ађКХ,вГЪ§,РраЭ,ЙуИцХХУћ,здШЛХХУћ,ASIN,БъЬт,ЮогУURL,МлИё,ЮогУзжЖЮ,ЦРЗж,ЦРМлзмЪ§,ЮогУзжЖЮ,аЁЭМСДНг,ЩЬЦЗЭМСДНг,ЮогУзжЖЮ,ЮогУзжЖЮ,згЬхЪ§СП
5,2,Organic,,51,B06WVB8P3B,"Luditek Sound Activated Party Lights with Remote DJ Lighting, Disco Ball Strobe Stage Light for Home Room Dance Parties Birthday Karaoke Stocking Stuffers New Years Eve Halloween Christmas Decorations",N/A,$9.99 ,,4.6,44884,FALSE,https://m.media-amazon.com/images/I/71G4t-Vi4cL._AC_UL320_.jpg,https://m.media-amazon.com/images/I/71G4t-Vi4cL._AC_SL1500_.jpg,,2026-04-14T18:24:46.074839,
6,2,Title,,,,Bulk Sunglasses for Kids Party FavorsSponsored|5K+ bought from this brand in past month|Shop RugortS,,,,,,FALSE,,,,2026-04-14T18:24:46.076845,
7,2,Title,,,,More results,,,,,,FALSE,,,,2026-04-14T18:24:46.076845,
8,2,Organic,,52,B0F1YMPVPN,Beach Party Decorations Kit - Beach Themed Honeycomb Centerpieces and Table Decor for Summer & Pool Party Decorations,N/A,$9.98 ,,4.7,1141,FALSE,https://m.media-amazon.com/images/I/81DHErA5m0L._AC_UL320_.jpg,https://m.media-amazon.com/images/I/81DHErA5m0L._AC_SL1500_.jpg,,2026-04-14T18:24:46.081519,
9,2,Organic,,53,B0B2RFGJL2,"Hawaiian Luau Party Decorations(161 Pcs), Tropical Summer Beach Pool Party Supplies Including Aloha Backdrop, Table Skirt, Tablecloth, Flamingo, Palm Leaves and Hibiscus, Balloons Arch, Straws,",N/A,$20.99 ,,4.6,577,FALSE,https://m.media-amazon.com/images/I/81tA7Fa0I8L._AC_UL320_.jpg,https://m.media-amazon.com/images/I/81tA7Fa0I8L._AC_SL1500_.jpg,,2026-04-14T18:24:46.084686,
10,2,Organic,,54,B0GGZ9QHZR,"9FT Summer Inflatable Beach Arch Ball, Giant Inflatable Arch Pool Party Decorations with 8 LED Lights Summer Inflatables Outdoor Decorations Beach Party Decorations for Sea Pool Beach Hawaiian",N/A,,,,,FALSE,https://m.media-amazon.com/images/I/71Y1bChqhaL._AC_UL320_.jpg,https://m.media-amazon.com/images/I/71Y1bChqhaL._AC_SL1500_.jpg,,2026-04-14T18:24:46.086690,
11,2,Organic,,55,B0GL2CG2LD,"118PCS Pool Party Decorations, Beach Party Favors Set with Water Sprayers Bubble Waters Garlands Paper Glasses Bracelets Stickers Keychains ЈC Summer Pool Party Supplies",N/A,$19.99 ,,,,FALSE,https://m.media-amazon.com/images/I/81jhqmCtRjL._AC_UL320_.jpg,https://m.media-amazon.com/images/I/81jhqmCtRjL._AC_SL1500_.jpg,,2026-04-14T18:24:46.091234,
12,2,Organic,,56,B0F21CQ8G1,"AIBIIN 194pcs Pool Birthday Party Decorations for Happy Birthday Party Plates, Cup, Napkin, Tablecloth, Tableware, Summer Pool Party Hawaii Holiday Party Supplies Plates Serve 24 Guests",N/A,$19.29 ,,4.8,12,FALSE,https://m.media-amazon.com/images/I/71XaqD-i7BL._AC_UL320_.jpg,https://m.media-amazon.com/images/I/71XaqD-i7BL._AC_SL1500_.jpg,,2026-04-14T18:24:46.094734,
13,2,Organic,,57,B0BWHFQKC5,"Katchon, Xtralarge Wavy Blue Foil Fringe Curtain - Pack of 2 | Blue Streamers for Under The Sea Party Decorations | Foil Fringe Backdrop for Birthday, Cruise Door Decorations, Pool Party Decorations",N/A,$12.99 ,,4.7,796,FALSE,https://m.media-amazon.com/images/I/915gfOmzz7L._AC_UL320_.jpg,https://m.media-amazon.com/images/I/915gfOmzz7L._AC_SL1500_.jpg,,2026-04-14T18:24:46.099309,
14,2,Title,,,,Moon Pool Lights - Solar PoweredShopTIALLYTIALLY Floating Pool Lights Solar Powered - 24" Ramadan In,,,,,,FALSE,,,,2026-04-14T18:24:46.099832,
15,2,Title,,,,More results,,,,,,FALSE,,,,2026-04-14T18:24:46.099832,
16,2,Organic,,58,B0C2HRKML4,"Zcaukya Inflatable Seashell Pool Float, Giant Clam Air-Filled Toys with Pearl Ball for Kids Birthday Party Swimming Pool Summer Beach Party Mermaid Ocean Theme Party Decor",N/A,$35.99 ,,4.6,314,FALSE,https://m.media-amazon.com/images/I/71RMEUGyOSL._AC_UL320_.jpg,https://m.media-amazon.com/images/I/71RMEUGyOSL._AC_SL1500_.jpg,,2026-04-14T18:24:46.108717,
17,2,Organic,,59,B0C9BQ6MWN,"2 Pack Fish Net Decorations for Party, Natural Cotton Hawaiian Party Fishing Net Decorative, Nautical Themed Cotton Fishnet Under The Sea Pirate Ocean BeachHalloween Decor",N/A,$9.99 ,,4.7,1095,FALSE,https://m.media-amazon.com/images/I/71z3Ekr-WZL._AC_UL320_.jpg,https://m.media-amazon.com/images/I/71z3Ekr-WZL._AC_SL1500_.jpg,,2026-04-14T18:24:46.113224,
18,2,Organic,,60,B07DLVSJ99,"FUTUREPLUSX 2 Pack Tropical Garland Party Decorations, 20ft Multicolored Tissue Paper Hibiscus Flower Summer Banner for Birthday Beach Theme Luau Hawaiian Party Supplies Jungle Decor",N/A,$8.09 ,,4.7,3376,FALSE,https://m.media-amazon.com/images/I/71q9+TnamlL._AC_UL320_.jpg,https://m.media-amazon.com/images/I/71q9+TnamlL._AC_SL1500_.jpg,,2026-04-14T18:24:46.117878,
19,2,Organic,,61,B0BW3DWXGL,"YUJUN 16 Pieces Big Diving Pool Toys, Beach Colorful Starfish Summer Swimming Underwater Pool Toys Soft Rubber Dive Throw for Kids Birthday Swimming Pool Party Favors Fish Tank Stuffer (2 Sizes)",N/A,$11.99 ,,4.7,570,FALSE,https://m.media-amazon.com/images/I/81uOKdyApQL._AC_UL320_.jpg,https://m.media-amazon.com/images/I/81uOKdyApQL._AC_SL1500_.jpg,,2026-04-14T18:24:46.122387,
20,2,Organic,,62,B0GMQQBGT6,"HAKOTI 4Pcs Pool Party Tablecloth,Summer Pool Birthday Party Supplies Summer Beach Plastic Tablecloth Hawaiian Table Cover for Hawaiian Swimming Birthday Holiday Decorations",N/A,$8.99 ,,,,FALSE,https://m.media-amazon.com/images/I/81IseACBAYL._AC_UL320_.jpg,https://m.media-amazon.com/images/I/81IseACBAYL._AC_SL1500_.jpg,,2026-04-14T18:24:46.126391,
21,2,Organic,,63,B0BRC8HPHB,Diving Gem Pool Toy 10PCS DISHIO Big Colorful Diamond Diving Toy with Treasure Box Chest Pirate Pool Toys for Kids Toddlers Underwater Sinking Dive Gemstone for Swimming Bath Birthday Party Decoration,N/A,$8.99 ,,4.5,697,FALSE,https://m.media-amazon.com/images/I/81FLUo5NOzL._AC_UL320_.jpg,https://m.media-amazon.com/images/I/81FLUo5NOzL._AC_SL1500_.jpg,,2026-04-14T18:24:46.129599,
22,2,Organic,,64,B0DT6V5QDN,"Summer Pool Beach Party Decorations, Splash Birthday Bash Party Supplies Tropical Summer Banner Beach Ball Lantern Fringe Curtain Foil Balloons Arch for Girls Swimming Luau Hawaiian Party Decor(Pink)",N/A,$18.99 ,,4.4,301,FALSE,https://m.media-amazon.com/images/I/81dxLorBn1L._AC_UL320_.jpg,https://m.media-amazon.com/images/I/81dxLorBn1L._AC_SL1500_.jpg,,2026-04-14T18:24:46.133884,
23,2,Organic,,65,B0FHDQNTWC,"Beach Birthday Party Decorations, 183Pcs Ocean Waves Birthday Party Decorations Summer Pool Hawaiian Beach Party Supplies Plates,Napkins,Cups,Banner,Tablecloth,Balloons,Cupcake Topper,Serves 24",N/A,$23.99 ,,4.7,34,FALSE,https://m.media-amazon.com/images/I/81R+TJv1VCL._AC_UL320_.jpg,https://m.media-amazon.com/images/I/81R+TJv1VCL._AC_SL1500_.jpg,,2026-04-14T18:24:46.137395,
24,2,Organic,,66,B07Q8JC9X4,"JOYIN Inflatable Pool Float Set Volleyball Net & Basketball Hoops, Floating Swimming Game Toy for Kids and Adults, Summer Floaties, Volleyball Court (105ЁБx28ЁБx38ЁБ)|Basketball (27.6ЁБx23ЁБ),L-Orange",N/A,$32.99 ,,4.2,9186,FALSE,https://m.media-amazon.com/images/I/81dxMvkv3UL._AC_UL320_.jpg,https://m.media-amazon.com/images/I/81dxMvkv3UL._AC_SL1500_.jpg,,2026-04-14T18:24:46.141903,
25,2,Organic,,67,B0FZLZN5CP,"xo, Fetti Pool Party Birthday Banner | Kids Party Decorations, Tropical Summer, Hawaiian Luau, Flamingo, Pink Glitter, Happy Birthday Garland",N/A,$10.99 ,,5,2,FALSE,https://m.media-amazon.com/images/I/61YeRAYAw9L._AC_UL320_.jpg,https://m.media-amazon.com/images/I/61YeRAYAw9L._AC_SL1500_.jpg,,2026-04-14T18:24:46.145505,
26,2,Organic,,68,B0C4DFTKP8,"Under the Sea Party Decorations 98Pcs, Ocean Theme Birthday Party Supplies Include Backdrop Tablecloth Bubble Garlands Cake Topper Ocean Animals Balloons for Pool Beach Party Baby Shower (Ocean-01)",N/A,$20.69 ,,4.7,538,FALSE,https://m.media-amazon.com/images/I/910e-bJJFyL._AC_UL320_.jpg,https://m.media-amazon.com/images/I/910e-bJJFyL._AC_SL1500_.jpg,,2026-04-14T18:24:46.149017,
27,2,Organic,,69,B0DVTBP3ZH,"xo, Fetti Pool Party Paper Plates, 3 Designs | 24 pcs 9"" | Kids Decorations, Summer Birthday Decor, Stripe Tablescape, Colorful Table Setting",N/A,$13.99 ,,4.6,8,FALSE,https://m.media-amazon.com/images/I/61ZUcHaHT8L._AC_UL320_.jpg,https://m.media-amazon.com/images/I/61ZUcHaHT8L._AC_SL1500_.jpg,,2026-04-14T18:24:46.153084,
28,2,Organic,,70,B0GKZ857XN,"140PCS Summer Pool Party Decorations Set Swimming Beach Ball Themed Birthday, Tropical Hawaii Holiday Tableware Supplies Includes Plates, Napkin, Fork, Cup, Serves 20",N/A,$17.99 ,,4.4,105,FALSE,https://m.media-amazon.com/images/I/815burhosnL._AC_UL320_.jpg,https://m.media-amazon.com/images/I/815burhosnL._AC_SL1500_.jpg,,2026-04-14T18:24:46.156593,
29,2,Organic,,71,B0DXFNDN63,"xo, Fetti Pool Party Napkins - 3-ply, 24 pcs | Summer Cocktail Napkins, Colorful Party Setting, Kids Birthday Decoration, Fun Tablescape",N/A,$12.99 ,,5,6,FALSE,https://m.media-amazon.com/images/I/61UHEDYOG8L._AC_UL320_.jpg,https://m.media-amazon.com/images/I/61UHEDYOG8L._AC_SL1500_.jpg,,2026-04-14T18:24:46.161730,
30,2,Organic,,72,B0D8HSCYCV,30 Pack Summer Themed Party Cupcake Toppers Neon Summer Party Decorations Picks for Hawaii Beach Pool Theme Wedding Baby Shower Birthday Party Supplies (Pool),N/A,$8.99 ,,4.7,53,FALSE,https://m.media-amazon.com/images/I/712umFpNj+L._AC_UL320_.jpg,https://m.media-amazon.com/images/I/712umFpNj+L._AC_SL1500_.jpg,,2026-04-14T18:24:46.165750,
31,2,Organic,,73,B0DP4H4M21,"28 Pack 12 Inch Rainbow Beach Balls Bulk, Inflatable Swimming Pool Toys Beach Ball for Kids Birthday Party Favors Outdoor Summer Games Hawaiian Tropical Luau Themed Pool Party Decorations",N/A,$15.29 ,,4.2,34,FALSE,https://m.media-amazon.com/images/I/71P91pSBUGL._AC_UL320_.jpg,https://m.media-amazon.com/images/I/71P91pSBUGL._AC_SL1500_.jpg,,2026-04-14T18:24:46.170768,
32,2,Organic,,74,B083B5YW71,"JOYIN 43"" Inflatable Cactus Cooler with Sombrero Hat for Fiesta, Cinco de Mayo Party Supplies, Inflatable Party Cooler, Pool Party Decoration",N/A,$16.99 ,,4.6,986,FALSE,https://m.media-amazon.com/images/I/71FlDC+by3L._AC_UL320_.jpg,https://m.media-amazon.com/images/I/71FlDC+by3L._AC_SL1500_.jpg,,2026-04-14T18:24:46.174771,
33,2,Organic,,75,B0GF7RQSJ6,168pcs Pool Party Supplies Pool Party Plates Napkins Dispoasble Tableware Set Summer Decorations for Kids Birthday Hawaii Summer Holiday Serve 24 Guests,N/A,$18.73 ,,4.8,13,FALSE,https://m.media-amazon.com/images/I/91X-2fdjREL._AC_UL320_.jpg,https://m.media-amazon.com/images/I/91X-2fdjREL._AC_SL1500_.jpg,,2026-04-14T18:24:46.179072,
34,2,Organic,,76,B0C7M6JWZM,"Pool Party Supplies,141pcs Pink Pool Birthday Tableware Decorations Pool Party Plates Cups Summer Theme Napkins Beach Ball Tablecloth for Hawaii Party Decoration",N/A,$18.99 ,,4.6,508,FALSE,https://m.media-amazon.com/images/I/81okreqsXqL._AC_UL320_.jpg,https://m.media-amazon.com/images/I/81okreqsXqL._AC_SL1500_.jpg,,2026-04-14T18:24:46.182591,
35,2,Organic,,77,B0CXDSHK5G,"Pool Party Birthday Decorations, Happy Birthday Pool Party Banner Backdrop Decorations, Summer Birthday Party Decorations Swimming Pool Party Decorations for Hawaiian Flamingo Party",N/A,$9.99 ,,4.6,32,FALSE,https://m.media-amazon.com/images/I/71Q+AxPf71L._AC_UL320_.jpg,https://m.media-amazon.com/images/I/71Q+AxPf71L._AC_SL1500_.jpg,,2026-04-14T18:24:46.186099,
36,2,Organic,,78,B0F5H25LKJ,"Solar Rechargeable Floating Pool Lights(2 Pack), Pool Lights That Float with Remote Control, 9 Lighting, Timing Mode, IPX7 Waterproof for Inground Pool, Bathroom, Bathtub, Pool Party",N/A,$19.98 ,,3.8,579,FALSE,https://m.media-amazon.com/images/I/814VL3iI5NL._AC_UL320_.jpg,https://m.media-amazon.com/images/I/814VL3iI5NL._AC_SL1500_.jpg,,2026-04-14T18:24:46.189100,
37,2,Organic,,79,B0DNK2ZYHB,"MoKo Inflatable Swimming Ring, Cute Pool Float Tube Decorations Swim Tubes Outdoor Pool Beach Water Floats Party Supplies Floaties",N/A,$10.99 ,,4.4,949,FALSE,https://m.media-amazon.com/images/I/81N8uBCnySL._AC_UL320_.jpg,https://m.media-amazon.com/images/I/81N8uBCnySL._AC_SL1500_.jpg,,2026-04-14T18:24:46.193638,
38,2,Organic,,80,B0BKTS39DL,"JOYIN 100 Pcs 8"" Glow sticks Bulk Party Favors Pack, Neon Glow in the Dark Party Supplies, Light Up Necklaces and Bracelets with Connectors, Easter, Football, Birthday Decorations",N/A,$7.59 ,,4.6,12268,FALSE,https://m.media-amazon.com/images/I/81WgRETcO0L._AC_UL320_.jpg,https://m.media-amazon.com/images/I/81WgRETcO0L._AC_SL1500_.jpg,,2026-04-14T18:24:46.196672,
39,2,Organic,,81,B0GBWPKG1Z,Reallnaive 2 Pack Summer Pool Party Table Skirt 30 x 108 Inch Summer Beach Pool Foil Fringe Tinsel Table Skirts with Cutouts Tablecloth Cover for Hawaiian Birthday Party Decorations Supplies,N/A,$15.99 ,,4.6,36,FALSE,https://m.media-amazon.com/images/I/81UNJIzGdXL._AC_UL320_.jpg,https://m.media-amazon.com/images/I/81UNJIzGdXL._AC_SL1500_.jpg,,2026-04-14T18:24:46.201524,
40,2,Organic,,82,B0GHRFP2TM,Sosation 1 Pcs Inflatable Flamingo Drink Cooler Pink Summer Flamingo Party Decoration Luau Blow up Drink Cooler Reusable Floating Ice Chest for Summer Hawaiian Tropical Beach Birthday Party Supplies,N/A,$27.99 ,,4.5,2,FALSE,https://m.media-amazon.com/images/I/71Y5yfJ7mIL._AC_UL320_.jpg,https://m.media-amazon.com/images/I/71Y5yfJ7mIL._AC_SL1500_.jpg,,2026-04-14T18:24:46.205088,
41,2,Organic,,83,B097F6TVLL,Transparent Bubble Garlands Mermaid Party Decoration Colored Flat Cutouts Hanging Streamer for Birthday Baptism Wedding Ocean Wall Decal Baby Shower Under Sea Festal Kid Room Photo Props (Color),N/A,$11.98 ,,4.5,1860,FALSE,https://m.media-amazon.com/images/I/61RgBCzk08S._AC_UL320_.jpg,https://m.media-amazon.com/images/I/61RgBCzk08S._AC_SL1500_.jpg,,2026-04-14T18:24:46.209146,
42,2,Organic,,84,B0C85LSKPV,"Summer Pool Birthday Party Decorations, Summer Themed Birthday Plates, Napkin, Cups Banner, Balloons and Cake Topper for Swimming Pool Party Decorations Supplies Set Serves 20",N/A,$17.99 ,,4.2,53,FALSE,https://m.media-amazon.com/images/I/8169SKkQ7IL._AC_UL320_.jpg,https://m.media-amazon.com/images/I/8169SKkQ7IL._AC_SL1500_.jpg,,2026-04-14T18:24:46.212866,
43,2,Organic,,85,B07L4N6KX5,Jasonwell Giant Inflatable Flamingo Pool Float with Fast Valves Summer Beach Swimming Pool Floatie Lounge Floating Raft Outdoor Party Decorations Toys for Adults (XL),N/A,$26.99 ,,4.2,3697,FALSE,https://m.media-amazon.com/images/I/51KA8AE4S8L._AC_UL320_.jpg,https://m.media-amazon.com/images/I/51KA8AE4S8L._AC_SL1500_.jpg,,2026-04-14T18:24:46.221895,
44,2,Organic,,86,B0FB8XT6J8,Neon Pool Party Birthday Banner Summer Birthday Party Decorations 3PCS Glitter Blue Hawaii Beach Pool Theme Banners for Hawaiian Luau Aloha Baby Shower Wedding Supplies,N/A,$9.99 ,,5,2,FALSE,https://m.media-amazon.com/images/I/81FlJEuNnHL._AC_UL320_.jpg,https://m.media-amazon.com/images/I/81FlJEuNnHL._AC_SL1500_.jpg,,2026-04-14T18:24:46.226035,
45,2,Organic,,87,B0DP6NRZGV,"72"" Inflatable Palm Tree Cooler, 200+ Drinks Super Large Capacity, Pool Party Decoration, Luau Party Decor, Beach Hawaiian Birthday Party Supplies Tropical Themed Summer Outdoor Drink Cooler",N/A,$22.49 ,,4.3,449,FALSE,https://m.media-amazon.com/images/I/71NsI-mdCGL._AC_UL320_.jpg,https://m.media-amazon.com/images/I/71NsI-mdCGL._AC_SL1500_.jpg,,2026-04-14T18:24:46.230491,
46,2,Organic,,88,B0DXDPRM7Z,11pcs Summer Pool Party Honeycomb Centerpieces Hello Summer Party Centerpieces for Table Pink Summer Theme Party Decorations for Girls Birthday Party Baby Shower Supplies,N/A,$11.99 ,,4.8,11,FALSE,https://m.media-amazon.com/images/I/815-TmnZCgL._AC_UL320_.jpg,https://m.media-amazon.com/images/I/815-TmnZCgL._AC_SL1500_.jpg,,2026-04-14T18:24:46.233513,
47,2,Organic,,89,B0BYZDTJS2,36pc Summer Cupcake Toppers - Pool Party Decorations - Water Themed Birthday Cake Picks for Swimming Baby Shower,N/A,$8.99 ,,4.7,64,FALSE,https://m.media-amazon.com/images/I/81RrTjR2J7L._AC_UL320_.jpg,https://m.media-amazon.com/images/I/81RrTjR2J7L._AC_SL1500_.jpg,,2026-04-14T18:24:46.238027,
48,2,Organic,,90,B0GFDDDL6R,Reallnaive 49 Pcs Pool Party Favors Jelly Basket Beach Towel Heart Sunglasses Bachelorette Pool Party Supplies for Women,N/A,$61.99 ,,4.2,5,FALSE,https://m.media-amazon.com/images/I/8133mfksBLL._AC_UL320_.jpg,https://m.media-amazon.com/images/I/8133mfksBLL._AC_SL1500_.jpg,,2026-04-14T18:24:46.243102,
49,2,Organic,,91,B09T2QKS13,"FLAMDYNO Pool Toys - 4/8 Pack Light Up Beach Balls for Kids w/ 8 Light Modes, Pool Beach Games Balls for Outdoor or Indoor Activities, Glow in The Dark Pool Beach Decorations for Kids and Adults",N/A,$25.19 ,,4.2,1081,FALSE,https://m.media-amazon.com/images/I/71yrSUa95NL._AC_UL320_.jpg,https://m.media-amazon.com/images/I/71yrSUa95NL._AC_SL1500_.jpg,,2026-04-14T18:24:46.245642,
50,2,Organic,,92,B0BKTQ9JLP,"JOYIN 120 Counts Hawaiian Leis Bulk, Colorful Tropical Flower Leis for Kids Adults Hawaiian Beach Luau Party Favors Decorations",N/A,$25.99 ,,4.6,10884,FALSE,https://m.media-amazon.com/images/I/911aTPl1DwL._AC_UL320_.jpg,https://m.media-amazon.com/images/I/911aTPl1DwL._AC_SL1500_.jpg,,2026-04-14T18:24:46.250150,
51,2,Organic,,93,B09WJB4JG1,Summer Pool Beach Hanging Swirls Banner Decor 30 Pack Foil Ceiling Hanging Swirls Streams Banner Decorations Garland for Kids Luau Hawaii Celebrating Events Birthday Party Supplies Room Wall Decor,N/A,$9.99 ,,4.6,287,FALSE,https://m.media-amazon.com/images/I/81pvLwg9GEL._AC_UL320_.jpg,https://m.media-amazon.com/images/I/81pvLwg9GEL._AC_SL1500_.jpg,,2026-04-14T18:24:46.253661,
52,2,Organic,,94,B0DT49JC6N,"24 Sets Pool Beach Birthday Party Decorations Cups with Summer Silly Straws Bulk, 16 OZ Pool Reusable Plastic Cups with Lids, Summer Party Favors Supplies for Kids",N/A,$26.99 ,,4.7,52,FALSE,https://m.media-amazon.com/images/I/81H8HxB27BL._AC_UL320_.jpg,https://m.media-amazon.com/images/I/81H8HxB27BL._AC_SL1500_.jpg,,2026-04-14T18:24:46.257774,
53,2,Organic,,95,B0BBPTLGV8,Yinder 24 Pieces Clear Inflatable Beach Ball Under The Sea Party Decorations Sponge Mermaid Party Bubble Summer Pool Floating Ball Ocean Theme Supplies,N/A,$19.99 ,,4.2,269,FALSE,https://m.media-amazon.com/images/I/71ncJQZ4jQL._AC_UL320_.jpg,https://m.media-amazon.com/images/I/71ncJQZ4jQL._AC_SL1500_.jpg,,2026-04-14T18:24:46.264380,
54,2,Organic,,96,B081JF35Z9,"FindUWill 6 Pack Pool Floats Kids, Pool Swim Tubes Rings(4 Pack) - 4Pcs Inflatable Big Floaties Beach Swimming Toys with 2Pcs Beach Balls for Adults Raft Floaties Toddlers",N/A,$19.99 ,,4.3,3051,FALSE,https://m.media-amazon.com/images/I/71c+qvQehmL._AC_UL320_.jpg,https://m.media-amazon.com/images/I/71c+qvQehmL._AC_SL1500_.jpg,,2026-04-14T18:24:46.268384,
56,2,Title,,,,"Debug info copied.SponsoredInflatable Pool Games Volleyball Net Pool Float Set with 19"" Beach Ball, ",,,,,,FALSE,,,,2026-04-14T18:24:46.268384,
57,2,Title,,,,Related searchespool party suppliespool party gamespool party decorations for adultspool party backd,,,,,,FALSE,,,,2026-04-14T18:24:46.269385,
58,2,Title,,,,Previous123...7Next,,,,,,FALSE,,,,2026-04-14T18:24:46.270615,
59,2,SB,3,,,N/A,https://aax-us-east-retail-direct.amazon.com/x/c/JPIwdXlCtKozP2mRV82cgbwAAAGdi4Wd7wEAAAH2AQBvbm9fdHhuX2JpZDcgICBvbm9fdHhuX2ltcDIgICA1osDf/clv1c_ek-wBIHXFcbWDn2nI4trJ16WnhIPnkbLeDuatxTyd84wyS6iQnjhjSoRxDXgZJVO_Yku8DZJs12X3hkvQj8Sn3-vFlp1WpndeyclfseEGsRVD-GrafXiUkGw0vl1tXcL1CCJJkTw8aUqoB8y2Lui4ZrXqh0clVjC8qi0x4cqjoMNfwPND83XqzF4zGjzIthQaAa9qYx4f0dIUOZmtkXYavy_NG23zIa8CLR_GjoQ-jqkUnf41KOHzM4xe51T3pcyp3Szk7aQ6vSj9Rv840-HUZ4afbLsGix3nG67VlaYz4mhAuxy7c1HM-Sa1-K1vF61yg32HuhfNniJMj_qvTbP8QIqhr65QIc_3yz2Clhs_Jh6VrsglQsX64Z9mDi8LgcujyXy3ILcBbbqXp1OfBSOfm4nLIoio9N5-k_p0fPtlgrEQvgCrQs--yjQyXp77igq75Vr7xJkpJgA0kQl0DH38G2kqAZJMAoHaulzJkitJmZaP80aronQ5b0pSakOkQxb_iUZe0f1Fg1MQsCASoZs6gnd2fnsqgZ_7PyJiX8M8HXtxS70jSIhRqDYQFXoYIxBEhLlZbBdIYs9AmKA8q9-FwtrGLw11kXSKEocBg7jaEtvsAbApeLmD1MWCJeusDUFnMYiVVhB8--9ES2Ae0O2ekyvW0SsUyaPNsQF1a7YvNzTLZrTLVQf9oUjQcgszQ-pIKohzbpAJp-SAxm_XvlrmnlAJtO88d2RhBArMzhmCYSlZTOFF458TXUonpNqrWYbdKN4PnVVlTaxywFF3efRePUWdQcXaAhzzNys35UAsHYnFdd66O2iWDhVpI7Q8AS2QknWfwxHQjqmzpL3aRORPbO7IDO1kBX_0-yBwggoYSkNtI4YLOCu8ir3xULolZHW2CNBwKQqpI1AxPXGL60PfJZaKY8p0r23agjTV-1MYgjBUA7vq8skBHXzM9ISX1KsOTrAXcS9Tn_FUd01IIc1_LhORsyKMRh58tYDO8VUdvHbIeCEoiwpIpfU26OMvvcP_UboFCe7cbIbYo4aRPLl-DZws90eIagN0WSQruOezivjXiKuMyv9BpC4g0Q3yVoXIZZOeVhigHIQeXy9t-MXaqFMGvAA_-LAP_bYBTixgcsNYXWNnM89zcSsXsjSS99OmtO8XxnNmLscvPO2EI8x-PFAGtk4yStFctMzWyXZQKvHVCGUsq9YAo2SxbwAGq70qyZRTS64SayeLEglNlAYfWZ9AK6WFs0-raDgP2hHx0hX4wLOrPpvqUh7Lv7duCrNBgXKjDb2gqT3DnMpLRC7PhdA-rlFhMe4EHRnqqO2WqofRW4w94VzvHYHIf0RD2bHzDhk8qC2CZGnRu5M7XML0vpbI9h-i4Q9pfkLT8pb_lSyLpUUa7w40H4vMTyLnCrltr4L_zCbiPpfUtd480ZdqnY_tKH37rAj9v10-ds2u1RuNSEfra4ql0IOd0rbr9VNbWPzveWSP5oJBxGql8skqWYM_TDrD-BWt9ZpMkk6K81Wj6ysTAuQ67cdbfVZSWfGM88b3a8L5kE69b4eLmQK8MD_uRDfEpwgMB0brqPScMBuWuYLsWYtYa4ar6gH_OINttKkFbgit1S6mAFI21xttUZQbVG_ZdMqbO6Q85kjGMEDwvIbmuk8hovDaJ6pcNMsDbIoI8C_QqYBq9RJKdko8Yh_Ia6L/https://www.amazon.com/stores/page/6956570F-DAF5-4795-AC42-1726A926FA0D/?_encoding=UTF8&store_ref=SB_A017845915CPB7KG2KJUE-A06766673SV040RNQ87P0&pd_rd_plhdr=t&aaxitk=593ed25cdae78151079140b4dafc652e&hsa_cr_id=0&lp_asins=B0DDH82BQW%2CB0CZ3LWF46%2CB0CKHGHL7Y&lp_query=pool%20party%20decorations&lp_slot=desktop-hsa-3psl&ref_=sbx_be_s_3psl_mbd_mb0_bkgd&pd_rd_w=l9SE4&content-id=amzn1.sym.cd7c548b-a599-426f-9ffe-daa1aa803c87%3Aamzn1.sym.cd7c548b-a599-426f-9ffe-daa1aa803c87&pf_rd_p=cd7c548b-a599-426f-9ffe-daa1aa803c87&pf_rd_r=WS9YJ0HKMMJKEX6QJEN8&pd_rd_wg=Tx6IH&pd_rd_r=e13305f8-3922-43fe-9c78-f45e39a7f86f,,,,,FALSE,,,N/A,2026-04-14T18:24:46.275639,
60,2,Title,,,,Need help?Visit the help sectionorcontact us,,,,,,FALSE,,,,2026-04-14T18:24:46.276639,
0,3,SB_Video,2,,,N/A,N/A,,,,,FALSE,,,,2026-04-14T18:25:00.204572,1
1,3,Title,,,,ResultsCheck each product page for other buying options. Price and other details may vary based on p,,,,,,FALSE,,,,2026-04-14T18:25:00.204572,
3,3,Organic,,97,B0G9LTXLML,"MEHOFOND 3 Pack Splish Splash Birthday Tablecloth, Disposable Plastic Tropical Table Cloth 54x108 inch, Summer Pool Birthday Table Cover for Girl Splash Water Paddling Pool Party Supplies",N/A,$9.49 ,,5,1,FALSE,https://m.media-amazon.com/images/I/71rXl4frX1L._AC_UL320_.jpg,https://m.media-amazon.com/images/I/71rXl4frX1L._AC_SL1500_.jpg,,2026-04-14T18:25:00.210538,
4,3,Organic,,98,B0C93J6WT3,Pool Party Happy Birthday Banner Decorations Summer Pool Garland Decorations for Summer Beach Hawaii Luau Birthday Party Supplies Wall Backdrop Decor,N/A,$7.19 ,,4.7,25,FALSE,https://m.media-amazon.com/images/I/81V9CrxrWuL._AC_UL320_.jpg,https://m.media-amazon.com/images/I/81V9CrxrWuL._AC_SL1500_.jpg,,2026-04-14T18:25:00.214542,
5,3,Organic,,99,B0CRGQMFYB,"AILEHO Kids Sunglasses Bulk Party Favors - 24 Packs Boys Girls Sunglasses for Kids Age 3-8 with UV 400 Protection, Neon Sunglasses for Kids Party",N/A,$19.97 ,,4.8,1112,FALSE,https://m.media-amazon.com/images/I/812gCrg-OsL._AC_UL320_.jpg,https://m.media-amazon.com/images/I/812gCrg-OsL._AC_SL1500_.jpg,,2026-04-14T18:25:00.219079,
6,3,Title,,,,Moon Pool Lights - Solar PoweredShopTIALLYTIALLY Floating Pool Lights Solar Powered - 24" Ramadan In,,,,,,FALSE,,,,2026-04-14T18:25:00.219079,
7,3,Title,,,,More results,,,,,,FALSE,,,,2026-04-14T18:25:00.219079,
8,3,Organic,,100,B0CQ4347VY,"tineit 98 Pcs Summer Tableware, Pool Party Decorations Include Tablecloth, Plastic Summer Fork, Plates and Napkins, Pool Party Supplies",N/A,$20.99 ,,4.6,32,FALSE,https://m.media-amazon.com/images/I/81OP1biGeTL._AC_UL320_.jpg,https://m.media-amazon.com/images/I/81OP1biGeTL._AC_SL1500_.jpg,,2026-04-14T18:25:00.222840,
9,3,Organic,,101,B0FMWJP2Q8,"Inflatable Shark Birthday Party Decorations & Pool Toys - 4 Pack (2 Grey, 2 Blue) Large 23-Inch Blow-Up Shark Float Party Supplies for Kids or Adults Birthday, Beach, Summer Games & Party Favor Gifts",N/A,$14.99 ,,4.4,30,FALSE,https://m.media-amazon.com/images/I/71MM-Ut7bkL._AC_UL320_.jpg,https://m.media-amazon.com/images/I/71MM-Ut7bkL._AC_SL1500_.jpg,,2026-04-14T18:25:00.229198,
10,3,Organic,,102,B0F8GR9GTG,"Party Favors Kids Sunglasses Bulk - 16 Packs Neon Sunglasses for Kid Age 3-8, UV400 Protection Party Sunglasses Goodie Bags Stuffers for kids Birthday Party Supply, End of the Year Gifts For Students",N/A,$14.52 ,,4.7,111,FALSE,https://m.media-amazon.com/images/I/81JrfNkiUwL._AC_UL320_.jpg,https://m.media-amazon.com/images/I/81JrfNkiUwL._AC_SL1500_.jpg,,2026-04-14T18:25:00.232717,
11,3,Organic,,103,B0FF98HP9J,"Pool Party Splish Splash Banner, Summer Pool Splish Splash Theme Outdoor Hanging Yard Sign Decor, Splish Splash Party Baby Shower Holiday Supplies (Splish Splash)",N/A,$12.99 ,,4.6,72,FALSE,https://m.media-amazon.com/images/I/61Yw9S4lOuL._AC_UL320_.jpg,https://m.media-amazon.com/images/I/61Yw9S4lOuL._AC_SL1500_.jpg,,2026-04-14T18:25:00.237223,
12,3,Organic,,104,B0GN2YJ3R8,12 Pack Inflatable Pool Floats Set Include Swim Rings and Inflatable Beach Balls for Summer Party,N/A,$32.99 ,,,,FALSE,https://m.media-amazon.com/images/I/911qw6oMxdL._AC_UL320_.jpg,https://m.media-amazon.com/images/I/911qw6oMxdL._AC_SL1500_.jpg,,2026-04-14T18:25:00.239942,
13,3,Organic,,105,B07S21149G,"JOYIN Toy 60 Counts Hawaiian Leis Bulk, Tropical Flower Lei Hawaiian Lei Beach Hawaii Luau Party Favors Decoration Birthday Party Supplies",N/A,$17.99 ,,4.6,10884,FALSE,https://m.media-amazon.com/images/I/911aTPl1DwL._AC_UL320_.jpg,https://m.media-amazon.com/images/I/911aTPl1DwL._AC_SL1500_.jpg,,2026-04-14T18:25:00.244587,
14,3,Title,,,,Kids Sunglasses Bulk Party FavorsSponsored|5K+ bought from this brand in past month|Shop RugortShop ,,,,,,FALSE,,,,2026-04-14T18:25:00.245592,
15,3,Title,,,,More results,,,,,,FALSE,,,,2026-04-14T18:25:00.245592,
16,3,Organic,,106,B0FB8X1KDY,Beach Pool Banner Neon Summer Theme Party Decorations 3PCS Glow Pool Party Cutout Banners for Hawaiian Luau Summer Birthday Baby Shower Supplies,N/A,$7.99 ,,4.7,3,FALSE,https://m.media-amazon.com/images/I/71P3Ln1iuSL._AC_UL320_.jpg,https://m.media-amazon.com/images/I/71P3Ln1iuSL._AC_SL1500_.jpg,,2026-04-14T18:25:00.250226,
