ађКХ,вГЪ§,РраЭ,ЙуИцХХУћ,здШЛХХУћ,ASIN,БъЬт,ЮогУURL,МлИё,ЮогУзжЖЮ,ЦРЗж,ЦРМлзмЪ§,ЮогУзжЖЮ,аЁЭМСДНг,ЩЬЦЗЭМСДНг,ЮогУзжЖЮ,ЮогУзжЖЮ,згЬхЪ§СП
data_index,page,ad_type,ad_rank,organic_rank,asin,title,url,price_current,price_list,rating_stars,rating_count,is_prime,image_small,image_large,brand_name,scraped_at,inner_products_count
0,1,SB,1,,,Colorful Rainbow Beach Balls,https://aax-us-east-retail-direct.amazon.com/x/c/JC2TXI5YGc9Ln_N15qfJ7HsAAAGdi4VYMQEAAAH2AQBvbm9fdHhuX2JpZDIgICBvbm9fdHhuX2ltcDEgICDH5HP7/clv1c_ek-wBHHWYsTaBrf7A0nA2juvmyoJre-ef2ZUBUwxMOm1rNoWPIqFLE83qVd5wEA06TosDI_QIZophKg2eQxkkKVgHD6-s_8La8Ox-bT2v2AMU9lYyQLoBCC4Irr25OBi7qJRdRlnuc7lhvN3_HV2j_BbotPMVl_SGpRxjjG24Da-mccmq85RDBxQhFTPPTcZ3EKLwA_jV-cblOfrmwvUl2P_GVsmnn6msQXucLubcr0DiVFknCn55ZkRln9fWVjyeBw6ZldUuMlNCPdvjGfkauuoj9kAjdSEe9iuSPkk_ca9jERI2W3tCTSBpqtP_b_Iml0z1ywQiQmvY3NYzk20L8R01VIJB2fUruvLNoiDFrZRF_wyZqzX7SGTQB2tbKNwnDN1rjgYQU7mQyv3K4uPg1iLly2rFXCGRkIAH-Hkexva_y0XhmH0MoIW7fJsuHnR4Dz6bmSenZpbVCSaElbwRKjLRq77h2m1hxRgghzpsrE1f-YCggUQJt9yyz3KNv5zgbfim9cPWANXI2OmF6Wtkmdx_MVCHV-6iMGHts3bKz8Woztt7T8Rep4LITemONa9T2Ev1wTZ3b9dZHsPXpBXO4IoDnHMRf7IT2b_FozN4MHm_sJ1vpsbQbw-8ewm58BMIIufUfANOMardS5A0f5dmvhNrB_KNrBG9NgHGYmL6Doq-P7iLIPsY8tfX5eYEhNjiXwFQPMaXGvIN6bdOFYuhjPz19j_afTrUem5Y2Zh3ZJreWvD_baRMJEeW_RGiDn5VwXPFf-Q7iMMP8z5sVRv38gbmSWOU7taSb3yFCDAQ4Pw_zNEPSjA65Rj2Z6Ngh-nRYKWBfRv5ZSlin4SZlsu-JpE5s081tw0Md6Zrru6iGbriDUJOZdes0AKXbu-vdmBxYMeL6EgFLxGrHkYKmgR8wezZeAVuqtmk_Y6xVONujSpT5eItMWm2oeXtnNTASIYU1zpy-mwXc9D8uFYUEufKJUuzQXi45Bi40LILTkaqfWrsCok-hlqgP2syU0-kVf4TFt8gUpVqmXbcs4npAFPnU1jXIgnGco5uh2xjnzxZevqbihLNb4D2wG4_cdtWVgGWvzB9d7pSxSTIUj_gN0h4qKh1Dllh77RPxWvW6mE7bXcMn-NzvTL44QJA1bmhVNF_7fJQoUn8d7UrCsj94qOsCzQDFubIQFDBX2j8JkSgE60QAEdzgebNdDiT0uvP1O21D6gx9FtXsKDfRHlxyErTlG9HlBobo5ywLBfGchrM6Oh0yoqBFK7Ppm4jD9n-guhPQzD6kkYIaLR46KhQYlBqjOo2r3P5F3-p_w0K97tdzk6ozD5XpeFa-YaUzmsaU5boXwc27ngafa2eEVoB2KDXxyBzh4O850_oifLFbr4TIoeRSYpOj8PX14NNDchE73sfv3RKmTx6zwoLVck5ymstsCCCfVqqK237sv41qG_0jcVsSCdz0y1Z1ENm1dUrZevzocQAm_tgRALAOIyBGTAyQ9VbgDQCcDYq2PgYPsbGzbT_0CwDGL9rycWHB_oO7Fh-0dVcS_T1MSLOF-eL1uZga__zRpl3Fy-h1kcF-uSLgTYhH8VbFRaxxz8H3tY-YlqI1K1OZ3yPNj4EM84tlHWL5wQbZKWSx9-aps1LIFYFJrXw2S_Bb2-B8zdbOhy2yQYsc-UjQ7r9YyXRmYk4XHANpI3UiU2Hm12xQ/https://www.amazon.com/stores/page/6A529998-3E96-4BBD-BB73-E06A4301338D/?_encoding=UTF8&store_ref=SB_A0829677URZWUORHME4J-A07459312VL5H8ME5BLCV&pd_rd_plhdr=t&aaxitk=79abc419f289afaae959d05e3a0c20bf&hsa_cr_id=0&lp_asins=B0BKTLGZN1%2CB07NWR7HKD%2CB07NZPQ5G6&lp_query=pool%20party%20decorations&lp_slot=auto-sparkle-hsa-tetris&ref_=sbx_s_sparkle_sbtcd_bkgd&pd_rd_w=bcJ8q&content-id=amzn1.sym.2fb72bc8-96ef-420d-b08f-c04b69f36507%3Aamzn1.sym.2fb72bc8-96ef-420d-b08f-c04b69f36507&pf_rd_p=2fb72bc8-96ef-420d-b08f-c04b69f36507&pf_rd_r=9G675QG8HYECAF94AMTH&pd_rd_wg=J6S9B&pd_rd_r=80b4feea-b88d-471f-9393-ec3f28b2c95d,,,,,FALSE,"https://m.media-amazon.com/images/S/al-na-9d5791cf-3faf/acc8c1a0-a88e-4e2a-8344-da2cbf5ce25e._CR0,0,1613,602_AC_SX130_SY60_CB1169409_QL70_.png",,Colorful Rainbow Beach Balls,2026-04-14T18:24:28.220671,3
1,1,Title,,,,ResultsCheck each product page for other buying options. Price and other details may vary based on p,,,,,,FALSE,,,,2026-04-14T18:24:28.221669,
3,1,Organic,,1,B0DT6X8QP2,"Summer Pool Beach Party Decorations, Splash Birthday Bash Party Supplies Tropical Summer Banner Beach Ball Lantern Fringe Curtain Foil Balloons Arch for Swimming Water Luau Hawaiian Party Decor(Blue)",N/A,$18.99 ,,4.4,301,FALSE,https://m.media-amazon.com/images/I/81BUSERqr5L._AC_UL320_.jpg,https://m.media-amazon.com/images/I/81BUSERqr5L._AC_SL1500_.jpg,,2026-04-14T18:24:28.226790,
4,1,Organic,,2,B0CR6SG9NZ,Arrowom 24pcs Hawaiian Leis Bulk Luau Party Silk Flower Necklace Colorful Tropical Hawaiian Bulk Hula Dance Party Decor Flower Leis Summer Beach Pool Party Decorations Favors Supplies,N/A,$9.49 ,,4.5,2697,FALSE,https://m.media-amazon.com/images/I/91Dw3St+MFL._AC_UL320_.jpg,https://m.media-amazon.com/images/I/91Dw3St+MFL._AC_SL1500_.jpg,,2026-04-14T18:24:28.232883,
5,1,Organic,,3,B0G7V1SY9X,"Ouddy Life 169pcs Tropical Balloon Arch Garland Kit, Luau Hawaiian Hot Light Pink Lime Green Orange Blue Gold Flamingo Balloons with Palm Leaves for Aloha Summer Beach Pool Birthday Party Decorations",N/A,$12.99 ,,4.6,323,FALSE,https://m.media-amazon.com/images/I/91tLumMdYAL._AC_UL320_.jpg,https://m.media-amazon.com/images/I/91tLumMdYAL._AC_SL1500_.jpg,,2026-04-14T18:24:28.236197,
7,1,Title,,,,"Debug info copied.SponsoredAmerican Flag Inflatable Cooler, Pool Party Decorations 130+ Cans Large D",,,,,,FALSE,,,,2026-04-14T18:24:28.237197,
8,1,Title,,,,Colorful Rainbow Beach BallsSponsored|Top 10 best-selling brand in this category|Shop JOYINShop nowP,,,,,,FALSE,,,,2026-04-14T18:24:28.238736,
9,1,Title,,,,More results,,,,,,FALSE,,,,2026-04-14T18:24:28.238736,
10,1,Organic,,4,B0GMPXPMZ5,"Pool Birthday Party Supplies,Summer Beach Party Decorations Paper Plates,Napkins,Balloon,Banner,Cupcake Topper for Summer Hawaiian Beach Pool Birthday Supplies Serves 24",N/A,$20.99 ,,5,2,FALSE,https://m.media-amazon.com/images/I/91NC+3f2OpL._AC_UL320_.jpg,https://m.media-amazon.com/images/I/91NC+3f2OpL._AC_SL1500_.jpg,,2026-04-14T18:24:28.244390,
11,1,Organic,,5,B0CYH6K5PW,"Summer Banner Pool Party Decorations, Pool Party Decorations Banner Backdrop Summer Party Decorations, Hanging Beach Themed Summer Party Decorations with Rope (72 * 44 Inches)",N/A,$8.99 ,,4.6,100,FALSE,https://m.media-amazon.com/images/I/81d1A48zuIL._AC_UL320_.jpg,https://m.media-amazon.com/images/I/81d1A48zuIL._AC_SL1500_.jpg,,2026-04-14T18:24:28.250445,
12,1,Organic,,6,B0CV33D9F1,"3 Pcs Iridescent Waves Tablecloths - Disposable Plastic Ocean Blue Table Cloth Rectangle Table Covers for Under the Sea Beach Surf Pool Party Birthday Party Decorations, 54 x 108 Inch",N/A,$8.00 ,,4.5,668,FALSE,https://m.media-amazon.com/images/I/81jVudN5HQL._AC_UL320_.jpg,https://m.media-amazon.com/images/I/81jVudN5HQL._AC_SL1500_.jpg,,2026-04-14T18:24:28.257626,
13,1,Organic,,7,B0GKSD39QN,"26.5"" Solar Powered RGB Pool Lights - 16 Colors LED Animal Shaped Light, IP68 Waterproof Floating Light for Pool Party Decorations, Backyard Spa Ambiance (1 Pack)",N/A,$29.99 ,,4.4,7,FALSE,https://m.media-amazon.com/images/I/71aB+qjgxqL._AC_UL320_.jpg,https://m.media-amazon.com/images/I/71aB+qjgxqL._AC_SL1500_.jpg,,2026-04-14T18:24:28.263295,
14,1,Organic,,8,B073RBVTXT,"ALINK 50 Umbrella Parasol Drinking Straws, Hawaiian Beach Cocktail Luau Party Decorations Supplies",N/A,$6.99 ,,4.6,10350,FALSE,https://m.media-amazon.com/images/I/81YbWfWBaPL._AC_UL320_.jpg,https://m.media-amazon.com/images/I/81YbWfWBaPL._AC_SL1500_.jpg,,2026-04-14T18:24:28.267860,
15,1,Organic,,9,B09TSY3Y24,Yexiya 12 Pieces Beach Honeycomb Centerpieces Pool Cake Balls Table Toppers Beach Pool Party Supplies Decorations for Birthday,N/A,$7.64 ,,4.3,246,FALSE,https://m.media-amazon.com/images/I/81uawshAiQL._AC_UL320_.jpg,https://m.media-amazon.com/images/I/81uawshAiQL._AC_SL1500_.jpg,,2026-04-14T18:24:28.271324,
16,1,Organic,,10,B09Z28TMY4,Vinsot 32 Pack Beach Pool Party Eyeglasses Decor Summer Luau Paper Glasses Bulk Hawaiian Sunglasses Frame Tropical Pool Props Photo Booth Props for Summer Beach Luau Party Favor Birthday Supply Decor,N/A,$12.99 ,,4.1,645,FALSE,https://m.media-amazon.com/images/I/81bbJ2wNgCL._AC_UL320_.jpg,https://m.media-amazon.com/images/I/81bbJ2wNgCL._AC_SL1500_.jpg,,2026-04-14T18:24:28.274857,
17,1,Organic,,11,B0G2BLV35J,Inflatable Palm Tree Beach Balls Flamingo Banana Parrot Dolphin Cactus Ring Toss Sets for Tropical Hawaiian Beach Luau Summer Pool Party Decorations,N/A,$25.99 ,,4.3,5,FALSE,https://m.media-amazon.com/images/I/71TYc-OHRGL._AC_UL320_.jpg,https://m.media-amazon.com/images/I/71TYc-OHRGL._AC_SL1500_.jpg,,2026-04-14T18:24:28.279492,
18,1,Organic,,12,B0BWR9FQYX,2 Pack Blue Streamers Party Decorations Fringe Backdrop Ocean Themed Decorations Foil Curtain Backdrop Blue Birthday Ocean Party Decor Supplies,N/A,$5.97 ,,4.4,10536,FALSE,https://m.media-amazon.com/images/I/914rDCqCJuL._AC_UL320_.jpg,https://m.media-amazon.com/images/I/914rDCqCJuL._AC_SL1500_.jpg,,2026-04-14T18:24:28.284508,
19,1,Organic,,13,B0D89XQ37N,"Swimming Pool Party Banner for Summer Party Decorations, Summer Themed Hawaiian Outdoor Party Decorations, Baby Shower Birthday Swimming Pool Party Supplies(Pool Party Blue)",N/A,$12.99 ,,4.6,72,FALSE,https://m.media-amazon.com/images/I/61vc5ADfwJL._AC_UL320_.jpg,https://m.media-amazon.com/images/I/61vc5ADfwJL._AC_SL1500_.jpg,,2026-04-14T18:24:28.289591,
20,1,Organic,,14,B071JR7GYP,"JOYIN 60"" Inflatable Palm Tree Cooler, Beach Theme Decor, Pool Party Decorations, Luau Hawaiian Birthday Party Supplies, Ocean Jungle Tropical Themed Summer Outdoor Drink Cooler",N/A,$19.99 ,,4.3,5370,FALSE,https://m.media-amazon.com/images/I/815M9fW4pfL._AC_UL320_.jpg,https://m.media-amazon.com/images/I/815M9fW4pfL._AC_SL1500_.jpg,,2026-04-14T18:24:28.294159,
21,1,Title,,,,More results,,,,,,FALSE,,,,2026-04-14T18:24:28.294688,
22,1,Organic,,15,B0DYY9GJ3S,"134Pcs Tropical Summer Beach Pool Party Balloon Garland Arch Kit,with Inflatable Beach Balls,Watermelon,Sun Foil Balloons for Hawaiian Luau Birthday Graduation Party Decorations - Hot Pink Yellow Blue",N/A,$15.49 ,,4.4,36,FALSE,https://m.media-amazon.com/images/I/81+iUruI7AL._AC_UL320_.jpg,https://m.media-amazon.com/images/I/81+iUruI7AL._AC_SL1500_.jpg,,2026-04-14T18:24:28.299993,
23,1,Organic,,16,B0DXFQD2N7,"xo, Fetti Pool Party Temporary Tattoos - 68 Iridescent Foil Pcs | Summer Birthday Accessory, Kids Waterpark Party Favor, Cute Beach Activity",N/A,$7.99 ,,4.6,33,FALSE,https://m.media-amazon.com/images/I/71mlSyRYaxL._AC_UL320_.jpg,https://m.media-amazon.com/images/I/71mlSyRYaxL._AC_SL1500_.jpg,,2026-04-14T18:24:28.304237,
24,1,Organic,,17,B08V51SGPG,"JOYIN 18 Pack 16.5'' Water Gun, Blaster Squirt Guns, Bulk Water Guns Summer Outdoor Swimming Pool, Backyard, Beach Water Game Fighting Play Pool Toys",N/A,$26.99 ,,4.5,1152,FALSE,https://m.media-amazon.com/images/I/81gALjEBpfL._AC_UL320_.jpg,https://m.media-amazon.com/images/I/81gALjEBpfL._AC_SL1500_.jpg,,2026-04-14T18:24:28.309225,
25,1,Organic,,18,B01F6LRW30,"Joyin Toy 36 Counts Hawaiian Leis Bulk, Tropical Flower Lei Hawaiian Lei Beach Hawaii Luau Party Favors Decoration Birthday Party Supplies(3 Dozen)",N/A,$9.99 ,,4.6,10884,FALSE,https://m.media-amazon.com/images/I/911aTPl1DwL._AC_UL320_.jpg,https://m.media-amazon.com/images/I/911aTPl1DwL._AC_SL1500_.jpg,,2026-04-14T18:24:28.314080,
26,1,Organic,,19,B0CLP5W5VQ,Ziliny 36 Pcs Summer Pool Beach Party Supplies 5 lb Beach Ball Large Paper Serving Snack Trays for Summer Hawaii Tropical Party Swimming Pool Favors,N/A,$17.99 ,,4.5,36,FALSE,https://m.media-amazon.com/images/I/818v8g+7+0L._AC_UL320_.jpg,https://m.media-amazon.com/images/I/818v8g+7+0L._AC_SL1500_.jpg,,2026-04-14T18:24:28.318408,
27,1,Organic,,20,B06XGNL1RX,"Ring Pop Lollipops - Bulk Candy Individually Wrapped Suckers Variety Party Pack- 20 Count w/Assorted Flavors - Hard Candy for Party Favors, Kids & Goodie Bags",N/A,$8.48 ,,4.8,87074,FALSE,https://m.media-amazon.com/images/I/81caeWEBoFL._AC_UL320_.jpg,https://m.media-amazon.com/images/I/81caeWEBoFL._AC_SL1500_.jpg,,2026-04-14T18:24:28.325900,
28,1,Organic,,21,B0G8J1PT7S,"MEHOFOND Splish Splash Birthday Party Supplies Tableware Set 193 Pcs, Summer Pool Party Disposable Plates Cups Napkins Cutlery with Plastic Tablecloth for Girls Tropical Birthday Party",N/A,$20.99 ,,5,2,FALSE,https://m.media-amazon.com/images/I/81cXU3ZUn9L._AC_UL320_.jpg,https://m.media-amazon.com/images/I/81cXU3ZUn9L._AC_SL1500_.jpg,,2026-04-14T18:24:28.330112,
29,1,Organic,,22,B07NWR7HKD,"JOYIN 12-Pack 12ЁА Beach Balls - Bulk Classic Beachball Inflatable Swimming Pool Toys for Games Adults Kids Birthday Party Supplies Combo Set, Rainbow Color Blow Up Luau Decorations Favors Gifts (12"")",N/A,$9.99 ,,4.5,3352,FALSE,https://m.media-amazon.com/images/I/814LDy0nOPL._AC_UL320_.jpg,https://m.media-amazon.com/images/I/814LDy0nOPL._AC_SL1500_.jpg,,2026-04-14T18:24:28.335235,
30,1,Organic,,23,B0BRZXJFHM,"12Pcs Reusable Water Balloons, Pool Beach water Toys for Boys and Girls, Outdoor Summer Toys for Kids Ages 3-12",N/A,$27.99 ,,4.7,3036,FALSE,https://m.media-amazon.com/images/I/71deILln+wL._AC_UL320_.jpg,https://m.media-amazon.com/images/I/71deILln+wL._AC_SL1500_.jpg,,2026-04-14T18:24:28.339711,
31,1,Title,,,,More results,,,,,,FALSE,,,,2026-04-14T18:24:28.339711,
32,1,Organic,,24,B0964DB59D,"JOYIN Set of 6 Small Pink Flamingo Yard Ornament Stakes, 17"" Plastic Flamingo Lawn Statues with Metal Legs for Sidewalks, Outdoor Garden Decor, Luau & Pool Party Decorations, 2 Styles",N/A,$15.99 ,,4.1,3739,FALSE,https://m.media-amazon.com/images/I/713gAJWZu5L._AC_UL320_.jpg,https://m.media-amazon.com/images/I/713gAJWZu5L._AC_SL1500_.jpg,,2026-04-14T18:24:28.343269,
33,1,Organic,,25,B0721468V1,"JOYIN Inflatable Swim Tube Raft (3 pack) with Summer Fruits Painting, Pool Toys for Swimming Pool Party Decorations",N/A,$16.98 ,,4.6,8361,FALSE,https://m.media-amazon.com/images/I/71cpqrIteIL._AC_UL320_.jpg,https://m.media-amazon.com/images/I/71cpqrIteIL._AC_SL1500_.jpg,,2026-04-14T18:24:28.347851,
34,1,Organic,,26,B0DTJ6WHHH,"Tiki Torch Bubbler - Summer Pool Party Bubble Machine with Lights and Music, Bubble Blower and Wand, Rechargeable Outdoor Toy for Kids Teens Birthday Party, 4 Feet Tall, Includes 4oz Bubble Solution",N/A,$14.73 ,,3.9,893,FALSE,https://m.media-amazon.com/images/I/714oV45JnkL._AC_UL320_.jpg,https://m.media-amazon.com/images/I/714oV45JnkL._AC_SL1500_.jpg,,2026-04-14T18:24:28.350996,
35,1,Organic,,27,B07NX2V91X,"JOYIN 2-Pack Flamingo Unicorn Pool Float - Fun Floaties Inflatable Swimming Pool Tubes Toys Party Decorations, Summer Vacation Lake Beach Floaty Swim Rings Raft Lounger for Adults & Kids",N/A,$24.99 ,,4.4,3222,FALSE,https://m.media-amazon.com/images/I/81U1c+sU5FL._AC_UL320_.jpg,https://m.media-amazon.com/images/I/81U1c+sU5FL._AC_SL1500_.jpg,,2026-04-14T18:24:28.356254,
36,1,Organic,,28,B0F2HT5477,"117Pcs Summer Pool Themed Happy Birthday Party Decorations, Plates Napkins Cups Tableware, Swim Pool Tube Glass Backdrop Tablecloth, Happy Birthday Banner, Colorful Printed Ballons for Kids Adults",N/A,$22.99 ,,4.4,25,FALSE,https://m.media-amazon.com/images/I/91Fbm1GlhwL._AC_UL320_.jpg,https://m.media-amazon.com/images/I/91Fbm1GlhwL._AC_SL1500_.jpg,,2026-04-14T18:24:28.361277,
37,1,Organic,,29,B00N1QPNMA,"PartySticks Glow Sticks Party Supplies 100pk - 8 Inch Glow in the Dark Light Up Sticks Party Favors, Glow Party Decorations, Neon Party Glow Necklaces and Glow Bracelets with Connectors",N/A,$7.99 ,,4.6,28643,FALSE,https://m.media-amazon.com/images/I/81JYNlch58L._AC_UL320_.jpg,https://m.media-amazon.com/images/I/81JYNlch58L._AC_SL1500_.jpg,,2026-04-14T18:24:28.366369,
38,1,Organic,,30,B0DC51MRZ4,"Freyalife Hawaiian Leis Decorations(24pcs),Leis for Luau Party Decor Flower,Tropical Hawaiian Bulk Hula Dance Party Decor",N/A,$6.99 ,,4.3,619,FALSE,https://m.media-amazon.com/images/I/816+lI1lMEL._AC_UL320_.jpg,https://m.media-amazon.com/images/I/816+lI1lMEL._AC_SL1500_.jpg,,2026-04-14T18:24:28.371880,
39,1,Organic,,31,B0DTJFLHHD,"Pool Party Favors and Beach Party Favors,158PCS Summer Pool Toys for Kids, Undersea theme decoration, Including Beach Balls, Sunglasses, Bubble Wands, Stamp and Crystal Shells for Kids Ages 4-8 8-12",N/A,$25.00 ,,4.6,198,FALSE,https://m.media-amazon.com/images/I/81TrxJeWztL._AC_UL320_.jpg,https://m.media-amazon.com/images/I/81TrxJeWztL._AC_SL1500_.jpg,,2026-04-14T18:24:28.375359,
40,1,Organic,,32,B0F1T15N7N,120PCS Summer Pool Party Supplies Swimming Beach Ball Themed Birthday Party Decorations Tropical Hawaii Holiday Tableware Set Plates Napkins Cups Set for 20 Guests,N/A,$17.99 ,,4.5,153,FALSE,https://m.media-amazon.com/images/I/910esUO6IgL._AC_UL320_.jpg,https://m.media-amazon.com/images/I/910esUO6IgL._AC_SL1500_.jpg,,2026-04-14T18:24:28.378867,
41,1,Organic,,33,B0796JVBJ8,"Max Liquidator 6-Pack Water Blaster Set, Multicolor",N/A,$15.44 ,,4.7,10426,FALSE,https://m.media-amazon.com/images/I/71STcje+p-L._AC_UL320_.jpg,https://m.media-amazon.com/images/I/71STcje+p-L._AC_SL1500_.jpg,,2026-04-14T18:24:28.384001,
42,1,Organic,,34,B0CTQL4WBT,JellyArch 4 Pcs Inflatable Surf Board Inflatable Luau Party Decorations Blow up Surfboard,N/A,$28.99 ,,4.1,113,FALSE,https://m.media-amazon.com/images/I/71XtcaMqViL._AC_UL320_.jpg,https://m.media-amazon.com/images/I/71XtcaMqViL._AC_SL1500_.jpg,,2026-04-14T18:24:28.388386,
43,1,Organic,,35,B0D25SW86C,"Pool Party Decorations,142pcs Pool Party Supplies Tableware Flamingo Pool Party Plates and Napkins Cups Supplies for Summer Pool Party Birthday Decorations",N/A,$17.99 ,,4.5,28,FALSE,https://m.media-amazon.com/images/I/8159cmcy4fL._AC_UL320_.jpg,https://m.media-amazon.com/images/I/8159cmcy4fL._AC_SL1500_.jpg,,2026-04-14T18:24:28.393403,
44,1,Organic,,36,B0F6LWCHDW,"Aliceset 20 Pcs Pool Party Clear Favor Bags with Handles Swimming Themed Waterproof Goodie Bags for Pool Swimming Summer Party Birthday Baby Shower Supplies, 8 x 8 x 3. 15 Inch",N/A,$20.99 ,,4.7,268,FALSE,https://m.media-amazon.com/images/I/81msf9UzssL._AC_UL320_.jpg,https://m.media-amazon.com/images/I/81msf9UzssL._AC_SL1500_.jpg,,2026-04-14T18:24:28.396915,
45,1,Organic,,37,B07YDK14GQ,Decor365 Under the Sea Party Decorations White Bubble Garlands Little Mermaid Birthday Decorations Bday Hanging Streamer Beach Banner Decor Underwater Backdrop Kids Ocean Party Supplies,N/A,$11.98 ,,4.6,6486,FALSE,https://m.media-amazon.com/images/I/51Gcx9gKPQL._AC_UL320_.jpg,https://m.media-amazon.com/images/I/51Gcx9gKPQL._AC_SL1500_.jpg,,2026-04-14T18:24:28.400915,
46,1,Organic,,38,B0GMQ1DQ67,"Beach Birthday Decorations Hello Summer Party Tableware Disposable Paper Plates,Napkins,Tablecloth,Cups,Balloon,Cake Topper,Banner for Hawaiian Summer Pool Themed Birthday Party Supplies,Serve 24",N/A,$20.99 ,,,,FALSE,https://m.media-amazon.com/images/I/91LJAt7CapL._AC_UL320_.jpg,https://m.media-amazon.com/images/I/91LJAt7CapL._AC_SL1500_.jpg,,2026-04-14T18:24:28.405013,
47,1,Organic,,39,B0F47TPJSL,"Tingjoo 3 Pcs Pool Party Arch Backdrop Stand Cover Spandex Fitted Hawaiian Theme Arch Cover 4ft, 5ft, 6ft Pool Photo Background Props for Summer Swimming Birthday Party Decoration",N/A,$39.99 ,,4.5,15,FALSE,https://m.media-amazon.com/images/I/81BTgH9mQyL._AC_UL320_.jpg,https://m.media-amazon.com/images/I/81BTgH9mQyL._AC_SL1500_.jpg,,2026-04-14T18:24:28.409014,
48,1,Organic,,40,B0DP2FLFKM,?Renbuzhu 15PCS Pool Party Decorations Beach Ball Paper Lanterns - Summer Luau Hawaiian Themed Hanging Decor for Home Birthday Outdoor Indoor,N/A,$15.99 ,,4.5,126,FALSE,https://m.media-amazon.com/images/I/81SAWFpzVML._AC_UL320_.jpg,https://m.media-amazon.com/images/I/81SAWFpzVML._AC_SL1500_.jpg,,2026-04-14T18:24:28.414095,
49,1,Organic,,41,B0BLVJV2YG,"LEEZZIZZ 30Pcs Punch Balloons, Thickened Neon Punching Balloon Heavy Duty Party Favors for Kids with Rubber Band Handle, Bouncy Balls for Birthday Weddings Goodie Bag Stuffer Supply",N/A,$8.88 ,,4.6,3531,FALSE,https://m.media-amazon.com/images/I/61o0vAZMh0L._AC_UL320_.jpg,https://m.media-amazon.com/images/I/61o0vAZMh0L._AC_SL1500_.jpg,,2026-04-14T18:24:28.418103,
50,1,Organic,,42,B09NM2FPKX,"Fovths Luau Grass Table Skirt Natural 9 Feet x 29.5 Inch Hawaiian Table Skirt for Tropical Hawaiian Party Decorations Luau Costume Party, Straw Yellow",N/A,$8.49 ,,4.5,2398,FALSE,https://m.media-amazon.com/images/I/81Hsj3wr27L._AC_UL320_.jpg,https://m.media-amazon.com/images/I/81Hsj3wr27L._AC_SL1500_.jpg,,2026-04-14T18:24:28.422100,
51,1,Title,,,,More results,,,,,,FALSE,,,,2026-04-14T18:24:28.422604,
52,1,Organic,,43,B091HP49FJ,"Voiiake Pool Floats Toys Games Set, Inflatable Cross Ring Toss Game Toy with 6pcs Rings for Kids Adults Family, Swimming Pool Water Game",N/A,$12.99 ,,4.3,711,FALSE,https://m.media-amazon.com/images/I/71H0Vars19L._AC_UL320_.jpg,https://m.media-amazon.com/images/I/71H0Vars19L._AC_SL1500_.jpg,,2026-04-14T18:24:28.425626,
53,1,Organic,,44,B07NWNGLVV,"iShyan Inflatable Drink Holder, 15 Pack Drink Floats Inflatable Cup Holders Flamingo Coasters for Swimming Pool Party",N/A,$11.99 ,,4.5,2227,FALSE,https://m.media-amazon.com/images/I/61aCqCb3t6L._AC_UL320_.jpg,https://m.media-amazon.com/images/I/61aCqCb3t6L._AC_SL1500_.jpg,,2026-04-14T18:24:28.432253,
54,1,Organic,,45,B0BTN5DNYZ,"Riakrum 3 Pcs Summer Beach Tablecloths Pool Party Table Covers Rectangle Plastic Hawaiian Tablecloth Beach Supplies Theme Party Decorations for Swimming Themed Birthday Favors, 54 x 108 Inch",N/A,$11.99 ,,4.7,88,FALSE,https://m.media-amazon.com/images/I/91TD+XEveuL._AC_UL320_.jpg,https://m.media-amazon.com/images/I/91TD+XEveuL._AC_SL1500_.jpg,,2026-04-14T18:24:28.435303,
55,1,Organic,,46,B0BKTLGZN1,"JOYIN 4-Pack 20"" Beach Balls - Large Rainbow Beach Ball Inflatable Pool Toys for Party Supplies Decorations, Adults Kids Birthday Luau Summer Beach Water Games Beachball Party Favors",N/A,$9.49 ,,4.5,1465,FALSE,https://m.media-amazon.com/images/I/71-+c9L29ML._AC_UL320_.jpg,https://m.media-amazon.com/images/I/71-+c9L29ML._AC_SL1500_.jpg,,2026-04-14T18:24:28.439304,
56,1,Organic,,47,B07NS7BG9L,"JOYIN 28ЁБ Inflatable Palm Tree Cooler, Luau Hawaiian Tropical Beach Themed Party Decorations, Blow Up Palm Trees Cooler Outdoor Party Supplies, Kids Adults Birthday Party DЈІcor",N/A,$19.99 ,,4.4,4015,FALSE,https://m.media-amazon.com/images/I/91NOjIPjumL._AC_UL320_.jpg,https://m.media-amazon.com/images/I/91NOjIPjumL._AC_SL1500_.jpg,,2026-04-14T18:24:28.442939,
57,1,Organic,,48,B0F1Y5WPC7,"4pcs Pool Party Decorations Wood Table Centerpieces,Hello Summer Splish Splash Party Table Decorations Hawaii Tropic Style Wooden Tabletop Decor for Summer Holiday",N/A,$11.99 ,,4.8,16,FALSE,https://m.media-amazon.com/images/I/71zZWDGM9UL._AC_UL320_.jpg,https://m.media-amazon.com/images/I/71zZWDGM9UL._AC_SL1500_.jpg,,2026-04-14T18:24:28.445620,
59,1,Title,,,,Debug info copied.SponsoredVISOFO Floating Bluetooth Pool Speaker with Lights | Pool Accessories Abo,,,,,,FALSE,,,,2026-04-14T18:24:28.447590,
60,1,Title,,,,Related searchespool party suppliespool party gamespool party decorations for adultspool party backd,,,,,,FALSE,,,,2026-04-14T18:24:28.448592,
61,1,Title,,,,Previous123...7Next,,,,,,FALSE,,,,2026-04-14T18:24:28.448592,
62,1,SB,2,,,N/A,https://aax-us-east-retail-direct.amazon.com/x/c/JCi94R4bnGUfPsOQYsCah8QAAAGdi4VYjgEAAAH2AQBvbm9fdHhuX2JpZDIgICBvbm9fdHhuX2ltcDIgICChzYAH/clv1c_ek-wxAf2FbbWDfHXj6fPpws_JPFBnjq1p9q1J2PMz5-rzKaMzXfYBtqKs2vJHNpIM-uKJgAWSWJKCXqCgpOMYSX5cHPuyj-vkwklHibQxI8mTalLiwZgonqcuvn3r3FXhkhxrOotK7XIqZ2qxYYyQ-n_MFyeij2qkiGwTDethNI_OegbDeooreiwIr1dzmcP8Pzp7GfJ34PN1OrxDwQoMqqtONYXh8462AoRjrPT0MzPtXdRZrQ4qRaJ8G2JlxgDuFawETtVTCyZfpbG6CLe9uYK9NexGFNBOVof-YVgwG76L8i5brWkltVd0tC7MeytHiBDv8qNdQaTfYAr_SZqLmqv5YulBlCuffozaJ2oAOnXnSBbOLuJGxeS4nf7TOTEq_bmieVlVBYHOteauR8T_skndBex2WIaeuJfzR4oS3okBIAzc97BWEaSujs1QNTrgfLtU_u-vux6426WNDRSlv111P0nRcxVpoNMkbN53cF3rbBGKydl-aFdtVyEPd5mihwWeRIMLT38Ks4pWolTDp5e5-lKqyp8qdQr2_7Em_WQKX7G6DvUEs572kLx1RLcvPAuVGZm9_4i-7Urc3Uxd-MgMBuov8hq6dViVthLkD5_PcLKn0U9Vn11ih_-cwL92oXqzY3o6mOZT2zvCJSTzzJmsO0iD212MqRZRYvNsCezSM2cNROG6AgY7Zov0ClViMkukgkv4dF6agdA6-tAWhZl6170pqqye7QEy4TX32iRIWmdwdsHlGFAl5TFHnKs--THTFrciAlizWChDUZDzJBS1KSr2kaAzeIFlolh283iP3YWsH9WN8hnZudL_Si3dpjycUAL5wvDIvt6P0zD0iVn33tf8P_lvAcN5Of8asp9NNmhw4O0VbJ0wh1s7VgxhLFQJzxR9P-EFNyxvAV0flVH6aQYUOxDfK049Y_Z1mDCFfwiv44UbDS0tfVXgRuDn3D0tdayrpFBZiYQ3o5siLczk8mtC_PusNYieO_gUy_bb8YZN5wRIcucoXBDqI05lYgY8e8yJbsZ1hWS74kEfFgksit4NT-sTWbslX6XqMwfcKavLMkITkti2JocQwupG4crm-m8clmmhnyuMhyFfWNxrm51pFadL68KSz68KYxFtAo2ToxEPPAU7HiozUAzA2SVzwRNJsxTpYC9krTNRNawpmRCqYiNj2AgaUSCy6vJ_bd9HfTizN52qIuMHq1FYQMPcrWcJ0I8ZqtkwqhNHRvUgmx21R1mikz_XdSsrmEOENGdDmI7e9jIQiwmgQBu4vbGF9xsygch5X6ebGLqsNM-OdOw8jOVmQro9hD2MTrcj8r7mJahzLfOpyH-9EU3K3fLyNj6m9zLP-fyrV-qhtniQeTSIcNGc5bx0ibz8_VvjXvG7oOBtMaRZxiVh86uJznnon-WKiwsS-l6aCUiSiVsSSPYVLw5exsHXPnOPxoxo-A5XAyRuQvQHJuBPITMZj3a870jcNa2JsJnRVl8eNPJHxv7aeoZZA1Qzysq5LoAQpV2PpE5QduEeYyjNXI7A3A9YPbvoAD89VZHwf4BK77gj56wLfkCx4YB-aajX4UaUhp0anKuFOTgohXEMoxKLPhXF-SR7Abzs1rKcXk4c3C45GOvz-onfk6uJl9zE4OQ3fm5IoA7C-Xt3AD13AUmbRckynFVhGIqaVG1449r8z9I9kUZUefRWOfs/https://www.amazon.com/stores/page/6956570F-DAF5-4795-AC42-1726A926FA0D/?_encoding=UTF8&store_ref=SB_A017845915CPB7KG2KJUE-A06766673SV040RNQ87P0&pd_rd_plhdr=t&aaxitk=593ed25cdae78151079140b4dafc652e&hsa_cr_id=0&lp_asins=B0DDH82BQW%2CB0CZ3LWF46%2CB0CKHGHL7Y&lp_query=pool%20party%20decorations&lp_slot=desktop-hsa-3psl&ref_=sbx_be_s_3psl_mbd_mb0_bkgd&pd_rd_w=78tfS&content-id=amzn1.sym.cd7c548b-a599-426f-9ffe-daa1aa803c87%3Aamzn1.sym.cd7c548b-a599-426f-9ffe-daa1aa803c87&pf_rd_p=cd7c548b-a599-426f-9ffe-daa1aa803c87&pf_rd_r=9G675QG8HYECAF94AMTH&pd_rd_wg=WxoF3&pd_rd_r=92e5560d-1bdf-41c0-9729-d8f2b52e3c69,,,,,FALSE,,,N/A,2026-04-14T18:24:28.454312,
63,1,Title,,,,Need help?Visit the help sectionorcontact us,,,,,,FALSE,,,,2026-04-14T18:24:28.454312,
0,2,SB_Video,1,,,N/A,N/A,,,,,FALSE,,,,2026-04-14T18:24:46.060012,1
1,2,Title,,,,ResultsCheck each product page for other buying options. Price and other details may vary based on p,,,,,,FALSE,,,,2026-04-14T18:24:46.060012,
3,2,Organic,,49,B0C935LM1K,Pool Birthday Party Banners 2Pcs Swimming Pool Party Cutout Banners Glitter Pink Hawaii Pool Party Garlands Baby Shower Decorations Hello Summer Pool Supplies for Girls,N/A,$7.19 ,,5,30,FALSE,https://m.media-amazon.com/images/I/719+lBe0EJL._AC_UL320_.jpg,https://m.media-amazon.com/images/I/719+lBe0EJL._AC_SL1500_.jpg,,2026-04-14T18:24:46.065578,
4,2,Organic,,50,B0CZ637F9S,"OBXT 10"" Blue Hanging Jellyfish Paper Lanterns - Under the Sea Party & Mermaid Birthday Decorations, Baby Shower, Nautical Events, Ocean Theme Classroom & Beach Room Decor (Set of 6)",N/A,$20.99 ,,4.8,706,FALSE,https://m.media-amazon.com/images/I/81vZ2BQo+gL._AC_UL320_.jpg,https://m.media-amazon.com/images/I/81vZ2BQo+gL._AC_SL1500_.jpg,,2026-04-14T18:24:46.070334,
