data_index,page,ad_type,ad_rank,organic_rank,asin,title,url,price_current,price_list,rating_stars,rating_count,is_prime,image_small,image_large,brand_name,scraped_at
4,3,Organic,,99.0,B0F9YCCFGS,"32 Inch Large Ice Cream Balloons Cone Kit, Giant Sweet Ice Cream Sprinkle Foil Balloons, Popsicle Three Scoops of Fun Social Party Decorations for Kid Girls Birthday Summer Beach Hawaii Pool Decor",N/A,CNY 92.13,,4.4,147.0,False,https://m.media-amazon.com/images/I/61p5yPylEXL._AC_UL320_.jpg,https://m.media-amazon.com/images/I/61p5yPylEXL._AC_SL1500_.jpg,,2026-04-14T17:57:29.453783
5,3,Title,,,,Ozepao 58 Pcs Summer Cutouts Beach Hawaiian Theme Bulletin Board Decoration Tropical Fruits Paper Cu,,,,,,False,,,,2026-04-14T17:57:29.455826
6,3,Title,,,,More results,,,,,,False,,,,2026-04-14T17:57:29.455826
7,3,Organic,,100.0,B09ZLC96TZ,"Canlierr 40 Pack Tropical Party Decorations Supplies Large Tissue Paper Hibiscus Flowers Faux Palm Leaves Set for Hawaiian Luau, Safari, Mexican Fiesta, Birthday Parties",N/A,CNY 136.52,,4.4,134.0,False,https://m.media-amazon.com/images/I/81xHpK4fbQL._AC_UL320_.jpg,https://m.media-amazon.com/images/I/81xHpK4fbQL._AC_SL1500_.jpg,,2026-04-14T17:57:29.460851
8,3,Organic,,101.0,B09BB2QVNB,"BLUE TOP 100pcs Umbrella Drink Straws 9.45 Inch Assorted Colors, Fancy Mini Paper Umbrella Drink for Cocktail,Milkshake,Juice,Great for Valentine's Day Beach Party,Hawaiian Party,Luau Party,Bar",N/A,CNY 67.47,,4.6,841.0,False,https://m.media-amazon.com/images/I/71GGavG2u6L._AC_UL320_.jpg,https://m.media-amazon.com/images/I/71GGavG2u6L._AC_SL1500_.jpg,,2026-04-14T17:57:29.465926
9,3,Organic,,102.0,B09XQV8C9P,48 Pieces Spring Sun Flowers Butterfly Hanging Swirl Decorations Spirals Sunflower Party Streamers Wall Ceiling Hanging Supplies Favors Spring Summer Birthday Party Decorations,N/A,CNY 81.88,,4.3,137.0,False,https://m.media-amazon.com/images/I/71L6G1vaVFL._AC_UL320_.jpg,https://m.media-amazon.com/images/I/71L6G1vaVFL._AC_SL1500_.jpg,,2026-04-14T17:57:29.471470
10,3,Organic,,103.0,B0F1TZZJ49,HOMETITUTE Hello Summer Banner 71 x 43 inch Summer Hawaiian Party Decorations Flower Butterfly Summer Outdoor Decorations Supplies Backdrop Tropical Beach Hawaiian Party Themed Photo Booth Props,N/A,CNY 88.71,,5.0,15.0,False,https://m.media-amazon.com/images/I/81r46yF5hUL._AC_UL320_.jpg,https://m.media-amazon.com/images/I/81r46yF5hUL._AC_SL1500_.jpg,,2026-04-14T17:57:29.475982
11,3,Organic,,104.0,B0D129R82J,"VILIFEVER Ice Cream Bar Banner Ice Cream Garland, Ice Cream Theme Birthday Party Baby Shower Wedding Decorations Photo Props Summer Holidays Party Favors",N/A,CNY 68.22,,4.8,67.0,False,https://m.media-amazon.com/images/I/71-ayrrmaxL._AC_UL320_.jpg,https://m.media-amazon.com/images/I/71-ayrrmaxL._AC_SL1500_.jpg,,2026-04-14T17:57:29.481004
12,3,Organic,,105.0,B0F9Y9SJNZ,"50 Counts Hawaiian Leis Bulk Decorations, Leis for Luau Party Hawaiian Colorful Tropical Flower Lays for Adults Hawaii Summer Beach Luau Party Favors Birthday Party Supplies",N/A,CNY 136.52,,4.8,41.0,False,https://m.media-amazon.com/images/I/81QW9MLaIaL._AC_UL320_.jpg,https://m.media-amazon.com/images/I/81QW9MLaIaL._AC_SL1500_.jpg,,2026-04-14T17:57:29.484507
13,3,Title,,,,More results,,,,,,False,,,,2026-04-14T17:57:29.485514
14,3,Organic,,106.0,B0FV8WS7H5,"xo, Fetti Camp Bunting Banner - 32 Flags | Bachelorette Decorations, Birthday Party, Bridal Shower, Pink Green Gingham, Summer Camp, Bandana",N/A,CNY 95.54,,,,False,https://m.media-amazon.com/images/I/71Hobo4NN6L._AC_UL320_.jpg,https://m.media-amazon.com/images/I/71Hobo4NN6L._AC_SL1500_.jpg,,2026-04-14T17:57:29.491044
15,3,Organic,,107.0,B0G82VM9N7,"xo, Fetti Hot Dog Banner | Cookout Party, BBQ Decor, Summer Party, July 4th, Kids Party, Funny",N/A,CNY 75.05,,,,False,https://m.media-amazon.com/images/I/71d6ZJ7bQNL._AC_UL320_.jpg,https://m.media-amazon.com/images/I/71d6ZJ7bQNL._AC_SL1500_.jpg,,2026-04-14T17:57:29.494549
16,3,Organic,,108.0,B0BNMX5S5H,"4 Pack Spring Summer Lavender Tulip Plastic Tablecloth, Blooming Floral Disposable Table Cloth, Watercolor Seasonal Holiday Table Cover for Easter Picnic Spring Summer Party Decorations, 54 x 108 Inch",N/A,CNY 81.88,,4.7,592.0,False,https://m.media-amazon.com/images/I/71IZqSZDnqL._AC_UL320_.jpg,https://m.media-amazon.com/images/I/71IZqSZDnqL._AC_SL1500_.jpg,,2026-04-14T17:57:29.500089
17,3,Organic,,109.0,B0BW3DWXGL,"YUJUN 16 Pieces Big Diving Pool Toys, Beach Colorful Starfish Summer Swimming Underwater Pool Toys Soft Rubber Dive Throw for Kids Birthday Swimming Pool Party Favors Fish Tank Stuffer (2 Sizes)",N/A,CNY 81.88,,4.7,570.0,False,https://m.media-amazon.com/images/I/81uOKdyApQL._AC_UL320_.jpg,https://m.media-amazon.com/images/I/81uOKdyApQL._AC_SL1500_.jpg,,2026-04-14T17:57:29.503597
18,3,Organic,,110.0,B0DXFQD2N7,"xo, Fetti Pool Party Temporary Tattoos - 68 Iridescent Foil Pcs | Summer Birthday Accessory, Kids Waterpark Party Favor, Cute Beach Activity",N/A,CNY 54.57,,4.6,33.0,False,https://m.media-amazon.com/images/I/71mlSyRYaxL._AC_UL320_.jpg,https://m.media-amazon.com/images/I/71mlSyRYaxL._AC_SL1500_.jpg,,2026-04-14T17:57:29.508449
19,3,Organic,,111.0,B0BW5B7SWT,Set of 5 Daisy Groovy Banner Boho Daisy Paper Garlands Hippie Party Banners Decor Colorful Flower Banners for Baby Shower Two Groovy Party Supplies Birthday Nursery Home Decor,N/A,CNY 61.39,,4.5,105.0,False,https://m.media-amazon.com/images/I/71vvr7kRvGL._AC_UL320_.jpg,https://m.media-amazon.com/images/I/71vvr7kRvGL._AC_SL1500_.jpg,,2026-04-14T17:57:29.512964
20,3,Organic,,112.0,B0DYT89VYV,"Soulchen 150 Pcs 5"" and 8"" Under The Sea Party Decorations Clear Bubble Garlands Mermaid Birthday Bobo Balloon Decoration Mermaid Birthday Decor for Summer Beach Ocean Party Supplies",N/A,CNY 122.86,,3.1,48.0,False,https://m.media-amazon.com/images/I/91inCImk7WL._AC_UL320_.jpg,https://m.media-amazon.com/images/I/91inCImk7WL._AC_SL1500_.jpg,,2026-04-14T17:57:29.517975
21,3,Organic,,113.0,B0B4VLGT76,Jetec Summer Slippers Hanging Sign Shape Welcome Hello Flip Flop Wooden Door Sign Hanging Plaque Rustic Wall Sign Yard Indoor Outdoor Garden Decoration with Rope (Hello Summer),N/A,CNY 54.57,,4.4,1166.0,False,https://m.media-amazon.com/images/I/71O52MbRKJL._AC_UL320_.jpg,https://m.media-amazon.com/images/I/71O52MbRKJL._AC_SL1500_.jpg,,2026-04-14T17:57:29.522007
22,3,Organic,,114.0,B0DVTD2YPF,"xo, Fetti Pink + Green Pool Party Plastic Cups | 16 pcs 12 oz | Summer Drinkware, Colorful Decorations, Bachelorette Party Drinks, Birthday Supplies",N/A,CNY 102.37,,4.9,14.0,False,https://m.media-amazon.com/images/I/51uCjCVkXwL._AC_UL320_.jpg,https://m.media-amazon.com/images/I/51uCjCVkXwL._AC_SL1500_.jpg,,2026-04-14T17:57:29.526523
23,3,Organic,,115.0,B0DW7L89JM,"SPERINGEEN Summer Tablecloth Decorations, Coloring Games Kids Summer Activities Crafts Poster Pages Banner Table Cover Party Favors for Family or Classroom School Party Decor",N/A,CNY 61.33,,4.7,456.0,False,https://m.media-amazon.com/images/I/71vVlKtQN3L._AC_UL320_.jpg,https://m.media-amazon.com/images/I/71vVlKtQN3L._AC_SL1500_.jpg,,2026-04-14T17:57:29.532559
24,3,Organic,,116.0,B0CYT7NTXZ,Bememo 6 Pcs Hello Summer Table Decorations Sign Summer Gnome Wooden Table Centerpieces Beach Hawaii Table Decor Ice Cream Colorful Table Topper Sign for Summer Pool Tropical Party Supplies,N/A,CNY 81.88,,4.3,22.0,False,https://m.media-amazon.com/images/I/71ML03K825L._AC_UL320_.jpg,https://m.media-amazon.com/images/I/71ML03K825L._AC_SL1500_.jpg,,2026-04-14T17:57:29.538825
25,3,Organic,,117.0,B0BPL5PYV8,"Zcaukya Inflatable Palm Tree Cooler, 60"" Blow Up Palm Tree Cooler for Tropical Party Decorations, Hawaiian Party Supplies Pool Decorations",N/A,CNY 220.52,,4.2,1456.0,False,https://m.media-amazon.com/images/I/81adb71iO8L._AC_UL320_.jpg,https://m.media-amazon.com/images/I/81adb71iO8L._AC_SL1500_.jpg,,2026-04-14T17:57:29.549208
26,3,Organic,,118.0,B0D5ZNJWVR,4E's Novelty Summer Inflatable Limbo Game Party Game for Kids Boys Girls Adults Tropical Inflatable Decoration for Indoor Outdoor Bithday Beach Pool Tropical Luau Backyard Game,N/A,CNY 204.81,,3.7,126.0,False,https://m.media-amazon.com/images/I/71lPT-wabXL._AC_UL320_.jpg,https://m.media-amazon.com/images/I/71lPT-wabXL._AC_SL1500_.jpg,,2026-04-14T17:57:29.554484
27,3,Organic,,119.0,B09T2QKS13,"FLAMDYNO Pool Toys - 4/8 Pack Light Up Beach Balls for Kids w/ 8 Light Modes, Pool Beach Games Balls for Outdoor or Indoor Activities, Glow in The Dark Pool Beach Decorations for Kids and Adults",N/A,CNY 172.03,,4.2,1081.0,False,https://m.media-amazon.com/images/I/71yrSUa95NL._AC_UL320_.jpg,https://m.media-amazon.com/images/I/71yrSUa95NL._AC_SL1500_.jpg,,2026-04-14T17:57:29.558175
28,3,Organic,,120.0,B0F13CVFYD,"Hallswl 3Pcs Ocean Waves Tablecloth, Ocean Water Print Tablecloths Summer Disposable Plastic Table Covers for Beach Surf Pool Sea Themed Party Birthday Decorations,54X108inch",N/A,CNY 61.39,,4.7,67.0,False,https://m.media-amazon.com/images/I/81xmLEb5RaL._AC_UL320_.jpg,https://m.media-amazon.com/images/I/81xmLEb5RaL._AC_SL1500_.jpg,,2026-04-14T17:57:29.562848
29,3,Organic,,121.0,B0CKYH12YF,"Artoid Mode Wildflowers Floral Spring Table Runner, Seasonal Summer Butterfly Kitchen Dining Table Decoration for Home Party 13x72 Inch",N/A,CNY 61.39,,4.3,697.0,False,https://m.media-amazon.com/images/I/81NcaIOKTOL._AC_UL320_.jpg,https://m.media-amazon.com/images/I/81NcaIOKTOL._AC_SL1500_.jpg,,2026-04-14T17:57:29.572836
30,3,Organic,,122.0,B0CB3Y6PPW,"Party Goodie Bag Stuffer Fillers for Kids, 32 Pack Mini Bubble Wand Toys Gifts for Toddler, Small Birthday Summer Beach Pool Camping Party Favor Supplies,4th of July Classroom School Stuff Treat Prize",N/A,CNY 60.64,,4.6,2729.0,False,https://m.media-amazon.com/images/I/71P27BMtwSL._AC_UL320_.jpg,https://m.media-amazon.com/images/I/71P27BMtwSL._AC_SL1500_.jpg,,2026-04-14T17:57:29.578628
31,3,Organic,,123.0,B0CTNT4ZL9,"xo, Fetti Italian Summer Paper Plates - 32 pk, 16 9"" plates + 16 7"" plates | Bachelorette Party Decorations, Last Toast Coast, Birthday Party Supplies, Flower Baby Shower, Stripe Cake Plates",N/A,CNY 122.86,,3.7,30.0,False,https://m.media-amazon.com/images/I/610uCWtQTkL._AC_UL320_.jpg,https://m.media-amazon.com/images/I/610uCWtQTkL._AC_SL1500_.jpg,,2026-04-14T17:57:29.583674
32,3,Organic,,124.0,B0CTS11B1M,"xo, Fetti Italian Summer Wavy Floral Stripe Napkins - 3-ply, 24 pcs | Bachelorette Party Decorations, Last Toast Coast, Birthday Party Supplies, Flower Baby Shower, Stripe Wavy Cocktail Decor",N/A,CNY 81.88,,4.2,29.0,False,https://m.media-amazon.com/images/I/61b6hxrc2qL._AC_UL320_.jpg,https://m.media-amazon.com/images/I/61b6hxrc2qL._AC_SL1500_.jpg,,2026-04-14T17:57:29.587756
33,3,Organic,,125.0,B09WYB7F1H,"100PCS Flamingo Fruit Paper Straws,Disposable Plastic Drinking Straws,Tropical Hawaiian Beach Summer Pool Party Cocktail Decorations - Assorted Colors",N/A,CNY 81.88,,4.6,526.0,False,https://m.media-amazon.com/images/I/712Vps8x8oL._AC_UL320_.jpg,https://m.media-amazon.com/images/I/712Vps8x8oL._AC_SL1500_.jpg,,2026-04-14T17:57:29.592316
34,3,Organic,,126.0,B0G2MNM6K6,"xo, Fetti Pool Party Cupcake Toppers and Wrappers - 24 Pc Set | Summer Birthday Decorations, Tropical Luau, Hawaiian Theme, Kids Party, Beach Ball, Pink Hibiscus",N/A,CNY 68.22,,,,False,https://m.media-amazon.com/images/I/61pezXRjecL._AC_UL320_.jpg,https://m.media-amazon.com/images/I/61pezXRjecL._AC_SL1500_.jpg,,2026-04-14T17:57:29.596322
35,3,Organic,,127.0,B0G44YV6CC,"xo, Fetti Pink and Orange Scallop Fringe Banner | Bachelorette Party, Birthday, Summer Decor, Iridescent, Fiesta, Girly, Photo Prop, Backdrop",N/A,CNY 129.69,,,,False,https://m.media-amazon.com/images/I/71AsMZlPTNL._AC_UL320_.jpg,https://m.media-amazon.com/images/I/71AsMZlPTNL._AC_SL1500_.jpg,,2026-04-14T17:57:29.599834
36,3,Organic,,128.0,B0F47J34TT,"10pcs Hawaiian Leis Bulk,Colorful Lei Tropical Flower Necklace Hawaii Hula Dance Decor for Summer Beach Pool Luau Party Birthday Decoration Favors Supplies",N/A,CNY 40.91,,4.2,377.0,False,https://m.media-amazon.com/images/I/811BK4Ug9sL._AC_UL320_.jpg,https://m.media-amazon.com/images/I/811BK4Ug9sL._AC_SL1500_.jpg,,2026-04-14T17:57:29.603882
37,3,Organic,,129.0,B0FMJQ7GTY,"JOYIN 12 Pcs Hawaiian Luau Party Sunglasses, Summer Pool Party Decorations, Tropical Glasses for Girls Hawaiian Outfit, Cool Party Favors & Theme Supplies",N/A,CNY 136.52,,4.4,29.0,False,https://m.media-amazon.com/images/I/81f7fVH8MkL._AC_UL320_.jpg,https://m.media-amazon.com/images/I/81f7fVH8MkL._AC_SL1500_.jpg,,2026-04-14T17:57:29.608911
38,3,Organic,,130.0,B071Z2PRRM,EBOOT 15 Pieces Assorted Colored Flower Crown Wreath Headband Garland Multicolor Headbands Floral Headpiece for Wedding Festival Vacation Fairy Party Photography Props,N/A,CNY 116.03,,4.7,1595.0,False,https://m.media-amazon.com/images/I/81cLZZxbU2L._AC_UL320_.jpg,https://m.media-amazon.com/images/I/81cLZZxbU2L._AC_SL1500_.jpg,,2026-04-14T17:57:29.612177
39,3,Organic,,131.0,B0F1SXK93S,CHARLENT Glitter Temporary Tattoos for Aloha Party Decoration - 74 Individually Sheets Glitter Summer Tattoos for Kids Women Hawaiian Party Favors,N/A,CNY 47.74,,4.8,142.0,False,https://m.media-amazon.com/images/I/81vtkHW4-xL._AC_UL320_.jpg,https://m.media-amazon.com/images/I/81vtkHW4-xL._AC_SL1500_.jpg,,2026-04-14T17:57:29.617191
40,3,Organic,,132.0,B0CLP5W5VQ,Ziliny 36 Pcs Summer Pool Beach Party Supplies 5 lb Beach Ball Large Paper Serving Snack Trays for Summer Hawaii Tropical Party Swimming Pool Favors,N/A,CNY 122.86,,4.5,36.0,False,https://m.media-amazon.com/images/I/818v8g+7+0L._AC_UL320_.jpg,https://m.media-amazon.com/images/I/818v8g+7+0L._AC_SL1500_.jpg,,2026-04-14T17:57:29.621723
41,3,Organic,,133.0,B0F1FNH8HG,13Pcs Gone Fishing Paper Honeycomb Ball & Fish Banners Party Decorations for Under-The-Sea/Summer/Mermaid/Luau/Hawaiian/Ocean/Birthday Decor Supplies,N/A,CNY 102.37,,5.0,13.0,False,https://m.media-amazon.com/images/I/81H5gxsOkOL._AC_UL320_.jpg,https://m.media-amazon.com/images/I/81H5gxsOkOL._AC_SL1500_.jpg,,2026-04-14T17:57:29.626234
42,3,Organic,,134.0,B0DZVJQC2Z,"Summer Vibes Neon Sign for wall decor, Summer Party LED Sign, USB Powered Beach Bar Neon Light with Dimmable Switch for Beach Bar Bedroom Party Decoration",N/A,CNY 129.00,,4.6,6.0,False,https://m.media-amazon.com/images/I/81rNOtQBzsL._AC_UL320_.jpg,https://m.media-amazon.com/images/I/81rNOtQBzsL._AC_SL1500_.jpg,,2026-04-14T17:57:29.630396
43,3,Organic,,135.0,B07CNC6RP7,HESTYA 42 Pieces Colorful Pennant Banner Flag Multicolor Bunting String Triangle Banner Pennants for Birthdays Classroom School Carnival Garland Outdoor Events Party Hanging Decorations(Pastel),N/A,CNY 75.05,,4.7,578.0,False,https://m.media-amazon.com/images/I/71TelkiFeJL._AC_UL320_.jpg,https://m.media-amazon.com/images/I/71TelkiFeJL._AC_SL1500_.jpg,,2026-04-14T17:57:29.634402
44,3,Organic,,136.0,B0CMQK4RMF,Sun Party Decorations Boho Sun Polka Dot Garland Streamer Ombre Orange White Retro Muted Sun Banner for First Trip Around the Sun Hippie Boho Summer Birthday Baby Shower Wedding Bridal Shower Supplies,N/A,CNY 88.71,,4.8,576.0,False,https://m.media-amazon.com/images/I/71+4LDjX+5L._AC_UL320_.jpg,https://m.media-amazon.com/images/I/71+4LDjX+5L._AC_SL1500_.jpg,,2026-04-14T17:57:29.638810
45,3,Organic,,137.0,B0F5M4M2WG,"Tropical Fun Headbands Set – 6 designs including pineapple, watermelon, flamingo, coconut, flip flops, and tiki for beach parties, Hawaiian luau, vacations, poolside, BBQ, and themed celebrations.",N/A,CNY 54.57,,4.2,7.0,False,https://m.media-amazon.com/images/I/61ET2tIv7GL._AC_UL320_.jpg,https://m.media-amazon.com/images/I/61ET2tIv7GL._AC_SL1500_.jpg,,2026-04-14T17:57:29.642321
46,3,Organic,,138.0,B0DQ4VYK9R,"REDWORD 60PCs Ice Cream Bowls, 9oz Ice Cream Containers Disposable Paper Bowls Sundae Cups Dessert Soup Containers for Ice-cream Party Decorations Summer Party Decorations",N/A,CNY 109.20,,4.8,76.0,False,https://m.media-amazon.com/images/I/811lHRyc73L._AC_UL320_.jpg,https://m.media-amazon.com/images/I/811lHRyc73L._AC_SL1500_.jpg,,2026-04-14T17:57:29.648878
47,3,Organic,,139.0,B0CYNP5QZF,Goodbye School Hello Pool Banner Bye Bye School Hello Pool Party Decorations End of School Year Party Decorations Last Day of School Decorations Pool Party Decorations,N/A,CNY 61.39,,4.7,14.0,False,https://m.media-amazon.com/images/I/81eO5+C0hpL._AC_UL320_.jpg,https://m.media-amazon.com/images/I/81eO5+C0hpL._AC_SL1500_.jpg,,2026-04-14T17:57:29.652391
48,3,Organic,,140.0,B0GBVNMHXF,"Seashell Birthday Party Decorations, Coastal Birthday Decorations Includes Banners, Backdrop, Balloons, Honeycomb, Tablecloth, Cale Topper for The Summer I Turned Pretty Party Decor",N/A,CNY 95.47,,5.0,2.0,False,https://m.media-amazon.com/images/I/71yxXKekI4L._AC_UL320_.jpg,https://m.media-amazon.com/images/I/71yxXKekI4L._AC_SL1500_.jpg,,2026-04-14T17:57:29.656898
49,3,Organic,,141.0,B0BVVMZMD4,"ADLKGG 10"" Jellyfish Paper Lanterns Lamps - Gradient Blue Under the Sea Party Decorations for Mermaid Theme Birthday, Beach Baby Shower, Pre-Assembled Classroom & Ocean Decor, 6 PCS",N/A,CNY 140.61,,4.8,1034.0,False,https://m.media-amazon.com/images/I/81WJ7uc8LNL._AC_UL320_.jpg,https://m.media-amazon.com/images/I/81WJ7uc8LNL._AC_SL1500_.jpg,,2026-04-14T17:57:29.660422
50,3,Organic,,142.0,B01JGQF40Y,"250pcs Multicolor Pennant Flags,LOOBJOYGAME 263Ft Nylon Fabric Decorations Grand Opening Banner Rope",N/A,CNY 88.71,,4.6,2041.0,False,https://m.media-amazon.com/images/I/61drJej456L._AC_UL320_.jpg,https://m.media-amazon.com/images/I/61drJej456L._AC_SL1500_.jpg,,2026-04-14T17:57:29.664428
51,3,Organic,,143.0,B0DXN3ZHZN,"Traplace 9 Sheets Summer Window Clings, Double Sided Summer Window Clings for Glass Windows, Hello Beach Decals, Sun Watermelon Pattern Stickers for Home Office Accessories Decorations",N/A,CNY 61.39,,4.5,1667.0,False,https://m.media-amazon.com/images/I/81hmu3ipNBL._AC_UL320_.jpg,https://m.media-amazon.com/images/I/81hmu3ipNBL._AC_SL1500_.jpg,,2026-04-14T17:57:29.668963
52,3,Organic,,144.0,B0CSFDLBMS,"Artoid Mode Sea Shell Starfish Summer Table Runner,Spring Ocean Kitchen Dining Table Decoration for Home Party Decor 13x72 Inch",N/A,CNY 68.22,,4.7,290.0,False,https://m.media-amazon.com/images/I/712YHZJVR1L._AC_UL320_.jpg,https://m.media-amazon.com/images/I/712YHZJVR1L._AC_SL1500_.jpg,,2026-04-14T17:57:29.675988
54,3,Title,,,,"Debug info copied.Sponsored120 Flags/72ft Pennant Banner Flags Garland, Triangle Banner Pennant Flag",,,,,,False,,,,2026-04-14T17:57:29.675988
55,3,Title,,,,Related searchesend of summer party decorationssummer partypool party decorationssummer party decora,,,,,,False,,,,2026-04-14T17:57:29.677566
56,3,Title,,,,Previous1234...7Next,,,,,,False,,,,2026-04-14T17:57:29.677566
57,3,SB,3.0,,,N/A,https://aax-us-east-retail-direct.amazon.com/x/c/JGHKQxUace4ykUKfm2RVyd4AAAGdi2ylrQEAAAH2AQBvbm9fdHhuX2JpZDQgICBvbm9fdHhuX2ltcDIgICCSfyzx/clv1c_ek-wBPHXUsbWHn2mJtYb8xPAyXQxfYtv3wtfftr22nYdpoOSZ_eYUgif2Y8QXjHoP82n8xgWQeOGTTTp8hFXywz3SBC-q3_t1wUvTP2gdtRXBwG58kCKHab969-0BjC2Zr2-etD55t4SHWkNlQL88knJIN2k9rXrk1D92iu27Fee2W4G2Jmf4z9NuEH9RDzM-Ql_oCfDL8YJVOpqvkXoquyz102PrOaEqOfk4S89IZMadVnpiClbi-fDfVxzVnr3uvZx79x-MWCQ2-cX9bMx7iqAk0wInlnPi1DfsqVybnLNK7N8PXg9TCwmYDPohqwSc6HFMeg4Ef3AsfhWoEoMaIVSYNJ8I0UnRmfA_dffXVrVROOFNU_Hji3HDd_IYsbybqCB9bSebT9S-OqbUuFPEaMZtoAh0ADQV39jAdUH__kz9vHXwRCjNGJOf6ew4qwic6Y0ywZ4Ez910vcZnclcw2bOnXBib_UqEQKMLgKhlJkcMh-0PVsPSun_t1JQEPVXxXkFuzc7mBnas39dQWYwTXEXcZUkFr5uSlwF5KSHv1gK2zZ-tTr2wG_E01oS3IihU9i2rKDQe1OELwbd7Qbzt5-pRAuFtBoVoEiG7VPCbkGWQojG5ZG_DHAoFIsvcc09IXp1A7lKq-AKRvyQrfR_oROc3pBH1AZhSDIig8AeHbR1ubaQV39Pu0Ih5iLkkxFgHv504X5Tg1kVizabxDjmb9Zu_i-H9jZ7_9CU5X-7q6dGiHFVXt7XOAq-msDN_oLLCdbViNU8NIK5ydhrxT8mdTLm_HRppY2XlyYHtNwlakn8JNOSzLpoWxq6CCXOZqcyjFi6KlF0CF6zE_8x1aEII8uYbDh2zYDMsBW0rivnnM-b2sICIVPkG9x0ZcO5i0WBEVsggZaGiMB9YUNa8S0A_CT85nfJz1wkWbxMrpykcvCbP9qr-fATQiSwrvPuaAMT4hT7l7eqfvKRczscdDEoZwXPj1bTCvrifwA7XgQ3ggp-29f3B6n5qPPuAIKNP-ZK9SyZobDSrA4DF5m59u16R1hIa8B1d-TmOfTqvqwkr3GD2AdQv0_wg27_q_vyxbQT4pJ4SXPh6rj4hDh1guxyCPMYu-RuMHatzbDKv3js73x-eOiT2FRNMSBDsgs0DOmRpNC8QCobjv9obG14dwjT021xPQEfcecEdaPl9WiwtxAWijvEa_j9Lm2cvoGL5-pCHrvQ6BT2p8FQgs37DxbK4d409cESxq0TkNUPjfwGuVouyEi2XY0I5hJZtFFwrOjvaYdtj52FLYbNWBBCm3sS3PQelTJ-qvB8_n8UHb_W4drbTq3_9TYbQrTOhin4VDgjVfmZ-wlVO9HVOVVgiojYuYxHsTcOXvrbo9SnX_lhsP3ujXsGVDEdHLQib00bJPh3HjlnuWum15r6064QnXjhMniOKITpNE9QT29Ww-r4cw1v0hYAT5YMEbDyLFL-jPAzSLl8Zzj2tP3MkXNQjbfxCsWK2OlUimfI3spmJF0XRZPh7FKTJec19P5yR9HV-mfuOr8tx_ze5Qn4qEIWTYIBvDEbMgjMXL3whith_wduMitDZYSwD_qc040Gqwu08qnkSXqCpjCsEatctSrU_rxYwSELuQ4Ve-XG4aTPvFfYstCjVc83nAW_DZhbGAtSUxIr-LGc-vekuzgoi-7A62MJad6ZcB5t6Bow1vA/https://www.amazon.com/stores/page/6956570F-DAF5-4795-AC42-1726A926FA0D/?_encoding=UTF8&store_ref=SB_A017845915CPB7KG2KJUE-A06766673SV040RNQ87P0&pd_rd_plhdr=t&aaxitk=593ed25cdae78151079140b4dafc652e&hsa_cr_id=0&lp_asins=B0DDH82BQW%2CB0CZ3LWF46%2CB0CKHGHL7Y&lp_query=summer%20party%20decorations&lp_slot=desktop-hsa-3psl&ref_=sbx_be_s_3psl_mbd_mb0_bkgd&pd_rd_w=oZ7PC&content-id=amzn1.sym.cd7c548b-a599-426f-9ffe-daa1aa803c87%3Aamzn1.sym.cd7c548b-a599-426f-9ffe-daa1aa803c87&pf_rd_p=cd7c548b-a599-426f-9ffe-daa1aa803c87&pf_rd_r=535GCND34WDTQPVKM898&pd_rd_wg=MpXJ1&pd_rd_r=1d78c09f-7eca-40e1-9f0f-e342e79ff7b5,,,,,False,,,N/A,2026-04-14T17:57:29.681585
58,3,Title,,,,Need help?Visit the help sectionorcontact us,,,,,,False,,,,2026-04-14T17:57:29.682584
0,4,Title,,,,ResultsCheck each product page for other buying options. Price and other details may vary based on p,,,,,,False,,,,2026-04-14T17:57:47.294282
2,4,Organic,,145.0,B0BPL5PYV8,"Zcaukya Inflatable Palm Tree Cooler, 60"" Blow Up Palm Tree Cooler for Tropical Party Decorations, Hawaiian Party Supplies Pool Decorations",N/A,CNY 220.52,,4.2,1456.0,False,https://m.media-amazon.com/images/I/81adb71iO8L._AC_UL320_.jpg,https://m.media-amazon.com/images/I/81adb71iO8L._AC_SL1500_.jpg,,2026-04-14T17:57:47.305321
3,4,Organic,,146.0,B0CTS11B1M,"xo, Fetti Italian Summer Wavy Floral Stripe Napkins - 3-ply, 24 pcs | Bachelorette Party Decorations, Last Toast Coast, Birthday Party Supplies, Flower Baby Shower, Stripe Wavy Cocktail Decor",N/A,CNY 81.88,,4.2,29.0,False,https://m.media-amazon.com/images/I/61b6hxrc2qL._AC_UL320_.jpg,https://m.media-amazon.com/images/I/61b6hxrc2qL._AC_SL1500_.jpg,,2026-04-14T17:57:47.311838
4,4,Organic,,147.0,B0G4VWGXKT,22PCS Beach Ball Paper Lanterns Bulk Pool Summer Luau Hawaiian Tropical Hanging Party Decorations Indoor Outdoor,N/A,CNY 122.86,,4.5,126.0,False,https://m.media-amazon.com/images/I/81SAWFpzVML._AC_UL320_.jpg,https://m.media-amazon.com/images/I/81SAWFpzVML._AC_SL1500_.jpg,,2026-04-14T17:57:47.315378
5,4,Title,,,,Realspring 12 Pcs 14 Inch Spring Inflatable Outdoor Decorations Butterfly Blow up Inflatable Birthda,,,,,,False,,,,2026-04-14T17:57:47.316380
6,4,Title,,,,More results,,,,,,False,,,,2026-04-14T17:57:47.317387
7,4,Organic,,148.0,B0DP6RSR73,"Inflatable Pool Toss Games, Pool Ring Toss Toys with 4 Rings for Adults Indoor Outdoor Tropical Summer Swimming Inflatable Bean Bags Toss Luau Party Supplies",N/A,CNY 122.86,,4.0,381.0,False,https://m.media-amazon.com/images/I/71UwG-DbxfL._AC_UL320_.jpg,https://m.media-amazon.com/images/I/71UwG-DbxfL._AC_SL1500_.jpg,,2026-04-14T17:57:47.320883
8,4,Organic,,149.0,B0F47J34TT,"10pcs Hawaiian Leis Bulk,Colorful Lei Tropical Flower Necklace Hawaii Hula Dance Decor for Summer Beach Pool Luau Party Birthday Decoration Favors Supplies",N/A,CNY 40.91,,4.2,377.0,False,https://m.media-amazon.com/images/I/811BK4Ug9sL._AC_UL320_.jpg,https://m.media-amazon.com/images/I/811BK4Ug9sL._AC_SL1500_.jpg,,2026-04-14T17:57:47.324055
9,4,Organic,,150.0,B0CYT7NTXZ,Bememo 6 Pcs Hello Summer Table Decorations Sign Summer Gnome Wooden Table Centerpieces Beach Hawaii Table Decor Ice Cream Colorful Table Topper Sign for Summer Pool Tropical Party Supplies,N/A,CNY 81.88,,4.3,22.0,False,https://m.media-amazon.com/images/I/71ML03K825L._AC_UL320_.jpg,https://m.media-amazon.com/images/I/71ML03K825L._AC_SL1500_.jpg,,2026-04-14T17:57:47.329059
10,4,Organic,,151.0,B0F5Q38FGC,"Moon Boat 60Pcs Hawaiian Luau Paper Glasses for Adults Bulk, Summer Beach Party Photo Props Hawaii Tiki Tropical Pool Sunglasses Decorations Supplies",N/A,CNY 95.54,,4.5,8.0,False,https://m.media-amazon.com/images/I/91ULW1zAZmL._AC_UL320_.jpg,https://m.media-amazon.com/images/I/91ULW1zAZmL._AC_SL1500_.jpg,,2026-04-14T17:57:47.332157
11,4,Organic,,152.0,B0C37DC8TH,Hello Summer Burlap Banner with Sunshine Signs and Bows Rustic Bunting Garland for Camp Pool Beach Barbecue Hawaiian Summer Party Decorations,N/A,CNY 68.22,,4.5,16.0,False,https://m.media-amazon.com/images/I/61yAm08lyhL._AC_UL320_.jpg,https://m.media-amazon.com/images/I/61yAm08lyhL._AC_SL1500_.jpg,,2026-04-14T17:57:47.335693
12,4,Organic,,153.0,B0CX1N2821,"Vellibring 16 Pack 12"" Summer Inflatable Beach Balls Bulk Rainbow Swimming Pool Water Games Toys for Kids Summer Party Supplies Decorations",N/A,CNY 68.22,,4.4,501.0,False,https://m.media-amazon.com/images/I/71mzmT+5bTL._AC_UL320_.jpg,https://m.media-amazon.com/images/I/71mzmT+5bTL._AC_SL1500_.jpg,,2026-04-14T17:57:47.340700
13,4,Title,,,,More results,,,,,,False,,,,2026-04-14T17:57:47.340700
14,4,Organic,,154.0,B0DNQ88CGJ,"misaya 4 Packs Buffalo Disposable Table Cloth, 54 x 108 Inch Waterproof Plastic Tablecloth, Rectangle Red and White Checkered Table Covers for Picnic, Birthday, Party",N/A,CNY 61.33,,4.5,571.0,False,https://m.media-amazon.com/images/I/81oJu4foe0L._AC_UL320_.jpg,https://m.media-amazon.com/images/I/81oJu4foe0L._AC_SL1500_.jpg,,2026-04-14T17:57:47.347567
15,4,Organic,,155.0,B0C37DM7XL,Hello Summer Burlap Banner with Sunshine Rustic Bunting Garland for Camp Pool Beach Barbecue Hawaiian Summer Party Decorations,N/A,CNY 68.22,,4.7,17.0,False,https://m.media-amazon.com/images/I/61-IM5CfVdL._AC_UL320_.jpg,https://m.media-amazon.com/images/I/61-IM5CfVdL._AC_SL1500_.jpg,,2026-04-14T17:57:47.351069
