data_index,page,ad_type,ad_rank,organic_rank,asin,title,url,price_current,price_list,rating_stars,rating_count,is_prime,image_small,image_large,brand_name,scraped_at
28,5,Organic,,213.0,B0G8DLLCN8,"50PCS Reusable Drinking Straws for Summer Beach Pool Birthday Party Supplies Decorations - ExtraThick Hard Blue Striped Plastic Straw for Holiday Tropical Luau Theme Party Favors Decor,Dishwasher Safe",N/A,CNY 61.39,,4.9,29.0,False,https://m.media-amazon.com/images/I/71Z3d-RHIQL._AC_UL320_.jpg,https://m.media-amazon.com/images/I/71Z3d-RHIQL._AC_SL1500_.jpg,,2026-04-14T17:58:04.272607
29,5,Organic,,214.0,B0C365NK7D,"Guzon Yellow Green White Pennant Banner, 3 Pack Paper Triangle Flags Spring Summer Hanging Paper Streamers Banner for Lemonade Birthday Wedding Engagement Baby Shower Tea Party",N/A,CNY 109.20,,4.4,12.0,False,https://m.media-amazon.com/images/I/61iVo8TFp4L._AC_UL320_.jpg,https://m.media-amazon.com/images/I/61iVo8TFp4L._AC_SL1500_.jpg,,2026-04-14T17:58:04.276121
30,5,Organic,,215.0,B01JGQF40Y,"250pcs Multicolor Pennant Flags,LOOBJOYGAME 263Ft Nylon Fabric Decorations Grand Opening Banner Rope",N/A,CNY 88.71,,4.6,2041.0,False,https://m.media-amazon.com/images/I/61drJej456L._AC_UL320_.jpg,https://m.media-amazon.com/images/I/61drJej456L._AC_SL1500_.jpg,,2026-04-14T17:58:04.280122
31,5,Organic,,216.0,B0FTZK9DC3,"xo, Fetti Pink, Orange + Green Balloon Pack – 24 Latex Balloons | Summer Tropical Party, Palm Royale, Island Hawaiian Birthday Decorations, Kids Party, Beach Pool Supplies",N/A,CNY 75.05,,,,False,https://m.media-amazon.com/images/I/51RF1TIGlYL._AC_UL320_.jpg,https://m.media-amazon.com/images/I/51RF1TIGlYL._AC_SL1500_.jpg,,2026-04-14T17:58:04.285184
32,5,Organic,,217.0,B0FMJJFYRD,Seashell Birthday Party Decorations Include Balloons-Shell Cake Topper-Cupcake Toppers-Seashell Banner-Backdrop for The Summer I Turned Pretty Party Decor,N/A,CNY 136.52,,4.0,15.0,False,https://m.media-amazon.com/images/I/812yB59NcgL._AC_UL320_.jpg,https://m.media-amazon.com/images/I/812yB59NcgL._AC_SL1500_.jpg,,2026-04-14T17:58:04.289328
33,5,Organic,,218.0,B07JGSW88G,"Lvydec Wisteria Artificial Flowers Garland, 4 Pcs Total 28.8ft Artificial Wisteria Vine Silk Hanging Flower for Home Garden Outdoor Ceremony Wedding Arch Floral Decor (Pink)",N/A,CNY 170.66,,4.4,8656.0,False,https://m.media-amazon.com/images/I/8141uB-gTSL._AC_UL320_.jpg,https://m.media-amazon.com/images/I/8141uB-gTSL._AC_SL1500_.jpg,,2026-04-14T17:58:04.293351
34,5,Organic,,219.0,B07PP3ZFGP,"JOYIN 36 Packs Plastic Margarita Glasses Cups 12 oz Disposable Cinco De Mayo Fiesta Party Decoration for Fun Taco Party Supplies, Neon Cocktail Cups, Mexican Theme for Carnivals",N/A,CNY 163.83,,4.6,1857.0,False,https://m.media-amazon.com/images/I/71hKfj1VHTL._AC_UL320_.jpg,https://m.media-amazon.com/images/I/71hKfj1VHTL._AC_SL1500_.jpg,,2026-04-14T17:58:04.296356
35,5,Organic,,220.0,B08ZXMR2H1,3 Pieces Hawaii Summer Hanging Pompom Ball Garland Tropical Flamingo Pineapple Party Banner Set Aloha Banner Flamingo Flower Garland Banner for Hawaiian,N/A,CNY 81.88,,4.4,181.0,False,https://m.media-amazon.com/images/I/71YgAC5MFrS._AC_UL320_.jpg,https://m.media-amazon.com/images/I/71YgAC5MFrS._AC_SL1500_.jpg,,2026-04-14T17:58:04.300356
36,5,Organic,,221.0,B0CQPY8LR8,"AVOIN colorlife Hello Summer Floral Cat Garden Flag 12x18 Inch Double Sided Outside, Party Holiday Burlap Yard Outdoor Decoration",N/A,CNY 61.39,,4.7,218.0,False,https://m.media-amazon.com/images/I/71kLazk75mL._AC_UL320_.jpg,https://m.media-amazon.com/images/I/71kLazk75mL._AC_SL1500_.jpg,,2026-04-14T17:58:04.306891
37,5,Organic,,222.0,B0DGCKDBPB,"SCIONE 28 Pack Mini Beach Balls Bulk, 5-Inch Inflatable Rainbow Beach Balls for Kids, Ideal for Pool Toys, Beach Theme Party Decorations and Outdoor Games, Hawaiian Tropical Theme Decorations Supplies",N/A,CNY 129.62,,4.4,52.0,False,https://m.media-amazon.com/images/I/71qTXD5xFVL._AC_UL320_.jpg,https://m.media-amazon.com/images/I/71qTXD5xFVL._AC_SL1500_.jpg,,2026-04-14T17:58:04.311033
38,5,Organic,,223.0,B0B38S23F6,"Threan 50 Pcs Summer Theme Party Balloons, Pool Decorations, Flamingo Tropical Leaf Beach Ball Theme Latex Balloons with Ribbons for Summer Beach Birthday Party Favor Supplies, 12 Inches",N/A,CNY 61.39,,4.5,116.0,False,https://m.media-amazon.com/images/I/71gmy8jZI5L._AC_UL320_.jpg,https://m.media-amazon.com/images/I/71gmy8jZI5L._AC_SL1500_.jpg,,2026-04-14T17:58:04.315551
39,5,Organic,,224.0,B07WGB8BRF,"10M/32Ft Triangle Bunting Banner, 36 Pcs Cotton Fabric Flags Pennant Garlands for Birthday Party, Wedding, Baby Shower, Outdoor and Home Decorations (Pink)",N/A,CNY 110.22,,4.8,532.0,False,https://m.media-amazon.com/images/I/71CRRz3fE7L._AC_UL320_.jpg,https://m.media-amazon.com/images/I/71CRRz3fE7L._AC_SL1500_.jpg,,2026-04-14T17:58:04.319552
40,5,Organic,,225.0,B0BZR7PCN1,PartyWoo Metallic Green Balloons 50pcs 12 Inch Metallic Apple Green Latex Helium Balloons for Graduation Spring Forest Summer Wedding Engagement Baby Shower Birthday Party Decorations Green-G121,N/A,CNY 42.96,,4.5,11552.0,False,https://m.media-amazon.com/images/I/71lW5ZiVNcL._AC_UL320_.jpg,https://m.media-amazon.com/images/I/71lW5ZiVNcL._AC_SL1500_.jpg,,2026-04-14T17:58:04.325072
41,5,Organic,,226.0,B0GD1JR172,"Hawaiian Flower Crown Headbands, Artificial Pink Hawaii Orchid Floral Headpiece, Tropical Hair Accessories for Women Hula Dance Costume Summer Beach Pool Vacation Party Decorations Hair Hoop",N/A,CNY 68.22,,4.0,14.0,False,https://m.media-amazon.com/images/I/61ZcNxVEADL._AC_UL320_.jpg,https://m.media-amazon.com/images/I/61ZcNxVEADL._AC_SL1500_.jpg,,2026-04-14T17:58:04.331102
42,5,Organic,,227.0,B0BNHWH457,"Artoid Mode Hydrangea Butterfly Summer Table Runner, Seasonal Spring Holiday Kitchen Dining Table Decoration for Home Party Indoor 13x72 Inch",N/A,CNY 54.57,,4.4,233.0,False,https://m.media-amazon.com/images/I/71vQqTZoaUL._AC_UL320_.jpg,https://m.media-amazon.com/images/I/71vQqTZoaUL._AC_SL1500_.jpg,,2026-04-14T17:58:04.337108
43,5,Organic,,228.0,B0BYDQFRGM,"AVOIN colorlife Summer Bee Happy Garden Flag 12x18 Inch Double Sided Outside, Sunflower Party Holiday Burlap Yard Outdoor Decoration",N/A,CNY 47.74,,4.8,329.0,False,https://m.media-amazon.com/images/I/71S2yVm-kNL._AC_UL320_.jpg,https://m.media-amazon.com/images/I/71S2yVm-kNL._AC_SL1500_.jpg,,2026-04-14T17:58:04.344079
44,5,Organic,,229.0,B0DX5KRRVG,"50 Pcs Honey Bee Party Decoration Cups, 12 oz Clear Disposable Drinking Honey Cups, First Bee Day Theme Summer Party Decorations Favors for Home, Kitchen, Baby Shower",N/A,CNY 102.37,,4.8,152.0,False,https://m.media-amazon.com/images/I/71wOYRQfM8L._AC_UL320_.jpg,https://m.media-amazon.com/images/I/71wOYRQfM8L._AC_SL1500_.jpg,,2026-04-14T17:58:04.348626
45,5,Organic,,230.0,B0GC34JZD5,"Artoid Mode Holiday Pool Swim Ring Waterproof 210 GSM Summer Table Runner, Seasonal Kitchen Dining Table Decoration for Home Party Decor 13x72 Inch",N/A,CNY 68.22,,,,False,https://m.media-amazon.com/images/I/819J3Y6pdQL._AC_UL320_.jpg,https://m.media-amazon.com/images/I/819J3Y6pdQL._AC_SL1500_.jpg,,2026-04-14T17:58:04.352200
46,5,Organic,,231.0,B0F7H4ND5Z,"3-Tier Cupcake Stand for Beach Party Decorations - Multi-Colored Tropical Luau Pool Party Supplies, Hawaiian Themed Birthday Cake Stand for Baby Shower Wedding Decorations",N/A,CNY 88.71,,4.3,59.0,False,https://m.media-amazon.com/images/I/71o2EKBm9WL._AC_UL320_.jpg,https://m.media-amazon.com/images/I/71o2EKBm9WL._AC_SL1500_.jpg,,2026-04-14T17:58:04.355983
47,5,Organic,,232.0,B0DXN3ZHZN,"Traplace 9 Sheets Summer Window Clings, Double Sided Summer Window Clings for Glass Windows, Hello Beach Decals, Sun Watermelon Pattern Stickers for Home Office Accessories Decorations",N/A,CNY 61.39,,4.5,1667.0,False,https://m.media-amazon.com/images/I/81hmu3ipNBL._AC_UL320_.jpg,https://m.media-amazon.com/images/I/81hmu3ipNBL._AC_SL1500_.jpg,,2026-04-14T17:58:04.360982
48,5,Organic,,233.0,B0F1T15N7N,120PCS Summer Pool Party Supplies Swimming Beach Ball Themed Birthday Party Decorations Tropical Hawaii Holiday Tableware Set Plates Napkins Cups Set for 20 Guests,N/A,CNY 122.86,,4.5,153.0,False,https://m.media-amazon.com/images/I/910esUO6IgL._AC_UL320_.jpg,https://m.media-amazon.com/images/I/910esUO6IgL._AC_SL1500_.jpg,,2026-04-14T17:58:04.364020
49,5,Organic,,234.0,B0CWGDHX5D,SJOLOON Summer sea Backdrop Tropical Beach Plants Photo Backdrop Hawaiian Ocean Blue Sky Background for Theme Party Supplies Studio Props 12692(7x5FT),N/A,CNY 88.71,,4.7,327.0,False,https://m.media-amazon.com/images/I/71AkGmQCIpL._AC_UL320_.jpg,https://m.media-amazon.com/images/I/71AkGmQCIpL._AC_SL1500_.jpg,,2026-04-14T17:58:04.368071
50,5,Organic,,235.0,B0CRVF1MGN,"8.5FT 3D Lemon LED String Lights, Lemon Kitchen Decor with 10 Lemon Lights, Plug in Lemon String Lights for Birthday Kindergartens Party Home Decoration",N/A,CNY 109.20,,4.6,140.0,False,https://m.media-amazon.com/images/I/81qkvwFsb9L._AC_UL320_.jpg,https://m.media-amazon.com/images/I/81qkvwFsb9L._AC_SL1500_.jpg,,2026-04-14T17:58:04.372072
51,5,Organic,,236.0,B0CT7LJ2KW,3 Pcs Hello Sweet Summer Table Block Signs Rustic Farmhouse Wood Lemon Centerpiece Blue Yellow Green Hello Summer Decorations for Tiered Tray Decor Home Office Kitchen Mantel Shelf Indoor,N/A,CNY 102.37,,4.3,277.0,False,https://m.media-amazon.com/images/I/81uG-MpRl8L._AC_UL320_.jpg,https://m.media-amazon.com/images/I/81uG-MpRl8L._AC_SL1500_.jpg,,2026-04-14T17:58:04.375411
52,5,Organic,,237.0,B09P41CBZD,12'' Beach Ball for Kids: 14 Pack Beach Balls Bulk Inflatable Pool - Beach Balls Bulk Hawaiian Tropical Theme Party Decorations Favors Supplies,N/A,CNY 61.33,,4.4,969.0,False,https://m.media-amazon.com/images/I/51LocPnEHUL._AC_UL320_.jpg,https://m.media-amazon.com/images/I/51LocPnEHUL._AC_SL1500_.jpg,,2026-04-14T17:58:04.380551
53,5,Organic,,238.0,B0D2NS4HQF,200Pcs Boho Sun Paper Napkins First Trip Around The Sun Napkin Disposable Sunshine Cocktail Napkins for Birthday Baby Shower Party Supplies,N/A,CNY 157.00,,4.8,39.0,False,https://m.media-amazon.com/images/I/51+Ld4trFLL._AC_UL320_.jpg,https://m.media-amazon.com/images/I/51+Ld4trFLL._AC_SL1500_.jpg,,2026-04-14T17:58:04.383565
54,5,Organic,,239.0,B0BXD3WHQR,"Artoid Mode Flowers Butterfly Summer Table Runner, Seasonal Spring Kitchen Dining Table Decoration for Home Party Decor 13x60 Inch",N/A,CNY 61.39,,4.3,162.0,False,https://m.media-amazon.com/images/I/71TaReTQzvL._AC_UL320_.jpg,https://m.media-amazon.com/images/I/71TaReTQzvL._AC_SL1500_.jpg,,2026-04-14T17:58:04.391220
55,5,Organic,,240.0,B0F21TW9LP,"Denwiller 16 Pcs Ocean Pineapple Birthday Paper Gift Bags Party Decorations, Blue Ocean Jellyfish Seaweed Candy Goodie Bags with Handles for Baby Shower Summer Birthday Party Supplies",N/A,CNY 109.20,,4.8,46.0,False,https://m.media-amazon.com/images/I/81Qp4FxjfpL._AC_UL320_.jpg,https://m.media-amazon.com/images/I/81Qp4FxjfpL._AC_SL1500_.jpg,,2026-04-14T17:58:04.395064
57,5,Title,,,,Debug info copied.SponsoredAffrolling 8 Pcs Hawaiian Luau Party Decoration Tiki Totem Hanging Decora,,,,,,False,,,,2026-04-14T17:58:04.396537
58,5,Title,,,,Related searchesend of summer party decorationssummer partypool party decorationssummer party decora,,,,,,False,,,,2026-04-14T17:58:04.397544
59,5,Title,,,,Previous1...4567Next,,,,,,False,,,,2026-04-14T17:58:04.397544
60,5,SB,5.0,,,N/A,https://aax-us-east-retail-direct.amazon.com/x/c/JFcHhUsPLoApQvCtuqHcYpIAAAGdi20seQEAAAH2AQBvbm9fdHhuX2JpZDEgICBvbm9fdHhuX2ltcDIgICDP3OUZ/clv1c_ek-wBPHXLcTWXmxht59Ob8h9oB0Ri57qgZYYKsXy1RclzUyRjDSaydV5pHDPs6B910m-SP4n7NbS6QNBhnSfal_KRRxr_7MQ6QWyt3z-vUAm2WF7TW-0HjRI4vhrjGpJjkD_XxMfvlcXc1BYn8g1dZDYps98FhSIU8b6wh_O7EcZXuc2RpmNDiiJQjX5o8V9X2e80mMrHg3F_5DbHwhDn3iTj1ctJuzyAInUwKqrBIjNl3psBoVRypkJWTRFi8V04u_oQ2d9511NO_9qy8JGVKEl7WlFcdFPNrqxFy98E_8ERNsjcBqCiU4WtsLu24rUAkEkt7W0kasyGiUydSH1TTvf5M3puIC91hD_-5H3SZsx3Y3CTLvQUzCgl7Vb2oGi5sXcyJX6o3L9YpkS7o2FZ2naUclP6vPhIFlZffMFwbIyaThPJlN9xjDEi9Z5IVhQDubIpbhOPvLTrmQhUQF5sO2kaRaNECa2Ke0Lvo_tftWPGPHiM4MAZ1v1wTTA1dWdXKPuc0Dxly1Ex5h8SaKQ99ruehdpYgE8PDu5DfiUhgqY6LKJp35T1KxDBLDCXQe95shpIE8O2_OT0-c28whEmGXnwfEBqMCXEK73847Qe-egGoZ5-2BQlAWRS4chyVvBrGhAS0rSQ8iWKM3NNKkC1wD1XKuZ0c4dc2bYhAp0zzXOAe8AUzZnaJMVWnwFvrSAy6ebqrwiZp_eozukD0z-75JT18OJiWorLFip78h623e3OU2VMYepo9uMCjgc5vuOSosYmW7_kQYeyjN7k9ojVLcfPfTb5Ekj5yQJbzfEr_3vK-xobU0TjKGD699w0xvjad2RurCY-0gOwnxAEiGovTZxn4OFzVtjNaVTha2ZXnLlxaGLkv5gW04222OeGnumEgZ0rtSVKaVbO7lJQtWDHIjkL-AEH7_3cm-rT6lcKgjHlk-vuyyVCzSzI1BSQFWJopTq2m2QTFxFEl01LAPE3FHQa0tNUlneGf7ob0uYE0jlh2wSL8kpQXr2akp2tWmWixiHCSY_27glVD_8hItodlFcy9LnIELhNtl5fITRy5yuSTtQHSkonci2oSwIKMHu0tAkC9GDv6yaRZ-_ZscXGCiE7rjQlh6bS4UJ9gDtaGxagQbK3PXl0PTxeO29AFuTKDr3Pdi0INgvryWJIf0vIVtiiFn98el13SUz8GT32DoUVUe8gDgeCzmXwSqHFyxMZStoB3GwWawcbcClMlAbXbIXyenuksG8bIdhFUarVyTyTfEL-udATChgRCkzvJhkaSRFS4hrSRVamB6BmD_MP2pDsVl-_GugdmILpiZHZDGPM6b-uKkJTrpeIaNS8Sr7wiOYAorgWfFUuSinZAkMoJzwuNAxNZnbgDBtIfV-gMgeaAZHib15OzgPkwLjYxSshdSXWg969ctjovwC-CqeyHpYt-rJ6aLrlyGTwv2oRpbNQXJieM7DGuDtw_2sKJV3ESC6_EgWkuIyHqjJUMrlZqe2_ON9Q4KcIpKR-JV9p298kZdbvlwAvyzw580fMRG_m_0ml2gf4IlveVOGHTlHzRDaphjjXZIkuHlQ7q-BMkTEgx-N_oCQmExnR5F_mpwU7IPbUcegJ0ZoY2Ft0fLr9yDzmBDaRMe0IYQQJcl92ih1mIPgI5QiVp-FDEn2yQkwXW9VdB7u_GvvPoPJQPsaVLLLMVMtEJ0Y/https://www.amazon.com/stores/page/6956570F-DAF5-4795-AC42-1726A926FA0D/?_encoding=UTF8&store_ref=SB_A017845915CPB7KG2KJUE-A06766673SV040RNQ87P0&pd_rd_plhdr=t&aaxitk=593ed25cdae78151079140b4dafc652e&hsa_cr_id=0&lp_asins=B0DDH82BQW%2CB0CZ3LWF46%2CB0CKHGHL7Y&lp_query=summer%20party%20decorations&lp_slot=desktop-hsa-3psl&ref_=sbx_be_s_3psl_mbd_mb0_bkgd&pd_rd_w=TwLDU&content-id=amzn1.sym.cd7c548b-a599-426f-9ffe-daa1aa803c87%3Aamzn1.sym.cd7c548b-a599-426f-9ffe-daa1aa803c87&pf_rd_p=cd7c548b-a599-426f-9ffe-daa1aa803c87&pf_rd_r=96V8PE2P8WKESHXEMGHJ&pd_rd_wg=JN6oP&pd_rd_r=848f5e59-be0d-4dc6-9f7d-9fd1c7db4049,,,,,False,,,N/A,2026-04-14T17:58:04.402117
61,5,Title,,,,Need help?Visit the help sectionorcontact us,,,,,,False,,,,2026-04-14T17:58:04.403055
0,6,Title,,,,ResultsCheck each product page for other buying options. Price and other details may vary based on p,,,,,,False,,,,2026-04-14T17:58:20.537643
2,6,Organic,,241.0,B0D2NS4HQF,200Pcs Boho Sun Paper Napkins First Trip Around The Sun Napkin Disposable Sunshine Cocktail Napkins for Birthday Baby Shower Party Supplies,N/A,CNY 157.00,,4.8,39.0,False,https://m.media-amazon.com/images/I/51+Ld4trFLL._AC_UL320_.jpg,https://m.media-amazon.com/images/I/51+Ld4trFLL._AC_SL1500_.jpg,,2026-04-14T17:58:20.541645
3,6,Organic,,242.0,B0DLMHMNJY,"Artoid Mode Hello Sunshine Sunflower Eucalyptus Summer Table Runner, Seasonal Spring Kitchen Dining Table Decoration for Home Party Decor 13x90 Inch",N/A,CNY 81.88,,4.8,38.0,False,https://m.media-amazon.com/images/I/81VKwAU3NTL._AC_UL320_.jpg,https://m.media-amazon.com/images/I/81VKwAU3NTL._AC_SL1500_.jpg,,2026-04-14T17:58:20.550391
4,6,Organic,,243.0,B0F21TW9LP,"Denwiller 16 Pcs Ocean Pineapple Birthday Paper Gift Bags Party Decorations, Blue Ocean Jellyfish Seaweed Candy Goodie Bags with Handles for Baby Shower Summer Birthday Party Supplies",N/A,CNY 109.20,,4.8,46.0,False,https://m.media-amazon.com/images/I/81Qp4FxjfpL._AC_UL320_.jpg,https://m.media-amazon.com/images/I/81Qp4FxjfpL._AC_SL1500_.jpg,,2026-04-14T17:58:20.553904
5,6,Title,,,,More results,,,,,,False,,,,2026-04-14T17:58:20.553904
6,6,Organic,,244.0,B0BXD3WHQR,"Artoid Mode Flowers Butterfly Summer Table Runner, Seasonal Spring Kitchen Dining Table Decoration for Home Party Decor 13x60 Inch",N/A,CNY 61.39,,4.3,162.0,False,https://m.media-amazon.com/images/I/71TaReTQzvL._AC_UL320_.jpg,https://m.media-amazon.com/images/I/71TaReTQzvL._AC_SL1500_.jpg,,2026-04-14T17:58:20.562987
7,6,Organic,,245.0,B0BSJ9QWSC,"Kate Aspen Tea Party Decorations, Colorful Pastel Plates And Napkins Garden Party Supplies for Adults Bridal Showers, Baby Shower Decorations, Birthdays, 62 Pc, 16 Guests",N/A,CNY 129.69,,4.7,498.0,False,https://m.media-amazon.com/images/I/A1hZh9jYaBL._AC_UL320_.jpg,https://m.media-amazon.com/images/I/A1hZh9jYaBL._AC_SL1500_.jpg,,2026-04-14T17:58:20.567998
8,6,Organic,,246.0,B0DWS767GW,"24PCS Summer Bubble Wands for Kids - Party Favors, Goodie Bag Fillers, Pinata Stuffers, Birthday Toys, Class Prizes, Gifts for Toddlers, Boys & Girls",N/A,CNY 102.37,,3.8,18.0,False,https://m.media-amazon.com/images/I/81d1XXtF1SL._AC_UL320_.jpg,https://m.media-amazon.com/images/I/81d1XXtF1SL._AC_SL1500_.jpg,,2026-04-14T17:58:20.573690
9,6,Organic,,247.0,B0CMV79VHC,"xo, Fetti Gingham Checkered Washable Tablecloth - 9ft. | Camp Bachelorette Party Supplies, Getting Lit + Getting Hitched, Glamping Birthday Party Decorations, Pastel Baby Shower, Cute Tableware",N/A,CNY 122.86,,4.8,47.0,False,https://m.media-amazon.com/images/I/71qcunsrjwL._AC_UL320_.jpg,https://m.media-amazon.com/images/I/71qcunsrjwL._AC_SL1500_.jpg,,2026-04-14T17:58:20.577311
10,6,Organic,,248.0,B0D874BKF9,Hushee 60 Pcs Boho Floral Cups with Spring Summer Flower 16 oz Wildflowers Plastic Disposable Drinking Cups for Summer Spring Autumn Birthday Baby Shower Party Supplies,N/A,CNY 204.81,,4.8,142.0,False,https://m.media-amazon.com/images/I/815Zuq6-KjL._AC_UL320_.jpg,https://m.media-amazon.com/images/I/815Zuq6-KjL._AC_SL1500_.jpg,,2026-04-14T17:58:20.581821
11,6,Organic,,249.0,B012FMY4H0,"Fun Express Limbo Game for Kids and Adults - 5 Feet Tall Adjustable Carnival Games Set for Birthday Party Games | Outdoor Games for Pool Party, Luau Games & Field Day Activities | 3-Piece Vinyl Kit",N/A,CNY 160.42,,3.7,448.0,False,https://m.media-amazon.com/images/I/71MQZHr8JFL._AC_UL320_.jpg,https://m.media-amazon.com/images/I/71MQZHr8JFL._AC_SL1500_.jpg,,2026-04-14T17:58:20.585766
12,6,Title,,,,More results,,,,,,False,,,,2026-04-14T17:58:20.586733
13,6,Organic,,250.0,B0C936QPTS,"FreshDear 6 Counts Hawaiian Leis Bulk,leis for luau party,hawaiian leis for adults,beach party favors for adults,Summer Beach Vacation,Theme Party Decorations",N/A,CNY 51.83,,4.5,468.0,False,https://m.media-amazon.com/images/I/71+MQO2IASL._AC_UL320_.jpg,https://m.media-amazon.com/images/I/71+MQO2IASL._AC_SL1500_.jpg,,2026-04-14T17:58:20.591821
14,6,Organic,,251.0,B07HQ4GCCV,"Ocean Line Luau Party Sunglasses - 9 Pairs Funny Hawaiian Glasses, Tropical Fancy Dress Props, Fun Summer Kids Party Favors, Beach Themed Party Supplies Decoration",N/A,CNY 136.45,,4.7,2161.0,False,https://m.media-amazon.com/images/I/71ugXRbXMFL._AC_UL320_.jpg,https://m.media-amazon.com/images/I/71ugXRbXMFL._AC_SL1500_.jpg,,2026-04-14T17:58:20.595093
15,6,Organic,,252.0,B0GJPT736C,"155Pcs Beach Party Supplies Plates Napkins Set Includes Summer Plates Napkins Cups Tablecloth Swirls Banner Tableware Kit Beach Hawaiian Pool Birthday Decorations Favors for Kids, Serve 20",N/A,CNY 136.52,,,,False,https://m.media-amazon.com/images/I/81XL4AC+DlL._AC_UL320_.jpg,https://m.media-amazon.com/images/I/81XL4AC+DlL._AC_SL1500_.jpg,,2026-04-14T17:58:20.599328
16,6,Organic,,253.0,B07BBK9913,TecUnite 2 Pack Inflatable Palm Trees 35 Inch Jumbo Coconut Trees Beach Backdrop Favor for Summer Beach Hawaiian Tropical Birthday Backyard Pool Luau Party Decoration Photo Booth Prop Accessory,N/A,CNY 95.54,,3.9,646.0,False,https://m.media-amazon.com/images/I/71c4uw8bBmL._AC_UL320_.jpg,https://m.media-amazon.com/images/I/71c4uw8bBmL._AC_SL1500_.jpg,,2026-04-14T17:58:20.604844
17,6,Organic,,254.0,B09Q6B3KN2,"KatchOn, Large Tropical Birds Honeycomb Cutouts - 9x7.7 Inch | Paper Bird Decorations, Luau Party Decorations, Hawaiian Party Decorations, Rainforest Decor, Tiki Party",N/A,CNY 95.54,,4.6,842.0,False,https://m.media-amazon.com/images/I/81maqEPUH0L._AC_UL320_.jpg,https://m.media-amazon.com/images/I/81maqEPUH0L._AC_SL1500_.jpg,,2026-04-14T17:58:20.609471
18,6,Organic,,255.0,B0DX23T2W1,"50Pcs Beach Pool Party Decoration Cups, 12 Oz Summer Disposable Cups for Summer Beach Pool Hawaiian Luau Birthday Party Decoration Supplies",N/A,CNY 68.22,,4.8,152.0,False,https://m.media-amazon.com/images/I/712bBwgcoDL._AC_UL320_.jpg,https://m.media-amazon.com/images/I/712bBwgcoDL._AC_SL1500_.jpg,,2026-04-14T17:58:20.613488
19,6,Organic,,256.0,B0DX72MCCG,"12Pcs Blue Paper Lanterns Set, Blue White Mint Green Hanging Round Paper Lanterns in Assorted Sizes 6"" 8"" 10"" 12"", for Graduation, Wedding, Birthday, Baby Shower and Coastal Party Decorations",N/A,CNY 101.62,,4.8,228.0,False,https://m.media-amazon.com/images/I/81uOrXZv8GL._AC_UL320_.jpg,https://m.media-amazon.com/images/I/81uOrXZv8GL._AC_SL1500_.jpg,,2026-04-14T17:58:20.617500
20,6,Organic,,257.0,B0GMQ84KMG,"4 Pack Beach Plastic Tablecloth Party Decorations, Disposable Summer Pool Table Cloth, Waterproof Tropical Surfboard Table Cover for Summer Hawaiian Theme Birthday Party Supplies",N/A,CNY 68.22,,5.0,1.0,False,https://m.media-amazon.com/images/I/718ZyTON4KL._AC_UL320_.jpg,https://m.media-amazon.com/images/I/718ZyTON4KL._AC_SL1500_.jpg,,2026-04-14T17:58:20.620483
21,6,Organic,,258.0,B087TB1DKW,"GoodUping 6 Count Thickened Hawaiian Leis, Perfect Luau Party Supplies for Summer Beach Vacations, Essential Party Decorations for Birthday, Graduation, and Wedding Celebrations",N/A,CNY 54.57,,4.4,355.0,False,https://m.media-amazon.com/images/I/81j5YoL856L._AC_UL320_.jpg,https://m.media-amazon.com/images/I/81j5YoL856L._AC_SL1500_.jpg,,2026-04-14T17:58:20.624991
22,6,Organic,,259.0,B0D4DQQ8SW,"Luau Party Decorations, Natural Hawaiian Grass Table Skirt, Flower 108 X 29.5"" Grass Skirts Tropical Luau Party Favors, Table Skirt for Luau Summer Tropical Indoor Outdoor Parties Decor Accessories",N/A,CNY 61.39,,4.5,709.0,False,https://m.media-amazon.com/images/I/81-9j7gt+mL._AC_UL320_.jpg,https://m.media-amazon.com/images/I/81-9j7gt+mL._AC_SL1500_.jpg,,2026-04-14T17:58:20.629007
23,6,Organic,,260.0,B0BZ7T7J6S,Kacctyen 12 Pcs Pool Beach Drawstring Bags Summer Drawstring Backpack Beach Ball String Birthday Bag Pool Party Decoration (Classic),N/A,CNY 88.71,,4.5,172.0,False,https://m.media-amazon.com/images/I/81SXAL235VL._AC_UL320_.jpg,https://m.media-amazon.com/images/I/81SXAL235VL._AC_SL1500_.jpg,,2026-04-14T17:58:20.633140
24,6,Organic,,261.0,B0BZCTN5RR,Hello Summer Cutouts 72 Pack Pool Beach Hawaiian Theme Cut Outs Summertime Bulletin Board Decoration Watermelon Spring Summer Tropical Office Decorations Palm School Teacher Supplies for Classroom,N/A,CNY 88.71,,4.7,111.0,False,https://m.media-amazon.com/images/I/811GDT8jifL._AC_UL320_.jpg,https://m.media-amazon.com/images/I/811GDT8jifL._AC_SL1500_.jpg,,2026-04-14T17:58:20.638142
25,6,Organic,,262.0,B0DQYSWJKW,"Bonjour Fête Strawberry Large Paper Napkins | 3-Ply Scalloped Lunch Napkins for Summer Parties, BBQ & Baby Showers | Premium Disposable Tableware | Pack of 20, 6.5"" Folded",N/A,CNY 68.22,,4.8,9.0,False,https://m.media-amazon.com/images/I/71lnV7pXFML._AC_UL320_.jpg,https://m.media-amazon.com/images/I/71lnV7pXFML._AC_SL1500_.jpg,,2026-04-14T17:58:20.642822
26,6,Organic,,263.0,B0CVX6PTVB,Libima 2 Pcs Inflatable Palm Trees 52 Inch Giant Blow up Palm Tree Hawaiian Party Decorations Tropical Trees for Kids Adults Hawaiian Luau Beach Summer Theme Party Decorations Photo Prop Decor,N/A,CNY 88.71,,4.3,261.0,False,https://m.media-amazon.com/images/I/81pbjosTyvL._AC_UL320_.jpg,https://m.media-amazon.com/images/I/81pbjosTyvL._AC_SL1500_.jpg,,2026-04-14T17:58:20.646330
27,6,Organic,,264.0,B0D61416DG,"4E's Novelty Inflatable Limbo Game for Kids Adults 62"" Luau Party Game, Indoor Outdoor Inflatable Lawn Yard Games, Summer Hawaiian Birthday Activity Carnival Game",N/A,CNY 204.81,,3.2,144.0,False,https://m.media-amazon.com/images/I/619Yz5llksL._AC_UL320_.jpg,https://m.media-amazon.com/images/I/619Yz5llksL._AC_SL1500_.jpg,,2026-04-14T17:58:20.651871
28,6,Organic,,265.0,B0CXDSHK5G,"Pool Party Birthday Decorations, Happy Birthday Pool Party Banner Backdrop Decorations, Summer Birthday Party Decorations Swimming Pool Party Decorations for Hawaiian Flamingo Party",N/A,CNY 68.22,,4.6,32.0,False,https://m.media-amazon.com/images/I/71Q+AxPf71L._AC_UL320_.jpg,https://m.media-amazon.com/images/I/71Q+AxPf71L._AC_SL1500_.jpg,,2026-04-14T17:58:20.654907
29,6,Organic,,266.0,B0D1MYQJ4Z,"CMUSKO Ocean Waves Tablecloth, 3Pcs Summer Beach Pool Party Decorations Tablecloth Plastic Beach Ocean Water Print Table Cover for Hawaiian Party Birthday Supplies 54X108inch",N/A,CNY 68.22,,4.6,98.0,False,https://m.media-amazon.com/images/I/81cCnx9NpYL._AC_UL320_.jpg,https://m.media-amazon.com/images/I/81cCnx9NpYL._AC_SL1500_.jpg,,2026-04-14T17:58:20.658413
30,6,Organic,,267.0,B0CYBWMR83,"Summer Party Decorations, Hello Summer Banner Hanging Swirls and Honeycomb Centerpieces Beach Pool Party Decorations, Summer Pool Holiday Birthday Party Supplies",N/A,CNY 54.57,,4.8,12.0,False,https://m.media-amazon.com/images/I/61PGCbFgpLL._AC_UL320_.jpg,https://m.media-amazon.com/images/I/61PGCbFgpLL._AC_SL1500_.jpg,,2026-04-14T17:58:20.662672
31,6,Organic,,268.0,B0D5B81HHH,Summer Pool Beach Party Decorations Tropical Balloon Garland Arch Kit with Explosion Star and ‘SPLASH’ Foil Balloon for Tropical Hawaii Birthday Baby Shower Party Decorations,N/A,CNY 88.71,,4.2,24.0,False,https://m.media-amazon.com/images/I/81F0hz+xd5L._AC_UL320_.jpg,https://m.media-amazon.com/images/I/81F0hz+xd5L._AC_SL1500_.jpg,,2026-04-14T17:58:20.667284
32,6,Organic,,269.0,B0CYC5SH26,"Hello Summer Party Decorations Extra Large Size Beach Banner for Summer Party Decorations Supplies, 118 x 20 inch",N/A,CNY 68.22,,4.7,26.0,False,https://m.media-amazon.com/images/I/71LkpSh-mIL._AC_UL320_.jpg,https://m.media-amazon.com/images/I/71LkpSh-mIL._AC_SL1500_.jpg,,2026-04-14T17:58:20.670295
33,6,Organic,,270.0,B09MLWRTY2,KAWKALSH Rainbow Balloon Arch Kit 111Pcs 18 12 5 Inch Latex Colorful Party Balloons Garland for Birthday Baby Shower Wedding Engagement Anniversary Christmas Party Decorations,N/A,CNY 68.22,,4.4,3580.0,False,https://m.media-amazon.com/images/I/71IdwYTmIlL._AC_UL320_.jpg,https://m.media-amazon.com/images/I/71IdwYTmIlL._AC_SL1500_.jpg,,2026-04-14T17:58:20.674966
