data_index,page,ad_type,ad_rank,organic_rank,asin,title,url,price_current,price_list,rating_stars,rating_count,is_prime,image_small,image_large,brand_name,scraped_at
75,1,SB,1.0,,,N/A,https://aax-us-east-retail-direct.amazon.com/x/c/JMNYQ01fJQvIkb97OiSJjrYAAAGdi2wtuAEAAAH2AQBvbm9fdHhuX2JpZDUgICBvbm9fdHhuX2ltcDEgICAXfea4/clv1c_ek-wBPHXLcTWXmxht59ObyiuCw57KhkpB7GzThWgt6SmzZpTjSwuDl9AFsUzoddVchid8wwk33CjPUAxBWmdlivd99s1TsDK6cxfucPFUN10gRcZMBCLTG31gkkVZsY8WlD5KYG_yMbpE6BnR5sGvkDap8nU1lUJUod0ygOYnCacWDixUlpCDMUSGhmcngn8BpI54lJ_l7eoFYK_sE60ofiPBFt7QMv2CMb05WuiEg4xk1_NArFZwWUZ1APfRoE2y6L8kfppZF3r00efI-do5bKz9Sc_krZoNuESVMJsXQH6z9VcrD1i-_hmGhId-hhu-oJaEvRNIV6ESB0s5h-d0H-DmGef6bRCLQHVUNGNErxiPLOaO--CQKLrqUNd7swSw0svJCd_QJXgn9iQNrjrkfuSqZGaWc6Y4p1kPyAOfGO3ubZBQ0ribmsv2VfMc2TKImJN56I2GigDN5409ErjOSy5mmMsJURYqousdzC63EL4_UNyNwwRxunA2h5UkuTHD5gvlpAIxITFcym5Nd-ESAQcl0mq57CVfu5FSdKpC5M-M5Q_fTC1h01uU3mzPQYdQahrIEcOW_KTM-R244jJFGMP1JrJqgT2Udm2kP9EdprW57Zku-6K1hbcwCPQcIj2YiqB4JN8gaDorQGOv3pQsdu6UMlAZb4EZbw9ZDMPDkExxx8feOJc-WLj7-48DThBcL2uqHWQ0ChzKGhBmAsbXWIJ5B4S0atQLrDwmQ5M1RoXWhOHF4x8v3UunpP6qucra6P4MfVZlTayywFF3efRcfUWtTvPJ6aTgpPZtJBTNNFgQNUPv99GcUheqnx9_2s9tyvXBchCLWoGcDpPvbFT69kUaqjp8qy7Da1sMJN0kIui0131pNch4DCCmCe-GhSm0ADT9wQjnz1R0GhSMiH9AR0EkjCntAoWFZ5k6E4bOvGP3ZJFghH5DOjZMujgbiB8JG1ZvYTjbbKS7GZVJAfE3KheRs6KMRid8db_O8V0eJHLISCHsiwpIpfE24SMvvdzLQlseeR81IR_qX4xUViDq2OWu_mP9kHNKRCiZwjzGdAFJihI_wAACwwBIZOeqrhoh8uYPk26R42AVmid5AlXRMC6UsTBS653Ocr0BsWRD33PAtOjsXVFb4-mTLwQDGFsSGFEs-wu9VrYetS79zRLh4S93uTZgBEqWqJC0XntP2ykzKAwLnbyvAlSxELX1zItAPJVDfom3CCFS76mkdPvSnjpyaIsWwXLEVxCf8py6ubWYlz2KzSdEdRfaoOHEhF14fuBLnU8VIoYd-FpLJSCFgkx7mMNjIubDEpi_M8KgdGSpnxkg3Awje7UCQttgvl8GExA2GgyHsAWqkP0TbbHIqozSyx0jcTFCAhXJACYkidXqG5hcSBhz7wcOHM-O4jaLMkkZMhEP-FtRsJHuIWgiEchPigQSrfKrFoP5C8AAjYFpn8yDd9FUm7l4UTmaJYX27zo2dvXXiVrjqISsgVGAh_2rezFOXHdvmVMI0BdVmDFpPMy7blngO6V2N1kfOB_3MsiQS6rtBXOtWgekALDztlHszhwm4y96MlBcxEn6dAC8LkOxHbYrRHYz2fnsFe-tyJz7Cq-nl6hSUYWsMnc1kva4lymI6i_mAHw6-lx3t3l4MM1Sq8uppNNP8KVYDALJr1HvLY4bo1Mji3NOQZ58pIVZrpMtle-oQ/https://www.amazon.com/stores/page/6956570F-DAF5-4795-AC42-1726A926FA0D/?_encoding=UTF8&store_ref=SB_A017845915CPB7KG2KJUE-A06766673SV040RNQ87P0&pd_rd_plhdr=t&aaxitk=593ed25cdae78151079140b4dafc652e&hsa_cr_id=0&lp_asins=B0DDH82BQW%2CB0CZ3LWF46%2CB0CKHGHL7Y&lp_query=summer%20party%20decorations&lp_slot=desktop-hsa-3psl&ref_=sbx_be_s_3psl_mbd_mb0_bkgd&pd_rd_w=KiPFS&content-id=amzn1.sym.cd7c548b-a599-426f-9ffe-daa1aa803c87%3Aamzn1.sym.cd7c548b-a599-426f-9ffe-daa1aa803c87&pf_rd_p=cd7c548b-a599-426f-9ffe-daa1aa803c87&pf_rd_r=BVHAGZACX6ZGNC8ZM97B&pd_rd_wg=8Dhec&pd_rd_r=1e832ea1-ee2d-4b06-b7bb-aaeb42dcd97a,,,,,False,,,N/A,2026-04-14T17:56:59.171598
76,1,Title,,,,Need help?Visit the help sectionorcontact us,,,,,,False,,,,2026-04-14T17:56:59.172601
0,2,Title,,,,ResultsCheck each product page for other buying options. Price and other details may vary based on p,,,,,,False,,,,2026-04-14T17:57:13.039370
2,2,Organic,,49.0,B09NN5WTZ5,Spakon 9 Pieces Tropical Birds Honeycomb Paper Cutouts Rio Luau Party Hanging Decorations Rainforest Hanging Paper Birds Hawaiian Parrot Honeycomb Cutouts for Luau Party Decor,N/A,CNY 81.88,,4.6,407.0,False,https://m.media-amazon.com/images/I/81DGOJ7+vDL._AC_UL320_.jpg,https://m.media-amazon.com/images/I/81DGOJ7+vDL._AC_SL1500_.jpg,,2026-04-14T17:57:13.043875
3,2,Organic,,50.0,B0BXN5ZXK3,"Atonofun Beach Party Supplies, Beach Plates and Napkins Set, Disposable Beach Plates, Cups, Napkins and Cutlery for Birthday, Pool, Summer Party, Baby Shower, Beach Themed Party Decorations Serves 24",N/A,CNY 122.86,,4.6,121.0,False,https://m.media-amazon.com/images/I/81i4hJ+qhSL._AC_UL320_.jpg,https://m.media-amazon.com/images/I/81i4hJ+qhSL._AC_SL1500_.jpg,,2026-04-14T17:57:13.047892
4,2,Organic,,51.0,B0CWQZNHVK,Summer Party Decorations Hello Summer Banner Hanging Swirls and Honeycomb Centerpieces Beach Pool Decorations for Pool Holiday Birthday Party Supplies,N/A,CNY 68.22,,4.7,19.0,False,https://m.media-amazon.com/images/I/812VyJjaHxL._AC_UL320_.jpg,https://m.media-amazon.com/images/I/812VyJjaHxL._AC_SL1500_.jpg,,2026-04-14T17:57:13.051896
5,2,Title,,,,"4E's Novelty Inflatable Limbo Game for Kids Adults 62"" Luau Party Game, Indoor Outdoor Inflatable La",,,,,,False,,,,2026-04-14T17:57:13.052897
6,2,Title,,,,More results,,,,,,False,,,,2026-04-14T17:57:13.052897
7,2,Organic,,52.0,B0D298R6F3,Summer Birthday Party Decorations - Beach Party Pool Decor 10PCS Hanging Swirl Banner Flip Flop Slippers Swirls Summer Birthday Hawaiian Supplies for Holiday Celebration Outdoor,N/A,CNY 68.22,,4.5,46.0,False,https://m.media-amazon.com/images/I/81S+FcCVIcL._AC_UL320_.jpg,https://m.media-amazon.com/images/I/81S+FcCVIcL._AC_SL1500_.jpg,,2026-04-14T17:57:13.056414
8,2,Organic,,53.0,B0DXN9X28C,"2 Pack Luau Decorations, 3.28 FT x 7.05 FT Summer Party Streamer, Green Brown Yellow Backdrop Tinsel Curtains Fringe Curtains, Metallic Hawaiian Supplies Aloha Party Decor",N/A,CNY 47.67,,4.5,2994.0,False,https://m.media-amazon.com/images/I/91++YWbYizL._AC_UL320_.jpg,https://m.media-amazon.com/images/I/91++YWbYizL._AC_SL1500_.jpg,,2026-04-14T17:57:13.060429
9,2,Organic,,54.0,B0BKTQ9JLP,"JOYIN 120 Counts Hawaiian Leis Bulk, Colorful Tropical Flower Leis for Kids Adults Hawaiian Beach Luau Party Favors Decorations",N/A,CNY 177.49,,4.6,10884.0,False,https://m.media-amazon.com/images/I/911aTPl1DwL._AC_UL320_.jpg,https://m.media-amazon.com/images/I/911aTPl1DwL._AC_SL1500_.jpg,,2026-04-14T17:57:13.066456
10,2,Organic,,55.0,B0DTPZ743W,Summer Party Decorations Hello Summer Banner Beach Hanging Swirls Streamers Beach Pool Theme Decorations for Home School Classroom Office Pool Holiday Party Supplies,N/A,CNY 81.88,,4.4,18.0,False,https://m.media-amazon.com/images/I/81PV7tdUOUL._AC_UL320_.jpg,https://m.media-amazon.com/images/I/81PV7tdUOUL._AC_SL1500_.jpg,,2026-04-14T17:57:13.070194
11,2,Organic,,56.0,B0CTQ46C5H,32Pcs Cinco De Mayo Decorations Fiesta Party Decorations Multi-Color Paper Fans Garlands Pennant Pom Poms Hanging Swirls for Birthday Wedding Rainbow Mexican Party,N/A,CNY 81.20,,4.6,362.0,False,https://m.media-amazon.com/images/I/811ElpXuZmL._AC_UL320_.jpg,https://m.media-amazon.com/images/I/811ElpXuZmL._AC_SL1500_.jpg,,2026-04-14T17:57:13.073114
12,2,Organic,,57.0,B0GMQ1CN4F,"Beach Party Supplies Serve 24, Summer Beach Party Decorations Include Hello Summer Party Plates, Napkins,Cups,Tablecloth,Banner,Balloons and Cake Toppers for Hawaiian Pool Birthday Baby Shower Decor",N/A,CNY 143.35,,,,False,https://m.media-amazon.com/images/I/81zN2pF3aNL._AC_UL320_.jpg,https://m.media-amazon.com/images/I/81zN2pF3aNL._AC_SL1500_.jpg,,2026-04-14T17:57:13.078234
13,2,Title,,,,Under The Sea Party DecorationsSponsored|Shop yorrShop nowPrevious pageUnder The Sea Party Decoratio,,,,,,False,,,,2026-04-14T17:57:13.079254
14,2,Title,,,,More results,,,,,,False,,,,2026-04-14T17:57:13.079254
15,2,Organic,,58.0,B0F7QXP2WY,"Cute Hawaiian Party Decoration Lights - Mini LED Flamingo Pineapple Palm Tree Cacti Signs, Summer Tropical-themed Birthday Party Table Centerpieces Lamps Decor",N/A,CNY 102.37,,4.7,10.0,False,https://m.media-amazon.com/images/I/715-yAuwcfL._AC_UL320_.jpg,https://m.media-amazon.com/images/I/715-yAuwcfL._AC_SL1500_.jpg,,2026-04-14T17:57:13.083260
16,2,Organic,,59.0,B0CR6SVS6X,"50pcs Hawaiian Leis Decorations, Hawaiian Leis Bulk Flower Necklaces Luau Party Decor, Colorful Hula Dance Celebration Tropical Summer Beach Pool Parties, Hawaiian Flower Leis for Party Favors Decor",N/A,CNY 136.52,,4.5,2697.0,False,https://m.media-amazon.com/images/I/9146S2M6KEL._AC_UL320_.jpg,https://m.media-amazon.com/images/I/9146S2M6KEL._AC_SL1500_.jpg,,2026-04-14T17:57:13.088272
17,2,Organic,,60.0,B0D2TQF1SQ,"JCFIRE Summer Pool Beach Party Favors Kids Tattoos, 102 Styles Larger Tropical Hawaiian Luau Themed Temporary Tattoos for Kids Teens Adult, Waterproof Summer Stickers Party Decorations Supplies",N/A,CNY 40.91,,4.7,922.0,False,https://m.media-amazon.com/images/I/71KUi4pTJkL._AC_UL320_.jpg,https://m.media-amazon.com/images/I/71KUi4pTJkL._AC_SL1500_.jpg,,2026-04-14T17:57:13.091284
18,2,Organic,,61.0,B0DTJFLHHD,"Pool Party Favors and Beach Party Favors,158PCS Summer Pool Toys for Kids, Undersea theme decoration, Including Beach Balls, Sunglasses, Bubble Wands, Stamp and Crystal Shells for Kids Ages 4-8 8-12",N/A,CNY 170.73,,4.6,198.0,False,https://m.media-amazon.com/images/I/81TrxJeWztL._AC_UL320_.jpg,https://m.media-amazon.com/images/I/81TrxJeWztL._AC_SL1500_.jpg,,2026-04-14T17:57:13.097088
19,2,Organic,,62.0,B0G7X1P64Y,16Pcs Summer Party Decorations Paper Lanterns Pom Poms Hanging Swirls - Luau Beach Pool Hawaiian Tropical Hanging Decor for Home Birthday Outdoor Indoor,N/A,CNY 109.20,,4.9,16.0,False,https://m.media-amazon.com/images/I/81X2FLgG9rL._AC_UL320_.jpg,https://m.media-amazon.com/images/I/81X2FLgG9rL._AC_SL1500_.jpg,,2026-04-14T17:57:13.099901
20,2,Organic,,63.0,B0GH6WXVTT,YTHETM Hawaiian Luau Birthday Party Decorations Glittery Pink Happy Birthday Banner for Tropical Party Decorations Summer Birthday Party Decor,N/A,CNY 95.54,,5.0,11.0,False,https://m.media-amazon.com/images/I/91LFHlNnIaL._AC_UL320_.jpg,https://m.media-amazon.com/images/I/91LFHlNnIaL._AC_SL1500_.jpg,,2026-04-14T17:57:13.104411
21,2,Organic,,64.0,B0DVTBP3ZH,"xo, Fetti Pool Party Paper Plates, 3 Designs | 24 pcs 9"" | Kids Decorations, Summer Birthday Decor, Stripe Tablescape, Colorful Table Setting",N/A,CNY 95.54,,4.6,8.0,False,https://m.media-amazon.com/images/I/61ZUcHaHT8L._AC_UL320_.jpg,https://m.media-amazon.com/images/I/61ZUcHaHT8L._AC_SL1500_.jpg,,2026-04-14T17:57:13.107423
22,2,Organic,,65.0,B0DS1SYB42,"Luau Party Decorations, 36PCS Hawaiian Themed Leis Necklace Costume Accessories, Colorful Hawaiian Leis Tropical Flower Clothing Bulk",N/A,CNY 68.22,,4.5,238.0,False,https://m.media-amazon.com/images/I/8196+Nb-nrL._AC_UL320_.jpg,https://m.media-amazon.com/images/I/8196+Nb-nrL._AC_SL1500_.jpg,,2026-04-14T17:57:13.111531
23,2,Organic,,66.0,B0DLB3QP6M,"12 Pack 8 Inch Beach Ball Paper Lanterns - Summer Classroom Decorations & Pool Party Hanging Decor, Reusable Hawaiian Luau, Ocean Theme Birthday & Beach Party Supplies for Indoor Outdoor",N/A,CNY 102.37,,4.9,27.0,False,https://m.media-amazon.com/images/I/81U-nIczqYL._AC_UL320_.jpg,https://m.media-amazon.com/images/I/81U-nIczqYL._AC_SL1500_.jpg,,2026-04-14T17:57:13.116043
24,2,Organic,,67.0,B0FZGTSPZM,Renbuzhu 15Pcs Summer Party Decorations Watermelon Paper Lanterns Pom Poms Hanging Swirls Pool Beach Luau Tropical Birthday Hanging Decor Indoor Outdoor,N/A,CNY 102.37,,5.0,1.0,False,https://m.media-amazon.com/images/I/81IcRicZ62L._AC_UL320_.jpg,https://m.media-amazon.com/images/I/81IcRicZ62L._AC_SL1500_.jpg,,2026-04-14T17:57:13.119550
25,2,Organic,,68.0,B0FZLZN5CP,"xo, Fetti Pool Party Birthday Banner | Kids Party Decorations, Tropical Summer, Hawaiian Luau, Flamingo, Pink Glitter, Happy Birthday Garland",N/A,CNY 75.05,,5.0,2.0,False,https://m.media-amazon.com/images/I/61YeRAYAw9L._AC_UL320_.jpg,https://m.media-amazon.com/images/I/61YeRAYAw9L._AC_SL1500_.jpg,,2026-04-14T17:57:13.123565
26,2,Organic,,69.0,B09QM5XX82,"Uieke 3 Pack Artificial Sunflower Garland, 7.5ft/Strand Silk Sunflowers Hanging Vines Flowers with Green Leaves for Room Kitchen Garden Birthday Wedding Baby Shower Party Table Decor Large",N/A,,,4.4,1389.0,False,https://m.media-amazon.com/images/I/81qgOQNv7KL._AC_UL320_.jpg,https://m.media-amazon.com/images/I/81qgOQNv7KL._AC_SL1500_.jpg,,2026-04-14T17:57:13.131865
27,2,Organic,,70.0,B0CZQP2PSJ,"12 Pack Summer Can Cooler Sleeve Insulated Neoprene Can Coolers in Bulk, Beach Pool Bottle Can Drink Holder Party Decorations, Men Women Birthday Bachelorette Party Favor Gifts",N/A,CNY 68.16,,4.4,171.0,False,https://m.media-amazon.com/images/I/81Y2vnYdXIL._AC_UL320_.jpg,https://m.media-amazon.com/images/I/81Y2vnYdXIL._AC_SL1500_.jpg,,2026-04-14T17:57:13.136379
28,2,Organic,,71.0,B0BLVJV2YG,"LEEZZIZZ 30Pcs Punch Balloons, Thickened Neon Punching Balloon Heavy Duty Party Favors for Kids with Rubber Band Handle, Bouncy Balls for Birthday Weddings Goodie Bag Stuffer Supply",N/A,CNY 60.64,,4.6,3531.0,False,https://m.media-amazon.com/images/I/61o0vAZMh0L._AC_UL320_.jpg,https://m.media-amazon.com/images/I/61o0vAZMh0L._AC_SL1500_.jpg,,2026-04-14T17:57:13.140387
29,2,Organic,,72.0,B0F58591L1,Oudain 2 Pack Blue Bow Starfish and Seashell Garland 6.56 ft Ocean Coastal Nautical Beach Party Paper Bow Hanging Banner for Under the Sea Summer Birthday Wedding Bachelorette Mermaid Baby Shower,N/A,CNY 51.15,,4.7,116.0,False,https://m.media-amazon.com/images/I/611IoA1u3FL._AC_UL320_.jpg,https://m.media-amazon.com/images/I/611IoA1u3FL._AC_SL1500_.jpg,,2026-04-14T17:57:13.145393
30,2,Organic,,73.0,B0F6MZMT3Q,"Schools Out for Summer Decorations, End Of School Year Party Decorations includes Schools Out for Summer Banner and Hello Summer Hanging Swirls and Honeycomb Centerpieces",N/A,CNY 81.88,,4.6,3.0,False,https://m.media-amazon.com/images/I/81aTvVtRLmL._AC_UL320_.jpg,https://m.media-amazon.com/images/I/81aTvVtRLmL._AC_SL1500_.jpg,,2026-04-14T17:57:13.148422
31,2,Organic,,74.0,B0946ZZ9BD,"Outus 30 Pieces Hawaiian Luau Birthday Party Hanging Swirl Decorations, Flower Tropical Palm Flamingo Sign Foil Ceiling Decor for Floral Tropical Party Summer Beach Pool Tiki Supplies(Summer)",N/A,CNY 60.03,,4.6,1154.0,False,https://m.media-amazon.com/images/I/81cwoPntlvL._AC_UL320_.jpg,https://m.media-amazon.com/images/I/81cwoPntlvL._AC_SL1500_.jpg,,2026-04-14T17:57:13.151946
32,2,Organic,,75.0,B0DXFNDN63,"xo, Fetti Pool Party Napkins - 3-ply, 24 pcs | Summer Cocktail Napkins, Colorful Party Setting, Kids Birthday Decoration, Fun Tablescape",N/A,CNY 88.71,,5.0,6.0,False,https://m.media-amazon.com/images/I/61UHEDYOG8L._AC_UL320_.jpg,https://m.media-amazon.com/images/I/61UHEDYOG8L._AC_SL1500_.jpg,,2026-04-14T17:57:13.157459
33,2,Organic,,76.0,B0DTHLYD5F,BlissYard Hello Summer Banner 71x43 Inches Beach Party Decorations Hawaiian Tropical Backdrop with Surfboard Ice Cream Design Summer Party Banner for Indoor Outdoor Pool Luau Decor,N/A,CNY 88.71,,4.7,13.0,False,https://m.media-amazon.com/images/I/81aESmY+81L._AC_UL320_.jpg,https://m.media-amazon.com/images/I/81aESmY+81L._AC_SL1500_.jpg,,2026-04-14T17:57:13.161011
34,2,Organic,,77.0,B07QKJ2RXS,Whaline Summer Party Decoration Set Hanging Paper Fans Pineapple and Flamingo Flower Garland Banner for Hawaiian Luau Beach Birthday Wedding Photo Backdrop,N/A,CNY 116.03,,4.7,1225.0,False,https://m.media-amazon.com/images/I/81WA-Zq-+vL._AC_UL320_.jpg,https://m.media-amazon.com/images/I/81WA-Zq-+vL._AC_SL1500_.jpg,,2026-04-14T17:57:13.164074
35,2,Organic,,78.0,B083W99RQ8,"Zcaukya Inflatable Palm Tree Cooler, 60"" Blow Up Palm Tree Cooler for Tropical Party Decorations, Hawaiian Party Supplies Pool Decorations",N/A,CNY 133.10,,4.2,1456.0,False,https://m.media-amazon.com/images/I/71YUjeio9AL._AC_UL320_.jpg,https://m.media-amazon.com/images/I/71YUjeio9AL._AC_SL1500_.jpg,,2026-04-14T17:57:13.174200
36,2,Organic,,79.0,B0GKZ857XN,"140PCS Summer Pool Party Decorations Set Swimming Beach Ball Themed Birthday, Tropical Hawaii Holiday Tableware Supplies Includes Plates, Napkin, Fork, Cup, Serves 20",N/A,CNY 122.86,,4.4,105.0,False,https://m.media-amazon.com/images/I/815burhosnL._AC_UL320_.jpg,https://m.media-amazon.com/images/I/815burhosnL._AC_SL1500_.jpg,,2026-04-14T17:57:13.177381
37,2,Organic,,80.0,B0GM781VGY,Renbuzhu 15Pcs Beach Party Decorations Paper Lanterns Fans Pom Poms Hanging Swirls Summer Pool Luau Hawaiian Tropical Decor Indoor Outdoor,N/A,CNY 109.20,,,,False,https://m.media-amazon.com/images/I/81s97jmKk9L._AC_UL320_.jpg,https://m.media-amazon.com/images/I/81s97jmKk9L._AC_SL1500_.jpg,,2026-04-14T17:57:13.181486
38,2,Organic,,81.0,B07CRL2KC9,"Hajoyful Grass Skirt Hawaiian Luau Hula Skirts Party Decorations Favors Supplies Grass Skirts for Adult Elastic Hibiscus Flowers Tropical Skirt, Party, Birthday, Celebration 60CM 12Pack Multicolored",N/A,CNY 156.94,,4.6,1316.0,False,https://m.media-amazon.com/images/I/91bZU2w7XPL._AC_UL320_.jpg,https://m.media-amazon.com/images/I/91bZU2w7XPL._AC_SL1500_.jpg,,2026-04-14T17:57:13.185231
39,2,Organic,,82.0,B0D2ZSC14M,"Vellibring 12"" Summer Inflatable Beach Balls Bulk Rainbow Color Swimming Pool Water Games Toys for Kids Summer Beach Party Favor",N/A,CNY 102.37,,4.5,200.0,False,https://m.media-amazon.com/images/I/71ogg3oFFZL._AC_UL320_.jpg,https://m.media-amazon.com/images/I/71ogg3oFFZL._AC_SL1500_.jpg,,2026-04-14T17:57:13.190460
40,2,Organic,,83.0,B0FCLMNBPB,"Capri Lemon Party Decorations 4 Pack Mediterranean Banner Garland Blue and Yellow Tile Design Lemon Summer Party Supplies for Birthday, Baby Shower, Bridal Shower",N/A,CNY 95.54,,4.3,19.0,False,https://m.media-amazon.com/images/I/715kCSV228L._AC_UL320_.jpg,https://m.media-amazon.com/images/I/715kCSV228L._AC_SL1500_.jpg,,2026-04-14T17:57:13.195400
41,2,Organic,,84.0,B0F3CRG7L5,"3 Pack Summer Flamingo Tablecloth Party Decorations, Hawaiian Tropical Plastic Table Cloth, Disposable Luau Table Cover for Summer Flamingo Picnic Birthday Party Supplies Decorations, 54” x 108”",N/A,CNY 61.39,,4.4,46.0,False,https://m.media-amazon.com/images/I/816T9zMlEeL._AC_UL320_.jpg,https://m.media-amazon.com/images/I/816T9zMlEeL._AC_SL1500_.jpg,,2026-04-14T17:57:13.199418
42,2,Organic,,85.0,B0FMWD7QSL,"Inflatable Pink Flamingo Party Decorations - (3 Pack) 28"" Large Blow-Up Flamingos, Realistic Animal Design, Summer Hawaiian Luau, BBQ, Birthday Party Decor, Pool Float Toys Indoor & Outdoor",N/A,CNY 68.22,,4.4,24.0,False,https://m.media-amazon.com/images/I/71nQEPbwQ2L._AC_UL320_.jpg,https://m.media-amazon.com/images/I/71nQEPbwQ2L._AC_SL1500_.jpg,,2026-04-14T17:57:13.206490
43,2,Organic,,86.0,B07RV85678,Decor365 White Finger Starfish Sea Shell Garland Ocean Coastal Nautical Party Decoration Starfish Cutouts Hanging Bunting Banner Under the Sea Mermaid Wish Birthday Beach Wedding Decor,N/A,CNY 88.71,,4.0,903.0,False,https://m.media-amazon.com/images/I/41NXMamleBL._AC_UL320_.jpg,https://m.media-amazon.com/images/I/41NXMamleBL._AC_SL1500_.jpg,,2026-04-14T17:57:13.212061
44,2,Organic,,87.0,B0DLBGHBK8,GaofanWai Ocean Pineapple Party Tablecloths - 3PCS Pineapple Birthday Table Covers for Kids Blue Ocean Jellyfish Seaweed Plastic Table Cloth for Teens Summer Party Decoration Baby Shower Supplies,N/A,CNY 68.22,,4.8,48.0,False,https://m.media-amazon.com/images/I/91+ill3YWbL._AC_UL320_.jpg,https://m.media-amazon.com/images/I/91+ill3YWbL._AC_SL1500_.jpg,,2026-04-14T17:57:13.219987
45,2,Organic,,88.0,B0BYDMHXHG,"AVOIN colorlife Hello Sunshine Classic Garden Flag 12x18 Inch Double Sided Outside, Summer Party Holiday Burlap Yard Outdoor Decoration",N/A,CNY 47.74,,4.8,285.0,False,https://m.media-amazon.com/images/I/71Lr5yGIRfL._AC_UL320_.jpg,https://m.media-amazon.com/images/I/71Lr5yGIRfL._AC_SL1500_.jpg,,2026-04-14T17:57:13.229441
46,2,Organic,,89.0,B0D9JF7Y4H,PIGETALE 2 Pack 3.2x6.5 Feet Wavy Blue Backdrop Curtain Tinsel Streamers Foil Fringe Backdrop Ocean Themed Decor Baby Shower Bachelorette Disco Winter Under The Sea Summer Pool Beach Party Decorations,N/A,CNY 36.88,,4.3,214.0,False,https://m.media-amazon.com/images/I/9177pfW8Z6L._AC_UL320_.jpg,https://m.media-amazon.com/images/I/9177pfW8Z6L._AC_SL1500_.jpg,,2026-04-14T17:57:13.233993
47,2,Organic,,90.0,B083B5YW71,"JOYIN 43"" Inflatable Cactus Cooler with Sombrero Hat for Fiesta, Cinco de Mayo Party Supplies, Inflatable Party Cooler, Pool Party Decoration",N/A,CNY 116.03,,4.6,986.0,False,https://m.media-amazon.com/images/I/71FlDC+by3L._AC_UL320_.jpg,https://m.media-amazon.com/images/I/71FlDC+by3L._AC_SL1500_.jpg,,2026-04-14T17:57:13.239989
48,2,Organic,,91.0,B0DP21D9BL,"25pcs Hawaiian Leis Bulk,Colorful Lei Tropical Flower Necklace Hawaii Hula Dance Decor for Summer Beach Pool Luau Party Birthday Decoration Favors Supplies",N/A,CNY 61.39,,4.2,377.0,False,https://m.media-amazon.com/images/I/812uJFjV7FL._AC_UL320_.jpg,https://m.media-amazon.com/images/I/812uJFjV7FL._AC_SL1500_.jpg,,2026-04-14T17:57:13.243504
49,2,Organic,,92.0,B0D12MLZ6X,"Summer Beach Tablecloths, Beach Themed Party Decorations 3pcs Hawaiian Tablecloth Waterproof Table Cover for Pool Beach Party Supplies",N/A,CNY 55.79,,4.6,43.0,False,https://m.media-amazon.com/images/I/81kGQbQ98-L._AC_UL320_.jpg,https://m.media-amazon.com/images/I/81kGQbQ98-L._AC_SL1500_.jpg,,2026-04-14T17:57:13.248293
50,2,Organic,,93.0,B07S21149G,"JOYIN Toy 60 Counts Hawaiian Leis Bulk, Tropical Flower Lei Hawaiian Lei Beach Hawaii Luau Party Favors Decoration Birthday Party Supplies",N/A,CNY 122.86,,4.6,10884.0,False,https://m.media-amazon.com/images/I/911aTPl1DwL._AC_UL320_.jpg,https://m.media-amazon.com/images/I/911aTPl1DwL._AC_SL1500_.jpg,,2026-04-14T17:57:13.252800
51,2,Organic,,94.0,B07NX2V91X,"JOYIN 2-Pack Flamingo Unicorn Pool Float - Fun Floaties Inflatable Swimming Pool Tubes Toys Party Decorations, Summer Vacation Lake Beach Floaty Swim Rings Raft Lounger for Adults & Kids",N/A,CNY 170.66,,4.4,3222.0,False,https://m.media-amazon.com/images/I/81U1c+sU5FL._AC_UL320_.jpg,https://m.media-amazon.com/images/I/81U1c+sU5FL._AC_SL1500_.jpg,,2026-04-14T17:57:13.256357
52,2,Organic,,95.0,B0C85LSKPV,"Summer Pool Birthday Party Decorations, Summer Themed Birthday Plates, Napkin, Cups Banner, Balloons and Cake Topper for Swimming Pool Party Decorations Supplies Set Serves 20",N/A,CNY 122.86,,4.2,53.0,False,https://m.media-amazon.com/images/I/8169SKkQ7IL._AC_UL320_.jpg,https://m.media-amazon.com/images/I/8169SKkQ7IL._AC_SL1500_.jpg,,2026-04-14T17:57:13.259879
53,2,Organic,,96.0,B0DLL3GNV9,CHARLENT Glitter Hibiscus Temporary Tattoos for Aloha Party Decoration - 74 Individually Sheets Glitter Hawaii Flower Tattoos for Kids Women Hawaiian Party Favors,N/A,CNY 47.74,,4.7,237.0,False,https://m.media-amazon.com/images/I/81alKIVdmGL._AC_UL320_.jpg,https://m.media-amazon.com/images/I/81alKIVdmGL._AC_SL1500_.jpg,,2026-04-14T17:57:13.263982
55,2,Title,,,,Picks from Amazon InfluencersSponsored| From Amazon Influencer storefrontsFlamingo Hawaiian Party De,,,,,,False,,,,2026-04-14T17:57:13.268169
56,2,Title,,,,Related searchesend of summer party decorationssummer partypool party decorationssummer party decora,,,,,,False,,,,2026-04-14T17:57:13.269169
57,2,Title,,,,Previous123...7Next,,,,,,False,,,,2026-04-14T17:57:13.269169
58,2,SB,2.0,,,N/A,https://aax-us-east-retail-direct.amazon.com/x/c/JIsCnN9I4NVOH7MrlijwCUgAAAGdi2xklgEAAAH2AQBvbm9fdHhuX2JpZDEgICBvbm9fdHhuX2ltcDEgICCW0NjU/clv1c_ek-wBPHXFbbWzjK3YpscrxfcOWxCnjqP74XjuyVjPTt483ygWNgfxyw7YwEVjslujwmFV-fP5sqVn1wkXpkFZVSa4KFD7k89Pj9hCtjFWPz0g37oJ93sUd_YI_tw6moBTq_vqYFKBQOcg_RK-CQi5LLXkg0clVzC8tGkP0cqjYMVbwMtE9FnZJA1xOtdN1-g60TLQPTbEQz0yfyNXphBdwfRj328hMIahAZV7Y_26btCE0FJQyH1Y9C9w0DXRaVQwZN8KIoVP2Iq99-ZD7Ww7jIAbnwGXVnJykzxS6R-RvxOKz9_vRntf9b5ckJhoc4hOP11cIH3EKgsLC8N1e12u2hFDN_PhqDg-wSrgxV5Y3UBp2xO_OTiCS8uhXY6AiIOBKoRsMvZZ1KjxTdDkRckJq_Hgm3_9Ba9cDbDl32xERaCpcpfMTCsFjnGgW29xVvQzPAsxIRCOvN_3ADI7er_9KcTU3WXJCBvgvHN2IXA9lyQ9qxsNisSbglhomG3uFmY6Ws9iMbcPtU4cE5GSdCCDu9jEyY9-0dJHRQiWg4Y3Pi7tYD474w6d_d6AdRN6EfprKHIx4tukv6XVDeQ1WPnju1ewIijjyHNzKO9PEot8qrXVn-VA2cySpXBFuPzN3GU89F38VZHXBYjKA1CNani6mxy_65EiE-Vrb6_oiuO91m9fxesls1-b4OoDMgs8R-pQKpbziqgJt9C8vKWSZz9-PXyxWO_X5R3wGCIRnG2-aAyQFfq2S-dGHHkZOFJqch35I_ldilJUC2_zrCySpY0OCmtHFPBYpaiRZ2s3pRgVMHgeWzy1Rg3WKcMnbmEyyg5tytnSj9vLWr92MrJHHME9dc9I2q9e4VsQp5Ah4Ln-QbHrtsGiX6RG_afKHZ4QVmm0BDD2zLefWd3YiYi48wTRU9jCfoaMcIe_utey-YCnXPSg_QK71jZtpaKZgUEuOlOxQZVKuJ9DHut64Fc0hLJ5aXBL6djPNGVHpoBvsfySs7HkGvbAPWcM5cdggorf5vFbd7_g9jgbDfGEeu6_vTYSHAuSbswBKGfv-bWK-pMm00YvZlZZGr1lAiFpv26guTs_Kbv__Wv7wLjpxSB09YTX3e3JEKEJGfZpDzXI4opGlOJcf9VMLrkxq6ILvK-Q5rITVyARmu22dVZNgp0d_ZYFpPMP22UCLIk-24ZQ1VvJCAwYWvXNxSn0TP375pEPZ5jO75MlfYyCOb04enZ7ZPrJYD7oN2i6WbIxqUC6nSmxuzzwM4XX_eAZSd4TE6iqEpvnvKibreOKJuSTJ9N11eArEpUgMLW7AgZmqOhdrerPNMj-2q4Qo064KszFO4wpFFqMTAJ2_DROBRIkqrb9rlOLowGHjN4ARrUZpP92u1RavIvuwsvL0o2nHYDZ7vBqOs-iFknySYdlU9eZkWb8jEHmysTMMKuMg_RMcuUm6gKAAcfOadtau6QRIQeOOYjesZ-vDLdcHLMaHpHs9NJ6MX2Mr46mq9uTb5Oz5RfizbJcMrRXb3JLyHJ-gB0r5DZ_l4THb16he7SYY1LbRxRUOcy53TTXPEXioHfjlPbOjIdxFixJ5pfchVJ0SdhqwTOFDtAdNn_OXNYHs5s4usMD8P6T3DVh_eMOl7OLQNh1-GXQNujeEZzO9yiRyFHLcvk3vha5EGRA1_Sqxokj3TqMn1W1FX4NqH-Rw/https://www.amazon.com/stores/page/AD723312-D35D-4CD3-B0E9-65BDEF2E3F00/?_encoding=UTF8&store_ref=SB_A04583713QCU9RACLQ6F4-A08954171UQSVU17I1HR0&pd_rd_plhdr=t&aaxitk=b3d19e8ea5339ff8af01be66ac5ac2a4&hsa_cr_id=0&lp_asins=B0DM1ZVLTX%2CB0GF1NLKLN%2CB0G3PCVXSD&lp_query=summer%20party%20decorations&lp_slot=desktop-hsa-3psl&ref_=sbx_be_s_3psl_mbd_mb0_bkgd&pd_rd_w=QI8zD&content-id=amzn1.sym.cd7c548b-a599-426f-9ffe-daa1aa803c87%3Aamzn1.sym.cd7c548b-a599-426f-9ffe-daa1aa803c87&pf_rd_p=cd7c548b-a599-426f-9ffe-daa1aa803c87&pf_rd_r=GCQN8RH8F0B9WNKARVHH&pd_rd_wg=qOpfF&pd_rd_r=8c0e1569-200d-4fb6-84e6-d12736bf2b05,,,,,False,,,N/A,2026-04-14T17:57:13.274188
59,2,Title,,,,Need help?Visit the help sectionorcontact us,,,,,,False,,,,2026-04-14T17:57:13.274188
0,3,Title,,,,ResultsCheck each product page for other buying options. Price and other details may vary based on p,,,,,,False,,,,2026-04-14T17:57:29.435639
2,3,Organic,,97.0,B0DLL3GNV9,CHARLENT Glitter Hibiscus Temporary Tattoos for Aloha Party Decoration - 74 Individually Sheets Glitter Hawaii Flower Tattoos for Kids Women Hawaiian Party Favors,N/A,CNY 47.74,,4.7,237.0,False,https://m.media-amazon.com/images/I/81alKIVdmGL._AC_UL320_.jpg,https://m.media-amazon.com/images/I/81alKIVdmGL._AC_SL1500_.jpg,,2026-04-14T17:57:29.440661
3,3,Organic,,98.0,B07NX2V91X,"JOYIN 2-Pack Flamingo Unicorn Pool Float - Fun Floaties Inflatable Swimming Pool Tubes Toys Party Decorations, Summer Vacation Lake Beach Floaty Swim Rings Raft Lounger for Adults & Kids",N/A,CNY 170.66,,4.4,3222.0,False,https://m.media-amazon.com/images/I/81U1c+sU5FL._AC_UL320_.jpg,https://m.media-amazon.com/images/I/81U1c+sU5FL._AC_SL1500_.jpg,,2026-04-14T17:57:29.445756
