data_index,page,ad_type,ad_rank,organic_rank,asin,title,url,price_current,price_list,rating_stars,rating_count,is_prime,image_small,image_large,brand_name,scraped_at
0,1,Title,,,,ResultsCheck each product page for other buying options. Price and other details may vary based on p,,,,,,False,,,,2026-04-14T17:56:58.878077
2,1,SP,1.0,,B0CR6SG9NZ,Arrowom 24pcs Hawaiian Leis Bulk Luau Party Silk Flower Necklace Colorful Tropical Hawaiian Bulk Hula Dance Party Decor Flower Leis Summer Beach Pool Party Decorations Favors Supplies,N/A,CNY 64.81,,4.5,2697.0,False,https://m.media-amazon.com/images/I/91Dw3St+MFL._AC_UL320_.jpg,https://m.media-amazon.com/images/I/91Dw3St+MFL._AC_SL1500_.jpg,,2026-04-14T17:56:58.882737
3,1,SP,2.0,,B0DY7Q87NC,Summer Beach Party Decorations - Pre-Strung Hello Summer Banner and 16 Hanging Swirls Pool Party Decorations for Home Office Classroom,N/A,CNY 54.29,,4.6,20.0,False,https://m.media-amazon.com/images/I/81WnSn6kppL._AC_UL320_.jpg,https://m.media-amazon.com/images/I/81WnSn6kppL._AC_SL1500_.jpg,,2026-04-14T17:56:58.887259
4,1,SP,3.0,,B0GC68YVNG,"DMIGHT 80PCS Leis for Luau Party Decorations- Hawaiian Leis Bulk, Luau Party Glasses, Colorful Bracelets, Flower Hair Clips for Adults Kids, Tropical Birthday Summer Beach Luau Party Favors Supplies",N/A,CNY 129.69,,4.7,22.0,False,https://m.media-amazon.com/images/I/91-1TMK+0wL._AC_UL320_.jpg,https://m.media-amazon.com/images/I/91-1TMK+0wL._AC_SL1500_.jpg,,2026-04-14T17:56:58.891276
5,1,SP,4.0,,B0F8QMB1HY,"15Pcs Paper Lanterns Party Decorations, Beach Ball Paper Lanterns for Luau Party Classroom Outdoor Decor, Decorative Summer Hanging Colorful Paper Lanterns(8pcs 8-Color 8"" + 7pcs 6-Color 5.7"")",N/A,CNY 102.37,,4.8,30.0,False,https://m.media-amazon.com/images/I/716tEFw2quL._AC_UL320_.jpg,https://m.media-amazon.com/images/I/716tEFw2quL._AC_SL1500_.jpg,,2026-04-14T17:56:58.895297
6,1,Organic,,1.0,B0CR6SG9NZ,Arrowom 24pcs Hawaiian Leis Bulk Luau Party Silk Flower Necklace Colorful Tropical Hawaiian Bulk Hula Dance Party Decor Flower Leis Summer Beach Pool Party Decorations Favors Supplies,N/A,CNY 64.81,,4.5,2697.0,False,https://m.media-amazon.com/images/I/91Dw3St+MFL._AC_UL320_.jpg,https://m.media-amazon.com/images/I/91Dw3St+MFL._AC_SL1500_.jpg,,2026-04-14T17:56:58.900319
7,1,Organic,,2.0,B071JR7GYP,"JOYIN 60"" Inflatable Palm Tree Cooler, Beach Theme Decor, Pool Party Decorations, Luau Hawaiian Birthday Party Supplies, Ocean Jungle Tropical Themed Summer Outdoor Drink Cooler",N/A,CNY 136.52,,4.3,5370.0,False,https://m.media-amazon.com/images/I/815M9fW4pfL._AC_UL320_.jpg,https://m.media-amazon.com/images/I/815M9fW4pfL._AC_SL1500_.jpg,,2026-04-14T17:56:58.905333
8,1,Organic,,3.0,B0GCZR9158,SUNBEAUTY 14PCS Pink Party Decorations Paper Flowers Decorations for Wall Paper Floral Backdrop Hanging Paper Fans Flower Garland for Birthday Baby Shower Spring Decor and Office Classroom Decorations,N/A,CNY 109.20,,4.6,868.0,False,https://m.media-amazon.com/images/I/71j5bCqQoPL._AC_UL320_.jpg,https://m.media-amazon.com/images/I/71j5bCqQoPL._AC_SL1500_.jpg,,2026-04-14T17:56:58.911878
10,1,Title,,,,"Customers frequently viewedSponsoredFlamingo Hawaiian Party Decorations, Luau Party Decor Flamingo a",,,,,,False,,,,2026-04-14T17:56:58.917428
12,1,Title,,,,Debug info copied.SponsoredOzepao 58 Pcs Summer Cutouts Beach Hawaiian Theme Bulletin Board Decorati,,,,,,False,,,,2026-04-14T17:56:58.917957
13,1,Title,,,,Colorful Rainbow Beach BallsSponsored|Top 10 best-selling brand in this category|Shop JOYINShop nowP,,,,,,False,,,,2026-04-14T17:56:58.919964
14,1,Title,,,,More results,,,,,,False,,,,2026-04-14T17:56:58.919964
15,1,Organic,,4.0,B0DP2FLFKM,‎Renbuzhu 15PCS Pool Party Decorations Beach Ball Paper Lanterns - Summer Luau Hawaiian Themed Hanging Decor for Home Birthday Outdoor Indoor,N/A,CNY 109.20,,4.5,126.0,False,https://m.media-amazon.com/images/I/81SAWFpzVML._AC_UL320_.jpg,https://m.media-amazon.com/images/I/81SAWFpzVML._AC_SL1500_.jpg,,2026-04-14T17:56:58.927504
16,1,Organic,,5.0,B0BX6C82D6,"Artoid Mode Daisy Eucalyptus Lavender Floral Leaves Summer Table Runner, Spring Kitchen Dining Table Decoration for Home Party Decor 13x72 Inch",N/A,CNY 68.22,,4.4,1016.0,False,https://m.media-amazon.com/images/I/71IhlrnyNCL._AC_UL320_.jpg,https://m.media-amazon.com/images/I/71IhlrnyNCL._AC_SL1500_.jpg,,2026-04-14T17:56:58.936106
17,1,Organic,,6.0,B0DC51MRZ4,"Freyalife Hawaiian Leis Decorations(24pcs),Leis for Luau Party Decor Flower,Tropical Hawaiian Bulk Hula Dance Party Decor",N/A,CNY 47.74,,4.3,619.0,False,https://m.media-amazon.com/images/I/816+lI1lMEL._AC_UL320_.jpg,https://m.media-amazon.com/images/I/816+lI1lMEL._AC_SL1500_.jpg,,2026-04-14T17:56:58.940615
18,1,SP,5.0,,B0DZYT48XZ,"Hello Summer Banner,Summer Party Decorations",N/A,CNY 47.74,,4.6,31.0,False,https://m.media-amazon.com/images/I/51lRmNCx93L._AC_UL320_.jpg,https://m.media-amazon.com/images/I/51lRmNCx93L._AC_SL1500_.jpg,,2026-04-14T17:56:58.945120
19,1,SP,6.0,,B0GLG7NHMK,144Pcs Tropical Luau Party Supplies Hawaiian Hibiscus Floral Disposable Paper Plates and Napkins Palm Leaf Themed Tableware Set for Summer Beach Aloha Birthday Decorations,N/A,CNY 122.86,,5.0,1.0,False,https://m.media-amazon.com/images/I/81+2soqpw8L._AC_UL320_.jpg,https://m.media-amazon.com/images/I/81+2soqpw8L._AC_SL1500_.jpg,,2026-04-14T17:56:58.948131
20,1,SP,7.0,,B0GKNL7PMH,"Flamingo Hawaiian Party Decorations, Luau Party Decor Flamingo and Pineapple Honeycomb Ball Paper Lanterns for Birthday Pool Summer Tropical Beach Party Supplies",N/A,CNY 95.54,,4.8,20.0,False,https://m.media-amazon.com/images/I/81qvfkmXqHL._AC_UL320_.jpg,https://m.media-amazon.com/images/I/81qvfkmXqHL._AC_SL1500_.jpg,,2026-04-14T17:56:58.951133
21,1,SP,8.0,,B0GKTZ5JNK,"LED Light Up Inflatable Ice Bucket - Transparent Blue Drink Cooler with Silver Rim & Color Changing Lights - Portable Inflatable Cooler & Storage Bin for Night Pool Party, BBQ, Luau Party Decorations",N/A,CNY 122.86,,4.7,16.0,False,https://m.media-amazon.com/images/I/813vRYgPGiL._AC_UL320_.jpg,https://m.media-amazon.com/images/I/813vRYgPGiL._AC_SL1500_.jpg,,2026-04-14T17:56:58.955135
22,1,Organic,,7.0,B0GC6JZY4T,"DMIGHT Summer Party Decorations Kit, Beach Pool Party Decorations, Hello Summer Banner with Beach Pool Hanging Swirls, Beach Ball Paper Lanterns for Home, Office, School, Classroom",N/A,CNY 116.03,,4.8,22.0,False,https://m.media-amazon.com/images/I/81QsPsSamjL._AC_UL320_.jpg,https://m.media-amazon.com/images/I/81QsPsSamjL._AC_SL1500_.jpg,,2026-04-14T17:56:58.959396
23,1,Organic,,8.0,B0964DB59D,"JOYIN Set of 6 Small Pink Flamingo Yard Ornament Stakes, 17"" Plastic Flamingo Lawn Statues with Metal Legs for Sidewalks, Outdoor Garden Decor, Luau & Pool Party Decorations, 2 Styles",N/A,CNY 109.20,,4.1,3739.0,False,https://m.media-amazon.com/images/I/713gAJWZu5L._AC_UL320_.jpg,https://m.media-amazon.com/images/I/713gAJWZu5L._AC_SL1500_.jpg,,2026-04-14T17:56:58.963398
24,1,Organic,,9.0,B09WJB4JG1,Summer Pool Beach Hanging Swirls Banner Decor 30 Pack Foil Ceiling Hanging Swirls Streams Banner Decorations Garland for Kids Luau Hawaii Celebrating Events Birthday Party Supplies Room Wall Decor,N/A,CNY 68.22,,4.6,287.0,False,https://m.media-amazon.com/images/I/81pvLwg9GEL._AC_UL320_.jpg,https://m.media-amazon.com/images/I/81pvLwg9GEL._AC_SL1500_.jpg,,2026-04-14T17:56:58.967404
25,1,Organic,,10.0,B07NWR7HKD,"JOYIN 12-Pack 12“ Beach Balls - Bulk Classic Beachball Inflatable Swimming Pool Toys for Games Adults Kids Birthday Party Supplies Combo Set, Rainbow Color Blow Up Luau Decorations Favors Gifts (12"")",N/A,CNY 68.22,,4.5,3352.0,False,https://m.media-amazon.com/images/I/814LDy0nOPL._AC_UL320_.jpg,https://m.media-amazon.com/images/I/814LDy0nOPL._AC_SL1500_.jpg,,2026-04-14T17:56:58.971435
26,1,SP,9.0,,B0GMQPRF3R,"48pcs Hawaiian Tropical Napkins Hawaiian Luau Napkins Paper, Disposable Aloha Napkin with Hibiscus Flowers Palm Leaves Tropical Party Decorations for Summer Beach Pool Party Dinner Kitchen Bathroom",N/A,CNY 61.39,,5.0,1.0,False,https://m.media-amazon.com/images/I/81pv1XRtb1L._AC_UL320_.jpg,https://m.media-amazon.com/images/I/81pv1XRtb1L._AC_SL1500_.jpg,,2026-04-14T17:56:58.975028
27,1,SP,10.0,,B0CYBWMR83,"Summer Party Decorations, Hello Summer Banner Hanging Swirls and Honeycomb Centerpieces Beach Pool Party Decorations, Summer Pool Holiday Birthday Party Supplies",N/A,CNY 54.57,,4.8,12.0,False,https://m.media-amazon.com/images/I/61PGCbFgpLL._AC_UL320_.jpg,https://m.media-amazon.com/images/I/61PGCbFgpLL._AC_SL1500_.jpg,,2026-04-14T17:56:58.978317
28,1,SP,11.0,,B0F4XKCB7B,"Hawaiian Party Decorations, Luau Decorations includes Glitter Aloha Banner Tropical Hawaii Hanging Swirls and Tissue Pom Poms, Hawaiian Luau Decorations for Summer Tropical Beach Tiki Bar Party",N/A,CNY 81.88,,3.9,12.0,False,https://m.media-amazon.com/images/I/81PleS8RrFL._AC_UL320_.jpg,https://m.media-amazon.com/images/I/81PleS8RrFL._AC_SL1500_.jpg,,2026-04-14T17:56:58.982535
29,1,SP,12.0,,B0G2MNM6K6,"xo, Fetti Pool Party Cupcake Toppers and Wrappers - 24 Pc Set | Summer Birthday Decorations, Tropical Luau, Hawaiian Theme, Kids Party, Beach Ball, Pink Hibiscus",N/A,CNY 68.22,,,,False,https://m.media-amazon.com/images/I/61pezXRjecL._AC_UL320_.jpg,https://m.media-amazon.com/images/I/61pezXRjecL._AC_SL1500_.jpg,,2026-04-14T17:56:58.987109
30,1,Organic,,11.0,B01F6LRW30,"Joyin Toy 36 Counts Hawaiian Leis Bulk, Tropical Flower Lei Hawaiian Lei Beach Hawaii Luau Party Favors Decoration Birthday Party Supplies(3 Dozen)",N/A,CNY 68.22,,4.6,10884.0,False,https://m.media-amazon.com/images/I/911aTPl1DwL._AC_UL320_.jpg,https://m.media-amazon.com/images/I/911aTPl1DwL._AC_SL1500_.jpg,,2026-04-14T17:56:58.993627
31,1,Organic,,12.0,B0F1YMPVPN,Beach Party Decorations Kit - Beach Themed Honeycomb Centerpieces and Table Decor for Summer & Pool Party Decorations,N/A,CNY 68.16,,4.7,1141.0,False,https://m.media-amazon.com/images/I/81DHErA5m0L._AC_UL320_.jpg,https://m.media-amazon.com/images/I/81DHErA5m0L._AC_SL1500_.jpg,,2026-04-14T17:56:58.999796
32,1,Title,,,,More results,,,,,,False,,,,2026-04-14T17:56:59.000801
33,1,Organic,,13.0,B0DYSKPF35,Summer Party Decorations - 61 Pcs Beach Pool Party Decorations Hello Summer Banner Pool Beach Hanging Streams Decor for Home Office School Classroom,N/A,CNY 54.57,,4.7,101.0,False,https://m.media-amazon.com/images/I/81Zdymfw6zL._AC_UL320_.jpg,https://m.media-amazon.com/images/I/81Zdymfw6zL._AC_SL1500_.jpg,,2026-04-14T17:56:59.006321
34,1,Organic,,14.0,B088FJ4L7K,"YUNXUAN Flamingo Party Supplies, Hawaiian Party Decorations Flamingo and Pineapple Honeycomb Ball Paper Lanterns Paper Fans Pom poms Flowers for Birthday Luau Tropical Bachelorette Party",N/A,CNY 116.03,,4.7,1692.0,False,https://m.media-amazon.com/images/I/71oYj8hh1KL._AC_UL320_.jpg,https://m.media-amazon.com/images/I/71oYj8hh1KL._AC_SL1500_.jpg,,2026-04-14T17:56:59.011905
35,1,Organic,,15.0,B09Z28TMY4,Vinsot 32 Pack Beach Pool Party Eyeglasses Decor Summer Luau Paper Glasses Bulk Hawaiian Sunglasses Frame Tropical Pool Props Photo Booth Props for Summer Beach Luau Party Favor Birthday Supply Decor,N/A,CNY 88.71,,4.1,645.0,False,https://m.media-amazon.com/images/I/81bbJ2wNgCL._AC_UL320_.jpg,https://m.media-amazon.com/images/I/81bbJ2wNgCL._AC_SL1500_.jpg,,2026-04-14T17:56:59.016414
36,1,Organic,,16.0,B0BZS1RK9X,"Summer Party Decorations, Beach Party Decorations Include Hello Summer Banner and Summer Beach Hanging Swirls, Summer Holiday Birthday Party Supplies",N/A,CNY 58.32,,4.6,23.0,False,https://m.media-amazon.com/images/I/81QbQGQF1oL._AC_UL320_.jpg,https://m.media-amazon.com/images/I/81QbQGQF1oL._AC_SL1500_.jpg,,2026-04-14T17:56:59.020674
37,1,Organic,,17.0,B0GC5K38TY,School's Out for Summer Decorations Include Summer Theme Banner Hanging Swirls Honeycomb Centerpieces End of School Year Party Decorations for Schools Classroom Summers Vacation Celebration Decor,N/A,CNY 95.54,,,,False,https://m.media-amazon.com/images/I/81UBkT0V5AL._AC_UL320_.jpg,https://m.media-amazon.com/images/I/81UBkT0V5AL._AC_SL1500_.jpg,,2026-04-14T17:56:59.025684
38,1,Organic,,18.0,B0F3J74VN5,Summer Party Decoration Hello Summer Banner Colorful Beach Pool Theme Banners Pre-strung Pool Banner Hanging Swirls Honeycomb Balls Circle Dots Garland for Holiday Beach Party Decorations Supplies,N/A,CNY 68.22,,4.8,20.0,False,https://m.media-amazon.com/images/I/81iDyh6u+ML._AC_UL320_.jpg,https://m.media-amazon.com/images/I/81iDyh6u+ML._AC_SL1500_.jpg,,2026-04-14T17:56:59.028222
39,1,Organic,,19.0,B09NM2FPKX,"Fovths Luau Grass Table Skirt Natural 9 Feet x 29.5 Inch Hawaiian Table Skirt for Tropical Hawaiian Party Decorations Luau Costume Party, Straw Yellow",N/A,CNY 57.98,,4.5,2398.0,False,https://m.media-amazon.com/images/I/81Hsj3wr27L._AC_UL320_.jpg,https://m.media-amazon.com/images/I/81Hsj3wr27L._AC_SL1500_.jpg,,2026-04-14T17:56:59.033330
40,1,Organic,,20.0,B0BWR9FQYX,2 Pack Blue Streamers Party Decorations Fringe Backdrop Ocean Themed Decorations Foil Curtain Backdrop Blue Birthday Ocean Party Decor Supplies,N/A,CNY 40.77,,4.4,10536.0,False,https://m.media-amazon.com/images/I/914rDCqCJuL._AC_UL320_.jpg,https://m.media-amazon.com/images/I/914rDCqCJuL._AC_SL1500_.jpg,,2026-04-14T17:56:59.037880
41,1,Organic,,21.0,B073RBVTXT,"ALINK 50 Umbrella Parasol Drinking Straws, Hawaiian Beach Cocktail Luau Party Decorations Supplies",N/A,CNY 47.74,,4.6,10350.0,False,https://m.media-amazon.com/images/I/81YbWfWBaPL._AC_UL320_.jpg,https://m.media-amazon.com/images/I/81YbWfWBaPL._AC_SL1500_.jpg,,2026-04-14T17:56:59.041396
42,1,Title,,,,More results,,,,,,False,,,,2026-04-14T17:56:59.041396
43,1,Organic,,22.0,B0C3PQ9M8X,7x5ft Summer Hawaiian Beach Photography Backdrop Tropical Flower Palm Leaves Surfboard Background for Luau Aloha Party Decoration Banner Photo Booth,N/A,CNY 95.54,,4.6,376.0,False,https://m.media-amazon.com/images/I/81BTSS8GBuL._AC_UL320_.jpg,https://m.media-amazon.com/images/I/81BTSS8GBuL._AC_SL1500_.jpg,,2026-04-14T17:56:59.045443
44,1,Organic,,23.0,B0721468V1,"JOYIN Inflatable Swim Tube Raft (3 pack) with Summer Fruits Painting, Pool Toys for Swimming Pool Party Decorations",N/A,CNY 115.96,,4.6,8361.0,False,https://m.media-amazon.com/images/I/71cpqrIteIL._AC_UL320_.jpg,https://m.media-amazon.com/images/I/71cpqrIteIL._AC_SL1500_.jpg,,2026-04-14T17:56:59.052473
45,1,Organic,,24.0,B0DZYT48XZ,"Hello Summer Banner,Summer Party Decorations",N/A,CNY 47.74,,4.6,31.0,False,https://m.media-amazon.com/images/I/51lRmNCx93L._AC_UL320_.jpg,https://m.media-amazon.com/images/I/51lRmNCx93L._AC_SL1500_.jpg,,2026-04-14T17:56:59.055984
46,1,Organic,,25.0,B075FPCFNR,60Pcs Tropical Party Decorations Supplies Tropical Palm Leaves Hibiscus Flower Simulation Artificial Leaf for Hawaiian Luau Safari Party Jungle Beach Theme BBQ Birthday Parties Decorations Table Decor,N/A,CNY 81.88,,4.6,3137.0,False,https://m.media-amazon.com/images/I/81jZYriVXGL._AC_UL320_.jpg,https://m.media-amazon.com/images/I/81jZYriVXGL._AC_SL1500_.jpg,,2026-04-14T17:56:59.060591
47,1,Organic,,26.0,B07DCNJDMK,"Inflatable Palm Tree Decoration, 2 Pack Jumbo Coconut Trees Beach Backdrop Favor Tropical Blow Up Hawaiian Summer Party Decor for Hawaiian Luau Party Decoration",N/A,CNY 95.54,,3.8,1142.0,False,https://m.media-amazon.com/images/I/61dX1IbRPCL._AC_UL320_.jpg,https://m.media-amazon.com/images/I/61dX1IbRPCL._AC_SL1500_.jpg,,2026-04-14T17:56:59.063599
48,1,Organic,,27.0,B00N1QPNMA,"PartySticks Glow Sticks Party Supplies 100pk - 8 Inch Glow in the Dark Light Up Sticks Party Favors, Glow Party Decorations, Neon Party Glow Necklaces and Glow Bracelets with Connectors",N/A,CNY 54.57,,4.6,28643.0,False,https://m.media-amazon.com/images/I/81JYNlch58L._AC_UL320_.jpg,https://m.media-amazon.com/images/I/81JYNlch58L._AC_SL1500_.jpg,,2026-04-14T17:56:59.069561
49,1,Organic,,28.0,B09X2XY5NG,10 Pcs Beach Party Decorations Kit Summer Pool Honeycomb Table Centerpieces Decorations Beach Hawaii Theme Birthday Party Table Topper Photo Props for BBQ Summer Pool Favor Supplies,N/A,CNY 61.39,,4.4,103.0,False,https://m.media-amazon.com/images/I/717opXWShtL._AC_UL320_.jpg,https://m.media-amazon.com/images/I/717opXWShtL._AC_SL1500_.jpg,,2026-04-14T17:56:59.074330
50,1,Organic,,29.0,B0C6X65BLF,"MISS FANTASY Summer Party Banners, Multi Color Rectangular Paper Summer Banner Decorations for Pool, Beach, Luau, Tropical Parties",N/A,CNY 47.74,,4.7,54.0,False,https://m.media-amazon.com/images/I/416LHGiY4NL._AC_UL320_.jpg,https://m.media-amazon.com/images/I/416LHGiY4NL._AC_SL1500_.jpg,,2026-04-14T17:56:59.081865
51,1,Organic,,30.0,B0F4X1G5Z9,16Pcs Summer Party Decorations Paper Lanterns Pom Poms Hanging Swirls - Beach Pool Luau Hawaiian Tropical Hanging Decor for Home Birthday Outdoor Indoor,N/A,CNY 122.86,,4.9,16.0,False,https://m.media-amazon.com/images/I/81PmrW2J9bL._AC_UL320_.jpg,https://m.media-amazon.com/images/I/81PmrW2J9bL._AC_SL1500_.jpg,,2026-04-14T17:56:59.086387
52,1,Organic,,31.0,B0B2RFGJL2,"Hawaiian Luau Party Decorations(161 Pcs), Tropical Summer Beach Pool Party Supplies Including Aloha Backdrop, Table Skirt, Tablecloth, Flamingo, Palm Leaves and Hibiscus, Balloons Arch, Straws,",N/A,CNY 143.35,,4.6,577.0,False,https://m.media-amazon.com/images/I/81tA7Fa0I8L._AC_UL320_.jpg,https://m.media-amazon.com/images/I/81tA7Fa0I8L._AC_SL1500_.jpg,,2026-04-14T17:56:59.089963
53,1,Organic,,32.0,B07NS7BG9L,"JOYIN 28” Inflatable Palm Tree Cooler, Luau Hawaiian Tropical Beach Themed Party Decorations, Blow Up Palm Trees Cooler Outdoor Party Supplies, Kids Adults Birthday Party Décor",N/A,CNY 136.52,,4.4,4015.0,False,https://m.media-amazon.com/images/I/91NOjIPjumL._AC_UL320_.jpg,https://m.media-amazon.com/images/I/91NOjIPjumL._AC_SL1500_.jpg,,2026-04-14T17:56:59.093521
54,1,Organic,,33.0,B00OCGUG02,"Hefty Party On Disposable Plastic Cups, Assorted, 16 Ounce, 100 Count",N/A,,,4.8,35428.0,False,https://m.media-amazon.com/images/I/81uf-BZz2eL._AC_UL320_.jpg,https://m.media-amazon.com/images/I/81uf-BZz2eL._AC_SL1500_.jpg,,2026-04-14T17:56:59.098262
55,1,Organic,,34.0,B0DP4H4M21,"28 Pack 12 Inch Rainbow Beach Balls Bulk, Inflatable Swimming Pool Toys Beach Ball for Kids Birthday Party Favors Outdoor Summer Games Hawaiian Tropical Luau Themed Pool Party Decorations",N/A,CNY 104.42,,4.2,34.0,False,https://m.media-amazon.com/images/I/71P91pSBUGL._AC_UL320_.jpg,https://m.media-amazon.com/images/I/71P91pSBUGL._AC_SL1500_.jpg,,2026-04-14T17:56:59.102772
56,1,Organic,,35.0,B0F7XT2HJ3,"Summer Party Decorations, Beach Party Supplies include Summer Plates and Napkins, Cups and Forks for Beach Birthday Decorations Serves 24",N/A,CNY 122.86,,4.6,118.0,False,https://m.media-amazon.com/images/I/81GqC4mvazL._AC_UL320_.jpg,https://m.media-amazon.com/images/I/81GqC4mvazL._AC_SL1500_.jpg,,2026-04-14T17:56:59.107300
57,1,Organic,,36.0,B0GDQVDTBN,"Summer Party Decorations Set, Pre-Strung Hello Summer Banner Hanging Swirls Beach Pool Decorations for Summer Pool Holiday Birthday Party Supplies Indoor Outdoor",N/A,CNY 61.39,,5.0,1.0,False,https://m.media-amazon.com/images/I/71yJfmIZkHL._AC_UL320_.jpg,https://m.media-amazon.com/images/I/71yJfmIZkHL._AC_SL1500_.jpg,,2026-04-14T17:56:59.110675
58,1,Organic,,37.0,B087794HBV,Boao 8 Pieces Flip Flop Decorations 52 Feet Summer Hanging Banner Beach Slipper Garland for Hawaiian Party Birthday Baby Shower Supplies,N/A,CNY 75.05,,4.6,186.0,False,https://m.media-amazon.com/images/I/71E-4U-F1iL._AC_UL320_.jpg,https://m.media-amazon.com/images/I/71E-4U-F1iL._AC_SL1500_.jpg,,2026-04-14T17:56:59.115211
59,1,Organic,,38.0,B0GKNL7PMH,"Flamingo Hawaiian Party Decorations, Luau Party Decor Flamingo and Pineapple Honeycomb Ball Paper Lanterns for Birthday Pool Summer Tropical Beach Party Supplies",N/A,CNY 95.54,,4.8,20.0,False,https://m.media-amazon.com/images/I/81qvfkmXqHL._AC_UL320_.jpg,https://m.media-amazon.com/images/I/81qvfkmXqHL._AC_SL1500_.jpg,,2026-04-14T17:56:59.119340
60,1,Organic,,39.0,B0BPS34MRJ,33pcs Spring Hanging Decorations for Home - Flower Butterfly Hanging Swirls with Led Lights for Spring Summer Easter Flower Butterfly Themed Birthday Party Decorations,N/A,CNY 61.39,,4.6,538.0,False,https://m.media-amazon.com/images/I/815GV8ode1L._AC_UL320_.jpg,https://m.media-amazon.com/images/I/815GV8ode1L._AC_SL1500_.jpg,,2026-04-14T17:56:59.122845
61,1,Organic,,40.0,B0CQV2P4FX,"12Pcs Summer Party Decorations Honeycomb Centerpiece, Hello Summer Party Decorations Centerpiece,3D Beach Summer Decorations Honeycomb Centerpiece for Summer Party Beach Party Decorations",N/A,CNY 68.22,,4.8,46.0,False,https://m.media-amazon.com/images/I/81OM2qVPj1L._AC_UL320_.jpg,https://m.media-amazon.com/images/I/81OM2qVPj1L._AC_SL1500_.jpg,,2026-04-14T17:56:59.128145
62,1,Title,,,,More results,,,,,,False,,,,2026-04-14T17:56:59.128145
63,1,Organic,,41.0,B07YDK14GQ,Decor365 Under the Sea Party Decorations White Bubble Garlands Little Mermaid Birthday Decorations Bday Hanging Streamer Beach Banner Decor Underwater Backdrop Kids Ocean Party Supplies,N/A,CNY 81.81,,4.6,6486.0,False,https://m.media-amazon.com/images/I/51Gcx9gKPQL._AC_UL320_.jpg,https://m.media-amazon.com/images/I/51Gcx9gKPQL._AC_SL1500_.jpg,,2026-04-14T17:56:59.131130
64,1,Organic,,42.0,B0BKTLGZN1,"JOYIN 4-Pack 20"" Beach Balls - Large Rainbow Beach Ball Inflatable Pool Toys for Party Supplies Decorations, Adults Kids Birthday Luau Summer Beach Water Games Beachball Party Favors",N/A,CNY 64.81,,4.5,1465.0,False,https://m.media-amazon.com/images/I/71-+c9L29ML._AC_UL320_.jpg,https://m.media-amazon.com/images/I/71-+c9L29ML._AC_SL1500_.jpg,,2026-04-14T17:56:59.135664
65,1,Organic,,43.0,B0F29LHPXS,"96 PCS Hello Summer Beach Pool Hawaiian Pre-Cut Temporary Tattoos for Kids | Super Cute Themed Birthday Party Favors, Supplies, Decorations, Fake Tattoo Stickers (Multiple)",N/A,CNY 49.10,,4.6,55.0,False,https://m.media-amazon.com/images/I/81zvrwTnkHL._AC_UL320_.jpg,https://m.media-amazon.com/images/I/81zvrwTnkHL._AC_SL1500_.jpg,,2026-04-14T17:56:59.139681
66,1,Organic,,44.0,B0FS366JXW,"xo, Fetti Summer Party Streamers - 5 Crepe Paper Rolls | Pink, Blue, Green, Orange, Pool Birthday Decorations, Island Bachelorette Decor, Tropical Luau, Beach Hawaiian Theme",N/A,CNY 68.22,,5.0,1.0,False,https://m.media-amazon.com/images/I/51oJ9eT6B2L._AC_UL320_.jpg,https://m.media-amazon.com/images/I/51oJ9eT6B2L._AC_SL1500_.jpg,,2026-04-14T17:56:59.143239
67,1,Organic,,45.0,B0CZ637F9S,"OBXT 10"" Blue Hanging Jellyfish Paper Lanterns - Under the Sea Party & Mermaid Birthday Decorations, Baby Shower, Nautical Events, Ocean Theme Classroom & Beach Room Decor (Set of 6)",N/A,CNY 143.35,,4.8,706.0,False,https://m.media-amazon.com/images/I/81vZ2BQo+gL._AC_UL320_.jpg,https://m.media-amazon.com/images/I/81vZ2BQo+gL._AC_SL1500_.jpg,,2026-04-14T17:56:59.147784
68,1,Organic,,46.0,B0CV33D9F1,"3 Pcs Iridescent Waves Tablecloths - Disposable Plastic Ocean Blue Table Cloth Rectangle Table Covers for Under the Sea Beach Surf Pool Party Birthday Party Decorations, 54 x 108 Inch",N/A,CNY 54.63,,4.5,668.0,False,https://m.media-amazon.com/images/I/81jVudN5HQL._AC_UL320_.jpg,https://m.media-amazon.com/images/I/81jVudN5HQL._AC_SL1500_.jpg,,2026-04-14T17:56:59.152788
69,1,Organic,,47.0,B0BV21BSRG,"Summer Party Decorations Porch Sign, 71"" X 12"" Hello Summer Banne for Office Indoor Door",N/A,CNY 68.22,,4.6,94.0,False,https://m.media-amazon.com/images/I/71WsYe4+xCL._AC_UL320_.jpg,https://m.media-amazon.com/images/I/71WsYe4+xCL._AC_SL1500_.jpg,,2026-04-14T17:56:59.156300
70,1,Organic,,48.0,B0BTN5DNYZ,"Riakrum 3 Pcs Summer Beach Tablecloths Pool Party Table Covers Rectangle Plastic Hawaiian Tablecloth Beach Supplies Theme Party Decorations for Swimming Themed Birthday Favors, 54 x 108 Inch",N/A,CNY 81.88,,4.7,88.0,False,https://m.media-amazon.com/images/I/91TD+XEveuL._AC_UL320_.jpg,https://m.media-amazon.com/images/I/91TD+XEveuL._AC_SL1500_.jpg,,2026-04-14T17:56:59.160366
72,1,Title,,,,"Seen on social mediaSponsoredFlamingo Hawaiian Party Decorations, Luau Party Decor Flamingo and Pine",,,,,,False,,,,2026-04-14T17:56:59.165536
73,1,Title,,,,Related searchesend of summer party decorationssummer partypool party decorationssummer party decora,,,,,,False,,,,2026-04-14T17:56:59.166499
74,1,Title,,,,Previous123...7Next,,,,,,False,,,,2026-04-14T17:56:59.166499
