data_index,page,ad_type,ad_rank,organic_rank,asin,title,url,price_current,price_list,rating_stars,rating_count,is_prime,image_small,image_large,brand_name,scraped_at
0,1,Title,,,,ResultsCheck each product page for other buying options. Price and other details may vary based on p,,,,,,False,,,,2026-04-14T16:46:03.563627
2,1,Organic,,1.0,B08LBN2JPS,"Tens Towels Pack of 4 Extra Large Bath Towels 30 x 60 Inches, 100% Cotton, Larger & Lighter Weight, Quicker to Dry, Super Soft and Absorbent, Perfect for Bathroom, Dark Grey",N/A,CNY 245.78,,4.3,22932.0,False,https://m.media-amazon.com/images/I/918gCoGCVYL._AC_UL320_.jpg,https://m.media-amazon.com/images/I/918gCoGCVYL._AC_SL1500_.jpg,,2026-04-14T16:46:03.579901
3,1,Organic,,2.0,B0FGQD1N6K,"Grey Bath Towels 30x60 – Pack of 4 | Soft, Light Weight & Quick-Dry | Highly Absorbent 100% Combed Yarn Cotton Towels for Bathroom, Spa, Home & Hotel Use (Grey Bath Towels, 30x60- Pack of 4)",N/A,CNY 238.95,,4.4,36.0,False,https://m.media-amazon.com/images/I/71RjjqWPRSL._AC_UL320_.jpg,https://m.media-amazon.com/images/I/71RjjqWPRSL._AC_SL1500_.jpg,,2026-04-14T16:46:03.586436
4,1,Organic,,3.0,B0B8CZM73P,"Towel and Linen Mart 100% Cotton 6 Pack Bath Towel Set, Quick Dry, Super Absorbent, Light Weight, Soft, (27 x 54 Pack of 6) Beige, White, Grey, Sky Blue, SAGE Green, Navy",N/A,CNY 167.25,,4.1,14810.0,False,https://m.media-amazon.com/images/I/91a5pVB983L._AC_UL320_.jpg,https://m.media-amazon.com/images/I/91a5pVB983L._AC_SL1500_.jpg,,2026-04-14T16:46:03.592512
6,1,Title,,,,"Debug info copied.SponsoredTens Towels Pack of 4 Extra Large Bath Towels 30 x 60 Inches, 100% Cotton",,,,,,False,,,,2026-04-14T16:46:03.593511
7,1,Title,,,,More results,,,,,,False,,,,2026-04-14T16:46:03.593511
8,1,Organic,,4.0,B09FZT5BYV,"LANE LINEN 18-Pack Premium Towels for Bathroom – 100% Cotton Towel Set, Zero Twist, 6 Bath, 6 Hand & 6 Washcloths,Gentle on Body, Highly Absorbent, Remains Soft After Wash, Hotel & Spa Quality – Grey",N/A,CNY 443.83,,4.2,11340.0,False,https://m.media-amazon.com/images/I/91ZvFOmrZPL._AC_UL320_.jpg,https://m.media-amazon.com/images/I/91ZvFOmrZPL._AC_SL1500_.jpg,,2026-04-14T16:46:03.606664
9,1,Organic,,5.0,B0963LSWW1,"Tens Towels Pack of 4 Extra Large Bath Towels 30 x 60 Inches, 100% Cotton, Larger & Lighter Weight, Quicker to Dry, Super Soft and Absorbent, Perfect for Bathroom, White",N/A,CNY 252.61,,4.3,22932.0,False,https://m.media-amazon.com/images/I/71f63LJo34L._AC_UL320_.jpg,https://m.media-amazon.com/images/I/71f63LJo34L._AC_SL1500_.jpg,,2026-04-14T16:46:03.631664
10,1,Organic,,6.0,B0BB29GC7W,"GLAMBURG 100% Cotton 2 Pack Oversized Bath Towel Set 28x55 Inches, Ultra Soft Highly Absorbant Compact Quickdry & Lightweight Large Bath Towels, Ideal for Gym Travel Camp Pool - Black",N/A,CNY 94.11,,4.1,9116.0,False,https://m.media-amazon.com/images/I/81JqWneZqpL._AC_UL320_.jpg,https://m.media-amazon.com/images/I/81JqWneZqpL._AC_SL1500_.jpg,,2026-04-14T16:46:03.647151
11,1,Organic,,7.0,B07FBZVWB4,"KAHAF COLLECTION 6 Pack Bath Towels Set (27 x 54 Inches) 100% Ring Spun Cotton, Lightweight, Quick Dry, Highly Absorbent Towels Multicolor, (27x54) Inches",N/A,CNY 170.39,,3.6,9018.0,False,https://m.media-amazon.com/images/I/81y0Jtp3DJL._AC_UL320_.jpg,https://m.media-amazon.com/images/I/81y0Jtp3DJL._AC_SL1500_.jpg,,2026-04-14T16:46:03.655556
12,1,Organic,,8.0,B07PBXXNCY,"Clean Skin Club Clean Towels XL®, 100% USDA Biobased Face Towel, Disposable Face Towelette, Eczema Association Accepted, Makeup Remover Dry Wipes, Ultra Soft, 1 Pack, 50 Ct",N/A,CNY 122.58,,4.8,42916.0,False,https://m.media-amazon.com/images/I/61Cn1ooILhL._AC_UL320_.jpg,https://m.media-amazon.com/images/I/61Cn1ooILhL._AC_SL1500_.jpg,,2026-04-14T16:46:03.666557
13,1,Title,,,,Super Soft Absorbent TowelsSponsored|Top 10 best-selling brand in bathroom towels|Shop Tens TowelsSh,,,,,,False,,,,2026-04-14T16:46:03.669074
14,1,Title,,,,More results,,,,,,False,,,,2026-04-14T16:46:03.670072
15,1,Organic,,9.0,B08JQ672VN,"American Soft Linen Luxury 4 Piece Bath Towel Set, 600 GSM 100% Cotton Turkish Bath Towels for Bathroom, 27x54 in Extra Large Bathroom Shower Towels, White",N/A,CNY 273.10,,4.4,77880.0,False,https://m.media-amazon.com/images/I/81h678YS9iL._AC_UL320_.jpg,https://m.media-amazon.com/images/I/81h678YS9iL._AC_SL1500_.jpg,,2026-04-14T16:46:03.683130
16,1,Organic,,10.0,B09BWFX1L6,"Amazon Basics 2-Ply Flex-Sheets Paper Towels, 12 Basics Rolls = 40 Regular Rolls, Everyday Value with 150 Sheets per Roll, Packaging May Vary",N/A,CNY 156.12,,4.1,69025.0,False,https://m.media-amazon.com/images/I/71v-pTar1AL._AC_UL320_.jpg,https://m.media-amazon.com/images/I/71v-pTar1AL._AC_SL1500_.jpg,,2026-04-14T16:46:03.691732
17,1,Organic,,11.0,B0BL6JGQM4,"POLYTE 430 GSM Microfiber Oversize Quick Dry Lint Free Bath Towel, 60 x 30 in, 4 Pack (Waffle Weave)",N/A,CNY 286.08,,4.4,4033.0,False,https://m.media-amazon.com/images/I/91IX-0seZ-L._AC_UL320_.jpg,https://m.media-amazon.com/images/I/91IX-0seZ-L._AC_SL1500_.jpg,,2026-04-14T16:46:03.698806
18,1,Organic,,12.0,B081FJHMYF,"KAHAF Collection 6-Pack Bath Towels - Lightweight - Extra Absorbent - 100% Cotton - Shower towels (Multi, 27 inchesx54 inches)",N/A,CNY 184.32,,4.0,23640.0,False,https://m.media-amazon.com/images/I/81UwogJF3yL._AC_UL320_.jpg,https://m.media-amazon.com/images/I/81UwogJF3yL._AC_SL1500_.jpg,,2026-04-14T16:46:03.703312
19,1,Organic,,13.0,B093CJRVX8,"Modern Threads Floral Trail 6-Piece 100% Cotton Towel Set – Reversible Yarn Dyed Jacquard - Includes 2 Bath Towels, 2 Hand Towels, 2 Washcloths – Absorbent, Quick Dry, Soft & Durable – Navy",N/A,,,4.4,26866.0,False,https://m.media-amazon.com/images/I/91WqO64F3KL._AC_UL320_.jpg,https://m.media-amazon.com/images/I/91WqO64F3KL._AC_SL1500_.jpg,,2026-04-14T16:46:03.715937
20,1,Organic,,14.0,B0DWSZ4SVY,"Utopia Towels 6 Pack Bath Towel Set (27 x 54 Inches), 500 GSM 100% Ring Spun Cotton Medium Lightweight and Highly Absorbent Quick Drying, Premium Towels for Hotel, Spa and Bathroom (White)",N/A,,,4.3,28564.0,False,https://m.media-amazon.com/images/I/81y+Ipv+sHL._AC_UL320_.jpg,https://m.media-amazon.com/images/I/81y+Ipv+sHL._AC_SL1500_.jpg,,2026-04-14T16:46:03.732099
21,1,Title,,,,More results,,,,,,False,,,,2026-04-14T16:46:03.732156
22,1,Organic,,15.0,B008C8J5QC,"Utopia Towels, Salon Towel, Pack of 24, Not Bleach Proof, 16 by 27 Inches, Highly Absorbent Cotton Towels for Hand, Gym, Beauty, Spa, and Home Hair Care, Black",N/A,CNY 273.10,,4.5,13260.0,False,https://m.media-amazon.com/images/I/91-JpSMKXDL._AC_UL320_.jpg,https://m.media-amazon.com/images/I/91-JpSMKXDL._AC_SL1500_.jpg,,2026-04-14T16:46:03.741184
23,1,Organic,,16.0,B01056KA58,"White Classic Luxury Bath Towels Set of 4 Large - 700 GSM Turkish Cotton Ultra Soft Bath Towels 27x54 | Highly Absorbent and Quick Dry | Hotel Towels for Bathroom Luxury, Plush Shower Towels, White",N/A,CNY 307.25,,4.4,12840.0,False,https://m.media-amazon.com/images/I/81i11OTEtKL._AC_UL320_.jpg,https://m.media-amazon.com/images/I/81i11OTEtKL._AC_SL1500_.jpg,,2026-04-14T16:46:03.752350
24,1,Organic,,17.0,B09ZY2D42V,"Infinitee Xclusives Luxury 100% Ring-Spun Cotton White Bath Towels Set of 4 (27x54 inches) – Soft, Absorbent & Quick-Drying Towels for Bathroom, Gym, Spa & Hotel Use (Brilliant White, Bath Towels)",N/A,CNY 252.61,,4.3,2330.0,False,https://m.media-amazon.com/images/I/81MXIB0LoRL._AC_UL320_.jpg,https://m.media-amazon.com/images/I/81MXIB0LoRL._AC_SL1500_.jpg,,2026-04-14T16:46:03.766455
25,1,Organic,,18.0,B0FHVWM2B1,"HOMEXCEL Grey Bath Towels 2 Pack, Microfiber Bathroom Towel, Super Soft Highly Absorbent Bath Towel Set, Quick Drying Towels for Sport, Yoga, SPA, Fitness",N/A,CNY 81.88,,4.2,1980.0,False,https://m.media-amazon.com/images/I/81hygPimWaL._AC_UL320_.jpg,https://m.media-amazon.com/images/I/81hygPimWaL._AC_SL1500_.jpg,,2026-04-14T16:46:03.770966
26,1,Organic,,19.0,B09ZTS9ZC9,"Orighty Bath Towels Pack of 2(27'' x 54'') - Soft Feel, Highly Absorbent, Quick Drying Microfiber for Body, Sport, Yoga, SPA, Fitness - Grey",N/A,CNY 92.13,,4.3,6530.0,False,https://m.media-amazon.com/images/I/71D-QQImzWL._AC_UL320_.jpg,https://m.media-amazon.com/images/I/71D-QQImzWL._AC_SL1500_.jpg,,2026-04-14T16:46:03.779226
27,1,Organic,,20.0,B085MCLJ4W,"LANE LINEN 100% Cotton Bathroom Towel Set of 24 - Durable, Soft & Absorbent - 4 Bath, 4 Fingertip, 6 Hand, 8 Washcloths, 2 Bath Sheets, Hotel & Spa-Quality Design - White Towels",N/A,CNY 430.17,,4.3,11989.0,False,https://m.media-amazon.com/images/I/914IYYJfjcL._AC_UL320_.jpg,https://m.media-amazon.com/images/I/914IYYJfjcL._AC_SL1500_.jpg,,2026-04-14T16:46:03.790478
28,1,Organic,,21.0,B0BTJBYRSY,"ZUPERIA 7-Pack Bath Towels - 30"" x 54"" - Ultra Soft 100% Cotton Large Bath Towels- Highly Absorbent for Bathroom, Pool, Gym, Spa, and Hotel Use (Colors Variety)",N/A,CNY 232.13,,4.0,1443.0,False,https://m.media-amazon.com/images/I/81hGwSXlq6L._AC_UL320_.jpg,https://m.media-amazon.com/images/I/81hGwSXlq6L._AC_SL1500_.jpg,,2026-04-14T16:46:03.797055
29,1,Organic,,22.0,B07B6GC2R5,"Amazon Basics 2-Piece Quick-Dry Oversize Bath Towel, 100% Cotton, 54"" x 30"", White",N/A,CNY 126.34,,4.1,9790.0,False,https://m.media-amazon.com/images/I/61kQk2OvjvL._AC_UL320_.jpg,https://m.media-amazon.com/images/I/61kQk2OvjvL._AC_SL1500_.jpg,,2026-04-14T16:46:03.810673
30,1,Organic,,23.0,B07SLR3T9F,"Hawmam Linen White Bath Towels 4 Pack 27 x 54 Inches 100% Turkish Cotton Soft Lightweight and Highly Absorbent Quick Drying Towels, Premium Quality Perfect for Daily Use",N/A,CNY 201.53,,4.3,33757.0,False,https://m.media-amazon.com/images/I/81ep3f8V2QL._AC_UL320_.jpg,https://m.media-amazon.com/images/I/81ep3f8V2QL._AC_SL1500_.jpg,,2026-04-14T16:46:03.818742
31,1,Title,,,,More results,,,,,,False,,,,2026-04-14T16:46:03.819742
32,1,Organic,,24.0,B08LBKXYWF,"Tens Towels Pack of 8 Towels Set, 2 Extra Large Bath, 2 Hand, 4 Washcloths, 100% Cotton, Lighter Weight, Quicker to Dry, Super Absorbent, Perfect for Bathroom, Dark Grey",N/A,CNY 218.19,,4.4,4725.0,False,https://m.media-amazon.com/images/I/917M+2Zic6L._AC_UL320_.jpg,https://m.media-amazon.com/images/I/917M+2Zic6L._AC_SL1500_.jpg,,2026-04-14T16:46:03.832598
33,1,Organic,,25.0,B07RPNBLWK,"Cotton Paradise 6 Piece Towel Set, 100% Cotton Soft Absorbent Turkish Towels for Bathroom, 2 Bath Towels 2 Hand Towels 2 Washcloths, Beige Towel Set",N/A,CNY 232.13,,4.4,18879.0,False,https://m.media-amazon.com/images/I/91kN6m4K0oL._AC_UL320_.jpg,https://m.media-amazon.com/images/I/91kN6m4K0oL._AC_SL1500_.jpg,,2026-04-14T16:46:03.845978
34,1,Organic,,26.0,B0CCW8QR2K,"NY Loft 6-Piece Cotton Towel Set - Super Soft & Absorbent, Quick-Dry, Sand Color, OEKO-TEX Certified, Machine Washable",N/A,CNY 682.85,,4.3,649.0,False,https://m.media-amazon.com/images/I/81MTuEnMV-L._AC_UL320_.jpg,https://m.media-amazon.com/images/I/81MTuEnMV-L._AC_SL1500_.jpg,,2026-04-14T16:46:03.855512
35,1,Organic,,27.0,B0812B1FMQ,"Clean Skin Club Clean Towels XL®, 100% USDA Biobased Face Towel, Disposable Face Towelette, Eczema Association Accepted, Makeup Remover Dry Wipes, Ultra Soft, 50 ct per pack, 2 Packs, 100 Ct Total",N/A,CNY 245.17,,4.8,42916.0,False,https://m.media-amazon.com/images/I/819VWIUIXSL._AC_UL320_.jpg,https://m.media-amazon.com/images/I/819VWIUIXSL._AC_SL1500_.jpg,,2026-04-14T16:46:03.861002
36,1,Organic,,28.0,B0DWSY83M4,"Utopia Towels 6 Pack Bath Towel Set (27 x 54 Inches), 500 GSM 100% Ring Spun Cotton Medium Lightweight and Highly Absorbent Quick Drying, Premium Towels for Hotel, Spa and Bathroom (Grey)",N/A,,,4.3,28564.0,False,https://m.media-amazon.com/images/I/91NMunqj+rL._AC_UL320_.jpg,https://m.media-amazon.com/images/I/91NMunqj+rL._AC_SL1500_.jpg,,2026-04-14T16:46:03.874571
37,1,Organic,,29.0,B091JGHYTH,"QUBA LINEN Hotel & Spa 100% Cotton Bath Towels Pack of 6, Ultra Soft, Quick Dry, Lightweight, Highly Absorbent, Perfect for Face, Hands, Spa, Gym, Hotel, Resort & Daily Use - Grey (24"" x 48"")",N/A,CNY 191.15,,3.4,7693.0,False,https://m.media-amazon.com/images/I/910-5ZPtvZL._AC_UL320_.jpg,https://m.media-amazon.com/images/I/910-5ZPtvZL._AC_SL1500_.jpg,,2026-04-14T16:46:03.881509
38,1,Organic,,30.0,B0DF8RSVJK,"Scott Paper Towels, Choose-A-Sheet, 6 Double Rolls = 12 Regular Rolls (108 Sheets Per Roll)",N/A,CNY 46.71,,4.6,22957.0,False,https://m.media-amazon.com/images/I/81GimKZfzDL._AC_UL320_.jpg,https://m.media-amazon.com/images/I/81GimKZfzDL._AC_SL1500_.jpg,,2026-04-14T16:46:03.886463
39,1,Organic,,31.0,B0BF4CYDTH,"POLYTE 430 GSM Microfiber Quick Dry Lint Free Oversize Bath Towel Set, 6 Piece (Waffle Weave)",N/A,CNY 245.78,,4.4,4748.0,False,https://m.media-amazon.com/images/I/917f+8VuybL._AC_UL320_.jpg,https://m.media-amazon.com/images/I/917f+8VuybL._AC_SL1500_.jpg,,2026-04-14T16:46:03.895463
40,1,Organic,,32.0,B079VP6DH5,"Bounty Paper Towels Quick Size, White, 16 Family Rolls = 40 Regular Rolls",N/A,,,4.8,230900.0,False,https://m.media-amazon.com/images/I/81JieznBIhL._AC_UL320_.jpg,https://m.media-amazon.com/images/I/81JieznBIhL._AC_SL1500_.jpg,,2026-04-14T16:46:03.901220
41,1,Organic,,33.0,B08637XW4H,"Chakir Turkish Linens | Hotel & Spa Quality 100% Cotton Premium Turkish Towels | Soft & Absorbent (4-Piece Bath Towels, White)",N/A,CNY 227.35,,4.3,8487.0,False,https://m.media-amazon.com/images/I/81ey4BJ84IL._AC_UL320_.jpg,https://m.media-amazon.com/images/I/81ey4BJ84IL._AC_SL1500_.jpg,,2026-04-14T16:46:03.916160
42,1,Organic,,34.0,B07CFRTNMC,"Amazon Basics Soft and Thick Cotton Hand Towels for Gym, 16 x 26 in, Gray, 12-Pack",N/A,CNY 136.52,,4.7,18928.0,False,https://m.media-amazon.com/images/I/81+8d9PbTKL._AC_UL320_.jpg,https://m.media-amazon.com/images/I/81+8d9PbTKL._AC_SL1500_.jpg,,2026-04-14T16:46:03.927034
43,1,Organic,,35.0,B0BMK73TPP,"KAHAF COLLECTION 100% Cotton Bath Towels, 24x48 Pack of 6 Towels, Quick Dry, Highly Absorbent, Soft Feel Towel, Gym, Spa, Bathroom, Shower, Pool, Luxury Soft Towels (Grey, 24x48-6 Pack)",N/A,CNY 197.98,,3.4,2714.0,False,https://m.media-amazon.com/images/I/91YIxo+7fEL._AC_UL320_.jpg,https://m.media-amazon.com/images/I/91YIxo+7fEL._AC_SL1500_.jpg,,2026-04-14T16:46:03.937460
44,1,Organic,,36.0,B0CP4N6T3B,"Chakir Turkish Linens 100% Cotton Premium Turkish Towels for Bathroom | 30'' x 60'' Large Bath Towels (4 Piece, White)",N/A,CNY 320.91,,4.4,3991.0,False,https://m.media-amazon.com/images/I/81OfJ+s4IPL._AC_UL320_.jpg,https://m.media-amazon.com/images/I/81OfJ+s4IPL._AC_SL1500_.jpg,,2026-04-14T16:46:03.951454
45,1,Organic,,37.0,B0CSKDQCLF,"LANE LINEN 100% Mercerized Cotton Bath Towels Set of 18 – Zero Twist, 6 Bath, 6 Hand Towel & 6 Washcloths, Soft, Ideal for Spa Hotel & Home, Gentle on Body, Durable After Multiple Washes – Cool Grey",N/A,CNY 477.98,,4.2,11340.0,False,https://m.media-amazon.com/images/I/9105uEWgWTL._AC_UL320_.jpg,https://m.media-amazon.com/images/I/9105uEWgWTL._AC_SL1500_.jpg,,2026-04-14T16:46:03.957480
46,1,Organic,,38.0,B00WFUPHF6,"COTTON CRAFT- Euro Spa Set of 4 Luxury Waffle Weave Bath Towels, Oversized Pure Ringspun Cotton, 30 inch x 56 inch, White",N/A,CNY 259.44,,4.4,1404.0,False,https://m.media-amazon.com/images/I/81yOJaoponL._AC_UL320_.jpg,https://m.media-amazon.com/images/I/81yOJaoponL._AC_SL1500_.jpg,,2026-04-14T16:46:03.967974
47,1,Organic,,39.0,B010S5WEZA,"Amazon Basics Highly Absorbent, Fast Drying 100% Cotton Washcloths for Bathroom, Machine Washable, Soft, 12 x 12 in, White, 60-Pack",N/A,CNY 293.59,,4.6,74347.0,False,https://m.media-amazon.com/images/I/61NBfRkYLKL._AC_UL320_.jpg,https://m.media-amazon.com/images/I/61NBfRkYLKL._AC_SL1500_.jpg,,2026-04-14T16:46:03.982856
48,1,Organic,,40.0,B0103XVVME,Luxury White Hand Towels - Soft 100% Turkish Cotton | Highly Absorbent Hotel spa Bathroom Towel Collection | 16x30 Inch | Set of 6,N/A,CNY 157.00,,4.5,24206.0,False,https://m.media-amazon.com/images/I/71XLoBSG4aL._AC_UL320_.jpg,https://m.media-amazon.com/images/I/71XLoBSG4aL._AC_SL1500_.jpg,,2026-04-14T16:46:04.025893
49,1,Organic,,41.0,B0CPT14R69,"ZUPERIA White Bath Towels Bulk 12 Pack (20 x 40 Inches) - 100% Cotton Economy Light Weight Towels for Commercial Use - Quick Dry, Ultra-Soft, and Absorbent Bulk Towels",N/A,CNY 202.76,,3.9,252.0,False,https://m.media-amazon.com/images/I/81nDQei5XYL._AC_UL320_.jpg,https://m.media-amazon.com/images/I/81nDQei5XYL._AC_SL1500_.jpg,,2026-04-14T16:46:04.038261
50,1,Organic,,42.0,B00X17SEXY,COTTON CRAFT Ultra Soft Oversized Bath Towels - 4 Pack Extra Large Bath Towel Set - 30x54 - Absorbent Everyday Luxury Hotel Spa Gym Shower Beach Pool Camp Travel Dorm - 100% Cotton 580 GSM - Linen,N/A,CNY 238.95,,4.5,14445.0,False,https://m.media-amazon.com/images/I/A1MHR3hucwL._AC_UL320_.jpg,https://m.media-amazon.com/images/I/A1MHR3hucwL._AC_SL1500_.jpg,,2026-04-14T16:46:04.053497
51,1,Title,,,,More results,,,,,,False,,,,2026-04-14T16:46:04.053497
52,1,Organic,,43.0,B0DZ5XXK8J,"REDKISS 6-Piece Bath Towel Set - 2 Washcloths, 2 Hand Towels, 2 Bath Towels | Ultra-Fiber Coral Fleece, Super Absorbent, No Lint & No Fading | Perfect for Bathroom, Spa, Gym | Family -Olive Green",N/A,CNY 130.44,,4.1,542.0,False,https://m.media-amazon.com/images/I/81Ba7iYFhLL._AC_UL320_.jpg,https://m.media-amazon.com/images/I/81Ba7iYFhLL._AC_SL1500_.jpg,,2026-04-14T16:46:04.062038
53,1,Organic,,44.0,B0C4CJRB9X,Cozy Earth Ribbed Bath Towel Set - 60% Cotton 40% Viscose from Bamboo Bathroom Towels - Soft & Absorbent Textured Ribbed Pattern - 2 Pack Charcoal,N/A,CNY 874.14,,4.4,61.0,False,https://m.media-amazon.com/images/I/51V4+rJotBL._AC_UL320_.jpg,https://m.media-amazon.com/images/I/51V4+rJotBL._AC_SL1500_.jpg,,2026-04-14T16:46:04.067570
54,1,Organic,,45.0,B013SX3T08,"Tork Multifold Hand Towel, Natural, 100% recycled, FSC certified, Compatible with H2 Dispensers, 16 packs x 250 sheets (MK520A)",N/A,CNY 235.61,,4.5,6268.0,False,https://m.media-amazon.com/images/I/71XQx-nmweL._AC_UL320_.jpg,https://m.media-amazon.com/images/I/71XQx-nmweL._AC_SL1500_.jpg,,2026-04-14T16:46:04.075590
55,1,Organic,,46.0,B0F8QCGZ2C,"Jacquotha Black and Ivory Striped Bath Towels Set of 2, Lighter & Quick Dry Towels Large 27.5 x 55 inches, Farmhouse for Bathroom, Pool, Shower",N/A,CNY 245.78,,4.2,232.0,False,https://m.media-amazon.com/images/I/81HKN64kO+L._AC_UL320_.jpg,https://m.media-amazon.com/images/I/81HKN64kO+L._AC_SL1500_.jpg,,2026-04-14T16:46:04.080629
56,1,Organic,,47.0,B098T6CYQJ,"Unifree Disposable Bath Towels 丨Camping Towel I Gym Towel I Barber Towel 20 Count, Individually Packed, Large Size 27.5 by 55 inches (27.5“x55”)",N/A,CNY 273.10,,4.7,440.0,False,https://m.media-amazon.com/images/I/71CvZJ01+rL._AC_UL320_.jpg,https://m.media-amazon.com/images/I/71CvZJ01+rL._AC_SL1500_.jpg,,2026-04-14T16:46:04.085389
57,1,Organic,,48.0,B00M6XTBJK,"Tork Multifold Hand Towel White H2, Universal, 100% Recycled Fibers, 16 x 250 Towels, MB540A",N/A,CNY 286.42,,4.2,3451.0,False,https://m.media-amazon.com/images/I/71BqYrSR-6L._AC_UL320_.jpg,https://m.media-amazon.com/images/I/71BqYrSR-6L._AC_SL1500_.jpg,,2026-04-14T16:46:04.092949
59,1,Title,,,,"Debug info copied.SponsoredPOLYTE Premium Microfiber Cleaning Towel,16x16 in 36 Pack (Blue,Gray,Yell",,,,,,False,,,,2026-04-14T16:46:04.093454
60,1,Title,,,,Related searchesbath towelswashclothstowels for bathroomtowel sethand towelstowels bathroom sets cle,,,,,,False,,,,2026-04-14T16:46:04.094462
61,1,Title,,,,Previous123...7Next,,,,,,False,,,,2026-04-14T16:46:04.094462
62,1,SB,1.0,,,N/A,https://aax-us-east-retail-direct.amazon.com/x/c/JOruifs9sS5L4HhJQv3S02oAAAGdiys-qAEAAAH2AQBvbm9fdHhuX2JpZDQgICBvbm9fdHhuX2ltcDEgICDViUKn/clv1c_ek-wBIfXJbbUzY6hNQRl7tqa7V2Zf1Bw4dw-vosJmgnddsdw9I6NB-tMl1pkUD8orArRkacKPIcHl1KtkhCT02RZumSr26r_QPBFyygd0gj1qxfakqXdyb3IJ_lxutIw3hG36tJFB4ZHJu05UNqjbC8Y5d2fiH36EsHeSDemqBYPWG8zZqCcfkbjQrZ-BVoeuK7A93EH_0dJ1uiZ_6gTMmqCQQytEFeWZH5MpuauJ4PSVFambO0CZVwMfNfoZ-ptFroa9vXXS7bkQia5hVIhAZ_hKbldhn4T-cVI-WQLCbg_Au9Png8OWgq7FW6JOvbwdN6NWiega_DvzNaUqXxlgt4cquIDIV8qa-jWdoAm7Z7XKJF8S2p3vohgnztSws6asky1JQT9cYVfVPiT3VfvRGwYahAZZVIEq_aM5M44hhc4nmtMmrPXf4hBh72Ye8bNzMDMwiGyKq8yiHj1jsHe12wNK5gjXPRfMAt1fPCQJW2CPVGLLb4xdqlkZSngEgnWyQsZP7fJyMfafVi-k-FjeKUPYpimiEcJuMU05f0X1ne7fNwgN9AsyIVKopfb0mmQPfPk4FrbPdgqIG1KXn0PiOaRRsjPnO1gBbuGIzX7i0nSNjMItGrKzCaJ56F_2pdSK29GrQ4OU2r2BaontEDPujwHDsmBip11e05KYm8zCCHmIjCQmtLudrX47-w9ITrAMEnagDolUaF3cT7uwlROBqayZ1Ua2HFjAToiqgX0xLS-YyOFETUQvX3oEPbpqmcbY8p9E-zefi2uMdWfUwC6RmyDcFx95eYiQw8KmRIjx6hhYWoSKzAPMaKP69UNHkCRiRuLyHC8OqDAt2bJ-uVEX4qd4UFAONkL8Q1tXeIh9tf0P6TvuH6HBF_hKhCH20WcgrAL6ZeKnd5HfP87kF8ErnwuTMsvpGw2BfDZVmxGzSDDKooOXTuaemIfg8G6HWVj-oq6EWhohak9dFhwDiG04FRqd8KldbaqVZx6-s7Wj71PB8MdR_TBytYmWYeHifFFenr5POkZisAPFijj03QPLHWNdZFG_j6autM02txxxB9TJ3ar49qiN-FNJUdGhhM1_cWzGb7vzJENXJv-bXkK-BkhSPqfflWQg2sqwjvop7tDSDYiisNhVvludiSSGjDN3ABOX41VlE6B9bFeOwff0754wEO5SSRUUgF4p38guAbTRhVCcNLeFsXV8FT3viOLtLdoHd_x4VdbbrSPIp0cL3pRkDgYP_ZM3ieva-EIGuYGzSbQ7MuLI729s9_DYaBsH8TloxMYLhBUgZ9ClbqABpfCxOJd8YZ_Nu4Bf6ELx9EEo3HtbbxhlX7bMPU7TFeyTSyC9yJAsuS2-JJSRYLO0Kqj9_sBBRrEB7RtcAQJDeQ2s4o3Y-sVAfykYLAf7AXLtczE7-ayDWc-Qbnq5Ua1v-oTUMKu7gB6w8QbsckFuC35Du_9ubnFCob-vDcpy8JyXKyduofUmiW4sQHqK28bCZ0hHx3Ey0--d4Cr8kAGZqfvg_Gr89jvkG00ySC6rkojgW-l_fQ4Y5wDhLUr01kHY7B9UeghEQY2LRUtOF9uF0aN6w33ulKtomvQlZWmllArmDTh-WV6BRin_cPHRVMu-Uji-5GMVmrXAISJJcxTcneBiThx4th-hwnNNSoR0-kTZxV6e3Gb2UCHRrE8UkksS-47rg/https://www.amazon.com/stores/page/EB347CD0-BE59-4E4E-9BD0-60C130F3F2BF/?_encoding=UTF8&store_ref=SB_A06464962I13FA9MIOBM2-A10396181GLQRPWXHLVPT&pd_rd_plhdr=t&aaxitk=3549b2257b06a38a03e80e47317e21a0&hsa_cr_id=0&lp_asins=B09MGB275D&lp_query=towels&lp_slot=desktop-hsa-3psl&ref_=sbx_be_s_3psl_mbd_mb0_bkgd&pd_rd_w=zwA9Y&content-id=amzn1.sym.cd7c548b-a599-426f-9ffe-daa1aa803c87%3Aamzn1.sym.cd7c548b-a599-426f-9ffe-daa1aa803c87&pf_rd_p=cd7c548b-a599-426f-9ffe-daa1aa803c87&pf_rd_r=AN9VTFYHFPV9HVBD8FAR&pd_rd_wg=QCdjy&pd_rd_r=33358233-aaa4-42ed-abb8-631693ef8a5a,,,,,False,,,N/A,2026-04-14T16:46:04.103986
63,1,Title,,,,Need help?Visit the help sectionorcontact us,,,,,,False,,,,2026-04-14T16:46:04.105495
0,2,Title,,,,ResultsCheck each product page for other buying options. Price and other details may vary based on p,,,,,,False,,,,2026-04-14T16:46:18.234774
2,2,Organic,,49.0,B000UC5R92,Genuine Joe GJO22600 Embossed Hardwound Roll Towels (Pack of 6),N/A,CNY 230.28,,4.4,3344.0,False,https://m.media-amazon.com/images/I/619JNtDCqEL._AC_UL320_.jpg,https://m.media-amazon.com/images/I/619JNtDCqEL._AC_SL1500_.jpg,,2026-04-14T16:46:18.241651
3,2,Organic,,50.0,B0DL668H54,COTTON CRAFT Oversized Beach Towel - 2 Pack 35 x 70 inches XL Beach Towel - 100% Cotton Velour - Big & Huge - Thick Plush 450 GSM Super Soft Luxury Towel - Pool Picnic Bath - Cabana Stripe Black,N/A,CNY 215.05,,4.6,225.0,False,https://m.media-amazon.com/images/I/61XLibYASDL._AC_UL320_.jpg,https://m.media-amazon.com/images/I/61XLibYASDL._AC_SL1500_.jpg,,2026-04-14T16:46:18.252722
4,2,Organic,,51.0,B08TGZPPY7,"LANE LINEN 100% Cotton Turkish Towel Set for Bathroom - 6 Piece - Super Soft, Quick Dry & Highly Absorbent - 2 Bath, 2 Wash cloths, 2 Hand Towels - Hotel Quality, Durable & OEKO-TEX Certified - Grey",N/A,CNY 204.81,,4.1,5489.0,False,https://m.media-amazon.com/images/I/A1SbSWyqbXL._AC_UL320_.jpg,https://m.media-amazon.com/images/I/A1SbSWyqbXL._AC_SL1500_.jpg,,2026-04-14T16:46:18.262774
5,2,Title,,,,New Release: Oversized Beach Towel Set - SpringShop Cloud ScapeLinenPrevious pageCLOUDSCAPE Turkish ,,,,,,False,,,,2026-04-14T16:46:18.265379
6,2,Title,,,,More results,,,,,,False,,,,2026-04-14T16:46:18.265379
7,2,Organic,,52.0,B07VMB9DDP,"Sand Cloud Turkish Beach Towel - Sand Proof - 100% Certified Organic Turkish Towel - Quick Dry Towel for Beach, Picnic, Blanket or Bath Towel - As Seen on Shark Tank - Gocek (Black)",N/A,CNY 327.80,,4.6,1301.0,False,https://m.media-amazon.com/images/I/91+yYv87U-L._AC_UL320_.jpg,https://m.media-amazon.com/images/I/91+yYv87U-L._AC_SL1500_.jpg,,2026-04-14T16:46:18.276721
8,2,Organic,,53.0,B00Q7JFDKK,"Amazon Basics 6-Piece Fade-Resistant 100% Cotton Towel Set, Soft and Absorbent, 2 Bath Towels, 2 Hand Towels, 2 Washcloths, Navy Blue",N/A,CNY 147.44,,4.4,16820.0,False,https://m.media-amazon.com/images/I/81Ryl3HyWuL._AC_UL320_.jpg,https://m.media-amazon.com/images/I/81Ryl3HyWuL._AC_SL1500_.jpg,,2026-04-14T16:46:18.288866
9,2,Organic,,54.0,B0D4CXX16H,"Amazon Basics Fade-Resistant 100% Cotton Bath Towel, 30""x54"", Teal Green, 2-Pack",N/A,CNY 161.31,,4.2,285.0,False,https://m.media-amazon.com/images/I/81eufHl4ABL._AC_UL320_.jpg,https://m.media-amazon.com/images/I/81eufHl4ABL._AC_SL1500_.jpg,,2026-04-14T16:46:18.314151
10,2,Organic,,55.0,B00YNKCWWC,"Utopia Towels Luxurious Bath Towels Set, 27 x 54 Inches 100% Ring Spun Cotton, 4 Pack White",N/A,CNY 340.03,,4.4,15626.0,False,https://m.media-amazon.com/images/I/81EN1PFTtFL._AC_UL320_.jpg,https://m.media-amazon.com/images/I/81EN1PFTtFL._AC_SL1500_.jpg,,2026-04-14T16:46:18.329690
11,2,Organic,,56.0,B08WQCCVHC,"Tork Soft Xpress Multifold Paper Hand Towels White, H2 System Compatible 16 Packs X 135 Towels Each (MB579)",N/A,CNY 282.46,,4.6,3456.0,False,https://m.media-amazon.com/images/I/713L+j53nWL._AC_UL320_.jpg,https://m.media-amazon.com/images/I/713L+j53nWL._AC_SL1500_.jpg,,2026-04-14T16:46:18.334205
12,2,Organic,,57.0,B0BZKV4KM2,"LANE LINEN Turkish Beach Towels for Women, Set of 6 - Large 39""x71"", Pre-Washed, No-Shrink, Sand-Free, Quick Dry, Lightweight, Soft Beach Bath Towels - Vintage Beach",N/A,CNY 273.10,,4.4,7920.0,False,https://m.media-amazon.com/images/I/81mhLSw7USL._AC_UL320_.jpg,https://m.media-amazon.com/images/I/81mhLSw7USL._AC_SL1500_.jpg,,2026-04-14T16:46:18.342031
13,2,Title,,,,More results,,,,,,False,,,,2026-04-14T16:46:18.343039
14,2,Organic,,58.0,B004YK2KSM,"Pacific Blue Select Multifold Premium 2-Ply Paper Towels (Previously Branded Signature) by GP PRO (Georgia-Pacific), White, 21000, 125 Paper Towels Per Pack, 16 Packs Per Case",N/A,,,4.6,23132.0,False,https://m.media-amazon.com/images/I/71dX1kJRLkL._AC_UL320_.jpg,https://m.media-amazon.com/images/I/71dX1kJRLkL._AC_SL1500_.jpg,,2026-04-14T16:46:18.346551
