data_index,page,ad_type,ad_rank,organic_rank,asin,title,url,price_current,price_list,rating_stars,rating_count,is_prime,image_small,image_large,brand_name,scraped_at,inner_products_count
0,1,SB,1.0,,,Super Soft Absorbent Towels,https://aax-us-east-retail-direct.amazon.com/x/c/JC3HKyxjTxG7Rnjkh62PKbkAAAGdizA_PAEAAAH2AQBvbm9fdHhuX2JpZDUgICBvbm9fdHhuX2ltcDIgICDvRG3h/clv1c_ek-wBAfWFcbSDn0nIotrJ16WpAySuUbn_6iobn2ijwMP6c7XK1ifaKQRHdtLZYV565FBkQKkBz79eQFQVv0sxtwkjUzxVmtTWuxlCtBvxf5SQyU7etPCGXHa1rm0InAEIKOOtqy2tdTfOndd6GHm21HXmB3cll_yncXsw5f7TQIRQz9b8aTrMir754JzHPCau-CBN8xNEQHcTfg1dwhnYyKPBFtbYEQv_iyOq3cOZ8Fu6hGxLTx39i7WNIimA9_Hjv0_FSdNxx2fo4ohh_GUksZVoPjsbBx33E63vXaY8ggQ-fogJTcEPHpLL85xrs8cwEaqQqA-iSAiredf-45XQIEyoB_qQGAzzEz8jxPkTtdfSStJ38RmDnGAHxFcnoy99E-YVUr_sjvr4Ts6_p-M0SWIuI7A0vex-SJkqXKmFg1QokFXKc8fTr-Nor-PZDIKREA6L1EUzjRQKMADXUGwfWcdYa36XqowxwAKn5L-XR-2ReyxjvWE35Q57UYXbW3vbKCYd-JrkmZC5RvHFGx6xX1rTeEEJE1BeVNYBjyfWkM_qxMH5bdG8t6Y3_msewr3Co67-ssoO4ODmS-alhAfz-MZLXK6IIQ4otVjB8Gwh3EuCeVTHQgtRu0MMBEHLh7XIhACZoX4fSp0RodMnV5CMt7UE55L9Fg7nVHmtGEj3hMLkj8jFXzhu5FMh7ogkv24J8lvuXE_UCSwf3gFa9FPxg9O7ST8Gq5mCe8zDewhm5AmlUGc2Kfp4teMJnRqcbsX8ls_B7L3R3a4e8js11sAyuRqGihFRdg30o8zI7b7sDueczXQvB-RX5xw06GuRySmgGJRDl8kNhTS-3CGFi1mBGG5B4aKhonAXqbuuwiP3oWjilol-VCNJ7Ii9Hiz2sQwcsYT8PhjAF3N1lM5yOYnADV5oGtIyUtIaSClCh8k3V5ON51EoWY9wYRkJx7zHm2OGywvzZ4scEpKGuqEsC62BeVkeIqRhRwfpAswLo05aeqykhJYHMvM4jnurwCG6LFbOESaBNmLI-LMSdln8bxAFsebYYL4Uz0meLQeI8FiMdpTY9jsQyCU8tIgT9DT3cEp5pPro25kyYxjZobuse9yPnLHnWxJsBiw614OUe9Mu387jM9Fh6a8N5dJ6jm46aZ6DWFYEjK6c1TOEfuai-RrrwhPgecNLZTk7TgKaJ1S7sHHkR-dtZukhfoN7uhBmrgrBCOsqYU6lGCeyTGAu6OY_feib3KrPy685wLU9G3popvsV7RmGX5bjGx3cWZeV0kxxjec5DqIjLxooikmMwXuDP3SktXKbPS70d8PYVX_yv5R1cl2vzWPTkkzZxbBML0W_m5mCQWFGCaDg_HZ_heTxtc6MWK5q9K0kwgZigdgLp6m1lZYKc0Red5CQ8e2PKQTXZjXTPtZHfzA_lXq8oSTt0NmbmIWqfFAxbgGn6A64tysBVY3GBz3LGWKOvApb09WgK7zTApkKbL-XbOw6z3hMkopqJ9ktYUsZ-lUpJxuQtRAApFQnkX_YcEdfaNx1xMkUlz7v3ZbP3GH9Qsfsz2hLYmIG0iuxCvxOdNTRRs1ZWLL6I-m9ldBjMzWjU6nuMioE40ADRkHVAKl_6kEdkbRDLru8m-KMqfgrc1hS3e9_t1NujZzMDkJjx9WDQlieTZ6Td_UzXNfbmYBPvDFqvOoTEwG9rPz-NYwkN3XhKl_/https://www.amazon.com/stores/page/CE940073-6082-492E-A3E3-4FE3AE9F4408/?_encoding=UTF8&store_ref=SB_A083062522BUINFHQKBQY-A04351963UR3S5S9R8BL6&pd_rd_plhdr=t&aaxitk=15f2ae3c10826f9d1aad7e25d834281f&hsa_cr_id=0&lp_asins=B08LBN2JPS%2CB08LBKXYWF%2CB08LBMMHDN&lp_query=towels&lp_slot=auto-sparkle-hsa-tetris&ref_=sbx_s_sparkle_sbtcd_bkgd&pd_rd_w=aJcqt&content-id=amzn1.sym.2fb72bc8-96ef-420d-b08f-c04b69f36507%3Aamzn1.sym.2fb72bc8-96ef-420d-b08f-c04b69f36507&pf_rd_p=2fb72bc8-96ef-420d-b08f-c04b69f36507&pf_rd_r=N022TJ1T9KGBTCH6Y5X3&pd_rd_wg=Ar7ma&pd_rd_r=0f831535-ea99-412b-8811-0c6573a6e77e,,,,,False,"https://m.media-amazon.com/images/S/al-na-9d5791cf-3faf/30bfe224-61c0-46b2-9970-344932738c04._CR0,0,600,600_AC_SX130_SY60_CB1169409_QL70_.png",,Super Soft Absorbent Towels,2026-04-14T16:51:31.493123,3.0
1,1,Title,,,,ResultsCheck each product page for other buying options. Price and other details may vary based on p,,,,,,False,,,,2026-04-14T16:51:31.494128,
3,1,SP,1.0,,B00Q7JESL0,"Amazon Basics 6-Piece Fade-Resistant 100% Cotton Towel Set for Bathroom, Soft and Absorbent, 2 Bath Towels, 2 Hand Towels, 2 Washcloths, Gray",N/A,$18.99,,4.4,26407.0,False,https://m.media-amazon.com/images/I/71MvNzm6GiL._AC_UL320_.jpg,https://m.media-amazon.com/images/I/71MvNzm6GiL._AC_SL1500_.jpg,,2026-04-14T16:51:31.502149,
4,1,SP,2.0,,B08LBN2JPS,"Tens Towels Pack of 4 Extra Large Bath Towels 30 x 60 Inches, 100% Cotton, Larger & Lighter Weight, Quicker to Dry, Super Soft and Absorbent, Perfect for Bathroom, Dark Grey",N/A,$35.99,,4.3,22932.0,False,https://m.media-amazon.com/images/I/918gCoGCVYL._AC_UL320_.jpg,https://m.media-amazon.com/images/I/918gCoGCVYL._AC_SL1500_.jpg,,2026-04-14T16:51:31.508210,
5,1,SP,3.0,,B0GMY978L7,"Artstyle Disposable Hand Towels for Bathroom, White Linen-Feel Guest Towels, Soft and Absorbent Dinner Paper Napkins, 12-inch x 17-inch, 100 ct.",N/A,$21.99,,4.8,16.0,False,https://m.media-amazon.com/images/I/81kw+nBrczL._AC_UL320_.jpg,https://m.media-amazon.com/images/I/81kw+nBrczL._AC_SL1500_.jpg,,2026-04-14T16:51:31.513236,
6,1,SP,4.0,,B07Q6Z59F2,"SKL Home Flips & Flops Hand Towel (2-Pack), Blue",N/A,$16.99,,4.8,985.0,False,https://m.media-amazon.com/images/I/910DekQ7hCL._AC_UL320_.jpg,https://m.media-amazon.com/images/I/910DekQ7hCL._AC_SL1500_.jpg,,2026-04-14T16:51:31.515475,
7,1,Organic,,1.0,B08LBN2JPS,"Tens Towels Pack of 4 Extra Large Bath Towels 30 x 60 Inches, 100% Cotton, Larger & Lighter Weight, Quicker to Dry, Super Soft and Absorbent, Perfect for Bathroom, Dark Grey",N/A,$35.99,,4.3,22932.0,False,https://m.media-amazon.com/images/I/918gCoGCVYL._AC_UL320_.jpg,https://m.media-amazon.com/images/I/918gCoGCVYL._AC_SL1500_.jpg,,2026-04-14T16:51:31.529146,
8,1,Organic,,2.0,B0FGQD1N6K,"Grey Bath Towels 30x60 – Pack of 4 | Soft, Light Weight & Quick-Dry | Highly Absorbent 100% Combed Yarn Cotton Towels for Bathroom, Spa, Home & Hotel Use (Grey Bath Towels, 30x60- Pack of 4)",N/A,$34.99,,4.4,36.0,False,https://m.media-amazon.com/images/I/71RjjqWPRSL._AC_UL320_.jpg,https://m.media-amazon.com/images/I/71RjjqWPRSL._AC_SL1500_.jpg,,2026-04-14T16:51:31.536741,
9,1,Organic,,3.0,B0GNF3KBSD,"DecorRack 4 Premium Turkish Bath Collection Towels, 100% Combed Turkish Cotton, 600 GSM, Super Plush, Ultra Absorbent and Quick Dry, Includes 4 Bath Towels, 27 x 54 inch, Gray (Set of 4)",N/A,$59.99,,,,False,https://m.media-amazon.com/images/I/91icUoTOjGL._AC_UL320_.jpg,https://m.media-amazon.com/images/I/91icUoTOjGL._AC_SL1500_.jpg,,2026-04-14T16:51:31.543481,
11,1,Title,,,,New arrivalsSponsored| Based on items added in the past 60 daysCASA COPENHAGEN Solitaire 6Pcs 100% E,,,,,,False,,,,2026-04-14T16:51:31.545899,
12,1,Title,,,,More results,,,,,,False,,,,2026-04-14T16:51:31.545899,
13,1,Organic,,4.0,B0B8CZM73P,"Towel and Linen Mart 100% Cotton 6 Pack Bath Towel Set, Quick Dry, Super Absorbent, Light Weight, Soft, (27 x 54 Pack of 6) Beige, White, Grey, Sky Blue, SAGE Green, Navy",N/A,$24.49,,4.1,14810.0,False,https://m.media-amazon.com/images/I/91a5pVB983L._AC_UL320_.jpg,https://m.media-amazon.com/images/I/91a5pVB983L._AC_SL1500_.jpg,,2026-04-14T16:51:31.553432,
14,1,Organic,,5.0,B0BB29GC7W,"GLAMBURG 100% Cotton 2 Pack Oversized Bath Towel Set 28x55 Inches, Ultra Soft Highly Absorbant Compact Quickdry & Lightweight Large Bath Towels, Ideal for Gym Travel Camp Pool - Black",N/A,$13.78,,4.1,9116.0,False,https://m.media-amazon.com/images/I/81JqWneZqpL._AC_UL320_.jpg,https://m.media-amazon.com/images/I/81JqWneZqpL._AC_SL1500_.jpg,,2026-04-14T16:51:31.562475,
15,1,Organic,,6.0,B07FBZVWB4,"KAHAF COLLECTION 6 Pack Bath Towels Set (27 x 54 Inches) 100% Ring Spun Cotton, Lightweight, Quick Dry, Highly Absorbent Towels Multicolor, (27x54) Inches",N/A,$24.95,,3.6,9018.0,False,https://m.media-amazon.com/images/I/81y0Jtp3DJL._AC_UL320_.jpg,https://m.media-amazon.com/images/I/81y0Jtp3DJL._AC_SL1500_.jpg,,2026-04-14T16:51:31.569115,
16,1,SP,5.0,,B07CFRTNMC,"Amazon Basics Soft and Thick Cotton Hand Towels for Gym, 16 x 26 in, Gray, 12-Pack",N/A,$19.99,,4.7,18928.0,False,https://m.media-amazon.com/images/I/81+8d9PbTKL._AC_UL320_.jpg,https://m.media-amazon.com/images/I/81+8d9PbTKL._AC_SL1500_.jpg,,2026-04-14T16:51:31.575167,
17,1,SP,6.0,,B0C3MMZ5R3,"Cotton Paradise 6 Piece Towel Set, 100% Cotton Soft Absorbent Turkish Towels for Bathroom, 2 Bath Towels 2 Hand Towels 2 Washcloths, Lilac Towel Set",N/A,$33.99,,4.4,18879.0,False,https://m.media-amazon.com/images/I/91DmE-ShZUL._AC_UL320_.jpg,https://m.media-amazon.com/images/I/91DmE-ShZUL._AC_SL1500_.jpg,,2026-04-14T16:51:31.581192,
18,1,SP,7.0,,B0FPR7QYK8,"Large Bath Towel Set 4 Pack, 30×60 Inches, 100% Cotton Bathroom Towels, Soft, Absorbent & Comfortable for Home, Spa, Gym (White)",N/A,$36.99,,4.2,118.0,False,https://m.media-amazon.com/images/I/71SifXa-dsL._AC_UL320_.jpg,https://m.media-amazon.com/images/I/71SifXa-dsL._AC_SL1500_.jpg,,2026-04-14T16:51:31.586030,
19,1,SP,8.0,,B08637XW4H,"Chakir Turkish Linens | Hotel & Spa Quality 100% Cotton Premium Turkish Towels | Soft & Absorbent (4-Piece Bath Towels, White)",N/A,$33.29,,4.3,8487.0,False,https://m.media-amazon.com/images/I/81ey4BJ84IL._AC_UL320_.jpg,https://m.media-amazon.com/images/I/81ey4BJ84IL._AC_SL1500_.jpg,,2026-04-14T16:51:31.593552,
20,1,Organic,,7.0,B079VP6DH5,"Bounty Paper Towels Quick Size, White, 16 Family Rolls = 40 Regular Rolls",N/A,$43.49,,4.8,230900.0,False,https://m.media-amazon.com/images/I/81JieznBIhL._AC_UL320_.jpg,https://m.media-amazon.com/images/I/81JieznBIhL._AC_SL1500_.jpg,,2026-04-14T16:51:31.598892,
22,1,Title,,,,"Debug info copied.SponsoredTens Towels Pack of 4 Extra Large Bath Towels 30 x 60 Inches, 100% Cotton",,,,,,False,,,,2026-04-14T16:51:31.599900,
23,1,Title,,,,Super Soft Absorbent TowelsSponsored|Top 10 best-selling brand in bathroom towels|Shop Tens TowelsSh,,,,,,False,,,,2026-04-14T16:51:31.601405,
24,1,Title,,,,More results,,,,,,False,,,,2026-04-14T16:51:31.601405,
25,1,Organic,,8.0,B00GQP0XTQ,"Utopia Towels 8 Piece Luxury Towel Set – Majestic Plush, Super Absorbent & Quicker-to-Dry, Thick 100% Ring Spun Cotton Towels for Bathroom, Spa & Hotel – 2 Bath, 2 Hand, 4 Washcloths, Grey",N/A,$26.99,,4.4,73684.0,False,https://m.media-amazon.com/images/I/91xpBpKYs8L._AC_UL320_.jpg,https://m.media-amazon.com/images/I/91xpBpKYs8L._AC_SL1500_.jpg,,2026-04-14T16:51:31.615112,
26,1,Organic,,9.0,B09FZT5BYV,"LANE LINEN 18-Pack Premium Towels for Bathroom – 100% Cotton Towel Set, Zero Twist, 6 Bath, 6 Hand & 6 Washcloths,Gentle on Body, Highly Absorbent, Remains Soft After Wash, Hotel & Spa Quality – Grey",N/A,$64.99,,4.2,11340.0,False,https://m.media-amazon.com/images/I/91ZvFOmrZPL._AC_UL320_.jpg,https://m.media-amazon.com/images/I/91ZvFOmrZPL._AC_SL1500_.jpg,,2026-04-14T16:51:31.627423,
27,1,Organic,,10.0,B07Q32S3B2,"Utopia Towels 4 Pack Premium Bath Towels Set, 27 by 54 Inches, 100% Ring Spun Cotton 600GSM, Lightweight and Highly Absorbent Quick Drying Towels, Perfect for Daily Use, Grey",N/A,$28.99,,4.4,21375.0,False,https://m.media-amazon.com/images/I/A1-LYS2k2DL._AC_UL320_.jpg,https://m.media-amazon.com/images/I/A1-LYS2k2DL._AC_SL1500_.jpg,,2026-04-14T16:51:31.643875,
28,1,SP,9.0,,B0FWW9GCTT,"REDKISS 2 Pack Large Bath Towels Set, 100% Cotton, 31x63 in, Heavyweight 760G, Highly Absorbent & Quick Dry, Super Soft Luxury Towels for Bathroom,Hotel Collection - Pink",N/A,$39.98,,4.4,196.0,False,https://m.media-amazon.com/images/I/8190kowIdfL._AC_UL320_.jpg,https://m.media-amazon.com/images/I/8190kowIdfL._AC_SL1500_.jpg,,2026-04-14T16:51:31.648886,
29,1,SP,10.0,,B0GJCXJV49,"ecolook 2 Pack Bath Towels Set,55x28 Inches,100% Cotton,Lighter Weight,Soft & Highly Absorbent,Quick Dry Towels for Bathroom,Gym, Shower, Hotel,Spa and Daily Use,Pink",N/A,$35.99,,4.3,9.0,False,https://m.media-amazon.com/images/I/81ZRdK6hqaL._AC_UL320_.jpg,https://m.media-amazon.com/images/I/81ZRdK6hqaL._AC_SL1500_.jpg,,2026-04-14T16:51:31.655118,
30,1,SP,11.0,,B07YF613R1,"Modern Threads - Spun Loft 6-Piece 100% Combed Cotton Towel Set - Bath Towels, Hand Towels, & Washcloths - Super Absorbent & Quick Dry - 600 GSM - Soft & Plush, Blush",N/A,$34.99,,4.5,1460.0,False,https://m.media-amazon.com/images/I/91bWjcU1GiL._AC_UL320_.jpg,https://m.media-amazon.com/images/I/91bWjcU1GiL._AC_SL1500_.jpg,,2026-04-14T16:51:31.662144,
31,1,SP,12.0,,B07G9LQFJ8,"Luxury White Bath Towel Set of 8 Pieces - 100% Turkish Cotton 700 GSM Highly Absorbent Towels for Bathroom, 2 Bath Towels, 2 Hand Towels, 4 Washcloths",N/A,$39.99,,4.5,14258.0,False,https://m.media-amazon.com/images/I/91y2TKtZXCL._AC_UL320_.jpg,https://m.media-amazon.com/images/I/91y2TKtZXCL._AC_SL1500_.jpg,,2026-04-14T16:51:31.670855,
32,1,Organic,,11.0,B0FHVWM2B1,"HOMEXCEL Grey Bath Towels 2 Pack, Microfiber Bathroom Towel, Super Soft Highly Absorbent Bath Towel Set, Quick Drying Towels for Sport, Yoga, SPA, Fitness",N/A,$11.99,,4.2,1980.0,False,https://m.media-amazon.com/images/I/81hygPimWaL._AC_UL320_.jpg,https://m.media-amazon.com/images/I/81hygPimWaL._AC_SL1500_.jpg,,2026-04-14T16:51:31.676675,
33,1,Organic,,12.0,B07PBXXNCY,"Clean Skin Club Clean Towels XL®, 100% USDA Biobased Face Towel, Disposable Face Towelette, Eczema Association Accepted, Makeup Remover Dry Wipes, Ultra Soft, 1 Pack, 50 Ct",N/A,$17.95,,4.8,42916.0,False,https://m.media-amazon.com/images/I/61Cn1ooILhL._AC_UL320_.jpg,https://m.media-amazon.com/images/I/61Cn1ooILhL._AC_SL1500_.jpg,,2026-04-14T16:51:31.684321,
34,1,Title,,,,More results,,,,,,False,,,,2026-04-14T16:51:31.684321,
35,1,Organic,,13.0,B081FJHMYF,"KAHAF Collection 6-Pack Bath Towels - Lightweight - Extra Absorbent - 100% Cotton - Shower towels (Multi, 27 inchesx54 inches)",N/A,$26.99,,4.0,23640.0,False,https://m.media-amazon.com/images/I/81UwogJF3yL._AC_UL320_.jpg,https://m.media-amazon.com/images/I/81UwogJF3yL._AC_SL1500_.jpg,,2026-04-14T16:51:31.690322,
36,1,Organic,,14.0,B09ZTS9ZC9,"Orighty Bath Towels Pack of 2(27'' x 54'') - Soft Feel, Highly Absorbent, Quick Drying Microfiber for Body, Sport, Yoga, SPA, Fitness - Grey",N/A,$13.49,,4.3,6530.0,False,https://m.media-amazon.com/images/I/71D-QQImzWL._AC_UL320_.jpg,https://m.media-amazon.com/images/I/71D-QQImzWL._AC_SL1500_.jpg,,2026-04-14T16:51:31.699613,
37,1,Organic,,15.0,B09MGCNMVC,"Lacoste Heritage 100% Supima Cotton Bath Towel, Aloe, 30"" x 54"" – Highly Absorbent & Quick Drying, Premium Super Soft Bath Towel, Bathroom Essential, Gift for All Occasions, Machine Washable",N/A,$14.40,,4.5,1814.0,False,https://m.media-amazon.com/images/I/91IBivulYfL._AC_UL320_.jpg,https://m.media-amazon.com/images/I/91IBivulYfL._AC_SL1500_.jpg,,2026-04-14T16:51:31.717550,
38,1,Organic,,16.0,B07VN49QF5,"Utopia Towels Jumbo Bath Sheet 2 Piece, 600 GSM, 35 by 70 Inches, 100% Ring Spun Cotton, Absorbent and Quick Dry Extra Large Bath Towel, Grey",N/A,$28.99,,4.4,55193.0,False,https://m.media-amazon.com/images/I/91ivZLrHkuL._AC_UL320_.jpg,https://m.media-amazon.com/images/I/91ivZLrHkuL._AC_SL1500_.jpg,,2026-04-14T16:51:31.733141,
39,1,Organic,,17.0,B09BWFX1L6,"Amazon Basics 2-Ply Flex-Sheets Paper Towels, 12 Basics Rolls = 40 Regular Rolls, Everyday Value with 150 Sheets per Roll, Packaging May Vary",N/A,$22.86,,4.1,69025.0,False,https://m.media-amazon.com/images/I/71v-pTar1AL._AC_UL320_.jpg,https://m.media-amazon.com/images/I/71v-pTar1AL._AC_SL1500_.jpg,,2026-04-14T16:51:31.743269,
40,1,Organic,,18.0,B083KKF8F8,"Utopia Towels 6 Pack Premium Hand Towels Set, 16 by 28 inches, 100% Ring Spun Cotton, Ultra Soft and Highly Absorbent 600GSM Towels for Bathroom, Gym, Shower, Hotel, and Spa, Grey",N/A,$22.99,,4.5,31361.0,False,https://m.media-amazon.com/images/I/912g5sx4EpL._AC_UL320_.jpg,https://m.media-amazon.com/images/I/912g5sx4EpL._AC_SL1500_.jpg,,2026-04-14T16:51:31.758632,
41,1,Organic,,19.0,B0DRVY8MKY,"Utopia Towels 4 Pack Premium Extra Large Bath Towels Set, (30 x 60 Inches) 100% Ring Spun Cotton, Lightweight and Highly Absorbent Quick Drying Towels, Perfect for Daily Use (Grey)",N/A,$37.99,,4.5,500.0,False,https://m.media-amazon.com/images/I/91XUUY5K6SL._AC_UL320_.jpg,https://m.media-amazon.com/images/I/91XUUY5K6SL._AC_SL1500_.jpg,,2026-04-14T16:51:31.773876,
42,1,Organic,,20.0,B01H65F6A0,"American Soft Linen Luxury 6 Piece Towel Set, 2 Bath Towels 2 Hand Towel 2 Washcloths, 600 GSM 100% Cotton Turkish Towels for Bathroom, White Towel Sets",N/A,$39.99,,4.4,77880.0,False,https://m.media-amazon.com/images/I/814IAxFvSvL._AC_UL320_.jpg,https://m.media-amazon.com/images/I/814IAxFvSvL._AC_SL1500_.jpg,,2026-04-14T16:51:31.787073,
43,1,Organic,,21.0,B01N2VYF50,"Utopia Towels 4 Pack Premium Bath Towels Set, 27 by 54 Inches, 100% Ring Spun Cotton 600GSM, Lightweight and Highly Absorbent Quick Drying Towels, Perfect for Daily Use, White",N/A,$27.59,,4.4,21375.0,False,https://m.media-amazon.com/images/I/81OsOFt-tSL._AC_UL320_.jpg,https://m.media-amazon.com/images/I/81OsOFt-tSL._AC_SL1500_.jpg,,2026-04-14T16:51:31.804233,
44,1,Title,,,,More results,,,,,,False,,,,2026-04-14T16:51:31.804738,
45,1,Organic,,22.0,B007JCHA6E,"Utopia Towels 24 Pack Cotton Washcloths Set, 100% Ring Spun Cotton, Premium Quality Flannel Face Cloths, Highly Absorbent and Soft Feel Fingertip Towels, White",N/A,$18.98,,4.6,73514.0,False,https://m.media-amazon.com/images/I/81BLni5VOCL._AC_UL320_.jpg,https://m.media-amazon.com/images/I/81BLni5VOCL._AC_SL1500_.jpg,,2026-04-14T16:51:31.823873,
46,1,Organic,,23.0,B0CJVGCFLM,"Utopia Towels 6 Pack Medium Bath Towel Set, 24 by 48 Inches, 500 GSM 100% Ring Spun Cotton, Lightweight and Highly Absorbent Quick Drying Premium Towels for Hotel, Spa and Bathroom, Cool Grey",N/A,$30.99,,4.3,28564.0,False,https://m.media-amazon.com/images/I/91TfS4j2X4L._AC_UL320_.jpg,https://m.media-amazon.com/images/I/91TfS4j2X4L._AC_SL1500_.jpg,,2026-04-14T16:51:31.836608,
47,1,Organic,,24.0,B01056KA58,"White Classic Luxury Bath Towels Set of 4 Large - 700 GSM Turkish Cotton Ultra Soft Bath Towels 27x54 | Highly Absorbent and Quick Dry | Hotel Towels for Bathroom Luxury, Plush Shower Towels, White",N/A,$44.99,,4.4,12840.0,False,https://m.media-amazon.com/images/I/81i11OTEtKL._AC_UL320_.jpg,https://m.media-amazon.com/images/I/81i11OTEtKL._AC_SL1500_.jpg,,2026-04-14T16:51:31.851375,
48,1,Organic,,25.0,B01MY09MKN,"Utopia Towels 4 Pack Premium Bath Towels Set, 27 by 54 Inches, 100% Ring Spun Cotton 600GSM, Lightweight and Highly Absorbent Quick Drying Towels, Perfect for Daily Use, Sage Green",N/A,$30.99,,4.4,21375.0,False,https://m.media-amazon.com/images/I/91KApnFjgjL._AC_UL320_.jpg,https://m.media-amazon.com/images/I/91KApnFjgjL._AC_SL1500_.jpg,,2026-04-14T16:51:31.867644,
49,1,Organic,,26.0,B07VN4T9Q5,"Utopia Towels Luxurious Jumbo Bath Sheet 2 Piece, 600 GSM, 35 by 70 Inches, 100% Ring Spun Cotton, Highly Absorbent and Quick Dry Extra Large Bath Towel, Super Soft Towel, White",N/A,$29.99,,4.4,55193.0,False,https://m.media-amazon.com/images/I/81pralPFdYL._AC_UL320_.jpg,https://m.media-amazon.com/images/I/81pralPFdYL._AC_SL1500_.jpg,,2026-04-14T16:51:31.884451,
50,1,Organic,,27.0,B091JGHYTH,"QUBA LINEN Hotel & Spa 100% Cotton Bath Towels Pack of 6, Ultra Soft, Quick Dry, Lightweight, Highly Absorbent, Perfect for Face, Hands, Spa, Gym, Hotel, Resort & Daily Use - Grey (24"" x 48"")",N/A,$27.99,,3.4,7693.0,False,https://m.media-amazon.com/images/I/910-5ZPtvZL._AC_UL320_.jpg,https://m.media-amazon.com/images/I/910-5ZPtvZL._AC_SL1500_.jpg,,2026-04-14T16:51:31.891989,
51,1,Organic,,28.0,B09ZY2D42V,"Infinitee Xclusives Luxury 100% Ring-Spun Cotton White Bath Towels Set of 4 (27x54 inches) – Soft, Absorbent & Quick-Drying Towels for Bathroom, Gym, Spa & Hotel Use (Brilliant White, Bath Towels)",N/A,$36.99,,4.3,2330.0,False,https://m.media-amazon.com/images/I/81MXIB0LoRL._AC_UL320_.jpg,https://m.media-amazon.com/images/I/81MXIB0LoRL._AC_SL1500_.jpg,,2026-04-14T16:51:31.915642,
52,1,Organic,,29.0,B008R51V94,"Utopia Towels, Salon Towel, Pack of 24, 16 by 27 Inches, Highly Absorbent Cotton Towels for Hand, Gym, Beauty, Spa, and Home Hair Care, White",N/A,$36.99,,4.5,13260.0,False,https://m.media-amazon.com/images/I/81Wt53F6iNL._AC_UL320_.jpg,https://m.media-amazon.com/images/I/81Wt53F6iNL._AC_SL1500_.jpg,,2026-04-14T16:51:31.925222,
53,1,Organic,,30.0,B01MY07RTW,"Utopia Towels 8 Piece Premium Towel Set, 2 Bath, 2 Hand, and 4 Washcloths, 100% Ring Spun Cotton, Highly Absorbent Towels for Bathroom, Sports, and Hotel, Grey",N/A,$24.99,,4.4,11434.0,False,https://m.media-amazon.com/images/I/91mZIseDMdL._AC_UL320_.jpg,https://m.media-amazon.com/images/I/91mZIseDMdL._AC_SL1500_.jpg,,2026-04-14T16:51:31.944431,
54,1,Organic,,31.0,B0BL6JGQM4,"POLYTE 430 GSM Microfiber Oversize Quick Dry Lint Free Bath Towel, 60 x 30 in, 4 Pack (Waffle Weave)",N/A,$41.89,,4.4,4033.0,False,https://m.media-amazon.com/images/I/91IX-0seZ-L._AC_UL320_.jpg,https://m.media-amazon.com/images/I/91IX-0seZ-L._AC_SL1500_.jpg,,2026-04-14T16:51:31.952462,
55,1,Organic,,32.0,B07B6GC2R5,"Amazon Basics 2-Piece Quick-Dry Oversize Bath Towel, 100% Cotton, 54"" x 30"", White",N/A,$18.50,,4.1,9790.0,False,https://m.media-amazon.com/images/I/61kQk2OvjvL._AC_UL320_.jpg,https://m.media-amazon.com/images/I/61kQk2OvjvL._AC_SL1500_.jpg,,2026-04-14T16:51:31.964264,
56,1,Organic,,33.0,B0BTJBYRSY,"ZUPERIA 7-Pack Bath Towels - 30"" x 54"" - Ultra Soft 100% Cotton Large Bath Towels- Highly Absorbent for Bathroom, Pool, Gym, Spa, and Hotel Use (Colors Variety)",N/A,$33.99,,4.0,1443.0,False,https://m.media-amazon.com/images/I/81hGwSXlq6L._AC_UL320_.jpg,https://m.media-amazon.com/images/I/81hGwSXlq6L._AC_SL1500_.jpg,,2026-04-14T16:51:31.969773,
57,1,Organic,,34.0,B00AA4H9BE,"Utopia Towels Pack of 4 Cabana Beach Towels, Oversized 30 x 60 Inches Cotton Beach Towel Set, Smooth Ring Spun Texture for Pool and Swim Days, Modern Striped Design Bath Towels",N/A,$39.99,,4.3,12150.0,False,https://m.media-amazon.com/images/I/91MXVlmrtOL._AC_UL320_.jpg,https://m.media-amazon.com/images/I/91MXVlmrtOL._AC_SL1500_.jpg,,2026-04-14T16:51:31.983885,
58,1,Organic,,35.0,B07SLR3T9F,"Hawmam Linen White Bath Towels 4 Pack 27 x 54 Inches 100% Turkish Cotton Soft Lightweight and Highly Absorbent Quick Drying Towels, Premium Quality Perfect for Daily Use",N/A,$29.51,,4.3,33757.0,False,https://m.media-amazon.com/images/I/81ep3f8V2QL._AC_UL320_.jpg,https://m.media-amazon.com/images/I/81ep3f8V2QL._AC_SL1500_.jpg,,2026-04-14T16:51:31.993487,
59,1,Organic,,36.0,B09NW92T8Q,"Sparkle Pick-A-Size Paper Towels, 6 Double Rolls (660 Sheets Total) - Strong 2-Ply Towels for Kitchen Cleanup and Everyday Messes",N/A,$6.97,,4.7,84417.0,False,https://m.media-amazon.com/images/I/71Y4-ItMNBL._AC_UL320_.jpg,https://m.media-amazon.com/images/I/71Y4-ItMNBL._AC_SL1500_.jpg,,2026-04-14T16:51:31.997924,
60,1,Organic,,37.0,B0BMK73TPP,"KAHAF COLLECTION 100% Cotton Bath Towels, 24x48 Pack of 6 Towels, Quick Dry, Highly Absorbent, Soft Feel Towel, Gym, Spa, Bathroom, Shower, Pool, Luxury Soft Towels (Grey, 24x48-6 Pack)",N/A,$28.99,,3.4,2714.0,False,https://m.media-amazon.com/images/I/91YIxo+7fEL._AC_UL320_.jpg,https://m.media-amazon.com/images/I/91YIxo+7fEL._AC_SL1500_.jpg,,2026-04-14T16:51:32.003952,
61,1,Organic,,38.0,B08L9D82S4,"Utopia Towels 8 Piece Luxury Towel Set, 2 Bath, 2 Hand, and 4 Wash Cloths, 600 GSM Ring Spun Cotton, Highly Absorbent Viscose Stripe Towels, Ideal for Everyday use, Cool Grey",N/A,$26.99,,4.4,17535.0,False,https://m.media-amazon.com/images/I/A1GbpUGwC1L._AC_UL320_.jpg,https://m.media-amazon.com/images/I/A1GbpUGwC1L._AC_SL1500_.jpg,,2026-04-14T16:51:32.017940,
62,1,Organic,,39.0,B08M3B5BJS,"Utopia Towels 8 Piece Luxury Towel Set – Majestic Plush, Super Absorbent & Quicker-to-Dry, Thick 100% Ring Spun Cotton Towels for Bathroom, Spa & Hotel – 2 Bath, 2 Hand, 4 Washcloths, Cool Grey",N/A,$29.99,,4.4,73684.0,False,https://m.media-amazon.com/images/I/91nF1dkCzcL._AC_UL320_.jpg,https://m.media-amazon.com/images/I/91nF1dkCzcL._AC_SL1500_.jpg,,2026-04-14T16:51:32.029985,
63,1,Organic,,40.0,B07SW4HB3N,"Utopia Towels 4 Pack Bath Towels Set, 27 by 54 Inches, 100% Ring Spun Cotton, Quick Dry, Highly Absorbent, Soft Feel Towels, Perfect for Daily Use, Grey",N/A,$28.99,,4.4,15626.0,False,https://m.media-amazon.com/images/I/91RKkf-cFYL._AC_UL320_.jpg,https://m.media-amazon.com/images/I/91RKkf-cFYL._AC_SL1500_.jpg,,2026-04-14T16:51:32.043191,
64,1,Title,,,,More results,,,,,,False,,,,2026-04-14T16:51:32.043191,
65,1,Organic,,41.0,B0CPT14R69,"ZUPERIA White Bath Towels Bulk 12 Pack (20 x 40 Inches) - 100% Cotton Economy Light Weight Towels for Commercial Use - Quick Dry, Ultra-Soft, and Absorbent Bulk Towels",N/A,$29.69,,3.9,252.0,False,https://m.media-amazon.com/images/I/81nDQei5XYL._AC_UL320_.jpg,https://m.media-amazon.com/images/I/81nDQei5XYL._AC_SL1500_.jpg,,2026-04-14T16:51:32.047702,
66,1,Organic,,42.0,B085MCLJ4W,"LANE LINEN 100% Cotton Bathroom Towel Set of 24 - Durable, Soft & Absorbent - 4 Bath, 4 Fingertip, 6 Hand, 8 Washcloths, 2 Bath Sheets, Hotel & Spa-Quality Design - White Towels",N/A,$62.99,,4.3,11989.0,False,https://m.media-amazon.com/images/I/914IYYJfjcL._AC_UL320_.jpg,https://m.media-amazon.com/images/I/914IYYJfjcL._AC_SL1500_.jpg,,2026-04-14T16:51:32.059246,
67,1,Organic,,43.0,B07RPNBLWK,"Cotton Paradise 6 Piece Towel Set, 100% Cotton Soft Absorbent Turkish Towels for Bathroom, 2 Bath Towels 2 Hand Towels 2 Washcloths, Beige Towel Set",N/A,$33.99,,4.4,18879.0,False,https://m.media-amazon.com/images/I/91kN6m4K0oL._AC_UL320_.jpg,https://m.media-amazon.com/images/I/91kN6m4K0oL._AC_SL1500_.jpg,,2026-04-14T16:51:32.074386,
68,1,Organic,,44.0,B0103XVVME,Luxury White Hand Towels - Soft 100% Turkish Cotton | Highly Absorbent Hotel spa Bathroom Towel Collection | 16x30 Inch | Set of 6,N/A,$22.99,,4.5,24206.0,False,https://m.media-amazon.com/images/I/71XLoBSG4aL._AC_UL320_.jpg,https://m.media-amazon.com/images/I/71XLoBSG4aL._AC_SL1500_.jpg,,2026-04-14T16:51:32.094363,
69,1,Organic,,45.0,B07Y22QK1S,"GLAMBURG Ultra Soft 8-Piece Towel Set - 100% Pure Ringspun Cotton, Contains 2 Oversized Bath Towels 27x54, 2 Hand Towels 16x28, 4 Wash Cloths 13x13 - Ideal for Everyday use, Hotel & Spa - Black",N/A,$25.99,,4.0,42549.0,False,https://m.media-amazon.com/images/I/81e9G4DIT2L._AC_UL320_.jpg,https://m.media-amazon.com/images/I/81e9G4DIT2L._AC_SL1500_.jpg,,2026-04-14T16:51:32.104020,
70,1,Organic,,46.0,B07YFLLJCV,"Utopia Towels 6 Piece Premium Hand Towels Set, 16 by 28 inches, 100% Ring Spun Cotton, Lightweight and Highly Absorbent Towels for Bathroom, Travel, Camp, Hotel, and Spa, White",N/A,$16.99,,4.5,16455.0,False,https://m.media-amazon.com/images/I/81Tf3Xo+saL._AC_UL320_.jpg,https://m.media-amazon.com/images/I/81Tf3Xo+saL._AC_SL1500_.jpg,,2026-04-14T16:51:32.117613,
