data_index,page,ad_type,ad_rank,organic_rank,asin,title,url,price_current,price_list,rating_stars,rating_count,is_prime,image_small,image_large,brand_name,scraped_at,inner_products_count
0,1,SB,1.0,,,250th Anniversary Patriotic Wreath for Front Door,https://aax-us-east-retail-direct.amazon.com/x/c/JPA9rjEyTdsVdyXsjPV1COIAAAGdsCZisQEAAAH2AQBvbm9fdHhuX2JpZDYgICBvbm9fdHhuX2ltcDIgICD-VV9Y/clv1c_ek-wBIHXFcbWDn2nI4trJ16WpAySuUaHOZzWw1LqnQLP0Gae8r26cfIHcNXN2kafZdB65ZiijF8z6e4CCUTEiA9Zp2areTb_vFgUD0v_766ymtdjLbIbZeiSon91lurhdwfsBKhcj75UOpL1gALh6VnXp-_8FlfvnuT13XPyjCQcV3gp9oghXNItSZ4GCUMIhIFQaRqrf0dM0OnLvGIQwkfSTzsvVB-jhjflYTcDqRI67YTicrRQ6vs2fZ1t3pvCxss5kbbXrfWjdcVAhSpUuVVzwHwO3VfNymBHx29_lG877qEIrYLjpiL4Ik5wrisgeNV1wAMPEJIVG2rChWuAJlQuMSzLU0VBPH7j3_hrseSG8PVd0H1g_H1wVEHU-zqUoAAd_pDEnBBwxrYBpvKjg8mYXmcrY1Y1Bk9vavhbPq9LsjZhQ6gqgpgUoSMrsGhKb2NhEshUtN3uxIK8czvnlz8D6hv0Q6nGJWhXsHR4cc_LkQzBjb1TFoH6cMXcUnLgq0VYUmWQVc3LT56jTkcsbb4l3Y_szD6DF-hlWNGH0YMqiRYp1RphplT7__GUByztzUauoDEp4asRK57XzunNVlbA4amTsBDBzJvsqOyhsm6bgKMQ-ppkAhebkhh1TfLGW_3er0A4phBxwlqB_DuPc-PbL9dJBMT_tfddFAFW1mq0VD1PJ6OT2nCD0SwEhcMbgGePRjOIasn997Zmvy3DHLoVLn3NiGPPHTb979xlSPb4kzn74fw8gdBVNrg2biPBnC3PROhBNeOiWTEqAxxU6tQH3QX9G0J-oTtS3J7TqFnud_xCtnhwebc_bmS66Q90IUyVsfldNUP8T0bWS46O9-ijU6tEpx3prkx99ltgASRVC0fyCCuUKUmloxecFO3VlaqrAsSgo-qRmXRrFChFyzzfosfvoMYNwTgwE3qXz3eDu7B0PYlwxwHs_xziK334Guk_8sCWIzGuI8bUkDXfoki-5O63xpe72KF6FpKqYHvQOGBje6Q8pcMGBp0qeV11VLjezeLKN04ZHuFC6yzIa8c8CgJYY6ENfzcJLm8mFGNqjQk4HCdVoi7VaA42y9rfjGj5gfMaRJaMpi6U2EcwwfcEPKQCPVwe3uBeAK7rBcSJmDTxlsyEBJEjiXLnQ2kw0klFMOay-quuMHy9SmBgySSRB77mwLHv7kAorF0fKmcyCeJHy5alLMAKQGK6bZhgLb9rBvFhQ9SnHIBn5XR78IJtvJnmm5AAqT7Z6UFwcZlTVEw-21R6OwX2jlEu_nRXeBR-JKIvEepAqRKWhrwh2PIzaRk-Fs4DXLviOVoFghUzRcugNyxNRaU6MoII57QSjB1NKG0bfC3qTskgsr19ZFUYIDPkUPjKfWWkXGwQVFrs7Te0TpdKeyaRsXBZCBh-ynOSioXbtb06Z_JOkcuIoms0RnLFEYhMAEkBqiw5uUWHU2aJ595_eimIdydqYrTZ-PN_kWX7r0Ev6PPpd7K8ZMx1LpEDwejFtKo7prkDl2ghxeCkI-V-T8tB67aSt-7MPP0RTw2V8HDL2pIjRWNytnQc1Boj5ml6P_MjM37Z7rxi1QyRGj0AOzM88pkAAhT9_xR-y7YLCtah4ncsKpbvlbHpzlaTKIZ8yYNSSUyM2QsG-9JFjkxfBHUtxmy_b1KKTpCfogHCig8PvVhJBQ/https://www.amazon.com/stores/page/1C68E5DD-6BF8-4AB4-A33A-72D4E6A0B387/?_encoding=UTF8&store_ref=SB_A01724512Q3ZO08V5BN01-A054026626RVBMKC6L5CB&pd_rd_plhdr=t&aaxitk=d597c60a235120c1f387fb2cec22f450&hsa_cr_id=0&lp_asins=B0FC2CYLWL%2CB0FC2CGLYN%2CB0FC2F4Y66&lp_query=4th%20of%20july%20accessories&lp_slot=auto-sparkle-hsa-tetris&ref_=sbx_s_sparkle_sbtcd_bkgd&pd_rd_w=lfIrq&content-id=amzn1.sym.2fb72bc8-96ef-420d-b08f-c04b69f36507%3Aamzn1.sym.2fb72bc8-96ef-420d-b08f-c04b69f36507&pf_rd_p=2fb72bc8-96ef-420d-b08f-c04b69f36507&pf_rd_r=5J3VFSNSDWEEN3YP8TYM&pd_rd_wg=azenQ&pd_rd_r=d67ca0c3-d8b8-48e9-b3ed-35b80962eb14,,,,,False,"https://m.media-amazon.com/images/S/al-na-9d5791cf-3faf/7bde2c15-17ad-4816-9876-a14dda7e6c30._CR0,0,1600,1600_AC_SX130_SY60_CB1169409_QL70_.png",,250th Anniversary Patriotic Wreath for Front Door,2026-04-21T13:06:46.474946,3.0
1,1,Title,,,,ResultsCheck each product page for other buying options. Price and other details may vary based on p,,,,,,False,,,,2026-04-21T13:06:46.475916,
3,1,Organic,,1.0,B0G6D1F613,"4PCS USA Sets Flag Flower Leis, 4th of July Hawaiian Lei Set with 1 Neck Lei, 1 Headband & 2 Wristbands, Red White Blue Garland for World Cup Sports Events Patriotic Party Decoration",N/A,$7.89,,4.6,3.0,False,https://m.media-amazon.com/images/I/71ky4i1u0yL._AC_UL320_.jpg,https://m.media-amazon.com/images/I/71ky4i1u0yL._AC_SL1500_.jpg,,2026-04-21T13:06:46.481378,
4,1,Organic,,2.0,B0DWMSWRZY,"Friendship Bracelets - Beaded Bracelets Set for Teen Women, Stretchable Preppy Bracelets, Stackable & Colorful Bracelets - Ideal Gifts, 4th of July, Halloween, Christmas",N/A,$5.99,,4.6,155.0,False,https://m.media-amazon.com/images/I/71wJsp0vUXL._AC_UL320_.jpg,https://m.media-amazon.com/images/I/71wJsp0vUXL._AC_SL1500_.jpg,,2026-04-21T13:06:46.486117,
5,1,Organic,,3.0,B0GSYJLRL4,12Pcs 4th of July Can Cooler Sleeves Patriotic Beverage Cooling Covers for 4th of July Accessories Patriotic Party Favors Memorial Day,N/A,$13.88,,5.0,1.0,False,https://m.media-amazon.com/images/I/71m0Wh5v4bL._AC_UL320_.jpg,https://m.media-amazon.com/images/I/71m0Wh5v4bL._AC_SL1500_.jpg,,2026-04-21T13:06:46.490345,
7,1,Title,,,,Debug info copied.Sponsored120 Pcs 4th of July Glow Sticks with Connectors & 20 Handles USA 250th An,,,,,,False,,,,2026-04-21T13:06:46.491419,
8,1,Title,,,,250th Anniversary Patriotic Wreath for Front DoorSponsored|Shop FoxiodShop nowPrevious page250th Ann,,,,,,False,,,,2026-04-21T13:06:46.492794,
9,1,Title,,,,More results,,,,,,False,,,,2026-04-21T13:06:46.493032,
10,1,Organic,,4.0,B0D1BZ83CQ,14pcs 4th of July Accessories Includes Patriotic Headband American Flag Sunglasses Earring Star Necklace and Patriotic Temporary Stickers for Independence Day Party Supplies,N/A,$9.99,,4.7,12.0,False,https://m.media-amazon.com/images/I/71NsK6ot6KL._AC_UL320_.jpg,https://m.media-amazon.com/images/I/71NsK6ot6KL._AC_SL1500_.jpg,,2026-04-21T13:06:46.499255,
11,1,Organic,,5.0,B0C3LG75LK,Huachi American Flag Headbands for Women 4th of July Headband Wide Red White and Blue Patriotic Hair Bands for Women's Hair Twist Turban Hair Wrap Accessories,N/A,$4.50,,4.2,49.0,False,https://m.media-amazon.com/images/I/61ZKsiwEJwL._AC_UL320_.jpg,https://m.media-amazon.com/images/I/61ZKsiwEJwL._AC_SL1500_.jpg,,2026-04-21T13:06:46.503921,
12,1,Organic,,6.0,B0CZ8FRW95,21Pcs 4th-of-July-Necklaces Independent-Day Patriotic Star Shaped Necklace Red-White-Blue Necklace for Adults Party Favors Accessories,N/A,$8.38,,4.4,46.0,False,https://m.media-amazon.com/images/I/810GrDlO85L._AC_UL320_.jpg,https://m.media-amazon.com/images/I/810GrDlO85L._AC_SL1500_.jpg,,2026-04-21T13:06:46.510030,
13,1,Organic,,7.0,B0GHTNH9MQ,"Pack of 32, USA Wind Spinners & Handheld Flags – 12 American Flag Pinwheels and 20 Small Wooden Flag Sticks with Gold Spear Top, Patriotic Decoration for 4th of July, Parades, Outdoor Yard Garden Lawn",N/A,$14.99,,5.0,1.0,False,https://m.media-amazon.com/images/I/81VjKtJC9YL._AC_UL320_.jpg,https://m.media-amazon.com/images/I/81VjKtJC9YL._AC_SL1500_.jpg,,2026-04-21T13:06:46.515147,
14,1,Organic,,8.0,B0F1SZC6W1,"Kannove American USA Flag Socks,Patriotic Red White and Blue Stars & Stripes Accessories for 250th Anniversary 4th of July",N/A,$5.89,,4.6,93.0,False,https://m.media-amazon.com/images/I/71iVqFGGlkL._AC_UL320_.jpg,https://m.media-amazon.com/images/I/71iVqFGGlkL._AC_SL1500_.jpg,,2026-04-21T13:06:46.519396,
15,1,Organic,,9.0,B0DZX72641,OHOME 4th of July Outfits for Women - 6 Pack Patriotic Bracelets | Fourth of July Decorations Accessories Shirts for Memorial Day Decorations - 250th Anniversary Celebration Jewelry for Women,N/A,$5.98,,4.6,704.0,False,https://m.media-amazon.com/images/I/71zZUR2VY1L._AC_UL320_.jpg,https://m.media-amazon.com/images/I/71zZUR2VY1L._AC_SL1500_.jpg,,2026-04-21T13:06:46.525068,
16,1,Organic,,10.0,B0FJ72NPB6,"Red White and Blue Earrings, USA Theme for 4th of July Women Outfit Accessories",N/A,$6.99,,5.0,4.0,False,https://m.media-amazon.com/images/I/71+MbOQeAiL._AC_UL320_.jpg,https://m.media-amazon.com/images/I/71+MbOQeAiL._AC_SL1500_.jpg,,2026-04-21T13:06:46.529891,
17,1,Organic,,11.0,B0F4K47FLP,"Huachi 4th of July Headband for Women with Bow, American Flag Headbands USA Patriotic Hair Accessories, Cute Red White and Blue Bow Headbands 2PCS",N/A,$7.70,,4.3,55.0,False,https://m.media-amazon.com/images/I/71Fh+3ln8sL._AC_UL320_.jpg,https://m.media-amazon.com/images/I/71Fh+3ln8sL._AC_SL1500_.jpg,,2026-04-21T13:06:46.533685,
18,1,Organic,,12.0,B0F5PPLDP5,"4th of July Headband for Women Girls, Red White and Blue Headband American Flag Hairband Set for Patriotic accessories Parade Halloween Party",N/A,$7.99,,4.9,26.0,False,https://m.media-amazon.com/images/I/812hayVl+QL._AC_UL320_.jpg,https://m.media-amazon.com/images/I/812hayVl+QL._AC_SL1500_.jpg,,2026-04-21T13:06:46.538656,
19,1,Organic,,13.0,B0B2MBGT8R,"ALMHH 4th of July Earrings, Handmade Beaded Patriotic Earrings for Women, Star American Flag Dangle Drop Independence Day Patriotic Holiday Gifts",N/A,$6.89,,4.5,113.0,False,https://m.media-amazon.com/images/I/71XEf5JlL2L._AC_UL320_.jpg,https://m.media-amazon.com/images/I/71XEf5JlL2L._AC_SL1500_.jpg,,2026-04-21T13:06:46.544236,
20,1,Organic,,14.0,B0C5MP5W5T,"Sheplus 4th of July Necklace for Women, American Flag Star Pendant Red White Blue Patriotic Jewelry, USA Independence Day Gift, Memorial Day Accessories",N/A,$15.51,,4.5,16.0,False,https://m.media-amazon.com/images/I/51u5Sk13ghL._AC_UL320_.jpg,https://m.media-amazon.com/images/I/51u5Sk13ghL._AC_SL1500_.jpg,,2026-04-21T13:06:46.549401,
21,1,Title,,,,More results,,,,,,False,,,,2026-04-21T13:06:46.550017,
22,1,Organic,,15.0,B0C4X9X5PP,4th of July Earrings for Women Patriotic American Flag Earrings USA Dangle Earrings Red White Blue American Flag Dangle Earring Patriotic Independence Day Earring,N/A,$5.99,,4.6,166.0,False,https://m.media-amazon.com/images/I/61QbDymsA8L._AC_UL320_.jpg,https://m.media-amazon.com/images/I/61QbDymsA8L._AC_SL1500_.jpg,,2026-04-21T13:06:46.554077,
23,1,Organic,,16.0,B0CY8G1TD2,Halloween Bracelets for Women Boo Pumpkin Skull Ghosts Stretchy Beaded Bracelets Spooky Skeleton Bat Cat Stackable Bracelet Christmas Bracelet Jewelry,N/A,$5.90,,4.6,169.0,False,https://m.media-amazon.com/images/I/71oQpqr8ZpL._AC_UL320_.jpg,https://m.media-amazon.com/images/I/71oQpqr8ZpL._AC_SL1500_.jpg,,2026-04-21T13:06:46.559986,
24,1,Organic,,17.0,B0F312CZHD,"Go Ho 4th of July Outfits for Women,Red White and Blue Face Body Glitter Gel,9 PC Necklaces,3 Pairs Star Sunglasses and 6 PC Rubber Bracelets Wristbands Set for USA Patriotic Outfits Makeup",N/A,$15.98,,4.7,54.0,False,https://m.media-amazon.com/images/I/81Z3MaGEfcL._AC_UL320_.jpg,https://m.media-amazon.com/images/I/81Z3MaGEfcL._AC_SL1500_.jpg,,2026-04-21T13:06:46.565896,
25,1,Organic,,18.0,B0F4QVLK5Q,Semato Festive Headband and Sunglasses,N/A,$5.99,,4.8,15.0,False,https://m.media-amazon.com/images/I/71+rQ+WBxeL._AC_UL320_.jpg,https://m.media-amazon.com/images/I/71+rQ+WBxeL._AC_SL1500_.jpg,,2026-04-21T13:06:46.571068,
26,1,Organic,,19.0,B0C5XSG6SQ,4th of July Headband Independence Day Hair Accessories Patriotic Party Hair Supplies USA Flag Star Design Blue Red Ribbon Stars Hair Decoration Hair Hoop for Women,N/A,$5.99,,4.5,120.0,False,https://m.media-amazon.com/images/I/61q13Oo65GL._AC_UL320_.jpg,https://m.media-amazon.com/images/I/61q13Oo65GL._AC_SL1500_.jpg,,2026-04-21T13:06:46.575898,
27,1,Organic,,20.0,B0F4X9RJMN,"Go Ho Patriotic Red White and Blue Glitter Freckles Face Tattoo,4th of July Freckles Sparkle,4th of July Outfits for Women Kids,Fourth of July Glitter Stickers on Independence Day,6 Pcs",N/A,$6.98,,4.4,105.0,False,https://m.media-amazon.com/images/I/719MKe2K8NL._AC_UL320_.jpg,https://m.media-amazon.com/images/I/719MKe2K8NL._AC_SL1500_.jpg,,2026-04-21T13:06:46.581590,
28,1,Organic,,21.0,B0CZDSVF5K,"SHAOQINLIN 12 PCS Patriotic Beads Necklaces, 4th of July Bead Necklace, 4th of July Accessories, 33'' Metallic Red/Silver/Blue Party Beads for Patriotic Day, Carnival Party Favors",N/A,$4.98,,4.6,614.0,False,https://m.media-amazon.com/images/I/81L6uFdRl2L._AC_UL320_.jpg,https://m.media-amazon.com/images/I/81L6uFdRl2L._AC_SL1500_.jpg,,2026-04-21T13:06:46.585061,
29,1,Organic,,22.0,B0F3Y6CQFZ,"4th of July Bracelet for Women - Patriotic Outfits Red White Blue USA Charm Bracelet with American Flag Pendants, Perfect Fourth of July Jewelry & Independence Day Accessories, Adjustable 7-9.25 Inch",N/A,$6.99,,4.3,60.0,False,https://m.media-amazon.com/images/I/71FkuS7ak+L._AC_UL320_.jpg,https://m.media-amazon.com/images/I/71FkuS7ak+L._AC_SL1500_.jpg,,2026-04-21T13:06:46.591164,
30,1,Organic,,23.0,B0CZX94RGP,"Artlunar USA Love Bracelets - 4th of July Accessories - Handmade Red, White, and Blue Jewelry Gifts for Teens,Women",N/A,$7.98,,4.5,236.0,False,https://m.media-amazon.com/images/I/61Gcw3Ou5rL._AC_UL320_.jpg,https://m.media-amazon.com/images/I/61Gcw3Ou5rL._AC_SL1500_.jpg,,2026-04-21T13:06:46.594678,
31,1,Title,,,,More results,,,,,,False,,,,2026-04-21T13:06:46.595116,
32,1,Organic,,24.0,B0F28T726D,RareLove Fourth of July Accessories Lightweight Patriotic Earrings Red White and Blue Sequins Fun Dangle Tassel Earrings for Women Alloy Plated,N/A,$6.33,,4.6,16.0,False,https://m.media-amazon.com/images/I/818MAXKr-IL._AC_UL320_.jpg,https://m.media-amazon.com/images/I/818MAXKr-IL._AC_SL1500_.jpg,,2026-04-21T13:06:46.598005,
33,1,Organic,,25.0,B0CZWSGGPK,3Pack 4th of July Glasses - Red White and Blue Style Accessories for Independence Patriots Women Outfit and Decorations,N/A,$6.59,,4.5,72.0,False,https://m.media-amazon.com/images/I/61rDZvRRgyL._AC_UL320_.jpg,https://m.media-amazon.com/images/I/61rDZvRRgyL._AC_SL1500_.jpg,,2026-04-21T13:06:46.601762,
34,1,Organic,,26.0,B0CXXKT6GR,4Pcs Patriotic 4th of July Hair Bands American Flag Hair Ties Hair Ropes Independence Day Hair Scrunchies National Day Decorations,N/A,$5.80,,4.6,209.0,False,https://m.media-amazon.com/images/I/716AiueS1mL._AC_UL320_.jpg,https://m.media-amazon.com/images/I/716AiueS1mL._AC_SL1500_.jpg,,2026-04-21T13:06:46.607420,
35,1,Organic,,27.0,B0F23MJT4V,"Patriotic American Flag Star Headband, Red White Blue Glitter Hair Hoop, Fun Party Accessory for 4th of July, Memorial Day, and Independence Day USA Themed Parade Supplies",N/A,$5.59,,3.7,3.0,False,https://m.media-amazon.com/images/I/61Twf5qnn4L._AC_UL320_.jpg,https://m.media-amazon.com/images/I/61Twf5qnn4L._AC_SL1500_.jpg,,2026-04-21T13:06:46.610772,
36,1,Organic,,28.0,B0D1JST8V9,"11 Pcs 4th of July Costume Patriotic Costume Accessories Set, American Patriotic Hat American Flag Headband Wristbands Vest Usa Sunglasses Necklaces Bow Ties Beard for Independence Day",N/A,$19.99,,4.2,48.0,False,https://m.media-amazon.com/images/I/81JGWvSerPL._AC_UL320_.jpg,https://m.media-amazon.com/images/I/81JGWvSerPL._AC_SL1500_.jpg,,2026-04-21T13:06:46.614635,
37,1,Organic,,29.0,B0DZQJ3VD5,"xo, Fetti America Face Gems - 80 pcs. | USA Face Stickers, 4th of July Rhinestone Accessory, Country Party Decorations, All American Supplies",N/A,$10.99,,4.2,27.0,False,https://m.media-amazon.com/images/I/61-AEDaxtxL._AC_UL320_.jpg,https://m.media-amazon.com/images/I/61-AEDaxtxL._AC_SL1500_.jpg,,2026-04-21T13:06:46.620337,
38,1,Organic,,30.0,B09YPBCLB6,4th of July Headband Glittery Stars Headband Stars Hair Accessory for Independence Day Patriotic Party Decorations,N/A,$6.99,,4.2,23.0,False,https://m.media-amazon.com/images/I/61jQZjSOI-L._AC_UL320_.jpg,https://m.media-amazon.com/images/I/61jQZjSOI-L._AC_SL1500_.jpg,,2026-04-21T13:06:46.623716,
39,1,Organic,,31.0,B09W9TTK78,American Flag Earrings - Beaded Heart Star Flag Dangle Drop Patriotic Earrings for Women - Handmade Independence Day & 4th of July Holiday Gifts,N/A,$5.99,,4.4,448.0,False,https://m.media-amazon.com/images/I/717Ymq0nvgL._AC_UL320_.jpg,https://m.media-amazon.com/images/I/717Ymq0nvgL._AC_SL1500_.jpg,,2026-04-21T13:06:46.627033,
40,1,Organic,,32.0,B09GXT57JG,E-Clover Fashion Scarf for Women Lightweight Scarves Shawl Wrap for Spring/Summer Winter,N/A,$11.99,,4.7,2348.0,False,https://m.media-amazon.com/images/I/71TMXBXFmVL._AC_UL320_.jpg,https://m.media-amazon.com/images/I/71TMXBXFmVL._AC_SL1500_.jpg,,2026-04-21T13:06:46.631861,
41,1,Organic,,33.0,B0F3W3QGHC,4th of July Accessories for Women Men Teens Red White Blue Clay Beaded Stackable Stretch Bracelets USA Patriotic Jewelry Fourth of July Gifts,N/A,$9.99,,4.4,159.0,False,https://m.media-amazon.com/images/I/71Qp94l+VML._AC_UL320_.jpg,https://m.media-amazon.com/images/I/71Qp94l+VML._AC_SL1500_.jpg,,2026-04-21T13:06:46.637569,
42,1,Organic,,34.0,B071W7WVBN,"Moon Boat 12PCS 4th of July Headbands, Fourth of July Party Decorations Accessories, Patriotic Red White Blue USA Outfit Favors for Independence/Memorial Day",N/A,$18.99,,4.5,786.0,False,https://m.media-amazon.com/images/I/81tEUF0CeKL._AC_UL320_.jpg,https://m.media-amazon.com/images/I/81tEUF0CeKL._AC_SL1500_.jpg,,2026-04-21T13:06:46.641331,
43,1,Organic,,35.0,B0CYGXN5PW,4th of July Women's American Flag Print Kimono Cover Up Cardigan with Accessories,N/A,$7.99,,4.4,153.0,False,https://m.media-amazon.com/images/I/81npF9mYxBL._AC_UL320_.jpg,https://m.media-amazon.com/images/I/81npF9mYxBL._AC_SL1500_.jpg,,2026-04-21T13:06:46.644668,
44,1,Organic,,36.0,B0DZX5QJ21,July 4th Independence Day Earrings American Flag Five-pointed Star Earrings Dangle Earrings for Women Independence Day Gifts,N/A,$9.99,,4.6,153.0,False,https://m.media-amazon.com/images/I/61Kae5CmgtL._AC_UL320_.jpg,https://m.media-amazon.com/images/I/61Kae5CmgtL._AC_SL1500_.jpg,,2026-04-21T13:06:46.647920,
45,1,Organic,,37.0,B0CX4XGN43,"ILHSTY 2 Pair Star Sunglasses for Women Men, Patriotic Rimless Star Shaped Sunglasses USA Red White Blue Accessories for Memorial Day 4th of July Beach Pool Birthday Party Favor (Red White Blue)",N/A,$4.99,,4.6,107.0,False,https://m.media-amazon.com/images/I/71R+8l1BRML._AC_UL320_.jpg,https://m.media-amazon.com/images/I/71R+8l1BRML._AC_SL1500_.jpg,,2026-04-21T13:06:46.653661,
46,1,Organic,,38.0,B089VM51Q9,IDesign USA American Flag Bracelet Decorations Gift Red Blue White Bracelet Patriotic 4th of July Independence Day,N/A,$9.99,,4.4,690.0,False,https://m.media-amazon.com/images/I/71WqYnjltOS._AC_UL320_.jpg,https://m.media-amazon.com/images/I/71WqYnjltOS._AC_SL1500_.jpg,,2026-04-21T13:06:46.658357,
47,1,Organic,,39.0,B0887ZKFXZ,"Frienda American Flag Costume Cape, 4th of July 250th Retro 80's USA Sunglasses and Flag Headband for 250th Anniversary",N/A,$11.99,,4.6,1028.0,False,https://m.media-amazon.com/images/I/71Moks+20JL._AC_UL320_.jpg,https://m.media-amazon.com/images/I/71Moks+20JL._AC_SL1500_.jpg,,2026-04-21T13:06:46.662407,
48,1,Organic,,40.0,B09TXT634D,Tarpop Patriotic Scarf 4th of July Red White Blue Scarf 250th Scarves Flag Shawl for Women Independence Day,N/A,$8.99,,4.6,164.0,False,https://m.media-amazon.com/images/I/81l2VZFE4BL._AC_UL320_.jpg,https://m.media-amazon.com/images/I/81l2VZFE4BL._AC_SL1500_.jpg,,2026-04-21T13:06:46.666649,
49,1,Organic,,41.0,B0CX1WQGD9,"4th of July Necklace Accessories, 12PCS Veterans Day Beads Necklaces Bulk, Independence Day Red Blue White Stars USA Flags Necklace, Veterans Day Patriotic Bulk for Parade Party Favors Decorations",N/A,$9.99,,4.4,153.0,False,https://m.media-amazon.com/images/I/91AfrlazyKL._AC_UL320_.jpg,https://m.media-amazon.com/images/I/91AfrlazyKL._AC_SL1500_.jpg,,2026-04-21T13:06:46.671253,
50,1,Organic,,42.0,B0F4QWBM7J,"2 PCS 250 Years 4th of July Headband for Women Girls -Red White Blue USA Star Headband Sunglasses,Patriotic Accessories Set for Independence Day, Memorial Day,Halloween Party",N/A,$7.99,,4.6,11.0,False,https://m.media-amazon.com/images/I/81645WSGf-L._AC_UL320_.jpg,https://m.media-amazon.com/images/I/81645WSGf-L._AC_SL1500_.jpg,,2026-04-21T13:06:46.675774,
51,1,Title,,,,More results,,,,,,False,,,,2026-04-21T13:06:46.676323,
52,1,Organic,,43.0,B0F535WDDW,4th of July Accessories Headband for Women Girls Boys Men Fourth of July Accessories Usa Headband American Flag Patriotic Red White and Blue Hair Accessories 2pcs,N/A,$6.99,,4.8,4.0,False,https://m.media-amazon.com/images/I/71diETSPk6L._AC_UL320_.jpg,https://m.media-amazon.com/images/I/71diETSPk6L._AC_SL1500_.jpg,,2026-04-21T13:06:46.680489,
53,1,Organic,,44.0,B0CZLSM1YL,"4 PCS Patriotic Party Accessories - Independence Day Headband, Star Sunglasses, Red White Blue Party Favors and Memorial Day Supplies",N/A,$8.53,,4.8,51.0,False,https://m.media-amazon.com/images/I/71HAYE3gWeL._AC_UL320_.jpg,https://m.media-amazon.com/images/I/71HAYE3gWeL._AC_SL1500_.jpg,,2026-04-21T13:06:46.686422,
54,1,Organic,,45.0,B0CYM2FT5X,"xo, Fetti Happy Fourth of July Star Headband | USA Party Favors, American Flag Supplies, 4th of July Decorations, Stars and Stripes Decor, Red White and Blue, Olympic Theme Bday Patriotic Accessory",N/A,$9.99,,4.7,26.0,False,https://m.media-amazon.com/images/I/711JNkI2f6L._AC_UL320_.jpg,https://m.media-amazon.com/images/I/711JNkI2f6L._AC_SL1500_.jpg,,2026-04-21T13:06:46.690474,
55,1,Organic,,46.0,B0F1DJDP24,"2 Pieces American Patriotic Headbands for Women Men, 4th of July Stars Hearts Boppers Head Bands Blue Red Tassel Patriotic Hair Accessories for Memorial Day Decorations Supplies",N/A,$7.99,,3.3,3.0,False,https://m.media-amazon.com/images/I/71nrKMJKTtL._AC_UL320_.jpg,https://m.media-amazon.com/images/I/71nrKMJKTtL._AC_SL1500_.jpg,,2026-04-21T13:06:46.694735,
56,1,Organic,,47.0,B0CCP23M6K,"MEICOLY Red White and Blue Body Glitter,4th of July Patriotic Accessories Hair Glitter for Kids,4th of July Outfits for Women,Self-Adhesive Face Glitter for President's Day Veterans Day",N/A,$7.98,,4.5,7228.0,False,https://m.media-amazon.com/images/I/71bSgIDKmnL._AC_UL320_.jpg,https://m.media-amazon.com/images/I/71bSgIDKmnL._AC_SL1500_.jpg,,2026-04-21T13:06:46.699167,
57,1,Organic,,48.0,B09XD4S6JT,E-Clover Herebuy - Unique Women's Floral Scarves: Chiffon Flowers & Birds Printed Scarf,N/A,$9.99,,4.6,2847.0,False,https://m.media-amazon.com/images/I/61MXLMR8yZL._AC_UL320_.jpg,https://m.media-amazon.com/images/I/61MXLMR8yZL._AC_SL1500_.jpg,,2026-04-21T13:06:46.704765,
59,1,Title,,,,"Debug info copied.Sponsored6 Pack 20 Inch Patriotic Inflatable Beach Balls Bulk, 4th of July Confett",,,,,,False,,,,2026-04-21T13:06:46.705790,
60,1,Title,,,,Related searches4th of july4th of july outfits for womenred white and blue accessories4th of july he,,,,,,False,,,,2026-04-21T13:06:46.706751,
61,1,Title,,,,Previous123...7Next,,,,,,False,,,,2026-04-21T13:06:46.707071,
62,1,SB,2.0,,,N/A,https://aax-us-east-retail-direct.amazon.com/x/c/JO7x1JPsc0aGo5MREoareSAAAAGdsCZipgEAAAH2AQBvbm9fdHhuX2JpZDQgICBvbm9fdHhuX2ltcDIgICCcRgTT/clv1c_ek-wxIE3EsbWDQHEIw2FLtt6rYkxSkIv-Y1H14ri3jsKbtVKRPRuchwFF0Upqj9khFHokEv--LPvRJmEidFX75xOVfa8lCIg6UrBNinYGvAwuhHb7Kvsfli609m1pmp9v8heCuo_mf-F9jSgjdNC5FMjCJEMl1b-uqTwBpYqS4M7f3stX0MjjIpe877-qfMIMu4iiQvfrYPB1tjR3_hZousddBctTUi3iRPC6Nen8R0g-bDTuUI_gJqPPcmuPoevm09aildSaDnCRRVfmFbsA2AS71eH_wh2Nru4BQQLCYW0tB7VRu39rhp4oYGpSkup1CCsylI18ZBeSL_4r5onq6CmPEN9rrofkJYdXG9bzvvtymHZrA_7g15AiBjK2EdiZn_kX-ojlAyWknH_p9AO9FmDOE7HUva5fxLmsAE5GmlV2PSYSTZGM4PjG39N95d_6fCL0X03owJ7yOehMJM3oOjySzhar3dqgZYV_jU5_GktuSwlSyxjYdlx-PmsRVHAgjuvRVjbyYNwOEGz2GdeX8esAfvnt5vVfOtP1yGg-des6H8h2fL7oyWb62Wky-YGrzAVWhCpGEAGlWShNUV9iY_pEM3v2RAA27ajBj_2nOAvUIvLOvFnb2j34xurYmJrqlT3Yt-G-ZhOc44DKk3WWQiEpmL0vH8AbJL95ROQZ2H7PW4dV2cLm8I59inEjxFAAnZxoflLk1IVhw-bwHroL9jmjy_wO_1nFUurxJhO9Xsx6wJDqEiakHSnExSFC6PRNPokBrcBmYn5Elqi3LRASwJFRSGFyrs2h8UAIo56_AFEG38mG1nu-k83ImvIzhcwrsH4i5b0Isvk9ebiZcPEO2IscDOliNVvoCnqwBhaca0tCs0Etv_BJy8ioyjsf9QY5yLe-PBSeogGLj---guoDh7YxDeEcfUMdtr_B_GHmH9MVmCkrlyqjfWlKbC6dmzAHs1YRqWlewH2WGXjt6Zk24JvZwEJNgh3iX-OK7A2mcXDAaH0aLYdQtF77X6XbqX5rIZyxT__f3g8aDjE7IkGYVimk6VkPX3z7IXuPJ-20G28WloIb2Sk17wRsU6WWtpn8zNHOgHWaNbj4T9nKkglP3gxXOJP_zESZCAu_IVa5HGrDrW1II9u0cxItnBONoUvQYm1kh7jyqnjaQfwSKxYtTBmrVt97Q1Ay-5ln0Vez94NcXwaKPVtpdsP3qB81cZBrYFd-8rAHtsb9ZqU7sUkBxlEk6o4-4cvt7ow5vPhhDxdovcCqu9OqTcph67IVD10vzTDHLs_u9U_MYbQZ9jJQ0a82_uFW4yLs8BXfRs7W-r0qCsyWEN9uIYC1gTaJIu4RpT6AXDoaWRdWGOtt2aTB_vHQQGN7Thk6IhGyoVPg7lraO4TnLovV7bZOZGaphOQLC5rCt5ZBxIctw_hM638zodhz-aVniOqNbJ7JW36L_q2xAQhl4pMdlo_gPDYfVI_Z1muCR5xwg8NBm9iO5k-AOGM60LI5DveFmha3iDtdoquGDq4vgT4rwMhxEksSG1NkchjnbOKtCDtGi6S_Mw2I3nOKGqdSuRi6ckErojOJJm1Z4NCVqsQmKe0-E0mkpBL03BVO83IGFn8AGYspU1UHVuwq1y3vP4R1tDq4dvIyuY2sEG44huyR29FT0jw0QM8DQ9VcJp6_lJsuMDZoAKRFLh1bZMN7DYy/https://www.amazon.com/stores/page/09368D41-20C1-4B0A-AE6B-E0F58A57286D/?_encoding=UTF8&store_ref=SB_A08224541DO077GBE8GO0-A05838622I46CBQ29R9XL&pd_rd_plhdr=t&aaxitk=035a18f66995c5e04f56e665dbfd98fa&hsa_cr_id=0&lp_asins=B08FFWHKLN%2CB09SLFSPRF%2CB0DQKYQM43&lp_query=4th%20of%20july%20accessories&lp_slot=desktop-hsa-3psl&ref_=sbx_be_s_3psl_mbd_mb0_bkgd&pd_rd_w=6JY0L&content-id=amzn1.sym.cd7c548b-a599-426f-9ffe-daa1aa803c87%3Aamzn1.sym.cd7c548b-a599-426f-9ffe-daa1aa803c87&pf_rd_p=cd7c548b-a599-426f-9ffe-daa1aa803c87&pf_rd_r=5J3VFSNSDWEEN3YP8TYM&pd_rd_wg=1eAso&pd_rd_r=fc1e7c2f-aec3-463f-af9a-96a9f1904b51,,,,,False,,,N/A,2026-04-21T13:06:46.711385,
63,1,Title,,,,Need help?Visit the help sectionorcontact us,,,,,,False,,,,2026-04-21T13:06:46.711925,
0,2,SB_Video,1.0,,,N/A,N/A,,,,,False,,,,2026-04-21T13:07:02.497348,6.0
1,2,Title,,,,ResultsCheck each product page for other buying options. Price and other details may vary based on p,,,,,,False,,,,2026-04-21T13:07:02.499026,
3,2,Organic,,49.0,B0CY23CC3K,Lonext 4pcs Independence Day Knotted Headband for Women 4th of July Hairbands Twist Turban Headband Elastic Hair Hoop (American Flag Colors),N/A,$8.80,,4.4,55.0,False,https://m.media-amazon.com/images/I/71FqRFmq81L._AC_UL320_.jpg,https://m.media-amazon.com/images/I/71FqRFmq81L._AC_SL1500_.jpg,,2026-04-21T13:07:02.504042,
4,2,Organic,,50.0,B0F43CNHPV,Dolkoic 250 Years 4th of July Headband for Women Girls Red White Blue USA Star Headband Sunglasses Patriotic Party Favors Independence Day Memorial Day 2026 World Cup,N/A,$4.99,,4.8,11.0,False,https://m.media-amazon.com/images/I/71Qb1XPVb7L._AC_UL320_.jpg,https://m.media-amazon.com/images/I/71Qb1XPVb7L._AC_SL1500_.jpg,,2026-04-21T13:07:02.508070,
5,2,Organic,,51.0,B0F43GRKXD,Dolkoic 250 Years 4th of July Headband for Women Girls Red White Blue Star Headband Sunglasses Independence Day Patriotic Party Favors and Memorial Day 2026 World Cup,N/A,$4.99,,3.6,10.0,False,https://m.media-amazon.com/images/I/81BxZGBqcbL._AC_UL320_.jpg,https://m.media-amazon.com/images/I/81BxZGBqcbL._AC_SL1500_.jpg,,2026-04-21T13:07:02.511481,
6,2,Title,,,,"7Pcs American Flag Cape Costume,USA Patriotic Accessories Olympic Sports Cheering,4th of July Outfit",,,,,,False,,,,2026-04-21T13:07:02.512282,
7,2,Title,,,,More results,,,,,,False,,,,2026-04-21T13:07:02.512413,
8,2,Organic,,52.0,B0F2YL4FWZ,8 Pcs Patriotic Party Accessories USA Flag Headband Star Sunglasses Patriotic Headbands and Sunglasses Set for 4th of July Independence Day Memorial Day Party Favors,N/A,$9.99,,5.0,1.0,False,https://m.media-amazon.com/images/I/71E1+-uwg+L._AC_UL320_.jpg,https://m.media-amazon.com/images/I/71E1+-uwg+L._AC_SL1500_.jpg,,2026-04-21T13:07:02.515302,
