data_index,page,ad_type,ad_rank,organic_rank,asin,title,url,price_current,price_list,rating_stars,rating_count,is_prime,image_small,image_large,brand_name,scraped_at,inner_products_count
3,3,Organic,,97.0,B0F1C1H8P2,"2 PCS Fish Net Decorations, 80 x 40 Inch, Ocean Themed Party Decor Beach, Nautical Wall Hanging Fishing Net for Coastal Bedroom, Bathroom, or Under The Sea Party Decorations",N/A,$8.99,,4.6,134.0,False,https://m.media-amazon.com/images/I/714D4m5bmhL._AC_UL320_.jpg,https://m.media-amazon.com/images/I/714D4m5bmhL._AC_SL1500_.jpg,,2026-04-21T12:17:19.871815,
4,3,Organic,,98.0,B0932TV2WL,"KESOTE 3 Pack Tropical Paper Flower Garland Luau Party Decorations, 30FT Tissue Flower Banner for Hawaiian Summer Tiki Bar Tropical Party Decor",N/A,$13.99,,4.6,702.0,False,https://m.media-amazon.com/images/I/71ZAuD1IQBS._AC_UL320_.jpg,https://m.media-amazon.com/images/I/71ZAuD1IQBS._AC_SL1500_.jpg,,2026-04-21T12:17:19.878119,
5,3,Organic,,99.0,B09WCWQLL2,"Blue Starfish Table Runner,Nautical Beach Table Runner Decor for Dinning Room Kitchen Summer Ocean Sea Decorations for Holiday Party, Housewarming Gifts for Women Friends Couple, 13X72Inches",N/A,$8.99,,4.6,440.0,False,https://m.media-amazon.com/images/I/71UCGiBeAdL._AC_UL320_.jpg,https://m.media-amazon.com/images/I/71UCGiBeAdL._AC_SL1500_.jpg,,2026-04-21T12:17:19.883217,
6,3,Title,,,,Kids Sunglasses Bulk Party FavorsSponsored|5K+ bought from this brand in past month|Shop RugortShop ,,,,,,False,,,,2026-04-21T12:17:19.886969,
7,3,Title,,,,More results,,,,,,False,,,,2026-04-21T12:17:19.887205,
8,3,Organic,,100.0,B0DS1SYB42,"Luau Party Decorations, 36PCS Hawaiian Themed Leis Necklace Costume Accessories, Colorful Hawaiian Leis Tropical Flower Clothing Bulk",N/A,$9.98,,4.5,242.0,False,https://m.media-amazon.com/images/I/8196+Nb-nrL._AC_UL320_.jpg,https://m.media-amazon.com/images/I/8196+Nb-nrL._AC_SL1500_.jpg,,2026-04-21T12:17:19.892218,
9,3,Organic,,101.0,B0BVFF3MM6,"Wavy Tinsel Foil Fringe Curtains Teal Blue Streamers Backdrop for Ocean Themed Party Blue Birthday Under The Sea Party Decorations(2 Pack,3.2 ft x 6.6 ft)",N/A,$5.98,,4.7,761.0,False,https://m.media-amazon.com/images/I/81orSPGDQtL._AC_UL320_.jpg,https://m.media-amazon.com/images/I/81orSPGDQtL._AC_SL1500_.jpg,,2026-04-21T12:17:19.897388,
10,3,Organic,,102.0,B0DTJFLHHD,"Pool Party Favors and Beach Party Favors,158PCS Summer Pool Toys for Kids, Undersea theme decoration, Including Beach Balls, Sunglasses, Bubble Wands, Stamp and Crystal Shells for Kids Ages 4-8 8-12",N/A,$26.98,,4.6,199.0,False,https://m.media-amazon.com/images/I/81TrxJeWztL._AC_UL320_.jpg,https://m.media-amazon.com/images/I/81TrxJeWztL._AC_SL1500_.jpg,,2026-04-21T12:17:19.901438,
11,3,Organic,,103.0,B0C936QPTS,"FreshDear 6 Counts Hawaiian Leis Bulk,leis for luau party,hawaiian leis for adults,beach party favors for adults,Summer Beach Vacation,Theme Party Decorations",N/A,$7.99,,4.5,473.0,False,https://m.media-amazon.com/images/I/71+MQO2IASL._AC_UL320_.jpg,https://m.media-amazon.com/images/I/71+MQO2IASL._AC_SL1500_.jpg,,2026-04-21T12:17:19.906939,
12,3,Organic,,104.0,B0FLXP8HLL,Flip Flop Candy Lollipops - 24 Individually Wrapped Summer Themed Suckers - Beach Candy - Summer Party Favors - Pool Party Treats - Goodie Bags for Kids Birthday Party,N/A,$13.95,,4.9,15.0,False,https://m.media-amazon.com/images/I/818UkPj-a9L._AC_UL320_.jpg,https://m.media-amazon.com/images/I/818UkPj-a9L._AC_SL1500_.jpg,,2026-04-21T12:17:19.913346,
13,3,Organic,,105.0,B0D2TQF1SQ,"JCFIRE Summer Pool Beach Party Favors Kids Tattoos, 102 Styles Larger Tropical Hawaiian Luau Themed Temporary Tattoos for Kids Teens Adult, Waterproof Summer Stickers Party Decorations Supplies",N/A,$5.99,,4.7,925.0,False,https://m.media-amazon.com/images/I/71KUi4pTJkL._AC_UL320_.jpg,https://m.media-amazon.com/images/I/71KUi4pTJkL._AC_SL1500_.jpg,,2026-04-21T12:17:19.918886,
14,3,Title,,,,Creative and unique idea to decorate homeShop ArtoidModePrevious pageArtoid Mode Sea Shell Starfish ,,,,,,False,,,,2026-04-21T12:17:19.921169,
15,3,Title,,,,More results,,,,,,False,,,,2026-04-21T12:17:19.921382,
16,3,Organic,,106.0,B094LZ2VGR,"4E's Novelty 48 Packs Tropical Party Cups with Parasol Straws - Disposable Plastic Cups 16oz BPA free, for Hawaiian Luau Party and Pool Parties, Beach Theme Birthday Decorations for Kids & Adults",N/A,$13.49,,4.7,443.0,False,https://m.media-amazon.com/images/I/61HGwRd92VL._AC_UL320_.jpg,https://m.media-amazon.com/images/I/61HGwRd92VL._AC_SL1500_.jpg,,2026-04-21T12:17:19.926437,
17,3,Organic,,107.0,B0FQV5K8B7,96pcs Scalloped Coastal Party Supplies Tropical Blue Bow Starfish Seashell Plates and Napkins Tableware Set Ocean Theme Party Decorations for Summer Beach Wedding Birthday Bachelorette for 24 Guests,N/A,$26.99,,4.7,278.0,False,https://m.media-amazon.com/images/I/81Zc6NZOZuL._AC_UL320_.jpg,https://m.media-amazon.com/images/I/81Zc6NZOZuL._AC_SL1500_.jpg,,2026-04-21T12:17:19.930411,
18,3,Organic,,108.0,B0F5HF5KYD,140 Pcs Ocean Seashell Beach Party Decorations Beach Theme Party Supplies Seashell Disposable Plates Paper Plates Napkins Forks for Kids Summer Birthday Baby Shower Serves 20,N/A,$17.99,,4.8,162.0,False,https://m.media-amazon.com/images/I/81YbskIrV+L._AC_UL320_.jpg,https://m.media-amazon.com/images/I/81YbskIrV+L._AC_SL1500_.jpg,,2026-04-21T12:17:19.934232,
19,3,Organic,,109.0,B0GJBS781S,"Ctosree 20 Pcs Ocean Seashell Party Favors Seashell Bow Lipstick Holder Keychain Gifts Bulk for Beach Wedding Party Favors(Modern,Blue)",N/A,$15.99,,,,False,https://m.media-amazon.com/images/I/81e+hRJVjYL._AC_UL320_.jpg,https://m.media-amazon.com/images/I/81e+hRJVjYL._AC_SL1500_.jpg,,2026-04-21T12:17:19.939118,
20,3,Organic,,110.0,B0GDWLRP7H,"Blue Beach Balloon Arch Kit, 140Pcs Blue and White Balloon Arch Kit Including Dusty Light Blue Pearl White Sand White Balloons for Ocean Sea Pool Theme Baby Shower Birthday Party Decorations",N/A,$9.99,,4.4,6.0,False,https://m.media-amazon.com/images/I/81KTEBfopDL._AC_UL320_.jpg,https://m.media-amazon.com/images/I/81KTEBfopDL._AC_SL1500_.jpg,,2026-04-21T12:17:19.944067,
21,3,Organic,,111.0,B0G338SWP5,12 Pcs 24 oz Blue Bow Starfish Seashell Plastic Cups with Lid Straw Beach Party Blue Coastal Reusable Cup Bulk Ocean Nautical Coffee Tumbler for Wedding Birthday Sea You Soon Baby Shower Summer Party,N/A,$20.99,,5.0,1.0,False,https://m.media-amazon.com/images/I/81asOYTLTxL._AC_UL320_.jpg,https://m.media-amazon.com/images/I/81asOYTLTxL._AC_SL1500_.jpg,,2026-04-21T12:17:19.948159,
22,3,Organic,,112.0,B0BXP8S2YG,"Beach Theme Party Supplies, Summer Pool Pack Includes: Paper Dinner Plates, Dessert Plates, Luncheon Napkins, Cups and Tablecloth for Hawaiian Party Birthday Decorations, Serve 25",N/A,$21.58,,4.7,2049.0,False,https://m.media-amazon.com/images/I/81iVLvNoQQL._AC_UL320_.jpg,https://m.media-amazon.com/images/I/81iVLvNoQQL._AC_SL1500_.jpg,,2026-04-21T12:17:19.952138,
23,3,Organic,,113.0,B0DX23T2W1,"50Pcs Beach Pool Party Decoration Cups, 12 Oz Summer Disposable Cups for Summer Beach Pool Hawaiian Luau Birthday Party Decoration Supplies",N/A,$7.99,,4.8,152.0,False,https://m.media-amazon.com/images/I/712bBwgcoDL._AC_UL320_.jpg,https://m.media-amazon.com/images/I/712bBwgcoDL._AC_SL1500_.jpg,,2026-04-21T12:17:19.956194,
24,3,Organic,,114.0,B09NV8M82B,"Tropical Luau Party Decorations Set Hawaiian Beach Theme Party Favors Luau Party Supplies with 9ft Luau Grass Table Skirt, Palm Leaves, Hibiscus Flowers, 3D Fruit Straws, Flamingo and Pineapple Décors",N/A,$19.98,,4.6,517.0,False,https://m.media-amazon.com/images/I/81RxmR6D5gL._AC_UL320_.jpg,https://m.media-amazon.com/images/I/81RxmR6D5gL._AC_SL1500_.jpg,,2026-04-21T12:17:19.959967,
25,3,Organic,,115.0,B0F1Y3DJTW,"40Pcs Beach Plates and Napkins Party Supplies, Disposable Ocean Waves Birthday Plates Napkins Tableware Set for Hawaiian Ocean Themed Party Decorations (Beach)",N/A,$9.99,,4.6,158.0,False,https://m.media-amazon.com/images/I/71-pY7ezkWL._AC_UL320_.jpg,https://m.media-amazon.com/images/I/71-pY7ezkWL._AC_SL1500_.jpg,,2026-04-21T12:17:19.965115,
26,3,Organic,,116.0,B0BX58241Y,"CCINEE 16 PCS Artificial Palm Leaves, Faux Large Palm Fronds Fake Tropical Plant Simulation Safari Leaves with Stems for Home Hawaiian Luau Party Jungle Beach Theme Party Decoration",N/A,$9.49,,4.4,895.0,False,https://m.media-amazon.com/images/I/81VYGvA-i8L._AC_UL320_.jpg,https://m.media-amazon.com/images/I/81VYGvA-i8L._AC_SL1500_.jpg,,2026-04-21T12:17:19.969136,
27,3,Organic,,117.0,B0BYHQC4XZ,Jerify 24 Pcs Mini Beach Stress Balls 2.5 Inch Foam PU Relief Stress Ball Mini Rainbow Blow Up Beach Balls Toys for Girls Boys Birthday Beach Hawaiian Party Favors Summer Water Games (Bright Color),N/A,$19.99,,4.6,163.0,False,https://m.media-amazon.com/images/I/71wn91QlcCL._AC_UL320_.jpg,https://m.media-amazon.com/images/I/71wn91QlcCL._AC_SL1500_.jpg,,2026-04-21T12:17:19.973934,
28,3,Organic,,118.0,B09MNDW992,Sggvecsy 82 Pieces 8 Kinds Artificial Tropical Palm Leaves Tropical Leaves Monstera Leaves Safari Jungle Leaf with Stems for Hawaiian Luau Party Beach Table Wedding Shower Birthday Theme Decorations,N/A,$12.51,,4.7,1457.0,False,https://m.media-amazon.com/images/I/91YZQCQL+fL._AC_UL320_.jpg,https://m.media-amazon.com/images/I/91YZQCQL+fL._AC_SL1500_.jpg,,2026-04-21T12:17:19.980947,
29,3,Organic,,119.0,B097L9DV95,"KatchOn, Xtralarge Beach Backdrop for Photography - 72x44 Inch | Aloha Blue Sky Ocean Palm Tree with Surfboard Background | Surfboard Backdrop, Surf Board Decoration | Surf Decorations For Party",N/A,$12.99,,4.7,719.0,False,https://m.media-amazon.com/images/I/81y8VjOAlqS._AC_UL320_.jpg,https://m.media-amazon.com/images/I/81y8VjOAlqS._AC_SL1500_.jpg,,2026-04-21T12:17:19.986988,
30,3,Organic,,120.0,B0CLMF5R71,"JOYIN Toy 12 Counts Hawaiian Leis Bulk, Tropical Flower Lei Hawaiian Lei Beach Hawaii Luau Party Favors Decoration Birthday Party Supplies",N/A,$7.11,,4.4,670.0,False,https://m.media-amazon.com/images/I/9196pt2PIiL._AC_UL320_.jpg,https://m.media-amazon.com/images/I/9196pt2PIiL._AC_SL1500_.jpg,,2026-04-21T12:17:19.992726,
31,3,Organic,,121.0,B0DP7JDJPG,"2 Pack Inflatable Palm Trees with Exclusive Two Trunks, 5.5Ft Blow Up Palm Tree Luau Hawaiian Tropical Theme Birthday Indoor Party Decoration, Outdoor Summer Beach Pool Party Supplies Photo Prop Decor",N/A,$29.99,,3.5,40.0,False,https://m.media-amazon.com/images/I/715YSEGGkuL._AC_UL320_.jpg,https://m.media-amazon.com/images/I/715YSEGGkuL._AC_SL1500_.jpg,,2026-04-21T12:17:19.996950,
32,3,Organic,,122.0,B0F58591L1,Oudain 2 Pack Blue Bow Starfish and Seashell Garland 6.56 ft Ocean Coastal Nautical Beach Party Paper Bow Hanging Banner for Under the Sea Summer Birthday Wedding Bachelorette Mermaid Baby Shower,N/A,$7.49,,4.7,117.0,False,https://m.media-amazon.com/images/I/611IoA1u3FL._AC_UL320_.jpg,https://m.media-amazon.com/images/I/611IoA1u3FL._AC_SL1500_.jpg,,2026-04-21T12:17:20.002901,
33,3,Organic,,123.0,B09VDHT8WP,"CCINEE 12 PCS Artificial Palm Leaves, Assorted Sizes Faux Large Palm Fronds Fake Tropical Plant Simulation Safari Leaves with Stems for Home Hawaiian Luau Party Jungle Beach Theme Party Decoration",N/A,$8.09,,4.4,895.0,False,https://m.media-amazon.com/images/I/812ZTMugnuL._AC_UL320_.jpg,https://m.media-amazon.com/images/I/812ZTMugnuL._AC_SL1500_.jpg,,2026-04-21T12:17:20.007048,
34,3,Organic,,124.0,B0CR6SVS6X,"50pcs Hawaiian Leis Decorations, Hawaiian Leis Bulk Flower Necklaces Luau Party Decor, Colorful Hula Dance Celebration Tropical Summer Beach Pool Parties, Hawaiian Flower Leis for Party Favors Decor",N/A,$19.99,,4.5,2699.0,False,https://m.media-amazon.com/images/I/9146S2M6KEL._AC_UL320_.jpg,https://m.media-amazon.com/images/I/9146S2M6KEL._AC_SL1500_.jpg,,2026-04-21T12:17:20.013425,
35,3,Organic,,125.0,B0DLGSDK64,"JOYIN 2-Pack 20"" Beach Balls - Pool Toys Large Inflatable Beach Ball Swimming Pool Water Games, Classic Rainbow Color Beachball Luau Birthday Decorations Party Supplies Party Favors Gifts",N/A,$7.99,,4.4,667.0,False,https://m.media-amazon.com/images/I/61qNOIW4oEL._AC_UL320_.jpg,https://m.media-amazon.com/images/I/61qNOIW4oEL._AC_SL1500_.jpg,,2026-04-21T12:17:20.019663,
36,3,Organic,,126.0,B07Q84Z49D,"PHOGARY 8 Pack Hula Skirt Costume Kit for Hawaii Luau Party - Dancing Hula with Flower Bikini Top, Hawaiian Lei",N/A,$9.99,,4.3,3332.0,False,https://m.media-amazon.com/images/I/8168AnksDBL._AC_UL320_.jpg,https://m.media-amazon.com/images/I/8168AnksDBL._AC_SL1500_.jpg,,2026-04-21T12:17:20.024805,
37,3,Organic,,127.0,B09C21R58H,24 Beach Drinking Crazy Silly Straws for Kids Beach Ball Pool Summer Birthday Party Supplies Favors Decorations End of Year Student Gifts Bulk Prizes with 2 PCS Cleaning Brushes,N/A,$15.95,,4.7,564.0,False,https://m.media-amazon.com/images/I/717WhwJSsQL._AC_UL320_.jpg,https://m.media-amazon.com/images/I/717WhwJSsQL._AC_SL1500_.jpg,,2026-04-21T12:17:20.030222,
38,3,Organic,,128.0,B07M9K6XLC,"Jangostor 12 PCS Starfish 2-6 Inch Mixed Starfish Natural Seashells Starfish Star Fish Shells Decorations Perfect for Wedding Decor Beach Theme Party, Home Decorations, DIY Crafts, Fish Tank",N/A,$8.99,,4.5,2011.0,False,https://m.media-amazon.com/images/I/61ZnkMlmRmL._AC_UL320_.jpg,https://m.media-amazon.com/images/I/61ZnkMlmRmL._AC_SL1500_.jpg,,2026-04-21T12:17:20.036300,
39,3,Organic,,129.0,B0F1Y5XTWS,"3 Pack Ocean Waves Plastic Tablecloth, 54 X 108Inch Disposable Water Print Table Cloths for Rectangle Table Ocean Party Decor Waterproof Tables Cover for Beach Pool Under The Sea Party Decoration",N/A,$7.99,,4.6,312.0,False,https://m.media-amazon.com/images/I/71nEx3UssZL._AC_UL320_.jpg,https://m.media-amazon.com/images/I/71nEx3UssZL._AC_SL1500_.jpg,,2026-04-21T12:17:20.051331,
40,3,Organic,,130.0,B0GM781VGY,Renbuzhu 15Pcs Beach Party Decorations Paper Lanterns Fans Pom Poms Hanging Swirls Summer Pool Luau Hawaiian Tropical Decor Indoor Outdoor,N/A,$15.99,,,,False,https://m.media-amazon.com/images/I/81s97jmKk9L._AC_UL320_.jpg,https://m.media-amazon.com/images/I/81s97jmKk9L._AC_SL1500_.jpg,,2026-04-21T12:17:20.055896,
41,3,Organic,,131.0,B0BY4BHXVZ,"60 Pcs Hawaiian Luau Hula Skirts Decorations, Hawaiian Grass Skirts Leis Necklaces Bracelets for Tropical Beach Holiday Decorations Tropical Themed Dance",N/A,$23.86,,4.5,183.0,False,https://m.media-amazon.com/images/I/91bZUuPj29L._AC_UL320_.jpg,https://m.media-amazon.com/images/I/91bZUuPj29L._AC_SL1500_.jpg,,2026-04-21T12:17:20.060874,
42,3,Organic,,132.0,B0FPFB5YRW,Blue Bow Starfish and Seashell Hanging Swirls 21PCS Ocean Coastal Party Decorations Nautical Beach Hanging Ceiling Streamers for Summwe Wedding Mermaid Baby Shower Bachelorette Party Supplies,N/A,$12.99,,4.4,2.0,False,https://m.media-amazon.com/images/I/81LGrqaU8+L._AC_UL320_.jpg,https://m.media-amazon.com/images/I/81LGrqaU8+L._AC_SL1500_.jpg,,2026-04-21T12:17:20.065553,
43,3,Organic,,133.0,B095S5DPN5,"FUTUREPLUSX 48 PCS Leis for Luau Party decorations, Hawaiian Leis Tropical Hawaiian Bulk Including Colorful Flower Necklace Headbands and Wristbands for Hula Dance Party Tropical Summer Beach Theme",N/A,$11.99,,4.5,690.0,False,https://m.media-amazon.com/images/I/91F4LP+2-TL._AC_UL320_.jpg,https://m.media-amazon.com/images/I/91F4LP+2-TL._AC_SL1500_.jpg,,2026-04-21T12:17:20.070685,
44,3,Organic,,134.0,B0GMQ84KMG,"4 Pack Beach Plastic Tablecloth Party Decorations, Disposable Summer Pool Table Cloth, Waterproof Tropical Surfboard Table Cover for Summer Hawaiian Theme Birthday Party Supplies",N/A,$9.99,,5.0,1.0,False,https://m.media-amazon.com/images/I/718ZyTON4KL._AC_UL320_.jpg,https://m.media-amazon.com/images/I/718ZyTON4KL._AC_SL1500_.jpg,,2026-04-21T12:17:20.075051,
45,3,Organic,,135.0,B0FX2TGN7V,"Jenaai Luau Party Decoration Hawaiian Tropical Beach Party Supplies Include 2 Blue Foil Fringe Curtains, 3 Large Surfboard Coconut Tree and Hibiscus Cardboard Decor, Banner for Aloha Hawaiian Summer",N/A,$36.99,,5.0,1.0,False,https://m.media-amazon.com/images/I/91Yjvq25xtL._AC_UL320_.jpg,https://m.media-amazon.com/images/I/91Yjvq25xtL._AC_SL1500_.jpg,,2026-04-21T12:17:20.078753,
46,3,Organic,,136.0,B073DWVS5T,jollylife 12PCS Luau Hawaiian Grass Skirts + 12PCS Wristbands Party Decorations Hula Hibiscus Flowers Birthday Tropical Supplies,N/A,$23.99,,4.6,1572.0,False,https://m.media-amazon.com/images/I/A1k-7qllpbL._AC_UL320_.jpg,https://m.media-amazon.com/images/I/A1k-7qllpbL._AC_SL1500_.jpg,,2026-04-21T12:17:20.082702,
47,3,Organic,,137.0,B07DNL2HM4,"Bedwina Beach Balls in Bulk - (Pack of 12) 16 Inch Inflatable Basketball, Baseball or Rainbow Beach Ball Toys for Kids, Dozen Beach Balls for Games, Pool Toys, Decorations, Party Favors",N/A,$11.99,,4.6,2818.0,False,https://m.media-amazon.com/images/I/7120bxOa7kL._AC_UL320_.jpg,https://m.media-amazon.com/images/I/7120bxOa7kL._AC_SL1500_.jpg,,2026-04-21T12:17:20.087764,
48,3,Organic,,138.0,B07CJ2SJ6Q,"4E's Novelty 2 Pack Giant Inflatable Palm Trees 6 Ft Tall - Palm Tree Blow Up for Tropical Seaside Inflate Trees Party Decorations, Summer Beach Tree Party, Beach Decoration Plant Birthday Supplies",N/A,$25.99,,4.0,1036.0,False,https://m.media-amazon.com/images/I/81hX7ak5V2L._AC_UL320_.jpg,https://m.media-amazon.com/images/I/81hX7ak5V2L._AC_SL1500_.jpg,,2026-04-21T12:17:20.094847,
49,3,Organic,,139.0,B0DT3YY4MS,"Summer Tropical Beach Hawaiian String Lights - 30 LED 16Ft Battery Operated Tropical Flamingo Pineapple Palm Tree Lights for Luau Pool Decor, Hawaii Theme Summer Outdoor Indoor Party Decorations",N/A,$15.99,,4.5,83.0,False,https://m.media-amazon.com/images/I/81jSbSwsXXL._AC_UL320_.jpg,https://m.media-amazon.com/images/I/81jSbSwsXXL._AC_SL1500_.jpg,,2026-04-21T12:17:20.099841,
50,3,Organic,,140.0,B0F7H4ND5Z,"3-Tier Cupcake Stand for Beach Party Decorations - Multi-Colored Tropical Luau Pool Party Supplies, Hawaiian Themed Birthday Cake Stand for Baby Shower Wedding Decorations",N/A,$12.99,,4.3,59.0,False,https://m.media-amazon.com/images/I/71o2EKBm9WL._AC_UL320_.jpg,https://m.media-amazon.com/images/I/71o2EKBm9WL._AC_SL1500_.jpg,,2026-04-21T12:17:20.103910,
51,3,Organic,,141.0,B0BMX5PY6P,"GINMIC Party Favors Kids sunglasses, 24Pack Kids, Boys and Girls Sunglasses Bulk Age 3-8 with UV400 Protection,Party Favors For Kids, Birthday Classroom Goodie Bags Party Supplies",N/A,$18.22,,4.7,1091.0,False,https://m.media-amazon.com/images/I/71Puo52xx2L._AC_UL320_.jpg,https://m.media-amazon.com/images/I/71Puo52xx2L._AC_SL1500_.jpg,,2026-04-21T12:17:20.109673,
52,3,Organic,,142.0,B0G63M4BZM,"Beach Ball 12 Pack - 12'' Inflatable Beach Balls for Kids Bulk, Swimming Pool Toys Beach Toys for Summer Water Games, Hawaiian Tropical Theme Party Decorations Favors Supplies",N/A,$9.99,,4.5,309.0,False,https://m.media-amazon.com/images/I/71BLmxXaPRL._AC_UL320_.jpg,https://m.media-amazon.com/images/I/71BLmxXaPRL._AC_SL1500_.jpg,,2026-04-21T12:17:20.114701,
53,3,Organic,,143.0,B0DT6V5QDN,"Summer Pool Beach Party Decorations, Splash Birthday Bash Party Supplies Tropical Summer Banner Beach Ball Lantern Fringe Curtain Foil Balloons Arch for Girls Swimming Luau Hawaiian Party Decor(Pink)",N/A,$18.99,,4.4,301.0,False,https://m.media-amazon.com/images/I/81dxLorBn1L._AC_UL320_.jpg,https://m.media-amazon.com/images/I/81dxLorBn1L._AC_SL1500_.jpg,,2026-04-21T12:17:20.119734,
54,3,Organic,,144.0,B0CX554LPZ,3 Pieces Ocean Waves Tablecloth 54 x 108 Inch Water Print Plastic Table Cover Ocean Party Table Cloths for Beach Pool Birthday Under The Sea Party Decorations Supplies,N/A,$7.98,,4.6,160.0,False,https://m.media-amazon.com/images/I/71SUwIsO9VL._AC_UL320_.jpg,https://m.media-amazon.com/images/I/71SUwIsO9VL._AC_SL1500_.jpg,,2026-04-21T12:17:20.123525,
56,3,Title,,,,"Debug info copied.SponsoredJellyfish Paper Lanterns and Bubbles - Under Sea Party Decorations, Merma",,,,,,False,,,,2026-04-21T12:17:20.124405,
57,3,Title,,,,Related searchesbeach party decorationsbeach themed party decorationsbeach theme decorbeach theme pa,,,,,,False,,,,2026-04-21T12:17:20.125336,
58,3,Title,,,,Previous1234...7Next,,,,,,False,,,,2026-04-21T12:17:20.125961,
59,3,SB,5.0,,,N/A,https://aax-us-east-retail-direct.amazon.com/x/c/JGZzFGHZoTsTJ27H5dSGihgAAAGdr_kgYQEAAAH2AQBvbm9fdHhuX2JpZDIgICBvbm9fdHhuX2ltcDEgICB-ncaw/clv1c_ek-IBPHXbcbWXixXZJuIyd59BF5KfsE4NZFHBsqUO6OvbZz2MSbx2HMr0GHEEghZfnFeUvvH7E7lbIfG7VKk9m01f-KVbSOmMmI8mq35Hf3wgzrxHlww_Ll44vQkltNxMpS-DTADtkcJz73-FbLjlsT6aF2dn23K0rRgDvaqypt3sctcg5pJ4W1x8iGs-j4Aw22M1y4JHADL36jb0yhhqS45t9-_juQkXIDcSvvU3TSgfdd6PW6Cuk8HBsV4cJirny04kVZepnlNL9JAU3E62LR34z8G3kcNu1Bfs5l2RvRfkg5A3YNiX_j4wemNSzqyWk1e2Rzik9vi921osX_hfm6DMlTwhyLp4WUpifikoHeQkssA47yjtEDtHWtEN7UKAvO-Qwt_ZGZe-IWx3W6_6d0f5CZbqATVtP_R6LKje4qPZPl-B7q-xnAOiq2twZpVblfQ5dT-DOXJnMCm64rz9IkRXbRRYwFvqRkUY1l-paMOQ9lJbnMQcAvluVJt1BZUyYtFvwacJj3b039NApbfXI1QSRJlkOLj7gCBp6QPVpMRTdhiF9Suw4Go-wPb4pCQ-xUuYujxOdgqHHNItegamiaoLSKOBSZdVAp0gUEGAUuOnrJwVa42K1K85lYnnrJTulq8rNOxY1k6M6sQkaRDnAGtWpHwf9NyV7wM0DGl0UMO9O7QLiFn6IvV9RXY06uECnDvnwhDkl7ScXy8FyrLMxtVSiCvSL3Mz4fwgb84-byAyLbi364LjzYkiPrdHoQqdMq1Fjwe22vwsT8XelqnXOWM1UUy8fv8YrYudr2qyvLcmveF1y87Kv4G9ooAFyHzKLL14fRPni1o5q649D7qfribaXM631524O4OVLcSI0xLGv97XvQAY13HrhGAOgeOQHAFFLs-iLKgTXIIh6babPFd5wzkgvAEdAqJAB0bmaBeuAL16ha6NctgDH1NbajlzPPIfh-Fzjq9FE7pQTH6xF2h0xzj-9ADrQyiLmuK0K84WhfxkwU_scoOUN0A-eBx3HKZqLcwY6PIyIC1lrLpZMKu67VUYZsBEAupdPKa0bNsWrPv_EJIF6CilwDe7pWpO9Mae9Bj-KrmAATIH53BbaM7rbPAdyKQ6s9-aPdBQ-U_fvNC5WDN9San3lICiCIeqCpyTn2NApU4Q4Q1IeFSHH_tJut4qArAuf35ue-ZM1xrFylrMB2fnFxUca05Jb5UJncAEtqxqPrld9kbBBBnW34d-XXBc0aGiti4vk25LUwxzW--rX_eRP5orUivpZWtItRGqRJP-MLv2obmLoI_SaD5kZXYyT78D7oIMVFG4JXvDXz2XeE7H9uMqVYJGF9-6SmDO9J1GxjMbuAJwzNgT7d4yS5nrczlTaj2dpzJcNkMwHVjjvpGC2P0vnyFbgaj10TybcovJZLm1KwMUE4FzDPeNvLR7BsTIyZvKncgz6JIZamsersXm0w-olXmu38ucB-Y62mHt4Rj2GwnUqTpDTdhzasen0uygqrcXEBL2n5J6Jj1PvATwQwGURIiDW49vyPKu1BZIDHc0vksQJBIMThr1Xw45VIUPhxcMH5N_HQtO3l18e5jCaz0nt3ed9pOTUDRtYFrzM4nOR4pqifIoMWWlFoAkNaZM2zfdeVgCFpInMdX1qz-pELFMewxNQmBQIhYkOHp1jNFZ15NzCxLA0A/https://www.amazon.com/stores/page/3FC3EA45-AA4E-4729-85CD-30CB91EC523E/?_encoding=UTF8&store_ref=SB_A08006461VM49SNH8I9V7-A10108031DR7OZ7UVR8U5&pd_rd_plhdr=t&aaxitk=89be480df608cda2f9a2e9250700af33&hsa_cr_id=0&lp_asins=B0FH9C8N63%2CB0FHWHF36L%2CB0FH9JZ9LW&lp_query=beach%20theme%20party%20decorations&lp_slot=desktop-hsa-3psl&ref_=sbx_be_s_3psl_mbd_mb0_bkgd&pd_rd_w=PpubS&content-id=amzn1.sym.cd7c548b-a599-426f-9ffe-daa1aa803c87%3Aamzn1.sym.cd7c548b-a599-426f-9ffe-daa1aa803c87&pf_rd_p=cd7c548b-a599-426f-9ffe-daa1aa803c87&pf_rd_r=6FSZZQB5CQ92712ZYRGW&pd_rd_wg=gXZXQ&pd_rd_r=db5ae9ac-eb1f-464a-8b85-7fb8c40b6960,,,,,False,,,N/A,2026-04-21T12:17:20.130310,
60,3,Title,,,,Need help?Visit the help sectionorcontact us,,,,,,False,,,,2026-04-21T12:17:20.131033,
0,4,SB,6.0,,,Seashell Birthday Party Decorations,https://aax-us-east-retail-direct.amazon.com/x/c/JJqgag29_1oifFm6pET1Tg8AAAGdr_lZGwEAAAH2AQBvbm9fdHhuX2JpZDcgICBvbm9fdHhuX2ltcDEgICDoGdqK/clv1c_ek-wBAfWKrTaneebE_uAIshabJkdaxwzPpOZ88TyBRJh7J0Az1Z8-QnQ2j9eb1bnfFs3km_J4i2qlXFh8UAiO9wOBRlLBcDeGgAvENJkHe0ejQKWXsTULS3_5uUcBunkW4NBXMNZgVD8cRNzx9R7r7Baosn8Vh4iEgX0ySqi1Oadh0vNPiQeivFuovEyrqEx7C0y7lZ7h9cIcKf4uc7pu-CXD3WVhmlu_HzCAAMdb6ttKMM_UfT04pD2uPV4C5qzMvP0L61nZoV6paeTxUP60spRzUV-ttb8wBz7IHJkew2is5N41TzwyVBo5oS9hYlsHU94C-IqoFkJjBBc3pfXz9TcAIvlGN7quaTk2t9Tc5i-Ui7mXwIaDOuZew5WnOopEnfq3Xi26p0X_7QBpkq0i8pNjNcsMI5E0Z4MNJz37Fyq_xhP7a5kaQqm-wSJUTz4OjUhcWSnNmGpYgtDWGA3xDHdQQm5zhoBTxkUW1b4peNubf6XBd-XYxg66YKmJJN_D9aAULT5Fz6xqnnuNz4esOA7zzWMwQoa6T6qsPmvgjuHzK4fubVMwsZtjRYdXoJm5L3ILse1QMPMJosAI7UvrDAJKQaFiSsf1tjRnUa557z8ZTbqtrdrrjq4LptrcEh2zk3WhtYm4Ryqt3etLxU6hbMR0TzwE4p7L4L8AxOAgcEF4Er7WhhZcDvIm3cPpwIP5K9BpsmFvu5MLc1iwgwNHhrhR8yCCTXc8c8RDM34e5gD5-aJzagM6UA9NTgMVhS69iKnL1VGyjCUBWg9zT7pytujhDfRgzE0lBsedna-mNmR8ONzgYFnWYd7HVf19YdxpLIWVfQQLeu256DPrh8xqn8_Y7IfsdB0HZXa0ND_glNccqmbI3JS1HF2-ZcGEruvEJ_rePWavMqD6JmpkIXfDx2LceqDGOeKP58hZbiXBr4BU1IbPSmNn74Ul_Fb0o64lZ17sjKb984a9z7bRfgGtuwxUWWyqKZImS5jdOxfNtw-SZwhRHGCCsLiK7l_fSGl25dNELIcH-9e1WtF159Q2F4evBGxCnPmzgWhCUJ3iPgYhmHy1VHUuNsfNYt9Y5uhTOarCY12Ii8gsK8CigbZHDXxKE3Xa4HehZ1Ze3rqS6LeSb9o4TVSstlIeiYe9Qb3VQTLm9SVAAtH9skKGAuvYKE_TGGFSMJSCL8WUOOew0T_lykHpXgkpm_AV9DBPJa04qVx1rff1joxMbYyOfSyYdTZE59KN5zjbsTETCUr-FCAXPFS1Xn_derD4fjBG65KslXJLW5vO-R6wbE1VIYaNfiC2NZ80KG87ccgnd0_rU3jV6M3ZWnghLAogozHvq1mGjNWohEo6o6UAYYSMgVeg4Y_lkuQ58RgmHeEJ8ZiVUgheaiaatsi4bACgsi037Be1T9vQ6dpiHG0mmmbhSOmkVVLWMeZGvWUEyOkldus7cVdoXzVv2gjJNi856lqapmtq7XvYN3ZPTC3B-7qs_AyAoExrkMnd7ZKx1y7zIeZa3H6uNmw4kQk35qU_qgqRFUW-0fml2kf5JmvOVOGHxkz92SNIWjLjuuMDbED5Ea1EwAfZXldDp-dkweinDHNmrVnI1GIOd3iPDvYHM_YN5g_n6onPw6wB1RKAZN7Lm3ufXJHfyRsyzS2fwPICPApkLPp4bQICgiGdYMRfvWVS6WK0nzjX49BKohiGw/https://www.amazon.com/stores/page/3FC3EA45-AA4E-4729-85CD-30CB91EC523E/?_encoding=UTF8&store_ref=SB_A08006461VM49SNH8I9V7-A10108031DR7OZ7UVR8U5&pd_rd_plhdr=t&aaxitk=89be480df608cda2f9a2e9250700af33&hsa_cr_id=0&lp_asins=B0FH9C8N63%2CB0FHWHF36L%2CB0FH9JZ9LW&lp_query=beach%20theme%20party%20decorations&lp_slot=auto-sparkle-hsa-tetris&ref_=sbx_s_sparkle_sbtcd_bkgd&pd_rd_w=FPqjG&content-id=amzn1.sym.cc961e39-6f5f-411e-8135-81c6c1187ac0%3Aamzn1.sym.cc961e39-6f5f-411e-8135-81c6c1187ac0&pf_rd_p=cc961e39-6f5f-411e-8135-81c6c1187ac0&pf_rd_r=VTWR67W7HRCG3XS6YAJG&pd_rd_wg=gnYtY&pd_rd_r=379a1239-6db3-40c8-a577-ab3c9808ba1d,,,,,False,"https://m.media-amazon.com/images/S/al-na-9d5791cf-3faf/dc70d21b-fdb2-46bd-87fb-34cb7f81db4e._CR0,0,1500,1500_AC_SX130_SY60_CB1169409_QL70_.jpg",,Seashell Birthday Party Decorations,2026-04-21T12:17:34.576018,3.0
1,4,Title,,,,ResultsCheck each product page for other buying options. Price and other details may vary based on p,,,,,,False,,,,2026-04-21T12:17:34.577559,
3,4,Organic,,145.0,B07M9K6XLC,"Jangostor 12 PCS Starfish 2-6 Inch Mixed Starfish Natural Seashells Starfish Star Fish Shells Decorations Perfect for Wedding Decor Beach Theme Party, Home Decorations, DIY Crafts, Fish Tank",N/A,$8.99,,4.5,2011.0,False,https://m.media-amazon.com/images/I/61ZnkMlmRmL._AC_UL320_.jpg,https://m.media-amazon.com/images/I/61ZnkMlmRmL._AC_SL1500_.jpg,,2026-04-21T12:17:34.583347,
