data_index,page,ad_type,ad_rank,organic_rank,asin,title,url,price_current,price_list,rating_stars,rating_count,is_prime,image_small,image_large,brand_name,scraped_at,inner_products_count
0,1,SB,1.0,,,Seashell Birthday Party Decorations,https://aax-us-east-retail-direct.amazon.com/x/c/JKoKbT_lvAWsL4XVUVllM0sAAAGdr_iSkQEAAAH2AQBvbm9fdHhuX2JpZDIgICBvbm9fdHhuX2ltcDEgICDaIosf/clv1c_ek-wBAfWFbbazTI3YotcKUSh-r1b6wMqzoLVAV_2GuZg-J1PQtQm3L8U1xtbDnm5KlJ-74OXkOACjI2H9EBLbdRMKyTYp-OUZnclnjfrXg2XJsE6TY-1Hm6sornzqpc2LwYNOMDU9uGtvC1cLT9T55gboNS0VtWbAgQyzz23vO7P-OuaTaWpIItKHBq_vAyCU_OI72ETB5epZ8T8uoVSlz-aA0pqId-xDmyGw5cba8RNoCW2vESmaUszu0UF0UmwMXOU4ojGvQO-MGQFnprtzRN-MACTpioDNKdZAHdvDddQqBn1mNDq3VltZg9Opdlwm05gi6MqoNkpghAfv4k6DUFp8QpHrdQCHAHU2p5TcZi8Qsknf-JwY4ps1KZWGiDTtpDlpF5pvb2Ci-YqxYIaSpoeQUnlC_99txDCDYBeD32f-TphWKBRcpnAJ7wPFtiR960e89JPEeAaJWrzSsjWAJ0Sp5MD_3ZdU1R3q474LXr4uUN-LgwbBB6I3BMlomwRJvenoIbmr3L_HH3cFqRt82dzuMLWHV_68MnvfdrMzfPZhvJnnqnb97HCxzrqDJBtX6z6ucEsJedLRGXH4yvVwiNVqWmlYkdMFdGDuQOKoZGYoPoCH897w17aI2Q3RO6FgrgmtJ9Ynde4_a6d86X-HwEcvWP5P9NyPCDeu7FiACnkZhicDgAZYyDCO0IFhxOUmnYJgc8ia1ym3tZZEWmXLpAoBZxUI7P2t_gM16s_C47OmLcSvO0c7RmwvoKRrLJLSay5fRfK4WkB_B2heH6IfVuf3MDEswgu9bpufEzysS-YUuTQKHAfQV-6CnfeaO0xJd1_yqxX_OYGommJVfWx7iUYN1tblgWSRMnbmDC1chFAuJfxOrn6OTpn5Q1mb46StyTDT70VVXpto68UBO_BXyjmV-LGq1yBxfj2rdsFPjtZStoSg1Z9bwRFg7xkH2-A6S8ld1Nak6xuJZmwTI5_MWzWReWSoKAJgS5zdnTwzHWbSZ7BRXH0hfUmSdwBOHbUxRRNlHMbH-de1UtF1YfQ2L6vrBGRApjbP22jwSYBdmocg1H47nmJDFO0SDtuSnjv8pO34sGMEHq1Wa7trCqhaPGxjD67zfdx9Txes34S-BDOd4obMUl_b6_NdslfOodwCvVEJIdigUVlUtMr7QgehINss4QwTBDiNq8t_7RXR-TjQOkA9wOFCj77P4lWTytDg5IJQHQN9nCGslOBNavJ6JR3A4XWXqIrIWki2o4bql5GOU_3Oa-s7a47Vl1aJVvoLLULmKMzzgzITzo23ULlE_q9TZ7nYnmisveIju2jmfMIyJp2AJmnJoNQ1DePEjtfZr-ROJNG-QHVnQyrJ-Vuez4vkEuQ58Rm-ApANZuK3OtI9AesmbgYv6Ln1O5PhALEZuaUa8Byvv4GksTL0d8Rn0Y737s1yveXxbImY1f3UsE0DqCakJxBdEgQx6VqRcfsphMLy7HLCXJkRPXetYz6L5o8iXgae-fb78vze8URZePZtoitIiFcuqjsejXm26TFVLkn5-uwsSfA5WjOL2Q6Qk2I1RYcDZyMd9qWUon34nYSDkiR2qKhJ_tLYB6UL63dwAyz9YEVUAtuzgh_ScNtQfZckHT9794X6CfjA0JACtOp8OSNop4jM_EtHIp02cDtHhZUWJDmGsS1z3w9Q2NcM0nl2A/https://www.amazon.com/stores/page/3FC3EA45-AA4E-4729-85CD-30CB91EC523E/?_encoding=UTF8&store_ref=SB_A08006461VM49SNH8I9V7-A10108031DR7OZ7UVR8U5&pd_rd_plhdr=t&aaxitk=89be480df608cda2f9a2e9250700af33&hsa_cr_id=0&lp_asins=B0FH9C8N63%2CB0FHWHF36L%2CB0FH9JZ9LW&lp_query=beach%20theme%20party%20decorations&lp_slot=auto-sparkle-hsa-tetris&ref_=sbx_s_sparkle_sbtcd_bkgd&pd_rd_w=z7jVu&content-id=amzn1.sym.2fb72bc8-96ef-420d-b08f-c04b69f36507%3Aamzn1.sym.2fb72bc8-96ef-420d-b08f-c04b69f36507&pf_rd_p=2fb72bc8-96ef-420d-b08f-c04b69f36507&pf_rd_r=K2JY41QRJ05G38KGFJ8R&pd_rd_wg=rZT7T&pd_rd_r=042a9e7e-3907-48b9-beef-825fcef309ef,,,,,False,"https://m.media-amazon.com/images/S/al-na-9d5791cf-3faf/dc70d21b-fdb2-46bd-87fb-34cb7f81db4e._CR0,0,1500,1500_AC_SX130_SY60_CB1169409_QL70_.jpg",,Seashell Birthday Party Decorations,2026-04-21T12:16:44.055490,3.0
1,1,Title,,,,ResultsCheck each product page for other buying options. Price and other details may vary based on p,,,,,,False,,,,2026-04-21T12:16:44.056604,
3,1,Organic,,1.0,B0FHDQNTWC,"Beach Birthday Party Decorations, 183Pcs Ocean Waves Birthday Party Decorations Summer Pool Hawaiian Beach Party Supplies Plates,Napkins,Cups,Banner,Tablecloth,Balloons,Cupcake Topper,Serves 24",N/A,$23.99,,4.7,34.0,False,https://m.media-amazon.com/images/I/81R+TJv1VCL._AC_UL320_.jpg,https://m.media-amazon.com/images/I/81R+TJv1VCL._AC_SL1500_.jpg,,2026-04-21T12:16:44.060414,
4,1,Organic,,2.0,B0GMQ5JZB3,"Seashell Birthday Decorations,190pcs Beach Party Supplies Coastal Party Decorations Plates and Napkins Cups Tablecloths,Cake Topper,Balloon for Ocean Theme Birthday Decorations,Serves 24",N/A,$23.99,,5.0,4.0,False,https://m.media-amazon.com/images/I/8146+5xChDL._AC_UL320_.jpg,https://m.media-amazon.com/images/I/8146+5xChDL._AC_SL1500_.jpg,,2026-04-21T12:16:44.064336,
5,1,Organic,,3.0,B0GHVYLZKB,Avezano 3 Pcs Summer Beach Tablecloth Beach Party Decorations Disposable Hawaiian Tablecloths Summer Hawaiian Party Decorations 108 x 54 Inch,N/A,$11.99,,4.0,2.0,False,https://m.media-amazon.com/images/I/71JEew2vQXL._AC_UL320_.jpg,https://m.media-amazon.com/images/I/71JEew2vQXL._AC_SL1500_.jpg,,2026-04-21T12:16:44.069458,
7,1,Title,,,,Customers frequently viewedSponsoredSummer Party Decorations Hello Summer Banner Beach Hanging Swirl,,,,,,False,,,,2026-04-21T12:16:44.073208,
8,1,Title,,,,More results,,,,,,False,,,,2026-04-21T12:16:44.073373,
9,1,Organic,,4.0,B0CR6SG9NZ,Arrowom 24pcs Hawaiian Leis Bulk Luau Party Silk Flower Necklace Colorful Tropical Hawaiian Bulk Hula Dance Party Decor Flower Leis Summer Beach Pool Party Decorations Favors Supplies,N/A,$9.49,,4.5,2699.0,False,https://m.media-amazon.com/images/I/91Dw3St+MFL._AC_UL320_.jpg,https://m.media-amazon.com/images/I/91Dw3St+MFL._AC_SL1500_.jpg,,2026-04-21T12:16:44.079433,
10,1,Organic,,5.0,B0FHDVKYG5,"Beach Party Decorations, 273Pcs Ocean Waves Birthday Supplies Summer Pool Beach Birthday Party Decorations Tableware,Banner,Tablecloth,Starfish Bubble Garlands,Balloons,Cake Topper,Fringe Curtains",N/A,$27.99,,4.5,31.0,False,https://m.media-amazon.com/images/I/811H8dHoXbL._AC_UL320_.jpg,https://m.media-amazon.com/images/I/811H8dHoXbL._AC_SL1500_.jpg,,2026-04-21T12:16:44.083541,
11,1,Organic,,6.0,B0DPJ5GMH9,"Beach Party Decorations, Ocean Themed Party Decorations Include Plates Napkins, Cake Topper, Cups Banner Tablecloth for Hawaiian Pool Summer Birthday Party Supplies, Serve 20",N/A,$20.99,,4.8,33.0,False,https://m.media-amazon.com/images/I/81psEPzp1eL._AC_UL320_.jpg,https://m.media-amazon.com/images/I/81psEPzp1eL._AC_SL1500_.jpg,,2026-04-21T12:16:44.087233,
12,1,Organic,,7.0,B0GK6T83LK,Crtiin 28 Pcs Beach Party Decorations Paper Lanterns Pom Poms Fans Spiral Cardboard Hanging Ornaments Hawaiian Tropical Themed Decor for Summer Pool Beach Birthday Party Supplies,N/A,$18.99,,5.0,1.0,False,https://m.media-amazon.com/images/I/81boiL1NpHL._AC_UL320_.jpg,https://m.media-amazon.com/images/I/81boiL1NpHL._AC_SL1500_.jpg,,2026-04-21T12:16:44.090759,
13,1,Organic,,8.0,B0BWLY1PKQ,Summer Theme Photo Ocean Blue Sky Seaside Tropical Palm Trees Luau Birthday Party Decor Banner 82x60in,N/A,$9.90,,4.6,325.0,False,https://m.media-amazon.com/images/I/71vhpJO1IGL._AC_UL320_.jpg,https://m.media-amazon.com/images/I/71vhpJO1IGL._AC_SL1500_.jpg,,2026-04-21T12:16:44.094165,
15,1,Title,,,,Debug info copied.Sponsored4 Pack 3.3 ft x 6.6 ft Wavy Sparkle Aqua Teal Blue Foil Curtain - Water B,,,,,,False,,,,2026-04-21T12:16:44.094943,
16,1,Title,,,,Pool Party DecoractionSponsored|Highly bought brand in this category|Shop TURNMEONShop nowPrevious p,,,,,,False,,,,2026-04-21T12:16:44.096343,
17,1,Title,,,,More results,,,,,,False,,,,2026-04-21T12:16:44.096487,
18,1,Organic,,9.0,B09Z28TMY4,Vinsot 32 Pack Beach Pool Party Eyeglasses Decor Summer Luau Paper Glasses Bulk Hawaiian Sunglasses Frame Tropical Pool Props Photo Booth Props for Summer Beach Luau Party Favor Birthday Supply Decor,N/A,$12.99,,4.1,648.0,False,https://m.media-amazon.com/images/I/81bbJ2wNgCL._AC_UL320_.jpg,https://m.media-amazon.com/images/I/81bbJ2wNgCL._AC_SL1500_.jpg,,2026-04-21T12:16:44.100352,
19,1,Organic,,10.0,B0BWR9FQYX,2 Pack Blue Streamers Party Decorations Fringe Backdrop Ocean Themed Decorations Foil Curtain Backdrop Blue Birthday Ocean Party Decor Supplies,N/A,$5.97,,4.4,10545.0,False,https://m.media-amazon.com/images/I/914rDCqCJuL._AC_UL320_.jpg,https://m.media-amazon.com/images/I/914rDCqCJuL._AC_SL1500_.jpg,,2026-04-21T12:16:44.104240,
20,1,Organic,,11.0,B01F6LRW30,"Joyin Toy 36 Counts Hawaiian Leis Bulk, Tropical Flower Lei Hawaiian Lei Beach Hawaii Luau Party Favors Decoration Birthday Party Supplies(3 Dozen)",N/A,$11.99,,4.6,10884.0,False,https://m.media-amazon.com/images/I/911aTPl1DwL._AC_UL320_.jpg,https://m.media-amazon.com/images/I/911aTPl1DwL._AC_SL1500_.jpg,,2026-04-21T12:16:44.108274,
21,1,Organic,,12.0,B0CTQL4WBT,JellyArch 4 Pcs Inflatable Surf Board 36 Inch Inflatable Pool Floats Luau Hawaiian Party Decorations Tropical Flower Blow up Surfboard for Wall Beach Party Decorations,N/A,$28.99,,4.1,113.0,False,https://m.media-amazon.com/images/I/71XtcaMqViL._AC_UL320_.jpg,https://m.media-amazon.com/images/I/71XtcaMqViL._AC_SL1500_.jpg,,2026-04-21T12:16:44.112557,
22,1,Organic,,13.0,B0G37TZT3X,"cocomigo 299pcs Beach Birthday Party Decorations Serves 25 Guests, Worry-free One-stop Set, with Balloons Arch, Banner Thick Plates and Cupcake Toppers, Easy Setup for Ocean-Themed Party",N/A,$22.99,,4.8,9.0,False,https://m.media-amazon.com/images/I/81VmhZ8LlzL._AC_UL320_.jpg,https://m.media-amazon.com/images/I/81VmhZ8LlzL._AC_SL1500_.jpg,,2026-04-21T12:16:44.117057,
23,1,Organic,,14.0,B073RBVTXT,"ALINK 50 Umbrella Parasol Drinking Straws, Hawaiian Beach Cocktail Luau Party Decorations Supplies",N/A,$6.99,,4.6,10351.0,False,https://m.media-amazon.com/images/I/81YbWfWBaPL._AC_UL320_.jpg,https://m.media-amazon.com/images/I/81YbWfWBaPL._AC_SL1500_.jpg,,2026-04-21T12:16:44.121382,
24,1,Title,,,,More results,,,,,,False,,,,2026-04-21T12:16:44.121933,
25,1,Organic,,15.0,B0CKX7H63H,Tinsel Foil Fringe Curtains Wavy Backdrop for Parties Sparkle Metallic Wavy Foil Fringe Backdrop Curtain for Party Decorations Photo Booth Props for Birthday Graduation Wedding,N/A,$5.99,,4.5,2522.0,False,https://m.media-amazon.com/images/I/91rXc76MkEL._AC_UL320_.jpg,https://m.media-amazon.com/images/I/91rXc76MkEL._AC_SL1500_.jpg,,2026-04-21T12:16:44.125518,
26,1,Organic,,16.0,B07YDK14GQ,Decor365 Under the Sea Party Decorations White Bubble Garlands Little Mermaid Birthday Decorations Bday Hanging Streamer Beach Banner Decor Underwater Backdrop Kids Ocean Party Supplies,N/A,$11.98,,4.6,6487.0,False,https://m.media-amazon.com/images/I/51Gcx9gKPQL._AC_UL320_.jpg,https://m.media-amazon.com/images/I/51Gcx9gKPQL._AC_SL1500_.jpg,,2026-04-21T12:16:44.128946,
27,1,Organic,,17.0,B000R4Q4C2,Sea Creatures Mini Centerpieces 5.5-Inch (4-Pcs),N/A,$5.40,,4.4,1437.0,False,https://m.media-amazon.com/images/I/715JbNe9M8L._AC_UL320_.jpg,https://m.media-amazon.com/images/I/715JbNe9M8L._AC_SL1500_.jpg,,2026-04-21T12:16:44.134074,
28,1,Organic,,18.0,B0CZ637F9S,"OBXT 10"" Blue Hanging Jellyfish Paper Lanterns - Under the Sea Party & Mermaid Birthday Decorations, Baby Shower, Nautical Events, Ocean Theme Classroom & Beach Room Decor (Set of 6)",N/A,$20.99,,4.8,707.0,False,https://m.media-amazon.com/images/I/81vZ2BQo+gL._AC_UL320_.jpg,https://m.media-amazon.com/images/I/81vZ2BQo+gL._AC_SL1500_.jpg,,2026-04-21T12:16:44.137623,
29,1,Organic,,19.0,B08MVQ3J4G,Glitter Paper Starfish Confetti for Birthday Party Table Scatter Beach Theme Party Wedding Decorations DIY Crafts Pack of 150 (teal gold silver),N/A,$9.95,,4.4,189.0,False,https://m.media-amazon.com/images/I/91coEIndt3L._AC_UL320_.jpg,https://m.media-amazon.com/images/I/91coEIndt3L._AC_SL1500_.jpg,,2026-04-21T12:16:44.142553,
30,1,Organic,,20.0,B0C9BQ6MWN,"2 Pack Fish Net Decorations for Party, Natural Cotton Hawaiian Party Fishing Net Decorative, Nautical Themed Cotton Fishnet Under The Sea Pirate Ocean BeachHalloween Decor",N/A,$9.99,,4.7,1095.0,False,https://m.media-amazon.com/images/I/71z3Ekr-WZL._AC_UL320_.jpg,https://m.media-amazon.com/images/I/71z3Ekr-WZL._AC_SL1500_.jpg,,2026-04-21T12:16:44.146917,
31,1,Organic,,21.0,B09TSY3Y24,Yexiya 12 Pieces Beach Honeycomb Centerpieces Pool Cake Balls Table Toppers Beach Pool Party Supplies Decorations for Birthday,N/A,$8.49,,4.3,246.0,False,https://m.media-amazon.com/images/I/81uawshAiQL._AC_UL320_.jpg,https://m.media-amazon.com/images/I/81uawshAiQL._AC_SL1500_.jpg,,2026-04-21T12:16:44.150619,
32,1,Organic,,22.0,B07NWR7HKD,"JOYIN 12-Pack 12“ Beach Balls - Bulk Classic Beachball Inflatable Swimming Pool Toys for Games Adults Kids Birthday Party Supplies Combo Set, Rainbow Color Blow Up Luau Decorations Favors Gifts (12"")",N/A,$9.99,,4.5,3356.0,False,https://m.media-amazon.com/images/I/814LDy0nOPL._AC_UL320_.jpg,https://m.media-amazon.com/images/I/814LDy0nOPL._AC_SL1500_.jpg,,2026-04-21T12:16:44.154980,
33,1,Organic,,23.0,B0GMQ63YV1,"Seashell Beach Party Decorations, Ocean Seashell Birthday Party Supplies with Starfish Plates,Napkins,Banner,Balloons,Tablecloth,Cups,Cake Topper,Honeycomb for Summer Birthday Party Decorations",N/A,$21.99,,,,False,https://m.media-amazon.com/images/I/81NNOMn4eNL._AC_UL320_.jpg,https://m.media-amazon.com/images/I/81NNOMn4eNL._AC_SL1500_.jpg,,2026-04-21T12:16:44.158744,
34,1,Title,,,,More results,,,,,,False,,,,2026-04-21T12:16:44.159369,
35,1,Organic,,24.0,B0DC51MRZ4,"Freyalife Hawaiian Leis Decorations(24pcs),Leis for Luau Party Decor Flower,Tropical Hawaiian Bulk Hula Dance Party Decor",N/A,$6.99,,4.3,621.0,False,https://m.media-amazon.com/images/I/816+lI1lMEL._AC_UL320_.jpg,https://m.media-amazon.com/images/I/816+lI1lMEL._AC_SL1500_.jpg,,2026-04-21T12:16:44.164602,
36,1,Organic,,25.0,B071JR7GYP,"JOYIN 60"" Inflatable Palm Tree Cooler, Beach Theme Decor, Pool Party Decorations, Luau Hawaiian Birthday Party Supplies, Ocean Jungle Tropical Themed Summer Outdoor Drink Cooler",N/A,$19.99,,4.3,5368.0,False,https://m.media-amazon.com/images/I/815M9fW4pfL._AC_UL320_.jpg,https://m.media-amazon.com/images/I/815M9fW4pfL._AC_SL1500_.jpg,,2026-04-21T12:16:44.169794,
37,1,Organic,,26.0,B0CV33D9F1,"3 Pcs Iridescent Waves Tablecloths - Disposable Plastic Ocean Blue Table Cloth Rectangle Table Covers for Under the Sea Beach Surf Pool Party Birthday Party Decorations, 54 x 108 Inch",N/A,$8.99,,4.5,671.0,False,https://m.media-amazon.com/images/I/81jVudN5HQL._AC_UL320_.jpg,https://m.media-amazon.com/images/I/81jVudN5HQL._AC_SL1500_.jpg,,2026-04-21T12:16:44.174012,
38,1,Organic,,27.0,B0C3PQ9M8X,7x5ft Summer Hawaiian Beach Photography Backdrop Tropical Flower Palm Leaves Surfboard Background for Luau Aloha Party Decoration Banner Photo Booth,N/A,$13.99,,4.6,377.0,False,https://m.media-amazon.com/images/I/81BTSS8GBuL._AC_UL320_.jpg,https://m.media-amazon.com/images/I/81BTSS8GBuL._AC_SL1500_.jpg,,2026-04-21T12:16:44.180614,
39,1,Organic,,28.0,B09NM2FPKX,"Fovths Luau Grass Table Skirt Natural 9 Feet x 29.5 Inch Hawaiian Table Skirt for Tropical Hawaiian Party Decorations Luau Costume Party, Straw Yellow",N/A,$8.49,,4.5,2400.0,False,https://m.media-amazon.com/images/I/81Hsj3wr27L._AC_UL320_.jpg,https://m.media-amazon.com/images/I/81Hsj3wr27L._AC_SL1500_.jpg,,2026-04-21T12:16:44.186206,
40,1,Organic,,29.0,B0BYD5TDVP,Iridescent Party Streamers Backdrop - GREATRIL Neon Transparent Holographic Tinsel Foil Fringe Curtain for Mermaid/Frozen/Sea/Euphoria/ERAS Party Theme Decorations 3.2ft x 6.5ft 2 PCS,N/A,$12.67,,4.6,9105.0,False,https://m.media-amazon.com/images/I/91arK4OqjtL._AC_UL320_.jpg,https://m.media-amazon.com/images/I/91arK4OqjtL._AC_SL1500_.jpg,,2026-04-21T12:16:44.192101,
41,1,Organic,,30.0,B0GMQ1DQ67,"Beach Birthday Decorations Hello Summer Party Tableware Disposable Paper Plates,Napkins,Tablecloth,Cups,Balloon,Cake Topper,Banner for Hawaiian Summer Pool Themed Birthday Party Supplies,Serve 24",N/A,$20.99,,,,False,https://m.media-amazon.com/images/I/91LJAt7CapL._AC_UL320_.jpg,https://m.media-amazon.com/images/I/91LJAt7CapL._AC_SL1500_.jpg,,2026-04-21T12:16:44.195741,
42,1,Organic,,31.0,B0C7GMW4T5,"Seashell Beach Party Decorations, Beach Seashell Birthday Party Supplies, Plate, Cup, Napkin, Tablecloth, Tableware, Sea Shell Party Supplies For Birthday Baby Shower Wedding Party | Serve 24",N/A,$21.99,,4.8,104.0,False,https://m.media-amazon.com/images/I/81E6SBYDdaL._AC_UL320_.jpg,https://m.media-amazon.com/images/I/81E6SBYDdaL._AC_SL1500_.jpg,,2026-04-21T12:16:44.200088,
43,1,Organic,,32.0,B0CWGR4MN9,"Large Dolphin Balloons,2 PCS 46 Inch Ocean Animals Foil Mylar Balloons,Sea Animal Balloons for Kids Birthday Themed Party Decorations",N/A,$6.98,,4.5,526.0,False,https://m.media-amazon.com/images/I/61r37M388CL._AC_UL320_.jpg,https://m.media-amazon.com/images/I/61r37M388CL._AC_SL1500_.jpg,,2026-04-21T12:16:44.207013,
44,1,Organic,,33.0,B0GMQ1CN4F,"Beach Party Supplies Serve 24, Summer Beach Party Decorations Include Hello Summer Party Plates, Napkins,Cups,Tablecloth,Banner,Balloons and Cake Toppers for Hawaiian Pool Birthday Baby Shower Decor",N/A,$20.99,,,,False,https://m.media-amazon.com/images/I/81zN2pF3aNL._AC_UL320_.jpg,https://m.media-amazon.com/images/I/81zN2pF3aNL._AC_SL1500_.jpg,,2026-04-21T12:16:44.211375,
45,1,Organic,,34.0,B07RV85678,Decor365 White Finger Starfish Sea Shell Garland Ocean Coastal Nautical Party Decoration Starfish Cutouts Hanging Bunting Banner Under the Sea Mermaid Wish Birthday Beach Wedding Decor,N/A,$12.99,,4.0,904.0,False,https://m.media-amazon.com/images/I/41NXMamleBL._AC_UL320_.jpg,https://m.media-amazon.com/images/I/41NXMamleBL._AC_SL1500_.jpg,,2026-04-21T12:16:44.216208,
46,1,Organic,,35.0,B0831D4S1D,R HORSE Inflatable Palm Tree Flamingo Banana Beach Ball Parrot Beach Pool Toys for Tropical Hawaiian Luau Party Summer Pool Beach Party Decorations,N/A,$22.99,,4.2,945.0,False,https://m.media-amazon.com/images/I/81UNKcb+coL._AC_UL320_.jpg,https://m.media-amazon.com/images/I/81UNKcb+coL._AC_SL1500_.jpg,,2026-04-21T12:16:44.220306,
47,1,Organic,,36.0,B0G2RMHBQW,"Trgowaul Ocean Theme Birthday Decorations for Girls, Sea Animals Birthday Party Supplies, Fish Hanging Swirls, Seashell Cake Topper, Starfish Cards, Fishing Net, Latex Balloon, Summer Beach Party Set",N/A,$19.99,,4.9,15.0,False,https://m.media-amazon.com/images/I/81PofIe0FJL._AC_UL320_.jpg,https://m.media-amazon.com/images/I/81PofIe0FJL._AC_SL1500_.jpg,,2026-04-21T12:16:44.224404,
48,1,Organic,,37.0,B07W7R7PGG,"Sea Shells Mixed Beach Seashells 9 Kinds 1.2""-3.5 ""Various Sizes Natural Seashells and 2 Kinds of Natural Starfish for Beach Themed Party DIY Crafts Fishtank Vase Fillers Home Wedding Decorations",N/A,$9.99,,4.5,6575.0,False,https://m.media-amazon.com/images/I/81ZRnZAoqgL._AC_UL320_.jpg,https://m.media-amazon.com/images/I/81ZRnZAoqgL._AC_SL1500_.jpg,,2026-04-21T12:16:44.227859,
49,1,Organic,,38.0,B0014KKKPA,"Beistle 4 Piece Nautical Cardstock Paper Cut Outs for Luau Themed Bash, Pool Party Decorations, 12 - 14, Beach Sign Cutouts",N/A,$6.41,,4.5,384.0,False,https://m.media-amazon.com/images/I/71zFy1J6JnL._AC_UL320_.jpg,https://m.media-amazon.com/images/I/71zFy1J6JnL._AC_SL1500_.jpg,,2026-04-21T12:16:44.231600,
50,1,Organic,,39.0,B07M5BGJFV,"Tropical Palm Leaf Garland Party Decorations, Length 2.6M, 8.5 FT, Green",N/A,$14.99,,,,False,https://m.media-amazon.com/images/I/81p2nI+iEYL._AC_UL320_.jpg,https://m.media-amazon.com/images/I/81p2nI+iEYL._AC_SL1500_.jpg,,2026-04-21T12:16:44.235007,
51,1,Organic,,40.0,B0CFSLVSCF,"Giant Inflatable Palm Trees - 2 Pack - 6 Foot Super Sturdy Trees for Luau Parties, Beach Decor, Poolside Ambiance, Tropical Theme Decor & Outdoor Fun, Easy Inflation",N/A,$27.99,,4.2,478.0,False,https://m.media-amazon.com/images/I/71FudYlYhIL._AC_UL320_.jpg,https://m.media-amazon.com/images/I/71FudYlYhIL._AC_SL1500_.jpg,,2026-04-21T12:16:44.240468,
52,1,Organic,,41.0,B07NS7BG9L,"JOYIN 28” Inflatable Palm Tree Cooler, Luau Hawaiian Tropical Beach Themed Party Decorations, Blow Up Palm Trees Cooler Outdoor Party Supplies, Kids Adults Birthday Party Décor",N/A,$17.99,,4.4,4015.0,False,https://m.media-amazon.com/images/I/91NOjIPjumL._AC_UL320_.jpg,https://m.media-amazon.com/images/I/91NOjIPjumL._AC_SL1500_.jpg,,2026-04-21T12:16:44.244219,
53,1,Organic,,42.0,B0FDFK627S,3 PACK Summer Banner Seashells Decor Party Decorations Party Supplies Birthday Decorations Blue Bow Starfish The Sea Summer Birthday Wedding Bachelorette Under Paper Hanging Banner for Baby Showre,N/A,$3.99,,4.5,85.0,False,https://m.media-amazon.com/images/I/71JHYmiMzIL._AC_UL320_.jpg,https://m.media-amazon.com/images/I/71JHYmiMzIL._AC_SL1500_.jpg,,2026-04-21T12:16:44.248474,
54,1,Title,,,,More results,,,,,,False,,,,2026-04-21T12:16:44.249045,
55,1,Organic,,43.0,B0BKTQ9JLP,"JOYIN 120 Counts Hawaiian Leis Bulk, Colorful Tropical Flower Leis for Kids Adults Hawaiian Beach Luau Party Favors Decorations",N/A,$32.99,,4.6,10884.0,False,https://m.media-amazon.com/images/I/911aTPl1DwL._AC_UL320_.jpg,https://m.media-amazon.com/images/I/911aTPl1DwL._AC_SL1500_.jpg,,2026-04-21T12:16:44.252650,
56,1,Organic,,44.0,B0CPLZMC78,"50 Shark Candy Bracelets, Cool Blue Candy for Under the Sea and Baby Shark Party Favors, Decorations and Goody Bag Fillers, Individually Wrapped In a Convenient Display Tub, Bulk Pack of 50, By 4YoreElves",N/A,$14.99,,4.8,472.0,False,https://m.media-amazon.com/images/I/81KeWh0y3cL._AC_UL320_.jpg,https://m.media-amazon.com/images/I/81KeWh0y3cL._AC_SL1500_.jpg,,2026-04-21T12:16:44.256463,
57,1,Organic,,45.0,B0G6T7DW6V,"Seashell Party Decorations for Summer Beach Birthday Turned Pretty, Blue Bow Seashell Birthday Party Supplies, Plate, Cup, Napkin, Banner, Tablecloth, Topper, Swirl, Backdrop, Cutlery, Serve 24",N/A,$24.99,,4.8,8.0,False,https://m.media-amazon.com/images/I/91oFWG0gudL._AC_UL320_.jpg,https://m.media-amazon.com/images/I/91oFWG0gudL._AC_SL1500_.jpg,,2026-04-21T12:16:44.260431,
58,1,Organic,,46.0,B0DLNL2DT4,"2 Pack Backdrop Curtains, 3.28 Feet x 7.05 Feet Sky Blue Tinsel Backdrop, Metallic Fringe Curtains Foil Tinsel Party Streamer, Winter Backdrop Happy Birthday Party Supplies",N/A,$5.98,,4.5,3016.0,False,https://m.media-amazon.com/images/I/91lL8c-zHSL._AC_UL320_.jpg,https://m.media-amazon.com/images/I/91lL8c-zHSL._AC_SL1500_.jpg,,2026-04-21T12:16:44.264824,
59,1,Organic,,47.0,B0F1YMPVPN,Beach Party Decorations Kit - Beach Themed Honeycomb Centerpieces and Table Decor for Summer & Pool Party Decorations,N/A,$9.98,,4.7,1132.0,False,https://m.media-amazon.com/images/I/81DHErA5m0L._AC_UL320_.jpg,https://m.media-amazon.com/images/I/81DHErA5m0L._AC_SL1500_.jpg,,2026-04-21T12:16:44.270331,
60,1,Organic,,48.0,B0D298R6F3,Summer Birthday Party Decorations - Beach Party Pool Decor 10PCS Hanging Swirl Banner Flip Flop Slippers Swirls Summer Birthday Hawaiian Supplies for Holiday Celebration Outdoor,N/A,$9.99,,4.5,46.0,False,https://m.media-amazon.com/images/I/81S+FcCVIcL._AC_UL320_.jpg,https://m.media-amazon.com/images/I/81S+FcCVIcL._AC_SL1500_.jpg,,2026-04-21T12:16:44.274388,
62,1,Title,,,,"Debug info copied.SponsoredJellyfish Decor - 10 Pcs Light Up Jellyfish Lanterns, Hanging Jelly Fish ",,,,,,False,,,,2026-04-21T12:16:44.275325,
63,1,Title,,,,Related searchesbeach party decorationsbeach themed party decorationsbeach theme decorbeach theme pa,,,,,,False,,,,2026-04-21T12:16:44.276251,
64,1,Title,,,,Previous123...7Next,,,,,,False,,,,2026-04-21T12:16:44.276604,
65,1,SB,2.0,,,N/A,https://aax-us-east-retail-direct.amazon.com/x/c/JItuvP3HrYbTe2IIYw0g3IEAAAGdr_iSdwEAAAH2AQBvbm9fdHhuX2JpZDIgICBvbm9fdHhuX2ltcDIgICCLwd9N/clv1c_ek-wBPHXbcbWXixXZLvfbmIzcZShsvSXDpFHBsqUO6OvbZxm2kOwPOR3wMuumkeJd9g_2IIVOXjkhg96xYpyXHI1fZK9Hu1JscsvBsf6v0DWyFZ2KXetBTz55-pGsvG_OwswuV7dhdkw-rGhNA1X4nDbo8n8FlUk1Mb3zF_-7Cde3gljeuRjeq9j2BgDnvAWVo5JIxuK3ofERuX07yBW3sGRlXcXLt9S5JpR9sqbBnmiD662vnqnGWjbfF_7s_r_AYkArOzWn-LlhCCvz8HasqtYW9NJQftrmRvEoIlmrI6Cr9Moxqb1QdOzwuMwJw0H_Qxz6CWoxSXVGX4MB4JE0iTCjIx4W0c6ItbkDrVIvVvyizTPAMAKgod9B6iOe0q5HbQ8OqhuTnlplKcCOUCgHTPfVhVMkNC7XGm-wPkfcOGvtFVhTyhqSYwCwjMtsj0BWI1nPglet43JJ_bYn0kNCCylHEL08kTGa9ia7FGqkO5Ta6YSghVI7pElp-e685nRgSWZe191FA1cRMDAxods6QnR2dkk6ojOncp21fW5Fk-_yS2kjSEhw6FO3Nl0cyYAfhgxo7gdKZM9AphmFc80EmX4bRyjwVuVNsI2GLlor2UOVeyTMo14H4uVJlYnrnZTHATRErNsEihFxN6GNZ4goDfb7Kv_B88ab6Nk3ROw42Lbm2OMSLh7r1fjPmMvraKrIJtwkf4KRVGpkgqHhRw_68onRWVo29CFo3yvuo8uxxFWGDfq364Lg_YkcDAZWxhb1854PnTc3r9OE-6yHm4aStF8ZkufQPK9zn5F2hHxrTW5B6bPZNtdIxcWZsoQ9SH_CLr1-exMli2I6q646CLqfvqUaXM431B10CnXJ4Ilh5cVYfTe727US_hw8NJUp3uUMHrgCqCWVzAqK3gKj8TCaPFds_i8lbf99q4d7KZOJu4Z1jyxW0ughvzBTnAIXwWTyAfo2Os9i1k6cgwtqW_W7SsiZ8iVv60jYwbQuvil8K18qHcqrS1PqCo-CKL_FLG_0qdeVpOeFkhoaMJHCofEpfgdJnC6U25qBrzMIUZrf5BHHGkZFn65CeV7sKgxbcUe-xNSVfJuf9cgil72ZbfDKbpHxi_JypCF5lnOSm_UnZ9nvr32_l_kbUJqZyG8CXlyrSjhjOgk_bQyPjJSSAybS5tJfh3sqQoWFAmkyqmxRurkMufAai9ehZtdgRxVUDiAHlIwrnE49gkUqqVAgKz1EtEZnEHdSbAyk9T86bVCpNk4tBrLSIbzHJWqkTPmEC9ZN1Ko2VdvHn-UzVXCK9ZpyTClwxYlVKHpMm-7ICDtmu8To4j32PWqvNUPT4vKARfGxpueJvRbTlXHCo6WPkFAJix8WYPsW9f7h5g2DnYEjxH8UbcBjS4kAlyhRHAd7T5tkMV2P5sa7PMvqMcEGOgR9U90r-TnfPxsnd1PsZ5sxwVyNWQ8hpuPwAhaV8M4j0UHNek7EHYEtZIh11yVMjCIRJ-c_Y4Rw4gEOAX5iORWuS7plnUOFeXX0Mb3ni6VWBfwL8SQklr8xyXkBZwoLIaap3hXboTRt2fxTe-OMoQGe8JFgBR9-sVr8RXICeLlSi1pU11MMP33SPDb8OwJ90C43IWZPPoonSW4zYIUIoRwylchqAF_LZY9cxnF09gSfF0GSaOsb2zfx134A_uVDv22/https://www.amazon.com/stores/page/3FC3EA45-AA4E-4729-85CD-30CB91EC523E/?_encoding=UTF8&store_ref=SB_A08006461VM49SNH8I9V7-A10108031DR7OZ7UVR8U5&pd_rd_plhdr=t&aaxitk=89be480df608cda2f9a2e9250700af33&hsa_cr_id=0&lp_asins=B0FH9C8N63%2CB0FHWHF36L%2CB0FH9JZ9LW&lp_query=beach%20theme%20party%20decorations&lp_slot=desktop-hsa-3psl&ref_=sbx_be_s_3psl_mbd_mb0_bkgd&pd_rd_w=bdnSe&content-id=amzn1.sym.cd7c548b-a599-426f-9ffe-daa1aa803c87%3Aamzn1.sym.cd7c548b-a599-426f-9ffe-daa1aa803c87&pf_rd_p=cd7c548b-a599-426f-9ffe-daa1aa803c87&pf_rd_r=K2JY41QRJ05G38KGFJ8R&pd_rd_wg=UGcjK&pd_rd_r=fe1cf206-0124-44aa-963e-3312d3c332b9,,,,,False,,,N/A,2026-04-21T12:16:44.279579,
66,1,Title,,,,Need help?Visit the help sectionorcontact us,,,,,,False,,,,2026-04-21T12:16:44.280121,
