data_index,page,ad_type,ad_rank,organic_rank,asin,title,url,price_current,price_list,rating_stars,rating_count,is_prime,image_small,image_large,brand_name,scraped_at,inner_products_count
0,2,SB,3.0,,,Pool Party Decoraction,https://aax-us-east-retail-direct.amazon.com/x/c/JOB3DLZvB1Nng2HeFHWu6n4AAAGdr_jaJAEAAAH2AQBvbm9fdHhuX2JpZDEgICBvbm9fdHhuX2ltcDIgICCEdRek/clv1c_ek-wBHHWYrbY3g73n97R7n4zBLahIrdpFxWJTKBf2wG_incVJBIbxU6QxFj0gKpsxhIDcR-CP300it1Q_JGHA5LDINEUOvbOZeNnB8j6zAgWTSnydkw4vLn8-5V0JHU4-x4PrCT46HmrFIiSybMgmlLHus28lE3yksSnjze8_saPWG8TpqCMDgd4zhieeun2eGVr6EBpVzcYtef2rlo45lqbF9ERDNy-rqzkrLygCzqBAklDInVxwps8Ipgi2WXY_ufbYKE1rSqgQNJ-fF7uMak6TWdKjJ6avfpC6AD9aM0QKP1qMfNIbbWHkGcPcXqC1enbYhTbJYxxnLgUdj2ofhGPVCF8jGblSw5reLga314l_U1KJ5Zu8MebHE0pALt0-BiPPL0a42s7RSzMQMaqCLauGb8tOcO3pzmxWpjOGRqr8mJ2vLM8KDCWkvlGvvlLPRbf2N3B_HYU80hb6J7oLO46toCTvoHgvAAsYgVKSeEhLZrWbnmVE9UYkMKmuaYl5dd3ved6zfQQ0witzOTCkUX7MNR3rwusoBcYEyQGG52oXoYt8pueCOaxMQAdeMihh5Sb8YGdYyMvJgNX_dGZOZRET3TSUc_6LKZ_umLcOokUeZ36Af8Boximn31mUW5ws9vpECvo1764KUO85kuoAY6s7QKa8fpK-WE1E_CjoECiwH46ylaYJGTSbv_uTL-EY17_4EhAbujuYwtaljex6KA4HaeHSqYgTmoV0al5k-qUCxWN7VUm3LMo1IQHAJFKoHz14DFCj4horWigFTxMbamg0IQnZVbWA1xUmZ7MkV__EPHdqVSrX6lZxyb3k0BFJquLGzyj57TmQvZeImxY3-VGzA7JjA057O0-kJS8Wj5tONixR5_KTFhJu8JeQn1rAKHSR5Uot2kMFoA_j_b7eMY_0sY-etZMqAtbXhzgi3ZXs5X8vG44vEcpfhih3ecTEvRSMW4uszU85bBd0EOC2sE-6tTEGPYusw2wG91u_s1vjmaegqF0gtXTA3xGzTlE32bZibDchqd9WplWRWZHJTB5799cDUVwVo4rqMsqe103rVvLYpocDjOkoKYTIN1kLAA2jeQv8tcD9MEjllpxxHvD1ACa5-ev1GvaNdvNgH48fK2Bn6as1bpn9r1hi7DLSf4rxZjfhqolsziKR98-6YIw6CGsMmJp84Zppy5DRRn0pkSOMe7a8fb1aCQt9JKUnDisA7AGElIQ2QnCUPo7JNP8dS52Nq5BU6ZlWGGfRheum0O6KQ5DOKSbOimuukb2ZkFar2HLq736ToDbHYSzIAjiESzrkzy0aL-cTmQyDbum8iMEcuuw7cs5My9_45YbW5bOk1HgTttvlUOawL22Nk9lF7FqGq-oAun0IuTWYcjKNnA3SWKvOJOo4livFiIRFQudS26ASjM-qhxNqmjN4RCs7uWbsYVGqld_DrUPIRADZIIm-qCUg7F4d_Cd6ByCyaMtNd11MWhoOCyh_aeCSplLUIr97taV76Rk3q2-pGjxxmy50_tbgc7HCyE0EUCq55ZWMq-9s9cm9ABJUUPjopT4Xo-FqfcjZ1Jwv7zr60JK8V8FPIUi0JWtiGWPdzr7YNr_UTESoVz9jHmg-xERpHvOfxlBQtaX3UeYGdR_vVsRpcK2sJl62JHpgUkdq3RutR-kiY46FKkBzPNL4LYiAd8_6RRguT7TU3kmPi9kmLpIvjY/https://www.amazon.com/stores/page/80D9C6A6-EBA4-4FAA-B337-C14F548C236F/?_encoding=UTF8&store_ref=SB_A01094002P03YGSTFY4FN-A0730151DVRL3YBL3F7W&pd_rd_plhdr=t&aaxitk=b11b1bc42d7224f2a3cc4fe985d614d2&hsa_cr_id=0&lp_asins=B094VPBWJ4%2CB07R3S37BY%2CB09NJJC2NT&lp_query=beach%20theme%20party%20decorations&lp_slot=auto-sparkle-hsa-tetris&ref_=sbx_s_sparkle_sbtcd_bkgd&pd_rd_w=ldHOD&content-id=amzn1.sym.cc961e39-6f5f-411e-8135-81c6c1187ac0%3Aamzn1.sym.cc961e39-6f5f-411e-8135-81c6c1187ac0&pf_rd_p=cc961e39-6f5f-411e-8135-81c6c1187ac0&pf_rd_r=4G3Q98FJE5837P0CYCWK&pd_rd_wg=Ybtjo&pd_rd_r=06006644-0b1e-48d2-aee8-83c2bb508e32,,,,,False,"https://m.media-amazon.com/images/S/al-na-9d5791cf-3faf/61ca8046-5a77-4fba-91a5-1823b2a633d7._CR0,0,400,400_AC_SX130_SY60_CB1169409_QL70_.png",,Pool Party Decoraction,2026-04-21T12:17:03.158747,3.0
1,2,Title,,,,ResultsCheck each product page for other buying options. Price and other details may vary based on p,,,,,,False,,,,2026-04-21T12:17:03.159896,
3,2,Organic,,49.0,B07DLVSJ99,"FUTUREPLUSX 2 Pack Tropical Garland Party Decorations, 20ft Multicolored Tissue Paper Hibiscus Flower Summer Banner for Birthday Beach Theme Luau Hawaiian Party Supplies Jungle Decor",N/A,$8.99,,4.7,3375.0,False,https://m.media-amazon.com/images/I/71q9+TnamlL._AC_UL320_.jpg,https://m.media-amazon.com/images/I/71q9+TnamlL._AC_SL1500_.jpg,,2026-04-21T12:17:03.164414,
4,2,Organic,,50.0,B07BHD1YQD,"WEOXPR 200 Pcs Sea Shells Bulk Mixed Ocean Beach Seashells for Kids, Various Sizes Natural Sea Shell for Crafts, Home Decorations, Beach Theme Party, Wedding Decor, DIY Crafts, Crafting Shells",N/A,$13.85,,4.3,2460.0,False,https://m.media-amazon.com/images/I/81I4+oReJOL._AC_UL320_.jpg,https://m.media-amazon.com/images/I/81I4+oReJOL._AC_SL1500_.jpg,,2026-04-21T12:17:03.168119,
5,2,Organic,,51.0,B07P5DBL4Z,Starryfill Ocean Real Conch 10 LED String Lights 9.0Ft Waterproof Battery Operated Warm White with Timer for Beach Themed Indoor Covered Outdoor Birthday Wedding Parties Decoration,N/A,$13.49,,4.4,878.0,False,https://m.media-amazon.com/images/I/71vYnfHLggL._AC_UL320_.jpg,https://m.media-amazon.com/images/I/71vYnfHLggL._AC_SL1500_.jpg,,2026-04-21T12:17:03.171388,
7,2,Title,,,,Customers frequently viewedSponsoredPool Party Favors and Beach Party Favors 168pcs Summer Pool Toys,,,,,,False,,,,2026-04-21T12:17:03.174922,
8,2,Title,,,,More results,,,,,,False,,,,2026-04-21T12:17:03.175078,
9,2,Organic,,52.0,B0F1XWXY24,"Seashell Party Supplies Ocean Beach Party Supplies Tableware with Seashell Beach Paper Plates Napkins Cups Tablecloth Banner for Summer Hawaiian Birthday Decorations, Serves 24",N/A,$19.99,,4.7,28.0,False,https://m.media-amazon.com/images/I/81X8vYoQ1yL._AC_UL320_.jpg,https://m.media-amazon.com/images/I/81X8vYoQ1yL._AC_SL1500_.jpg,,2026-04-21T12:17:03.178922,
10,2,Organic,,53.0,B0CBPJCBCS,Sukh Fish Net Decorations for Party - 2PCS 39.37 * 78.74 in Fishing Net Decoration Netting for Wall Photo Hanging Nautical Fishnet Table Runner Decorative Ocean Theme Birthday Party Rope Nets,N/A,$8.99,,4.7,408.0,False,https://m.media-amazon.com/images/I/61VAOoIafEL._AC_UL320_.jpg,https://m.media-amazon.com/images/I/61VAOoIafEL._AC_SL1500_.jpg,,2026-04-21T12:17:03.184581,
11,2,Organic,,54.0,B09WJB4JG1,Summer Pool Beach Hanging Swirls Banner Decor 30 Pack Foil Ceiling Hanging Swirls Streams Banner Decorations Garland for Kids Luau Hawaii Celebrating Events Birthday Party Supplies Room Wall Decor,N/A,$9.99,,4.6,287.0,False,https://m.media-amazon.com/images/I/81pvLwg9GEL._AC_UL320_.jpg,https://m.media-amazon.com/images/I/81pvLwg9GEL._AC_SL1500_.jpg,,2026-04-21T12:17:03.188759,
12,2,Organic,,55.0,B07PKN9MYZ,Beach Seashell Decorative String Lights 14.1Ft 40 Warm White LED Waterproof Battery Operated Ocean String Lights for Bedroom Wedding Holiday Party Garden Indoor Outdoor Decorations,N/A,$13.99,,4.5,445.0,False,https://m.media-amazon.com/images/I/814QOeu4soL._AC_UL320_.jpg,https://m.media-amazon.com/images/I/814QOeu4soL._AC_SL1500_.jpg,,2026-04-21T12:17:03.192698,
13,2,Organic,,56.0,B0C2HRKML4,"Zcaukya Inflatable Seashell Pool Float, Giant Clam Air-Filled Toys with Pearl Ball for Kids Birthday Party Swimming Pool Summer Beach Party Mermaid Ocean Theme Party Decor",N/A,$35.99,,4.6,315.0,False,https://m.media-amazon.com/images/I/71RMEUGyOSL._AC_UL320_.jpg,https://m.media-amazon.com/images/I/71RMEUGyOSL._AC_SL1500_.jpg,,2026-04-21T12:17:03.201340,
14,2,Organic,,57.0,B075FPCFNR,60Pcs Tropical Party Decorations Supplies Tropical Palm Leaves Hibiscus Flower Simulation Artificial Leaf for Hawaiian Luau Safari Party Jungle Beach Theme BBQ Birthday Parties Decorations Table Decor,N/A,$11.99,,4.6,3137.0,False,https://m.media-amazon.com/images/I/81jZYriVXGL._AC_UL320_.jpg,https://m.media-amazon.com/images/I/81jZYriVXGL._AC_SL1500_.jpg,,2026-04-21T12:17:03.205579,
15,2,Title,,,,Sunglasses Bulk for Kids Goodie Bag StuffersSponsored|Top 10 best-selling brand in girls' sunglasses,,,,,,False,,,,2026-04-21T12:17:03.208209,
16,2,Title,,,,"Temporary tattoos, your skin’s story.ShopMeoIsDaBestPrevious page96 PCS Smores Pre-cut Temporary Tat",,,,,,False,,,,2026-04-21T12:17:03.209948,
17,2,Title,,,,More results,,,,,,False,,,,2026-04-21T12:17:03.210126,
18,2,Organic,,58.0,B0DT6X8QP2,"Summer Pool Beach Party Decorations, Splash Birthday Bash Party Supplies Tropical Summer Banner Beach Ball Lantern Fringe Curtain Foil Balloons Arch for Swimming Water Luau Hawaiian Party Decor(Blue)",N/A,$18.99,,4.4,301.0,False,https://m.media-amazon.com/images/I/81BUSERqr5L._AC_UL320_.jpg,https://m.media-amazon.com/images/I/81BUSERqr5L._AC_SL1500_.jpg,,2026-04-21T12:17:03.214227,
19,2,Organic,,59.0,B0721468V1,"JOYIN Inflatable Swim Tube Raft (3 pack) with Summer Fruits Painting, Pool Toys for Swimming Pool Party Decorations",N/A,$16.99,,4.6,8366.0,False,https://m.media-amazon.com/images/I/71cpqrIteIL._AC_UL320_.jpg,https://m.media-amazon.com/images/I/71cpqrIteIL._AC_SL1500_.jpg,,2026-04-21T12:17:03.217544,
20,2,Organic,,60.0,B0C4DFTKP8,"Under the Sea Party Decorations 98Pcs, Ocean Theme Birthday Party Supplies Include Backdrop Tablecloth Bubble Garlands Cake Topper Ocean Animals Balloons for Pool Beach Party Baby Shower (Ocean-01)",N/A,$22.99,,4.7,540.0,False,https://m.media-amazon.com/images/I/910e-bJJFyL._AC_UL320_.jpg,https://m.media-amazon.com/images/I/910e-bJJFyL._AC_SL1500_.jpg,,2026-04-21T12:17:03.221123,
21,2,Organic,,61.0,B0DTJ6WHHH,"Tiki Torch Bubbler - Summer Pool Party Bubble Machine with Lights and Music, Bubble Blower and Wand, Rechargeable Outdoor Toy for Kids Teens Birthday Party, 4 Feet Tall, Includes 4oz Bubble Solution",N/A,$14.99,,3.9,897.0,False,https://m.media-amazon.com/images/I/714oV45JnkL._AC_UL320_.jpg,https://m.media-amazon.com/images/I/714oV45JnkL._AC_SL1500_.jpg,,2026-04-21T12:17:03.225183,
22,2,Organic,,62.0,B09G98NBM1,Tropical Luau Party Decoration Pack Hawaiian Beach Theme Party Flamingo Pineapple Décors Multi Scene Luau Party Supplies (135pcs) Happy Birthday & Aloha Felt Banner Table Skirt Disposable Tablecloth,N/A,$24.79,,4.6,982.0,False,https://m.media-amazon.com/images/I/81HD2FwDE8L._AC_UL320_.jpg,https://m.media-amazon.com/images/I/81HD2FwDE8L._AC_SL1500_.jpg,,2026-04-21T12:17:03.229698,
23,2,Organic,,63.0,B0BKTLGZN1,"JOYIN 4-Pack 20"" Beach Balls - Large Rainbow Beach Ball Inflatable Pool Toys for Party Supplies Decorations, Adults Kids Birthday Luau Summer Beach Water Games Beachball Party Favors",N/A,$9.99,,4.5,1468.0,False,https://m.media-amazon.com/images/I/71-+c9L29ML._AC_UL320_.jpg,https://m.media-amazon.com/images/I/71-+c9L29ML._AC_SL1500_.jpg,,2026-04-21T12:17:03.233627,
24,2,Organic,,64.0,B0DCVFYWQ5,"80+ Pcs Natural Seashells, Mixed Starfish Sea Shells for Crafts, Various Sizes Ocean Shells Conch for Decorating, Beach Theme Party, DIY Crafts, Fish Tank Filling, Home Decor, Wedding Decoration",N/A,$8.99,,4.2,544.0,False,https://m.media-amazon.com/images/I/819mz-3rkYL._AC_UL320_.jpg,https://m.media-amazon.com/images/I/819mz-3rkYL._AC_SL1500_.jpg,,2026-04-21T12:17:03.238031,
25,2,Organic,,65.0,B0BVJ95ZH7,"Beach Birthday Party Supplies - 142PCS Hawaiian Pool Party Decoration Including Beach Dinner Plates,Tablecloth for Summer Beach Tropical Baby Shower Birthday Decoration",N/A,$18.99,,4.6,868.0,False,https://m.media-amazon.com/images/I/810my3NZZrL._AC_UL320_.jpg,https://m.media-amazon.com/images/I/810my3NZZrL._AC_SL1500_.jpg,,2026-04-21T12:17:03.243102,
26,2,Organic,,66.0,B071Z2PRRM,EBOOT 15 Pieces Assorted Colored Flower Crown Wreath Headband Garland Multicolor Headbands Floral Headpiece for Wedding Festival Vacation Fairy Party Photography Props,N/A,$16.99,,4.7,1595.0,False,https://m.media-amazon.com/images/I/81cLZZxbU2L._AC_UL320_.jpg,https://m.media-amazon.com/images/I/81cLZZxbU2L._AC_SL1500_.jpg,,2026-04-21T12:17:03.247263,
27,2,Organic,,67.0,B0CKT9X1C6,"Blue Streamers Party Decorations, Pale-Blue Fringe Backdrop, Light-Blue Birthday Decoration, Frozen Birthday Favor, Ocean Parties Decor, Under The Sea Party Decor, Pool Beach Backdrop Decorations",N/A,$5.99,,4.5,586.0,False,https://m.media-amazon.com/images/I/81gmiFkx3DL._AC_UL320_.jpg,https://m.media-amazon.com/images/I/81gmiFkx3DL._AC_SL1500_.jpg,,2026-04-21T12:17:03.252678,
28,2,Organic,,68.0,B0DDJFQJK9,"PHD CAKE Number 1 Beach Birthday Candles, Beach Themed Number Candles, Party Celebration",N/A,$5.99,,4.8,83.0,False,https://m.media-amazon.com/images/I/81XV16qbKdL._AC_UL320_.jpg,https://m.media-amazon.com/images/I/81XV16qbKdL._AC_SL1500_.jpg,,2026-04-21T12:17:03.258767,
29,2,Organic,,69.0,B0B2RFGJL2,"Hawaiian Luau Party Decorations(161 Pcs), Tropical Summer Beach Pool Party Supplies Including Aloha Backdrop, Table Skirt, Tablecloth, Flamingo, Palm Leaves and Hibiscus, Balloons Arch, Straws,",N/A,$22.99,,4.6,579.0,False,https://m.media-amazon.com/images/I/81tA7Fa0I8L._AC_UL320_.jpg,https://m.media-amazon.com/images/I/81tA7Fa0I8L._AC_SL1500_.jpg,,2026-04-21T12:17:03.262498,
30,2,Organic,,70.0,B0F2RXN18F,OHOME 2 Pack Luau Party Decorations - Plastic Tablecloth for Hawaiian Theme Party Decorations | Tropical Summer Beach Pool Birthday Backdrop Favors Supplies,N/A,$6.29,,4.6,900.0,False,https://m.media-amazon.com/images/I/91VMLJwCDvL._AC_UL320_.jpg,https://m.media-amazon.com/images/I/91VMLJwCDvL._AC_SL1500_.jpg,,2026-04-21T12:17:03.267328,
31,2,Organic,,71.0,B079YWPX8X,"4E's Novelty Fish Net Decorative - Pack of 3 - Natural Cotton Fishnet Decor - Each 14 x 4 feet - for Mermaid Party Decorations, Luau Tropical Nautical Beach Table Cover",N/A,$17.98,,4.6,2400.0,False,https://m.media-amazon.com/images/I/81EDandXW3L._AC_UL320_.jpg,https://m.media-amazon.com/images/I/81EDandXW3L._AC_SL1500_.jpg,,2026-04-21T12:17:03.272441,
32,2,Organic,,72.0,B0G7GGDTZ7,"Beach Balls 12 Pack, 12"" Ball, Beach Toys for Kids, Pool Games, Inflatable Pool Toys, Bulk Hawaiian Tropical Theme Party Decorations Favors Supplies Bulk Beach Balls Beach Party Favor",N/A,$7.60,,4.4,461.0,False,https://m.media-amazon.com/images/I/71Pe78yv1EL._AC_UL320_.jpg,https://m.media-amazon.com/images/I/71Pe78yv1EL._AC_SL1500_.jpg,,2026-04-21T12:17:03.276891,
33,2,Organic,,73.0,B0DP2FLFKM,‎Renbuzhu 15PCS Pool Party Decorations Beach Ball Paper Lanterns - Summer Luau Hawaiian Themed Hanging Decor for Home Birthday Outdoor Indoor,N/A,$16.99,,4.5,126.0,False,https://m.media-amazon.com/images/I/81SAWFpzVML._AC_UL320_.jpg,https://m.media-amazon.com/images/I/81SAWFpzVML._AC_SL1500_.jpg,,2026-04-21T12:17:03.281210,
34,2,Organic,,74.0,B0F8TRDXLK,"Big Dot of Happiness Last Toast on The Coast Banner, Beach Bridal or Bachelorette Party Decor, 30 Feet of Cord, 15 Double-Sided Seashells, Champagne Glasses, Wedding Ring Shaped Pieces",N/A,$14.99,,4.3,9.0,False,https://m.media-amazon.com/images/I/81ykNGZiHFL._AC_UL320_.jpg,https://m.media-amazon.com/images/I/81ykNGZiHFL._AC_SL1500_.jpg,,2026-04-21T12:17:03.285811,
35,2,Organic,,75.0,B0CQKP1Y1R,"Playbees Giant Inflatable Palm Tree 6 Foot - 4PK - Beach Party Decorations for Summer Luau Themed Pool Party, Tropical Hawaiian Blow Up Palm Tree Favors - Poolside Ambiance, Easy Inflation",N/A,$41.99,,4.2,478.0,False,https://m.media-amazon.com/images/I/81wL7vpgZhL._AC_UL320_.jpg,https://m.media-amazon.com/images/I/81wL7vpgZhL._AC_SL1500_.jpg,,2026-04-21T12:17:03.293231,
36,2,Organic,,76.0,B0DWDQP46M,"cocomigo 201 Pieces Ocean Party Decorations, All-in-One Sea Turtle Birthday Party Pack, Includes Banner, Plates, Tablecloth, Cake Toppers, Balloons, Under the Sea Decorations for 25 Guests",N/A,$23.99,,4.4,95.0,False,https://m.media-amazon.com/images/I/81qTTuy6BoL._AC_UL320_.jpg,https://m.media-amazon.com/images/I/81qTTuy6BoL._AC_SL1500_.jpg,,2026-04-21T12:17:03.297969,
37,2,Organic,,77.0,B0F13CVFYD,"Hallswl 3Pcs Ocean Waves Tablecloth, Ocean Water Print Tablecloths Summer Disposable Plastic Table Covers for Beach Surf Pool Sea Themed Party Birthday Decorations,54X108inch",N/A,$8.99,,4.7,67.0,False,https://m.media-amazon.com/images/I/81xmLEb5RaL._AC_UL320_.jpg,https://m.media-amazon.com/images/I/81xmLEb5RaL._AC_SL1500_.jpg,,2026-04-21T12:17:03.302950,
38,2,Organic,,78.0,B0G6W7BBYT,"Ocean Seashell Party Decorations Tablecloth, 3 Pcs Beach Coastal Last Toast on the Coast Bachelorette Supplies Table Cover for Summer Birthday, Bridal Shower, Disposable, 55in x 86in",N/A,$7.99,,3.0,1.0,False,https://m.media-amazon.com/images/I/81qCAzuhcoL._AC_UL320_.jpg,https://m.media-amazon.com/images/I/81qCAzuhcoL._AC_SL1500_.jpg,,2026-04-21T12:17:03.307053,
39,2,Organic,,79.0,B0F13P9P91,"Beach Party Supplies, 144Pcs Ocean Waves Birthday Party Supplies Tableware Set Summer Pool party Decorations Ocean Plates and Napkins and Cups for Hawaiian Birthday Decorations",N/A,$17.99,,4.7,17.0,False,https://m.media-amazon.com/images/I/810a-TFmmTL._AC_UL320_.jpg,https://m.media-amazon.com/images/I/810a-TFmmTL._AC_SL1500_.jpg,,2026-04-21T12:17:03.311242,
40,2,Organic,,80.0,B0DLL3GNV9,CHARLENT Glitter Hibiscus Temporary Tattoos for Aloha Party Decoration - 74 Individually Sheets Glitter Hawaii Flower Tattoos for Kids Women Hawaiian Party Favors,N/A,$6.99,,4.7,237.0,False,https://m.media-amazon.com/images/I/81alKIVdmGL._AC_UL320_.jpg,https://m.media-amazon.com/images/I/81alKIVdmGL._AC_SL1500_.jpg,,2026-04-21T12:17:03.314914,
41,2,Organic,,81.0,B0BWHFQKC5,"Katchon, Xtralarge Wavy Blue Foil Fringe Curtain - Pack of 2 | Blue Streamers for Under The Sea Party Decorations | Foil Fringe Backdrop for Birthday, Cruise Door Decorations, Pool Party Decorations",N/A,$12.99,,4.7,796.0,False,https://m.media-amazon.com/images/I/915gfOmzz7L._AC_UL320_.jpg,https://m.media-amazon.com/images/I/915gfOmzz7L._AC_SL1500_.jpg,,2026-04-21T12:17:03.319056,
42,2,Organic,,82.0,B0B2P18C1J,"Paxcoo 50pc Umbrella Straws for Cocktails, Tropical Hawaiian Luau Party Decorations (Assorted Colors)",N/A,$7.99,,4.6,1088.0,False,https://m.media-amazon.com/images/I/71PMm6c2CXL._AC_UL320_.jpg,https://m.media-amazon.com/images/I/71PMm6c2CXL._AC_SL1500_.jpg,,2026-04-21T12:17:03.323993,
43,2,Organic,,83.0,B0FYFRQLQ7,Blue Bow Starfish Seashell Happy Birthday Banner Garland for Ocean Beach Under The Sea Theme Birthday Decor Mermaid Xmas Party Decorations,N/A,$9.99,,4.3,5.0,False,https://m.media-amazon.com/images/I/61IZRddDRZL._AC_UL320_.jpg,https://m.media-amazon.com/images/I/61IZRddDRZL._AC_SL1500_.jpg,,2026-04-21T12:17:03.329558,
44,2,Organic,,84.0,B07DCNJDMK,"Inflatable Palm Tree Decoration, 2 Pack Jumbo Coconut Trees Beach Backdrop Favor Tropical Blow Up Hawaiian Summer Party Decor for Hawaiian Luau Party Decoration",N/A,$13.99,,3.8,1143.0,False,https://m.media-amazon.com/images/I/61dX1IbRPCL._AC_UL320_.jpg,https://m.media-amazon.com/images/I/61dX1IbRPCL._AC_SL1500_.jpg,,2026-04-21T12:17:03.335731,
45,2,Organic,,85.0,B0CG97M36Z,"RICHMYC Ocean Wave Projector Light, 16 Colors Gradual Rotating Water Lamp with Remote Control, Beach Decor Sea Themed Northern Lights Projector for Office Bedroom Bar Restaurant(Plug in 4.7in)",N/A,$15.99,,4.2,1376.0,False,https://m.media-amazon.com/images/I/719HHtEEa-L._AC_UL320_.jpg,https://m.media-amazon.com/images/I/719HHtEEa-L._AC_SL1500_.jpg,,2026-04-21T12:17:03.341191,
46,2,Organic,,86.0,B093SCK8DQ,"WEOXPR Mixed Sea Shells, 100+ Pcs Beach Seashells Starfish, Various Sizes Ocean Seashells for Fish Tank Vase Fillers, Beach Theme Party Wedding Decor, Candle Making, DIY Crafts",N/A,$9.98,,4.3,2460.0,False,https://m.media-amazon.com/images/I/81iNCl7DNIS._AC_UL320_.jpg,https://m.media-amazon.com/images/I/81iNCl7DNIS._AC_SL1500_.jpg,,2026-04-21T12:17:03.345095,
47,2,Organic,,87.0,B0F1C1H8P2,"2 PCS Fish Net Decorations, 80 x 40 Inch, Ocean Themed Party Decor Beach, Nautical Wall Hanging Fishing Net for Coastal Bedroom, Bathroom, or Under The Sea Party Decorations",N/A,$8.99,,4.6,134.0,False,https://m.media-amazon.com/images/I/714D4m5bmhL._AC_UL320_.jpg,https://m.media-amazon.com/images/I/714D4m5bmhL._AC_SL1500_.jpg,,2026-04-21T12:17:03.351445,
48,2,Organic,,88.0,B07HQ4GCCV,"Ocean Line Luau Party Sunglasses - 9 Pairs Funny Hawaiian Glasses, Tropical Fancy Dress Props, Fun Summer Kids Party Favors, Beach Themed Party Supplies Decoration",N/A,$17.98,,4.7,2161.0,False,https://m.media-amazon.com/images/I/71ugXRbXMFL._AC_UL320_.jpg,https://m.media-amazon.com/images/I/71ugXRbXMFL._AC_SL1500_.jpg,,2026-04-21T12:17:03.362299,
49,2,Organic,,89.0,B094CZ2L77,"1200 Pieces Tiny Sea Shells Small Natural Starfish Mixed Ocean Beach Spiral Seashells for Home Decorations,Wedding Decor,Candle Making,Beach Theme Party,DIY Crafts and Vase Filler",N/A,$7.99,,4.6,815.0,False,https://m.media-amazon.com/images/I/714dfHL+J0L._AC_UL320_.jpg,https://m.media-amazon.com/images/I/714dfHL+J0L._AC_SL1500_.jpg,,2026-04-21T12:17:03.368062,
50,2,Organic,,90.0,B0CCRPZXWH,"Under The Sea Party Favor, 32 Pack Mini Bubble Wand for Kids Toddler with Gift Box, Mermaid Birthday Party Supplies, Ocean Goody Bag Filler, Summer Pool Beach Party Decoration Toy, Classroom Prizes",N/A,$8.98,,4.6,316.0,False,https://m.media-amazon.com/images/I/81Y954Yy1gL._AC_UL320_.jpg,https://m.media-amazon.com/images/I/81Y954Yy1gL._AC_SL1500_.jpg,,2026-04-21T12:17:03.374174,
51,2,Organic,,91.0,B097F6TVLL,Transparent Bubble Garlands Mermaid Party Decoration Colored Flat Cutouts Hanging Streamer for Birthday Baptism Wedding Ocean Wall Decal Baby Shower Under Sea Festal Kid Room Photo Props (Color),N/A,,,4.5,1860.0,False,https://m.media-amazon.com/images/I/61RgBCzk08S._AC_UL320_.jpg,https://m.media-amazon.com/images/I/61RgBCzk08S._AC_SL1500_.jpg,,2026-04-21T12:17:03.381171,
52,2,Organic,,92.0,B0C74DRMY7,"NBEADS Conch Shape Ceramic Jewelry Tray, Aqua Shell Trinket Dish Ceramic Ring Earring Holder Ocean-themed Decorative Trinket Plate for Rings Earrings Necklaces Bracelet Jewelry Watch Keys",N/A,$9.89,,4.7,701.0,False,https://m.media-amazon.com/images/I/51r3AqQCQZL._AC_UL320_.jpg,https://m.media-amazon.com/images/I/51r3AqQCQZL._AC_SL1500_.jpg,,2026-04-21T12:17:03.389373,
53,2,Organic,,93.0,B0C2CDXV9C,"VKTEN 32Pcs Sea Mini Bubble Wands Assortment 8 Styles 8 Colors Bubble Party Favors for Kids, Bubbles for Kids, Themed Birthday Party Favors, Classroom Prizes Summer Outdoor Gifts for Girls Boys",N/A,$7.99,,4.8,1206.0,False,https://m.media-amazon.com/images/I/71UOCAZ6noL._AC_UL320_.jpg,https://m.media-amazon.com/images/I/71UOCAZ6noL._AC_SL1500_.jpg,,2026-04-21T12:17:03.393918,
54,2,Organic,,94.0,B09P41CBZD,12'' Beach Ball for Kids: 14 Pack Beach Balls Bulk Inflatable Pool - Beach Balls Bulk Hawaiian Tropical Theme Party Decorations Favors Supplies,N/A,$7.98,,4.4,969.0,False,https://m.media-amazon.com/images/I/51LocPnEHUL._AC_UL320_.jpg,https://m.media-amazon.com/images/I/51LocPnEHUL._AC_SL1500_.jpg,,2026-04-21T12:17:03.398199,
55,2,Organic,,95.0,B09WCWQLL2,"Blue Starfish Table Runner,Nautical Beach Table Runner Decor for Dinning Room Kitchen Summer Ocean Sea Decorations for Holiday Party, Housewarming Gifts for Women Friends Couple, 13X72Inches",N/A,$8.99,,4.6,440.0,False,https://m.media-amazon.com/images/I/71UCGiBeAdL._AC_UL320_.jpg,https://m.media-amazon.com/images/I/71UCGiBeAdL._AC_SL1500_.jpg,,2026-04-21T12:17:03.402165,
56,2,Organic,,96.0,B0F5S3G97S,"Kate Aspen Beach Party Decorations - 62 Piece Coastal Plates and Napkins Party Supplies for 16 Guests - Summer Tableware for Bridal Shower, Luau, Wedding, Pool Parties & More",N/A,$18.63,,4.5,15.0,False,https://m.media-amazon.com/images/I/819+cC60CGL._AC_UL320_.jpg,https://m.media-amazon.com/images/I/819+cC60CGL._AC_SL1500_.jpg,,2026-04-21T12:17:03.406749,
58,2,Title,,,,"Debug info copied.SponsoredJellyfish Paper Lanterns and Bubbles - Under Sea Party Decorations, Merma",,,,,,False,,,,2026-04-21T12:17:03.407597,
59,2,Title,,,,Related searchesbeach party decorationsbeach themed party decorationsbeach theme decorbeach theme pa,,,,,,False,,,,2026-04-21T12:17:03.408508,
60,2,Title,,,,Previous123...7Next,,,,,,False,,,,2026-04-21T12:17:03.408853,
61,2,SB,4.0,,,N/A,https://aax-us-east-retail-direct.amazon.com/x/c/JH-foaoucHBD2tkh7G_3ITQAAAGdr_ja8wEAAAH2AQBvbm9fdHhuX2JpZDMgICBvbm9fdHhuX2ltcDEgICAvJgiY/clv1c_ek-wBAfWbcbaXT1XZ_v_Sd5aokuZ0nDJpJ4Da4JzPUMrv1nrn5qrDK-H4EXABmhfZnFeEraiDIaKZXmb9yGMRNIUjW_7hTDO8bh1sjbW0I8GyFKst6u2QmSo4_xnlOZKxjodWfbX5SEqzkUZxwDNyfgbotyEttWZAgQxzy2_5O7P-KtKs8UxlwOb5vhAI50GSI22wB87LycLsab_sdKF0sKRlXcXLt9S5JtR9srbBvGdNszb0Il9vfC9ppWFItVFV99HJaAicTg9tmVFNfduuqJb7ZX9jlg_wYz84XVFNj7Hpt8FaxXe8aZqsieC3zySCjp0LCSoxSXVKX4CB_JE0hzMgD9u5zVbkUkge0sg0crh-Wb1va0qeFKEj-5IZMd1Xp90jB-L6Ar0YoEpNYAgGtnr_6gpLYVUrb_teoAyuWcJ3_6K8uaCBwMDGWbMsj0BeI2lPnEzGJm9p_bQnUkNCCilGkL0ckTOa8Ra7FGukGwja2YSgiVI7rtDwMTgtNnew6Ru6PKDQSB6r6z_swA-YksEzQYootSF-T65CXiUBkuUKJJFZN7UMv67iQfmBkThNHK_uTqVBDkUVgnstG6-cWB8dHxhcCimCpwe4cUVf5hBhAegHLNajBmUsujSEsiiu0jtwholrWfQDhW7OvaT9dMW8sMqMLqjaNW90dpNj6imE0IE4X-d9k2j1nwFxrSAC3DvcSlDkt5tU3WxwbjmaFY2rbeymiB58WZuj5NXyUPoSCZpz48-3h89ZrHw0eC97cH88AVY9Rc2RvT43Tu0SGipNuCERT0OJlADi-DQuCIyUwbxP-7QYboKSsDvqID3SQRaUsd2fvHtnjuaTEZWm3Fdzn2itCr00pQbngrGVfu8HHHU8COu3ypLd0WuqUWRCOeahb1SMHNpWMDo3OkzSS0Htwzml51TCr76pIvUc4VlfOPOeyKDzcxgDH1NbQjirPPKfx9mzjq9FE7ZQXASPV2tExznes8DrQyS3mj6cK2UT7zfQbMuA-zeThT_AP0FbTUD12DUH-0Trt7fWn1HpLeiA2xDefI-rvj-5hMtjKSLr0MyK8P8d-J3WUgFWAE34R6FsPxCe51IhJCzHVbNmBpaSaloxNLBwx8WbQ8dzDfCG2rrZVReux8Dz_FKrt25L76JyUp5E-ZI3LUMGZUXwK0N7bQE4yNf_NhbGPGCL9bGrOyJox2C1NoewNh2s3l5S5xh6vfehur1k2CJWjwRPRMgMBTZjsIz8pojkpBy_D9gBH3G5XMHyv0iyPP2RhlamboxdMd3iIag361BcXpygw24qUtvkUu0CCsOgDUP3REyEshc7iqzHcncvp1kIpOgupHOT-KTU1wmbNteL9-HwDZc-qfLgoqeIAK982PJabZhZerAIIqwG1HoFWMkCbG_UZyUHbEp5dYx6QEDAtQFbZIR_gUD19cTqgaTKFZRCAx8CKeocd-PQBdtJJVw2Y7eX78z5ZDVw7CrfBKP9Qx8FvblHfk0qdW1d738lFqcz748v23ly7AZ7Q9rlCPgWEchSaTSfCUopziUBfB89p41DcobAMH5wtYkZGUykwWeQENY8Bxs0Q5eB073Hp13srQO_hIz4-fynN5-BnSdhNud1RjI5DEETXs9LgRQRFzR2gslwYDdIJ0gEoctHMsPXc2GJLP6L3OADEO2E2-w_uEDH2c/https://www.amazon.com/stores/page/3FC3EA45-AA4E-4729-85CD-30CB91EC523E/?_encoding=UTF8&store_ref=SB_A08006461VM49SNH8I9V7-A10108031DR7OZ7UVR8U5&pd_rd_plhdr=t&aaxitk=89be480df608cda2f9a2e9250700af33&hsa_cr_id=0&lp_asins=B0FH9C8N63%2CB0FHWHF36L%2CB0FH9JZ9LW&lp_query=beach%20theme%20party%20decorations&lp_slot=desktop-hsa-3psl&ref_=sbx_be_s_3psl_mbd_mb0_bkgd&pd_rd_w=Z5Pdd&content-id=amzn1.sym.cd7c548b-a599-426f-9ffe-daa1aa803c87%3Aamzn1.sym.cd7c548b-a599-426f-9ffe-daa1aa803c87&pf_rd_p=cd7c548b-a599-426f-9ffe-daa1aa803c87&pf_rd_r=4G3Q98FJE5837P0CYCWK&pd_rd_wg=7ntvG&pd_rd_r=60d7151c-6887-46f0-ba67-5f4e63d96864,,,,,False,,,N/A,2026-04-21T12:17:03.412421,
62,2,Title,,,,Need help?Visit the help sectionorcontact us,,,,,,False,,,,2026-04-21T12:17:03.413060,
0,3,SB_Video,1.0,,,N/A,N/A,,,,,False,,,,2026-04-21T12:17:19.864060,6.0
1,3,Title,,,,ResultsCheck each product page for other buying options. Price and other details may vary based on p,,,,,,False,,,,2026-04-21T12:17:19.866096,
