data_index,page,ad_type,ad_rank,organic_rank,asin,title,url,price_current,price_list,rating_stars,rating_count,is_prime,image_small,image_large,brand_name,scraped_at,inner_products_count
4,4,Organic,,146.0,B0DS7KHN12,96Pcs Coastal Beach Party Decorations Blue Seashell Starfish Coral Plates and Napkins Sets Nautical Ocean Birthday Party Decorations for Summer Beach Baby Shower Wedding Party Supplies Serves 24,N/A,$16.99,,4.8,274.0,False,https://m.media-amazon.com/images/I/81ZQlSum7xL._AC_UL320_.jpg,https://m.media-amazon.com/images/I/81ZQlSum7xL._AC_SL1500_.jpg,,2026-04-21T12:17:34.588612,
5,4,Organic,,147.0,B0DYSKPF35,Summer Party Decorations - 61 Pcs Beach Pool Party Decorations Hello Summer Banner Pool Beach Hanging Streams Decor for Home Office School Classroom,N/A,$7.99,,4.7,101.0,False,https://m.media-amazon.com/images/I/81Zdymfw6zL._AC_UL320_.jpg,https://m.media-amazon.com/images/I/81Zdymfw6zL._AC_SL1500_.jpg,,2026-04-21T12:17:34.592603,
6,4,Title,,,,Shark Gift BagSponsored|10K+ bought from this brand in past month|Shop AlicesetShop nowPrevious page,,,,,,False,,,,2026-04-21T12:17:34.594550,
7,4,Title,,,,More results,,,,,,False,,,,2026-04-21T12:17:34.594714,
8,4,Organic,,148.0,B0GM781VGY,Renbuzhu 15Pcs Beach Party Decorations Paper Lanterns Fans Pom Poms Hanging Swirls Summer Pool Luau Hawaiian Tropical Decor Indoor Outdoor,N/A,$15.99,,,,False,https://m.media-amazon.com/images/I/81s97jmKk9L._AC_UL320_.jpg,https://m.media-amazon.com/images/I/81s97jmKk9L._AC_SL1500_.jpg,,2026-04-21T12:17:34.598676,
9,4,Organic,,149.0,B07S21149G,"JOYIN Toy 60 Counts Hawaiian Leis Bulk, Tropical Flower Lei Hawaiian Lei Beach Hawaii Luau Party Favors Decoration Birthday Party Supplies",N/A,$17.99,,4.6,10884.0,False,https://m.media-amazon.com/images/I/911aTPl1DwL._AC_UL320_.jpg,https://m.media-amazon.com/images/I/911aTPl1DwL._AC_SL1500_.jpg,,2026-04-21T12:17:34.603325,
10,4,Organic,,150.0,B0FX2TGN7V,"Jenaai Luau Party Decoration Hawaiian Tropical Beach Party Supplies Include 2 Blue Foil Fringe Curtains, 3 Large Surfboard Coconut Tree and Hibiscus Cardboard Decor, Banner for Aloha Hawaiian Summer",N/A,$36.99,,5.0,1.0,False,https://m.media-amazon.com/images/I/91Yjvq25xtL._AC_UL320_.jpg,https://m.media-amazon.com/images/I/91Yjvq25xtL._AC_SL1500_.jpg,,2026-04-21T12:17:34.609250,
11,4,Organic,,151.0,B0FPFB5YRW,Blue Bow Starfish and Seashell Hanging Swirls 21PCS Ocean Coastal Party Decorations Nautical Beach Hanging Ceiling Streamers for Summwe Wedding Mermaid Baby Shower Bachelorette Party Supplies,N/A,$12.99,,4.4,2.0,False,https://m.media-amazon.com/images/I/81LGrqaU8+L._AC_UL320_.jpg,https://m.media-amazon.com/images/I/81LGrqaU8+L._AC_SL1500_.jpg,,2026-04-21T12:17:34.613175,
12,4,Organic,,152.0,B0DT6V5QDN,"Summer Pool Beach Party Decorations, Splash Birthday Bash Party Supplies Tropical Summer Banner Beach Ball Lantern Fringe Curtain Foil Balloons Arch for Girls Swimming Luau Hawaiian Party Decor(Pink)",N/A,$18.99,,4.4,301.0,False,https://m.media-amazon.com/images/I/81dxLorBn1L._AC_UL320_.jpg,https://m.media-amazon.com/images/I/81dxLorBn1L._AC_SL1500_.jpg,,2026-04-21T12:17:34.617049,
13,4,Organic,,153.0,B09C21R58H,24 Beach Drinking Crazy Silly Straws for Kids Beach Ball Pool Summer Birthday Party Supplies Favors Decorations End of Year Student Gifts Bulk Prizes with 2 PCS Cleaning Brushes,N/A,$15.95,,4.7,564.0,False,https://m.media-amazon.com/images/I/717WhwJSsQL._AC_UL320_.jpg,https://m.media-amazon.com/images/I/717WhwJSsQL._AC_SL1500_.jpg,,2026-04-21T12:17:34.620416,
14,4,Title,,,,"Temporary tattoos, your skin’s story.ShopMeoIsDaBestPrevious page96 PCS Smores Pre-cut Temporary Tat",,,,,,False,,,,2026-04-21T12:17:34.621854,
15,4,Title,,,,More results,,,,,,False,,,,2026-04-21T12:17:34.621990,
16,4,Organic,,154.0,B0GMQ84KMG,"4 Pack Beach Plastic Tablecloth Party Decorations, Disposable Summer Pool Table Cloth, Waterproof Tropical Surfboard Table Cover for Summer Hawaiian Theme Birthday Party Supplies",N/A,$9.99,,5.0,1.0,False,https://m.media-amazon.com/images/I/718ZyTON4KL._AC_UL320_.jpg,https://m.media-amazon.com/images/I/718ZyTON4KL._AC_SL1500_.jpg,,2026-04-21T12:17:34.625246,
17,4,Organic,,155.0,B0FQ5VP6K2,"80x40 Inch Fishing Net Decor, 3mm Beige Natural Cotton Large Decorative Fish Netting Table Runner, Wall Ceiling Halloween Party Decorations for Pirate Under The Sea Nautical Mermaid Themed Party",N/A,$6.99,,4.6,290.0,False,https://m.media-amazon.com/images/I/81sQJCgPpNL._AC_UL320_.jpg,https://m.media-amazon.com/images/I/81sQJCgPpNL._AC_SL1500_.jpg,,2026-04-21T12:17:34.629806,
18,4,Organic,,156.0,B0F1Y5XTWS,"3 Pack Ocean Waves Plastic Tablecloth, 54 X 108Inch Disposable Water Print Table Cloths for Rectangle Table Ocean Party Decor Waterproof Tables Cover for Beach Pool Under The Sea Party Decoration",N/A,$7.99,,4.6,312.0,False,https://m.media-amazon.com/images/I/71nEx3UssZL._AC_UL320_.jpg,https://m.media-amazon.com/images/I/71nEx3UssZL._AC_SL1500_.jpg,,2026-04-21T12:17:34.635667,
19,4,Organic,,157.0,B07Q84Z49D,"PHOGARY 8 Pack Hula Skirt Costume Kit for Hawaii Luau Party - Dancing Hula with Flower Bikini Top, Hawaiian Lei",N/A,$9.99,,4.3,3332.0,False,https://m.media-amazon.com/images/I/8168AnksDBL._AC_UL320_.jpg,https://m.media-amazon.com/images/I/8168AnksDBL._AC_SL1500_.jpg,,2026-04-21T12:17:34.639722,
20,4,Organic,,158.0,B0DP6NRZGV,"72"" Inflatable Palm Tree Cooler, 200+ Drinks Super Large Capacity, Pool Party Decoration, Luau Party Decor, Beach Hawaiian Birthday Party Supplies Tropical Themed Summer Outdoor Drink Cooler",N/A,$22.49,,4.3,449.0,False,https://m.media-amazon.com/images/I/71NsI-mdCGL._AC_UL320_.jpg,https://m.media-amazon.com/images/I/71NsI-mdCGL._AC_SL1500_.jpg,,2026-04-21T12:17:34.644034,
21,4,Organic,,159.0,B0DLGSDK64,"JOYIN 2-Pack 20"" Beach Balls - Pool Toys Large Inflatable Beach Ball Swimming Pool Water Games, Classic Rainbow Color Beachball Luau Birthday Decorations Party Supplies Party Favors Gifts",N/A,$7.99,,4.4,667.0,False,https://m.media-amazon.com/images/I/61qNOIW4oEL._AC_UL320_.jpg,https://m.media-amazon.com/images/I/61qNOIW4oEL._AC_SL1500_.jpg,,2026-04-21T12:17:34.648205,
22,4,Organic,,160.0,B0DT3YY4MS,"Summer Tropical Beach Hawaiian String Lights - 30 LED 16Ft Battery Operated Tropical Flamingo Pineapple Palm Tree Lights for Luau Pool Decor, Hawaii Theme Summer Outdoor Indoor Party Decorations",N/A,$15.99,,4.5,83.0,False,https://m.media-amazon.com/images/I/81jSbSwsXXL._AC_UL320_.jpg,https://m.media-amazon.com/images/I/81jSbSwsXXL._AC_SL1500_.jpg,,2026-04-21T12:17:34.651910,
23,4,Organic,,161.0,B0DTP5ZWGB,"Summer Tropical Birthday Party Decorations, Beach Theme Party Supplies with Table Cloth, Happy Birthday Banner, Aloha Hawaiian Luau Balloons, Foil Fringe Curtains, Hibiscus Palm Leaves, Cake Toppers",N/A,$15.99,,4.3,88.0,False,https://m.media-amazon.com/images/I/81fHXu1ri+L._AC_UL320_.jpg,https://m.media-amazon.com/images/I/81fHXu1ri+L._AC_SL1500_.jpg,,2026-04-21T12:17:34.655915,
24,4,Organic,,162.0,B0G34FMRJ8,Moukeren 3 Pcs Blue Bow Seashell Tablecloth Plastic Beach Party Table Cover Decoration 107.9 x 54 Inches Ocean Starfish Rectangle Tablecloth for the Pool Birthday Party Decor,N/A,$8.99,,5.0,3.0,False,https://m.media-amazon.com/images/I/81a+Cz1atRL._AC_UL320_.jpg,https://m.media-amazon.com/images/I/81a+Cz1atRL._AC_SL1500_.jpg,,2026-04-21T12:17:34.660418,
25,4,Organic,,163.0,B0BZNQN9GK,24 Pieces Beach Theme Reusable Plastic Drink Cocktail Straws Beach Ball Pool Summer Birthday Party Favor Decorations With 2 Cleaning Brushes 8 Colors Straws,N/A,$13.99,,4.7,174.0,False,https://m.media-amazon.com/images/I/71SKzmjBWGL._AC_UL320_.jpg,https://m.media-amazon.com/images/I/71SKzmjBWGL._AC_SL1500_.jpg,,2026-04-21T12:17:34.664478,
26,4,Organic,,164.0,B0G398ZPHD,Pajean 8 Pcs Summer Seashell Birthday Party Decorations Starfish Sea Shell Banner Ocean Nautical Coastal Decor Beach Garland Hanging Streamers Cutouts for Under The Sea Mermaid Decor Wedding Supplies,N/A,$9.99,,4.7,36.0,False,https://m.media-amazon.com/images/I/71lUJSO8YFL._AC_UL320_.jpg,https://m.media-amazon.com/images/I/71lUJSO8YFL._AC_SL1500_.jpg,,2026-04-21T12:17:34.668077,
27,4,Organic,,165.0,B0F7H4ND5Z,"3-Tier Cupcake Stand for Beach Party Decorations - Multi-Colored Tropical Luau Pool Party Supplies, Hawaiian Themed Birthday Cake Stand for Baby Shower Wedding Decorations",N/A,$12.99,,4.3,59.0,False,https://m.media-amazon.com/images/I/71o2EKBm9WL._AC_UL320_.jpg,https://m.media-amazon.com/images/I/71o2EKBm9WL._AC_SL1500_.jpg,,2026-04-21T12:17:34.671993,
28,4,Organic,,166.0,B07DNL2HM4,"Bedwina Beach Balls in Bulk - (Pack of 12) 16 Inch Inflatable Basketball, Baseball or Rainbow Beach Ball Toys for Kids, Dozen Beach Balls for Games, Pool Toys, Decorations, Party Favors",N/A,$11.99,,4.6,2818.0,False,https://m.media-amazon.com/images/I/7120bxOa7kL._AC_UL320_.jpg,https://m.media-amazon.com/images/I/7120bxOa7kL._AC_SL1500_.jpg,,2026-04-21T12:17:34.678133,
29,4,Organic,,167.0,B0F2HPL3PY,"72PCS Beach Plates and Napkins, Ocean Waves Party Supplies Paper Plates and Napkins with Forks Disposable Tableware Set for Hawaiian Ocean Themed Party Decorations",N/A,$9.99,,4.6,122.0,False,https://m.media-amazon.com/images/I/71gHqjFj8iL._AC_UL320_.jpg,https://m.media-amazon.com/images/I/71gHqjFj8iL._AC_SL1500_.jpg,,2026-04-21T12:17:34.681804,
30,4,Organic,,168.0,B07CJ2SJ6Q,"4E's Novelty 2 Pack Giant Inflatable Palm Trees 6 Ft Tall - Palm Tree Blow Up for Tropical Seaside Inflate Trees Party Decorations, Summer Beach Tree Party, Beach Decoration Plant Birthday Supplies",N/A,$25.99,,4.0,1036.0,False,https://m.media-amazon.com/images/I/81hX7ak5V2L._AC_UL320_.jpg,https://m.media-amazon.com/images/I/81hX7ak5V2L._AC_SL1500_.jpg,,2026-04-21T12:17:34.686614,
31,4,Organic,,169.0,B0BY4BHXVZ,"60 Pcs Hawaiian Luau Hula Skirts Decorations, Hawaiian Grass Skirts Leis Necklaces Bracelets for Tropical Beach Holiday Decorations Tropical Themed Dance",N/A,$23.86,,4.5,183.0,False,https://m.media-amazon.com/images/I/91bZUuPj29L._AC_UL320_.jpg,https://m.media-amazon.com/images/I/91bZUuPj29L._AC_SL1500_.jpg,,2026-04-21T12:17:34.691104,
32,4,Organic,,170.0,B0G63M4BZM,"Beach Ball 12 Pack - 12'' Inflatable Beach Balls for Kids Bulk, Swimming Pool Toys Beach Toys for Summer Water Games, Hawaiian Tropical Theme Party Decorations Favors Supplies",N/A,$9.99,,4.5,309.0,False,https://m.media-amazon.com/images/I/71BLmxXaPRL._AC_UL320_.jpg,https://m.media-amazon.com/images/I/71BLmxXaPRL._AC_SL1500_.jpg,,2026-04-21T12:17:34.696831,
33,4,Organic,,171.0,B0DNV52638,"xo, Fetti Coastal Party Foil Confetti - 200 pc | Beach Engagement Party Decoration, Bachelorette Table Decor, Bridal Shower Supplies, Beach Birthday Tablescape",N/A,$8.99,,5.0,13.0,False,https://m.media-amazon.com/images/I/7189UukxmAL._AC_UL320_.jpg,https://m.media-amazon.com/images/I/7189UukxmAL._AC_SL1500_.jpg,,2026-04-21T12:17:34.702307,
34,4,Organic,,172.0,B0BBPTLGV8,Yinder 24 Pieces Clear Inflatable Beach Ball Under The Sea Party Decorations Sponge Mermaid Party Bubble Summer Pool Floating Ball Ocean Theme Supplies,N/A,$19.99,,4.3,255.0,False,https://m.media-amazon.com/images/I/71ncJQZ4jQL._AC_UL320_.jpg,https://m.media-amazon.com/images/I/71ncJQZ4jQL._AC_SL1500_.jpg,,2026-04-21T12:17:34.710854,
35,4,Organic,,173.0,B095S5DPN5,"FUTUREPLUSX 48 PCS Leis for Luau Party decorations, Hawaiian Leis Tropical Hawaiian Bulk Including Colorful Flower Necklace Headbands and Wristbands for Hula Dance Party Tropical Summer Beach Theme",N/A,$11.99,,4.5,690.0,False,https://m.media-amazon.com/images/I/91F4LP+2-TL._AC_UL320_.jpg,https://m.media-amazon.com/images/I/91F4LP+2-TL._AC_SL1500_.jpg,,2026-04-21T12:17:34.716481,
36,4,Organic,,174.0,B0CFDCY9SL,"200Pcs Seashell Cocktail Picks,Beach Hawaiian Lua Party Pick 4.7 Inch Fancy Appetizer Tooth Picks for Summer Hawaiian Party Luau Beach Holiday Party Supplies",N/A,$9.99,,4.6,95.0,False,https://m.media-amazon.com/images/I/81nhc8i+9uL._AC_UL320_.jpg,https://m.media-amazon.com/images/I/81nhc8i+9uL._AC_SL1500_.jpg,,2026-04-21T12:17:34.720085,
37,4,Organic,,175.0,B0CR6SVS6X,"50pcs Hawaiian Leis Decorations, Hawaiian Leis Bulk Flower Necklaces Luau Party Decor, Colorful Hula Dance Celebration Tropical Summer Beach Pool Parties, Hawaiian Flower Leis for Party Favors Decor",N/A,$19.99,,4.5,2699.0,False,https://m.media-amazon.com/images/I/9146S2M6KEL._AC_UL320_.jpg,https://m.media-amazon.com/images/I/9146S2M6KEL._AC_SL1500_.jpg,,2026-04-21T12:17:34.725857,
38,4,Organic,,176.0,B0F942HG9X,3pcs Paper Beach Seashell Party Banners Ocean Party Decorations Natural Seashell Starfish Conch Theme Cardboard Banners for Coastal Beach Sea Birthday Party Baby Shower Supplies,N/A,$13.99,,4.8,9.0,False,https://m.media-amazon.com/images/I/812zuIK7dEL._AC_UL320_.jpg,https://m.media-amazon.com/images/I/812zuIK7dEL._AC_SL1500_.jpg,,2026-04-21T12:17:34.729838,
39,4,Organic,,177.0,B0C85LSKPV,"Summer Pool Birthday Party Decorations, Summer Themed Birthday Plates, Napkin, Cups Banner, Balloons and Cake Topper for Swimming Pool Party Decorations Supplies Set Serves 20",N/A,$17.99,,4.2,53.0,False,https://m.media-amazon.com/images/I/8169SKkQ7IL._AC_UL320_.jpg,https://m.media-amazon.com/images/I/8169SKkQ7IL._AC_SL1500_.jpg,,2026-04-21T12:17:34.733705,
40,4,Organic,,178.0,B0BMX5PY6P,"GINMIC Party Favors Kids sunglasses, 24Pack Kids, Boys and Girls Sunglasses Bulk Age 3-8 with UV400 Protection,Party Favors For Kids, Birthday Classroom Goodie Bags Party Supplies",N/A,$18.22,,4.7,1091.0,False,https://m.media-amazon.com/images/I/71Puo52xx2L._AC_UL320_.jpg,https://m.media-amazon.com/images/I/71Puo52xx2L._AC_SL1500_.jpg,,2026-04-21T12:17:34.738609,
41,4,Organic,,179.0,B0BTYLTMB3,"Kepeel 96 Pcs Summer Pool Beach Party Paper Plates Napkins, Beach Pool Ball Party Decorations Supplies Disposable Dinnerware Tableware for Kids, Serves 24",N/A,$16.99,,4.7,1349.0,False,https://m.media-amazon.com/images/I/71Egk8uyCqL._AC_UL320_.jpg,https://m.media-amazon.com/images/I/71Egk8uyCqL._AC_SL1500_.jpg,,2026-04-21T12:17:34.743480,
42,4,Organic,,180.0,B09WYST684,Kesfey 3 Packs Ocean Wave Tablecloths 54 x 108 Inch Water Print Table Cover Splashproof Plastic Ocean Party Table Cloths with Sea Backdrop for Beach Birthday Party Decoration Shower Supplies,N/A,$6.97,,4.7,515.0,False,https://m.media-amazon.com/images/I/71C5eqF1bML._AC_UL320_.jpg,https://m.media-amazon.com/images/I/71C5eqF1bML._AC_SL1500_.jpg,,2026-04-21T12:17:34.748596,
43,4,Organic,,181.0,B083W99RQ8,"Zcaukya Inflatable Palm Tree Cooler, 60"" Blow Up Palm Tree Cooler for Tropical Party Decorations, Hawaiian Party Supplies Pool Decorations",N/A,$19.49,,4.2,1456.0,False,https://m.media-amazon.com/images/I/71YUjeio9AL._AC_UL320_.jpg,https://m.media-amazon.com/images/I/71YUjeio9AL._AC_SL1500_.jpg,,2026-04-21T12:17:34.766558,
44,4,Organic,,182.0,B0CX554LPZ,3 Pieces Ocean Waves Tablecloth 54 x 108 Inch Water Print Plastic Table Cover Ocean Party Table Cloths for Beach Pool Birthday Under The Sea Party Decorations Supplies,N/A,$7.98,,4.6,160.0,False,https://m.media-amazon.com/images/I/71SUwIsO9VL._AC_UL320_.jpg,https://m.media-amazon.com/images/I/71SUwIsO9VL._AC_SL1500_.jpg,,2026-04-21T12:17:34.771823,
45,4,Organic,,183.0,B073DWVS5T,jollylife 12PCS Luau Hawaiian Grass Skirts + 12PCS Wristbands Party Decorations Hula Hibiscus Flowers Birthday Tropical Supplies,N/A,$23.99,,4.6,1572.0,False,https://m.media-amazon.com/images/I/A1k-7qllpbL._AC_UL320_.jpg,https://m.media-amazon.com/images/I/A1k-7qllpbL._AC_SL1500_.jpg,,2026-04-21T12:17:34.776815,
46,4,Organic,,184.0,B0GL2CG2LD,"118PCS Pool Party Decorations, Beach Party Favors Set with Water Sprayers Bubble Waters Garlands Paper Glasses Bracelets Stickers Keychains – Summer Pool Party Supplies",N/A,$19.99,,,,False,https://m.media-amazon.com/images/I/81jhqmCtRjL._AC_UL320_.jpg,https://m.media-amazon.com/images/I/81jhqmCtRjL._AC_SL1500_.jpg,,2026-04-21T12:17:34.780627,
47,4,Organic,,185.0,B0F4P2TLPG,"PPCLION 12 PCS Natural Starfish 4-5"" and Scallop Shell for Crafts Making Beach Theme Party Wedding Decoration, Home Wall Decor, Christmas Ornaments",N/A,$12.99,,4.8,37.0,False,https://m.media-amazon.com/images/I/71MkeEImdOL._AC_UL320_.jpg,https://m.media-amazon.com/images/I/71MkeEImdOL._AC_SL1500_.jpg,,2026-04-21T12:17:34.785012,
48,4,Organic,,186.0,B0946ZZ9BD,"Outus 30 Pieces Hawaiian Luau Birthday Party Hanging Swirl Decorations, Flower Tropical Palm Flamingo Sign Foil Ceiling Decor for Floral Tropical Party Summer Beach Pool Tiki Supplies(Summer)",N/A,$8.79,,4.6,1154.0,False,https://m.media-amazon.com/images/I/81cwoPntlvL._AC_UL320_.jpg,https://m.media-amazon.com/images/I/81cwoPntlvL._AC_SL1500_.jpg,,2026-04-21T12:17:34.788298,
49,4,Organic,,187.0,B0FS366JXW,"xo, Fetti Summer Party Streamers - 5 Crepe Paper Rolls | Pink, Blue, Green, Orange, Pool Birthday Decorations, Island Bachelorette Decor, Tropical Luau, Beach Hawaiian Theme",N/A,$10.99,,5.0,1.0,False,https://m.media-amazon.com/images/I/51oJ9eT6B2L._AC_UL320_.jpg,https://m.media-amazon.com/images/I/51oJ9eT6B2L._AC_SL1500_.jpg,,2026-04-21T12:17:34.791753,
50,4,Organic,,188.0,B0CW9CMFPJ,"OHOME Luau Party Decorations - Plastic Tablecloth for Tropical Party Decorations | Hawaiian Themed Palm Leaves Summer Beach Favors Supplies,2 Pack",N/A,$5.93,,4.6,2355.0,False,https://m.media-amazon.com/images/I/81s8HD7CFCL._AC_UL320_.jpg,https://m.media-amazon.com/images/I/81s8HD7CFCL._AC_SL1500_.jpg,,2026-04-21T12:17:34.799566,
51,4,Organic,,189.0,B0D12MLZ6X,"Summer Beach Tablecloths, Beach Themed Party Decorations 3pcs Hawaiian Tablecloth Waterproof Table Cover for Pool Beach Party Supplies",N/A,$8.17,,4.6,43.0,False,https://m.media-amazon.com/images/I/81kGQbQ98-L._AC_UL320_.jpg,https://m.media-amazon.com/images/I/81kGQbQ98-L._AC_SL1500_.jpg,,2026-04-21T12:17:34.803831,
52,4,Organic,,190.0,B0DZ2HYV7W,Qinyoung 100 Pcs Ocean Party Disposable Cups 12 oz Clear Plastic Cups with Sea Pattern Ocean Party Supplies for Sea Birthday Decoration Supplies(Seaside),N/A,$24.99,,4.9,19.0,False,https://m.media-amazon.com/images/I/81eJWc9prWL._AC_UL320_.jpg,https://m.media-amazon.com/images/I/81eJWc9prWL._AC_SL1500_.jpg,,2026-04-21T12:17:34.808362,
53,4,Organic,,191.0,B0CX56TZLW,"APOWBLS Surf's Up Party Decorations Tableware For Boys - Surf Birthday Party Supplies, Paper Plate, Cup, Napkin, Cutlery, Tablecloth, Summer Hawaiian Beach Wave Surfing Birthday Decorations | Serve 24",N/A,$22.99,,4.8,23.0,False,https://m.media-amazon.com/images/I/81FwcWXb5HL._AC_UL320_.jpg,https://m.media-amazon.com/images/I/81FwcWXb5HL._AC_SL1500_.jpg,,2026-04-21T12:17:34.812312,
54,4,Organic,,192.0,B0FMJZRKMN,Seashell Cake Toppers 17PCS Starfish Conch Cake Topper Beach Seashell Cake Decorations Under the Sea Ocean Cake Cupcake Decorations for Birthday Baby Shower Wedding Ocean Nautical Theme Party,N/A,$9.98,,5.0,5.0,False,https://m.media-amazon.com/images/I/71yHptDD6aL._AC_UL320_.jpg,https://m.media-amazon.com/images/I/71yHptDD6aL._AC_SL1500_.jpg,,2026-04-21T12:17:34.819707,
56,4,Title,,,,"Debug info copied.SponsoredGranny Pants Yard Game, Granny Pants Outdoor Party Game Granny Pants Outd",,,,,,False,,,,2026-04-21T12:17:34.820685,
57,4,Title,,,,Related searchesbeach party decorationsbeach themed party decorationsbeach theme decorbeach theme pa,,,,,,False,,,,2026-04-21T12:17:34.821632,
58,4,Title,,,,Previous1234567Next,,,,,,False,,,,2026-04-21T12:17:34.822147,
59,4,SB,7.0,,,N/A,https://aax-us-east-retail-direct.amazon.com/x/c/JDoDDIReQKyIoQtHsuoAXAgAAAGdr_lZyQEAAAH2AQBvbm9fdHhuX2JpZDIgICBvbm9fdHhuX2ltcDEgICCUVNp9/clv1c_ek-wBHfWVcba3TK2Z9p873dcuEa5bu_v1xwKjgNItZARpnIleVP8pVkV9Z9QODm4g6OrtwEqzkKZOYw92SZYkiu26UvCkwgc6jnZEebqn_x1CJPRLQZ_Hcz56MNgDlf4sihAHXdnwJLIv9j3MeHtu9TZvL0clptsmtL2n5_qjoEac_4B2abz_0OBx57zgxksjVfvpEhAHA2E84BdFtPEcEiYmtOTFAeAHmKGAZebiDVk4Qu7wRa8fJSvC1waHdqKumwRARvHjQu8MmQNmhr9waOb7YV9tlY_QQREoArW4lYQpXsWe5DqnUXt5gi8hblgnQ9gC-MqHd4JihQdv5XKDU_rppBoW084Mt4mzqOQ4iExr6py_Y6NhLvgppoMYRcyfMKbF1qm3l8kEagxpsmk22wEbeveFVWr5nHe7XW_-oglzxyPreG_WAtK7Rk8Hz3z57YgMMES4vHvDkxLsCnLF8IpNcglrYfLIJ0rowqqrfvil0ij32QwBLirmYViyenYgzvcxNfknmwjRR9MmKC9mDOiikTds56TygI6jHXdA7xI-2ARtZd_WmkWgdYxNI_8pzdRxzgr1HWXwphi6CXRbjEfTNFksaTMlTafc7vv0qcicUUHiWNy1S9EhHm_Pwbr5MrIpQd15gKGN3QBK3hWOLU2eK3XIjFcSd5s8BnAqjyQLVVg_xLm1M53VJecOOvWuiDTj7IEU-HaAHd_G2H2ggclC4EZRb5OAAuiSdVynQsmtop7Hp9u6UDIowHKSjH0_jsHzKvFp_2r4ZeXOnWDCYfnrrHw8x-lNyue3qqzpHdYSDYfSbzidV05MDHoTwChIa6laNR0F_U8237_t2i09q2Pt-aTecAM_T5v0W5Y_EdmnWulJ357S-iMzFBthGMSWiCapFamq05Txi1yiZAJhj_GBXJUDixHl4VZ8LxvmgTTDhPDuT-mq6TFPvI9krC5QS2arJkj_DyyyTSZOVjsFsrOP-zjEZDmndrKZ51iUj2Vry8zBB_3XBaIRc9Jm_c4R5d6saeciVenLvVJOt_NjCTtr3_yz-XD0lwFPYZSbK_0mHuGkxh4r0GegNIwM4TpCoANWBHh9BSb9fKAc742yS179_RkzDupYjt7qUMxhLoGiF7f2zDqk2NpadLKVPB25awk_JtqcXzEQa3zLkumnHl0JEs4DsY6CZnl8MdAooatsPSzuCY-jMghquV7dlGBSZdhd5BEOnUOkQJY6KWr4_M-BxRRyoGqsx1WJ63htK7wX1ppeKz1Z99uwsh8uVoecqDF_xBem5xUwoBEv_5dzfh8DYpBtBgUBZqYslCG8LmeWrUMp21s_Vz9ZbYFXvsaGqkCZ3QTvRHhr8L_HJu39TPOnP6VyWFkMgIdtn-a5J1WJ9EdrqTgeFsj2yomaoo8Aj_oBvX3fSxZ77uoyp6r5Pmoj7T60gE6XgayWTa1HKeDyLrRYjvhIxQOaGux6F4GVsRnaMSK_ZuM7ybAXNeRKnWoyE-SLDOEgC5ZM_7dIh_oyPNCX90ksRGHi42CLMdxMYS6ZaGM70VWXBPB1nYhM7NdprBfk_Wugq2jMgsE_8JXMGGrR6nHBlUKiG0isUnrMEpaUKmdWzo1PKREtGaHIOVF-m8eQMGnWUhSZtzOEPnAWUJ5vIk4r7HE0mK5fZ6tSfDd_IdXlzh7wsCsuRsR/https://www.amazon.com/stores/page/3FC3EA45-AA4E-4729-85CD-30CB91EC523E/?_encoding=UTF8&store_ref=SB_A08006461VM49SNH8I9V7-A10108031DR7OZ7UVR8U5&pd_rd_plhdr=t&aaxitk=89be480df608cda2f9a2e9250700af33&hsa_cr_id=0&lp_asins=B0FH9C8N63%2CB0FHWHF36L%2CB0FH9JZ9LW&lp_query=beach%20theme%20party%20decorations&lp_slot=desktop-hsa-3psl&ref_=sbx_be_s_3psl_mbd_mb0_bkgd&pd_rd_w=OpML1&content-id=amzn1.sym.cd7c548b-a599-426f-9ffe-daa1aa803c87%3Aamzn1.sym.cd7c548b-a599-426f-9ffe-daa1aa803c87&pf_rd_p=cd7c548b-a599-426f-9ffe-daa1aa803c87&pf_rd_r=VTWR67W7HRCG3XS6YAJG&pd_rd_wg=402TT&pd_rd_r=a45cc3d7-bab9-47c9-b33f-9cbf1a095f21,,,,,False,,,N/A,2026-04-21T12:17:34.826162,
60,4,Title,,,,Need help?Visit the help sectionorcontact us,,,,,,False,,,,2026-04-21T12:17:34.826792,
0,5,SB_Video,2.0,,,N/A,N/A,,,,,False,,,,2026-04-21T12:17:50.123294,6.0
1,5,Title,,,,ResultsCheck each product page for other buying options. Price and other details may vary based on p,,,,,,False,,,,2026-04-21T12:17:50.127057,
3,5,Organic,,193.0,B0DNV52638,"xo, Fetti Coastal Party Foil Confetti - 200 pc | Beach Engagement Party Decoration, Bachelorette Table Decor, Bridal Shower Supplies, Beach Birthday Tablescape",N/A,$8.99,,5.0,13.0,False,https://m.media-amazon.com/images/I/7189UukxmAL._AC_UL320_.jpg,https://m.media-amazon.com/images/I/7189UukxmAL._AC_SL1500_.jpg,,2026-04-21T12:17:50.132327,
4,5,Organic,,194.0,B0F942HG9X,3pcs Paper Beach Seashell Party Banners Ocean Party Decorations Natural Seashell Starfish Conch Theme Cardboard Banners for Coastal Beach Sea Birthday Party Baby Shower Supplies,N/A,$13.99,,4.8,9.0,False,https://m.media-amazon.com/images/I/812zuIK7dEL._AC_UL320_.jpg,https://m.media-amazon.com/images/I/812zuIK7dEL._AC_SL1500_.jpg,,2026-04-21T12:17:50.136916,
5,5,Organic,,195.0,B0G63M4BZM,"Beach Ball 12 Pack - 12'' Inflatable Beach Balls for Kids Bulk, Swimming Pool Toys Beach Toys for Summer Water Games, Hawaiian Tropical Theme Party Decorations Favors Supplies",N/A,$9.99,,4.5,309.0,False,https://m.media-amazon.com/images/I/71BLmxXaPRL._AC_UL320_.jpg,https://m.media-amazon.com/images/I/71BLmxXaPRL._AC_SL1500_.jpg,,2026-04-21T12:17:50.142504,
6,5,Title,,,,Sunglasses Bulk for Kids Goodie Bag StuffersSponsored|Top 10 best-selling brand in girls' sunglasses,,,,,,False,,,,2026-04-21T12:17:50.144573,
7,5,Title,,,,More results,,,,,,False,,,,2026-04-21T12:17:50.144716,
8,5,Organic,,196.0,B0G398ZPHD,Pajean 8 Pcs Summer Seashell Birthday Party Decorations Starfish Sea Shell Banner Ocean Nautical Coastal Decor Beach Garland Hanging Streamers Cutouts for Under The Sea Mermaid Decor Wedding Supplies,N/A,$9.99,,4.7,36.0,False,https://m.media-amazon.com/images/I/71lUJSO8YFL._AC_UL320_.jpg,https://m.media-amazon.com/images/I/71lUJSO8YFL._AC_SL1500_.jpg,,2026-04-21T12:17:50.148585,
9,5,Organic,,197.0,B0G4DDFRSN,"Honeydak 210 Pcs Seashell Beach Party Supplies, Serve 30 Coastal Theme Disposable Paper Plates Blue Ocean Starfish Party Decorations Napkins Forks Cups for Bachelorette Summer Birthday Baby Shower",N/A,$28.99,,4.1,6.0,False,https://m.media-amazon.com/images/I/81KtUJ0oUAL._AC_UL320_.jpg,https://m.media-amazon.com/images/I/81KtUJ0oUAL._AC_SL1500_.jpg,,2026-04-21T12:17:50.152351,
10,5,Organic,,198.0,B0D12MLZ6X,"Summer Beach Tablecloths, Beach Themed Party Decorations 3pcs Hawaiian Tablecloth Waterproof Table Cover for Pool Beach Party Supplies",N/A,$8.17,,4.6,43.0,False,https://m.media-amazon.com/images/I/81kGQbQ98-L._AC_UL320_.jpg,https://m.media-amazon.com/images/I/81kGQbQ98-L._AC_SL1500_.jpg,,2026-04-21T12:17:50.157547,
11,5,Organic,,199.0,B088FJ4L7K,"YUNXUAN Flamingo Party Supplies, Hawaiian Party Decorations Flamingo and Pineapple Honeycomb Ball Paper Lanterns Paper Fans Pom poms Flowers for Birthday Luau Tropical Bachelorette Party",N/A,$16.99,,4.7,1692.0,False,https://m.media-amazon.com/images/I/71oYj8hh1KL._AC_UL320_.jpg,https://m.media-amazon.com/images/I/71oYj8hh1KL._AC_SL1500_.jpg,,2026-04-21T12:17:50.161136,
12,5,Organic,,200.0,B0CX554LPZ,3 Pieces Ocean Waves Tablecloth 54 x 108 Inch Water Print Plastic Table Cover Ocean Party Table Cloths for Beach Pool Birthday Under The Sea Party Decorations Supplies,N/A,$7.98,,4.6,160.0,False,https://m.media-amazon.com/images/I/71SUwIsO9VL._AC_UL320_.jpg,https://m.media-amazon.com/images/I/71SUwIsO9VL._AC_SL1500_.jpg,,2026-04-21T12:17:50.164643,
13,5,Organic,,201.0,B0BTYLTMB3,"Kepeel 96 Pcs Summer Pool Beach Party Paper Plates Napkins, Beach Pool Ball Party Decorations Supplies Disposable Dinnerware Tableware for Kids, Serves 24",N/A,$16.99,,4.7,1349.0,False,https://m.media-amazon.com/images/I/71Egk8uyCqL._AC_UL320_.jpg,https://m.media-amazon.com/images/I/71Egk8uyCqL._AC_SL1500_.jpg,,2026-04-21T12:17:50.168295,
14,5,Title,,,,Creative and unique idea to decorate homeShop ArtoidModePrevious pageArtoid Mode Sea Shell Starfish ,,,,,,False,,,,2026-04-21T12:17:50.169905,
