data_index,page,ad_type,ad_rank,organic_rank,asin,title,url,price_current,price_list,rating_stars,rating_count,is_prime,image_small,image_large,brand_name,scraped_at,inner_products_count
0,1,SB_Video,1.0,,,N/A,N/A,,,,,False,,,,2026-04-21T12:14:52.561056,1.0
1,1,Title,,,,ResultsCheck each product page for other buying options. Price and other details may vary based on p,,,,,,False,,,,2026-04-21T12:14:52.561890,
3,1,Organic,,1.0,B0F5Q8N47F,Hooqict Gone Fishing Hanging Banner Garland Fish Birthday Party Banner for Happy Birthday Decorations Fishing Theme Party Supplies Under The Sea Baby Shower Fathers Day Decorations,N/A,$5.97,,4.8,539.0,False,https://m.media-amazon.com/images/I/61sWbfXswcL._AC_UL320_.jpg,https://m.media-amazon.com/images/I/61sWbfXswcL._AC_SL1500_.jpg,,2026-04-21T12:14:52.565466,
4,1,Organic,,2.0,B09WJC62Y7,Tropical Fish Hanging Swirls Banner Decor 30 Pack Foil Ceiling Hanging Swirls Streams Banner Decorations Garland for Under the Sea Ocean Celebrating Events Birthday Party Supplies Room Wall Decor,N/A,$9.99,,4.6,233.0,False,https://m.media-amazon.com/images/I/81y3nAfOWIL._AC_UL320_.jpg,https://m.media-amazon.com/images/I/81y3nAfOWIL._AC_SL1500_.jpg,,2026-04-21T12:14:52.570514,
5,1,Organic,,3.0,B0C9BQ6MWN,"2 Pack Fish Net Decorations for Party, Natural Cotton Hawaiian Party Fishing Net Decorative, Nautical Themed Cotton Fishnet Under The Sea Pirate Ocean BeachHalloween Decor",N/A,$9.99,,4.7,1095.0,False,https://m.media-amazon.com/images/I/71z3Ekr-WZL._AC_UL320_.jpg,https://m.media-amazon.com/images/I/71z3Ekr-WZL._AC_SL1500_.jpg,,2026-04-21T12:14:52.575644,
7,1,Title,,,,"Debug info copied.Sponsored4Pcs Fishing Table Cloth Plastic Gone Fishing Party Decorations, Bass Tab",,,,,,False,,,,2026-04-21T12:14:52.576867,
8,1,Title,,,,Streamer Backdrop for Party DecorationsSponsored|7K+ bought from this brand in past month|Shop JINSU,,,,,,False,,,,2026-04-21T12:14:52.579322,
9,1,Title,,,,More results,,,,,,False,,,,2026-04-21T12:14:52.579507,
10,1,Organic,,4.0,B07YDK14GQ,Decor365 Under the Sea Party Decorations White Bubble Garlands Little Mermaid Birthday Decorations Bday Hanging Streamer Beach Banner Decor Underwater Backdrop Kids Ocean Party Supplies,N/A,$11.98,,4.6,6487.0,False,https://m.media-amazon.com/images/I/51Gcx9gKPQL._AC_UL320_.jpg,https://m.media-amazon.com/images/I/51Gcx9gKPQL._AC_SL1500_.jpg,,2026-04-21T12:14:52.583854,
11,1,Organic,,5.0,B09XX3FMCY,"50 PCS Tropical Fish Cutouts, Double-Sided Printing Fish Sea Animal Accents Cut-Outs Bulletin Board Classroom Decoration in 10 Designs Ocean Themed Party Supplies for Kids Teacher Student",N/A,$6.99,,4.7,465.0,False,https://m.media-amazon.com/images/I/91ElStM5SwL._AC_UL320_.jpg,https://m.media-amazon.com/images/I/91ElStM5SwL._AC_SL1500_.jpg,,2026-04-21T12:14:52.588613,
12,1,Organic,,6.0,B09CY6T951,30 Pcs Tropical Fish Hanging Swirls Under The Sea Party Decorations Ceiling Decor Ocean Themed Mermaid Creatures Beach Party Supplies Under The Sea Decor(Fish Style),N/A,$8.99,,4.7,1097.0,False,https://m.media-amazon.com/images/I/810yyRu1g4L._AC_UL320_.jpg,https://m.media-amazon.com/images/I/810yyRu1g4L._AC_SL1500_.jpg,,2026-04-21T12:14:52.597797,
13,1,Organic,,7.0,B0D41WFMXB,"170PCS Fishing Birthday Party Decorations Gone Fishing Party Decorations Include Plates, Cups, Cutlery, Banner, Tablecloth for Ofishally One Birthday Decorations",N/A,$17.99,,4.6,346.0,False,https://m.media-amazon.com/images/I/816cruWkmVL._AC_UL320_.jpg,https://m.media-amazon.com/images/I/816cruWkmVL._AC_SL1500_.jpg,,2026-04-21T12:14:52.602198,
14,1,Organic,,8.0,B0FMK85FWD,"Fishing Birthday Party Decorations, All-in-1 Fishing Party Decorations with Balloons Fish Plates Napkins Cake Toppers Honeycombs Tablecloths and Banner Ofishally One Birthday Decorations, Serve 24",N/A,$24.99,,4.4,35.0,False,https://m.media-amazon.com/images/I/81TkasKE7lL._AC_UL320_.jpg,https://m.media-amazon.com/images/I/81TkasKE7lL._AC_SL1500_.jpg,,2026-04-21T12:14:52.606112,
15,1,Organic,,9.0,B0B1D8SY3T,Fishing Cake Topper Gone fishing Cake with Bass Reed Happy Birthday Sign,N/A,$13.99,,4.8,989.0,False,https://m.media-amazon.com/images/I/61v47L6LfjL._AC_UL320_.jpg,https://m.media-amazon.com/images/I/61v47L6LfjL._AC_SL1500_.jpg,,2026-04-21T12:14:52.609795,
16,1,Organic,,10.0,B0F8HBNDF8,Weysat 3 Tier Go Fishing Cupcake Stand Decorations Fishing Birthday Party Cake Tower Fish Cardboard Cupcake Holder for Little Fisherman Ofishally One Birthday Baby Shower Party Supplies.,N/A,$9.99,,4.7,62.0,False,https://m.media-amazon.com/images/I/719FVQm-HPL._AC_UL320_.jpg,https://m.media-amazon.com/images/I/719FVQm-HPL._AC_SL1500_.jpg,,2026-04-21T12:14:52.615188,
17,1,Organic,,11.0,B01LLSM4L2,"Fun Express Little Fisherman Fishing Pole Picks Set of 25 - Fishing Birthday Party Decorations & Cake Toppers | Fish Party Favors for Baby Shower, Retirement & Lake Themed Celebrations",N/A,$9.99,,4.8,1673.0,False,https://m.media-amazon.com/images/I/71eTc5fbEUL._AC_UL320_.jpg,https://m.media-amazon.com/images/I/71eTc5fbEUL._AC_SL1500_.jpg,,2026-04-21T12:14:52.620243,
18,1,Organic,,12.0,B0DJNXFV61,"Realistic Fish Foil Balloons 4 Pack for Fishing Party Decorations - Gone Fishing Themed Birthday Supplies, Ocean Under the Sea Party Balloons, O-fish-ally One Decor (Tuna & Classic)",N/A,$12.39,,4.7,86.0,False,https://m.media-amazon.com/images/I/71n+RPg0xdL._AC_UL320_.jpg,https://m.media-amazon.com/images/I/71n+RPg0xdL._AC_SL1500_.jpg,,2026-04-21T12:14:52.624755,
19,1,Organic,,13.0,B0CBPJCBCS,Sukh Fish Net Decorations for Party - 2PCS 39.37 * 78.74 in Fishing Net Decoration Netting for Wall Photo Hanging Nautical Fishnet Table Runner Decorative Ocean Theme Birthday Party Rope Nets,N/A,$8.99,,4.7,408.0,False,https://m.media-amazon.com/images/I/61VAOoIafEL._AC_UL320_.jpg,https://m.media-amazon.com/images/I/61VAOoIafEL._AC_SL1500_.jpg,,2026-04-21T12:14:52.631553,
20,1,Organic,,14.0,B0GJZ4HKZK,"QIYANPAX 4 Pack Fish Tablecloths, Fishing Birthday Party Decorations, Gone Fishing Plastic Tablecloths for Bass Ofishally One Birthday Decorations, 54"" × 108""",N/A,$9.99,,4.8,360.0,False,https://m.media-amazon.com/images/I/81BXqW1BgaL._AC_UL320_.jpg,https://m.media-amazon.com/images/I/81BXqW1BgaL._AC_SL1500_.jpg,,2026-04-21T12:14:52.640634,
21,1,Title,,,,More results,,,,,,False,,,,2026-04-21T12:14:52.641190,
22,1,Organic,,15.0,B0CYBXPP9F,Pasimy 8 Pcs Fishing Birthday Party Decoration Banner Fish Garland Party Decoration for Fishing Fisherman Competition Tournament Retirement Barbecue Ofishally One Birthday Decor Supplies,N/A,$9.99,,4.8,144.0,False,https://m.media-amazon.com/images/I/81OzMTqJ-lL._AC_UL320_.jpg,https://m.media-amazon.com/images/I/81OzMTqJ-lL._AC_SL1500_.jpg,,2026-04-21T12:14:52.644570,
23,1,Organic,,16.0,B0FVXMSPX8,"Fishing Birthday Party Decorations, Gone Fishing Themed Banner Fish Net Decor Garland Honeycomb Balloons",N/A,$19.89,,4.8,25.0,False,https://m.media-amazon.com/images/I/81OTI0xY9CL._AC_UL320_.jpg,https://m.media-amazon.com/images/I/81OTI0xY9CL._AC_SL1500_.jpg,,2026-04-21T12:14:52.650992,
24,1,Organic,,17.0,B0BWR9FQYX,2 Pack Blue Streamers Party Decorations Fringe Backdrop Ocean Themed Decorations Foil Curtain Backdrop Blue Birthday Ocean Party Decor Supplies,N/A,$5.97,,4.4,10545.0,False,https://m.media-amazon.com/images/I/914rDCqCJuL._AC_UL320_.jpg,https://m.media-amazon.com/images/I/914rDCqCJuL._AC_SL1500_.jpg,,2026-04-21T12:14:52.659150,
25,1,Organic,,18.0,B07FCBHCTC,90shine 12PCS Tropical Fish Party Decorations Supplies- Under-The-sea/Mermaid/Luau/Hawaiian/Kids Birthday Table Centerpiece,N/A,$12.99,,4.7,992.0,False,https://m.media-amazon.com/images/I/71SAbz+AEjL._AC_UL320_.jpg,https://m.media-amazon.com/images/I/71SAbz+AEjL._AC_SL1500_.jpg,,2026-04-21T12:14:52.664204,
26,1,Organic,,19.0,B0CX57GTTV,"170PCS Gone Fishing Party Decorations Fishing Birthday Party Decorations Include Plates, Cups, Cutlery, Banner, Tablecloth for Ofishally One Birthday Decorations, Serve 24",N/A,$17.99,,4.8,504.0,False,https://m.media-amazon.com/images/I/81W6iP-c16L._AC_UL320_.jpg,https://m.media-amazon.com/images/I/81W6iP-c16L._AC_SL1500_.jpg,,2026-04-21T12:14:52.669066,
27,1,Organic,,20.0,B0733L3X5V,Creative Converting 329657 Plain Water Print Plastic Tablecloth,N/A,$3.70,,4.6,5040.0,False,https://m.media-amazon.com/images/I/61O-ICqAztL._AC_UL320_.jpg,https://m.media-amazon.com/images/I/61O-ICqAztL._AC_SL1500_.jpg,,2026-04-21T12:14:52.673559,
28,1,Organic,,21.0,B0FMK5TFTK,"Fishing Birthday Party Decorations Includes Plates, Napkins, Cups, Cutlery, Tablecloth, Cake Toppers, Banner, Hanging Swirls for Fishing Ofishally One Party Decorations,Serve 24",N/A,$24.99,,4.8,27.0,False,https://m.media-amazon.com/images/I/912aet8eY9L._AC_UL320_.jpg,https://m.media-amazon.com/images/I/912aet8eY9L._AC_SL1500_.jpg,,2026-04-21T12:14:52.677323,
29,1,Organic,,22.0,B0GJYJM1D8,"Fishing Birthday Party Decorations - Plates, Napkins, Cups, Cutlery, Honeycomb Centerpieces, Banner, Hanging Swirls, Tablecloths, Toppers, Balloons for Ofishally One Birthday Decorations, Serves 24",N/A,$22.99,,5.0,1.0,False,https://m.media-amazon.com/images/I/81m5DZqHEPL._AC_UL320_.jpg,https://m.media-amazon.com/images/I/81m5DZqHEPL._AC_SL1500_.jpg,,2026-04-21T12:14:52.681951,
30,1,Organic,,23.0,B0CZ637F9S,"OBXT 10"" Blue Hanging Jellyfish Paper Lanterns - Under the Sea Party & Mermaid Birthday Decorations, Baby Shower, Nautical Events, Ocean Theme Classroom & Beach Room Decor (Set of 6)",N/A,$20.99,,4.8,707.0,False,https://m.media-amazon.com/images/I/81vZ2BQo+gL._AC_UL320_.jpg,https://m.media-amazon.com/images/I/81vZ2BQo+gL._AC_SL1500_.jpg,,2026-04-21T12:14:52.686353,
31,1,Title,,,,More results,,,,,,False,,,,2026-04-21T12:14:52.686909,
32,1,Organic,,24.0,B0DY1N3ZL8,"178PCS Fishing Birthday Party Decorations Includes Plates, Napkins, Cups, Cutlery, Tablecloth, Cake & Cupcake Toppers, Banner, Hanging Swirls, Balloons for Fishing Party Decorations, Serve 20",N/A,$19.99,,4.8,360.0,False,https://m.media-amazon.com/images/I/81WwsxTtjAL._AC_UL320_.jpg,https://m.media-amazon.com/images/I/81WwsxTtjAL._AC_SL1500_.jpg,,2026-04-21T12:14:52.691154,
33,1,Organic,,25.0,B0DKX5JSJ1,WERNNSAI Fish Piñata - Fishing Game Piñata Ocean Piñata Under the Sea for Boy Adult Party Decoration Summer Pool Party Game Supplies Favors with Bat Blindfold,N/A,$31.99,,4.2,3144.0,False,https://m.media-amazon.com/images/I/71UiG545kOL._AC_UL320_.jpg,https://m.media-amazon.com/images/I/71UiG545kOL._AC_SL1500_.jpg,,2026-04-21T12:14:52.698359,
34,1,Organic,,26.0,B0D7Z6WH1K,40PCS Fishing Birthday Party Decorations Gone Fishing Party Decorations Include Fishing Themed Party Plates Napkins for Ofishally One Birthday Decorations Serves 20,N/A,$7.22,,4.6,12.0,False,https://m.media-amazon.com/images/I/81OUDdazSHL._AC_UL320_.jpg,https://m.media-amazon.com/images/I/81OUDdazSHL._AC_SL1500_.jpg,,2026-04-21T12:14:52.703876,
35,1,Organic,,27.0,B0F8T71JH4,"Fishing Birthday Party Decorations Includes Backdrop, Banner, Hanging Swirls, Balloons, Cake & Cupcake Toppers, Honeycomb Centerpieces for Ofishally One Birthday Decorations",N/A,$17.99,,4.8,152.0,False,https://m.media-amazon.com/images/I/81oVBDiBUWL._AC_UL320_.jpg,https://m.media-amazon.com/images/I/81oVBDiBUWL._AC_SL1500_.jpg,,2026-04-21T12:14:52.707699,
36,1,Organic,,28.0,B0C4DFTKP8,"Under the Sea Party Decorations 98Pcs, Ocean Theme Birthday Party Supplies Include Backdrop Tablecloth Bubble Garlands Cake Topper Ocean Animals Balloons for Pool Beach Party Baby Shower (Ocean-01)",N/A,$22.99,,4.7,540.0,False,https://m.media-amazon.com/images/I/910e-bJJFyL._AC_UL320_.jpg,https://m.media-amazon.com/images/I/910e-bJJFyL._AC_SL1500_.jpg,,2026-04-21T12:14:52.711858,
37,1,Organic,,29.0,B0FVSZ4XGK,"Fishing Theme Cupcake Toppers, 20 Mini Fishing Rod Decorations with Colorful Fish",N/A,$13.99,,4.7,20.0,False,https://m.media-amazon.com/images/I/81VHsq0TxjL._AC_UL320_.jpg,https://m.media-amazon.com/images/I/81VHsq0TxjL._AC_SL1500_.jpg,,2026-04-21T12:14:52.715793,
38,1,Organic,,30.0,B0CR6C6SG9,"Birthday Decorations, 20Pcs 2 Side Fish Cupcake Toppers Fishing for Fish Theme Party Baby Shower Tropical Party Cake Picks Under The Sea Decoration Supplies (20 pcs)",N/A,$4.99,,4.8,56.0,False,https://m.media-amazon.com/images/I/81WtYl5KMhL._AC_UL320_.jpg,https://m.media-amazon.com/images/I/81WtYl5KMhL._AC_SL1500_.jpg,,2026-04-21T12:14:52.719660,
39,1,Organic,,31.0,B0B42NXW62,Meanplan Fish Pen Favors Gifts Cute Fishing Party Decorations Creative Glitter Ballpoint Pens for Adults Office Birthday Themed Party Decor(20 Pack),N/A,$19.99,,4.6,106.0,False,https://m.media-amazon.com/images/I/71VpYnSnevL._AC_UL320_.jpg,https://m.media-amazon.com/images/I/71VpYnSnevL._AC_SL1500_.jpg,,2026-04-21T12:14:52.723159,
40,1,Organic,,32.0,B0DHKQCXJT,Pre-Strung Fishing Birthday Party Decorations Fishing Theme Birthday Party Decorations Include Happy Banner and 9PCS Hanging Swirl,N/A,$12.99,,4.7,71.0,False,https://m.media-amazon.com/images/I/81-8mZAxrLL._AC_UL320_.jpg,https://m.media-amazon.com/images/I/81-8mZAxrLL._AC_SL1500_.jpg,,2026-04-21T12:14:52.728525,
41,1,Organic,,33.0,B07PMF7P24,"Bedwina Plastic Vinyl Goldfish - 144 Pcs, 2 Inches Long Gold Fish Toys in Assorted Colors for Party Favors for Kids, Decorations, Crafts, Games and Birthday Party Supplies",N/A,$12.89,,4.3,1481.0,False,https://m.media-amazon.com/images/I/91-cz5cRX7L._AC_UL320_.jpg,https://m.media-amazon.com/images/I/91-cz5cRX7L._AC_SL1500_.jpg,,2026-04-21T12:14:52.733490,
42,1,Organic,,34.0,B0CV33D9F1,"3 Pcs Iridescent Waves Tablecloths - Disposable Plastic Ocean Blue Table Cloth Rectangle Table Covers for Under the Sea Beach Surf Pool Party Birthday Party Decorations, 54 x 108 Inch",N/A,$8.99,,4.5,671.0,False,https://m.media-amazon.com/images/I/81jVudN5HQL._AC_UL320_.jpg,https://m.media-amazon.com/images/I/81jVudN5HQL._AC_SL1500_.jpg,,2026-04-21T12:14:52.738416,
43,1,Organic,,35.0,B0DFWDML7P,"42 Pcs Fishing Birthday Party Decorations Gone Fishing Theme Party Supplies with Fish Plates, Napkins, Tablecloth and Banner, Fish Party Tableware for Birthday or Themed Party, Serve 10",N/A,$6.99,,4.7,58.0,False,https://m.media-amazon.com/images/I/71AkW3ajjKL._AC_UL320_.jpg,https://m.media-amazon.com/images/I/71AkW3ajjKL._AC_SL1500_.jpg,,2026-04-21T12:14:52.743256,
44,1,Organic,,36.0,B0D7RL5FKC,"8 Pcs Fish Balloons, Under The Sea Clownfish Tropical Fish Bubble Sea Animal Creature Foil Balloons for Baby Shower Under The Ocean Themed Birthday Party Decorations",N/A,$9.99,,4.4,255.0,False,https://m.media-amazon.com/images/I/71Z00Q7MmUL._AC_UL320_.jpg,https://m.media-amazon.com/images/I/71Z00Q7MmUL._AC_SL1500_.jpg,,2026-04-21T12:14:52.747464,
45,1,Organic,,37.0,B0FX3ZDLSL,Pre-Strung Fishing Party Banner Decorations - Fishing Birthday Banner NO DIY Double-Sided Printed Fish Garland Signs for Indoor Outdoor Gone Fish Birthday Party Decorations,N/A,$9.99,,4.7,4.0,False,https://m.media-amazon.com/images/I/81k3nXlHKZL._AC_UL320_.jpg,https://m.media-amazon.com/images/I/81k3nXlHKZL._AC_SL1500_.jpg,,2026-04-21T12:14:52.752791,
46,1,Organic,,38.0,B0CPLZMC78,"50 Shark Candy Bracelets, Cool Blue Candy for Under the Sea and Baby Shark Party Favors, Decorations and Goody Bag Fillers, Individually Wrapped In a Convenient Display Tub, Bulk Pack of 50, By 4YoreElves",N/A,$14.99,,4.8,472.0,False,https://m.media-amazon.com/images/I/81KeWh0y3cL._AC_UL320_.jpg,https://m.media-amazon.com/images/I/81KeWh0y3cL._AC_SL1500_.jpg,,2026-04-21T12:14:52.758167,
47,1,Organic,,39.0,B0DBPPS63P,"Jellyfish Decor - 10 Pcs Light Up Jellyfish Lanterns, Hanging Jelly Fish Decorations for Mermaid Birthday Decorations & Under The Sea Party Decorations, Ocean Themed Supplies Gifts",N/A,$22.99,,4.6,163.0,False,https://m.media-amazon.com/images/I/81-wvsAcWIL._AC_UL320_.jpg,https://m.media-amazon.com/images/I/81-wvsAcWIL._AC_SL1500_.jpg,,2026-04-21T12:14:52.762093,
48,1,Organic,,40.0,B08HZFB6N7,"Havercamp String of Fish Party Banner for Fish Fry, Bass Fishing, Freshwater Pond & Salt Water Tournament Fishing Themed Decorations. Fish up to 16 inches. Banner up to 7 ft.",N/A,$12.79,,4.7,646.0,False,https://m.media-amazon.com/images/I/71kcuTKMUyL._AC_UL320_.jpg,https://m.media-amazon.com/images/I/71kcuTKMUyL._AC_SL1500_.jpg,,2026-04-21T12:14:52.768247,
49,1,Organic,,41.0,B0D14KQPQ4,"Fish Balloons Decoration, 10PCS Large Sea Animal Balloons for Kids Birthday Party",N/A,$8.95,,4.4,76.0,False,https://m.media-amazon.com/images/I/81OXzOAPIrL._AC_UL320_.jpg,https://m.media-amazon.com/images/I/81OXzOAPIrL._AC_SL1500_.jpg,,2026-04-21T12:14:52.773199,
50,1,Organic,,42.0,B0B2DN1X87,12 Pcs Fishing Decorations Gone Fishing Centerpieces Fish Party Decorations Honeycomb Party Supplies 3D Fishing Table Decor Fishing Birthday Party Supplies for Fathers Day Retirement Baby Shower,N/A,$11.99,,4.4,169.0,False,https://m.media-amazon.com/images/I/81BfJfTumXL._AC_UL320_.jpg,https://m.media-amazon.com/images/I/81BfJfTumXL._AC_SL1500_.jpg,,2026-04-21T12:14:52.778045,
51,1,Title,,,,More results,,,,,,False,,,,2026-04-21T12:14:52.778582,
52,1,Organic,,43.0,B0DW8YK7R6,"Fishing Birthday Party Decorations, 55 Pack Ofishally One Birthday Decorations, Gone Fishing Party Decorations includes Backdrop, Tablecloth, Banner, Balloons, Centerpieces, Cupcake Toppers",N/A,$18.99,,4.7,70.0,False,https://m.media-amazon.com/images/I/81muke7nZuL._AC_UL320_.jpg,https://m.media-amazon.com/images/I/81muke7nZuL._AC_SL1500_.jpg,,2026-04-21T12:14:52.783413,
53,1,Organic,,44.0,B0CKX7H63H,Tinsel Foil Fringe Curtains Wavy Backdrop for Parties Sparkle Metallic Wavy Foil Fringe Backdrop Curtain for Party Decorations Photo Booth Props for Birthday Graduation Wedding,N/A,$5.99,,4.5,2522.0,False,https://m.media-amazon.com/images/I/91rXc76MkEL._AC_UL320_.jpg,https://m.media-amazon.com/images/I/91rXc76MkEL._AC_SL1500_.jpg,,2026-04-21T12:14:52.788793,
54,1,Organic,,45.0,B098K3B7ZY,Skylety 9 Pcs Under The Sea Party Decorations Ocean Themed Animal Honeycomb Hanging Centerpiece Large Tropical Fish Decor Mermaid Creatures Supplies for Beach Hawaiian Luau Baby Shower Birthday Party,N/A,$11.99,,4.6,123.0,False,https://m.media-amazon.com/images/I/81q-mm9JG8L._AC_UL320_.jpg,https://m.media-amazon.com/images/I/81q-mm9JG8L._AC_SL1500_.jpg,,2026-04-21T12:14:52.794113,
55,1,Organic,,46.0,B0DHKRCN6M,Pre-Strung Fishing Birthday Party Decorations 18PCS Fishing Theme Birthday Party Decorations Gone Fishing Birthday Party Decorations Fish Party Decorations Hanging Swirl,N/A,$11.99,,4.8,23.0,False,https://m.media-amazon.com/images/I/81x20WycjdL._AC_UL320_.jpg,https://m.media-amazon.com/images/I/81x20WycjdL._AC_SL1500_.jpg,,2026-04-21T12:14:52.797781,
56,1,Organic,,47.0,B0CWNF7X4R,96 PCS Fishing Pre-Cut Temporary Tattoos Birthday Party Decorations Favors Supplies Decor Gone Fishing Fisherman Stickers For Girls Boys Gift School Prizes Rewards (Normal),N/A,$7.99,,4.6,99.0,False,https://m.media-amazon.com/images/I/81DybKgUCcL._AC_UL320_.jpg,https://m.media-amazon.com/images/I/81DybKgUCcL._AC_SL1500_.jpg,,2026-04-21T12:14:52.803046,
57,1,Organic,,48.0,B0DFM6B99N,Gone Fishing Party Decorations Kit Include Hanging Banner Swirl Balloons (Gone Fishing),N/A,$11.49,,4.7,93.0,False,https://m.media-amazon.com/images/I/81qFJU2eZwL._AC_UL320_.jpg,https://m.media-amazon.com/images/I/81qFJU2eZwL._AC_SL1500_.jpg,,2026-04-21T12:14:52.809087,
59,1,Title,,,,"Debug info copied.SponsoredOBBOLO Under The sea Party Decorations, 8 Pcs Jellyfish Honeycomb Decorat",,,,,,False,,,,2026-04-21T12:14:52.810067,
60,1,Title,,,,Related searchesfishing party decorationsfish birthday party decorationsfish party favorsfish decora,,,,,,False,,,,2026-04-21T12:14:52.810980,
61,1,Title,,,,Previous123...7Next,,,,,,False,,,,2026-04-21T12:14:52.811402,
62,1,SB,1.0,,,N/A,https://aax-us-east-retail-direct.amazon.com/x/c/JEfLt1_UgEC1q29fPA1dficAAAGdr_bflAEAAAH2AQBvbm9fdHhuX2JpZDUgICBvbm9fdHhuX2ltcDEgICCopU2_/clv1c_ek-wBPHXLcTWnuOrE7vOukGuCw4b_uCAoksUpxzqusU30Y6wjDT6wNV5pPDre3MbPLaxc8vF5vvgvYjO-Uymjw_T3dV9f295MZ-OWvRq7A68iT8BxhCLj2zlsvHUJw_VW2C72wR9s0-hqZPin2e26jm7ota4dtXqw-TwySSSmCZ-2WBrlkCCkoxoKehxCmaftLTkIzdpa8eol2dtuU4wwibSTztvld-jzEwGOVSHlontuDskeiGYtMYPXIfNOEvZNRh2tqhAA1ZeKtKl5ppBtMFg58pitiB-ZAKW-1d1vttfkxYq_WzvTU320iR707cfADd6PI33ECzyTy8L1ZJ6WqjMUBjCDC_N1KptIfa1CaY_OhG1M80_NqSMzoYBkSMkJbUDtoKEgmNrF-NmTcRO9J2Txk8LEbe1v9KbkDZdMGBZtxHmJ0N9RhFghtZ5x1sFDUBn3yJkprgG0mQhIAF5MJ0QU3avJBuzTPEruYXI9iyQ9KxgdjMUbg1hYmC4CF9aeXl-fBSQuDrMPvDfswEx0NruemEl9H6HtJdFpgI5T7Qepzfo6ZtR9Ox1xyQhnUhPO3OvGXC1JZPb82KAmlyZp1sT-NwW03Zx-JsRPqfacepsj-wZeUTZdyadRPH9Tx5KbRz69GeQmxtGgLRNWtV_DlOcCNtX2BW3mBe481B_mOLwh0Dk_JLjlJM89MLjGBSm9lLp3CGYVydWYHfS_jpLmBxurq7BDYCDaj3Z9tfXg4nUOR0EXFoJhHlehjkhMx8ra6HmMXRV9a6PufRrSwKaRmyHcFx9wdHrV2i_69Pjb_z3q9dt8JkwuS_I0Pl3OMtXVsWUSnA6OhYqGwvUELSHrwIE888NdKxwa4b6oQwaIcBJ1E478K8BB1zx-hPQahSRPxvduaYcLawTtLU-W_TPCYgbvbYRP1QsNpdetzuT7tt9q9Jy0ifXtik7iV4TsuXokRIBvP7Y-QZ4dZmN7elNBkK3l56bComhjU9MxsaVv70_bAYC7qjf9VvYFfYdEYOzkx-HmfU4QGjXIhHx6NjdLk_IChM2q367UkYlVaNPS3m79No63H6iHlb4K7ATIMf58yUnWv7t2j55HauggAwgKG7yDcDxNC_O5P4tM8ptwvhrGV-7QKAYRHXnP2Rb6Mm3nD2aK8RtLnDuAeKrn7OsfwfntaRiVqz0WeYIJNHxOCO-DZTfoLeQgQ3wfDUXB79b7lywl_NfFLaWIJu5E6Tm1Su_o4Jqegq6rLd9x2OE4pO8xEVjorpRa_Zxs-_E73Ngz-skJY9ThlX9AmdBJL6FHrcN9_GARUpugzDN-IFhP85_0APsr-3gOdeGYi3dJ9dqMT4J21iynFSQA8pyaKNC2tqenop79CRqTEA9ZQLXud_VVwdf5doNgS5qZNeOFbpnniqG1GZalV8-_saakjHh2zsUUMKuQgPRccuUg67iL0isHYVrj-dxopVqmdFSTTxfwbiRacsaZwscPZQkkgUgoQIzPRCdzIQjkin6y8dlPfFcwtFvk0bavr2Hji6eWUMSNaoGh4ttYJ67i58uKgka9CgTrMhUEO8LthObmfuZC56BB0hSdEBCScLTDUdDFJPKOSIMKbz6VBj3NmWgmqbUz7lubSNYHVSxZMNpX83xFwgH6VZPIt47GJmRtCqw2ODtVBRRqPMjpZyg6JO7abqvuFw45g/https://www.amazon.com/stores/page/8EC9EEA8-105B-43E7-8CC6-27E81D86BBD3/?_encoding=UTF8&store_ref=SB_A0254302D0AVDXLKWU75-A030079035F6R719L4XOK&pd_rd_plhdr=t&aaxitk=298c177388f60d92350382b534de9ba9&hsa_cr_id=0&lp_asins=B0D7386P7V%2CB0BYJJ4S4W%2CB0BYJ3G3D7&lp_query=fish%20party%20decorations&lp_slot=desktop-hsa-3psl&ref_=sbx_be_s_3psl_mbd_mb0_bkgd&pd_rd_w=vnO5X&content-id=amzn1.sym.cd7c548b-a599-426f-9ffe-daa1aa803c87%3Aamzn1.sym.cd7c548b-a599-426f-9ffe-daa1aa803c87&pf_rd_p=cd7c548b-a599-426f-9ffe-daa1aa803c87&pf_rd_r=DWHNJ0DVCBNPXE3YC1J1&pd_rd_wg=kD8vg&pd_rd_r=e54d094e-bba0-4dca-946c-8d46bca94c6b,,,,,False,,,N/A,2026-04-21T12:14:52.816376,
63,1,Title,,,,Need help?Visit the help sectionorcontact us,,,,,,False,,,,2026-04-21T12:14:52.816969,
0,2,SB_Video,2.0,,,N/A,N/A,,,,,False,,,,2026-04-21T12:15:08.797827,6.0
1,2,Title,,,,ResultsCheck each product page for other buying options. Price and other details may vary based on p,,,,,,False,,,,2026-04-21T12:15:08.799353,
3,2,Organic,,49.0,B0DDPGSBFX,Gone Fishing Party Decorations Fish Decorations Fishing Party Banner Fishing Bobber Honeycomb Balls Fish Hanging Swirls Cotton Fish Net Decorations Fishing Theme Birthday Party Supplies,N/A,$19.99,,4.7,55.0,False,https://m.media-amazon.com/images/I/81OE6GvzI2L._AC_UL320_.jpg,https://m.media-amazon.com/images/I/81OE6GvzI2L._AC_SL1500_.jpg,,2026-04-21T12:15:08.803517,
4,2,Organic,,50.0,B0D9BGHPPW,36pcs Tropical Fish Hanging Swirls Under The Sea Party Decor Ocean Themed Party Swirls Streamers Supplies for Boys Girls Kids Mermaid Creatures Baby Shower Decorations,N/A,$9.99,,4.6,225.0,False,https://m.media-amazon.com/images/I/81QIld6StxL._AC_UL320_.jpg,https://m.media-amazon.com/images/I/81QIld6StxL._AC_SL1500_.jpg,,2026-04-21T12:15:08.806955,
5,2,Organic,,51.0,B0D3LJ2NLX,Naozinebi 20 Pcs Tropical Fish Garland Kit Under the Sea Party Decorations Ocean Animals Banner Mermaid Streamers Strings Hanging Swirls for Kids Home Classroom Baby Shower Birthday Party Supply Favor,N/A,$9.99,,4.8,11.0,False,https://m.media-amazon.com/images/I/71aLN7QNLJL._AC_UL320_.jpg,https://m.media-amazon.com/images/I/71aLN7QNLJL._AC_SL1500_.jpg,,2026-04-21T12:15:08.810946,
6,2,Title,,,,"Magnetic Fishing Pool Toys Game for Kids Toddlers 3-5 4-8, Fishing Water Table Bathtub Toy with Infl",,,,,,False,,,,2026-04-21T12:15:08.812342,
7,2,Title,,,,Decorative Fishing Net for Family Photo DisplaySponsored|Shop PatiolandShop nowPrevious pagePatiolan,,,,,,False,,,,2026-04-21T12:15:08.813589,
8,2,Title,,,,More results,,,,,,False,,,,2026-04-21T12:15:08.813731,
9,2,Organic,,52.0,B0FMKC1N2Q,"4Pcs Fishing Table Cloth Plastic Gone Fishing Party Decorations, Bass Table Cloth Fish Tablecloth Rectangle for Party Birthday Little Fisherman Ofishally One Fish Party Decorations, 51.2"" x 87""",N/A,$10.99,,4.3,20.0,False,https://m.media-amazon.com/images/I/81vSeSi0Y-L._AC_UL320_.jpg,https://m.media-amazon.com/images/I/81vSeSi0Y-L._AC_SL1500_.jpg,,2026-04-21T12:15:08.816984,
10,2,Organic,,53.0,B0FJF71RS8,"197 Pcs Fishing Birthday Party Decorations - Serve 24, Includes Banner, Swirls, Cake & Cupcake Topper, Plates, Cups, Napkins, Cutlery, Tablecloth & Balloons for Fishing Theme Party",N/A,$19.99,,5.0,20.0,False,https://m.media-amazon.com/images/I/818-YN07R-L._AC_UL320_.jpg,https://m.media-amazon.com/images/I/818-YN07R-L._AC_SL1500_.jpg,,2026-04-21T12:15:08.821065,
11,2,Organic,,54.0,B079YWPX8X,"4E's Novelty Fish Net Decorative - Pack of 3 - Natural Cotton Fishnet Decor - Each 14 x 4 feet - for Mermaid Party Decorations, Luau Tropical Nautical Beach Table Cover",N/A,$17.98,,4.6,2400.0,False,https://m.media-amazon.com/images/I/81EDandXW3L._AC_UL320_.jpg,https://m.media-amazon.com/images/I/81EDandXW3L._AC_SL1500_.jpg,,2026-04-21T12:15:08.826781,
12,2,Organic,,55.0,B0DHGM5GMH,Fish Balloons Fishing Balloons Ofishally One Birthday Decorations Fishing Birthday Party Decoration Gone Fisherman Theme Birthday Decor Fish Themed Party Let’s Go Fishing Party Fishman Baby Shower,N/A,$9.99,,4.9,18.0,False,https://m.media-amazon.com/images/I/7169rDOx-AL._AC_UL320_.jpg,https://m.media-amazon.com/images/I/7169rDOx-AL._AC_SL1500_.jpg,,2026-04-21T12:15:08.832532,
13,2,Organic,,56.0,B0F32DS3QL,Gone Fishing Party Decorations Kit Include Fishing Birthday Backdrop Tablecloth Balloons Fish Net for Theme Birthday Fisherman Photo Booth Party Supplies,N/A,$12.99,,4.9,32.0,False,https://m.media-amazon.com/images/I/81s6eDnAcBL._AC_UL320_.jpg,https://m.media-amazon.com/images/I/81s6eDnAcBL._AC_SL1500_.jpg,,2026-04-21T12:15:08.838079,
