data_index,page,ad_type,ad_rank,organic_rank,asin,title,url,price_current,price_list,rating_stars,rating_count,is_prime,image_small,image_large,brand_name,scraped_at,inner_products_count
0,1,SB_Video,1.0,,,N/A,N/A,,,,,False,,,,2026-04-21T13:12:21.890345,1.0
1,1,Title,,,,ResultsCheck each product page for other buying options. Price and other details may vary based on p,,,,,,False,,,,2026-04-21T13:12:21.891458,
3,1,Organic,,1.0,B088FLY7S8,"12 Pack Small American Flags on Stick Small US Flags/Mini American Flags for Outside 4x6 Inch American Hand Held Stick Flags with Kid-Safe Spear Top, Patriotic Veterans Day Decorations, 4th of July Decorations",N/A,$5.99,,4.6,3997.0,False,https://m.media-amazon.com/images/I/817zxE5-iIS._AC_UL320_.jpg,https://m.media-amazon.com/images/I/817zxE5-iIS._AC_SL1500_.jpg,,2026-04-21T13:12:21.896978,
4,1,Organic,,2.0,B0FRD7TBK7,OHOME 4th of July Decorations - Patriotic USA Stars Table Runner for Home | Memorial Day Decorations - 250th Anniversary Fourth of July Accessories Decor Party Supplies Indoor Outdoor,N/A,$6.76,,4.6,246.0,False,https://m.media-amazon.com/images/I/81cTp7vzkBL._AC_UL320_.jpg,https://m.media-amazon.com/images/I/81cTp7vzkBL._AC_SL1500_.jpg,,2026-04-21T13:12:21.902606,
5,1,Organic,,3.0,B0GHXNM31W,"Artscope 4th of July God Bless America Throw Pillow Covers 18x18 Inch Set of 4, Independence Day Red and Blue Sunflower Love Heart Patriotic Decoration Pillow Cases for Sofa Bed Room Home Decor",N/A,$9.99,,4.7,9.0,False,https://m.media-amazon.com/images/I/81klxcxLtML._AC_UL320_.jpg,https://m.media-amazon.com/images/I/81klxcxLtML._AC_SL1500_.jpg,,2026-04-21T13:12:21.908431,
7,1,Title,,,,New arrivalsSponsoredBased on items added in the past 60 daysIndependence Day Party Decoration Gift ,,,,,,False,,,,2026-04-21T13:12:21.911456,
9,1,Title,,,,Debug info copied.SponsoredNAZENTI Personalized 250th Anniversary 4th of July Door Sign with Family ,,,,,,False,,,,2026-04-21T13:12:21.911954,
10,1,Title,,,,4th of July Patriotic Eagle WreathSponsored|Highly bought brand in this category|Shop AnglechicShop ,,,,,,False,,,,2026-04-21T13:12:21.913065,
11,1,Title,,,,More results,,,,,,False,,,,2026-04-21T13:12:21.913287,
12,1,Organic,,4.0,B0GHNCZG4H,"4th of July Decorations - 2 Pack Red White and Blue Streamer for 250th Anniversary | Fourth of July Accessories Party Favors for Outdoor Outside Home - Memorial Day Patriotic Flag Banner Decor,10 FT",N/A,$3.98,,4.5,47.0,False,https://m.media-amazon.com/images/I/81qzXpx7zrL._AC_UL320_.jpg,https://m.media-amazon.com/images/I/81qzXpx7zrL._AC_SL1500_.jpg,,2026-04-21T13:12:21.918453,
13,1,Organic,,5.0,B0GRYB7TJR,4th of July Decorations - 6.5 Ft Patriotic Bow Garland - Memorial Day Decor - America 250th Anniversary Decoration - Fourth of July Home Party Supplies Independence Day Accessories for Indoor Outdoor,N/A,$17.99,,5.0,9.0,False,https://m.media-amazon.com/images/I/71zuDZNC+TL._AC_UL320_.jpg,https://m.media-amazon.com/images/I/71zuDZNC+TL._AC_SL1500_.jpg,,2026-04-21T13:12:21.923632,
14,1,Organic,,6.0,B0DYV7PB84,"4th of July Garland Decorations,50Ft Glitter Tinsel Patriotic Decor for Tree Car Golf Cart Parade Float Bike Party Table Yard Door Boat Indoor Outdoor Holiday Home",N/A,$14.98,,4.8,375.0,False,https://m.media-amazon.com/images/I/81lr+xyLu0L._AC_UL320_.jpg,https://m.media-amazon.com/images/I/81lr+xyLu0L._AC_SL1500_.jpg,,2026-04-21T13:12:21.929895,
15,1,Organic,,7.0,B0GLYPMGY3,"Memorial Day Decorations,4th of July Door Cover Thank You Veterans Patriotic Decor Memorial Day Decoration and Supplies for Home Party-71×35'' (Eagle 01)",N/A,$6.98,,5.0,1.0,False,https://m.media-amazon.com/images/I/8192zMzbeYL._AC_UL320_.jpg,https://m.media-amazon.com/images/I/8192zMzbeYL._AC_SL1500_.jpg,,2026-04-21T13:12:21.935708,
16,1,Organic,,8.0,B0CWV8NMGD,"AVOIN colorlife Let Freedom Ring Stars Fireworks Red White Flower Throw Pillow Covers, 18 x 18 Inch 4th of July Patriotic Independence Memorial Day USA Flag Cushion Case for Sofa Couch Set of 4",N/A,$12.99,,4.6,230.0,False,https://m.media-amazon.com/images/I/81MnZdbkRqL._AC_UL320_.jpg,https://m.media-amazon.com/images/I/81MnZdbkRqL._AC_SL1500_.jpg,,2026-04-21T13:12:21.942718,
17,1,Organic,,9.0,B07SVXSKCK,6 Pack Patriotic Star Streamers Garland Red White Blue Bunting Banner Paper Hanging Decorations for 4th of July American Independence Day Labor Day Holiday Memorial Day Party Supplies (50 Feet),N/A,$6.97,,4.6,1633.0,False,https://m.media-amazon.com/images/I/71ae9SUJ9jL._AC_UL320_.jpg,https://m.media-amazon.com/images/I/71ae9SUJ9jL._AC_SL1500_.jpg,,2026-04-21T13:12:21.946407,
18,1,Organic,,10.0,B0DLKHW2Z4,"Valery Madelyn Patriotic Ornaments for Memorial Day 4th of July Tree Decorations, 16ct 2 Inches Red White Blue Shatterproof Americana Hanging Ball Decor for Independence Day USA 250th Anniversary",N/A,$14.99,,4.6,175.0,False,https://m.media-amazon.com/images/I/91DlEMcBh3L._AC_UL320_.jpg,https://m.media-amazon.com/images/I/91DlEMcBh3L._AC_SL1500_.jpg,,2026-04-21T13:12:21.950092,
19,1,Organic,,11.0,B0CWN9J3VW,"cshare Red White and Blue Lights Battery Operated, 4th of July Lights with Timer Outdoor Waterproof 9.8ft 30 LED for 4th of July Independence Day Decorations Garland Party Garden",N/A,$6.99,,4.5,1384.0,False,https://m.media-amazon.com/images/I/71flmfbgYVL._AC_UL320_.jpg,https://m.media-amazon.com/images/I/71flmfbgYVL._AC_SL1500_.jpg,,2026-04-21T13:12:21.953819,
20,1,Organic,,12.0,B09S8XT64X,"3x6 Ft American Pleated Fan Flag (Set of 4) – Patriotic Half Fan Bunting, 4th of July Memorial Day Decorations for 250th Anniversary",N/A,$39.99,,4.7,1111.0,False,https://m.media-amazon.com/images/I/61SIxFNNiDL._AC_UL320_.jpg,https://m.media-amazon.com/images/I/61SIxFNNiDL._AC_SL1500_.jpg,,2026-04-21T13:12:21.957508,
21,1,Organic,,13.0,B0FFS5RBLC,"COCHIE 4th of July Decorations Set, Red White Blue Decor, Wooden Patriotic Memorial Day Tiered Tray Decor, Labor Day Decorations, Fourth of July Decoration for Home Office Table (Flag Retro)",N/A,$16.99,,4.3,72.0,False,https://m.media-amazon.com/images/I/71MLJVl1yQL._AC_UL320_.jpg,https://m.media-amazon.com/images/I/71MLJVl1yQL._AC_SL1500_.jpg,,2026-04-21T13:12:21.963233,
22,1,Organic,,14.0,B0DZH3LX6Q,"COCHIE 4th of July Decorations Stars Set of 4, Red White Blue Decor, Patriotic Memorial Day Star Tiered Tray Decor, Labor Day Fourth of July Decoration for Home Office Table Shelf (Retro Solid)",N/A,$12.99,,4.6,119.0,False,https://m.media-amazon.com/images/I/61tS2mlbzOL._AC_UL320_.jpg,https://m.media-amazon.com/images/I/61tS2mlbzOL._AC_SL1500_.jpg,,2026-04-21T13:12:21.966967,
23,1,Title,,,,More results,,,,,,False,,,,2026-04-21T13:12:21.967532,
24,1,Organic,,15.0,B09VLFT6JD,"2 Pack 4th of July Decor Bow for Wreath,Red White Blue Stripe Stars Tree Topper Bows for Patriotic,Independence Day,Memorial Day,Veteran's Day,Front Door Indoor Outdoor Decorations",N/A,$14.98,,4.6,632.0,False,https://m.media-amazon.com/images/I/81HqOJ1wbkL._AC_UL320_.jpg,https://m.media-amazon.com/images/I/81HqOJ1wbkL._AC_SL1500_.jpg,,2026-04-21T13:12:21.971741,
25,1,Organic,,16.0,B0BKRY6RH1,"Childom 3 Pack Patriotic Tablecloths 4th of July Decorations,Disposable Plastic Tablecloths 54""x108"",Patriotic Themed Party Table Cloth for Kids Birthday Party Supplies,Outside,Picnic,Camping,Memorial",N/A,$7.64,,4.7,6739.0,False,https://m.media-amazon.com/images/I/81NiPLuGlML._AC_UL320_.jpg,https://m.media-amazon.com/images/I/81NiPLuGlML._AC_SL1500_.jpg,,2026-04-21T13:12:21.976660,
26,1,Organic,,17.0,B09P367SG1,"250th Anniversary USA, 2 Pack 40 Inch American Flag Windsock with Lights Red White Blue Star Stripes Patriotic Windsock Hanging 4th of July Decorations Memorial Day Independence Day Fourth of July",N/A,$9.98,,4.3,151.0,False,https://m.media-amazon.com/images/I/711WiQCaNHL._AC_UL320_.jpg,https://m.media-amazon.com/images/I/711WiQCaNHL._AC_SL1500_.jpg,,2026-04-21T13:12:21.982394,
27,1,Organic,,18.0,B0GGBF5PD3,"250 Anniversary Usa Garden Flags for Outside, 250 Anniversary USA Flag with Fireworks Design, 1776-2026 Patriotic 4th of July Decorations Yard Sign Double-Sided Waterproof Flag 12x18 Inch 250 Year American Flag",N/A,$9.89,,4.8,45.0,False,https://m.media-amazon.com/images/I/718FIKPPswL._AC_UL320_.jpg,https://m.media-amazon.com/images/I/718FIKPPswL._AC_SL1500_.jpg,,2026-04-21T13:12:21.988071,
28,1,Organic,,19.0,B0DZX72641,OHOME 4th of July Outfits for Women - 6 Pack Patriotic Bracelets | Fourth of July Decorations Accessories Shirts for Memorial Day Decorations - 250th Anniversary Celebration Jewelry for Women,N/A,$5.98,,4.6,704.0,False,https://m.media-amazon.com/images/I/71zZUR2VY1L._AC_UL320_.jpg,https://m.media-amazon.com/images/I/71zZUR2VY1L._AC_SL1500_.jpg,,2026-04-21T13:12:21.992821,
29,1,Organic,,20.0,B0CYC4QC2Y,"cshare 4th of July Lights Battery Operated, Red White and Blue Lights with Timer Outdoor Waterproof, 13ft 40LED Patriotic Star String Lights for Memorial Day Presidents Day Independence Day",N/A,$9.99,,4.4,162.0,False,https://m.media-amazon.com/images/I/71eZLbn4apL._AC_UL320_.jpg,https://m.media-amazon.com/images/I/71eZLbn4apL._AC_SL1500_.jpg,,2026-04-21T13:12:21.998791,
30,1,Organic,,21.0,B0DY7GDH5D,"4th of July Pillow Covers 18x18 Inch,Set of 4 Patriotic Red White Blue Summer Outdoor Throw Pillow Covers,Independence Memorial Day USA Flag Linen Fourth of July Cushion Case for Sofa Couch Decor",N/A,$15.99,,4.7,197.0,False,https://m.media-amazon.com/images/I/71DGHcmzRcL._AC_UL320_.jpg,https://m.media-amazon.com/images/I/71DGHcmzRcL._AC_SL1500_.jpg,,2026-04-21T13:12:22.002857,
31,1,Organic,,22.0,B0BXN6YF3X,Qunclay 6 Pieces Patriotic Table Decor Memorial Day Table Decorations Wooden Gnome Freedom Truck Star 4th of July Table Signs for Veterans Day Independence Day Table Topper Decor Supplies (With Base),N/A,$13.99,,4.7,250.0,False,https://m.media-amazon.com/images/I/81--CuLovrL._AC_UL320_.jpg,https://m.media-amazon.com/images/I/81--CuLovrL._AC_SL1500_.jpg,,2026-04-21T13:12:22.008399,
32,1,Organic,,23.0,B0F3XLBLGK,"COCHIE 4th of July Decorations Wooden Stars, Patriotic Memorial Day Star Tiered Tray Decor Set of 3, Fourth of July Red White Blue Decoration for Home Office Table Shelf (Flag Retro)",N/A,$14.99,,4.6,39.0,False,https://m.media-amazon.com/images/I/71JAPzfWH9L._AC_UL320_.jpg,https://m.media-amazon.com/images/I/71JAPzfWH9L._AC_SL1500_.jpg,,2026-04-21T13:12:22.012881,
33,1,Title,,,,More results,,,,,,False,,,,2026-04-21T13:12:22.013581,
34,1,Organic,,24.0,B07D6LY6TX,"29PCS 4th/Fourth of July Patriotic Decorations Set - Red White Blue Paper Fans,USA Flag Pennant,Star Streamer,Pom Poms,Hanging Swirls Party Decor Supplies",N/A,$14.99,,4.6,2095.0,False,https://m.media-amazon.com/images/I/81YVp++8wwL._AC_UL320_.jpg,https://m.media-amazon.com/images/I/81YVp++8wwL._AC_SL1500_.jpg,,2026-04-21T13:12:22.019185,
35,1,Organic,,25.0,B0CSCS6B6J,"4th of July Decorations - Memorial Day Decorations - 250th Anniversary Patriotic USA Gnomes for Home - Fourth of July for Office, Indoor - 250 Years America Red White Blue Figurines Merchandise",N/A,$19.99,,4.6,207.0,False,https://m.media-amazon.com/images/I/81TNj0xnxLL._AC_UL320_.jpg,https://m.media-amazon.com/images/I/81TNj0xnxLL._AC_SL1500_.jpg,,2026-04-21T13:12:22.027068,
36,1,Organic,,26.0,B0BZPN8YXF,"4 Pcs 4th of July Patriotic Kitchen Towels American Flag Stars Dish Towels Independence Day Hand Towel Red White Blue 250th Anniversary for Kitchen Housewarming Gifts Memorial Day Home, 15.7"" x 23.6""",N/A,$9.99,,3.9,47.0,False,https://m.media-amazon.com/images/I/710PYjzfTgL._AC_UL320_.jpg,https://m.media-amazon.com/images/I/710PYjzfTgL._AC_SL1500_.jpg,,2026-04-21T13:12:22.032551,
37,1,Organic,,27.0,B09MYYBWQL,"American Flag Bunting Patriotic Pleated Fan Flag USA Flags with Brass Grommets and Zip Ties for 4th of July Memorial Day Decoration Outdoor (4, 1.5x3 Feet)",N/A,$16.99,,4.7,1254.0,False,https://m.media-amazon.com/images/I/71TM1b0fx-L._AC_UL320_.jpg,https://m.media-amazon.com/images/I/71TM1b0fx-L._AC_SL1500_.jpg,,2026-04-21T13:12:22.037465,
38,1,Organic,,28.0,B0CTK72VDV,"OHOME 4th of July Decorations - Patriotic American Flag Plastic Tablecloth for 250th Anniversary | Fourth of July Accessories Memorial Day Decor for Home Outdoor Outside Party Favors,54""x108"",2 Pack",N/A,$5.98,,4.6,2355.0,False,https://m.media-amazon.com/images/I/81ZDjk1CMrL._AC_UL320_.jpg,https://m.media-amazon.com/images/I/81ZDjk1CMrL._AC_SL1500_.jpg,,2026-04-21T13:12:22.045362,
39,1,Organic,,29.0,B0DK1BZ4SG,"Valery Madelyn 4th of July Gnomes Decorations, Memorial Day Decorations for Home Decor, Medium 3Pcs Patriotic USA 250th Anniversary Decorations, Stars and Stripes Gnomes Figurine for Independence Day",N/A,$14.99,,4.5,72.0,False,https://m.media-amazon.com/images/I/713nxeVcatL._AC_UL320_.jpg,https://m.media-amazon.com/images/I/713nxeVcatL._AC_SL1500_.jpg,,2026-04-21T13:12:22.048665,
40,1,Organic,,30.0,B0C2P85SMN,"AVOIN colorlife Patriotic 4th of July Garden Flag 12x18 Inch Double Sided Outside, Memorial Day Floral Welcome Daisy Yard Outdoor Decoration",N/A,$8.99,,4.7,983.0,False,https://m.media-amazon.com/images/I/71wuSrCnIkL._AC_UL320_.jpg,https://m.media-amazon.com/images/I/71wuSrCnIkL._AC_SL1500_.jpg,,2026-04-21T13:12:22.055793,
41,1,Organic,,31.0,B0916584XY,4th of July Decoration Patriotic Mini Lights - 100 Count 20 Feet Red White Blue Incandescent Bulb Waterproof String Lights Plug in for Indoor Outdoor Christmas Party Patio Independence Day Decoration,N/A,$11.99,,4.6,4793.0,False,https://m.media-amazon.com/images/I/71Z15pjNWNL._AC_UL320_.jpg,https://m.media-amazon.com/images/I/71Z15pjNWNL._AC_SL1500_.jpg,,2026-04-21T13:12:22.058877,
42,1,Organic,,32.0,B0CTKBBK4B,1 Pcs 4th of July Patriotic Door Sign 250th Anniversary Eagle Wreath Decorations Patriotic Door Hanger American Rustic Wooden Plaque for Wall Front Porch Memorial Day Decor,N/A,,,2.7,435.0,False,https://m.media-amazon.com/images/I/71gJv7oD7oL._AC_UL320_.jpg,https://m.media-amazon.com/images/I/71gJv7oD7oL._AC_SL1500_.jpg,,2026-04-21T13:12:22.062226,
43,1,Organic,,33.0,B0C3L277BJ,"HOOSUN 4th of July Decorations,12Pcs American Flag Patriotic Pinwheels for Yard and Garden,Fourth of July Pinwheels Patriotic Memorial Day Decorations,Garden Wind Spinners,Pinwheel for Kids,Lawn,Patio",N/A,$14.99,,3.6,1074.0,False,https://m.media-amazon.com/images/I/81h5YOIT-VL._AC_UL320_.jpg,https://m.media-amazon.com/images/I/81h5YOIT-VL._AC_SL1500_.jpg,,2026-04-21T13:12:22.065629,
44,1,Organic,,34.0,B0BW3KHBVT,"4 Pack Patriotic Artificial Berry Stem Picks White Blue Red Stars for 4th of July Independence Day, Pentagram Faux Berry Branches Decoration for Home Office Restaurant Vase Décor",N/A,$17.99,,4.6,368.0,False,https://m.media-amazon.com/images/I/81JizKTi40L._AC_UL320_.jpg,https://m.media-amazon.com/images/I/81JizKTi40L._AC_SL1500_.jpg,,2026-04-21T13:12:22.071063,
45,1,Organic,,35.0,B0FGX5WSFF,"COCHIE 4th of July Decorations Wooden Star Set of 6, Labor Day Decor, Patriotic Memorial Day Tiered Tray Decor, Red White and Blue Veterans Day Decorations for Home Office Table Shelf (Retro Solid)",N/A,$13.99,,4.6,17.0,False,https://m.media-amazon.com/images/I/71+7XggZh3L._AC_UL320_.jpg,https://m.media-amazon.com/images/I/71+7XggZh3L._AC_SL1500_.jpg,,2026-04-21T13:12:22.076138,
46,1,Organic,,36.0,B0GQT2YND1,"4th of July Table Decorations, 3Pcs Red White and Blue Decorations, Retro Patriotic Memorial Day Tiered Tray Decor, Labor Day Independence Day Fourth of July Decor for Home Office Shelf",N/A,$13.99,,5.0,2.0,False,https://m.media-amazon.com/images/I/71OPVh8tmBL._AC_UL320_.jpg,https://m.media-amazon.com/images/I/71OPVh8tmBL._AC_SL1500_.jpg,,2026-04-21T13:12:22.079983,
47,1,Organic,,37.0,B0DWZKWJHG,"4th of July Party Supplies Set, Patriotic Theme Kit for Independence & Election Day Decorations, Includes Plates, Napkins, Cups, Banner, Tablecloth -Patriotic & 4th of July Party Decorations-24 Guests",N/A,$21.58,,4.8,551.0,False,https://m.media-amazon.com/images/I/81r8uRVECLL._AC_UL320_.jpg,https://m.media-amazon.com/images/I/81r8uRVECLL._AC_SL1500_.jpg,,2026-04-21T13:12:22.086130,
48,1,Organic,,38.0,B0F1CFT8ZH,Moon Boat 144PCS 4th/Fourth of July Accessories Party Favors: Patriotic Silicone Rubber Bracelets Bulk USA Flag Wristbands American Memorial Day Decorations Gifts Supplies,N/A,$21.99,,4.8,41.0,False,https://m.media-amazon.com/images/I/81yBe+Ki2UL._AC_UL320_.jpg,https://m.media-amazon.com/images/I/81yBe+Ki2UL._AC_SL1500_.jpg,,2026-04-21T13:12:22.089618,
49,1,Organic,,39.0,B091636RRK,Minetom Red White Blue Christmas Lights Green Wire - 100 Count 4th July Decoration Patriotic Mini String Lights Waterproof for Indoor Outdoor Xmas Holiday Party Patio Independence Day Decoration,N/A,$11.99,,4.6,8255.0,False,https://m.media-amazon.com/images/I/71hcRq6gV4L._AC_UL320_.jpg,https://m.media-amazon.com/images/I/71hcRq6gV4L._AC_SL1500_.jpg,,2026-04-21T13:12:22.093408,
50,1,Organic,,40.0,B0CX1S7436,"100PCS 4th of July Accessories, Veterans Day Beads Necklace Bulk, Fourth of July Red Blue Silver Necklace Party Favors, Beads for Veterans Day Patriotic Parade Party Celebration Favors Decorations",N/A,$19.99,,4.6,1238.0,False,https://m.media-amazon.com/images/I/91pIKz9R9oL._AC_UL320_.jpg,https://m.media-amazon.com/images/I/91pIKz9R9oL._AC_SL1500_.jpg,,2026-04-21T13:12:22.097521,
51,1,Organic,,41.0,B0BZ7K8RXR,"2 Packs Solar 4th of July Decorations Outdoor Lights, Solar Red White and Blue Star Pathway Lights, Waterproof Outdoor Patriotic Decorations Lights for July 4th Memorial Day Garden Yard Pathway Grave",N/A,$20.99,,4.5,260.0,False,https://m.media-amazon.com/images/I/71ojQjJvK7L._AC_UL320_.jpg,https://m.media-amazon.com/images/I/71ojQjJvK7L._AC_SL1500_.jpg,,2026-04-21T13:12:22.102480,
52,1,Organic,,42.0,B0F3D8S8FN,"4th of July Patriotic Garland Decorations, Rustic Wooden Star Red White and Blue Garland Decor, Retro 4th of July Banner for Fireplace Mantel Wall Patriotic Party Home Decor (Star)",N/A,$12.99,,4.3,58.0,False,https://m.media-amazon.com/images/I/71I93haFX2L._AC_UL320_.jpg,https://m.media-amazon.com/images/I/71I93haFX2L._AC_SL1500_.jpg,,2026-04-21T13:12:22.107184,
53,1,Title,,,,More results,,,,,,False,,,,2026-04-21T13:12:22.107653,
54,1,Organic,,43.0,B0CX1WFH79,25 Pcs 4th of July Tiered Tray Decorations Set Wood Patriotic Decoration Rustic American Flag Star Red White Blue Farmhouse Decor for Memorial Day 250th Anniversary Home Indoor Birthday Party（Stylish,N/A,$13.99,,4.0,98.0,False,https://m.media-amazon.com/images/I/81Unw51Z+4L._AC_UL320_.jpg,https://m.media-amazon.com/images/I/81Unw51Z+4L._AC_SL1500_.jpg,,2026-04-21T13:12:22.111521,
55,1,Organic,,44.0,B0CWGWDJG8,"SY Super Bang 2PCS 4th of July Decorations, Red White Blue Wreath Decor for Front Door, Stripe Stars Tree Topper Patriotic Bows, for Independence Day, Memorial Day, Indoor/Outdoor Home Holiday Party.",N/A,$15.99,,4.6,64.0,False,https://m.media-amazon.com/images/I/819pvs6-55L._AC_UL320_.jpg,https://m.media-amazon.com/images/I/819pvs6-55L._AC_SL1500_.jpg,,2026-04-21T13:12:22.116050,
56,1,Organic,,45.0,B0BW3GLL7F,"24 Piece Independence Day Hanging Ball - 1.57"" Memorial Day Sequin Hanging Ball Ornament - 4th of July Red White Blue Tree Decorations for Memorial Day Veterans Patriotic USA Themed Party Supplies",N/A,$18.99,,4.6,144.0,False,https://m.media-amazon.com/images/I/81eRnuE0+bL._AC_UL320_.jpg,https://m.media-amazon.com/images/I/81eRnuE0+bL._AC_SL1500_.jpg,,2026-04-21T13:12:22.119599,
57,1,Organic,,46.0,B07SX1VWY1,4th of July Decorations Outdoor - Hanging American Flag Banners Stars and Stripes Porch Sign -Patriotic Memorial Day Decor Party Supplies for July Fourth Independence Labor - Red White Blue (2 Pcs),N/A,$9.99,,4.4,2607.0,False,https://m.media-amazon.com/images/I/71fWs4SI+oL._AC_UL320_.jpg,https://m.media-amazon.com/images/I/71fWs4SI+oL._AC_SL1500_.jpg,,2026-04-21T13:12:22.124761,
58,1,Organic,,47.0,B0F5BDCG2P,"Mysense Patriotic USA Flag Face Hair Glitter for Independence Day Memorial Day Veterans Day, 4th of July Outfits and Accessories for Women Kids, 08# Red White and Blue Glitter Stick, 0.56oz",N/A,$8.99,,4.3,700.0,False,https://m.media-amazon.com/images/I/81cxoSEECXL._AC_UL320_.jpg,https://m.media-amazon.com/images/I/81cxoSEECXL._AC_SL1500_.jpg,,2026-04-21T13:12:22.128276,
59,1,Organic,,48.0,B0CTKM7HGL,"Tujoe 4th of July Decorations Outdoor 4 Pack Colored Solar Firework Lights with 180 LED Patriotic Solar Lights 8 Lighting Modes for Yard Pathway Garden Patio Party Decorations(Red, White, Blue)",N/A,$36.99,,3.8,214.0,False,https://m.media-amazon.com/images/I/91L2C+XPRxL._AC_UL320_.jpg,https://m.media-amazon.com/images/I/91L2C+XPRxL._AC_SL1500_.jpg,,2026-04-21T13:12:22.133277,
61,1,Title,,,,Debug info copied.SponsoredNAZENTI Personalized 250th Anniversary 4th of July Door Sign with Family ,,,,,,False,,,,2026-04-21T13:12:22.134541,
62,1,Title,,,,Related searchesfourth of july accessoriesred white and blue decorationsfourth of julyvalentines day,,,,,,False,,,,2026-04-21T13:12:22.135700,
63,1,Title,,,,Previous123...7Next,,,,,,False,,,,2026-04-21T13:12:22.136151,
64,1,SB,1.0,,,N/A,https://aax-us-east-retail-direct.amazon.com/x/c/JEGaf4ldlQQJG81I-TwnOhQAAAGdsCt-iQEAAAH2AQBvbm9fdHhuX2JpZDUgICBvbm9fdHhuX2ltcDEgICBX6EbH/clv1c_ek-wBIXWFbbWzTI3YotcKUShqhZWsFzjT9eEs3qyiz15ShtamNeC3UdW09iWHF71xKeKJklAHKhweihJJZBhVcS0t51Y7k8_Pi9njNGk1I0-yWHwRlw4BLl87upk9tPyT7GW8zsCoUeehRz3IBJf4ZHfodUcV1bv-s3l0ytqHUfc22Y-QvI3sDSJlVz1UY-83tra-EhtJz8YNNZdtkELYk4CGXMVrkL5iuZio3gOBooBbKDvfl_nAzxmllCA8pnXlyU-cYbYrfXj5Vvr102NapiJxje33ddJJrdck4x698VG5mE0bRLt_GZ7OvXdH3UGIsYzoa99ZhygU0Me-6QPvT92UzkCqhINA4KuFQlp61ol9C463f3YpwJirtLkNoE1tsPM4FAMF419w4luYqCJeVc29tXGW243Z94B139xncKerjilhxl3POkjiqd0QqOGTvOX0WjHAZTZ3DzA76tvd5eT5o08b3ejHlJUzQKxcIdQ7Q2IAWoQcAnhZQK4uxhcxY8FszY72Nm6snKAeNb7Aqx7EVc1iUfNApQDSgbaFonPwV7kglIZR5hOWch0smdlLZnPNbVglD6H3DAgs5LipCvZj1r8rzQ73H3uhQBUofuXxt6uCm-s7wuKGlH1kXvR3dZkUlPOFUrAOSK7-1b1YrPiJrqaW60i9kWPggwZwepnJm7nnVjbQKUg9qnSQjRTz1-6-LJH10RNVQDXrDzP0z6nnxzc3bH-FSVHz00Qq7-KgLfqwSBfAPX0l8HF6NRznd-MbGZXDAPNB2UJEo6wOyntBFGwalQ9B5MNoZDntoLW7ZoYsF4TBKKF655-UzvkadVqBc6_-8edJc0nK6-idYwoz0z2eG357f8Lv9exoPerFSaBTijeBl9spPVymCxydoske6bLIHHHu53182Vn5QVlcxnSTkk9aFqwBON9-aXol5NkFcgVeiRbQfB30U9aQBLjoFBr0RVCrTGXvzIB6Ptot_TdTcEgSIA6-mY29F03v7mN_YRxR5XRZMvi2bqkQ6KNT0FNIyVo_sL_zTaKirXUx4BHCrAvAbSTmKcHiqn7-QfzhVoW9T-5awBfiEKTJMf0ns_fOqOhfWZRSiMRYw_IiolTRLGkR8UJPsvR-VO5T9DR5NrOv5m1Uofo2US-AgwLuQVKWeutkdnDYjJZ2L5qKBRcrvPSRWy_JpSChJx8dyGKPHfwR_szIWTZsPQqrdkQgoFopKMtmG2tkEiY9iUBwTUFumlZdHyh_tdbeszzOngw4_JFxHXDbJCOMgxQor1bb5SKS7wEHdD-qUVzIQLWFlaW3brStlO5JeVpfkgkwk-Ri6UKD0idPJt_eNS-ui9pVfT0pzaIA-ApfhWaGtaT2RJKaywJmzUuMTAhnEM7G2xLni6zex7v26DIpVSnY4KH457SuIEmnZ--CV8C6xdXhi3HEboHW-1aAU4svi0Oia6zXDAyx300mws9YcUNPqnbE2xGQJaQ65Ty-vcwxSUyxLAwbDM8ESrJMzvIOQZp3wH6K0m4R5ulQ8aCRGT_K1LNCKFH6eGdXrwJ0K7sQbS4gA29tchud-1dnA9OozeQd2h97I7Pa9g3ay63rg8iztk14eb1lHIXBHRN17iHJUu1TDoGSVp2nzG85YcX3UlO5kDeIZ4_Go8NXMsLrTeB64KCFVw-DCUooRUJ_WVImi8/https://www.amazon.com/stores/page/CD30F755-2D89-439B-9017-3A5BFEC7943D/?_encoding=UTF8&store_ref=SB_A0339132URMMXA0LNR19-A0233059XPK4DZQXIW4T&pd_rd_plhdr=t&aaxitk=25c4110bb0d890284f42e5ea59ff7045&hsa_cr_id=0&lp_asins=B0FSS8VKGX%2CB0FSRVWJLG%2CB0G658LSVX&lp_query=fourth%20of%20july%20decorations&lp_slot=desktop-hsa-3psl&ref_=sbx_be_s_3psl_mbd_mb0_bkgd&pd_rd_w=Z4QFs&content-id=amzn1.sym.cd7c548b-a599-426f-9ffe-daa1aa803c87%3Aamzn1.sym.cd7c548b-a599-426f-9ffe-daa1aa803c87&pf_rd_p=cd7c548b-a599-426f-9ffe-daa1aa803c87&pf_rd_r=QKPFB6Q3MXBMHD9S2QE5&pd_rd_wg=WPFfo&pd_rd_r=1f590458-a4bd-4565-ada6-a44d677776a9,,,,,False,,,N/A,2026-04-21T13:12:22.142025,
65,1,Title,,,,Need help?Visit the help sectionorcontact us,,,,,,False,,,,2026-04-21T13:12:22.142633,
0,2,SB_Video,2.0,,,N/A,N/A,,,,,False,,,,2026-04-21T13:12:37.563343,6.0
1,2,Title,,,,ResultsCheck each product page for other buying options. Price and other details may vary based on p,,,,,,False,,,,2026-04-21T13:12:37.565778,
3,2,Organic,,49.0,B0CTT27G77,Patriotic Decorations - 4th of July Decorations Outdoor Hanging American Flag Banners Porch Sign for Veterans Memorial Labor Presidents Flag Election Day,N/A,$8.49,,4.5,469.0,False,https://m.media-amazon.com/images/I/71-5UBLTGVL._AC_UL320_.jpg,https://m.media-amazon.com/images/I/71-5UBLTGVL._AC_SL1500_.jpg,,2026-04-21T13:12:37.574036,
4,2,Organic,,50.0,B0F2DQP2J9,"26 PCS 4th of July Decorations, 250th Memorial Day Red White Blue Paper Fans Decorations, 4th of July Banner Pompom Garland and Hanging Swirls Set for Fourth of July Independence Day Decor",N/A,$14.99,,4.7,443.0,False,https://m.media-amazon.com/images/I/91EhtVbHnoL._AC_UL320_.jpg,https://m.media-amazon.com/images/I/91EhtVbHnoL._AC_SL1500_.jpg,,2026-04-21T13:12:37.579019,
5,2,Organic,,51.0,B0DNZBJVKV,"3 Packs American Flag Lights Outdoor - 4x2 FT Half Fan Shape Patriotic Net Light with 8 Modes, 150 LED Red White and Blue Lights, Waterproof for 4th of July Decorations, Christmas, Yard, Parties",N/A,$28.49,,4.2,167.0,False,https://m.media-amazon.com/images/I/71ZczX3TDgL._AC_UL320_.jpg,https://m.media-amazon.com/images/I/71ZczX3TDgL._AC_SL1500_.jpg,,2026-04-21T13:12:37.583952,
7,2,Title,,,,New arrivalsSponsoredBased on items added in the past 60 daysIndependence Day Party Decoration Gift ,,,,,,False,,,,2026-04-21T13:12:37.586980,
8,2,Title,,,,More results,,,,,,False,,,,2026-04-21T13:12:37.587414,
9,2,Organic,,52.0,B0F31TDVBF,4th of July Decorations - Memorial Day Decor - 4 x 2.3 Ft Rag American Flag Banner for Home Party Supplies - Fourth of July Independence Day Accessories for 250th Anniversary Celebration Indoor Outdoor Decoration,N/A,$29.99,,4.8,55.0,False,https://m.media-amazon.com/images/I/81IRT7P+xgL._AC_UL320_.jpg,https://m.media-amazon.com/images/I/81IRT7P+xgL._AC_SL1500_.jpg,,2026-04-21T13:12:37.590538,
10,2,Organic,,53.0,B0D9YDFCG6,"TERESA'S COLLECTIONS 4th of July Decorations for Outdoor, Patriotic Memorial Day Garden Decor, Eagle Metal Yard Art Sign for Outside, Americana Garden Stake for Lawn, Independence Day Gifts, 22.4''",N/A,$19.99,,4.6,176.0,False,https://m.media-amazon.com/images/I/71+rEQL1MlL._AC_UL320_.jpg,https://m.media-amazon.com/images/I/71+rEQL1MlL._AC_SL1500_.jpg,,2026-04-21T13:12:37.595298,
