data_index,page,ad_type,ad_rank,organic_rank,asin,title,url,price_current,price_list,rating_stars,rating_count,is_prime,image_small,image_large,brand_name,scraped_at,inner_products_count
5,3,SP,15.0,,B0G5YWCZT9,"Magnetic Road Tiles Set with Pull-Back Cars,Magnet Building Blocks for Kids Ages 4-8 with Magnetic Ship & Traffic Lights,STEM Educational Preschool Learning Toys,Ideal Gift for Boys and Girls",N/A,$29.99,,4.6,31.0,False,https://m.media-amazon.com/images/I/91scCGhH36L._AC_UL320_.jpg,https://m.media-amazon.com/images/I/91scCGhH36L._AC_SL1500_.jpg,,2026-04-21T11:14:23.951566,
6,3,SP,16.0,,B0DL5VMN36,"Gay Gifts for Him, Gifts for Gay Men, Funny Gift for Boyfriend Brother Husband, Birthday Christmas Presents for Him, LGBTQ Friend Pride Gift for Men, Bisexual Transgender Queer Present",N/A,$14.97,,4.6,29.0,False,https://m.media-amazon.com/images/I/61yBXUK0JtL._AC_UL320_.jpg,https://m.media-amazon.com/images/I/61yBXUK0JtL._AC_SL1500_.jpg,,2026-04-21T11:14:23.954491,
7,3,Organic,,97.0,B0D77MGD77,"2 (Pieces) 3"" and 5"" Gay Agenda Sticker, Waterproof Vinyl Decals for Many Purpose Like Cars, Trucks, Laptops, Phones, Windows and More",N/A,$7.00,,5.0,1.0,False,https://m.media-amazon.com/images/I/71fI+MeaYfL._AC_UL320_.jpg,https://m.media-amazon.com/images/I/71fI+MeaYfL._AC_SL1500_.jpg,,2026-04-21T11:14:23.958285,
8,3,Organic,,98.0,B0F3C4QNSN,"7.5x3.75(in) - Funny Magnet - honk if You are Gay Bumper Magnet - honk if You are Gay Bumper Sticker - Vehicle, Car, Truck",N/A,$8.99,,5.0,1.0,False,https://m.media-amazon.com/images/I/51K9htXof4L._AC_UL320_.jpg,https://m.media-amazon.com/images/I/51K9htXof4L._AC_SL1500_.jpg,,2026-04-21T11:14:23.962682,
9,3,Organic,,99.0,B0C2YW4174,"Hying 2PCS Gay Pride Bumper Stickers, LGBTQ Love is Love Magnetic, Reusable Pride Month Decorations, Multicolor, Vinyl, Rectangular Stickers for Cars",N/A,$9.89,,4.7,16.0,False,https://m.media-amazon.com/images/I/51xiCuRKRfL._AC_UL320_.jpg,https://m.media-amazon.com/images/I/51xiCuRKRfL._AC_SL1500_.jpg,,2026-04-21T11:14:23.967756,
10,3,Title,,,,Zero Sugar. Flavor UnleashedSponsored|Shop Monster EnergyShop nowPrevious pageMonster Energy Ultra P,,,,,,False,,,,2026-04-21T11:14:23.970489,
11,3,Title,,,,More results,,,,,,False,,,,2026-04-21T11:14:23.970722,
12,3,Organic,,100.0,B01H0W7HYC,"CafePress Honk for Gay Rights 10"" x 3"", Bumper Magnet",N/A,$9.99,,4.3,14.0,False,https://m.media-amazon.com/images/I/41N7zTI4s+L._AC_UL320_.jpg,https://m.media-amazon.com/images/I/41N7zTI4s+L._AC_SL1500_.jpg,,2026-04-21T11:14:23.975737,
13,3,Organic,,101.0,B09HY7DPHP,"Honk If You Have to Poop - 8"" x 3.5"" Auto Car Truck Bumper Locker Flat Surface All Weather Vinyl Decal Sticker - Hilarious Funny Prank Sticker",N/A,$5.75,,4.5,95.0,False,https://m.media-amazon.com/images/I/51pjImT3bwL._AC_UL320_.jpg,https://m.media-amazon.com/images/I/51pjImT3bwL._AC_SL1500_.jpg,,2026-04-21T11:14:23.982482,
14,3,Organic,,102.0,B0G2G4B8YW,"Magnet Only Gay Cops Pull Me Over, Gay Cops Funny Quotes Magnetic Vinyl Sticker Decal 5""",N/A,$5.95,,,,False,https://m.media-amazon.com/images/I/41H3qEmSebL._AC_UL320_.jpg,https://m.media-amazon.com/images/I/41H3qEmSebL._AC_SL1500_.jpg,,2026-04-21T11:14:23.986969,
15,3,Organic,,103.0,B0G2RNXNHH,"Magnet Only Gay Cops Pull Me Over Magnetic Vinyl Sticker Decal 5""",N/A,$5.95,,,,False,https://m.media-amazon.com/images/I/61Ov0rUlViL._AC_UL320_.jpg,https://m.media-amazon.com/images/I/61Ov0rUlViL._AC_SL1500_.jpg,,2026-04-21T11:14:23.990729,
16,3,Organic,,104.0,B07C3411WP,I Love Gay Porn Magnetic Bumper Sticker Prank,N/A,,,4.4,62.0,False,https://m.media-amazon.com/images/I/41JVmHhECfL._AC_UL320_.jpg,https://m.media-amazon.com/images/I/41JVmHhECfL._AC_SL1500_.jpg,,2026-04-21T11:14:23.993633,
17,3,Organic,,105.0,B087PBTW2G,"MAGNET Joe Biden For President| Biden LGBT | Gay Pride Rainbow Magnetic Vinyl Car Bumper Sticker 5""",N/A,$5.95,,4.1,109.0,False,https://m.media-amazon.com/images/I/419tc59IRgL._AC_UL320_.jpg,https://m.media-amazon.com/images/I/419tc59IRgL._AC_SL1500_.jpg,,2026-04-21T11:14:23.997515,
18,3,Organic,,106.0,B0BJM6MKJK,"Gear Tatz - I'm So Gay I Can't Even Drive Straight - Funny - Bumper Sticker or Car Magnet - 3"" X 10"" - Professionally Made in The USA - Vinyl or Magnetic Decal (Vinyl, X1)",N/A,$7.99,,4.8,5.0,False,https://m.media-amazon.com/images/I/61fc-sqixTL._AC_UL320_.jpg,https://m.media-amazon.com/images/I/61fc-sqixTL._AC_SL1500_.jpg,,2026-04-21T11:14:24.004826,
19,3,Organic,,107.0,B0B2MNL6KT,"MAGNET Honk If You're Horny Funny Bumper Magnet Vinyl Magnetic Sticker 20 mil - Size 5""",N/A,$5.95,,4.2,29.0,False,https://m.media-amazon.com/images/I/51+326T-oTL._AC_UL320_.jpg,https://m.media-amazon.com/images/I/51+326T-oTL._AC_SL1500_.jpg,,2026-04-21T11:14:24.009161,
20,3,Organic,,108.0,B0C6JM3F29,"Cops are Gay LGBT Funny Apparel Bumper Sticker Vinyl Decal 5""",N/A,$4.95,,4.7,10.0,False,https://m.media-amazon.com/images/I/51SEYVgQrrL._AC_UL320_.jpg,https://m.media-amazon.com/images/I/51SEYVgQrrL._AC_SL1500_.jpg,,2026-04-21T11:14:24.013507,
21,3,SP,17.0,,B0GSTQBY8S,"16PCS Funny Pride Gay Car Bumper Magnets: Bulk Magnetic Rainbow Decals Decorations for LGBT Parade Decor, Refrigerator, Truck, Prank Gift Ideas(Style 4)",N/A,$16.79,,5.0,7.0,False,https://m.media-amazon.com/images/I/91+sI1pToVL._AC_UL320_.jpg,https://m.media-amazon.com/images/I/91+sI1pToVL._AC_SL1500_.jpg,,2026-04-21T11:14:24.016775,
22,3,SP,18.0,,B0G6YXDZLT,12 Pcs Gay Pride Funny Magnet Bumper Sticker LGBT Rainbow Pride Prank Magnetic Sign for Vehicle Truck Reusable Magnet Sticker for Fridge (Bright),N/A,$20.99,,3.9,62.0,False,https://m.media-amazon.com/images/I/81VKBER+vBL._AC_UL320_.jpg,https://m.media-amazon.com/images/I/81VKBER+vBL._AC_SL1500_.jpg,,2026-04-21T11:14:24.021157,
23,3,Organic,,109.0,B0D3YQZL8W,10PC Funny Car Bumper Magnet Fun Magnetic Magnets Sticker Decal Prank for Cars Truck Adults Hot Girls Hit Curbs New Driver Please Be Patient Beep Honk Poop Joke Novelty Accessories Gifts,N/A,$9.99,,4.5,124.0,False,https://m.media-amazon.com/images/I/61-QNmp6RTL._AC_UL320_.jpg,https://m.media-amazon.com/images/I/61-QNmp6RTL._AC_SL1500_.jpg,,2026-04-21T11:14:24.024682,
24,3,Organic,,110.0,B0CQMC8Y6S,"Magnet Me Up Honk If You're A Goose Honk Twice If You're A Silly Goose Funny Magnet Decal, 3x8 Inch, Heavy Duty Automotive Magnet for Car Truck Or Any Other Magnetic Surface, Perfect Humorous Gift",N/A,$7.99,,5.0,39.0,False,https://m.media-amazon.com/images/I/61++5Ng1XeL._AC_UL320_.jpg,https://m.media-amazon.com/images/I/61++5Ng1XeL._AC_SL1500_.jpg,,2026-04-21T11:14:24.029805,
25,3,Organic,,111.0,B0DNGC88KQ,"Guess What? Chicken Butt! Magnets - 5"" On Longest Side - Cute Funny - 2 Pack - Thick Strong Magnet - Bumper Magnets for Fridge, Toolbox, Cars - Made in USA - PLDFMAG0660",N/A,$8.95,,4.7,47.0,False,https://m.media-amazon.com/images/I/71Yd8sGsmCL._AC_UL320_.jpg,https://m.media-amazon.com/images/I/71Yd8sGsmCL._AC_SL1500_.jpg,,2026-04-21T11:14:24.034039,
26,3,Organic,,112.0,B0CG6RCZLP,"MAGNET I Love My Gay Dog Magnetic Sticker Vinyl Waterproof Magnet Decal Car 5""",N/A,$5.95,,,,False,https://m.media-amazon.com/images/I/51NiPzwG-OL._AC_UL320_.jpg,https://m.media-amazon.com/images/I/51NiPzwG-OL._AC_SL1500_.jpg,,2026-04-21T11:14:24.037196,
27,3,Organic,,113.0,B0D9CGC37H,I Love Gay Porn Magnet 3x10 Bumper Sticker Size Funny I Heart Porn Magnet - Rainbow,N/A,$11.99,,,,False,https://m.media-amazon.com/images/I/61Fx7m5GNpL._AC_UL320_.jpg,https://m.media-amazon.com/images/I/61Fx7m5GNpL._AC_SL1500_.jpg,,2026-04-21T11:14:24.041494,
28,3,Organic,,114.0,B093CF8V73,"Gay Rainbow - 5"" Magnet for Car Locker Refrigerator",N/A,$8.99,,4.3,23.0,False,https://m.media-amazon.com/images/I/31xGiM8OEAS._AC_UL320_.jpg,https://m.media-amazon.com/images/I/31xGiM8OEAS._AC_SL1500_.jpg,,2026-04-21T11:14:24.046672,
29,3,Organic,,115.0,B0DJWHSR55,I'm Not Gay But My Boyfriend is | Bumper Sticker or Car Magnet | LGBTQ Waterproof Vinyl Sticker for Trucks Vans Cars [7.5x3.75],N/A,$6.95,,,,False,https://m.media-amazon.com/images/I/71LM2WZYmxL._AC_UL320_.jpg,https://m.media-amazon.com/images/I/71LM2WZYmxL._AC_SL1500_.jpg,,2026-04-21T11:14:24.049772,
30,3,Organic,,116.0,B0F2SQ5H7S,"10PCS Bumper Decals Funny LGBT Stickers, Gay Bumper Stickers, Waterproof Rainbow Bumper Prank Car Stickers with Humor Text, Universal Colorful Gay Pride Decals for Car Luggage Wall Laptop (02)",N/A,$7.59,,5.0,4.0,False,https://m.media-amazon.com/images/I/81W3JB8eG7L._AC_UL320_.jpg,https://m.media-amazon.com/images/I/81W3JB8eG7L._AC_SL1500_.jpg,,2026-04-21T11:14:24.053399,
31,3,Organic,,117.0,B0D857HJB1,I'm Not Gay But My Butthole is Magnet Funny 3x10 Bumper Sticker Size Joke Prank Gay Magnet Rainbow,N/A,$11.99,,,,False,https://m.media-amazon.com/images/I/61If3klqSEL._AC_UL320_.jpg,https://m.media-amazon.com/images/I/61If3klqSEL._AC_SL1500_.jpg,,2026-04-21T11:14:24.057767,
32,3,Organic,,118.0,B07LGG4FQY,Gear Tatz - SKINNY GAY PRIDE RAINBOW FLAG - LGBTQ PRIDE CAR MAGNET - 1.75 x 10 inches - Professionally Made in the USA - Magnetic Decal,N/A,$14.50,,4.5,97.0,False,https://m.media-amazon.com/images/I/41iJXZ1NB1L._AC_UL320_.jpg,https://m.media-amazon.com/images/I/41iJXZ1NB1L._AC_SL1500_.jpg,,2026-04-21T11:14:24.061996,
33,3,Organic,,119.0,B08MB7R9LP,"Crazy Novelty Guy Funny Warning Magnets - Set of 8, 6"" x 3"" Removable and Reusable Prank and Practical Joke Magnets",N/A,$29.99,,4.6,107.0,False,https://m.media-amazon.com/images/I/81zi263ESvL._AC_UL320_.jpg,https://m.media-amazon.com/images/I/81zi263ESvL._AC_SL1500_.jpg,,2026-04-21T11:14:24.066104,
34,3,Organic,,120.0,B07NSPXGPT,"Magnet Fish Meme Magnetic Car Sticker Decal Bumper Magnet Vinyl 5""",N/A,$5.40,,4.5,61.0,False,https://m.media-amazon.com/images/I/31yzr3aSQCL._AC_UL320_.jpg,https://m.media-amazon.com/images/I/31yzr3aSQCL._AC_SL1500_.jpg,,2026-04-21T11:14:24.069608,
35,3,Organic,,121.0,B0BTKC9YMM,"Beersy Gay Cruise Prank Package: Great Gift for Father's Day, Hilarious Pranks & Gags",N/A,$9.99,,4.0,233.0,False,https://m.media-amazon.com/images/I/81lb0+a2pOL._AC_UL320_.jpg,https://m.media-amazon.com/images/I/81lb0+a2pOL._AC_SL1500_.jpg,,2026-04-21T11:14:24.074012,
36,3,Organic,,122.0,B0DQWDGXXW,"MAIANEY [7.5""x4.5""] Proud Ally Magnetic Bumper Sticker Gay Pride Trans Pride Magnet Support LGBTQ Equality Bumper Magnets Equal Rights Human Rights Ally Gifts Decorations Car Truck Automobile Vehicle",N/A,$5.99,,,,False,https://m.media-amazon.com/images/I/41CDHj0A6ML._AC_UL320_.jpg,https://m.media-amazon.com/images/I/41CDHj0A6ML._AC_SL1500_.jpg,,2026-04-21T11:14:24.079538,
37,3,Organic,,123.0,B0F7R75RPR,LGBT Pride Rainbow Gay Dudes Just Taste Better Aluminum License Plate Metal Car Front License Plate Cover Car Decor Accessory Novelty Vanity Decoration Tag with 4 Holes Gift 6 x 12 Inch,N/A,,,4.4,36.0,False,https://m.media-amazon.com/images/I/510vk-LpQsL._AC_UL320_.jpg,https://m.media-amazon.com/images/I/510vk-LpQsL._AC_SL1500_.jpg,,2026-04-21T11:14:24.083468,
38,3,Organic,,124.0,B0G2T3QQM3,"Magnet I'm Not Gay I'm Super Gay Pride LGBT Flag Magnetic Vinyl Sticker Decal 5""",N/A,$5.95,,,,False,https://m.media-amazon.com/images/I/61+22byBJyL._AC_UL320_.jpg,https://m.media-amazon.com/images/I/61+22byBJyL._AC_SL1500_.jpg,,2026-04-21T11:14:24.087921,
39,3,Organic,,125.0,B00GH03HPW,Honk If You Have to Poop - Magnetic Prank Bumper Sticker,N/A,$8.99,,4.8,296.0,False,https://m.media-amazon.com/images/I/31qVTk87jBL._AC_UL320_.jpg,https://m.media-amazon.com/images/I/31qVTk87jBL._AC_SL1500_.jpg,,2026-04-21T11:14:24.094412,
40,3,Organic,,126.0,B01HFN8I6M,"Funny Warning Magnet - I Love Gay Porn - 6"" x 3"" Magnetic Bumper Sticker - Great for Practical Jokes, Pranks, Gags - Removable",N/A,$8.49,,4.8,21.0,False,https://m.media-amazon.com/images/I/61Fl37zFoYL._AC_UL320_.jpg,https://m.media-amazon.com/images/I/61Fl37zFoYL._AC_SL1500_.jpg,,2026-04-21T11:14:24.100513,
41,3,Organic,,127.0,B0D6JZGRBQ,My Girlfriend is Gay Sticker Funny Car Sticker I'm Not Gay But My Girlfriend is Sticker Decal,N/A,$5.95,,,,False,https://m.media-amazon.com/images/I/51HIbWu4eQL._AC_UL320_.jpg,https://m.media-amazon.com/images/I/51HIbWu4eQL._AC_SL1500_.jpg,,2026-04-21T11:14:24.104879,
42,3,Organic,,128.0,B0BTWKRLZW,I'm Not Gay But My Husband is Bumper Sticker Funny Car Sticker I'm Not Gay But My Husband is Sticker Decal Made in USA,N/A,$5.95,,,,False,https://m.media-amazon.com/images/I/51poku4Uw6L._AC_UL320_.jpg,https://m.media-amazon.com/images/I/51poku4Uw6L._AC_SL1500_.jpg,,2026-04-21T11:14:24.108933,
43,3,Organic,,129.0,B0C2GPSRBZ,"ALIBBON 2Pcs Gay Pride Rainbow Car Magnet for LGBTQ, Pride Month Bumper Decals",N/A,$7.99,,4.1,15.0,False,https://m.media-amazon.com/images/I/61+ZBJebVHL._AC_UL320_.jpg,https://m.media-amazon.com/images/I/61+ZBJebVHL._AC_SL1500_.jpg,,2026-04-21T11:14:24.113595,
44,3,Organic,,130.0,B0FH635851,"Funny Car Magnet Bumper Sticker - 10Pcs Hilarious Funny Joke Vehicle Magnets Embarrassing Harmless Waterproof Bumper Decals, Strong Magnetic Car Home Warning Sign Decor Gift for Adult Friends Couples",N/A,$14.99,,4.6,13.0,False,https://m.media-amazon.com/images/I/81I1JcRk3GL._AC_UL320_.jpg,https://m.media-amazon.com/images/I/81I1JcRk3GL._AC_SL1500_.jpg,,2026-04-21T11:14:24.117738,
45,3,Organic,,131.0,B0DKB9XZT4,I Love Dick Magnet I Heart Dick Large 3x10 Bumper Sticker Size Fun Prank Joke Gay Adult Penis Magnet - Black,N/A,$11.99,,5.0,1.0,False,https://m.media-amazon.com/images/I/41nJSlQjs3L._AC_UL320_.jpg,https://m.media-amazon.com/images/I/41nJSlQjs3L._AC_SL1500_.jpg,,2026-04-21T11:14:24.122419,
46,3,Organic,,132.0,B09LGZR84D,I'm Not Gay But My Boyfriend is License Plate Frame Stainless Steels Funny Black Car Tag Holder Frames with 2 Holes and Screws 12 x 6 Inch Decoration for US Vehicles Standard for Women Men,N/A,$13.99,,4.8,793.0,False,https://m.media-amazon.com/images/I/51JcUJw9DnL._AC_UL320_.jpg,https://m.media-amazon.com/images/I/51JcUJw9DnL._AC_SL1500_.jpg,,2026-04-21T11:14:24.128039,
47,3,Organic,,133.0,B08RLTLV16,Honk If You Have to Poop Car Magnet | Magnetic Prank Bumper Sticker (5 X 5 Inch),N/A,$9.95,,4.4,80.0,False,https://m.media-amazon.com/images/I/71yhjPKNBvL._AC_UL320_.jpg,https://m.media-amazon.com/images/I/71yhjPKNBvL._AC_SL1500_.jpg,,2026-04-21T11:14:24.132541,
48,3,Organic,,134.0,B0BZYVRHSG,24 Pieces Rainbow Magnetic Stickers Car Magnet Bumper Sticker Gay Pride Rainbow Car Magnet Heart Decal Wins Magnetic Stickers for Bumpers Refrigerator Decorations,N/A,$9.59,,4.6,409.0,False,https://m.media-amazon.com/images/I/81WxVwu4ayL._AC_UL320_.jpg,https://m.media-amazon.com/images/I/81WxVwu4ayL._AC_SL1500_.jpg,,2026-04-21T11:14:24.137670,
49,3,Organic,,135.0,B0973S7724,"MAZ DISTRIBUTIONS – Only Gay Cops Give Me Tickets Sticker - Vinyl Decal for Car, Truck, and Van – Long Lasting and Indoor and Outdoor Use – Waterproof Decal for Laptop - MAZ – 423 (White)",N/A,$5.99,,4.3,13.0,False,https://m.media-amazon.com/images/I/41wr4+RL0wS._AC_UL320_.jpg,https://m.media-amazon.com/images/I/41wr4+RL0wS._AC_SL1500_.jpg,,2026-04-21T11:14:24.142691,
50,3,Organic,,136.0,B0D9C5MBYY,Sounds Gay I'm in Magnet - LGBTQ Pride Ally Love Rainbow Flag Magnet - Car Truck Bumper Fridge Metal Surface Magnet - 5 Inches On Longest Side - Made in USA - AAMT0123,N/A,$6.95,,5.0,1.0,False,https://m.media-amazon.com/images/I/61JKy1Dzw2L._AC_UL320_.jpg,https://m.media-amazon.com/images/I/61JKy1Dzw2L._AC_SL1500_.jpg,,2026-04-21T11:14:24.146943,
51,3,Organic,,137.0,B0DRC9Y9DM,"(1Pcs - 7.5x4.5 in) Don't Honk At Me I'll Cum Magnet Bumper, Funny Adult Humor Car Magnet, Gen Z Meme Truck Vehicle Decor, Inappropriate Car Accessories, New Driver Gift for Friends, Coworkers",N/A,$9.99,,4.4,5.0,False,https://m.media-amazon.com/images/I/51p9kNrAETL._AC_UL320_.jpg,https://m.media-amazon.com/images/I/51p9kNrAETL._AC_SL1500_.jpg,,2026-04-21T11:14:24.150417,
52,3,Organic,,138.0,B0F2J65TXW,"Magnet Resist Fascism Magnet Banned Books LGBTQ Rights Trans Equality Liberal Social Justice Pride Black for Bumper, Refrigerator, Cruise Door, Car, Truck 7.5x3.75in",N/A,$6.99,,4.6,52.0,False,https://m.media-amazon.com/images/I/51ml5sowWyL._AC_UL320_.jpg,https://m.media-amazon.com/images/I/51ml5sowWyL._AC_SL1500_.jpg,,2026-04-21T11:14:24.155308,
53,3,Organic,,139.0,B0CFTY1YHL,"Magnet Tread On Me Daddy Magnet Vinyl Decal Sticker 5""",N/A,$5.95,,4.3,12.0,False,https://m.media-amazon.com/images/I/51siK2gaXJL._AC_UL320_.jpg,https://m.media-amazon.com/images/I/51siK2gaXJL._AC_SL1500_.jpg,,2026-04-21T11:14:24.160914,
54,3,Organic,,140.0,B07NSRSMRL,"Magnet I eat Ass Magnetic Car Sticker Decal Bumper Magnet Vinyl 5""",N/A,$5.40,,4.0,42.0,False,https://m.media-amazon.com/images/I/31Q88NHNXCL._AC_UL320_.jpg,https://m.media-amazon.com/images/I/31Q88NHNXCL._AC_SL1500_.jpg,,2026-04-21T11:14:24.165076,
55,3,Organic,,141.0,B0C4FC15BC,GTOTd Rainbow Gay Pride LGBTQ Car Fridge Magnets（12 Pack） Pride Merch Decor Gifts Party Supplies Accessories Cruise Door Decorations Magnetic Bumper Cabinets Decal Reusable Vinyl,N/A,$8.35,,4.6,67.0,False,https://m.media-amazon.com/images/I/91i3gDkDlNL._AC_UL320_.jpg,https://m.media-amazon.com/images/I/91i3gDkDlNL._AC_SL1500_.jpg,,2026-04-21T11:14:24.170732,
56,3,Organic,,142.0,B09FQ9X3CK,"Gear Tatz - Sorry Girls, I'm Gay - Retro Style, Gay Pride - Car Magnet - 3 x 10 inch - Professionally Made in USA - Magnetic Car Decal",N/A,$14.50,,4.5,2.0,False,https://m.media-amazon.com/images/I/61uD2KFA16L._AC_UL320_.jpg,https://m.media-amazon.com/images/I/61uD2KFA16L._AC_SL1500_.jpg,,2026-04-21T11:14:24.175737,
57,3,Organic,,143.0,B0F3VK31PT,"7.5x3.75(in) - Funny Magnet - I'm Not Gay But My Butthole is Bumper Magnet - I'm Not Gay But My Butthole is Bumper Sticker - Vehicle, Car, Truck",N/A,$8.99,,,,False,https://m.media-amazon.com/images/I/51z-DbUcJhL._AC_UL320_.jpg,https://m.media-amazon.com/images/I/51z-DbUcJhL._AC_SL1500_.jpg,,2026-04-21T11:14:24.180154,
58,3,Organic,,144.0,B0FRR9V2ZL,"3 Pcs Driver is Gay Stickers, Funny Rainbow Pride Vinyl Decals with Caution Sign Design, LGBTQ+ Humor Stickers for Cars, Laptops, Water Bottles and Gifts for Friends (3 inch)",N/A,$8.99,,,,False,https://m.media-amazon.com/images/I/61nW2wxqQRL._AC_UL320_.jpg,https://m.media-amazon.com/images/I/61nW2wxqQRL._AC_SL1500_.jpg,,2026-04-21T11:14:24.184631,
59,3,SP,19.0,,B09WGTF29B,LGBT Hearts |Great Gift Idea | Single |5 Inch Magnet | Made in The USA | Car Auto Tool Box Refrigerator Magnet|MAG10454,N/A,$6.95,,4.2,9.0,False,https://m.media-amazon.com/images/I/4197AJek9iL._AC_UL320_.jpg,https://m.media-amazon.com/images/I/4197AJek9iL._AC_SL1500_.jpg,,2026-04-21T11:14:24.187733,
60,3,SP,20.0,,B0FGX2WLKL,Mothers Day Birthday Gifts for Gay Lesbian LGBTQ+ Pride Month Graduation Gifts for Partner I Love You Gift for Wedding Anniversary Long Distance Gay Boyfriend Lesbian Girlfriend Handmade Rainbow Gift,N/A,$9.98,,5.0,22.0,False,https://m.media-amazon.com/images/I/81N9kcRhPzL._AC_UL320_.jpg,https://m.media-amazon.com/images/I/81N9kcRhPzL._AC_SL1500_.jpg,,2026-04-21T11:14:24.190711,
61,3,SP,21.0,,B07MY9PPR6,"Vehicle Magnets sign With Custom Lettering 12"" X 24"" (Set of 2) -Landscape, Construction, Handy man, Plumbing, car repair shop-GREEN-BAR",N/A,$54.99,,4.2,19.0,False,https://m.media-amazon.com/images/I/61Xi2d8HwOL._AC_UL320_.jpg,https://m.media-amazon.com/images/I/61Xi2d8HwOL._AC_SL1500_.jpg,,2026-04-21T11:14:24.194174,
62,3,SP,22.0,,B08P43TYYZ,"Car Magnet Signs Custom - 24""x12"" (Set of 2), 30-mil Thickness with Rounded Corners (Red)",N/A,$54.99,,4.4,99.0,False,https://m.media-amazon.com/images/I/61jimz3qVoL._AC_UL320_.jpg,https://m.media-amazon.com/images/I/61jimz3qVoL._AC_SL1500_.jpg,,2026-04-21T11:14:24.199052,
63,3,SP,23.0,,B0FZBL5MVW,"Custom car Magnets for Businesses 2 Pack | Personalized Magnetic car Signs | with Full Color Image, Text and Logo |Effective Advertising Signs | Various Size | Weather-Resistant (3"" X 10"")",N/A,$12.99,,4.8,20.0,False,https://m.media-amazon.com/images/I/61ldtFAQhhL._AC_UL320_.jpg,https://m.media-amazon.com/images/I/61ldtFAQhhL._AC_SL1500_.jpg,,2026-04-21T11:14:24.202544,
64,3,SP,24.0,,B07MY66K8Z,"Vehicle Magnets Sign with Custom Lettering 12"" X 24"" (Set of 2) - Landscape, Construction, Handy Man, Plumbing, Car Repair Shop - Black - 30mil Thickness Magnetic Car Sign with Rounded Corners",N/A,$54.99,,4.6,255.0,False,https://m.media-amazon.com/images/I/711sLGjib1L._AC_UL320_.jpg,https://m.media-amazon.com/images/I/711sLGjib1L._AC_SL1500_.jpg,,2026-04-21T11:14:24.205975,
65,3,Title,,,,Previous1234...7Next,,,,,,False,,,,2026-04-21T11:14:24.206813,
66,3,SB,5.0,,,N/A,https://aax-us-east-retail-direct.amazon.com/x/c/JA9cQ8I-AVVgffk67leuOUMAAAGdr7-EKgEAAAH2AQBvbm9fdHhuX2JpZDIgICBvbm9fdHhuX2ltcDEgICCO6QWh/clv1c_ek-YBPH3FdTW3ut7cCfGIQu_TZqZIjQDB3YAhnBmDbPTFUpZqDDDD-7m7-5SaLp4XtNsyvy8PHf42QO1B_7oahMbLdu7-2Zb6czWwPdyjIY-ggkjmctKBFDUIjjyp8EHz9y2PMlxsKspstT73YRTcpDequXcl1ZokdHy01c6TQASX6ehjLJ0rvn2w7jGmCVJhDzOwojJHwDOicKJ1ymbeCjLXB17IK4_l8cz4KOU6LLfVFrZ1FF47Qrt1M5F1hqXhHiTrE-V-DzcZ2yZOHVR2YWpQjb4Us99XKaXbiC5zyVvtffpP3aPCxc8gP4FDB0ZhdblNP9PgKmcTB0s5hydr2uRjNpf4TVeLmHJpsmFj3AaxWb13e3_SuUvVSTusKR0RZxvDFv35wV8HL4BNYIwHnPXVGVMl6GtXLKxPSOG4AfiTZQfv98q71Smynq4zqgpnnb24mF4Sg28xc5Rzmy9EoTIgmlRDgdjKgkUQ1l8Hb-7ZzyYAyMUafvDLU64WprG9F6vUz73VWg4FPFXh5bXfI3UafK7HoxQtgCJpaSPPWSG3m0U22FkfTQu-n0RQ06wy7Ni5U36ZNioHHNIzPhXUk6gWmDC9EDi_tR7bE7r1UAswMGogs_mcIwmjX_7enWIy0ZaxZxGoFRGtmmwbfEPzllSScnzjrDdJR1YIEG_SjOQrfMe9duVrZt_9MIj-xSmtFIlfQAeVydWYk_R_jpMGKjBQXr3jTC-YtGq82QKPhPLVX_VM2UhLRE87leQMK5TzEXwK3Qzl0bJl19Gs_wsbpnFb2uPHQ7WmzJ8xmcWvs5tDbWsVgyhZTB6RClaBVszGd-KRu52sX-Jf8SGgsaNh-TEnfE0dHK8EdlO4gNDMDmfDT9CACaRAx7J8eyyV9HyZbuCmPDmxjAA9HTVIkstzRY86ZCcqRAqPaaVwRisd0ByqGLbnppxGvEVuJOtwGGN4WcTzsA1md_Sr8ia2lpstTDq_-hBBJcdE9M4BAfxnm6fkuTlNwwNbJfi31trz-xzFM3yXEycUdp8GFlPXPeW6vWyVW9dF9Jo3OjQZSuat0mV__3S8BdNeL4IPjC_xMk2qFd-OrLAsa0rSmYq1eitDZJMmIRlvhF22pR7kWP9Uh3GPXsxf5ogPfOAeSm80_4KmTMSU2Zq0RUU0U2ZkdGzsc58IQKq1EreUbYlXOmtlJ7qxhI3_bObUxLjYN4hD1a6lTE2dfieqXIN5TaaTbgIFmV7Dy97Gg6O113g6pd_Um_RVWWOhVAw7T0hpjO1CcT7thndsQ2BL0oPx_iQh5U0T0A_OkVDtMy7eH3vZHy6JFD2qBpuplSTzXcZXaIRL6dvk0Dl309JXZsXvgc4QVi15MDPW_zkyzqVlFRcCU0zj7GOtmpYcvVZyQyrbMaaXbWmeElnK28LojTomhD6YoJscz4AwnwP5v3CqiprlUKw69g96pKMBLPS1-ZKU9551aixjifwx5-itLwGJAsVjHMLAajfFTEeYzkPDCftV1dJfOaDrgb157k_Kpab8yb0KD-DUU_BCcYTCWS_0FsCVrjziW5Ubh6_D66559UaAtRtc_7uyFCx9D0qZ2z0UlVkFA14AlVc97BrFlkbFW0EXeeIUVhVeTsg9DadigtLS-Wo6-dy2wgn9f6oZF8vfdjTxJXHEQ/https://www.amazon.com/stores/page/9D6717CC-CF2D-444A-9174-90925EAAF895/?_encoding=UTF8&store_ref=SB_A060666427GW4SOGJVTWZ-A03273971K79WTLXXTKQ3&pd_rd_plhdr=t&aaxitk=34d19618a01dcd9c9f964c8b0934426b&hsa_cr_id=0&lp_asins=B0G5B6MM22%2CB0BL7316GD%2CB0BL6XL5QZ&lp_query=gay%20magnets%20for%20car%20prank&lp_slot=desktop-hsa-3psl&ref_=sbx_be_s_3psl_mbd_mb0_bkgd&pd_rd_w=wgcgy&content-id=amzn1.sym.cd7c548b-a599-426f-9ffe-daa1aa803c87%3Aamzn1.sym.cd7c548b-a599-426f-9ffe-daa1aa803c87&pf_rd_p=cd7c548b-a599-426f-9ffe-daa1aa803c87&pf_rd_r=58HRSDX7G8X22J6DBGK6&pd_rd_wg=cSprF&pd_rd_r=53ced6c9-05b4-43df-a6ee-9e50e5206f58,,,,,False,,,N/A,2026-04-21T11:14:24.214016,
67,3,Title,,,,Need help?Visit the help sectionorcontact us,,,,,,False,,,,2026-04-21T11:14:24.214680,
0,4,SB_Video,1.0,,,N/A,N/A,,,,,False,,,,2026-04-21T11:14:39.808369,6.0
1,4,Title,,,,ResultsCheck each product page for other buying options. Price and other details may vary based on p,,,,,,False,,,,2026-04-21T11:14:39.810195,
3,4,Organic,,145.0,B0C4FC15BC,GTOTd Rainbow Gay Pride LGBTQ Car Fridge Magnets（12 Pack） Pride Merch Decor Gifts Party Supplies Accessories Cruise Door Decorations Magnetic Bumper Cabinets Decal Reusable Vinyl,N/A,$8.35,,4.6,67.0,False,https://m.media-amazon.com/images/I/91i3gDkDlNL._AC_UL320_.jpg,https://m.media-amazon.com/images/I/91i3gDkDlNL._AC_SL1500_.jpg,,2026-04-21T11:14:39.816567,
4,4,Organic,,146.0,B0FFVKPX92,"Magnet Me Up 5 Inch Round Toe Fungus Institute of America Magnet - Funny Gag Car Magnet for Pranks, Bumper Laughs & Joke Gifts - Full Color UV Weatherproof Printed Vinyl, Car, Fridge, Made in USA",N/A,$8.99,,4.9,12.0,False,https://m.media-amazon.com/images/I/71CRPFU2JOL._AC_UL320_.jpg,https://m.media-amazon.com/images/I/71CRPFU2JOL._AC_SL1500_.jpg,,2026-04-21T11:14:39.821467,
5,4,Organic,,147.0,B0F2J65TXW,"Magnet Resist Fascism Magnet Banned Books LGBTQ Rights Trans Equality Liberal Social Justice Pride Black for Bumper, Refrigerator, Cruise Door, Car, Truck 7.5x3.75in",N/A,$6.99,,4.6,52.0,False,https://m.media-amazon.com/images/I/51ml5sowWyL._AC_UL320_.jpg,https://m.media-amazon.com/images/I/51ml5sowWyL._AC_SL1500_.jpg,,2026-04-21T11:14:39.827108,
6,4,Title,,,,"Zero Sugar. Flavor UnleashedShop MonsterEnergyPrevious pageMonster Energy Ultra Punk Punch, Sugar Fr",,,,,,False,,,,2026-04-21T11:14:39.829398,
7,4,Title,,,,Your Kitchen & Bathroom AssistantSponsored|Shop BonieShop nowPrevious pageShower Head Cleaning Brush,,,,,,False,,,,2026-04-21T11:14:39.831037,
8,4,Title,,,,More results,,,,,,False,,,,2026-04-21T11:14:39.831250,
9,4,Organic,,148.0,B0GFXJYR9W,I Love Black Cock | Bumper Sticker or Car Magnet | Humorous Dirty Funny Adult Fun Joke Prank Gay Rainbow Gift Magnets for Cars [7.5x3.75],N/A,$6.95,,,,False,https://m.media-amazon.com/images/I/619r0+fLe5L._AC_UL320_.jpg,https://m.media-amazon.com/images/I/619r0+fLe5L._AC_SL1500_.jpg,,2026-04-21T11:14:39.834495,
10,4,Organic,,149.0,B0FY5WRC85,"I'm Not Gay But My Butthole is Magnet 5"" Round Fun Gay Friends Lovers Joke Prank Magnets",N/A,$12.95,,,,False,https://m.media-amazon.com/images/I/61PZ1DsyOpL._AC_UL320_.jpg,https://m.media-amazon.com/images/I/61PZ1DsyOpL._AC_SL1500_.jpg,,2026-04-21T11:14:39.838670,
11,4,Organic,,150.0,B07NSRSMRL,"Magnet I eat Ass Magnetic Car Sticker Decal Bumper Magnet Vinyl 5""",N/A,$5.40,,4.0,42.0,False,https://m.media-amazon.com/images/I/31Q88NHNXCL._AC_UL320_.jpg,https://m.media-amazon.com/images/I/31Q88NHNXCL._AC_SL1500_.jpg,,2026-04-21T11:14:39.842094,
