data_index,page,ad_type,ad_rank,organic_rank,asin,title,url,price_current,price_list,rating_stars,rating_count,is_prime,image_small,image_large,brand_name,scraped_at,inner_products_count
0,1,Title,,,,ResultsCheck each product page for other buying options.,,,,,,False,,,,2026-04-21T11:13:49.693074,
2,1,Organic,,1.0,B0D4DRRF9X,"bylikeho 10Pcs Car Stickers,Magnetic Bumper Stickers,Car Accessories,Funny Bumper Sticker,Automotive Stickers,Reusable Bumper Stickers,Suitable for All Cars,Trucks,Motorcycles,Etc",N/A,$9.98,,4.6,91.0,False,https://m.media-amazon.com/images/I/8112GIlya-L._AC_UL320_.jpg,https://m.media-amazon.com/images/I/8112GIlya-L._AC_SL1500_.jpg,,2026-04-21T11:13:49.698405,
3,1,Organic,,2.0,B0G5PQ2B48,"16PCS Funny Pride Gay Car Bumper Magnets: Bulk Magnetic Rainbow Decals Decorations for LGBT Parade Decor, Refrigerator, Truck, Prank Gift Ideas",N/A,$16.79,,5.0,7.0,False,https://m.media-amazon.com/images/I/81LlU3gySXL._AC_UL320_.jpg,https://m.media-amazon.com/images/I/81LlU3gySXL._AC_SL1500_.jpg,,2026-04-21T11:13:49.702782,
4,1,Organic,,3.0,B09PVNBP17,"Gay Pride Funny Magnet Bumper Sticker, Rainbow Pride Prank Magnetic Sign for Vehicle Truck Reusable Magnet Sticker for Fridge(10 Styles)",N/A,$13.99,,4.5,235.0,False,https://m.media-amazon.com/images/I/81xTMP3L1nL._AC_UL320_.jpg,https://m.media-amazon.com/images/I/81xTMP3L1nL._AC_SL1500_.jpg,,2026-04-21T11:13:49.707310,
5,1,Title,,,,Zero Sugar. Flavor UnleashedSponsored|Shop Monster EnergyShop nowPrevious pageMonster Energy Ultra P,,,,,,False,,,,2026-04-21T11:13:49.709402,
6,1,Title,,,,More results,,,,,,False,,,,2026-04-21T11:13:49.709560,
7,1,Organic,,4.0,B0DY1HSLHJ,12 Pcs Gay Pride Funny Magnet Bumper Sticker LGBT Rainbow Pride Prank Magnetic Sign for Vehicle Truck Reusable Magnet Sticker for Fridge(Classic),N/A,$17.99,,3.9,62.0,False,https://m.media-amazon.com/images/I/81cE-6Oxz5L._AC_UL320_.jpg,https://m.media-amazon.com/images/I/81cE-6Oxz5L._AC_SL1500_.jpg,,2026-04-21T11:13:49.713714,
8,1,Organic,,5.0,B09RF3DM5D,"Frienda 10 Pcs Bumper Decals Funny LGBT Stickers Rainbow Bumper Prank Car Stickers Colorful Car Accessories for Truck Vehicle Luggage Window Refrigerator(Magnetic,Stylish Style)",N/A,$9.49,,4.6,1330.0,False,https://m.media-amazon.com/images/I/91mxv5AzqxL._AC_UL320_.jpg,https://m.media-amazon.com/images/I/91mxv5AzqxL._AC_SL1500_.jpg,,2026-04-21T11:13:49.717909,
9,1,Organic,,6.0,B0F4WWDQBV,"LGBTQ Pride Prank Bumper Stickers - 12Pcs Gay Rainbow Pride Funny LGBT Prank Bumper Stickers, Strong Magnetic Car Home Decor Good LGBT Gift for Gay Couples Celebrate Love Equality",N/A,$7.03,,4.6,12.0,False,https://m.media-amazon.com/images/I/81BdAGVjCgL._AC_UL320_.jpg,https://m.media-amazon.com/images/I/81BdAGVjCgL._AC_SL1500_.jpg,,2026-04-21T11:13:49.721882,
10,1,Organic,,7.0,B0FVLZ956Z,"YOPPIX 10PCS Gay Pride Funny Car Magnet, LGBT Rainbow Pride Prank Magnetic Bumper Sticker for Adult Waterproof Magnetic Car Stickers for Vehicles and Trucks Reusable Magnet Sticker for Fridge",N/A,$15.99,,4.9,41.0,False,https://m.media-amazon.com/images/I/71FmMC6YysL._AC_UL320_.jpg,https://m.media-amazon.com/images/I/71FmMC6YysL._AC_SL1500_.jpg,,2026-04-21T11:13:49.727111,
11,1,Organic,,8.0,B0GKG7S2YW,"16PCS Funny Pride Gay Car Bumper Magnets: Bulk Magnetic Rainbow Decals Decorations for LGBT Parade Decor, Refrigerator, Truck, Prank Gift Ideas(Style 2)",N/A,$16.99,,5.0,7.0,False,https://m.media-amazon.com/images/I/91IYWViM9KL._AC_UL320_.jpg,https://m.media-amazon.com/images/I/91IYWViM9KL._AC_SL1500_.jpg,,2026-04-21T11:13:49.731425,
12,1,Organic,,9.0,B0FWTX3WZJ,Funny Bumper Stickers Gay Pride Magnets Car Prank Stickers Magnetic LGBTQ Car Stickers for Vehicles and Trucks or Fridge Magnet,N/A,$19.99,,4.6,91.0,False,https://m.media-amazon.com/images/I/81Yvs8V1I2L._AC_UL320_.jpg,https://m.media-amazon.com/images/I/81Yvs8V1I2L._AC_SL1500_.jpg,,2026-04-21T11:13:49.735169,
13,1,Organic,,10.0,B0DGXP6VF3,"10PCS Magnetic Bumper Sticker Decals, Funny LGBT Rainbow Prank Car Stickers, Magnets Pranks Car Reflective Decals for Vehicle Truck Luggage Window Refrigerator",N/A,$8.54,,4.8,5.0,False,https://m.media-amazon.com/images/I/71nCSSqSVFL._AC_UL320_.jpg,https://m.media-amazon.com/images/I/71nCSSqSVFL._AC_SL1500_.jpg,,2026-04-21T11:13:49.739062,
14,1,Organic,,11.0,B0GGXCZ4KD,"Funny Car Magnets, 10 Pcs Gay Bumper Magnets Reusable Car Stickers Gay Magnets for Car Prank Waterproof Magnetic Bumper Stickers for Vehicles Trucks Fridge",N/A,$9.99,,,,False,https://m.media-amazon.com/images/I/81Qjz8t3ntL._AC_UL320_.jpg,https://m.media-amazon.com/images/I/81Qjz8t3ntL._AC_SL1500_.jpg,,2026-04-21T11:13:49.742767,
15,1,Organic,,12.0,B0GSTQBY8S,"16PCS Funny Pride Gay Car Bumper Magnets: Bulk Magnetic Rainbow Decals Decorations for LGBT Parade Decor, Refrigerator, Truck, Prank Gift Ideas(Style 4)",N/A,$16.79,,5.0,7.0,False,https://m.media-amazon.com/images/I/91+sI1pToVL._AC_UL320_.jpg,https://m.media-amazon.com/images/I/91+sI1pToVL._AC_SL1500_.jpg,,2026-04-21T11:13:49.746817,
16,1,Organic,,13.0,B09TZNYK4L,10 Pcs Magnetic Bumper Decals Funny Bumper Stickers Rainbow Car Decals Prank Car Stickers Gay Pride Magnets for Vehicles Truck Car Refrigerator,N/A,$9.99,,4.7,218.0,False,https://m.media-amazon.com/images/I/71FsU6sQyyL._AC_UL320_.jpg,https://m.media-amazon.com/images/I/71FsU6sQyyL._AC_SL1500_.jpg,,2026-04-21T11:13:49.750815,
17,1,Organic,,14.0,B0FXXQ59PQ,"10PCS Magnetic Car Bumper Sticker, Magnet Reflective Funny Pride Prank Rainbow Reusable Vehicle Decal, Hilarious Colorful Auto Exterior Bumper Decoration, Universal for Truck SUV Van (StyleA)",N/A,$7.99,,5.0,2.0,False,https://m.media-amazon.com/images/I/714kmw8R78L._AC_UL320_.jpg,https://m.media-amazon.com/images/I/714kmw8R78L._AC_SL1500_.jpg,,2026-04-21T11:13:49.754204,
18,1,Title,,,,More results,,,,,,False,,,,2026-04-21T11:13:49.754768,
19,1,Organic,,15.0,B09BCGP6H6,Frienda 6 Pcs Bumper Stickers Prank Funny Bumper Magnets Funny Car Magnet Only Stickers LGBT Vehicle Refrigerator Trucks Luggage Wall Laptop,N/A,$6.99,,4.4,253.0,False,https://m.media-amazon.com/images/I/81xiOXCntBL._AC_UL320_.jpg,https://m.media-amazon.com/images/I/81xiOXCntBL._AC_SL1500_.jpg,,2026-04-21T11:13:49.758166,
20,1,Organic,,16.0,B0GHD2HC29,"12PCS Gay Pride Funny Car Magnet, LGBT Rainbow Pride Prank Magnetic Sign, Prank Magnetic Bumper Sticker for Vehicles and Trucks Reusable Magnet Sticker for Fridge",N/A,$17.99,,4.8,9.0,False,https://m.media-amazon.com/images/I/716YC4mE8yL._AC_UL320_.jpg,https://m.media-amazon.com/images/I/716YC4mE8yL._AC_SL1500_.jpg,,2026-04-21T11:13:49.762281,
21,1,Organic,,17.0,B0F1CM92K1,"10 PCS Bumper Decals, Funny LGBT Sticker Rainbow Gay Bumper Prank Decoration, Waterproof Vinyl Decal Humor Text Gay Pride Stickers for Luggage Window Refrigerator Laptop (Style 2)",N/A,$6.99,,4.7,6.0,False,https://m.media-amazon.com/images/I/81+B+bBjk8L._AC_UL320_.jpg,https://m.media-amazon.com/images/I/81+B+bBjk8L._AC_SL1500_.jpg,,2026-04-21T11:13:49.765787,
22,1,Organic,,18.0,B0FZBBJ7B5,"Zpana Magnetic LGBT Car Bumper Sticker, 10Sheets Reflective Funny Rainbow Sign Vehicle Bumper Prank Decal with Humor Text, Reusable Automotive Decorative Sticker, Universal Fit (Style1)",N/A,$4.69,,5.0,1.0,False,https://m.media-amazon.com/images/I/71er4d3DETL._AC_UL320_.jpg,https://m.media-amazon.com/images/I/71er4d3DETL._AC_SL1500_.jpg,,2026-04-21T11:13:49.769334,
23,1,Organic,,19.0,B08VNTRTSG,"Magnet, Funny Warning Magnet, I'm Not Gay, But $20 is $20, Practical Jokes, Gags, Pranks, 6"" x 3""",N/A,$6.99,,4.8,126.0,False,https://m.media-amazon.com/images/I/61Q7BL-ZxUL._AC_UL320_.jpg,https://m.media-amazon.com/images/I/61Q7BL-ZxUL._AC_SL1500_.jpg,,2026-04-21T11:13:49.774122,
24,1,Organic,,20.0,B0DNJNY9R3,"DXNQ 10 PCS Car Funny LGBT Stickers, Waterproof Prank Rainbow Bumper Stickers with Humor Text, Universal Colorful Gay Pride Decals for Vehicle Luggage Window, Car Accessories (02)",N/A,$7.99,,4.3,41.0,False,https://m.media-amazon.com/images/I/81errmFV8ML._AC_UL320_.jpg,https://m.media-amazon.com/images/I/81errmFV8ML._AC_SL1500_.jpg,,2026-04-21T11:13:49.777817,
25,1,Organic,,21.0,B0CD68VCGP,"Original Funny Gay LGBT Prank Bumper for Truck Cars Vehicle Or Luggage Bumper Sticker Vinyl Decal 5""",N/A,$4.95,,2.3,32.0,False,https://m.media-amazon.com/images/I/61BBvBhrh-L._AC_UL320_.jpg,https://m.media-amazon.com/images/I/61BBvBhrh-L._AC_SL1500_.jpg,,2026-04-21T11:13:49.781136,
26,1,Organic,,22.0,B0G446MXH4,12 Pcs Gay Pride Funny Magnet Bumper Sticker LGBT Rainbow Pride Prank Magnetic Sign for Vehicle Truck Reusable Magnet Sticker for Fridge(Cute),N/A,$18.99,,3.9,62.0,False,https://m.media-amazon.com/images/I/81tPMc1b7iL._AC_UL320_.jpg,https://m.media-amazon.com/images/I/81tPMc1b7iL._AC_SL1500_.jpg,,2026-04-21T11:13:49.784671,
27,1,Organic,,23.0,B0DNQXBVTG,"(1Pcs - 7.5x4.5 in) I Love Sucking Dicks with My Butthole Magnet Bumper, Funny Adult Humor Car Magnet, Inappropriate Gay Prank Truck Vehicle Decoration Accessories, Gift for Family, Friends",N/A,$9.99,,4.5,5.0,False,https://m.media-amazon.com/images/I/51DSyOE3VLL._AC_UL320_.jpg,https://m.media-amazon.com/images/I/51DSyOE3VLL._AC_SL1500_.jpg,,2026-04-21T11:13:49.789905,
28,1,Title,,,,More results,,,,,,False,,,,2026-04-21T11:13:49.790733,
29,1,Organic,,24.0,B0CGNZLZ6X,"10 PCS Funny Prank Magnet Bumper Sticker, Rainbow Gay Pride Adults Pranks Magnetic Sign for Vehicle Truck Car Reusable Magnet Sticker for Fridge",N/A,$13.99,,4.5,235.0,False,https://m.media-amazon.com/images/I/81lX5WX5PlL._AC_UL320_.jpg,https://m.media-amazon.com/images/I/81lX5WX5PlL._AC_SL1500_.jpg,,2026-04-21T11:13:49.797215,
30,1,Organic,,25.0,B0G3NDQCDX,"12PCS Gay Pride Car Funny Magnet Sticker Decal, Reusable LGBT Prank Automotive Sticker with Humor Text, Waterproof Car Bumper Magnetic Sign for Truck, SUV (Colorful)",N/A,$13.49,,,,False,https://m.media-amazon.com/images/I/71sqca4X+7L._AC_UL320_.jpg,https://m.media-amazon.com/images/I/71sqca4X+7L._AC_SL1500_.jpg,,2026-04-21T11:13:49.800604,
31,1,Organic,,26.0,B095NSVMB7,Anley I'm So Gay I Can't Even Drive Straight Car Magnet Signs - Reflective Truck & Vehicle Bumper Sticker - LGBT Magnetic Decal (10 inch) - Set of 3,N/A,$6.55,,4.7,270.0,False,https://m.media-amazon.com/images/I/91TLEfVn4uS._AC_UL320_.jpg,https://m.media-amazon.com/images/I/91TLEfVn4uS._AC_SL1500_.jpg,,2026-04-21T11:13:49.804955,
32,1,Organic,,27.0,B0G4QHLS77,"10 PCS Bumper Decals, Funny LGBT Prank Car Stickers Rainbow Bumper Decor with Humor Text, Universal Waterproof Vinyl Gay Pride Decal Luggage Sticker for Sedan Truck SUV (Style 1)",N/A,$5.49,,5.0,2.0,False,https://m.media-amazon.com/images/I/813DEk1jfoL._AC_UL320_.jpg,https://m.media-amazon.com/images/I/813DEk1jfoL._AC_SL1500_.jpg,,2026-04-21T11:13:49.808417,
33,1,Organic,,28.0,B0GRVCC4KS,"6PCS Gay Pride Funny Magnet Bumper Sticker, LGBTQ Rainbow Car Decals Prank Car Stickers, Prank Magnetic Bumper Sticker for Vehicles and Trucks or Fridge Magnet Sign",N/A,$14.99,,,,False,https://m.media-amazon.com/images/I/71AVhqLOCML._AC_UL320_.jpg,https://m.media-amazon.com/images/I/71AVhqLOCML._AC_SL1500_.jpg,,2026-04-21T11:13:49.816242,
34,1,Organic,,29.0,B0FWBYQ7DY,"10PCS Funny Bumper Stickers,Car Accessories Funny Car Magnets,Gay Sticker,LGBT Colorful Bumper Magnet,Stickers for Trucks,Suitable for Window,Cars,Truck,Motorcycle,or Other Type of Vehicle",N/A,$9.89,,,,False,https://m.media-amazon.com/images/I/81m69zBdTnL._AC_UL320_.jpg,https://m.media-amazon.com/images/I/81m69zBdTnL._AC_SL1500_.jpg,,2026-04-21T11:13:49.819686,
35,1,Organic,,30.0,B0DRRRHGJC,"MAIANEY [7.5""x4.5""] Caution This Vehicle Frequently Stops at Gay Bars Bumper Magnet Funny Adult Humor Car Magnets Gay Joke Warning Prank Gag Gifts for Men Decorations Car Truck Vehicle Automobile",N/A,$8.99,,5.0,1.0,False,https://m.media-amazon.com/images/I/5109Ul+TN0L._AC_UL320_.jpg,https://m.media-amazon.com/images/I/5109Ul+TN0L._AC_SL1500_.jpg,,2026-04-21T11:13:49.823145,
36,1,Organic,,31.0,B009995MTC,* Magnet * I Love Gay Porn Magnetic Bumper Sticker Prank,N/A,$4.89,,4.6,716.0,False,https://m.media-amazon.com/images/I/71C+UbYWKML._AC_UL320_.jpg,https://m.media-amazon.com/images/I/71C+UbYWKML._AC_SL1500_.jpg,,2026-04-21T11:13:49.826487,
37,1,Organic,,32.0,B0FY116XJ8,"YoRise 10PCS Car Funny LGBT Sticker Decals, Magnetic Rainbow Prank Decal with Humor Text, Waterproof Reflective Gay Pride Sticker, Universal Vehicle Window Bumper Accessories for Luggage(Colorful)",N/A,$8.90,,,,False,https://m.media-amazon.com/images/I/71oilW1q9gL._AC_UL320_.jpg,https://m.media-amazon.com/images/I/71oilW1q9gL._AC_SL1500_.jpg,,2026-04-21T11:13:49.830035,
38,1,Organic,,33.0,B0D5QKB5SF,"10-Pack Personalized Fun LGBT Bumper Stickers Colorful Magnetic Stickers Accessories Suitable for Cars, Computers, Motorcycles, refrigerators and Other Magnetic Objects",N/A,$9.28,,3.3,4.0,False,https://m.media-amazon.com/images/I/71K2EB7a8aL._AC_UL320_.jpg,https://m.media-amazon.com/images/I/71K2EB7a8aL._AC_SL1500_.jpg,,2026-04-21T11:13:49.836511,
39,1,Organic,,34.0,B0FP5GHQZ6,"10 PCS Car Funny LGBT Stickers, Waterproof Pride Bumper Stickers, Rainbow Prank Decals with Humor Text, Universal Car Accessories for Vehicle Luggage Window Refrigerator",N/A,$5.99,,5.0,2.0,False,https://m.media-amazon.com/images/I/719Q-8-H8xL._AC_UL320_.jpg,https://m.media-amazon.com/images/I/719Q-8-H8xL._AC_SL1500_.jpg,,2026-04-21T11:13:49.841991,
40,1,Organic,,35.0,B08RNGVG85,"Frienda 2 Pieces Large Gay Pride Bumper Sticker Colorful Waterproof Funny LGBT Stickers Gay Pride Prank Sign for Car Vehicle Truck RV SUV Auto Boat Laptops Decoration, 10 x 3 Inches",N/A,$6.99,,4.4,171.0,False,https://m.media-amazon.com/images/I/71kBHFhYxhL._AC_UL320_.jpg,https://m.media-amazon.com/images/I/71kBHFhYxhL._AC_SL1500_.jpg,,2026-04-21T11:13:49.847521,
41,1,Organic,,36.0,B0BTVM28BY,I'm Not Gay But My Butthole is Sticker 2 Sticker Deal 3x9 and 2x2 Funny Anal Gay Joke Prank Gag Gift,N/A,$5.85,,4.3,90.0,False,https://m.media-amazon.com/images/I/51WUU2UHP2L._AC_UL320_.jpg,https://m.media-amazon.com/images/I/51WUU2UHP2L._AC_SL1500_.jpg,,2026-04-21T11:13:49.854968,
42,1,Organic,,37.0,B0F8GPH4H8,"I'm So Gay I Can't Even Drive Straight Car Magnet Signs, 3 Pack Magnetic LGBT Waterproof Reflective Funny Car Stickers, Reflective Truck & Vehicle Bumper Sticker",N/A,$7.99,,3.9,7.0,False,https://m.media-amazon.com/images/I/81R6JHvT6+L._AC_UL320_.jpg,https://m.media-amazon.com/images/I/81R6JHvT6+L._AC_SL1500_.jpg,,2026-04-21T11:13:49.858986,
43,1,Organic,,38.0,B0F26QMKL4,"10PCS Bumper Decals Funny LGBT Stickers, Rainbow Bumper Prank Car Stickers LGBT Sticker Sign, Colorful Gay Pride Decal for Cars Trucks Luggage Window, Car Accessories (Style 2)",N/A,$7.99,,4.2,12.0,False,https://m.media-amazon.com/images/I/81KRGP-Wt-L._AC_UL320_.jpg,https://m.media-amazon.com/images/I/81KRGP-Wt-L._AC_SL1500_.jpg,,2026-04-21T11:13:49.863013,
44,1,Organic,,39.0,B09VKW5V5S,"76 PCS Original Funny Gay Prank Bumper Stickers, Funny LGBT Gay Stickers for Cars Decals Motorcycle Truck Vehicles Luggage Sticker for Adults Bumper Decals",N/A,$8.99,,4.6,302.0,False,https://m.media-amazon.com/images/I/81a9npQCGuL._AC_UL320_.jpg,https://m.media-amazon.com/images/I/81a9npQCGuL._AC_SL1500_.jpg,,2026-04-21T11:13:49.868884,
45,1,Organic,,40.0,B0DKCBRGGZ,My Other Ride is a Penis Magnet Large 3x10 Bumper Sticker Size Sexy Adult Prank Joke Gag Magnet - Black,N/A,$11.99,,5.0,2.0,False,https://m.media-amazon.com/images/I/51raer3VjLL._AC_UL320_.jpg,https://m.media-amazon.com/images/I/51raer3VjLL._AC_SL1500_.jpg,,2026-04-21T11:13:49.874084,
46,1,Organic,,41.0,B0BWHLV2H1,"JULMELON Pride Rainbow Magnetic Stickers, 22pcs Pride Car Water-Repellent Magnets Decorations Accessories for Pride Day Parade Supplies Home Fridge Car Bumpers Party Decor",N/A,$7.99,,3.9,1277.0,False,https://m.media-amazon.com/images/I/815wRHkoG+L._AC_UL320_.jpg,https://m.media-amazon.com/images/I/815wRHkoG+L._AC_SL1500_.jpg,,2026-04-21T11:13:49.878883,
47,1,Organic,,42.0,B0FW3GXCM6,"10PCS 8"" x 3"" Bumper Stickers,Car Accessories Prank Funny Car Stickers,Gay Pride Auto Magnets and Decals,Funny Bumper Magnets,Suitable for Any Metal Surface on Trucks,SUVs,Motorcycles",N/A,$9.99,,,,False,https://m.media-amazon.com/images/I/81uRaUwlU2L._AC_UL320_.jpg,https://m.media-amazon.com/images/I/81uRaUwlU2L._AC_SL1500_.jpg,,2026-04-21T11:13:49.884294,
48,1,Title,,,,More results,,,,,,False,,,,2026-04-21T11:13:49.884852,
49,1,Organic,,43.0,B01HFN8NNU,"Funny Warning Magnet - Big Truck, Small Penis - 6"" x 3"" Magnetic Bumper Sticker - Great for Practical Jokes, Pranks, Gags - Removable",N/A,$6.99,,4.6,85.0,False,https://m.media-amazon.com/images/I/61qqrlcPG5L._AC_UL320_.jpg,https://m.media-amazon.com/images/I/61qqrlcPG5L._AC_SL1500_.jpg,,2026-04-21T11:13:49.888983,
50,1,Organic,,44.0,B0B57N94CN,"Rio Salto 10-Pack Funny Prank Car Magnets – Hilarious Removable Bumper Magnet Set, Waterproof Reusable Magnetic Decals, Gag Gifts for Adults, Office Coworker Pranks, Joke Gifts",N/A,$16.99,,4.5,490.0,False,https://m.media-amazon.com/images/I/71RdBh+55HL._AC_UL320_.jpg,https://m.media-amazon.com/images/I/71RdBh+55HL._AC_SL1500_.jpg,,2026-04-21T11:13:49.893188,
51,1,Organic,,45.0,B088YN7FS2,CafePress Gay Pride Democrat Oval Euro Car Bumper Magnet,N/A,$11.99,,5.0,4.0,False,https://m.media-amazon.com/images/I/61FpKmvT7cL._AC_UL320_.jpg,https://m.media-amazon.com/images/I/61FpKmvT7cL._AC_SL1500_.jpg,,2026-04-21T11:13:49.896473,
52,1,Organic,,46.0,B0GGBKHYD7,"10Pcs Gay Pride Funny Car Magnets, Rainbow Designs I‘M Gay, Gay Driver Magnetic Bumper Stickers, Gay Bumper Magnets Reusable Removable Prank Decals for Vehicle, Truck, Fridge, LGBTQ Pride Gift",N/A,,,4.8,28.0,False,https://m.media-amazon.com/images/I/812FLvJ3nML._AC_UL320_.jpg,https://m.media-amazon.com/images/I/812FLvJ3nML._AC_SL1500_.jpg,,2026-04-21T11:13:49.899645,
53,1,Organic,,47.0,B0D79GZXJ8,"12 Pcs Magnetic Bumper Stickers Funny Car Decals Rainbow Prank Pride Stickers for Cars, Trucks, Vehicles, Refrigerators, Waterproof and Reusable Car Magnets, Colorful Auto Accessories",N/A,$8.56,,5.0,3.0,False,https://m.media-amazon.com/images/I/715UPIklG0L._AC_UL320_.jpg,https://m.media-amazon.com/images/I/715UPIklG0L._AC_SL1500_.jpg,,2026-04-21T11:13:49.905572,
54,1,Organic,,48.0,B0C7TFHX8C,GEEKBEAR I'm So Gay I Can't Even Drive Straight Car Magnet - 8.7 x 3.5 in,N/A,$14.99,,4.5,18.0,False,https://m.media-amazon.com/images/I/71Z5248dkVL._AC_UL320_.jpg,https://m.media-amazon.com/images/I/71Z5248dkVL._AC_SL1500_.jpg,,2026-04-21T11:13:49.909122,
56,1,Title,,,,Debug info copied.SponsoredMCMILLER ENTERTAINMENT It’s Bananas – The Hilarious Monkey Tail Party Gam,,,,,,False,,,,2026-04-21T11:13:49.909982,
57,1,Title,,,,Previous123...6Next,,,,,,False,,,,2026-04-21T11:13:49.910310,
58,1,SB,1.0,,,N/A,https://aax-us-east-retail-direct.amazon.com/x/c/JNStSy1q4z0ECTAgydwlO1MAAAGdr779VwEAAAH2AQBvbm9fdHhuX2JpZDYgICBvbm9fdHhuX2ltcDIgICAQOv4x/clv1c_ek-YBPHXFbbWzjK3YoscrxfcuXaZLo-H_zaMBCVjPTswaXwD3tgfByw7YwFhAHm5OFJ-fWPlPP-SAr66swXozWBaS2GRBXA7Oz5hAtrp_UAGzRn-DFL7iQa5YPdMPiKQhg2FvHc670GjHc5hgbIgNPSLIN2QxhVqduZxSDKm9lYvOSm2PpeZFO_BrlnqYrecdda3ggTJERnegTzRn4gCwg8Csd-3ggiQxagJGdjqBMqcn3A8EQP_55XDQ8JF90VzmIbkQydHxeejYRSkWe-lEeuiBSbztI7eakygwSM3rJr_2fE7y6RDOBghm0DS2zoX9w7Z0iHbNXiJMl7aQTH_MX2OHsZlET6pz0uG-3maYJ0MsX95c8oQj4f2pcEg0O_Zhowi7K8K4kjjzd4w17Gpqqq87oLFxhCtm29ayaFEJwo2bMkTt0v6mmoPoYvEca1HI-JKp6I2HCgDxd5P9UrvOUPKZaLssuyOjxVvAAxh8gOHSu8dJUYoZux73sTA-zWc3EQv6PKBASBhOZnntQG-40sCtcGkSk5NPRxCWgH8O3K6rYaY74oKcfQ-Muh0GAoCYBxw46gPxw9afamzrtmIr6ug2UUhtUAKcQGetaTWtblAhnpI2eYKAJQR2-3LHWnE5-JJoeJTdSkjLwsjktApf2x47nyWigi8uSH74XPJEACicALBjahojE4B7iLknxVikvl00X4zO1yRmzWbxzjma9Z-_Gy4UiD5W6seKEHa0O8hX1h8WN7XGAw8isjFz5LMCkVsDRxuMnWailuzPvQhh12UxAXm3YOZaGg7wbVfOfHLzPASn1Tu2pc9CCX-Z2DuPdH2CjVH1pHiU46kaXBdkTCaHmVtODlQaVTENCqVJWHPHnYkRpO8rZtIleGj8IjEgp900s83QZprx_vMMKWoed7xXlObKGjwZwIDJPgdmV2oObSdW9DD-t0nffJIi8073h2LXKN0qiSsb2-PgxXME0xs4ui5dw7y2v7lZIdJqKPMUpt2W49XTNP1qnY0BYprKsCQWa1cqgfFA6IB2tw5oLMV3EGyybi07icDwo2gjTLPdwe2EJWNrLNTWepI-oYU8MuQN7M91_HpJHcLcm-xyP7J47O27538xUOPMagjxaNUnh98ItmbEzQO4XE1Ocf1SKfvQ8Ov6kdSjwfxT5jdNugVS0_RImod-9-2Yz-Fl22TTiGXcc4PO3LYguTahLKRbBdYygGckG2yitwdL7kRZ8EVdPgd5ScUox1zoSulLovmRFbMVkOjhOaEGd-uzEX8MvUlULvpJtHUrKaOxiAT55tsrPTS1nRx3zb1Yv5BZbhX8zJ-4eNMjEnPRkWHxipH7P0qyUCaOWy49Pgshiq8dhh3WaTVLogjjJ0boTLmhxnzMqAU2o3sUhmt4A2UfzXdW4GKXapHwKO-BP3zFgUS4w1yQsoLCIAk3gKfs6g5Wd_DvOiuFf_hSIzADNh5xaqRhiX4EA088UsCJBOVjXPLp_qY2W1-TGDwcj3DV0dNePbjvgr356m_a2J5swuSwx4w1rkCWhrk5343LyVh9cDLA1llkZgObc1jZZS1wQ3exguNQKktXhOprDI245OrzGSQtMBTKmltD7AJ1CvZepDb0On6KpskBFY4TDA05TpBLOcaR8qGE2WO_HuWK-qhPr-i6g/https://www.amazon.com/stores/page/9D6717CC-CF2D-444A-9174-90925EAAF895/?_encoding=UTF8&store_ref=SB_A060666427GW4SOGJVTWZ-A03273971K79WTLXXTKQ3&pd_rd_plhdr=t&aaxitk=34d19618a01dcd9c9f964c8b0934426b&hsa_cr_id=0&lp_asins=B0G5B6MM22%2CB0BL7316GD%2CB0BL6XL5QZ&lp_query=gay%20magnets%20for%20car%20prank&lp_slot=desktop-hsa-3psl&ref_=sbx_be_s_3psl_mbd_mb0_bkgd&pd_rd_w=LMaXz&content-id=amzn1.sym.cd7c548b-a599-426f-9ffe-daa1aa803c87%3Aamzn1.sym.cd7c548b-a599-426f-9ffe-daa1aa803c87&pf_rd_p=cd7c548b-a599-426f-9ffe-daa1aa803c87&pf_rd_r=ED2XHAY7FPH1RP8M66DG&pd_rd_wg=Jbsqo&pd_rd_r=ed4cbc10-2f20-4301-a23f-7ebcfb699605,,,,,False,,,N/A,2026-04-21T11:13:49.917470,
59,1,Title,,,,Need help?Visit the help sectionorcontact us,,,,,,False,,,,2026-04-21T11:13:49.918236,
0,2,SB,2.0,,,Zero Sugar. Flavor Unleashed,https://aax-us-east-retail-direct.amazon.com/x/c/JIS816gE6UKrB1Lp6RfkmcEAAAGdr79A0QEAAAH2AQBvbm9fdHhuX2JpZDMgICBvbm9fdHhuX2ltcDEgICDE5eMq/clv1c_ek-wBIHXKsTWnuvbEztEiWrgOTgDWx2lbWEyvnU2MHmllHElG6Ii8VkgGA65L4KqWB3dTOwXsVXSocrGKYw5p3ZJsSfU9mIJnhMQ4ZD-vxm2Bi3RhLIhjGnwmim1ZjxwCsEHgxLnoYnTHDPWmtbk_ehrsPyewBXrhuIgB3dqzJ0TROXAjqgz2og6R1XCikYEqx2bygsqXQBX087NhzyBYi4LDU4aBp_yhqMecd_60rbSkQg-uhM2jMoPJUAldKzgtidMM1sW9m5pr0nIspdmEIiViZpmEPPv4p8maLD1N1plrAbzY9Y7kTLeKbr8iyilL9GBTLspIZZdhNRVXDtkj8GJLpISE5Sc9qs1LSxXyF-cbW1HQPo9mFNYwAfc5xCVUTnm5_E5y1o_8Vdwrk1CPL9kiGujxiZUeUbV3-0z7f6E4dw2sefzX9hgDqR2VYlZ_GWA5rvKGDQksCrzGZ2qGqK0_k2xcnVqQPAr-Y0g9xph5X2Ixj8QdmEPPdoOfGvYbjR1Lu2Bu8HRqoHvN0Ge8_gTR9B0KkvWGm6rA4OpSJTLEe7s1bUGZSGPQB30V774K2Av1wC5_bedZa-bbA13-tUCTU3e_J5uuCTmv_qVabnt-JLueEBPBJZ13DQ-nlamIlntAKW_rZoSL4051jIuDNHecyXvWc-hB6Dvg-mM8HHz1Lco4oMml8Kcur2_MarCdVHqhIuu5oYAutpaFyX-kf03NQjOEooh7dRH5qPOiLmKy8j5HqyMaHv1RLfnq7NBJABh3SuJgwHa6JRbCtTawVTZTWi4-GWi31kHfFb1lnn20zUt_l6Suyepnsm1qF4rXB6ZS_Wbzi1w4zEuzWVkZVTOiEZbvXqWKfS4y-AQtEzEvVOs6O85Ll4xFB5LF5SaZJ9AWu03V1JyXKLh-OPi9SrhrkhrkyGQRxmU_8gFTuURBRVXoKzxCu56e6Y8rOSezWGy--l9TD-bdUnnUKRReU9sXJ-DI9-vPUDxeYV4OuwplDMiob-CJVSMZONoWSgkd22llzrbwmpKlqzHVG3_iMC72dxhgUFHa9sgCmNeUzO0Mw8CpgjNMYbJwpelbOy-kU9Z8zVGEb37wwIpZ355tWV8QWXQAJ9fNfOoxUcZkIqT8RT44VpJqag-BT_ZdAiuii-ornry4XH2bEcPOfNrn2C8oCJbF4gEhQBDfw2R2X35hKKYJdemIORRQKi7cWZqm68GRm9b1U0kmLRQ62XNou2B_ERNMutjV9r_6o1q9lYenrUklpR4-GZCvAvXFC0IhrKE8Ge9miiSR_7cre2wW837b8Hhd7PHtq07FN1VQ9iqRNT-_mcsshcs7IcUd6lMgTx5LLxwlrSiirTt3rmuxoWuJBB3pBRe811ZiWsdiI2hZuJ1Y2neINxnlYEiYF5RANba5_yQ3DMK3TV9al1k6QYnswvTRfqnQ1BiucqkjEDkS4QA-dmRCQYjmieEB5c34OwLpnrRKXhoXrTXTbfQlO3DWXd2N_mupi8MLpPgV3WGrsdHL9DgqXlJtVEqp8pHTmq6hLjKVl7ZSZwPTCPRmzT_VIuagZIk6nKxc7HOt70Nf07dkHebdCb-6uDZg21bHerMkyUNb1zOw9VQZf_IsR4NzPy9ZkhluBsF-qHbWilh8HapI5cCLaM1KGj49CKSpZ6XjvEi1NU0L0k8L-wMsbKIu0OwsZN5762LqA/https://www.amazon.com/stores/page/9D6717CC-CF2D-444A-9174-90925EAAF895/?_encoding=UTF8&store_ref=SB_A060666427GW4SOGJVTWZ-A03273971K79WTLXXTKQ3&pd_rd_plhdr=t&aaxitk=34d19618a01dcd9c9f964c8b0934426b&hsa_cr_id=0&lp_asins=B0G5B6MM22%2CB0BL7316GD%2CB0BL6XL5QZ&lp_query=gay%20magnets%20for%20car%20prank&lp_slot=auto-sparkle-hsa-tetris&ref_=sbx_s_sparkle_sbtcd_bkgd&pd_rd_w=cO86v&content-id=amzn1.sym.cc961e39-6f5f-411e-8135-81c6c1187ac0%3Aamzn1.sym.cc961e39-6f5f-411e-8135-81c6c1187ac0&pf_rd_p=cc961e39-6f5f-411e-8135-81c6c1187ac0&pf_rd_r=HH5ZYXE8NN59CHA78D8A&pd_rd_wg=YpYsV&pd_rd_r=3a35e503-0f7a-4fc5-b0ea-0ab8d5cb780b,,,,,False,"https://m.media-amazon.com/images/S/al-na-9d5791cf-3faf/a24a1e05-0884-48a7-904c-c281906d529c._CR0,0,400,400_AC_SX130_SY60_CB1169409_QL70_.png",,Zero Sugar. Flavor Unleashed,2026-04-21T11:14:06.659783,3.0
1,2,Title,,,,ResultsCheck each product page for other buying options. Price and other details may vary based on p,,,,,,False,,,,2026-04-21T11:14:06.661036,
3,2,SP,1.0,,B0G5YWCZT9,"Magnetic Road Tiles Set with Pull-Back Cars,Magnet Building Blocks for Kids Ages 4-8 with Magnetic Ship & Traffic Lights,STEM Educational Preschool Learning Toys,Ideal Gift for Boys and Girls",N/A,$29.99,,4.6,31.0,False,https://m.media-amazon.com/images/I/91scCGhH36L._AC_UL320_.jpg,https://m.media-amazon.com/images/I/91scCGhH36L._AC_SL1500_.jpg,,2026-04-21T11:14:06.664526,
4,2,SP,2.0,,B0FGX429RM,"Mothers Day Birthday Gifts for Pride LGBTQ+ Trans LGBT Gay Non Binary Lesbian Bisexual Transgender, Graduation Gift for Him Her Adults Lovers Prides Proculsexual Couple, Handmade Rainbow Present",N/A,$9.98,,5.0,4.0,False,https://m.media-amazon.com/images/I/81wHpeXCdBL._AC_UL320_.jpg,https://m.media-amazon.com/images/I/81wHpeXCdBL._AC_SL1500_.jpg,,2026-04-21T11:14:06.670283,
5,2,SP,3.0,,B0FGX214V2,"Graduation Birthday Gift for Her, Emotional Rainbow Support Birthday Gifts for Teen Women Friend LGBTQ Gay, Positive Crochet Rainbow Pride for Administrative Professionals Encouragement Present",N/A,$9.98,,4.6,18.0,False,https://m.media-amazon.com/images/I/817V00j8irL._AC_UL320_.jpg,https://m.media-amazon.com/images/I/817V00j8irL._AC_SL1500_.jpg,,2026-04-21T11:14:06.674941,
6,2,SP,4.0,,B0GSTQBY8S,"16PCS Funny Pride Gay Car Bumper Magnets: Bulk Magnetic Rainbow Decals Decorations for LGBT Parade Decor, Refrigerator, Truck, Prank Gift Ideas(Style 4)",N/A,$16.79,,5.0,7.0,False,https://m.media-amazon.com/images/I/91+sI1pToVL._AC_UL320_.jpg,https://m.media-amazon.com/images/I/91+sI1pToVL._AC_SL1500_.jpg,,2026-04-21T11:14:06.678067,
7,2,Organic,,49.0,B0758HYW6Q,Follow Me to The Gay Bar Rainbow Auto Bumper Magnet - Hilarious!,N/A,$8.42,,4.6,321.0,False,https://m.media-amazon.com/images/I/61R0vqKuCQL._AC_UL320_.jpg,https://m.media-amazon.com/images/I/61R0vqKuCQL._AC_SL1500_.jpg,,2026-04-21T11:14:06.683301,
