data_index,page,ad_type,ad_rank,organic_rank,asin,title,url,price_current,price_list,rating_stars,rating_count,is_prime,image_small,image_large,brand_name,scraped_at,inner_products_count
8,2,Organic,,50.0,B0F99WH92W,"10pcs Funny Gay Bumper Stickers, Waterproof Funny Car Magnets Gay Stickers LGBT Magnetic Bumper Decals Reflective Rainbow Car Decals for Vehicles and Trucks",N/A,$12.99,,4.5,12.0,False,https://m.media-amazon.com/images/I/81Yy56GiiOL._AC_UL320_.jpg,https://m.media-amazon.com/images/I/81Yy56GiiOL._AC_SL1500_.jpg,,2026-04-21T11:14:06.690217,
9,2,Organic,,51.0,B0C5W25RG2,"Here I Go in My Gay Little Car Bumper Sticker Vinyl Decal 5""",N/A,$4.95,,4.4,7.0,False,https://m.media-amazon.com/images/I/41-o2azcujL._AC_UL320_.jpg,https://m.media-amazon.com/images/I/41-o2azcujL._AC_SL1500_.jpg,,2026-04-21T11:14:06.694330,
10,2,Title,,,,"Zero Sugar. Flavor UnleashedShop MonsterEnergyPrevious pageMonster Energy Ultra Punk Punch, Sugar Fr",,,,,,False,,,,2026-04-21T11:14:06.696600,
11,2,Title,,,,Vacuum Magnetic Car Phone Holder Ultra Suction CupSponsored|7K+ bought from this brand in past month,,,,,,False,,,,2026-04-21T11:14:06.697952,
12,2,Title,,,,More results,,,,,,False,,,,2026-04-21T11:14:06.698086,
13,2,Organic,,52.0,B0CG1HWD44,"12pcs Funny Car Magnet, Prank Magnetic Bumper Decals for Adult Waterproof Car Hilarious Bumper Sticker Reusable Joke Funny Bumper Warming Sign for Car Truck Vehicle",N/A,$17.99,,4.6,105.0,False,https://m.media-amazon.com/images/I/81bF9U3qFIL._AC_UL320_.jpg,https://m.media-amazon.com/images/I/81bF9U3qFIL._AC_SL1500_.jpg,,2026-04-21T11:14:06.701618,
14,2,Organic,,53.0,B07T363PTM,"NOCITUN Funny Fashion Metal License Plate Tag Sign Decoration for Car Woman/Man - 12"" x 6""- Anodized Aluminum I'm So Gay I Can't Even Drive Straight White",N/A,$13.99,,4.6,161.0,False,https://m.media-amazon.com/images/I/516Rb-TBSfL._AC_UL320_.jpg,https://m.media-amazon.com/images/I/516Rb-TBSfL._AC_SL1500_.jpg,,2026-04-21T11:14:06.705732,
15,2,Organic,,54.0,B09C6F9XSQ,"Only Gay Cops Pull Me Over Magnet Bumper 8.25"" x 2.75""",N/A,$10.99,,4.6,179.0,False,https://m.media-amazon.com/images/I/617XS28ZQFL._AC_UL320_.jpg,https://m.media-amazon.com/images/I/617XS28ZQFL._AC_SL1500_.jpg,,2026-04-21T11:14:06.709881,
16,2,Organic,,55.0,B0CQVRH12Q,I'm So Gay I Can't Even Drive Straight - Flexible Car Auto Bumper Magnet (Rectangular),N/A,$7.59,,4.0,23.0,False,https://m.media-amazon.com/images/I/613p4WbgYXL._AC_UL320_.jpg,https://m.media-amazon.com/images/I/613p4WbgYXL._AC_SL1500_.jpg,,2026-04-21T11:14:06.713760,
17,2,Organic,,56.0,B0C78MP5XF,CafePress Honk for Gay Rights Rectangle Car Bumper Magnet,N/A,$5.99,,5.0,1.0,False,https://m.media-amazon.com/images/I/61twH6efkgL._AC_UL320_.jpg,https://m.media-amazon.com/images/I/61twH6efkgL._AC_SL1500_.jpg,,2026-04-21T11:14:06.720175,
18,2,Organic,,57.0,B0BSGGQ6QJ,"I'm So Gay Pride Sticker, Funny Car Sticker, Gay Prank Car Bumper Decal - 10 inches",N/A,$6.99,,4.3,87.0,False,https://m.media-amazon.com/images/I/41tjtciGGdL._AC_UL320_.jpg,https://m.media-amazon.com/images/I/41tjtciGGdL._AC_SL1500_.jpg,,2026-04-21T11:14:06.723724,
19,2,Organic,,58.0,B0FHKJQRVV,"ESENHARBER 6-Pack Cricket Noise Maker Prank Kit with Magnet, Unlimited Chaos Prank, Hidden Beeping Devices for Office & Home Pranks, Hilarious Gag Gifts for Adults Lasting for Over 1 Year",N/A,$16.99,,4.2,82.0,False,https://m.media-amazon.com/images/I/71qHIWGmNwL._AC_UL320_.jpg,https://m.media-amazon.com/images/I/71qHIWGmNwL._AC_SL1500_.jpg,,2026-04-21T11:14:06.727502,
20,2,Organic,,59.0,B0CF2S19WW,"I'm Gay Rainbow Heat Change Mug - Funny Rude Mug - Message Appears as it Heats - Perfect Novelty Gag Gift, best funny gifts and pride accessories",N/A,$19.99,,4.0,2703.0,False,https://m.media-amazon.com/images/I/71pMNLHAYjL._AC_UL320_.jpg,https://m.media-amazon.com/images/I/71pMNLHAYjL._AC_SL1500_.jpg,,2026-04-21T11:14:06.731965,
21,2,Organic,,60.0,B0B2MLGBYZ,"MAGNET Only Gay Cops Pull Me Over Cool Biker Magnet Vinyl Magnetic Sticker 20 mil - Size 5""",N/A,$5.95,,4.0,29.0,False,https://m.media-amazon.com/images/I/51iRP7ZJ8-L._AC_UL320_.jpg,https://m.media-amazon.com/images/I/51iRP7ZJ8-L._AC_SL1500_.jpg,,2026-04-21T11:14:06.737553,
22,2,SP,5.0,,B0G6YXDZLT,12 Pcs Gay Pride Funny Magnet Bumper Sticker LGBT Rainbow Pride Prank Magnetic Sign for Vehicle Truck Reusable Magnet Sticker for Fridge (Bright),N/A,$20.99,,3.9,62.0,False,https://m.media-amazon.com/images/I/81VKBER+vBL._AC_UL320_.jpg,https://m.media-amazon.com/images/I/81VKBER+vBL._AC_SL1500_.jpg,,2026-04-21T11:14:06.742023,
23,2,Organic,,61.0,B01HFN8K88,"Funny Warning Magnet - Cowboy Butts Drive Me Nuts - 6"" x 3"" Magnetic Bumper Sticker - Great for Practical Jokes, Pranks, Gags - Removable",N/A,$8.49,,4.6,424.0,False,https://m.media-amazon.com/images/I/61+8iegAX9L._AC_UL320_.jpg,https://m.media-amazon.com/images/I/61+8iegAX9L._AC_SL1500_.jpg,,2026-04-21T11:14:06.746210,
24,2,Organic,,62.0,B0DXKMMF3H,"3Pcs I Love Gay Porn Sticker, I Love Gay Porn Rainbow Pride Prank Bumper Sticker, LGBT Pride Flag Vinyl Decal, Universal Colorful Gay Pride Decals - Sticker For Laptop Water Bottle Car Phone Helmet 3""",N/A,$7.99,,5.0,2.0,False,https://m.media-amazon.com/images/I/61KPoZInKhL._AC_UL320_.jpg,https://m.media-amazon.com/images/I/61KPoZInKhL._AC_SL1500_.jpg,,2026-04-21T11:14:06.750440,
25,2,Organic,,63.0,B0G5X8KH3D,"10PCS Magnetic Bumper Stickers for Car, Funny Rainbow LGBT Stickers, Reusable Prank Bumper Magnets Decal for Car SUV Truck Motorcycle",N/A,$9.88,,5.0,3.0,False,https://m.media-amazon.com/images/I/811uyXBuVtL._AC_UL320_.jpg,https://m.media-amazon.com/images/I/811uyXBuVtL._AC_SL1500_.jpg,,2026-04-21T11:14:06.755285,
26,2,Organic,,64.0,B08NHYNF6B,"Funny Gay Bumper Stickers - Great for Gags, Jokes, Gifts - Set of 4 | Sticker | 8"" x 3""",N/A,$6.99,,4.6,322.0,False,https://m.media-amazon.com/images/I/819+Seme1LL._AC_UL320_.jpg,https://m.media-amazon.com/images/I/819+Seme1LL._AC_SL1500_.jpg,,2026-04-21T11:14:06.760696,
27,2,Organic,,65.0,B0D85P1YK6,I'm Not Gay But My Butthole is Magnet Funny 3x10 Bumper Sticker Size Joke Prank Gay Magnet,N/A,$11.99,,5.0,3.0,False,https://m.media-amazon.com/images/I/51j+lP-lazL._AC_UL320_.jpg,https://m.media-amazon.com/images/I/51j+lP-lazL._AC_SL1500_.jpg,,2026-04-21T11:14:06.764860,
28,2,Organic,,66.0,B081B6YJ2B,"Funny Warning Magnet, Driver is Hung Like A Chipmunk, Practical Jokes, Gags, Pranks, 6"" x 3""",N/A,$8.49,,4.8,168.0,False,https://m.media-amazon.com/images/I/61sVQak0JDL._AC_UL320_.jpg,https://m.media-amazon.com/images/I/61sVQak0JDL._AC_SL1500_.jpg,,2026-04-21T11:14:06.771530,
29,2,Organic,,67.0,B0DPD3L243,I Love Anal Magnet Large 3x10 Bumper Sticker Size Gay Joke Prank Gag Magnets - White,N/A,$11.95,,,,False,https://m.media-amazon.com/images/I/41yaiXXpyTL._AC_UL320_.jpg,https://m.media-amazon.com/images/I/41yaiXXpyTL._AC_SL1500_.jpg,,2026-04-21T11:14:06.777085,
30,2,Organic,,68.0,B072K11VFD,"Funny Warning Magnets - I Rode The Short Bus - 6"" x 3"" Magnetic Bumper Sticker - Great for Practical Jokes, Pranks, Gags - Removable",N/A,$8.49,,4.6,187.0,False,https://m.media-amazon.com/images/I/710ZP4EJ80L._AC_UL320_.jpg,https://m.media-amazon.com/images/I/710ZP4EJ80L._AC_SL1500_.jpg,,2026-04-21T11:14:06.781528,
31,2,Organic,,69.0,B0D9C5FQGW,Ad Astra Graphics Sounds Gay I'm In Rectangular LGBTQ Pride Ally Love Rainbow Flag Magnet - 5 Inches - Multi Color - 1 Count - Made in USA,N/A,$7.95,,4.6,19.0,False,https://m.media-amazon.com/images/I/6164VEVR3ML._AC_UL320_.jpg,https://m.media-amazon.com/images/I/6164VEVR3ML._AC_SL1500_.jpg,,2026-04-21T11:14:06.786135,
32,2,Organic,,70.0,B0G2RQHYCJ,"Magnet Only Gay Cops Give Me Tickets Magnetic Vinyl Sticker Decal 5""",N/A,$5.95,,,,False,https://m.media-amazon.com/images/I/61ne7m2Az5L._AC_UL320_.jpg,https://m.media-amazon.com/images/I/61ne7m2Az5L._AC_SL1500_.jpg,,2026-04-21T11:14:06.789572,
33,2,Organic,,71.0,B00SDTDEA8,"Crazy Sticker Guy Funny Warning Magnets - Driver is Gay - 6"" by 3"" - Great for Practical Jokes! Removable!",N/A,$8.49,,4.4,27.0,False,https://m.media-amazon.com/images/I/51uqv9PqcwL._AC_UL320_.jpg,https://m.media-amazon.com/images/I/51uqv9PqcwL._AC_SL1500_.jpg,,2026-04-21T11:14:06.793703,
34,2,Organic,,72.0,B0B8YXSP3N,"Sukh Funny Magnetic Bumper Sticker - I'm Only Driving This Fast Because I Have to Poop Funny Car Magnet Used for Jokes, Gags, Pranks 1 Pack",N/A,$5.59,,4.7,226.0,False,https://m.media-amazon.com/images/I/61x9qQjBfML._AC_UL320_.jpg,https://m.media-amazon.com/images/I/61x9qQjBfML._AC_SL1500_.jpg,,2026-04-21T11:14:06.798438,
35,2,Organic,,73.0,B0G4CNGNWP,"2026 New 5.5x5.5 Funny Car Magnets,Reflective I Have to Poop Bumper Magnets for Cars,Weatherproof Funny Bumper Stickers as Hilarious Prank Gifts for Friends/Colleagues",N/A,$4.99,,4.5,2.0,False,https://m.media-amazon.com/images/I/61OGv9keI0L._AC_UL320_.jpg,https://m.media-amazon.com/images/I/61OGv9keI0L._AC_SL1500_.jpg,,2026-04-21T11:14:06.801930,
36,2,Organic,,74.0,B0G2RTXGYT,"Magnet Gay Bear Man Showing Off Magnetic Vinyl Sticker Decal 5""",N/A,$5.95,,,,False,https://m.media-amazon.com/images/I/61fQ1RVBjiL._AC_UL320_.jpg,https://m.media-amazon.com/images/I/61fQ1RVBjiL._AC_SL1500_.jpg,,2026-04-21T11:14:06.805105,
37,2,Organic,,75.0,B0CWRBKWLQ,I'm So Gay I Can't Even Drive Straight - Flexible Car Auto Bumper Magnet (Oval),N/A,$6.99,,4.0,8.0,False,https://m.media-amazon.com/images/I/61eHrwvB-RL._AC_UL320_.jpg,https://m.media-amazon.com/images/I/61eHrwvB-RL._AC_SL1500_.jpg,,2026-04-21T11:14:06.808651,
38,2,SP,6.0,,B0FWTX3WZJ,Funny Bumper Stickers Gay Pride Magnets Car Prank Stickers Magnetic LGBTQ Car Stickers for Vehicles and Trucks or Fridge Magnet,N/A,$19.99,,4.6,91.0,False,https://m.media-amazon.com/images/I/81Yvs8V1I2L._AC_UL320_.jpg,https://m.media-amazon.com/images/I/81Yvs8V1I2L._AC_SL1500_.jpg,,2026-04-21T11:14:06.812019,
39,2,Organic,,76.0,B0F8R68N5Z,Here I Go in My Gay Little Car | Bumper Sticker or Car Magnet | LGBT Funny Pride Meme Quote Magnetic Bumper for Refrigerators Doors Trucks Cars [7.5x3.75],N/A,$6.95,,,,False,https://m.media-amazon.com/images/I/71RtVoWm3WL._AC_UL320_.jpg,https://m.media-amazon.com/images/I/71RtVoWm3WL._AC_SL1500_.jpg,,2026-04-21T11:14:06.814599,
40,2,Organic,,77.0,B0DKB7PRDJ,I Love Cock Magnet I Heart Cock Large 3x10 Bumper Sticker Size Fun Prank Joke Gay Adult Penis Magnet - Black,N/A,$11.99,,5.0,3.0,False,https://m.media-amazon.com/images/I/51D9Jv4xLOL._AC_UL320_.jpg,https://m.media-amazon.com/images/I/51D9Jv4xLOL._AC_SL1500_.jpg,,2026-04-21T11:14:06.818933,
41,2,Organic,,78.0,B0DRQQC5Z3,"MAIANEY [7.5""x4.5""] I'm So Gay I Cant Even Park Straight Bumper Magnet Funny Adult Humor Car Magnets Gay Joke Warning Prank Gen Z Meme New Driver Gifts For Men Decorations Car Truck Vehicle Automobile",N/A,$5.99,,,,False,https://m.media-amazon.com/images/I/61klRayo4oL._AC_UL320_.jpg,https://m.media-amazon.com/images/I/61klRayo4oL._AC_SL1500_.jpg,,2026-04-21T11:14:06.822131,
42,2,Organic,,79.0,B0D9QK4DNY,"Only G.ay Cops Pull Me Over Funny Bumper Stickers for Car Truck Van, Vinyl Waterproof Decal Sticker for Adults, Size 7.5 x 3.75 inches",N/A,$6.25,,4.4,23.0,False,https://m.media-amazon.com/images/I/61DXkCMkW5L._AC_UL320_.jpg,https://m.media-amazon.com/images/I/61DXkCMkW5L._AC_SL1500_.jpg,,2026-04-21T11:14:06.826547,
43,2,Organic,,80.0,B07DYH1WXG,GRAPHICS & MORE Oh Deer I'm Queer Rainbow Pride Gay Lesbian Funny Automotive Car Refrigerator Locker Vinyl Euro Oval Magnet,N/A,$8.99,,4.6,207.0,False,https://m.media-amazon.com/images/I/61CfqbvqdTL._AC_UL320_.jpg,https://m.media-amazon.com/images/I/61CfqbvqdTL._AC_SL1500_.jpg,,2026-04-21T11:14:06.831745,
44,2,Organic,,81.0,B0F24FNNDL,"Yoppix 10PCS Funny Car Bumper Magnet, New Driver Magnet Prank Magnetic Sticker for Car Truck Metal, Hot Girls Hit Curbs New Driver Please Be Patient Waterproof Reusable",N/A,$15.99,,4.5,116.0,False,https://m.media-amazon.com/images/I/712W1py7MRL._AC_UL320_.jpg,https://m.media-amazon.com/images/I/712W1py7MRL._AC_SL1500_.jpg,,2026-04-21T11:14:06.835557,
45,2,Organic,,82.0,B0G2RTF5TP,"Magnet Honk If Youâ€™Re Gay Magnetic Vinyl Sticker Decal 5""",N/A,$5.95,,,,False,https://m.media-amazon.com/images/I/51iFKxVNoZL._AC_UL320_.jpg,https://m.media-amazon.com/images/I/51iFKxVNoZL._AC_SL1500_.jpg,,2026-04-21T11:14:06.838838,
46,2,Organic,,83.0,B09CLLJB2V,"Magnet Me Up: Flag Progress Pride Gay Pride Rainbow Flag Car Magnet Decal - 3x5 Inches - Heavy-Duty Automotive Magnet for Car, Truck, SUV - Show Support for LGBTQ Community - Any Magnetic Surface",N/A,$6.99,,4.5,837.0,False,https://m.media-amazon.com/images/I/51wJW24Tl2L._AC_UL320_.jpg,https://m.media-amazon.com/images/I/51wJW24Tl2L._AC_SL1500_.jpg,,2026-04-21T11:14:06.843501,
47,2,Organic,,84.0,B0DXCLHQ65,Gay Cruise Prank Package with Tickets,N/A,$9.49,,4.6,7.0,False,https://m.media-amazon.com/images/I/816XmmfyFNL._AC_UL320_.jpg,https://m.media-amazon.com/images/I/816XmmfyFNL._AC_SL1500_.jpg,,2026-04-21T11:14:06.848237,
48,2,Organic,,85.0,B0CXMQ7RCP,"LAD Studio Honk If You Have Small PP - Funny Road Rage Window Bumper Sticker Decal 5""""",N/A,$4.95,,4.3,16.0,False,https://m.media-amazon.com/images/I/51n71kSA21L._AC_UL320_.jpg,https://m.media-amazon.com/images/I/51n71kSA21L._AC_SL1500_.jpg,,2026-04-21T11:14:06.852618,
49,2,Organic,,86.0,B0CKHBNQB6,"Funny Rick Roll Scan Me QR Code Bumper Sticker Vinyl Decal 5""",N/A,$4.95,,,,False,https://m.media-amazon.com/images/I/51xaFp50mtL._AC_UL320_.jpg,https://m.media-amazon.com/images/I/51xaFp50mtL._AC_SL1500_.jpg,,2026-04-21T11:14:06.856188,
50,2,Organic,,87.0,B0D8RXQCV8,8 Funny Prank Stickers for Cars and Door Handle Pranks - Ron Jeremy Meme Sticker Amusing Decals April Fools Gag Gift Practical Joke (Blue Speedo),N/A,$11.98,,5.0,27.0,False,https://m.media-amazon.com/images/I/71GQJG1tJ4L._AC_UL320_.jpg,https://m.media-amazon.com/images/I/71GQJG1tJ4L._AC_SL1500_.jpg,,2026-04-21T11:14:06.860652,
51,2,Organic,,88.0,B098SL8GDR,Funny License Plate Frame with Humor Text Gay Pride Rainbow Flag I'm So Gay I Can't Even Drive Straight Stainless Steels Black Car Holder with 2 Holes and Screws 12 x 6 Inch for US Vehicle Standard,N/A,$13.99,,4.6,468.0,False,https://m.media-amazon.com/images/I/51Dx4oHIx2S._AC_UL320_.jpg,https://m.media-amazon.com/images/I/51Dx4oHIx2S._AC_SL1500_.jpg,,2026-04-21T11:14:06.864228,
52,2,Organic,,89.0,B0C7LM9TKH,"Overdecor Pride Progress Rainbow Gay Flag Decal Stickers Car Emblem LGBTQ Car Accessories Decorations Chrome Shield Flag Sticker Decals for Cars Truck Vehicles, 2 Pack",N/A,$9.99,,4.8,51.0,False,https://m.media-amazon.com/images/I/51dj6ePDd5L._AC_UL320_.jpg,https://m.media-amazon.com/images/I/51dj6ePDd5L._AC_SL1500_.jpg,,2026-04-21T11:14:06.867617,
53,2,Organic,,90.0,B0765DC1SY,Rogue River Tactical Rainbow LGBT Large Funny Bumper Sticker Auto Car Decal Truck RV Boat Window I'M So Gay I Can't Even Drive Straight,N/A,$6.99,,4.4,470.0,False,https://m.media-amazon.com/images/I/51qVX5IZDHL._AC_UL320_.jpg,https://m.media-amazon.com/images/I/51qVX5IZDHL._AC_SL1500_.jpg,,2026-04-21T11:14:06.871814,
54,2,Organic,,91.0,B0BXTD8F83,"Honk If You're Gay - Funny Prank Sticker - Funny Bumper Sticker Decal for 6"" x 3""",N/A,$6.59,,5.0,2.0,False,https://m.media-amazon.com/images/I/41YPUPTd1hL._AC_UL320_.jpg,https://m.media-amazon.com/images/I/41YPUPTd1hL._AC_SL1500_.jpg,,2026-04-21T11:14:06.875599,
55,2,Organic,,92.0,B09QYJ7QX2,Whaline 12Pcs Pride Rainbow Magnetic Stickers Love is Love Car Magnet Bumper Sticker Gay Pride Day Gnome Love Wins Heart Fridge Magnet Decal for LGBTQ Refrigerator Decorations,N/A,$9.99,,4.3,80.0,False,https://m.media-amazon.com/images/I/81nsn72EuJL._AC_UL320_.jpg,https://m.media-amazon.com/images/I/81nsn72EuJL._AC_SL1500_.jpg,,2026-04-21T11:14:06.880807,
56,2,Organic,,93.0,B0C8HT6V21,"7.5"" Broken Glass Decal - 3 Pack Waterproof Reusable Broken Screen Prank Stickers, Car Window Sticker for Cars, Boats, Trucks, laptops, Walls, Phones",N/A,$8.39,,3.7,233.0,False,https://m.media-amazon.com/images/I/71HKVdkOA0L._AC_UL320_.jpg,https://m.media-amazon.com/images/I/71HKVdkOA0L._AC_SL1500_.jpg,,2026-04-21T11:14:06.884458,
57,2,Organic,,94.0,B0C2YW4174,"Hying 2PCS Gay Pride Bumper Stickers, LGBTQ Love is Love Magnetic, Reusable Pride Month Decorations, Multicolor, Vinyl, Rectangular Stickers for Cars",N/A,$9.89,,4.7,16.0,False,https://m.media-amazon.com/images/I/51xiCuRKRfL._AC_UL320_.jpg,https://m.media-amazon.com/images/I/51xiCuRKRfL._AC_SL1500_.jpg,,2026-04-21T11:14:06.888164,
58,2,Organic,,95.0,B0FC1V8PJS,"10PCS Funny Car Bumper Magnet Prank Decals, Waterproof Car Stickers Hot Girls Hit Curbs New Driver Please Be Patient Beep Honk Poop",N/A,$6.49,,,,False,https://m.media-amazon.com/images/I/81N9V57BCgL._AC_UL320_.jpg,https://m.media-amazon.com/images/I/81N9V57BCgL._AC_SL1500_.jpg,,2026-04-21T11:14:06.892200,
59,2,Organic,,96.0,B0FR5FX42V,"Funny 'I'm Not Gay My Butthole is' Bumper Sticker - Durable Vinyl Decal for Cars, Laptops, Water Bottles - Waterproof (3PCS, 3"")",N/A,$5.99,,,,False,https://m.media-amazon.com/images/I/61y9uAgjGfL._AC_UL320_.jpg,https://m.media-amazon.com/images/I/61y9uAgjGfL._AC_SL1500_.jpg,,2026-04-21T11:14:06.897136,
60,2,SP,7.0,,B0FGX2WLKL,Mothers Day Birthday Gifts for Gay Lesbian LGBTQ+ Pride Month Graduation Gifts for Partner I Love You Gift for Wedding Anniversary Long Distance Gay Boyfriend Lesbian Girlfriend Handmade Rainbow Gift,N/A,$9.98,,5.0,22.0,False,https://m.media-amazon.com/images/I/81N9kcRhPzL._AC_UL320_.jpg,https://m.media-amazon.com/images/I/81N9kcRhPzL._AC_SL1500_.jpg,,2026-04-21T11:14:06.900084,
61,2,SP,8.0,,B0FJ2XCLTP,"Magnet Me Up Furry & Proud, National Convention Attendee Gag Magnet - 5"" Round Magnetic Decal for Car or Fridge Hilarious Furry Convention Joke Magnet - UV Printed, Weatherproof, Made in USA",N/A,$7.99,,4.9,12.0,False,https://m.media-amazon.com/images/I/71ow5xeYQNL._AC_UL320_.jpg,https://m.media-amazon.com/images/I/71ow5xeYQNL._AC_SL1500_.jpg,,2026-04-21T11:14:06.903828,
62,2,SP,9.0,,B0FZBL5MVW,"Custom car Magnets for Businesses 2 Pack | Personalized Magnetic car Signs | with Full Color Image, Text and Logo |Effective Advertising Signs | Various Size | Weather-Resistant (3"" X 10"")",N/A,$12.99,,4.8,20.0,False,https://m.media-amazon.com/images/I/61ldtFAQhhL._AC_UL320_.jpg,https://m.media-amazon.com/images/I/61ldtFAQhhL._AC_SL1500_.jpg,,2026-04-21T11:14:06.907189,
63,2,SP,10.0,,B0GLTQLWV1,"VSE Custom Vehicle Door Cling/Magnet Signs | Various Dimensions | Reusable Industrial Signs for Car Truck Van, Weatherproof UV (24"" W x 12"" H | 2 Pack)",N/A,$54.95,,,,False,https://m.media-amazon.com/images/I/51dOPeoOgEL._AC_UL320_.jpg,https://m.media-amazon.com/images/I/51dOPeoOgEL._AC_SL1500_.jpg,,2026-04-21T11:14:06.910561,
64,2,SP,11.0,,B0BXZBXXVH,"Custom Car Magnet 12"" x 18"" 30 Mil - 2 Pack Magnetic Business Magnets for Vehicles & Trucks - Custom Vehicle Magnetic Door Sign - Upload Your Logo and Add Text - Made in USA - Magnet Me Up",N/A,$40.49,,4.3,186.0,False,https://m.media-amazon.com/images/I/71UKOPZ5X-L._AC_UL320_.jpg,https://m.media-amazon.com/images/I/71UKOPZ5X-L._AC_SL1500_.jpg,,2026-04-21T11:14:06.913918,
65,2,SP,12.0,,B09MMH51DF,"LOVIMAG Magnetic Hooks, 12 Pack 30lbs+ Magnet Hook 2026 Cruise Cabin Ship Essentials Heavy Duty Strong Magnets Refrigerator Fridge Hanging for Classroom Beach Vacation Kitchen Grills (Black)",N/A,$6.28,,4.4,11619.0,False,https://m.media-amazon.com/images/I/71c36WQA9tL._AC_UL320_.jpg,https://m.media-amazon.com/images/I/71c36WQA9tL._AC_SL1500_.jpg,,2026-04-21T11:14:06.917730,
67,2,Title,,,,Debug info copied.Sponsored16PCS Funny Pride Gay Car Bumper Magnets: Bulk Magnetic Rainbow Decals De,,,,,,False,,,,2026-04-21T11:14:06.919134,
68,2,Title,,,,Previous123...6Next,,,,,,False,,,,2026-04-21T11:14:06.919512,
69,2,SB,3.0,,,N/A,https://aax-us-east-retail-direct.amazon.com/x/c/JFSlzFcydBHM8z0e_IMlYiQAAAGdr79AwgEAAAH2AQBvbm9fdHhuX2JpZDEgICBvbm9fdHhuX2ltcDIgICAf-rYf/clv1c_ek-YBIHXFcbWDn2nI5drJ16WtD5jqoAH4mm1yNTCTwBHcpQXjqqfU-6aJ7sdUMH5yv75YAW5Z1k38IO-rZxJyxMb023COCKPfyGrl1LWHtQXv4kDWUh6BGXCwlk3I2QA_FoWgFCyKmlJwQGgJU726sJLoN6Gqi2quaD4f7fuy4QZFQMS7ImyUX_8b_t2lzGMKBQnakJWHStgZX2tN8qhOdgxHdC5ooynyQCkOQ3gEYwmw4PTMuCHMWUJPGDnXpHAyvax1VLhjGNxX2RrkcBIW8aRxtXmVY59XKarYY6S0Z1WExcKH3KPGxB9F12xKZemOyE8xN7Rp8om5eB6BbsU-ccy2krYWwLYc4UpQJrBbVUfHhzJSKS1xVCQspVawqCOagnZtBkAvYthsz4nJrb2SOERCSP0qNYjf_yTnHvk6sxSOjpuDssTpPJCCu1OYzUQ7pnqz3v7ChX89WYkUhFzj4XIBmmxrEdjKgnnU1F8JKJmYT2QAyMWYfslWboV2JehH2gDtAf8PrE5FfGz0eUR6CAvrhkpW-QtntX21etZ3PgbrQb47wo6d7QC25ZN7CaHYBDwo6AP92_Sfqrrkky5f4Ss2e1vRkGQBzI9YEqrpfnunHAPlSgjzVn5YK_I3aBv86VUNaHZbmmp7uSdCBo6ya0IIDyC7rDNbldlbLN_BsH5PhvfWO4u6SDz72gEDb5heL2ssHPDcId6qRldzp_fxeie3XkCrqSinieFUm2SuZjJkMacIa8um1stpWiNoKUmuU7rmOL-kWcSiu3M3GgScXUK9ycT57qXh4RYtK63FcFXcBkmPzyGff3HHnH8nC99i-7dSzO0j04mVaj8NohpF7gEZmhAEZ7LLe5BIfAJlzERMAXLEtl5Ww6aDpqovxqT5g-pw4nQ0DRlvNRRfnvh56UkR_lshb0sOOPtd9I5z5VmCphuwxmu9myeMhecROpTUJF1FK9uT1eGB7xgWcLzEuWbGOO8weEAcfWQMjzWge6mvv3Sm7x1S0qFPZcaJUj2VrHmwnghdkD56m1xlSTZZQ-8de26nYZvuY_Cz2btH6P9VCvR3oNMuqBKKwhDP9YJLchCQ7d1NYJf3T3ecSQDeFrflyaWqYqnAL5-gvd911Agv_1tAcXRlB7M7y9aaKoP50Yij1uecfho6PKIUQ6BSxynux4jR-WgqmYtjj6VU2wfGKcgnWp6q7SgxTvsvq0v_9AvDLwWOBN8s673l59F-xy_rh6U_fKL7Mh1V-IANdpvHqZpUgJcRI8vOfNcZabVBGco8vGCDWfZ7V7jT8U8BC1juEB0W39MCcAgL86VolQ291Iut3sfdKFN6nMQvj0rpQRI4gaWAy9jrmZuZLlTXR_eX7P3K1qapgaboUtH1Ubbejx2FQlWJPIz94Bn_ZS_2ZElKtR3q5Snnm1rFArxnQDCNwIHHFmCdj4dHyIHYLjatdGhVSvEaL7XcX0TTSuu1KfWWh7fXht5VH3WStFW2MPciJXD76jq6kwRZmrCeupqP8M8xjIAinqvqriVm4HzIVqBiSQyJD0BIQzpDMIhkSYG5OIVNh2LYuN4d94PXH5Cg2C4VEAD3DXGB2VXWrPGGRYA4aGOQBtHrgenr0R6YDlaejQwRVG4RChiSZUxW7c5Imw-e9k52yLk-Uwz8QuShC9WLw/https://www.amazon.com/stores/page/9D6717CC-CF2D-444A-9174-90925EAAF895/?_encoding=UTF8&store_ref=SB_A060666427GW4SOGJVTWZ-A03273971K79WTLXXTKQ3&pd_rd_plhdr=t&aaxitk=34d19618a01dcd9c9f964c8b0934426b&hsa_cr_id=0&lp_asins=B0G5B6MM22%2CB0BL7316GD%2CB0BL6XL5QZ&lp_query=gay%20magnets%20for%20car%20prank&lp_slot=desktop-hsa-3psl&ref_=sbx_be_s_3psl_mbd_mb0_bkgd&pd_rd_w=uItLH&content-id=amzn1.sym.cd7c548b-a599-426f-9ffe-daa1aa803c87%3Aamzn1.sym.cd7c548b-a599-426f-9ffe-daa1aa803c87&pf_rd_p=cd7c548b-a599-426f-9ffe-daa1aa803c87&pf_rd_r=HH5ZYXE8NN59CHA78D8A&pd_rd_wg=YSQMo&pd_rd_r=78f593d2-4ccf-4b5c-a5a2-79374642ee1b,,,,,False,,,N/A,2026-04-21T11:14:06.925432,
70,2,Title,,,,Need help?Visit the help sectionorcontact us,,,,,,False,,,,2026-04-21T11:14:06.926033,
0,3,SB,4.0,,,Screwdriver Head Magnetic Ring,https://aax-us-east-retail-direct.amazon.com/x/c/JJBUfknI72UKz3FpruUYEYEAAAGdr7-EJAEAAAH2AQBvbm9fdHhuX2JpZDQgICBvbm9fdHhuX2ltcDIgICB_E0ZN/clv1c_ek-wBIHXFcbWDn2nI4trJ16WtD5jqoDm-NoVylVg3ylVjrYjtOP-Nv_V6ufV7AtWp0ncqzQqFxTyZQdD9SYMkGWxW4iJyyoKGSkH6OXcWu9wiByWJ8RSLa749rUcdgs0ciXcp-qPgh2uYuZzueNU7rT7INyEhpXyWiSQzrKk9MrP-QBk1sw7QBc5uNoEjJW0tWCbxFOrf0ZLmGH3gwSTYGKpFfeXAHLHNkdwKts38VQcTBb8Zf4yT7T1bF_zM9pNFIxCseYksRh5pQ-RcnFKUALHoTiVYAMREpP84AFAJj6Eu6-4Ery4oJJfMEcCqL2QGroTTGZJ4IB9UiT_JnZ8wd54Dhvf5rRCbWHVVNGNjm7cPLOaOz-HQtNT1eq7MSdFyhedUQJjiSq_ubXH7Y77lwDuTqWoY65W0bMABEhwkVTgrEaD6Oz0ZiKTzzIr13YlXR2H5EfUnxQr7DNLcDhjnH8qU_aBJuCzgODNuIXAFt02R5tp6msYcEjRbZ8o4R6TVwBCArL5O2iQooLSfUckjqOiubFk5qc3tuGpun26B0nzZNz0IdDIsFDWdi6Y2xavrK7KNue5QKo_Iz_zCOFjLu8jCntoJtSbYIZlj0sAZzqySuIGF_eXHDvMW_VR60pyuw5p-rzijtEVXAGI3ng0CL0NKfgB7dWWCLkoSr4zXKOM73xYkENVKS2nHJGzexZgrWe2nbbuTgxwry2wWFFLllvbnh-QVJp6k9dx1J7x7oY6-zvtbpzYmeOn2j_PZlG9mB1P5D7jPqR9m2uZDwTDvNepROPLhIYVndquSzzzbiebKGw6l18HHDqgrxFVh2TtrojR-kcTZO6EcyDPrs_gFOtgtomqhz_EFb1veEogoLwfGtvxUQ7UJmLEF6bYCHZBeU13XI3OPaQ0-wNygUTvUNp3dzAF37J9n4dxNfITATDTICoM8Q9VYhxlZY9cBP5EsQpMbGnOrBC8bsWOUxvfyWxkLcf933W2vkawOUuWfh8i63VJ3uj9SJqUBmwK4OTkc9jc-7yZMG4Reh6QVU911faG9Ysw1b_DHzaUJOcl53pPlzqyMNm8nc5GaUAEwSEQ0hiGMQrh5_w1K2GwgoMOtDHE12Voe8Cft17nfMx-mVKwlSBBr83EWvbyyq_c3XzIZwXw-Bah3zTs5UR8Ia8VadMyq4PvSBr5pJ2lsKp1MnTf7e0zoA-Arr4lcsByvOqHX8oFXiMISgFHDh3mT7EVub19flNwEz63OrINcg-RGGTtmLCtXlGIZBwaWwfgYZXyVrt1D_OOnxr_qsRYiGCQ0re3MD2YmsYBc_LJmskfKlvXQK-JfJi2pi9NF7VIzcE2yMxOiTYSmblSmbsIlZgpOgcbPaifV89iDJB7B61cSEJJMALysTdeNdHthYMA5DI9wNW97rUX-y3xPt-wAjIP1DOtcai1Xl3COrcvPqWK6BcZk3wuIzYOaAOAnKFqHcCOf-x8d3vhGQ6K5aw9yUkSADtJGxw1Cvp-ZYf-5a2-NJ08JF4DSHOyyBh2J6DMZSwdCJET0uqO6FZMyJ9-6frJosplMDGE01M09YPQo-PPVUxC1Kpeffw83lEQLIT9TAT_LmMZkjYJMYuzmGbp_2mZC_0hrmTkPldegRgyDYzeaWuHxsVqsAIGhsXCL_bL_MBL5ksYdVJl3Qblok02-9SdY0x-aJdJfg/https://www.amazon.com/stores/page/24B37DA0-75AB-40CC-9A3E-216DE07E01AE/?_encoding=UTF8&store_ref=SB_A07103153PTVMWBFZ2WPA-A01624643ORISA4LIGNK9&pd_rd_plhdr=t&aaxitk=e5fa83a8e7f17c6ecbccdb122226ebc6&hsa_cr_id=0&lp_asins=B0GSDLQBSF%2CB0GSF294YK%2CB0GSF4MGYG&lp_query=gay%20magnets%20for%20car%20prank&lp_slot=auto-sparkle-hsa-tetris&ref_=sbx_s_sparkle_sbtcd_bkgd&pd_rd_w=jEUiY&content-id=amzn1.sym.cc961e39-6f5f-411e-8135-81c6c1187ac0%3Aamzn1.sym.cc961e39-6f5f-411e-8135-81c6c1187ac0&pf_rd_p=cc961e39-6f5f-411e-8135-81c6c1187ac0&pf_rd_r=58HRSDX7G8X22J6DBGK6&pd_rd_wg=weRKk&pd_rd_r=5d4d8122-e706-4f05-8c2b-de58547d25f2,,,,,False,"https://m.media-amazon.com/images/S/al-na-9d5791cf-3faf/8e456373-f8c3-4467-af44-55e9a84e6927._CR0,0,2048,2048_AC_SX130_SY60_CB1169409_QL70_.jpg",,Screwdriver Head Magnetic Ring,2026-04-21T11:14:23.941992,3.0
1,3,Title,,,,ResultsCheck each product page for other buying options.,,,,,,False,,,,2026-04-21T11:14:23.942599,
3,3,SP,13.0,,B0FGX214V2,"Graduation Birthday Gift for Her, Emotional Rainbow Support Birthday Gifts for Teen Women Friend LGBTQ Gay, Positive Crochet Rainbow Pride for Administrative Professionals Encouragement Present",N/A,$9.98,,4.6,18.0,False,https://m.media-amazon.com/images/I/817V00j8irL._AC_UL320_.jpg,https://m.media-amazon.com/images/I/817V00j8irL._AC_SL1500_.jpg,,2026-04-21T11:14:23.945389,
4,3,SP,14.0,,B0FGX429RM,"Mothers Day Birthday Gifts for Pride LGBTQ+ Trans LGBT Gay Non Binary Lesbian Bisexual Transgender, Graduation Gift for Him Her Adults Lovers Prides Proculsexual Couple, Handmade Rainbow Present",N/A,$9.98,,5.0,4.0,False,https://m.media-amazon.com/images/I/81wHpeXCdBL._AC_UL320_.jpg,https://m.media-amazon.com/images/I/81wHpeXCdBL._AC_SL1500_.jpg,,2026-04-21T11:14:23.948396,
