data_index,page,ad_type,ad_rank,organic_rank,asin,title,url,price_current,price_list,rating_stars,rating_count,is_prime,image_small,image_large,brand_name,scraped_at
46,3,Organic,,140.0,B09VNB86JW,Be Careful Who You Hate It Could Be Someone You Love | LGBT Magnet | Great Gift Idea|Single |5 Inch Magnet | Made in The USA | Car Auto Tool Box Refrigerator Magnet|S10340,N/A,$6.95,,4.8,145.0,False,https://m.media-amazon.com/images/I/619uIwKVLtL._AC_UL320_.jpg,https://m.media-amazon.com/images/I/619uIwKVLtL._AC_SL1500_.jpg,,2026-04-21T11:12:30.684244
47,3,Organic,,141.0,B09M7NPHL7,Gear Tatz - Bear Pride Flag - LGBTQ Pride Car Magnet - 3.25 x 4.75 inches - Professionally Made in the USA - Magnetic Car Decal,N/A,$13.50,,5.0,1.0,False,https://m.media-amazon.com/images/I/41Hsf+mY3SL._AC_UL320_.jpg,https://m.media-amazon.com/images/I/41Hsf+mY3SL._AC_SL1500_.jpg,,2026-04-21T11:12:30.689026
48,3,Organic,,142.0,B0G2T1RVMP,"Magnet Gay Unicorn LGBT Pride Flag LGBT I'm Not Gay I'm Super Gay Magnetic Vinyl Sticker Decal 5""",N/A,$5.95,,,,False,https://m.media-amazon.com/images/I/51If8NRk0lL._AC_UL320_.jpg,https://m.media-amazon.com/images/I/51If8NRk0lL._AC_SL1500_.jpg,,2026-04-21T11:12:30.692619
49,3,Organic,,143.0,B01BPMDTIQ,"CafePress Rainbow Gay Pride Flag Car Magnet 10 X 3 10"" x 3"", Bumper Magnet",N/A,$9.99,,4.5,12.0,False,https://m.media-amazon.com/images/I/21q-63MXqyL._AC_UL320_.jpg,https://m.media-amazon.com/images/I/21q-63MXqyL._AC_SL1500_.jpg,,2026-04-21T11:12:30.695885
50,3,Organic,,144.0,B0DZNN7DGW,"Magnet Gay Pride Flag NASA Logo Magnetic Bumper Sticker 5""",N/A,$4.95,,,,False,https://m.media-amazon.com/images/I/51hQXY1qNhL._AC_UL320_.jpg,https://m.media-amazon.com/images/I/51hQXY1qNhL._AC_SL1500_.jpg,,2026-04-21T11:12:30.698973
51,3,Title,,,,Previous1234...7Next,,,,,,False,,,,2026-04-21T11:12:30.700125
52,3,Title,,,,Need help?Visit the help sectionorcontact us,,,,,,False,,,,2026-04-21T11:12:30.700404
0,4,Title,,,,ResultsCheck each product page for other buying options. Price and other details may vary based on p,,,,,,False,,,,2026-04-21T11:12:48.100140
2,4,Organic,,145.0,B0CF2S19WW,"I'm Gay Rainbow Heat Change Mug - Funny Rude Mug - Message Appears as it Heats - Perfect Novelty Gag Gift, best funny gifts and pride accessories",N/A,$19.99,,4.0,2703.0,False,https://m.media-amazon.com/images/I/71pMNLHAYjL._AC_UL320_.jpg,https://m.media-amazon.com/images/I/71pMNLHAYjL._AC_SL1500_.jpg,,2026-04-21T11:12:48.107072
3,4,Organic,,146.0,B0CFJY741D,"Gay Pride Dancing Skeleton Bumper Sticker Vinyl Decal 5""",N/A,$4.95,,5.0,1.0,False,https://m.media-amazon.com/images/I/51xduf-mCaL._AC_UL320_.jpg,https://m.media-amazon.com/images/I/51xduf-mCaL._AC_SL1500_.jpg,,2026-04-21T11:12:48.111430
4,4,Organic,,147.0,B0982HY7JH,LGBT Faith Ichthus Gay Pride Bumper Sticker - LGBTQ Rainbow Fish Life Premium Vinyl Decal 3 x 3 For Car Auto LGBTQIA Flag Christian Jesus Cross Bible Outdoor Sign + Better Than Magnets Sticks Anywhere,N/A,$8.49,,5.0,4.0,False,https://m.media-amazon.com/images/I/71U3+y-eE9S._AC_UL320_.jpg,https://m.media-amazon.com/images/I/71U3+y-eE9S._AC_SL1500_.jpg,,2026-04-21T11:12:48.117350
5,4,Title,,,,More results,,,,,,False,,,,2026-04-21T11:12:48.117895
6,4,Organic,,148.0,B0BRSXVTWC,LGBT Paw Gay Pride Bumper Sticker – Doggy & Kitty Be You LGBTQ Premium Vinyl Decal 3 x 3 for Cars Auto LGBTQIA Coexist Equality Rainbow Flag Pet Cat Dog Puppy + Better Than Magnets Sticks Anywhere,N/A,$8.49,,4.6,23.0,False,https://m.media-amazon.com/images/I/71fEizIaCtL._AC_UL320_.jpg,https://m.media-amazon.com/images/I/71fEizIaCtL._AC_SL1500_.jpg,,2026-04-21T11:12:48.123612
7,4,Organic,,149.0,B0DXTFGWQ5,"3 Pcs Rainbow Mountain Sunset Sticker, Gay Sticker, LGBT, LGBTQ Pride Stickers, Mountain Hiking Camping Stickers, Aesthetic Nature Vinyl Decal for Laptop Car Water Bottle, Pride LGBTQ+ (Normal, 3x3)",N/A,$8.99,,5.0,5.0,False,https://m.media-amazon.com/images/I/61lAFK+TWlL._AC_UL320_.jpg,https://m.media-amazon.com/images/I/61lAFK+TWlL._AC_SL1500_.jpg,,2026-04-21T11:12:48.128498
8,4,Organic,,150.0,B0G2RV8BM9,"Magnet Baseball Ball Gay Pride LGBT Magnetic Vinyl Sticker Decal 5""",N/A,$5.95,,,,False,https://m.media-amazon.com/images/I/61xNzvW8gsL._AC_UL320_.jpg,https://m.media-amazon.com/images/I/61xNzvW8gsL._AC_SL1500_.jpg,,2026-04-21T11:12:48.132339
9,4,Organic,,151.0,B0FVJ6TBB2,"Progress Pride LGBTQ+ Flag Car Magnet, Vinyl Weather-Resistant Bumper Sticker with Intersex Ring Design, Rainbow Colors, 3x5 Inches (1, Magnetic)",N/A,$13.50,,,,False,https://m.media-amazon.com/images/I/51BWTN-J5VL._AC_UL320_.jpg,https://m.media-amazon.com/images/I/51BWTN-J5VL._AC_SL1500_.jpg,,2026-04-21T11:12:48.137429
10,4,Organic,,152.0,B073TP4M45,"Pride Gay Lesbian Rainbow Flag Chrome Emblem 3D auto Decal car Bike Boat 5.3""",N/A,$15.99,,4.7,191.0,False,https://m.media-amazon.com/images/I/51xq1qUVMsL._AC_UL320_.jpg,https://m.media-amazon.com/images/I/51xq1qUVMsL._AC_SL1500_.jpg,,2026-04-21T11:12:48.143561
11,4,Organic,,153.0,B0D9C545PY,The World Has Bigger Problems Than Gay People Magnet - LGBTQ Pride Ally Love Rainbow Flag Magnet - Car Truck Bumper Fridge Metal Surface Magnet - 5 Inches On Longest Side - Made in USA - AAMT0097,N/A,$6.95,,,,False,https://m.media-amazon.com/images/I/71DJKfCEY0L._AC_UL320_.jpg,https://m.media-amazon.com/images/I/71DJKfCEY0L._AC_SL1500_.jpg,,2026-04-21T11:12:48.147792
12,4,Organic,,154.0,B0G2RTF5TP,"Magnet Honk If Youâ€™Re Gay Magnetic Vinyl Sticker Decal 5""",N/A,$5.95,,,,False,https://m.media-amazon.com/images/I/51iFKxVNoZL._AC_UL320_.jpg,https://m.media-amazon.com/images/I/51iFKxVNoZL._AC_SL1500_.jpg,,2026-04-21T11:12:48.150867
13,4,Organic,,155.0,B07LC486RS,Gear Tatz - PROUD PARENT of A GAY DAUGHTER - LGBTQ Pride CAR MAGNET - 2.75 X 9.5 inches - Professionally Made in The USA - Magnetic Decal,N/A,$12.99,,4.8,10.0,False,https://m.media-amazon.com/images/I/51gdKTePN6L._AC_UL320_.jpg,https://m.media-amazon.com/images/I/51gdKTePN6L._AC_SL1500_.jpg,,2026-04-21T11:12:48.155393
14,4,Organic,,156.0,B0DZN7PXZ4,"Magnet Gay Pride Rocket Magnetic Bumper Sticker 5""",N/A,$4.95,,,,False,https://m.media-amazon.com/images/I/61vtItbseSL._AC_UL320_.jpg,https://m.media-amazon.com/images/I/61vtItbseSL._AC_SL1500_.jpg,,2026-04-21T11:12:48.159704
15,4,Organic,,157.0,B094V53DLV,LGBT Unicorn Bumper Sticker - Gay Pride Be You Be Proud Premium Vinyl Decal 3 x 3 LGBTQ Rainbow for Car Auto LGBTQIA Inclusive Equality Coexist Flag Sign USA + Better Than Magnets Sticks Anywhere,N/A,$8.49,,4.4,14.0,False,https://m.media-amazon.com/images/I/71W4f0jMknS._AC_UL320_.jpg,https://m.media-amazon.com/images/I/71W4f0jMknS._AC_SL1500_.jpg,,2026-04-21T11:12:48.165176
16,4,Organic,,158.0,B099MCJPGM,Hilarious Gay Pride Prank Two Magnets - Follow Me to The Gay Bar and I Love Gay Porn - First Time Driver Friend Bro Social Media New Car Truck Auto Removable Bumper Magnets Bundle,N/A,$9.99,,4.3,15.0,False,https://m.media-amazon.com/images/I/719uluwAnLS._AC_UL320_.jpg,https://m.media-amazon.com/images/I/719uluwAnLS._AC_SL1500_.jpg,,2026-04-21T11:12:48.170181
17,4,Organic,,159.0,B08QGXLMGT,Dismantle The Patriarchy Bumper-Sticker – Challenge Entrenched Biases Against Women Equality Vinyl Decal 6 x 2 | for Car Auto Trans LGBT Gay Pride Equal Pay BLM + Better Than Magnets Sticks Anywhere,N/A,$8.49,,4.3,66.0,False,https://m.media-amazon.com/images/I/715kFmg7DqL._AC_UL320_.jpg,https://m.media-amazon.com/images/I/715kFmg7DqL._AC_SL1500_.jpg,,2026-04-21T11:12:48.176958
18,4,Organic,,160.0,B08P3MDNV4,Yin-Yang Tree of Life LGBT Bumper Sticker – LGBTQ Gay Pride Life Rainbow Premium Vinyl Decal 3 x 3 for Car Auto Equality LGBTQIA Coexist Peace Love Flag Sign + Better Than Magnets Sticks Anywhere,N/A,$8.49,,4.5,98.0,False,https://m.media-amazon.com/images/I/81N3ihzjf9L._AC_UL320_.jpg,https://m.media-amazon.com/images/I/81N3ihzjf9L._AC_SL1500_.jpg,,2026-04-21T11:12:48.183736
19,4,Organic,,161.0,B0G2RQPCH3,"Magnet Woke Up Gay Again Magnetic Vinyl Sticker Decal 5""",N/A,$5.95,,,,False,https://m.media-amazon.com/images/I/51zaj9aPy4L._AC_UL320_.jpg,https://m.media-amazon.com/images/I/51zaj9aPy4L._AC_SL1500_.jpg,,2026-04-21T11:12:48.187796
20,4,Organic,,162.0,B07KZX6NP1,"Magnet Trump MAGA GOP 2020 Made Me Gay (LGBTQ Pride) Magnet Vinyl Magnetic Sheet for Lockers, Cars, Signs, Refrigerator 5""",N/A,$6.95,,3.5,9.0,False,https://m.media-amazon.com/images/I/41IEaEktL3L._AC_UL320_.jpg,https://m.media-amazon.com/images/I/41IEaEktL3L._AC_SL1500_.jpg,,2026-04-21T11:12:48.193059
21,4,Organic,,163.0,B0C6JM3F29,"Cops are Gay LGBT Funny Apparel Bumper Sticker Vinyl Decal 5""",N/A,$4.95,,4.7,10.0,False,https://m.media-amazon.com/images/I/51SEYVgQrrL._AC_UL320_.jpg,https://m.media-amazon.com/images/I/51SEYVgQrrL._AC_SL1500_.jpg,,2026-04-21T11:12:48.196571
22,4,Organic,,164.0,B0G2RV64ZD,"Magnet Gay Mlm Pride Heartbeat Magnetic Vinyl Sticker Decal 5""",N/A,$5.95,,,,False,https://m.media-amazon.com/images/I/31sXTuFuxxL._AC_UL320_.jpg,https://m.media-amazon.com/images/I/31sXTuFuxxL._AC_SL1500_.jpg,,2026-04-21T11:12:48.200106
23,4,Organic,,165.0,B0CG574GLW,"Bee Kind Lgbtq Ally Gay Pride Rainbow Bumblebee Positivity Sticker Vinyl Waterproof Sticker Decal Car Laptop Wall Window Bumper Sticker 5""",N/A,$4.95,,4.6,9.0,False,https://m.media-amazon.com/images/I/611HSlk1fXL._AC_UL320_.jpg,https://m.media-amazon.com/images/I/611HSlk1fXL._AC_SL1500_.jpg,,2026-04-21T11:12:48.204685
24,4,Organic,,166.0,B0C7LQ1GVY,"Overdecor Rainbow Gay Pride Flag Decal Sticker LGBT Emblem Flags for Car Bumper, 2 Pack",N/A,$9.99,,4.4,25.0,False,https://m.media-amazon.com/images/I/512-f+-XsJL._AC_UL320_.jpg,https://m.media-amazon.com/images/I/512-f+-XsJL._AC_SL1500_.jpg,,2026-04-21T11:12:48.208409
25,4,Organic,,167.0,B0CFHCT4K7,"Heartbeat Rainbow LGBT Love is Love Gay Pride Bumper Sticker Vinyl Decal 5""",N/A,$4.95,,4.6,16.0,False,https://m.media-amazon.com/images/I/51jYtBJS1YL._AC_UL320_.jpg,https://m.media-amazon.com/images/I/51jYtBJS1YL._AC_SL1500_.jpg,,2026-04-21T11:12:48.212891
26,4,Organic,,168.0,B0G2SZYGYF,"Magnet Nurse LGBT-Q Gay Pride Rainbow Flag Registered Nursing Rn Magnetic Vinyl Sticker Decal 5""",N/A,$5.95,,4.0,1.0,False,https://m.media-amazon.com/images/I/51GcHxpoPjL._AC_UL320_.jpg,https://m.media-amazon.com/images/I/51GcHxpoPjL._AC_SL1500_.jpg,,2026-04-21T11:12:48.218027
27,4,Organic,,169.0,B0B6MZ2XB4,BBTO 25 Pcs Car Magnet Decorations 60s Hippie Theme Party Magnetic Decals Fridge Magnets Flower Peace Sticker Love Sign Colorful for Refrigerator Mailbox (Car Style),N/A,$9.99,,4.5,434.0,False,https://m.media-amazon.com/images/I/812nC3J-dzL._AC_UL320_.jpg,https://m.media-amazon.com/images/I/812nC3J-dzL._AC_SL1500_.jpg,,2026-04-21T11:12:48.222403
28,4,Organic,,170.0,B08NHYNF6B,"Funny Gay Bumper Stickers - Great for Gags, Jokes, Gifts - Set of 4 | Sticker | 8"" x 3""",N/A,$6.99,,4.6,322.0,False,https://m.media-amazon.com/images/I/819+Seme1LL._AC_UL320_.jpg,https://m.media-amazon.com/images/I/819+Seme1LL._AC_SL1500_.jpg,,2026-04-21T11:12:48.227145
29,4,Organic,,171.0,B086SH5ZF4,"MAGNET Delaware State Shaped Gay Pride Rainbow Flag Sticker Lgbt De Magnetic Vinyl Car Fridge Sticks to any Metal Surface 5""",N/A,$5.95,,,,False,https://m.media-amazon.com/images/I/31TH2tcbbGL._AC_UL320_.jpg,https://m.media-amazon.com/images/I/31TH2tcbbGL._AC_SL1500_.jpg,,2026-04-21T11:12:48.230217
30,4,Organic,,172.0,B0CY8PYF3L,"CafePress Rainbow Stripe Diagonal Gay Pride Square Car Magnet, Magnetic Bumper Display",N/A,$8.99,,,,False,https://m.media-amazon.com/images/I/41X0BCBZ3CL._AC_UL320_.jpg,https://m.media-amazon.com/images/I/41X0BCBZ3CL._AC_SL1500_.jpg,,2026-04-21T11:12:48.234246
31,4,Organic,,173.0,B0DY2YLPHK,"Magnet Gay Pride LGBT Subtle Rainbow Stripe Flag 2018 LoveFest Magnetic Vinyl Sticker 5""",N/A,$5.95,,,,False,https://m.media-amazon.com/images/I/41GPi81xyQL._AC_UL320_.jpg,https://m.media-amazon.com/images/I/41GPi81xyQL._AC_SL1500_.jpg,,2026-04-21T11:12:48.238569
32,4,Organic,,174.0,B0D9CGC37H,I Love Gay Porn Magnet 3x10 Bumper Sticker Size Funny I Heart Porn Magnet - Rainbow,N/A,$11.99,,,,False,https://m.media-amazon.com/images/I/61Fx7m5GNpL._AC_UL320_.jpg,https://m.media-amazon.com/images/I/61Fx7m5GNpL._AC_SL1500_.jpg,,2026-04-21T11:12:48.242736
33,4,Organic,,175.0,B0DWXMSL2S,"3Pcs Sounds Gay I'm in Sticker Funny LGBTQ Rainbow Flag Sticker Inclusion Matters Gay Pride Love Equality Rights Stickers Sounds Gay Im in LGBT Decal for Laptop Bottle Phone Car Hard Hat 3""x3"" (S1)",N/A,$8.99,,5.0,5.0,False,https://m.media-amazon.com/images/I/6170QF+vmfL._AC_UL320_.jpg,https://m.media-amazon.com/images/I/6170QF+vmfL._AC_SL1500_.jpg,,2026-04-21T11:12:48.248132
34,4,Organic,,176.0,B0C78LJL9X,CafePress Honk for Gay Rights Rectangle Car Bumper Magnet,N/A,$7.99,,5.0,1.0,False,https://m.media-amazon.com/images/I/61twH6efkgL._AC_UL320_.jpg,https://m.media-amazon.com/images/I/61twH6efkgL._AC_SL1500_.jpg,,2026-04-21T11:12:48.252082
35,4,Organic,,177.0,B09SNCYF3D,Love is Love Rainbow Decorative LGBTQ+ Heavy Duty Gay Pride Bumper Sticker Car Magnet 3 inch (GT7849),N/A,$6.95,,3.6,8.0,False,https://m.media-amazon.com/images/I/61yM4W1CoEL._AC_UL320_.jpg,https://m.media-amazon.com/images/I/61yM4W1CoEL._AC_SL1500_.jpg,,2026-04-21T11:12:48.255953
36,4,Organic,,178.0,B0DK7T97JC,"CafePress Rainbow Butterfly Gay Pride Car Magnet 10 X 3 10"" x 3"", Bumper Magnet",N/A,$9.99,,,,False,https://m.media-amazon.com/images/I/21Zh2hzGEvL._AC_UL320_.jpg,https://m.media-amazon.com/images/I/21Zh2hzGEvL._AC_SL1500_.jpg,,2026-04-21T11:12:48.259555
37,4,Organic,,179.0,B08QDWDPJR,"Rainbow Cuddly Cow Gay Pride Bumper Sticker - LGBTQ LGBT Premium Vinyl Decal 3 x 3"" inch | for Cars Auto-mobiles Windows Bottles Mirrors Outdoor Circle Sign + Better Than Magnets Sticks Anywhere",N/A,$8.49,,4.8,30.0,False,https://m.media-amazon.com/images/I/81U4fOoTvDL._AC_UL320_.jpg,https://m.media-amazon.com/images/I/81U4fOoTvDL._AC_SL1500_.jpg,,2026-04-21T11:12:48.264767
38,4,Organic,,180.0,B086D3FNNJ,"MAGNET Iowa State Shaped Gay Pride Rainbow Flag Sticker Lgbt Ia Magnetic Vinyl Car Fridge Sticks to any Metal Surface 5""",N/A,$5.95,,5.0,1.0,False,https://m.media-amazon.com/images/I/31EIH63YUtL._AC_UL320_.jpg,https://m.media-amazon.com/images/I/31EIH63YUtL._AC_SL1500_.jpg,,2026-04-21T11:12:48.268891
39,4,Organic,,181.0,B078SK96FG,GRAPHICS & MORE Oh Deer I'm Queer Rainbow Pride Gay Lesbian Funny Automotive Car Refrigerator Locker Vinyl Circle Magnet,N/A,$8.99,,4.6,73.0,False,https://m.media-amazon.com/images/I/61B6X0fq0-L._AC_UL320_.jpg,https://m.media-amazon.com/images/I/61B6X0fq0-L._AC_SL1500_.jpg,,2026-04-21T11:12:48.273118
40,4,Organic,,182.0,B07NL36MHT,"ION Graphics Magnet Oregon State Shaped Gay Pride Rainbow Flag Magnetic Vinyl LGBT OR 5"" Car Magnet Bumper Sticker",N/A,$4.95,,5.0,4.0,False,https://m.media-amazon.com/images/I/319oCC9tjVL._AC_UL320_.jpg,https://m.media-amazon.com/images/I/319oCC9tjVL._AC_SL1500_.jpg,,2026-04-21T11:12:48.277192
41,4,Organic,,183.0,B08CTDFV95,Coexist Harmony Rainbow Sticker - Inclusive Premium Vinyl Decal | for Car Bumper Window Laptop Bottle Hydro-Flask + Celebrate Gay Pride LGBTQ+ Peace Love Star Cross Religion Yin-Yang Sign 6 x 2 inch,N/A,$8.49,,4.4,52.0,False,https://m.media-amazon.com/images/I/71SCAEwSdBL._AC_UL320_.jpg,https://m.media-amazon.com/images/I/71SCAEwSdBL._AC_SL1500_.jpg,,2026-04-21T11:12:48.282121
42,4,Organic,,184.0,B0D5H2Q5SW,52PCS Pride Stickers Rainbow Stickers LGBTQ Vinyl Sticker Gay Graffiti Sticker for Laptop Pride Decorations Rainbow Accessories,N/A,$5.99,,4.4,45.0,False,https://m.media-amazon.com/images/I/81fxk7pyRzL._AC_UL320_.jpg,https://m.media-amazon.com/images/I/81fxk7pyRzL._AC_SL1500_.jpg,,2026-04-21T11:12:48.286016
43,4,Organic,,185.0,B0D3M4PCXY,"CafePress Gay Pride Hearts Car Magnet 10 X 3 10"" x 3"", Bumper Magnet",N/A,$9.99,,,,False,https://m.media-amazon.com/images/I/211SzRIeOML._AC_UL320_.jpg,https://m.media-amazon.com/images/I/211SzRIeOML._AC_SL1500_.jpg,,2026-04-21T11:12:48.289660
44,4,Organic,,186.0,B0G2RQ17VJ,"Magnet Heartbeat Rainbow LGBT Love is Love Gay Pride Magnetic Vinyl Sticker Decal 5""",N/A,$5.95,,,,False,https://m.media-amazon.com/images/I/51jYtBJS1YL._AC_UL320_.jpg,https://m.media-amazon.com/images/I/51jYtBJS1YL._AC_SL1500_.jpg,,2026-04-21T11:12:48.293046
45,4,Organic,,187.0,B094XGPYNT,"Magnet LGBT+ Gay Pride Lovebird Bumper Sticker Car Flexible Reuseable Magnetic Vinyl 5""",N/A,$5.95,,4.5,10.0,False,https://m.media-amazon.com/images/I/51WfvKeFC6S._AC_UL320_.jpg,https://m.media-amazon.com/images/I/51WfvKeFC6S._AC_SL1500_.jpg,,2026-04-21T11:12:48.297110
46,4,Organic,,188.0,B08K2NMCZB,"Gay Panic Sticker Vinyl Bumper Sticker Decal Waterproof 5""",N/A,$4.95,,3.8,14.0,False,https://m.media-amazon.com/images/I/51bmZlygbTL._AC_UL320_.jpg,https://m.media-amazon.com/images/I/51bmZlygbTL._AC_SL1500_.jpg,,2026-04-21T11:12:48.300594
47,4,Organic,,189.0,B0F5QBC638,"3 Pcs Here I Go in My Gay Little Car Sticker – Funny LGBTQ+ Meme Bumper Sticker Vinyl Waterproof Decal for Laptop, Water Bottle, Phone, Car, Helmet, Notebook, Window – 5 Inch Cute Queer Humor Pack",N/A,$9.99,,5.0,3.0,False,https://m.media-amazon.com/images/I/51OAdm0pocL._AC_UL320_.jpg,https://m.media-amazon.com/images/I/51OAdm0pocL._AC_SL1500_.jpg,,2026-04-21T11:12:48.304328
48,4,Organic,,190.0,B08N33BZ6Q,LGBT Rainbow Heart Ears Love is Everything Sticker - Gay Pride Premium Vinyl Decal 3 X 3 Inch for Car Bumpers Auto Window Water Bottle Mirror Laptop LGBTQ BLM + Better Than Magnets - Sticks Anywhere,N/A,$8.49,,4.8,9.0,False,https://m.media-amazon.com/images/I/81cgDSq-Z9L._AC_UL320_.jpg,https://m.media-amazon.com/images/I/81cgDSq-Z9L._AC_SL1500_.jpg,,2026-04-21T11:12:48.308559
49,4,Organic,,191.0,B0G2R2ZMHX,"Magnet Womens I See I Love You I Accept You LGBT LGBTQ Ally Gay Pride V-Neck Magnetic Vinyl Sticker Decal 5""",N/A,$5.95,,,,False,https://m.media-amazon.com/images/I/51Z5tGHAiKL._AC_UL320_.jpg,https://m.media-amazon.com/images/I/51Z5tGHAiKL._AC_SL1500_.jpg,,2026-04-21T11:12:48.312630
50,4,Organic,,192.0,B0FH5RQVF7,Here I Go in My Gay Little Car Magnet Large 3x9 Bumper Sticker Size Funny LGBTQ Bumper Magnets,N/A,$13.95,,,,False,https://m.media-amazon.com/images/I/61aK7LaIpcL._AC_UL320_.jpg,https://m.media-amazon.com/images/I/61aK7LaIpcL._AC_SL1500_.jpg,,2026-04-21T11:12:48.317122
51,4,Title,,,,Previous1234567Next,,,,,,False,,,,2026-04-21T11:12:48.318116
52,4,Title,,,,Need help?Visit the help sectionorcontact us,,,,,,False,,,,2026-04-21T11:12:48.318329
0,5,Title,,,,ResultsCheck each product page for other buying options. Price and other details may vary based on p,,,,,,False,,,,2026-04-21T11:13:04.779823
2,5,Organic,,193.0,B0BSQMYVYX,25 Pieces Car Magnet Decorations 60s Hippie Theme Party Magnetic Decals Fridge Magnets Flower Peace Car Magnetic Sticker Love Sign Colorful Hippie Decals for Refrigerator Mailbox Decor,N/A,$11.99,,4.5,790.0,False,https://m.media-amazon.com/images/I/81OVLiuGpXL._AC_UL320_.jpg,https://m.media-amazon.com/images/I/81OVLiuGpXL._AC_SL1500_.jpg,,2026-04-21T11:13:04.783303
3,5,Organic,,194.0,B0DNJNPYGG,"BEATRI LGBT Pride Stickers 50Pcs Rainbow Vinyl Waterproof for LGBTQ Bi Trans Lesbian Pride Gay Decor & Party Favors for Laptop, Water Bottle & Travel Gear | Non-Repeating Decals, High-Definition Print",N/A,$6.99,,4.5,362.0,False,https://m.media-amazon.com/images/I/91cpRSvhsdL._AC_UL320_.jpg,https://m.media-amazon.com/images/I/91cpRSvhsdL._AC_SL1500_.jpg,,2026-04-21T11:13:04.787811
4,5,Organic,,195.0,B092PF2J5S,"Pride Stickers Bulk, 200 PCS Rainbow Sticker Packs for LGBTQ Gay Pride Stuff Accessories Celebration Parades Home Decor Party Supplies Festivals",N/A,$7.99,,4.7,791.0,False,https://m.media-amazon.com/images/I/81lJJpEVcBL._AC_UL320_.jpg,https://m.media-amazon.com/images/I/81lJJpEVcBL._AC_SL1500_.jpg,,2026-04-21T11:13:04.792631
6,5,Title,,,,New arrivalsSponsoredBased on items added in the past 60 daysPlease Be Patient Bisexual Driver Pride,,,,,,False,,,,2026-04-21T11:13:04.797825
7,5,Title,,,,More results,,,,,,False,,,,2026-04-21T11:13:04.798011
8,5,Organic,,196.0,B07NXW31HJ,"ION Graphics Magnet North Carolina State Shaped Gay Pride Rainbow Flag Magnetic Vinyl LGBT NC 5"" Car Magnet Bumper Sticker",N/A,$4.95,,5.0,3.0,False,https://m.media-amazon.com/images/I/31h2NwyNDHL._AC_UL320_.jpg,https://m.media-amazon.com/images/I/31h2NwyNDHL._AC_SL1500_.jpg,,2026-04-21T11:13:04.802831
9,5,Organic,,197.0,B0BSLR3PDT,Gay Pride Purride Paw Bumper Sticker - LGBT Rainbow Kitty Be You Premium Vinyl Decal 3 x 3 for Cars Auto-mobiles Windows LGBTQ Outdoor LGBTQIA Cat Dog Flag Sign + Better Than Magnets Sticks Anywhere,N/A,$8.49,,5.0,4.0,False,https://m.media-amazon.com/images/I/81zup5QohKL._AC_UL320_.jpg,https://m.media-amazon.com/images/I/81zup5QohKL._AC_SL1500_.jpg,,2026-04-21T11:13:04.807486
10,5,Organic,,198.0,B093P3NQGG,LGBT Unicorn Wanderer Bumper Sticker - Gay Pride Premium Vinyl Decal 3 x 3 Be You Be Proud LGBTQ Rainbow for Car Auto LGBTQIA Inclusive Equality Coexist Flag Sign Better Than Magnets Sticks Anywhere,N/A,$8.49,,4.1,21.0,False,https://m.media-amazon.com/images/I/81mE2RhAZDS._AC_UL320_.jpg,https://m.media-amazon.com/images/I/81mE2RhAZDS._AC_SL1500_.jpg,,2026-04-21T11:13:04.816560
11,5,Organic,,199.0,B0DZNBWW4X,"Magnet Lunar Gay Pride Flag Assembly Magnetic Bumper Sticker 5""",N/A,$4.95,,,,False,https://m.media-amazon.com/images/I/51PHJmgHUbL._AC_UL320_.jpg,https://m.media-amazon.com/images/I/51PHJmgHUbL._AC_SL1500_.jpg,,2026-04-21T11:13:04.821859
12,5,Organic,,200.0,B0G2RQ5LYJ,"Magnet Ally Cat Purride Rainbow Funny Cat Lover LGBT Gay Pride Magnetic Vinyl Sticker Decal 5""",N/A,$5.95,,,,False,https://m.media-amazon.com/images/I/51ZM6sR2AnL._AC_UL320_.jpg,https://m.media-amazon.com/images/I/51ZM6sR2AnL._AC_SL1500_.jpg,,2026-04-21T11:13:04.826448
13,5,Organic,,201.0,B09FQBYQ2V,Gear Tatz - Gay Veteran - LGBTQ Pride - Car Magnet - 2.75 x 9.75 inches - Professionally Made in The USA - Magnetic Decal,N/A,$12.99,,5.0,2.0,False,https://m.media-amazon.com/images/I/612gBxWeWnL._AC_UL320_.jpg,https://m.media-amazon.com/images/I/612gBxWeWnL._AC_SL1500_.jpg,,2026-04-21T11:13:04.831764
14,5,Organic,,202.0,B0B3QTDWR1,100pcs LGBTQ Sticker Rainbow Lesbian Bisexual Pansexual Transgender Stickers for Laptop Graffiti Vinyl Decals Sticker Toys,N/A,$5.99,,4.6,212.0,False,https://m.media-amazon.com/images/I/71s1V-4O2sL._AC_UL320_.jpg,https://m.media-amazon.com/images/I/71s1V-4O2sL._AC_SL1500_.jpg,,2026-04-21T11:13:04.835573
15,5,Organic,,203.0,B09H8THC7R,Pro-Choice Bumper Sticker - My Mind My Body My Choice Vinyl Decal 3 x 3 | for Car Auto BLM LGBT Women's Rights Equality Equal Pay Female Gay Pride Pink Flag Sign + Better Than Magnets Sticks Anywhere,N/A,$8.49,,4.6,43.0,False,https://m.media-amazon.com/images/I/71SR0I79JHL._AC_UL320_.jpg,https://m.media-amazon.com/images/I/71SR0I79JHL._AC_SL1500_.jpg,,2026-04-21T11:13:04.839818
16,5,Organic,,204.0,B0CG6RCZLP,"MAGNET I Love My Gay Dog Magnetic Sticker Vinyl Waterproof Magnet Decal Car 5""",N/A,$5.95,,,,False,https://m.media-amazon.com/images/I/51NiPzwG-OL._AC_UL320_.jpg,https://m.media-amazon.com/images/I/51NiPzwG-OL._AC_SL1500_.jpg,,2026-04-21T11:13:04.843808
17,5,Organic,,205.0,B0B38PB3NH,"MAGNET Sounds Gay I'm In Magnet Vinyl Magnetic Sticker 20 mil - Size 5""",N/A,$5.95,,,,False,https://m.media-amazon.com/images/I/41Imi8MRAuL._AC_UL320_.jpg,https://m.media-amazon.com/images/I/41Imi8MRAuL._AC_SL1500_.jpg,,2026-04-21T11:13:04.848991
18,5,Organic,,206.0,B0FQQMFWN7,"I'm Gay Rainbow Air Freshener - Funny Rude Air Freshener - Perfect Novelty Gag Gift, Best Funny Gifts and Pride Accessories (Pride)",N/A,$5.99,,5.0,14.0,False,https://m.media-amazon.com/images/I/61mCmDdSZPL._AC_UL320_.jpg,https://m.media-amazon.com/images/I/61mCmDdSZPL._AC_SL1500_.jpg,,2026-04-21T11:13:04.853223
19,5,Organic,,207.0,B0G2SYYZ3F,"Magnet Jollibee Peeking Gay Pride Flag Filipino Back Print Magnetic Vinyl Sticker Decal 5""",N/A,$5.95,,,,False,https://m.media-amazon.com/images/I/51Zp8g7ELqL._AC_UL320_.jpg,https://m.media-amazon.com/images/I/51Zp8g7ELqL._AC_SL1500_.jpg,,2026-04-21T11:13:04.856799
20,5,Organic,,208.0,B01BPN77RO,"CafePress Rainbow Gay Pride Flag Oval Car Magnet, Euro Oval Bumper Magnet",N/A,$9.99,,4.0,1.0,False,https://m.media-amazon.com/images/I/51C-ssbeVhL._AC_UL320_.jpg,https://m.media-amazon.com/images/I/51C-ssbeVhL._AC_SL1500_.jpg,,2026-04-21T11:13:04.861871
21,5,Organic,,209.0,B0GTC88KB5,"Gay Heading to Brunch Gonzo Muppets LGBTQ Pride Funny Quote Weekend Humor 5"" Magnetic Bumper Sticker Car Magnet",N/A,$5.95,,,,False,https://m.media-amazon.com/images/I/61FL8PUMB0L._AC_UL320_.jpg,https://m.media-amazon.com/images/I/61FL8PUMB0L._AC_SL1500_.jpg,,2026-04-21T11:13:04.866653
22,5,Organic,,210.0,B07FZM92JK,"MAGNET More Love Less Hate, Gay Pride, Lgbt Magnet Decal Fridge Metal Magnet Window Vinyl 5""",N/A,$5.95,,3.6,6.0,False,https://m.media-amazon.com/images/I/51qWBWcnbVL._AC_UL320_.jpg,https://m.media-amazon.com/images/I/51qWBWcnbVL._AC_SL1500_.jpg,,2026-04-21T11:13:04.871435
23,5,Organic,,211.0,B0GTC3XRJW,"Babadook Says Gay Rights LGBT Pride Ally Support Horror Movie 5"" Magnetic Bumper Sticker Car Magnet",N/A,$5.95,,,,False,https://m.media-amazon.com/images/I/51EUCEQDSJL._AC_UL320_.jpg,https://m.media-amazon.com/images/I/51EUCEQDSJL._AC_SL1500_.jpg,,2026-04-21T11:13:04.876372
24,5,Organic,,212.0,B07NYT3Q4H,"ION Graphics Magnet Iowa State Shaped Gay Pride Rainbow Flag Magnetic Vinyl LGBT IA 5"" Car Magnet Bumper Sticker",N/A,$4.95,,5.0,1.0,False,https://m.media-amazon.com/images/I/31DQ56lETjL._AC_UL320_.jpg,https://m.media-amazon.com/images/I/31DQ56lETjL._AC_SL1500_.jpg,,2026-04-21T11:13:04.879847
25,5,Organic,,213.0,B0FMNKXPJD,"130PCS Pride LGBTQ+ Stickers Pack, Rainbow Love Trans Vinyl Decals for Bottles, Laptops, Skateboard and Notebook for Teens, Kids, Adults",N/A,$7.99,,4.7,10.0,False,https://m.media-amazon.com/images/I/91ypZtOtiCL._AC_UL320_.jpg,https://m.media-amazon.com/images/I/91ypZtOtiCL._AC_SL1500_.jpg,,2026-04-21T11:13:04.885300
