data_index,page,ad_type,ad_rank,organic_rank,asin,title,url,price_current,price_list,rating_stars,rating_count,is_prime,image_small,image_large,brand_name,scraped_at
26,5,Organic,,214.0,B093DYY37R,"Magnet Gay Pride Tiger Magnet Bumper Sticker Car Magnet Flexible Reuseable Magnetic Vinyl 5""",N/A,$5.95,,,,False,https://m.media-amazon.com/images/I/61VeGz5gOqL._AC_UL320_.jpg,https://m.media-amazon.com/images/I/61VeGz5gOqL._AC_SL1500_.jpg,,2026-04-21T11:13:04.889967
27,5,Organic,,215.0,B0CXWWFTVQ,"MARFOREVER 200 Pcs LGBT Pride Stickers, LGBTQ+ Stickers Rainbow Sticker Bulk for Pride Month Lesbian Bisexual Sticker Vinyl Waterproof Gay Pride-Stuff for Water Bottle Laptop Skateboard Guitar Car",N/A,$6.99,,4.3,137.0,False,https://m.media-amazon.com/images/I/81pcuN3xszL._AC_UL320_.jpg,https://m.media-amazon.com/images/I/81pcuN3xszL._AC_SL1500_.jpg,,2026-04-21T11:13:04.895405
28,5,Organic,,216.0,B0BJPJ81J7,"Pride Stickers, 200 PCS Mixed All Kind of LGBTQ+ Stickers Bulk for Trans Bi Lesbian LGBTQ Gay Pride Stuff Accessories Celebration Parades Home Decor Party Supplies Festivals",N/A,$6.99,,4.8,490.0,False,https://m.media-amazon.com/images/I/91iyZ8xtI9L._AC_UL320_.jpg,https://m.media-amazon.com/images/I/91iyZ8xtI9L._AC_SL1500_.jpg,,2026-04-21T11:13:04.899460
29,5,Organic,,217.0,B0B2MNBNYH,"MAGNET Sounds Gay Im In Magnet Vinyl Magnetic Sticker 20 mil - Size 5""",N/A,$5.95,,,,False,https://m.media-amazon.com/images/I/41Mcsv4sFyL._AC_UL320_.jpg,https://m.media-amazon.com/images/I/41Mcsv4sFyL._AC_SL1500_.jpg,,2026-04-21T11:13:04.903611
30,5,Organic,,218.0,B0DPD3L243,I Love Anal Magnet Large 3x10 Bumper Sticker Size Gay Joke Prank Gag Magnets - White,N/A,$11.95,,,,False,https://m.media-amazon.com/images/I/41yaiXXpyTL._AC_UL320_.jpg,https://m.media-amazon.com/images/I/41yaiXXpyTL._AC_SL1500_.jpg,,2026-04-21T11:13:04.907733
31,5,Organic,,219.0,B0G5FTRZVK,I Climbed Brokeback Mountain Magnet Large 3x9 Bumper Sticker Size Funny Gay Magnets,N/A,$13.95,,,,False,https://m.media-amazon.com/images/I/51iqxWHGX+L._AC_UL320_.jpg,https://m.media-amazon.com/images/I/51iqxWHGX+L._AC_SL1500_.jpg,,2026-04-21T11:13:04.911950
32,5,Organic,,220.0,B01DDYYTBA,"CafePress Gay Colors Christian Fish Sticker Car Magnet 10 X 10"" x 3"", Bumper Magnet",N/A,$9.99,,,,False,https://m.media-amazon.com/images/I/31uwBjB55LL._AC_UL320_.jpg,https://m.media-amazon.com/images/I/31uwBjB55LL._AC_SL1500_.jpg,,2026-04-21T11:13:04.915519
33,5,Organic,,221.0,B0D85P1YK6,I'm Not Gay But My Butthole is Magnet Funny 3x10 Bumper Sticker Size Joke Prank Gay Magnet,N/A,$11.99,,5.0,3.0,False,https://m.media-amazon.com/images/I/51j+lP-lazL._AC_UL320_.jpg,https://m.media-amazon.com/images/I/51j+lP-lazL._AC_SL1500_.jpg,,2026-04-21T11:13:04.921306
34,5,Organic,,222.0,B0DS4V9DV8,GTOTd LGBTQ Cat Gay Pride Rainbow Stickers (100 pcs) Gifts Pride Cute Sticker Merch Party Supplies Wall Art Room Decor Decals Vinyls for Laptop Waterbottle Phone Adults Teens,N/A,$6.99,,4.8,64.0,False,https://m.media-amazon.com/images/I/91q9TKn1NZL._AC_UL320_.jpg,https://m.media-amazon.com/images/I/91q9TKn1NZL._AC_SL1500_.jpg,,2026-04-21T11:13:04.924829
35,5,Organic,,223.0,B0D857HJB1,I'm Not Gay But My Butthole is Magnet Funny 3x10 Bumper Sticker Size Joke Prank Gay Magnet Rainbow,N/A,$11.99,,,,False,https://m.media-amazon.com/images/I/61If3klqSEL._AC_UL320_.jpg,https://m.media-amazon.com/images/I/61If3klqSEL._AC_SL1500_.jpg,,2026-04-21T11:13:04.928849
36,5,Organic,,224.0,B0871NK9W5,"MAGNET Minnesota State Shaped Gay Pride Rainbow Flag Sticker Lgbt Mn Magnetic Vinyl Car Fridge Sticks to any Metal Surface 5""",N/A,$5.95,,,,False,https://m.media-amazon.com/images/I/31P87vCHSaL._AC_UL320_.jpg,https://m.media-amazon.com/images/I/31P87vCHSaL._AC_SL1500_.jpg,,2026-04-21T11:13:04.932625
37,5,Organic,,225.0,B0FG3C3956,"CafePress Gay Pride Paw Print Square Car Magnet 3 X 3 Square Car Magnet, Magnetic Bumper Display",N/A,$8.99,,,,False,https://m.media-amazon.com/images/I/313gcCZzNbL._AC_UL320_.jpg,https://m.media-amazon.com/images/I/313gcCZzNbL._AC_SL1500_.jpg,,2026-04-21T11:13:04.936459
38,5,Organic,,226.0,B0CT968LXH,LGBT Frog Progress Gay Pride Bumper Sticker - You are Quite Ribbiting Be You Premium Vinyl Decal 3 x 3 | LGBTQ LGBTQIA BLM Trans Rainbow Sign Flag | for Cars Auto Better Than Magnets Sticks Anywhere,N/A,$8.49,,,,False,https://m.media-amazon.com/images/I/81P66TDYbYL._AC_UL320_.jpg,https://m.media-amazon.com/images/I/81P66TDYbYL._AC_SL1500_.jpg,,2026-04-21T11:13:04.940634
39,5,Organic,,227.0,B086DHM8W5,"MAGNET New Jersey State Shaped Gay Pride Rainbow Flag Sticker Lgbt Nj Magnetic Vinyl Car Fridge Sticks to any Metal Surface 5""",N/A,$5.95,,4.3,3.0,False,https://m.media-amazon.com/images/I/31w+hI555OL._AC_UL320_.jpg,https://m.media-amazon.com/images/I/31w+hI555OL._AC_SL1500_.jpg,,2026-04-21T11:13:04.944093
40,5,Organic,,228.0,B087B987PV,"MAGNET Ohio State Shaped Gay Pride Rainbow Flag Sticker Lgbt Oh Magnetic Vinyl Car Fridge Sticks to any Metal Surface 5""",N/A,$5.95,,5.0,3.0,False,https://m.media-amazon.com/images/I/31iQv15VepL._AC_UL320_.jpg,https://m.media-amazon.com/images/I/31iQv15VepL._AC_SL1500_.jpg,,2026-04-21T11:13:04.947710
41,5,Organic,,229.0,B0BSLR1ZHD,LGBT Sounds Gay Pride I'm in Bumper Sticker - Inclusion Matters Bumper Sticker - LGBTQ Rainbow Premium Vinyl Decal 3 x 3 LGBTQIA Flag Sign for Cars Auto Window + Better Than Magnets Sticks Anywhere,N/A,$8.49,,5.0,1.0,False,https://m.media-amazon.com/images/I/71pgTaGBynL._AC_UL320_.jpg,https://m.media-amazon.com/images/I/71pgTaGBynL._AC_SL1500_.jpg,,2026-04-21T11:13:04.952833
42,5,Organic,,230.0,B0BSLQLFG1,LGBT YEP Be You Bumper Sticker - Inclusion Matters Gay Pride Bumper Sticker - LGBTQ Rainbow Premium Vinyl Decal 3 x 3 LGBTQIA Flag Sign for Cars Auto Window + Better Than Magnets Sticks Anywhere,N/A,$8.49,,,,False,https://m.media-amazon.com/images/I/71E5xF36sIL._AC_UL320_.jpg,https://m.media-amazon.com/images/I/71E5xF36sIL._AC_SL1500_.jpg,,2026-04-21T11:13:04.957029
43,5,Organic,,231.0,B07NKZPJN7,Magnet Kentucky State Shaped Gay Pride Rainbow Flag Magnetic Vinyl LGBT KY Car Magnet Bumper Sticker,N/A,,,5.0,1.0,False,https://m.media-amazon.com/images/I/311+QE1cYiL._AC_UL320_.jpg,https://m.media-amazon.com/images/I/311+QE1cYiL._AC_SL1500_.jpg,,2026-04-21T11:13:04.960581
44,5,Organic,,232.0,B087BLPVRQ,"MAGNET Maryland State Shaped Gay Pride Rainbow Flag Sticker Lgbt Md Magnetic Vinyl Car Fridge Sticks to any Metal Surface 5""",N/A,$5.95,,,,False,https://m.media-amazon.com/images/I/31tvM4DKxjL._AC_UL320_.jpg,https://m.media-amazon.com/images/I/31tvM4DKxjL._AC_SL1500_.jpg,,2026-04-21T11:13:04.963852
45,5,Organic,,233.0,B087BGCJJJ,"MAGNET Utah State Shaped Gay Pride Rainbow Flag Sticker Lgbt Ut Magnetic Vinyl Car Fridge Sticks to any Metal Surface 5""",N/A,$5.95,,5.0,1.0,False,https://m.media-amazon.com/images/I/31bUk5yux6L._AC_UL320_.jpg,https://m.media-amazon.com/images/I/31bUk5yux6L._AC_SL1500_.jpg,,2026-04-21T11:13:04.967302
46,5,Organic,,234.0,B07NXW2ZLD,"ION Graphics Magnet Texas State Shaped Gay Pride Rainbow Flag Magnetic Vinyl LGBT TX 5"" Car Magnet Bumper Sticker",N/A,$4.95,,5.0,2.0,False,https://m.media-amazon.com/images/I/31nMHs6M2vL._AC_UL320_.jpg,https://m.media-amazon.com/images/I/31nMHs6M2vL._AC_SL1500_.jpg,,2026-04-21T11:13:04.970520
47,5,Organic,,235.0,B0D6JZGRBQ,My Girlfriend is Gay Sticker Funny Car Sticker I'm Not Gay But My Girlfriend is Sticker Decal,N/A,$5.95,,,,False,https://m.media-amazon.com/images/I/51HIbWu4eQL._AC_UL320_.jpg,https://m.media-amazon.com/images/I/51HIbWu4eQL._AC_SL1500_.jpg,,2026-04-21T11:13:04.974387
48,5,Organic,,236.0,B087PC6ZQJ,Magnet More Love Less Hate Gay Pride Rainbow Graphic Car Magnetic Vinyl Bumper Sticker 5'' x 4'',N/A,$5.95,,4.0,2.0,False,https://m.media-amazon.com/images/I/61BZErHpHQL._AC_UL320_.jpg,https://m.media-amazon.com/images/I/61BZErHpHQL._AC_SL1500_.jpg,,2026-04-21T11:13:04.978129
49,5,Organic,,237.0,B07ZGHDCLD,"Gay Pride Lesbian Symbol Sticker Decal Self Adhesive Vinyl #2 Truck Car Decal Vinyl Bumper Sticker Sticks to Any Surface 5""",N/A,$4.99,,5.0,2.0,False,https://m.media-amazon.com/images/I/41FNL9shnSL._AC_UL320_.jpg,https://m.media-amazon.com/images/I/41FNL9shnSL._AC_SL1500_.jpg,,2026-04-21T11:13:04.981578
50,5,Organic,,238.0,B086CXQLBZ,"MAGNET California State Shaped Gay Pride Rainbow Flag Sticker Lgbt Ca Magnetic Vinyl Car Fridge Sticks to any Metal Surface 5""",N/A,$5.95,,5.0,1.0,False,https://m.media-amazon.com/images/I/31H99kCO1DL._AC_UL320_.jpg,https://m.media-amazon.com/images/I/31H99kCO1DL._AC_SL1500_.jpg,,2026-04-21T11:13:04.984771
51,5,Organic,,239.0,B0DD5WMTJH,"CafePress Gay Pride Rainbow Flag Sugar Skull with Roses Squa Square Car Magnet, Magnetic Bumper Display",N/A,$8.99,,,,False,https://m.media-amazon.com/images/I/51lsKs3HusL._AC_UL320_.jpg,https://m.media-amazon.com/images/I/51lsKs3HusL._AC_SL1500_.jpg,,2026-04-21T11:13:04.988005
52,5,Organic,,240.0,B01G4X9XS6,BOLDERGRAPHX 2048 Bear Claw Ripping Decal White Vinyl,N/A,$5.90,,4.4,65.0,False,https://m.media-amazon.com/images/I/41fLWiBhjZL._AC_UL320_.jpg,https://m.media-amazon.com/images/I/41fLWiBhjZL._AC_SL1500_.jpg,,2026-04-21T11:13:04.992016
53,5,Title,,,,Previous1...4567Next,,,,,,False,,,,2026-04-21T11:13:04.992971
54,5,Title,,,,Need help?Visit the help sectionorcontact us,,,,,,False,,,,2026-04-21T11:13:04.993169
