data_index,page,ad_type,ad_rank,organic_rank,asin,title,url,price_current,price_list,rating_stars,rating_count,is_prime,image_small,image_large,brand_name,scraped_at,inner_products_count
0,1,SB,1.0,,,Luau Party Decorations,https://aax-us-east-retail-direct.amazon.com/x/c/JLHhNkkExQUZCe9gbcmtOMkAAAGdr-x6KAEAAAH2AQBvbm9fdHhuX2JpZDYgICBvbm9fdHhuX2ltcDIgICD0VFbj/clv1c_ek-wBPHXUsbWHn2mJsob8xPAyXQxfYur0OvsWknLFXFccc9nBj-RP2aQ9kxP6gyoRGHIcxtR4N4bu9z2wVpyjK-DyyTbxHkR7uzwHrVC1O-6u8OqabX8WmGw0vl1tWhFk4vLfXSILk4RM_R6qC8w2UHSks0clFDa8uGUP4cqjYMDfwPNC-tSKuJQKlg1tgT9gjiRr8Mrn4DN2NLunZjwvzO9N38fJ12_sJUD2dnrFMqcl_A_EyP_4NXTQ8JFm9qdh7JSJAD6SxFfZnk1NxT5XAVvf7P87gz5n--nvheYUrBu4Xk-4RE3ynBbDyvfxGgWMs4xoa3dq_CRh50MEO1ywC90c7l1q--XhGRuUfY1aS895o_CTJf1gXTil4K0daKUEUqlJXDP3pldhxKTVo2Pe1ddumU_9RZ7mralSO0FWjVqmPXpMlyzCw2ySTI7Hz33lxKH5NNTTQI7sF8ELcvbrOPM6okxxx0qMWWrpW16sAtwzpVPslgxPrnauNDTVvLc20TacrWQ0NAcMSGlkPET8uQkHqUqrNDVFpbEOiOokLMiCyYhs3GoLnH6__G0ByyzHvye8TBJ3fOCc9l9RE5na1zyGpDz432wYBA1C8zS3edyoE74Kfdj9YufMKsy3bEJVGkQeYJMun8jYlbAhkxZ51lQuuEJrS3FuUe6Vb7RXKWnXpsuMFGyj6zpu3CpTVex6lK6s3KQMx8bteZhNLEcTu245br5fDeTPfn-aI6M4e414c2QqS8QAQxohI5xAr4WOOSTKbryT2NZZbMqUJ_aDGcg-35IaJvKy9MwJWLbrrwc0KkBPQ6tfrI5RsvQcW4OlvF9CDQ4YBuwQlvaWB_C7eyIoncDTXIeyzFRkGmO-gsxoRxTZijhBhWXD4sV_aqRpv5pXf6-r93cFxUOpChO0ZrSi_ROczKZfGoyeH3xBVQ4t5VGAhxBw1R0lQ61RgMCFxaHpveRq6KIADwW-6qBLv43qjxTZdDTgA1FMxHhdKmEz2wBqwm_kbrxG35XQkPqqx0g_7nx5WVRmfgRMND6lBJMuGUJ8hVcDNcmbwiR4GusJbFmX6zVLLqxJZrCDykIn36Rr5tErHTvc-Ixu_SV7u_G8mBm05_8Ot795zWJK3GT4KwzjNIm8WE-lVvcQw4yZSn3Y61x6FyVsYjySpWGPhD8RWKF4jCQ6lks0fuCHwIczk2MqqfCyvVDF76CF67m_9q2WCAi-kbS2R4SS3pJNwhfEyZ9a0lvqqJxWa0jWxCvyCpla4mkaz0gUNlcIW6GITAjvi3o4siT1M4Mu-EUcidFBJU8AE4Z8JW9OskW-XRdRMFVVz8qFPTLdW9Y6qO1S6RCCwXPsW2c9tg48JiYFK5zlQMfN0CX70pzZ4Ht8Rz3Qx8As0XNft-w2qOwQtqI43CdYWMBqRaE6oFzYSo9EV21ux588ewhCXl9QKtoeumEMlAmgYED1jumUioyf6M0KPLX_WrHZBOdwt9T8cmzt0QwbaoS7KbhPlwqzntTsbWDZzmGM5LC_pFx20KiaiStVYODzksI_obbhirztgrrp-F0wXrjEE_rvSIA3kV-dvzyM1ZTwDuyL7R3evg3RXOI_NEl8qyXNPc0p1V_8bN75Q45UEH_xhyd2rOQveqiPSUzSo-x_9l4CawcGfBV4HAKJqwcvGb2NGrBRe8hbDUhuZ06-ozsgINZDuLyPlYuOezj5G8/https://www.amazon.com/stores/page/5293A3C0-4DB5-4472-990F-B965D60EE00A/?_encoding=UTF8&store_ref=SB_A07795963POCTO23QX4GV-A059678259FNOVC2X5G1&pd_rd_plhdr=t&aaxitk=d56eab758393d5e5d6edadc5905ab1f6&hsa_cr_id=8042606210001&lp_asins=B09NM3WQH6%2CB09Y16XSWR%2CB09NM3RNCV&lp_query=hawaiian%20party%20supplies&lp_slot=auto-sparkle-hsa-tetris&ref_=sbx_s_sparkle_sbtcd_bkgd&pd_rd_w=0EXR5&content-id=amzn1.sym.2fb72bc8-96ef-420d-b08f-c04b69f36507%3Aamzn1.sym.2fb72bc8-96ef-420d-b08f-c04b69f36507&pf_rd_p=2fb72bc8-96ef-420d-b08f-c04b69f36507&pf_rd_r=SW89QJS1CHKYPVGMD49D&pd_rd_wg=NwtaC&pd_rd_r=00cb4b63-daa9-4db3-b682-8115454427b3,,,,,False,"https://m.media-amazon.com/images/S/al-na-9d5791cf-3faf/34b9de36-72e1-40c4-80b3-6b8a2d8a468c._CR0,0,400,400_AC_SX130_SY60_CB1169409_QL70_.png",,Luau Party Decorations,2026-04-21T12:03:31.260330,3.0
1,1,Title,,,,ResultsCheck each product page for other buying options. Price and other details may vary based on p,,,,,,False,,,,2026-04-21T12:03:31.260975,
3,1,Organic,,1.0,B0CR6SG9NZ,Arrowom 24pcs Hawaiian Leis Bulk Luau Party Silk Flower Necklace Colorful Tropical Hawaiian Bulk Hula Dance Party Decor Flower Leis Summer Beach Pool Party Decorations Favors Supplies,N/A,$9.49,,4.5,2699.0,False,https://m.media-amazon.com/images/I/91Dw3St+MFL._AC_UL320_.jpg,https://m.media-amazon.com/images/I/91Dw3St+MFL._AC_SL1500_.jpg,,2026-04-21T12:03:31.266787,
4,1,Organic,,2.0,B01F6LRW30,"Joyin Toy 36 Counts Hawaiian Leis Bulk, Tropical Flower Lei Hawaiian Lei Beach Hawaii Luau Party Favors Decoration Birthday Party Supplies(3 Dozen)",N/A,$11.99,,4.6,10884.0,False,https://m.media-amazon.com/images/I/911aTPl1DwL._AC_UL320_.jpg,https://m.media-amazon.com/images/I/911aTPl1DwL._AC_SL1500_.jpg,,2026-04-21T12:03:31.270801,
5,1,Organic,,3.0,B0GSYZZFTS,Tiki Gift Bag Brown Hawaiian Wrapping Paper Bag with Tissue Paper and Greeting Card Aloha Luau Party Favors Hawaiian Themed Party Decor for Hawaii Tropical Summer Festival Birthday Party Supplies,N/A,$7.99,,4.5,2.0,False,https://m.media-amazon.com/images/I/71RZPhdK1VL._AC_UL320_.jpg,https://m.media-amazon.com/images/I/71RZPhdK1VL._AC_SL1500_.jpg,,2026-04-21T12:03:31.276913,
7,1,Title,,,,Debug info copied.SponsoredArrowom 24pcs Hawaiian Leis Bulk Luau Party Silk Flower Necklace Colorful,,,,,,False,,,,2026-04-21T12:03:31.277976,
8,1,Title,,,,Paper Jazz Toucan Tropical Party DecorationSponsored|Shop Paper JazzShop nowPrevious pageTropical Bi,,,,,,False,,,,2026-04-21T12:03:31.279129,
9,1,Title,,,,More results,,,,,,False,,,,2026-04-21T12:03:31.279261,
10,1,Organic,,4.0,B0F2RXN18F,OHOME 2 Pack Luau Party Decorations - Plastic Tablecloth for Hawaiian Theme Party Decorations | Tropical Summer Beach Pool Birthday Backdrop Favors Supplies,N/A,$6.29,,4.6,900.0,False,https://m.media-amazon.com/images/I/91VMLJwCDvL._AC_UL320_.jpg,https://m.media-amazon.com/images/I/91VMLJwCDvL._AC_SL1500_.jpg,,2026-04-21T12:03:31.283080,
11,1,Organic,,5.0,B09NM2FPKX,"Fovths Luau Grass Table Skirt Natural 9 Feet x 29.5 Inch Hawaiian Table Skirt for Tropical Hawaiian Party Decorations Luau Costume Party, Straw Yellow",N/A,$8.49,,4.5,2400.0,False,https://m.media-amazon.com/images/I/81Hsj3wr27L._AC_UL320_.jpg,https://m.media-amazon.com/images/I/81Hsj3wr27L._AC_SL1500_.jpg,,2026-04-21T12:03:31.287089,
12,1,Organic,,6.0,B073RBVTXT,"ALINK 50 Umbrella Parasol Drinking Straws, Hawaiian Beach Cocktail Luau Party Decorations Supplies",N/A,$6.99,,4.6,10351.0,False,https://m.media-amazon.com/images/I/81YbWfWBaPL._AC_UL320_.jpg,https://m.media-amazon.com/images/I/81YbWfWBaPL._AC_SL1500_.jpg,,2026-04-21T12:03:31.290882,
13,1,Organic,,7.0,B075FPCFNR,60Pcs Tropical Party Decorations Supplies Tropical Palm Leaves Hibiscus Flower Simulation Artificial Leaf for Hawaiian Luau Safari Party Jungle Beach Theme BBQ Birthday Parties Decorations Table Decor,N/A,$11.99,,4.6,3137.0,False,https://m.media-amazon.com/images/I/81jZYriVXGL._AC_UL320_.jpg,https://m.media-amazon.com/images/I/81jZYriVXGL._AC_SL1500_.jpg,,2026-04-21T12:03:31.295354,
14,1,Organic,,8.0,B0BRXTH8YD,"Hawaiian Leis Luau Party Decorations Set, 54Pcs Hawaiian Luau Party Supplies Flower Leis Necklaces Headbands Wristbands Grass Hula Skirt Lays Tropical Summer Beach Birthday Holiday Party Favors",N/A,$14.99,,4.6,180.0,False,https://m.media-amazon.com/images/I/91gg2g1qE8L._AC_UL320_.jpg,https://m.media-amazon.com/images/I/91gg2g1qE8L._AC_SL1500_.jpg,,2026-04-21T12:03:31.301441,
15,1,Organic,,9.0,B09NV8M82B,"Tropical Luau Party Decorations Set Hawaiian Beach Theme Party Favors Luau Party Supplies with 9ft Luau Grass Table Skirt, Palm Leaves, Hibiscus Flowers, 3D Fruit Straws, Flamingo and Pineapple Décors",N/A,$19.98,,4.6,517.0,False,https://m.media-amazon.com/images/I/81RxmR6D5gL._AC_UL320_.jpg,https://m.media-amazon.com/images/I/81RxmR6D5gL._AC_SL1500_.jpg,,2026-04-21T12:03:31.305983,
16,1,Organic,,10.0,B07DLVSJ99,"FUTUREPLUSX 2 Pack Tropical Garland Party Decorations, 20ft Multicolored Tissue Paper Hibiscus Flower Summer Banner for Birthday Beach Theme Luau Hawaiian Party Supplies Jungle Decor",N/A,$8.99,,4.7,3375.0,False,https://m.media-amazon.com/images/I/71q9+TnamlL._AC_UL320_.jpg,https://m.media-amazon.com/images/I/71q9+TnamlL._AC_SL1500_.jpg,,2026-04-21T12:03:31.310035,
17,1,Organic,,11.0,B0F1CZBKQZ,"Atonofun 80 PCS Leis for Luau Party Decorations- Hawaiian Leis Bulk, Luau Party Glasses, Colorful Bracelets, Flower Headbands for Adults Tropical Birthday Summer Beach Luau Party Favors Supplies",N/A,$21.99,,4.7,210.0,False,https://m.media-amazon.com/images/I/81wie7bpooL._AC_UL320_.jpg,https://m.media-amazon.com/images/I/81wie7bpooL._AC_SL1500_.jpg,,2026-04-21T12:03:31.314388,
18,1,Organic,,12.0,B0D3TQF2TG,12Pcs Hawaiian Luau Party Table Decorations - Double sided Aloha Flamingo Honeycomb Centerpieces Table Decorations for Hawaiian Tiki Birthday Wedding Pool Party Supplies,N/A,$9.49,,4.5,265.0,False,https://m.media-amazon.com/images/I/81MDzrp5gcL._AC_UL320_.jpg,https://m.media-amazon.com/images/I/81MDzrp5gcL._AC_SL1500_.jpg,,2026-04-21T12:03:31.317948,
19,1,Organic,,13.0,B0F31BBMPH,"100 Pcs Tropical Luau Party Supplies Set, Serves 25 – Disposable Hibiscus Floral Paper Plates, Napkins, and Forks, Hawaiian Themed Tableware for Summer BBQ, Pool and Beach Aloha Birthday Decorations",N/A,$19.99,,4.6,134.0,False,https://m.media-amazon.com/images/I/81CLa6x2myL._AC_UL320_.jpg,https://m.media-amazon.com/images/I/81CLa6x2myL._AC_SL1500_.jpg,,2026-04-21T12:03:31.321444,
20,1,Organic,,14.0,B0BR8TZMTW,"mishunyus 24 Pcs Glow Hawaiian Luau Party Cups, Flashing Tiki Party Cups, Tropical Luau Party Decorations Hawaiian Party Supplies Favor (16oz)",N/A,$17.99,,4.4,384.0,False,https://m.media-amazon.com/images/I/71OXFtJmqSL._AC_UL320_.jpg,https://m.media-amazon.com/images/I/71OXFtJmqSL._AC_SL1500_.jpg,,2026-04-21T12:03:31.325338,
21,1,Title,,,,More results,,,,,,False,,,,2026-04-21T12:03:31.325966,
22,1,Organic,,15.0,B0DC51MRZ4,"Freyalife Hawaiian Leis Decorations(24pcs),Leis for Luau Party Decor Flower,Tropical Hawaiian Bulk Hula Dance Party Decor",N/A,$6.99,,4.3,621.0,False,https://m.media-amazon.com/images/I/816+lI1lMEL._AC_UL320_.jpg,https://m.media-amazon.com/images/I/816+lI1lMEL._AC_SL1500_.jpg,,2026-04-21T12:03:31.329715,
23,1,Organic,,16.0,B09Z28TMY4,Vinsot 32 Pack Beach Pool Party Eyeglasses Decor Summer Luau Paper Glasses Bulk Hawaiian Sunglasses Frame Tropical Pool Props Photo Booth Props for Summer Beach Luau Party Favor Birthday Supply Decor,N/A,$12.99,,4.1,648.0,False,https://m.media-amazon.com/images/I/81bbJ2wNgCL._AC_UL320_.jpg,https://m.media-amazon.com/images/I/81bbJ2wNgCL._AC_SL1500_.jpg,,2026-04-21T12:03:31.334028,
24,1,Organic,,17.0,B0D1KMLLF9,Jingmore 200 Pcs Tropical Nights Hawaiian Aloha Party Supplies Serve 50 Guests Luau Paper Plates Cups Napkins for Summer Beach Tableware Pool Party,N/A,$26.99,,4.6,50.0,False,https://m.media-amazon.com/images/I/91i6-LmDHvL._AC_UL320_.jpg,https://m.media-amazon.com/images/I/91i6-LmDHvL._AC_SL1500_.jpg,,2026-04-21T12:03:31.338577,
25,1,Organic,,18.0,B071JR7GYP,"JOYIN 60"" Inflatable Palm Tree Cooler, Beach Theme Decor, Pool Party Decorations, Luau Hawaiian Birthday Party Supplies, Ocean Jungle Tropical Themed Summer Outdoor Drink Cooler",N/A,$19.99,,4.3,5368.0,False,https://m.media-amazon.com/images/I/815M9fW4pfL._AC_UL320_.jpg,https://m.media-amazon.com/images/I/815M9fW4pfL._AC_SL1500_.jpg,,2026-04-21T12:03:31.343810,
26,1,Organic,,19.0,B073DWVS5T,jollylife 12PCS Luau Hawaiian Grass Skirts + 12PCS Wristbands Party Decorations Hula Hibiscus Flowers Birthday Tropical Supplies,N/A,$23.99,,4.6,1572.0,False,https://m.media-amazon.com/images/I/A1k-7qllpbL._AC_UL320_.jpg,https://m.media-amazon.com/images/I/A1k-7qllpbL._AC_SL1500_.jpg,,2026-04-21T12:03:31.350421,
27,1,Organic,,20.0,B085GC3XF4,108 Pack Palm Leaves Artificial Tropical Monstera - 6 Kinds Large Small Green Fake Palm Leaf with Stems for Safari Jungle Hawaiian Luau Party Table Decoration Wedding Birthday Theme Party Decorations,N/A,$15.97,,4.5,5966.0,False,https://m.media-amazon.com/images/I/91GcpXJTi3L._AC_UL320_.jpg,https://m.media-amazon.com/images/I/91GcpXJTi3L._AC_SL1500_.jpg,,2026-04-21T12:03:31.358472,
28,1,Organic,,21.0,B0GK193MPZ,175Pcs Hawaiian Luau Party Decorations Aloha Tropical Tropical Hibiscus Floral Tableware Supplies Hawaii Palm Leaves Plates for Summer Hawaiian Birthday BBQ Pool Beach Party Supplies Serves 25 Guests,N/A,$24.99,,4.6,18.0,False,https://m.media-amazon.com/images/I/812VDNvQBQL._AC_UL320_.jpg,https://m.media-amazon.com/images/I/812VDNvQBQL._AC_SL1500_.jpg,,2026-04-21T12:03:31.364518,
29,1,Organic,,22.0,B0BR8944R3,200 PCS Hawaiian Leis Neck Vibrant Colors Assortment for Luan Party Tropical Themed Party Decorations Beach Party Decor,N/A,$44.99,,4.4,200.0,False,https://m.media-amazon.com/images/I/811O-WZyh5L._AC_UL320_.jpg,https://m.media-amazon.com/images/I/811O-WZyh5L._AC_SL1500_.jpg,,2026-04-21T12:03:31.369926,
30,1,Organic,,23.0,B0DP1M3KRL,"180 pc Premium Luau Party Decorations Set – Hawaiian Birthday Party Decor with Balloons, Backdrop, Table Skirt, Toppers & More – Tropical Aloha Themed Supplies for Indoor & Outdoor Celebrations",N/A,$37.99,,4.6,150.0,False,https://m.media-amazon.com/images/I/91nX76qPjAL._AC_UL320_.jpg,https://m.media-amazon.com/images/I/91nX76qPjAL._AC_SL1500_.jpg,,2026-04-21T12:03:31.377261,
31,1,Title,,,,More results,,,,,,False,,,,2026-04-21T12:03:31.378179,
32,1,Organic,,24.0,B0CYGTM114,50 Hawaiian Luau Party Decorations Cups with Parasol Straws -16OZ Disposable Party Cups for Tropical Luau Moana Birthday Party Decor Supplies,N/A,$13.99,,4.8,172.0,False,https://m.media-amazon.com/images/I/714iHzFp-KL._AC_UL320_.jpg,https://m.media-amazon.com/images/I/714iHzFp-KL._AC_SL1500_.jpg,,2026-04-21T12:03:31.382498,
33,1,Organic,,25.0,B0F4XVVVW3,Hawaiian Luau Party Decorations Supplies - 175 PCS Aloha Tropical Birthday Party Decorations Disposable Dinnerware Set (25 Guest) With Paper Plates Napkin Cup for Summer Beach Themed Pool,N/A,$24.99,,4.6,68.0,False,https://m.media-amazon.com/images/I/81f2GExZRXL._AC_UL320_.jpg,https://m.media-amazon.com/images/I/81f2GExZRXL._AC_SL1500_.jpg,,2026-04-21T12:03:31.386603,
34,1,Organic,,26.0,B088NBDQWF,"3 Pack Hawaiian Luau Tablecloths for Party Decoration, Hawaii Disposable Plastic Rectangular Table Covers, Aloha Tropical Palm Leaves Table Cloth, Summer Beach Kids Birthday Cocktail Party Supplies",N/A,$6.78,,4.7,2823.0,False,https://m.media-amazon.com/images/I/713DQX5GfnL._AC_UL320_.jpg,https://m.media-amazon.com/images/I/713DQX5GfnL._AC_SL1500_.jpg,,2026-04-21T12:03:31.390226,
35,1,Organic,,27.0,B0DXN9X28C,"2 Pack Luau Decorations, 3.28 FT x 7.05 FT Summer Party Streamer, Green Brown Yellow Backdrop Tinsel Curtains Fringe Curtains, Metallic Hawaiian Supplies Aloha Party Decor",N/A,$6.99,,4.5,3016.0,False,https://m.media-amazon.com/images/I/91++YWbYizL._AC_UL320_.jpg,https://m.media-amazon.com/images/I/91++YWbYizL._AC_SL1500_.jpg,,2026-04-21T12:03:31.394580,
36,1,Organic,,28.0,B0F3XJFSKZ,Hawaiian Luau Party Decorations Set: Aloha Theme Table Decoration with Luau Honeycomb Centerpiece for Tiki and Luau Hawaiian Party Supplies,N/A,$9.98,,4.7,1132.0,False,https://m.media-amazon.com/images/I/81Zd6FMFEzL._AC_UL320_.jpg,https://m.media-amazon.com/images/I/81Zd6FMFEzL._AC_SL1500_.jpg,,2026-04-21T12:03:31.400003,
37,1,Organic,,29.0,B0DWFBYCCH,"DMIGHT 101PCS Hawaiian Themed Party Decorations Set, Tropical Beach Aloha Summer Party Supplies, Including Backdrop, Table Skirt, Honeycomb Centerpieces, Balloons for Luau, Tiki Birthday Party",N/A,$21.99,,4.8,80.0,False,https://m.media-amazon.com/images/I/91P+tcyxzkL._AC_UL320_.jpg,https://m.media-amazon.com/images/I/91P+tcyxzkL._AC_SL1500_.jpg,,2026-04-21T12:03:31.404125,
38,1,Organic,,30.0,B0C9BQ6MWN,"2 Pack Fish Net Decorations for Party, Natural Cotton Hawaiian Party Fishing Net Decorative, Nautical Themed Cotton Fishnet Under The Sea Pirate Ocean BeachHalloween Decor",N/A,$9.99,,4.7,1095.0,False,https://m.media-amazon.com/images/I/71z3Ekr-WZL._AC_UL320_.jpg,https://m.media-amazon.com/images/I/71z3Ekr-WZL._AC_SL1500_.jpg,,2026-04-21T12:03:31.408575,
39,1,Organic,,31.0,B0BKTQ9JLP,"JOYIN 120 Counts Hawaiian Leis Bulk, Colorful Tropical Flower Leis for Kids Adults Hawaiian Beach Luau Party Favors Decorations",N/A,$32.99,,4.6,10884.0,False,https://m.media-amazon.com/images/I/911aTPl1DwL._AC_UL320_.jpg,https://m.media-amazon.com/images/I/911aTPl1DwL._AC_SL1500_.jpg,,2026-04-21T12:03:31.413108,
40,1,Organic,,32.0,B0B2RFGJL2,"Hawaiian Luau Party Decorations(161 Pcs), Tropical Summer Beach Pool Party Supplies Including Aloha Backdrop, Table Skirt, Tablecloth, Flamingo, Palm Leaves and Hibiscus, Balloons Arch, Straws,",N/A,$22.99,,4.6,579.0,False,https://m.media-amazon.com/images/I/81tA7Fa0I8L._AC_UL320_.jpg,https://m.media-amazon.com/images/I/81tA7Fa0I8L._AC_SL1500_.jpg,,2026-04-21T12:03:31.418298,
41,1,Organic,,33.0,B07NS7BG9L,"JOYIN 28” Inflatable Palm Tree Cooler, Luau Hawaiian Tropical Beach Themed Party Decorations, Blow Up Palm Trees Cooler Outdoor Party Supplies, Kids Adults Birthday Party Décor",N/A,$17.99,,4.4,4015.0,False,https://m.media-amazon.com/images/I/91NOjIPjumL._AC_UL320_.jpg,https://m.media-amazon.com/images/I/91NOjIPjumL._AC_SL1500_.jpg,,2026-04-21T12:03:31.422328,
42,1,Organic,,34.0,B0CZ8TGK8D,20 Pieces Luau Party Decorations Hawaiian Party Welcome Sign Summer Tropical Party Direction Signs for Fiesta Hawaiian Luau Tiki Themed Birthday Wedding Party Supplies with 2 Sheet Stickers,N/A,$7.97,,4.6,656.0,False,https://m.media-amazon.com/images/I/81Wy7W9RweL._AC_UL320_.jpg,https://m.media-amazon.com/images/I/81Wy7W9RweL._AC_SL1500_.jpg,,2026-04-21T12:03:31.426248,
43,1,Organic,,35.0,B07NWR7HKD,"JOYIN 12-Pack 12“ Beach Balls - Bulk Classic Beachball Inflatable Swimming Pool Toys for Games Adults Kids Birthday Party Supplies Combo Set, Rainbow Color Blow Up Luau Decorations Favors Gifts (12"")",N/A,$9.99,,4.5,3356.0,False,https://m.media-amazon.com/images/I/814LDy0nOPL._AC_UL320_.jpg,https://m.media-amazon.com/images/I/814LDy0nOPL._AC_SL1500_.jpg,,2026-04-21T12:03:31.431198,
44,1,Organic,,36.0,B07YD4G1R9,WERNNSAI Hawaiian Aloha Party Banner Decorations - Flamingo Pineapple Tiki Tropical Luau Party Supplies Favors Large Gold Glittery Aloha Sign Flag for Birthday Wedding Summer Beach Pool,N/A,$11.99,,4.4,792.0,False,https://m.media-amazon.com/images/I/81d-Tg-P2-L._AC_UL320_.jpg,https://m.media-amazon.com/images/I/81d-Tg-P2-L._AC_SL1500_.jpg,,2026-04-21T12:03:31.437511,
45,1,Organic,,37.0,B0G3Q79NZZ,"96 Pieces Tropical Hawaiian Luau Party Tableware Set – Flamingo Hibiscus Floral Disposable Plates, Napkins, and Forks for Aloha Birthday, Summer BBQ, Pool Party, Beach Event, or Island Celebration",N/A,$14.99,,4.5,41.0,False,https://m.media-amazon.com/images/I/81zHZrBHdOL._AC_UL320_.jpg,https://m.media-amazon.com/images/I/81zHZrBHdOL._AC_SL1500_.jpg,,2026-04-21T12:03:31.441134,
46,1,Organic,,38.0,B07F5G8MRN,"24 Pack Hawaiian Flower Hair Clips, 2.5 Inch Plumeria Foam Hair Accessories Clip for Women, Hawaii Tropical Party Decorations, Beach Pool Vacation Outfit, Luau Party Supplies favors, Bridal Wedding",N/A,$12.68,,4.6,1122.0,False,https://m.media-amazon.com/images/I/71XY-jJcMHL._AC_UL320_.jpg,https://m.media-amazon.com/images/I/71XY-jJcMHL._AC_SL1500_.jpg,,2026-04-21T12:03:31.446185,
47,1,Organic,,39.0,B07HQ4GCCV,"Ocean Line Luau Party Sunglasses - 9 Pairs Funny Hawaiian Glasses, Tropical Fancy Dress Props, Fun Summer Kids Party Favors, Beach Themed Party Supplies Decoration",N/A,$17.98,,4.7,2161.0,False,https://m.media-amazon.com/images/I/71ugXRbXMFL._AC_UL320_.jpg,https://m.media-amazon.com/images/I/71ugXRbXMFL._AC_SL1500_.jpg,,2026-04-21T12:03:31.452441,
48,1,Organic,,40.0,B088FJ4L7K,"YUNXUAN Flamingo Party Supplies, Hawaiian Party Decorations Flamingo and Pineapple Honeycomb Ball Paper Lanterns Paper Fans Pom poms Flowers for Birthday Luau Tropical Bachelorette Party",N/A,$16.99,,4.7,1692.0,False,https://m.media-amazon.com/images/I/71oYj8hh1KL._AC_UL320_.jpg,https://m.media-amazon.com/images/I/71oYj8hh1KL._AC_SL1500_.jpg,,2026-04-21T12:03:31.455984,
49,1,Organic,,41.0,B0D4DQQ8SW,"Luau Party Decorations, Natural Hawaiian Grass Table Skirt, Flower 108 X 29.5"" Grass Skirts Tropical Luau Party Favors, Table Skirt for Luau Summer Tropical Indoor Outdoor Parties Decor Accessories",N/A,$8.98,,4.5,710.0,False,https://m.media-amazon.com/images/I/81-9j7gt+mL._AC_UL320_.jpg,https://m.media-amazon.com/images/I/81-9j7gt+mL._AC_SL1500_.jpg,,2026-04-21T12:03:31.461300,
50,1,Organic,,42.0,B0C7N7XKZP,"GoodUping 18 Counts Hawaiian Leis, Flower Hair Clip, Headbands and Wristbands, Perfect Luau Party Supplies for Summer Beach Vacations, Essential Party Decorations for Birthday, Graduation, and Wedding",N/A,$8.99,,4.5,462.0,False,https://m.media-amazon.com/images/I/91pK50dq7AL._AC_UL320_.jpg,https://m.media-amazon.com/images/I/91pK50dq7AL._AC_SL1500_.jpg,,2026-04-21T12:03:31.466968,
51,1,Title,,,,More results,,,,,,False,,,,2026-04-21T12:03:31.467603,
52,1,Organic,,43.0,B0CYZX38MZ,"Atonofun 48 PCS Leis for Luau Party, Hawaiian Leis Bulk, Luau Party Glasses, Flowers Hair Clip Tropical Birthday Summer Beach Luau Party Favors Supplies",N/A,$19.99,,4.6,248.0,False,https://m.media-amazon.com/images/I/81NKj-LwaBL._AC_UL320_.jpg,https://m.media-amazon.com/images/I/81NKj-LwaBL._AC_SL1500_.jpg,,2026-04-21T12:03:31.471536,
53,1,Organic,,44.0,B0BXWTP4KM,"Kepeel 96 Pcs Hawaiian Aloha Party Decorations Supplies, Luau Tropical Birthday Party Plates Summer Beach Holiday Party Paper Plates Napkins Tableware Disposable Dinnerware Set , Serves 24",N/A,$16.99,,4.7,1005.0,False,https://m.media-amazon.com/images/I/81OQkBRO8tL._AC_UL320_.jpg,https://m.media-amazon.com/images/I/81OQkBRO8tL._AC_SL1500_.jpg,,2026-04-21T12:03:31.475978,
54,1,Organic,,45.0,B0CRGQMFYB,"AILEHO Kids Sunglasses Bulk Party Favors - 24 Packs Boys Girls Sunglasses for Kids Age 3-8 with UV 400 Protection, Neon Sunglasses for Kids Party",N/A,$22.49,,4.8,1114.0,False,https://m.media-amazon.com/images/I/812gCrg-OsL._AC_UL320_.jpg,https://m.media-amazon.com/images/I/812gCrg-OsL._AC_SL1500_.jpg,,2026-04-21T12:03:31.480764,
55,1,Organic,,46.0,B07CRL2KC9,"Hajoyful Grass Skirt Hawaiian Luau Hula Skirts Party Decorations Favors Supplies Grass Skirts for Adult Elastic Hibiscus Flowers Tropical Skirt, Party, Birthday, Celebration 60CM 12Pack Multicolored",N/A,$22.98,,4.6,1316.0,False,https://m.media-amazon.com/images/I/91bZU2w7XPL._AC_UL320_.jpg,https://m.media-amazon.com/images/I/91bZU2w7XPL._AC_SL1500_.jpg,,2026-04-21T12:03:31.484813,
56,1,Organic,,47.0,B0DHL149K2,Luau Birthday Party Decorations Hawaiian Party Decorations 169 Pcs Tropical Aloha Party Supplies for Summer Beach Holiday Including Balloon Arch Kit Backdrop Table Skirt Banner Cake Toppers Straws,N/A,$23.99,,4.6,148.0,False,https://m.media-amazon.com/images/I/91MolvwyNFL._AC_UL320_.jpg,https://m.media-amazon.com/images/I/91MolvwyNFL._AC_SL1500_.jpg,,2026-04-21T12:03:31.488592,
57,1,Organic,,48.0,B0B2P18C1J,"Paxcoo 50pc Umbrella Straws for Cocktails, Tropical Hawaiian Luau Party Decorations (Assorted Colors)",N/A,$7.99,,4.6,1088.0,False,https://m.media-amazon.com/images/I/71PMm6c2CXL._AC_UL320_.jpg,https://m.media-amazon.com/images/I/71PMm6c2CXL._AC_SL1500_.jpg,,2026-04-21T12:03:31.493026,
59,1,Title,,,,Debug info copied.SponsoredAtonofun 72 Pack Hawaiian Luau Party Decorations Cups -14OZ Disposable Tr,,,,,,False,,,,2026-04-21T12:03:31.493921,
60,1,Title,,,,Related searcheshawaiian themed party decorationshawaiian partyhawaiian party decorationshawaiian pa,,,,,,False,,,,2026-04-21T12:03:31.494791,
61,1,Title,,,,Previous123...7Next,,,,,,False,,,,2026-04-21T12:03:31.495165,
62,1,SB,2.0,,,N/A,https://aax-us-east-retail-direct.amazon.com/x/c/JIycFnY9vgfEu4bgjQAQ8P0AAAGdr-x66QEAAAH2AQBvbm9fdHhuX2JpZDIgICBvbm9fdHhuX2ltcDIgICCjcNEh/clv1c_ek-wxPHXFbbWDfHXL5sAvQuvcRxOLvvnaLj4TDC-P6NxeeuD8Dva30SGs2sZIdxIOlE_6aKVaCnlSEpzYXKx9BxO5CTYpesQVyFt7GaH3E_1SBLoX6W9vkw74v0YzqLUUsB4luBLAmo5Yy4-5_Js1tbOuJ0dlk1amNXS45f6TQIWXx_gl7dH-1mivkpPV370N7bPoEdIPSugZY2tNs6puPi5ntu9po6nss3wSWz41_0uTdHkerFZEezymbs-SFMZQfP8kXKBjefwT3xrsNgwqcHqeEJEzajW2fyN4YJAJj6Gu5O4IrBGkebzYFQjilearqIy6cQEwo2Hkb4uzMedNN5Dy2_O00CISY-0aaTW5J5M6RPrWg-nszgECjcww0S0jYQquNXOJdV58VkCscPgphFBQEWgxc5j-mPITcIxAqiHsRZBQ0o6ergQwYvOc61TDHLmvhleNNU8pyvdXlHxVUHyYXrUMqqtjyVvARz5lTOq98G9xwwSJqjAhR7036HPDZgv7tCzsAw_cUF_vXKlM0_yEm74lf2G6gpCGvv1JMzqpIZ0j0usVQw5WISi3NiZgFWXmxAnzHdnWGbj6L1N1sSs28wNPbG_2fnr-vVDNGvjsGiJwNfh33nS4cGKRhCzB_MbRpkEDfePif8OBUZSsDL9V9efcVcbpeopsF59Cv-5Kp3aOO5e-WDihzGiH-fXKiGAlT4lUOHWS_0GSobSBKlRepTDMV1yy6kTgjXs2KNfCMpVFYwUo0N2vnLxqocba-P4MXVZlTbRywFFXV6jVpsGdzsfbEhzzpysPpVgVMGUUkMNv5x2-dGCcHVM-U99S8a65tGsj3MwVcrZJEwV89c9A2pdeoVuQp5Ah4Ln-Q7Hrt8GyX6Sm6cnUnXIRzL-kcm-jSz9u-oboeOF7o6tpA6pKaKILH4DD3oQIxgJZybbH8LdO57H7iSdB4-cMSrWIHm8ZNOLUBS_PPvo1ntG-UX074mPLIK1lgyufMs7tPtsoCqgbDS8vri10RwmZZ0UM8e_8r8EtBLEV5F1VdGF6AnLY_rYiz3bxpF2vdV0xNTZhg-erJRVLQVNm3QPtepUwdDarxPEvFXhzM0JMjsPSoxAF2F5Wp_IjGo-9wMQEFuKHn8HfDAKzMh33aje_9Geasot7bo-cWkzjJGRdIJoJgGm7JWwd-rlNXKRpnto3wgXEN1Z7cs0HdaQrvvEc3mueaoGUax5EnZQECygG2CWdAxSdbNjcH01fVDUs0_H5jVMScjO_WdKODTteVWU6nEjeXFBc_lLK0fLoe31Ad4qA4BI6uJY-ePS-sY9JmVJqnkEBatCRQPqv0WaOeizByIqyrun9aWRIyjhrsT1f3obIrHLl30tTLAx97EP8VKK9tv5sQWo4C7F4l5lhF7xNTD78ogRIhPgQZAuBzgjSeF5dSBPWVTyLCzN_r16OheS907fns-_dsAQinQ-bj3gRsE_RhXmTee_Fb_4fMGrRRirJb2QLdaNphphQRgPptYzjgR68FHI8dTIk7mh4xRwrF0fqoD-5Kq4rTPJ6XLNViMtM-tnmLBd03UuIttOyguEqRlTa5Zj--LOuANY-aDwgYcw-OPpqtf2I0AGz0bdaMRd_3FSVtIA0vKnSnhMNZTQ32hNOJG-IBg0DM0dLDfQB7sPEtHxq72oPKn3_S_4H10SNA/https://www.amazon.com/stores/page/67375DFC-5257-4A3E-9899-589F11936B5A/?_encoding=UTF8&store_ref=SB_A0853921EACDYYH6Z7TY-A0977847TWJQGKFS8L96&pd_rd_plhdr=t&aaxitk=eef1cb5c452b161545c16f6c2274517f&hsa_cr_id=0&lp_asins=B0CSSRYKPX%2CB0CSSLCLCH%2CB0CV517GYH&lp_query=hawaiian%20party%20supplies&lp_slot=desktop-hsa-3psl&ref_=sbx_be_s_3psl_mbd_mb0_bkgd&pd_rd_w=ONxt9&content-id=amzn1.sym.cd7c548b-a599-426f-9ffe-daa1aa803c87%3Aamzn1.sym.cd7c548b-a599-426f-9ffe-daa1aa803c87&pf_rd_p=cd7c548b-a599-426f-9ffe-daa1aa803c87&pf_rd_r=SW89QJS1CHKYPVGMD49D&pd_rd_wg=eaPSN&pd_rd_r=4f5ab2b6-6dfd-4cc1-b8b0-04be5329dab9,,,,,False,,,N/A,2026-04-21T12:03:31.500428,
63,1,Title,,,,Need help?Visit the help sectionorcontact us,,,,,,False,,,,2026-04-21T12:03:31.501148,
