data_index,page,ad_type,ad_rank,organic_rank,asin,title,url,price_current,price_list,rating_stars,rating_count,is_prime,image_small,image_large,brand_name,scraped_at,inner_products_count
0,1,SB,1.0,,,eachers' Day Cupcake Fuzzy Socks Bulk,https://aax-us-east-retail-direct.amazon.com/x/c/JFWC13NJiF5tj9h63fZhoL8AAAGdr6jYxQEAAAH2AQBvbm9fdHhuX2JpZDMgICBvbm9fdHhuX2ltcDEgICC1wNNG/clv1c_ek-wBPHXEsTW3uLbExsAb8j98LgzrO8-i3D8qUagYjsgFpkTjTRujqpKiqtrYeLFlBo-y_A-K3IlJ0o3Knbo7T0Z9dfg9voPH5Ar2xTuv0imCZDSMJb6za349pWcBs9dlbrWs60xPpn-2iFgLrfh_NXnMJ2dlMvri_Soj1SowpUTiYVfx-MCL2Q3dE87TM-k1SB41kvIGhr-2P7Nh32B0uK7v_wslMar17rWjaqoBj7gAbm3sIYW4Og-2_VIK0Zw8UIcZatnHpN-IqWby0PLQqC7azBRVT6KmdPloDE0dA9zplX9WPDijUGs_oB8izWVRANki35MbHCbEKYhlqhwWHVxb_AOOUSfEece1yOQxZaC7LtqMQDlhYDe1mUmjw6qP0HhLBhZeohkrqmmL-KvvsxZafnTbsUdQK2od8DE4W21wpWSyFZRcJnDVpxcFc6YlKtYas757YkOAjTibYOBKo1S7Cj2hAXtrhbukwyi9Huwry8l2gegjwFPSnFQoTZAl8DHNqD0rKhUZAj0kZMuj984LMejxlI6blp5qfQ8jBQ9F5ufDnwtbjoUZXCFQ9JE2-TQo0LgADOdxgfl4-eD_gzUnQkzL_-vZ7GCw8d_d0daFM94xyCtz-tYL52rt8_SpYlMbRI0Ukj3AY9hnf4hjJ_ZOnvyVLXN19qzT_Fi2zWmJD5jMQUlKCyfncERG7RyIxECDYjd_Oy02dra4-x793ror72N2trmt8Y5p8R8T2FZP3TaZjdHz2eW4fCfkzeGU4kCJgmqIlOUgwvB-wz-GVINqHcTeZovnnVP5aJ5NwL2Vk6Bh5KD2pe7C-a019xipQ3Fdh6Be7jhek76c4rj83i3QbdfqC_WyfbwLrT8ynKHeaxUwSD1_Ay2S6vgIi107Eb6WUUuh36u5Z-IIJB2_xpM0e6E8_3z3WHjUreMx3tt8hUk5Z6NibCth9K8naG_TG8lSkgblki0qOXluTDKvhRTSZLEljGCxl8wqutOkOvWit8qnceXwxuFRMf7IlvEOFb-IJWqdSMTVEmbRvxvgOD3DTy4xEJlBWJnsIOMvjwV0i-2-_fzIdDvywEuA4jojO_ze7atyqGAUFD-8GC3MVzcinLjdlvNg5p9QR-9EiDo1nDb7XlcZHmhPdJOkXFRyoKiVNLpg85bRQjwDqhW_XiBvMCebF2LBiUOFihFX-fGH59WjoecvDiNPvsJDvaSMApSR6RsWVbxKtL7a4UWfPsOawquOaah-YySQEXzSbVfIAuISloRuunpPJ2i_6i-imowjF2xv8dZ1DtfZdSijtl3ZsgoMVkRLAHx0o8n71sXw1sf2eOi9NVnXj1SxxkDIx4s5cfUyqPxP2LanWBkenmXatZhjnF24Pyp9tb1Yvnx10NiVnZ-x9GVcSMM9LKlHG8CKXIvR3xsl1I_A7Q-tprLMBY8KiRLmkwfS1Ce52gStzcrpUFWSpaFH9l8oHx5TyoU6uxVOQJyYSLi7gEp-wYQh2scYYbNPeioNpTigHoGo7Ly9hEB_2BsGWjf-mR1s0nke6xGvZoD8Z5U0XpWiluJHPB1U52EdVuW1qm3dhfBiRJK1Hd8-qhDYnGe86y8_snSie-3WRgi7LkOBYtst4PSwJZg4j4f8rA4z8hoj-2ju4Jd1LwOxgNFJcG9CBDVOUj3pnH9nq76ubfBeGDduVQsQ_I/https://www.amazon.com/stores/page/AC60CF9B-E286-40E1-99A1-0B84DD119BA9/?_encoding=UTF8&store_ref=SB_A01774432629111GMV9IE-A096408837IZ800DLZE27&pd_rd_plhdr=t&aaxitk=a24498243e9cd4d59d916cbec3bfd43c&hsa_cr_id=0&lp_asins=B0GLH478BD%2CB0GLH7QW13%2CB0GLHCV1GS&lp_query=nurses%20week%20gifts&lp_slot=auto-sparkle-hsa-tetris&ref_=sbx_s_sparkle_sbtcd_bkgd&pd_rd_w=suhgt&content-id=amzn1.sym.2fb72bc8-96ef-420d-b08f-c04b69f36507%3Aamzn1.sym.2fb72bc8-96ef-420d-b08f-c04b69f36507&pf_rd_p=2fb72bc8-96ef-420d-b08f-c04b69f36507&pf_rd_r=F427JAMZDBRHAJGPE87C&pd_rd_wg=gBd8l&pd_rd_r=7c82a3da-bad7-4162-b79b-35adf5d8efb9,,,,,False,"https://m.media-amazon.com/images/S/al-na-9d5791cf-3faf/4e82e17c-76e3-43ec-8bdc-d784badaf1a7._CR0,0,800,800_AC_SX130_SY60_CB1169409_QL70_.png",,eachers' Day Cupcake Fuzzy Socks Bulk,2026-04-21T10:49:38.353248,3.0
1,1,Title,,,,ResultsCheck each product page for other buying options. Price and other details may vary based on p,,,,,,False,,,,2026-04-21T10:49:38.354420,
3,1,Organic,,1.0,B0DJJM84H2,"Nurse Gifts for Women,Cool School Nurse Week Appreciation Graduation Practitioner Retirement Thank You Thanksgiving Essentials Accessories for Work Christmas Valentines Gifts Bracelet Female Ideas",N/A,$4.99,,4.7,71.0,False,https://m.media-amazon.com/images/I/71Bb-Qt43kL._AC_UL320_.jpg,https://m.media-amazon.com/images/I/71Bb-Qt43kL._AC_SL1500_.jpg,,2026-04-21T10:49:38.360300,
4,1,Organic,,2.0,B0CMV2DCXT,"CHMI Under Eye Patches (50 Pairs) - 24K Gold Eye Patches for Puffy Eyes, Dark Circles, EyeBags and Wrinkles, Collagen Skin Care Products, Beauty & Personal Care",N/A,$9.98,,4.5,1133.0,False,https://m.media-amazon.com/images/I/81yyVOb7GKL._AC_UL320_.jpg,https://m.media-amazon.com/images/I/81yyVOb7GKL._AC_SL1500_.jpg,,2026-04-21T10:49:38.364058,
5,1,Organic,,3.0,B0GK1HNFZT,Nurses Week 2026 Decorations Set: Thank You/Happy Nurse Paper Banner Appreciation Hanging Swirls Blue Red White Paper Glasses Photo Booth Props RN Graduation Gifts Party Decor Supplies,N/A,$15.99,,5.0,1.0,False,https://m.media-amazon.com/images/I/815-wZh77DL._AC_UL320_.jpg,https://m.media-amazon.com/images/I/815-wZh77DL._AC_SL1500_.jpg,,2026-04-21T10:49:38.367826,
7,1,Title,,,,Debug info copied.SponsoredAjiangwu 925 Sterling Silver Custom Stethoscope Charms Nurse Graduation G,,,,,,False,,,,2026-04-21T10:49:38.368888,
8,1,Title,,,,Cute and Comfortable Compression Socks for WomenSponsored|9K+ bought from this brand in past month|S,,,,,,False,,,,2026-04-21T10:49:38.369990,
9,1,Title,,,,More results,,,,,,False,,,,2026-04-21T10:49:38.370152,
10,1,Organic,,4.0,B09V7Z4TJG,"medicube Toner Pads Zero Pore Pad 2.0 | Dual-Textured Facial Pad for Exfoliation and Pore Care with 4.5% AHA Lactic Acid, 0.45% BHA Salicylic Acid | Ideal for All, Korean Skin Care, 70 Pads (1 Pack)",N/A,$18.90,,4.6,21704.0,False,https://m.media-amazon.com/images/I/71Mcspt-6AL._AC_UL320_.jpg,https://m.media-amazon.com/images/I/71Mcspt-6AL._AC_SL1500_.jpg,,2026-04-21T10:49:38.378652,
11,1,Organic,,5.0,B0CZ3LL36N,LSLSHY Cute Nurse Pens Funny Nurse Accessories for Work Aesthetic Gel Pen Black Ink Set for Cna Rn Medical Assistant Nursing Student Essentials Nurse Week Gifts Appreciation Gift,N/A,$6.99,,4.8,661.0,False,https://m.media-amazon.com/images/I/61ReA1A1UmL._AC_UL320_.jpg,https://m.media-amazon.com/images/I/61ReA1A1UmL._AC_SL1500_.jpg,,2026-04-21T10:49:38.385564,
12,1,Organic,,6.0,B0BVZXL3ZW,Nurse Graduation Gift for Women Nurse Keychain Nurses Week Gifts Graduation Presents for Nurses Appreciation Gifts,N/A,$5.99,,4.7,683.0,False,https://m.media-amazon.com/images/I/61in6-g-u9L._AC_UL320_.jpg,https://m.media-amazon.com/images/I/61in6-g-u9L._AC_SL1500_.jpg,,2026-04-21T10:49:38.389342,
13,1,Organic,,7.0,B0GMXC3233,5 Pairs Nurse Essentials for Work Arm Sleeves for Nursing Accessories 2026 Nurses Week Gifts CNA Must Haves,N/A,$15.99,,5.0,1.0,False,https://m.media-amazon.com/images/I/81mG8NaWL+L._AC_UL320_.jpg,https://m.media-amazon.com/images/I/81mG8NaWL+L._AC_SL1500_.jpg,,2026-04-21T10:49:38.393085,
14,1,Organic,,8.0,B0F1TFD9HG,"Nurse Gifts for Women 2025, Nurse Appreciation Gifts Nurses Week Set, Nursing Student Graduation Birthday Gift Baskets, Funny Nurses Canvas Tote Bag Tumbler Keychain Socks Thank You Gift for Women",N/A,$22.99,,4.8,314.0,False,https://m.media-amazon.com/images/I/81L4vj7qcuL._AC_UL320_.jpg,https://m.media-amazon.com/images/I/81L4vj7qcuL._AC_SL1500_.jpg,,2026-04-21T10:49:38.400520,
15,1,Organic,,9.0,B0DBVMKZ7G,Pickmesh 12 Pack Nurse Coffee Cup Gifts Bulk 16 oz Appreciation Reusable Holiday Tumblers with Lid Plastic Nurse Travel Coffee Mug Thank You Gifts for Women Coworkers,N/A,$20.99,,4.4,44.0,False,https://m.media-amazon.com/images/I/81yNHIAjpYL._AC_UL320_.jpg,https://m.media-amazon.com/images/I/81yNHIAjpYL._AC_SL1500_.jpg,,2026-04-21T10:49:38.406040,
16,1,Organic,,10.0,B0D5FZGY8W,"O Positiv URO Vaginal Probiotics for Women pH Balance with Prebiotics & Lactobacillus – Vaginal Health Supplement – Promote Healthy Vaginal Odor & Flora, 60 Count (Pack of 1), 1 Month Supply",N/A,$28.97,,4.6,33300.0,False,https://m.media-amazon.com/images/I/51L1a4u7LnL._AC_UL320_.jpg,https://m.media-amazon.com/images/I/51L1a4u7LnL._AC_SL1500_.jpg,,2026-04-21T10:49:38.412574,
17,1,Organic,,11.0,B0CJFGN7S2,"Nurse Straw Covers for Stanley Cup 30&40 Oz Tumbler, Silicone Straw Toppers Fit 10mm Reusable Straws, Nurse Week Appreciation Gifts Bulk",N/A,$7.19,,4.7,1014.0,False,https://m.media-amazon.com/images/I/51aunMdXV4L._AC_UL320_.jpg,https://m.media-amazon.com/images/I/51aunMdXV4L._AC_SL1500_.jpg,,2026-04-21T10:49:38.416460,
18,1,Organic,,12.0,B0DRNPS9YG,Anwyll Nurses Week Gift Tags - 50Pcs Happy Nurse Appreciation Week Tags with String Nurse Thank You Tag Personalized Thank You for All You Do Hang Paper Tag for Gift Wrap Present Treat Bag Party Favor,N/A,$8.99,,4.8,276.0,False,https://m.media-amazon.com/images/I/61EMGgMVkLL._AC_UL320_.jpg,https://m.media-amazon.com/images/I/61EMGgMVkLL._AC_SL1500_.jpg,,2026-04-21T10:49:38.422247,
19,1,Organic,,13.0,B0C9W8DD9S,"Ddaowanx Gel Pens, 6 Pcs 0.5mm Quick Dry Black Ink Pens Fine Point Smooth Writing Pens, Cute Office School Supplies Gifts for Women",N/A,$8.99,,4.6,7759.0,False,https://m.media-amazon.com/images/I/61mcgT64xQL._AC_UL320_.jpg,https://m.media-amazon.com/images/I/61mcgT64xQL._AC_SL1500_.jpg,,2026-04-21T10:49:38.432519,
20,1,Organic,,14.0,B0CW1S35SB,"Jetec 20 Sets Nurse Gift Bulk Nurse Week Appreciation Gifts Nursing Notebook with Sticky Note and Pen Set, Inspirational Thank You Nursing Spiral Journal Notepad (Bright Colors)",N/A,$35.99,,4.8,90.0,False,https://m.media-amazon.com/images/I/81nJyw-YX6L._AC_UL320_.jpg,https://m.media-amazon.com/images/I/81nJyw-YX6L._AC_SL1500_.jpg,,2026-04-21T10:49:38.437248,
21,1,Title,,,,More results,,,,,,False,,,,2026-04-21T10:49:38.437784,
22,1,Organic,,15.0,B0DYV6J92F,"MHSMHL Nurse Gifts for Women, Nurses Week Gift, Nurse Appreciation Gift, Practitioner Gifts for Nurses, Nursing School Essentials with 16oz Glass Cup",N/A,$17.99,,4.7,70.0,False,https://m.media-amazon.com/images/I/81cm6nrEXvL._AC_UL320_.jpg,https://m.media-amazon.com/images/I/81cm6nrEXvL._AC_SL1500_.jpg,,2026-04-21T10:49:38.442142,
23,1,Organic,,16.0,B0DXPP7ZQW,Nurses Week Gifts Bulk 2025-12 Packs Funny Nursing Day Can Coolers Sleeves for Women Men Nurse Appreciation Week Gifts Graduation Rn Themed Party Decorations Supplies Favors,N/A,$16.99,,4.8,10.0,False,https://m.media-amazon.com/images/I/81pCfY3uDHL._AC_UL320_.jpg,https://m.media-amazon.com/images/I/81pCfY3uDHL._AC_SL1500_.jpg,,2026-04-21T10:49:38.447018,
24,1,Organic,,17.0,B0BTYN1ZVP,Xuhal 20 Pairs Nurses' Week Appreciation Gift Nurse Novelty Cotton Ankle Socks Bulk for Doctor Dental Medical Assistant,N/A,$28.99,,4.8,120.0,False,https://m.media-amazon.com/images/I/81clesAaZ4L._AC_UL320_.jpg,https://m.media-amazon.com/images/I/81clesAaZ4L._AC_SL1500_.jpg,,2026-04-21T10:49:38.451397,
25,1,Organic,,18.0,B0CQRSD68B,"Hallmark Healthcare Thank You Card Pack (20 Blank Cards with Envelopes) for Nurses Day, Doctors, Physician Assistants, Medical Professionals",N/A,$7.47,,4.8,114.0,False,https://m.media-amazon.com/images/I/81pugib6rEL._AC_UL320_.jpg,https://m.media-amazon.com/images/I/81pugib6rEL._AC_SL1500_.jpg,,2026-04-21T10:49:38.454991,
26,1,Organic,,19.0,B0F9KVTPDS,"OASSIE Thank You Gifts for Women - Mini Tulip Positive Emotional Support Crochet - Graduation End of Year Teacher Appreciation Gifts for Teachers Nurse Coworker Friend, Retirement Gift for Woman",N/A,$9.95,,4.8,633.0,False,https://m.media-amazon.com/images/I/819ywE8Fk2L._AC_UL320_.jpg,https://m.media-amazon.com/images/I/819ywE8Fk2L._AC_SL1500_.jpg,,2026-04-21T10:49:38.458618,
27,1,Organic,,20.0,B0009F3R7E,"Burt's Bees Gifts Ideas - Hand Repair Set, 3 Hand Creams plus Gloves - Almond Milk, Lemon Butter Cuticle Cream, Shea Butter Repair",N/A,$13.77,,4.7,13511.0,False,https://m.media-amazon.com/images/I/81Ys2BNR6BL._AC_UL320_.jpg,https://m.media-amazon.com/images/I/81Ys2BNR6BL._AC_SL1500_.jpg,,2026-04-21T10:49:38.463183,
28,1,Organic,,21.0,B0FCLNN4LV,JoycuFF Nurse Graduation Gifts - Funny Turtle Nurses Appreciation Gifts for Women Men Thank You Nurse Week Gift Graduation Gift Handmade Emotional Positive Nurses Crochet,N/A,$9.97,,4.8,122.0,False,https://m.media-amazon.com/images/I/71abRKBVqvL._AC_UL320_.jpg,https://m.media-amazon.com/images/I/71abRKBVqvL._AC_SL1500_.jpg,,2026-04-21T10:49:38.468902,
29,1,Organic,,22.0,B0CY2C791K,"DOGMEM Nurse Gifts Nurse Appreciation Gift Set for Women Birthday Gift for Nurses Week Nurses Graduation Gifts for Her, Nursing Student with Canvas Bag Socks Affirmations Cards 16 Oz Can Glass",N/A,$25.97,,4.7,360.0,False,https://m.media-amazon.com/images/I/81s4SgatUKL._AC_UL320_.jpg,https://m.media-amazon.com/images/I/81s4SgatUKL._AC_SL1500_.jpg,,2026-04-21T10:49:38.473037,
30,1,Organic,,23.0,B09SB9Y5TM,8 Pack Mini Funny Nurse Sticky Notes Nursing Student Essentials School Gifts Stationary Sticky Notes Booklet Self Stick Pads for Hospital School Supplies,N/A,$8.99,,4.6,845.0,False,https://m.media-amazon.com/images/I/71D4QOSWqnL._AC_UL320_.jpg,https://m.media-amazon.com/images/I/71D4QOSWqnL._AC_SL1500_.jpg,,2026-04-21T10:49:38.476740,
31,1,Title,,,,More results,,,,,,False,,,,2026-04-21T10:49:38.477193,
32,1,Organic,,24.0,B0BG971YRY,"BulbaCraft 100Pcs Funny Nurse Stickers, Funny Nurse Gifts, Nursing Stickers, Medical Decals for Computer, Cups, Planner Laptop Decals, Gifts for Women & Men",N/A,$9.99,,4.5,967.0,False,https://m.media-amazon.com/images/I/91jBfq7hkzL._AC_UL320_.jpg,https://m.media-amazon.com/images/I/91jBfq7hkzL._AC_SL1500_.jpg,,2026-04-21T10:49:38.481115,
33,1,Organic,,25.0,B09NVZ4VZZ,Chinco 30 Pcs Retractable Shuttle Pen Clip with Mini Highlighter Nurse Badge Pen Neon Marker LED Keychain Ring Clip,N/A,$13.99,,4.4,1110.0,False,https://m.media-amazon.com/images/I/71kye3S1F+L._AC_UL320_.jpg,https://m.media-amazon.com/images/I/71kye3S1F+L._AC_SL1500_.jpg,,2026-04-21T10:49:38.485206,
34,1,Organic,,26.0,B0DPJ2SXNZ,Gemscream 100 Pcs Nurses Week Gifts Bulk Mini Resin Duck Tiny Ducks Statues with Nurse Hat Stethoscope Miniature Figurine Resin Animals Nurses Day Gifts,N/A,$21.99,,4.3,33.0,False,https://m.media-amazon.com/images/I/81DcVV0VMML._AC_UL320_.jpg,https://m.media-amazon.com/images/I/81DcVV0VMML._AC_SL1500_.jpg,,2026-04-21T10:49:38.488682,
35,1,Organic,,27.0,B0CB8DZ11H,"Yinder 24 Pcs Inspirational Sticky Notes Cute Motivational Sticky Notes Pad End of Year Employee Appreciation Gifts Bulk for Teacher Nurse Coworkers Office Supplies 3 x 3'' (Appreciation,Dark Color)",N/A,$14.97,,4.3,865.0,False,https://m.media-amazon.com/images/I/717nUsZDquL._AC_UL320_.jpg,https://m.media-amazon.com/images/I/717nUsZDquL._AC_SL1500_.jpg,,2026-04-21T10:49:38.492191,
36,1,Organic,,28.0,B0CSYX19ZY,luck sea 24Sets Nurses Week Gifts Bulk 2026: Nursing Funny Ballpoint Pens with Appreciation Sayings and Sticky Notes for RN CNA Goodie Bags Stuffers Office Party Favors,N/A,$14.99,,4.7,147.0,False,https://m.media-amazon.com/images/I/81RquwTSRJL._AC_UL320_.jpg,https://m.media-amazon.com/images/I/81RquwTSRJL._AC_SL1500_.jpg,,2026-04-21T10:49:38.496666,
37,1,Organic,,29.0,B093PZK2GF,"Patelai Nurse Need Shots Too, Funny Glass Gift for Women and Male Mom Sister or Friend Present for Nursing Graduation Nurses Day Party 2 oz(2 Pieces,2.36 x 1.97 Inches)",N/A,$9.49,,4.8,1376.0,False,https://m.media-amazon.com/images/I/716D76BF9fS._AC_UL320_.jpg,https://m.media-amazon.com/images/I/716D76BF9fS._AC_SL1500_.jpg,,2026-04-21T10:49:38.502333,
38,1,Organic,,30.0,B0CJBMZ6FL,"Nurse Gifts for Women, Funny Nurse Mug with Gold Print, Nurses Week Retirement Graduation Appreciation Present, School Nursing Student RN Practitioner, 14oz Pink Marbled Ceramic Cup, Nice Gift Boxed",N/A,$12.99,,4.8,3955.0,False,https://m.media-amazon.com/images/I/71tsgXCoUnL._AC_UL320_.jpg,https://m.media-amazon.com/images/I/71tsgXCoUnL._AC_SL1500_.jpg,,2026-04-21T10:49:38.511965,
39,1,Organic,,31.0,B09BHWXFKP,"JOYIN 36pk Retractable- Syringe Pens Bulk Party Favors Fun Nurse Pens, Multi Color Novelty Nursing School Supplies, Classroom Goodie Bags Party Favors",N/A,$11.39,,4.6,1126.0,False,https://m.media-amazon.com/images/I/817us4mheBL._AC_UL320_.jpg,https://m.media-amazon.com/images/I/817us4mheBL._AC_SL1500_.jpg,,2026-04-21T10:49:38.516363,
40,1,Organic,,32.0,B0C73JDN4S,Linbsunne Ballpoint Pens Black Medium Point 1mm Pen with Super Soft Grip Ball Point Pen for Men Women Retractable Pens (gold-12 pcs),N/A,$9.99,,4.8,5820.0,False,https://m.media-amazon.com/images/I/81InKMZkubL._AC_UL320_.jpg,https://m.media-amazon.com/images/I/81InKMZkubL._AC_SL1500_.jpg,,2026-04-21T10:49:38.520290,
41,1,Organic,,33.0,B08CHBCGFL,"10 Pack Hand Cream for Dry Cracked Hands,Mothers Day Gifts,Teacher Appreciation Gifts,Nurses Week Gifts,Birthday Gifts for Women,Natural Plant Fragrance Mini Hand Lotion Moisturizing Hand Care Cream",N/A,$9.99,,4.5,6177.0,False,https://m.media-amazon.com/images/I/71TPFD7SHhL._AC_UL320_.jpg,https://m.media-amazon.com/images/I/71TPFD7SHhL._AC_SL1500_.jpg,,2026-04-21T10:49:38.523857,
42,1,Organic,,34.0,B0BMQC7YW1,"Cityhermit 11Pcs Funny Adult Ballpoint Pen Set, Premium Days of The Week Swear Cuss Word Pens for Office Gifts, Novelty Pens for Corworkers",N/A,$6.99,,4.7,2836.0,False,https://m.media-amazon.com/images/I/71kIitkZ+0L._AC_UL320_.jpg,https://m.media-amazon.com/images/I/71kIitkZ+0L._AC_SL1500_.jpg,,2026-04-21T10:49:38.528042,
43,1,Organic,,35.0,B0FRFW2L13,"Jetec 20 Sets Nurse Gift Bulk Nurse Week Appreciation Gifts Nursing Notebook with Sticky Note and Pen Set, Inspirational Thank You Nursing Spiral Journal Notepad (Healing Colors)",N/A,$32.99,,4.8,90.0,False,https://m.media-amazon.com/images/I/81JNnCDLopL._AC_UL320_.jpg,https://m.media-amazon.com/images/I/81JNnCDLopL._AC_SL1500_.jpg,,2026-04-21T10:49:38.531768,
44,1,Organic,,36.0,B0F9JWSSV5,Teacher Appreciation Nurse Week Gifts: 7 Pcs Gel Pens 0.5mm Black Ink Fine Point Smooth Writing Pens Cute Office Essentials School Supplies Graduation Gifts Stocking Stuffers for Women Teen Girls,N/A,$5.98,,4.6,534.0,False,https://m.media-amazon.com/images/I/61y9pzsdB1L._AC_UL320_.jpg,https://m.media-amazon.com/images/I/61y9pzsdB1L._AC_SL1500_.jpg,,2026-04-21T10:49:38.536066,
45,1,Organic,,37.0,B0CYBNZV8Z,Feifeiya 24 Pcs Funny Badge Reel Nurse Cute Retractable Name ID Clip Badge Holder for Doctor Student Medical Assistant Coworker Work Accessories Bulk Gifts(Medical Style),N/A,$24.99,,4.7,342.0,False,https://m.media-amazon.com/images/I/81nLJfAMXvL._AC_UL320_.jpg,https://m.media-amazon.com/images/I/81nLJfAMXvL._AC_SL1500_.jpg,,2026-04-21T10:49:38.539563,
46,1,Organic,,38.0,B0BQYGGYQ5,"Oudain 60 Pcs Nurse Survival Kit Bag Nursing Makeup Bags Multi Purpose Cosmetic Pouches for Girls Women Travel Supplies, 7.87 x 5.91 Inches(White)",N/A,$12.99,,4.5,114.0,False,https://m.media-amazon.com/images/I/71b740wQunL._AC_UL320_.jpg,https://m.media-amazon.com/images/I/71b740wQunL._AC_SL1500_.jpg,,2026-04-21T10:49:38.544017,
47,1,Organic,,39.0,B0CM3DQKR6,"fenglaoda Compression Socks for Women Men Support Circulation 6 Pairs Socks For Nurse, Travel, Flight",N/A,$17.97,,4.4,2375.0,False,https://m.media-amazon.com/images/I/81wRVOoiBpL._AC_UL320_.jpg,https://m.media-amazon.com/images/I/81wRVOoiBpL._AC_SL1500_.jpg,,2026-04-21T10:49:38.551116,
48,1,Organic,,40.0,B0BRKMVY7J,Ertyjikg 20 Pcs Nurse Week Gift Bags Reusable Thank You Nurses Gift Non-woven Bags Goody Treat Bags 2025 Nurse Graduation Party Decorations,N/A,$13.99,,4.7,41.0,False,https://m.media-amazon.com/images/I/717jkWbSBxL._AC_UL320_.jpg,https://m.media-amazon.com/images/I/717jkWbSBxL._AC_SL1500_.jpg,,2026-04-21T10:49:38.554715,
49,1,Organic,,41.0,B0DWFD9JDG,Willinglong 30 Pcs Nurse Appreciation Gift Set for Women Nurse Gifts Basket Set for Nursing Graduation School Student Cna Week (Colorful Color),N/A,$107.99,,4.5,77.0,False,https://m.media-amazon.com/images/I/81nqfsKn5TL._AC_UL320_.jpg,https://m.media-amazon.com/images/I/81nqfsKn5TL._AC_SL1500_.jpg,,2026-04-21T10:49:38.558959,
50,1,Organic,,42.0,B0CXDL3L1T,"SUCHAGIFT Nurse Gifts for Women - Nurses Week Gifts - Appreciation Gift for Nurses - Nurse Rn Lpn Practitioner Gift for Women - Retirement, Graduation, Christmas Nursing Ideas - 20 Oz Mint Tumbler",N/A,$16.99,,4.8,77.0,False,https://m.media-amazon.com/images/I/71TlYa-NitL._AC_UL320_.jpg,https://m.media-amazon.com/images/I/71TlYa-NitL._AC_SL1500_.jpg,,2026-04-21T10:49:38.563914,
51,1,Title,,,,More results,,,,,,False,,,,2026-04-21T10:49:38.564443,
52,1,Organic,,43.0,B0G56W61F3,"WRAPAHOLIC 2 Inch 500 Total Labels - 2026 Nurses Week Stickers Roll - Nurse Appreciation Design Gift Sticker, Medical Stickers for Nurse Party Favor",N/A,$9.99,,5.0,2.0,False,https://m.media-amazon.com/images/I/61DIdPPlCYL._AC_UL320_.jpg,https://m.media-amazon.com/images/I/61DIdPPlCYL._AC_SL1500_.jpg,,2026-04-21T10:49:38.568949,
53,1,Organic,,44.0,B0GK8N28FV,"12 Pcs Nurse Week Gifts for Women Mini Canvas Tote Bags 6 Cute Nurse Gifts 2026 Themed Designs, Reusable Small Totes for Appreciation Week Daily Storage",N/A,$38.99,,5.0,3.0,False,https://m.media-amazon.com/images/I/81gnukf-WwL._AC_UL320_.jpg,https://m.media-amazon.com/images/I/81gnukf-WwL._AC_SL1500_.jpg,,2026-04-21T10:49:38.572852,
54,1,Organic,,45.0,B094JJNY19,"28 Pack Hand Lotion Gifts for Women,Mothers Day Gifts,Gifts for Mom,Teacher Appreciation Gifts,Nurses Week Gifts,Bulk Gifts for Women,Teen Girls,Natural Fragrance Hand Cream for Dry Cracked Hands",N/A,$13.99,,4.6,4504.0,False,https://m.media-amazon.com/images/I/916X6R041qL._AC_UL320_.jpg,https://m.media-amazon.com/images/I/916X6R041qL._AC_SL1500_.jpg,,2026-04-21T10:49:38.577080,
55,1,Organic,,46.0,B0FZKPD7C8,Remerry 40 Pcs Nurses Gifts for Coworkers Funny Nursing Coffee Cup Fuzzy Socks Set for Pack Respiratory Care Week Appreciation Gift 16 oz Nurse Reusable Coffee Cup DIY Socks,N/A,$38.99,,4.5,2.0,False,https://m.media-amazon.com/images/I/81urUuCzciL._AC_UL320_.jpg,https://m.media-amazon.com/images/I/81urUuCzciL._AC_SL1500_.jpg,,2026-04-21T10:49:38.581105,
56,1,Organic,,47.0,B082QTVPCM,"Bluemaple 6 Pack Copper Compression Socks for Women and Men Circulation-Best Support for Medical, Running,Nursing,Athletic",N/A,$19.99,,4.5,78702.0,False,https://m.media-amazon.com/images/I/61aC2o2RnEL._AC_UL320_.jpg,https://m.media-amazon.com/images/I/61aC2o2RnEL._AC_SL1500_.jpg,,2026-04-21T10:49:38.594078,
57,1,Organic,,48.0,B0G4VV619Q,50 Pcs Nurse Gifts for Women Bulk Rn Appreciation Nail File Bulk Mini Nursing Emery Board Nail Files Nurse Appreciation Gifts for Nurses' Week Female Dental Medical Assistant,N/A,$15.99,,4.8,95.0,False,https://m.media-amazon.com/images/I/814NMLfFUhL._AC_UL320_.jpg,https://m.media-amazon.com/images/I/814NMLfFUhL._AC_SL1500_.jpg,,2026-04-21T10:49:38.597730,
59,1,Title,,,,"Debug info copied.SponsoredCustom Stethoscope Charms Nurse Graduation Gifts for Women,Stethoscope Na",,,,,,False,,,,2026-04-21T10:49:38.598547,
60,1,Title,,,,Related searchesnurse giftsnursenurse accessories for worknephrology giftsnurses weeknephrology nurs,,,,,,False,,,,2026-04-21T10:49:38.599409,
61,1,Title,,,,Previous123...7Next,,,,,,False,,,,2026-04-21T10:49:38.599743,
62,1,SB,2.0,,,N/A,https://aax-us-east-retail-direct.amazon.com/x/c/JO1arvLGEsfjUb-uyF8c4CEAAAGdr6jZcAEAAAH2AQBvbm9fdHhuX2JpZDYgICBvbm9fdHhuX2ltcDEgICBPci8B/clv1c_ek-YBIHXFcbWDn2nI5drJ16WtD5jqoDmOI_WJl7ym5m4MWefLolvZqYRgYFxyj_0tWQXPqPVHF8KZ78urZxJyysbDxPC8COPbAld-VzXHkAuvfcDrsKhjGXQSikV2imsRyF15qs6tO5rtvexCf8k-9HJpP2cl_mulMv3h3tqrUeZ2IleOOKG5diR70Q-4_IIvMTv8tOr_kdPHmL7vt7lOcCZMWWFTmyNjATNAEAt4eidNsPb04l9M4eNrpKBW9VNEYsArG13-Ty8TzSGsNA8KKD6egNLL5DAEoWCY48CIlBItLdfoRGckS_fy75l24l4K7G1yUykNYWDUN8-DecSoMf51h_FUEWxPG5l__QruRSWsPRdAIpgDdFsUnoRbMI_SelXKSM5PkyiBCpRuk9SQv4JaRvGlcR9bGLWM9h3qoGrzxqNjenTVw2DSehIXn3B1rGjBAqxOXckdAhd11dKRq2lZZ_pvzhwyY02-EqWf6T7Xj75YIQyNNfasFYnsvXg2_SMzO-A-lpNWE5oizLHVx_l47ng94E0DRDtRGKXjLK5x4fFiasBpwpo7i8nEv_5xHI11IDhUTg8A1UIW7QDAB_Ia10SofIilLkhxQLsfBsZZYglcRDTiU0_qVvBSqYfTWg2ag-saREVQVOx67T5VlDgJjaoD1A7fB7a9oX_GTQmP5cUNNjFgHVCVymFL3d3O_0oVO-ll57P2qJqczZTYM1owEI2TJ13rRGCzeHdgHncBxsZXajAKkO4BUMh5TAiW8y4bdfL6WkDvH2eU2RMrsxGhMJEs_Iv9bzOIjzqiWxkUmlBTn4ZabMCnsx86mh3EoM4Vpe-gGpKKrykDzCH80JUqVglTaSzWqI4MzYFstO80OrWQIXKiXcekR32UZMbC94rhuAhMjEfhEZdMRJo3Ko3A4awUWdQNYN-o_XtmvhTWWw3UW7Vot_faCvau46GzdJ2MZu0Yv5D2M3mgfuXGzm4d4_tLzqpJ1dwSsIG7g7kmFdeAz__EYam0wWGVghcxlguuoUyZfKVsCEYh7rRcmdH9Neh7ZsP9-iPEBOdkZsi-ZHjJx_xKStyWMZQGTjk0IfU65ZyTtB5nUky2xbUs6BIsuQpSyw8HLgTEcV6h1n4NmDao7InkYhqa1FCbEcLdCmRBL13BXUnpnhpfVV0GmX-n_uqcMdlRLsT38be_RDmruSzAinsRDQFcl6yEf-PyLAx4yZydi4mMj-QD-pfgeQmcFj-glzaMCoQZHKnO8HuyngfDZHMuhktWRZEUAvC9BQcgzs7jZNVo1yFyltW65iLNc9nuJKPV-9i0IU_apAXdgVCthiogR5arxizKsLy_LrCCRfVx0B46bnlfYRBWrwugFJHmnXfEsoOPT-7LwpXa10a6EO6wjBukfgsP1XPLZfQYNtOge4DWdBvAE20R_VBtouypaPAuGkcH31gJa9sjLI3vIo6GqK6Y_b3VpkMLrHpE713LAVx5wOWdMQ0Q8xxX5cwo4Yk0WI9V-Q5ClAtxpfgkk795g5ZjOmoOZ0zcLfg3wI5bd6yg95vzRCI4Sasf6foh1HZidFJYWDrSVUOWmx9MYtAAJGLvLa1RRpyZk6zEoINfXOimuQyl--IwPld8npDIK6_tv_ezDBA55ynJKZ_jltCsW0NHlDx/https://www.amazon.com/stores/page/6D739491-1B98-497D-AB5E-1ABCC42529C9/?_encoding=UTF8&store_ref=SB_A07007551RFJX92PIZRYY-A03034662UPOSC1Z80HA7&pd_rd_plhdr=t&aaxitk=0b4dd06596e0c4a9f783f3ff1a7079e6&hsa_cr_id=0&lp_asins=B0GFDCMCMF%2CB0GFNC9FJS%2CB0GFD6HSC6&lp_query=nurses%20week%20gifts&lp_slot=desktop-hsa-3psl&ref_=sbx_be_s_3psl_mbd_mb0_bkgd&pd_rd_w=9QYvY&content-id=amzn1.sym.cd7c548b-a599-426f-9ffe-daa1aa803c87%3Aamzn1.sym.cd7c548b-a599-426f-9ffe-daa1aa803c87&pf_rd_p=cd7c548b-a599-426f-9ffe-daa1aa803c87&pf_rd_r=F427JAMZDBRHAJGPE87C&pd_rd_wg=QCN7x&pd_rd_r=b7f63c9f-e149-48ac-87d9-e84f50e88325,,,,,False,,,N/A,2026-04-21T10:49:38.604461,
63,1,Title,,,,Need help?Visit the help sectionorcontact us,,,,,,False,,,,2026-04-21T10:49:38.605176,
0,2,SB_Video,1.0,,,N/A,N/A,,,,,False,,,,2026-04-21T10:49:52.689736,6.0
1,2,Title,,,,ResultsCheck each product page for other buying options. Price and other details may vary based on p,,,,,,False,,,,2026-04-21T10:49:52.691349,
3,2,Organic,,49.0,B0GCJNRY49,"90 Pcs Nurse Appreciation Gifts Bulk 30 Sets 2026 Nurse Week Hand Cream & Lip Balm with Bags and Tags, Thank You Gifts for Hospital Staff Midwife CNA RN Nursing Graduation Favors",N/A,,,4.6,46.0,False,https://m.media-amazon.com/images/I/91P6eVpaGpL._AC_UL320_.jpg,https://m.media-amazon.com/images/I/91P6eVpaGpL._AC_SL1500_.jpg,,2026-04-21T10:49:52.695895,
4,2,Organic,,50.0,B0DRHR1PY5,"Nurse Gifts for Women, Nurse Appreciation Gifts, Nurse Week Gifts Acrylic Heart Sign Nurse Graduation Gift School Nurse Practitioner Gifts for Women Desk Decor",N/A,$5.98,,4.8,414.0,False,https://m.media-amazon.com/images/I/71QevWkW8KL._AC_UL320_.jpg,https://m.media-amazon.com/images/I/71QevWkW8KL._AC_SL1500_.jpg,,2026-04-21T10:49:52.700980,
