data_index,page,ad_type,ad_rank,organic_rank,asin,title,url,price_current,price_list,rating_stars,rating_count,is_prime,image_small,image_large,brand_name,scraped_at
9,6,Organic,,143.0,B007OLKF5I,"Fun Express Rubber Ducks Beach Balls Set of 12 - Premium 11 Inch Inflatable Duck Pool Toys for Kids | Perfect for Cruise Ships, Pool Party Decorations & Beach Games | Bulk Water Toys Bundle",N/A,CNY 133.21,,4.3,119.0,False,https://m.media-amazon.com/images/I/61ecWJcXQxL._AC_UL320_.jpg,https://m.media-amazon.com/images/I/61ecWJcXQxL._AC_SL1500_.jpg,,2026-04-16T09:42:31.719166
10,6,Organic,,144.0,B0DNV3CVZL,"xo, Fetti Pink Tropical Vacation Tablecloth - 9' x 4.5' | Bachelorette Cocktail Tablescape, Palm Tree Dinner Party Setting, Miami Birthday Decoration, Cute Tablecover, Beach Table Decor",N/A,CNY 122.65,,5.0,2.0,False,https://m.media-amazon.com/images/I/6138nkC6OGL._AC_UL320_.jpg,https://m.media-amazon.com/images/I/6138nkC6OGL._AC_SL1500_.jpg,,2026-04-16T09:42:31.725174
11,6,Organic,,145.0,B09VC2W2PC,Zhanmai 6 Pieces Inflatable Clear Beach Ball 16 Inch Clear Pool Floating Ball Balloons for Under The Sea Party Decoration DIY Bubble Summer Beach Swimming Pool Hawaii Luau Party Favor,N/A,CNY 68.11,,4.0,154.0,False,https://m.media-amazon.com/images/I/613HZlukjwL._AC_UL320_.jpg,https://m.media-amazon.com/images/I/613HZlukjwL._AC_SL1500_.jpg,,2026-04-16T09:42:31.729268
12,6,Organic,,146.0,B0DN75FQDK,"xo, Fetti Pink Tropical Vacation Plastic Cups | 16 pcs 17 oz | Iridescent Summer Drinkware, Flamingo Decorations, Palm Leaf Bachelorette Party Drinks, Birthday Supplies",N/A,CNY 149.92,,5.0,10.0,False,https://m.media-amazon.com/images/I/71tQVvX3QxL._AC_UL320_.jpg,https://m.media-amazon.com/images/I/71tQVvX3QxL._AC_SL1500_.jpg,,2026-04-16T09:42:31.734276
13,6,Organic,,147.0,B0DVTBMVMV,"xo, Fetti I Got a Text Banner - Blue Iridescent Foil, 6 Ft. | Island Bachelorette Decorations, Love Villa Birthday Backdrop, Reality Bach Party, Bday Photo Booth Supplies",N/A,CNY 81.74,,4.4,10.0,False,https://m.media-amazon.com/images/I/51AFzk9ZWKL._AC_UL320_.jpg,https://m.media-amazon.com/images/I/51AFzk9ZWKL._AC_SL1500_.jpg,,2026-04-16T09:42:31.739345
14,6,Title,,,,Jellyarch 10 Pcs Inflatable Palm Tree Set Giant Blow up Palm Tree Fake Wooden Boxes Natural Fishing ,,,,,,False,,,,2026-04-16T09:42:31.740859
15,6,Title,,,,More results,,,,,,False,,,,2026-04-16T09:42:31.740859
16,6,Organic,,148.0,B0G1SKW2MR,2 Pack 47.24 Inches Donut Pool Floats Large Inflatable Donuts Tube Jumbo Swim Rings with Sprinkles for Adults Swimming Pool Party Decorations Supplies,N/A,CNY 177.18,,4.1,4.0,False,https://m.media-amazon.com/images/I/71Ym0SBs4iL._AC_UL320_.jpg,https://m.media-amazon.com/images/I/71Ym0SBs4iL._AC_SL1500_.jpg,,2026-04-16T09:42:31.746548
17,6,Organic,,149.0,B0D64SQP1K,"xo, Fetti Pool Party Paper Coloring Tablecloth - 9' x 4.5' | Summer Tablescape, Palm Tree Dinner Party Setting, Kids Birthday Decoration, Cute Tablecover, Beach Table DIY",N/A,CNY 68.11,,5.0,13.0,False,https://m.media-amazon.com/images/I/81A-AcateyL._AC_UL320_.jpg,https://m.media-amazon.com/images/I/81A-AcateyL._AC_SL1500_.jpg,,2026-04-16T09:42:31.752616
18,6,Organic,,150.0,B0C7VCXKGC,"141 Pcs Rainbow Neon Balloon Arch Kit, Hot Pink Lime Green Orange Slate Blue Yellow Latex Hawaii Summer Tropical Balloon Garland for Hawaiian Luau Aloha Birthday Baby Shower Pool Party Decorations",N/A,CNY 115.83,,4.5,951.0,False,https://m.media-amazon.com/images/I/81oKy0HeszL._AC_UL320_.jpg,https://m.media-amazon.com/images/I/81oKy0HeszL._AC_SL1500_.jpg,,2026-04-16T09:42:31.763786
19,6,Organic,,151.0,B0F8GR9GTG,"Party Favors Kids Sunglasses Bulk - 16 Packs Neon Sunglasses for Kid Age 3-8, UV400 Protection Party Sunglasses Goodie Bags Stuffers for kids Birthday Party Supply, End of the Year Gifts For Students",N/A,CNY 92.58,,4.7,111.0,False,https://m.media-amazon.com/images/I/81JrfNkiUwL._AC_UL320_.jpg,https://m.media-amazon.com/images/I/81JrfNkiUwL._AC_SL1500_.jpg,,2026-04-16T09:42:31.770322
20,6,Organic,,152.0,B0G4W86L8F,Blosssound Beach Ball Piñata Summer Pool Party Decorations Supplies Rainbow Pool Ball Piñata Set with Stick Blindfold for Hawaiian Tropical Luau Beach Theme Birthday Baby Shower Celebration Decor,N/A,CNY 170.37,,3.8,54.0,False,https://m.media-amazon.com/images/I/71hY22QZV4L._AC_UL320_.jpg,https://m.media-amazon.com/images/I/71hY22QZV4L._AC_SL1500_.jpg,,2026-04-16T09:42:31.780309
21,6,Organic,,153.0,B0D5ZNJWVR,4E's Novelty Summer Inflatable Limbo Game Party Game for Kids Boys Girls Adults Tropical Inflatable Decoration for Indoor Outdoor Bithday Beach Pool Tropical Luau Backyard Game,N/A,CNY 204.45,,3.7,126.0,False,https://m.media-amazon.com/images/I/71lPT-wabXL._AC_UL320_.jpg,https://m.media-amazon.com/images/I/71lPT-wabXL._AC_SL1500_.jpg,,2026-04-16T09:42:31.789606
22,6,Organic,,154.0,B0BTYLTMB3,"Kepeel 96 Pcs Summer Pool Beach Party Paper Plates Napkins, Beach Pool Ball Party Decorations Supplies Disposable Dinnerware Tableware for Kids, Serves 24",N/A,CNY 115.83,,4.7,1348.0,False,https://m.media-amazon.com/images/I/71Egk8uyCqL._AC_UL320_.jpg,https://m.media-amazon.com/images/I/71Egk8uyCqL._AC_SL1500_.jpg,,2026-04-16T09:42:31.801103
23,6,Organic,,155.0,B096LS5Q25,Float Joy Sprinkler for Kids Outdoor Play Water Sprinkler Inflatable 5.5ft Giant Dinosaur T-REX Great Gift for Kids and Adults Water Toy for Pool Party Decorations Summer Yard Party,N/A,CNY 224.91,,4.3,1108.0,False,https://m.media-amazon.com/images/I/81wkKzVwpaL._AC_UL320_.jpg,https://m.media-amazon.com/images/I/81wkKzVwpaL._AC_SL1500_.jpg,,2026-04-16T09:42:31.809076
24,6,Organic,,156.0,B0D61416DG,"4E's Novelty Inflatable Limbo Game for Kids Adults 62"" Luau Party Game, Indoor Outdoor Inflatable Lawn Yard Games, Summer Hawaiian Birthday Activity Carnival Game",N/A,CNY 204.45,,3.2,144.0,False,https://m.media-amazon.com/images/I/619Yz5llksL._AC_UL320_.jpg,https://m.media-amazon.com/images/I/619Yz5llksL._AC_SL1500_.jpg,,2026-04-16T09:42:31.819714
25,6,Organic,,157.0,B0CPWCWSD6,"uoyoi Pool Party Favors,24Pcs Summer Bubble Wands for Kids,Beach Bubble Wand for Pool Birthday Party Supplies,Classroom Prizes Pinata Goodie Bag Stuffers Gift",N/A,CNY 102.19,,4.5,515.0,False,https://m.media-amazon.com/images/I/71VtAN79k5L._AC_UL320_.jpg,https://m.media-amazon.com/images/I/71VtAN79k5L._AC_SL1500_.jpg,,2026-04-16T09:42:31.827350
26,6,Organic,,158.0,B0G2RMHBQW,"Trgowaul Ocean Theme Birthday Decorations for Girls, Sea Animals Birthday Party Supplies, Fish Hanging Swirls, Seashell Cake Topper, Starfish Cards, Fishing Net, Latex Balloon, Summer Beach Party Set",N/A,CNY 136.28,,4.8,13.0,False,https://m.media-amazon.com/images/I/81PofIe0FJL._AC_UL320_.jpg,https://m.media-amazon.com/images/I/81PofIe0FJL._AC_SL1500_.jpg,,2026-04-16T09:42:31.832423
27,6,Organic,,159.0,B0BR3R2534,"12 Pack Inflatable Beach Balls Bulk - 16"" Glitter Pool Toys Balls for Summer Beach Pool Party, Swimming Pool Game Water Beach Toys Party Favor Summer Luau Decoration Essential Blow Up Beach Ball",N/A,CNY 143.10,,4.4,156.0,False,https://m.media-amazon.com/images/I/917a2ykjO5L._AC_UL320_.jpg,https://m.media-amazon.com/images/I/917a2ykjO5L._AC_SL1500_.jpg,,2026-04-16T09:42:31.839050
28,6,Organic,,160.0,B0F13P9P91,"Beach Party Supplies, 144Pcs Ocean Waves Birthday Party Supplies Tableware Set Summer Pool party Decorations Ocean Plates and Napkins and Cups for Hawaiian Birthday Decorations",N/A,CNY 122.65,,4.7,17.0,False,https://m.media-amazon.com/images/I/810a-TFmmTL._AC_UL320_.jpg,https://m.media-amazon.com/images/I/810a-TFmmTL._AC_SL1500_.jpg,,2026-04-16T09:42:31.843590
29,6,Organic,,161.0,B0CCXTCSD2,"Aignis 24pcs Flameless Floating Candles Waterproof, 200Hr 3”LED Floating Tea Lights with Battery, Water-Activated Candles for Pool, Wedding Centerpieces, Bath & Spa, Easter Decoration (Elegant White)",N/A,CNY 170.37,,4.0,503.0,False,https://m.media-amazon.com/images/I/61iQjhZb6HL._AC_UL320_.jpg,https://m.media-amazon.com/images/I/61iQjhZb6HL._AC_SL1500_.jpg,,2026-04-16T09:42:31.848606
30,6,Organic,,162.0,B0G6KZBDFN,"Civaner 6 Pcs Inflatable Glitter Beach Balls 24 Inch Large Sparkly Confetti Pool Balls for Holiday Party Decorations Clear Floatable Blow up for Wedding Birthday Summer Party Favor(Colorful,Confetti)",N/A,CNY 136.28,,3.8,133.0,False,https://m.media-amazon.com/images/I/81rjOY4Q6HL._AC_UL320_.jpg,https://m.media-amazon.com/images/I/81rjOY4Q6HL._AC_SL1500_.jpg,,2026-04-16T09:42:31.857643
31,6,Organic,,163.0,B0GK193MPZ,175Pcs Hawaiian Luau Party Decorations Aloha Tropical Tropical Hibiscus Floral Tableware Supplies Hawaii Palm Leaves Plates for Summer Hawaiian Birthday BBQ Pool Beach Party Supplies Serves 25 Guests,N/A,CNY 170.37,,4.6,17.0,False,https://m.media-amazon.com/images/I/812VDNvQBQL._AC_UL320_.jpg,https://m.media-amazon.com/images/I/812VDNvQBQL._AC_SL1500_.jpg,,2026-04-16T09:42:31.864059
32,6,Organic,,164.0,B0G5MC397C,"6 Pieces Pastel Beach Balls Bulk- 17 Inch Inflatable Pool Balls, PVC Inflatable Ball for Theme Gender Reveal Birthday Party Decorations Summer Swimming Pool Game Supplies",N/A,CNY 109.01,,4.4,3.0,False,https://m.media-amazon.com/images/I/61mZfZPU79L._AC_UL320_.jpg,https://m.media-amazon.com/images/I/61mZfZPU79L._AC_SL1500_.jpg,,2026-04-16T09:42:31.869808
33,6,Organic,,165.0,B0B9MTRL3W,"Pool Hair Don't Care Hat, Funny Adjustable Embroidered Pool Decor Baseball Cap for Women Men",N/A,CNY 136.28,,4.6,48.0,False,https://m.media-amazon.com/images/I/61imHdxApnL._AC_UL320_.jpg,https://m.media-amazon.com/images/I/61imHdxApnL._AC_SL1500_.jpg,,2026-04-16T09:42:31.874199
34,6,Organic,,166.0,B0BXP8S2YG,"Beach Theme Party Supplies, Summer Pool Pack Includes: Paper Dinner Plates, Dessert Plates, Luncheon Napkins, Cups and Tablecloth for Hawaiian Party Birthday Decorations, Serve 25",N/A,CNY 163.48,,4.7,2049.0,False,https://m.media-amazon.com/images/I/81iVLvNoQQL._AC_UL320_.jpg,https://m.media-amazon.com/images/I/81iVLvNoQQL._AC_SL1500_.jpg,,2026-04-16T09:42:31.881233
35,6,Organic,,167.0,B0D9N65WLG,"Mega-L Glow in The Dark Party Supplies, Neon Party Decorations, 2 Pack 6.6x6.6 ft Fluorescent Green Foil Fringe Curtains, Glow Photo Backdrop for Birthday, Pool Party, Music Festival, Nightclub",N/A,CNY 68.11,,4.5,329.0,False,https://m.media-amazon.com/images/I/81G7PM3w4QL._AC_UL320_.jpg,https://m.media-amazon.com/images/I/81G7PM3w4QL._AC_SL1500_.jpg,,2026-04-16T09:42:31.888851
36,6,Organic,,168.0,B0101AFV3Y,"GiftExpress 25pcs Mini Beach Ball - 6"" Small Inflatable Rainbow Multicolor Beach Balls for Kids Birthday Goodie Bag, Party Favor, Toddler Summer Water Toys, Pool Party, Carnival Award, Give Away Toys",N/A,CNY 115.83,,4.3,283.0,False,https://m.media-amazon.com/images/I/61ZW90IjvML._AC_UL320_.jpg,https://m.media-amazon.com/images/I/61ZW90IjvML._AC_SL1500_.jpg,,2026-04-16T09:42:31.895436
37,6,Organic,,169.0,B0C33JK547,Sensfun Summer Pool Party Backdrop Swimming Beach Ball Girls Birthday Decorations Vinyl Banner Splish Splash Pool Flamingo Lifebuoy Ice Cream Summer Holiday Background Photo Booth Props 7x5ft,N/A,CNY 94.01,,4.9,21.0,False,https://m.media-amazon.com/images/I/71iqLYTxPsL._AC_UL320_.jpg,https://m.media-amazon.com/images/I/71iqLYTxPsL._AC_SL1500_.jpg,,2026-04-16T09:42:31.901960
38,6,Organic,,170.0,B0CSRZ8JBR,Chivao 192 Beach Pool Party Favors Summer Pool Toy Gift Bulk for Kids End of Year Student Gifts Bulk Sand Buckets Shovels Bubble Wands Sunglasses Water Guns Sidewalk Chalks Swim Party Supply,N/A,CNY 368.07,,4.3,23.0,False,https://m.media-amazon.com/images/I/81W5m0pTpBL._AC_UL320_.jpg,https://m.media-amazon.com/images/I/81W5m0pTpBL._AC_SL1500_.jpg,,2026-04-16T09:42:31.909629
39,6,Organic,,171.0,B0CCVV291K,3 Pack Teal Aqua Blue Wave Foil Curtains - 3.3 ft x 6.6 ft Tinsel Metallic Streamers for Photo Booth Birthday Wedding Girl Princess Bachelorette Euphoria Theme Party Decorations,N/A,CNY 95.38,,4.6,1218.0,False,https://m.media-amazon.com/images/I/91ZkHD2+QQL._AC_UL320_.jpg,https://m.media-amazon.com/images/I/91ZkHD2+QQL._AC_SL1500_.jpg,,2026-04-16T09:42:31.915651
40,6,Organic,,172.0,B0FDQWYY2Y,"Ocean Themed Party Balloons Arch Kit, Turquoise Blue Teal Clear Metallic Balloons for Kids Ocean Sea Themed Pool Party Baby Shower Birthday Beach Party Decorations",N/A,CNY 101.51,,4.5,57.0,False,https://m.media-amazon.com/images/I/81n6MJCsWSL._AC_UL320_.jpg,https://m.media-amazon.com/images/I/81n6MJCsWSL._AC_SL1500_.jpg,,2026-04-16T09:42:31.923780
41,6,Organic,,173.0,B0D64DCTHH,"4E's Novelty 3D Beach Balls - 4 Pack 13"" Inflatable Pool Toys, Flamingo, Mermaid, Shark, Sea Horse Unique Pool Ball, Ocean Under the Sea Party Decorations for Kids Toddlers Adult",N/A,CNY 115.83,,4.4,113.0,False,https://m.media-amazon.com/images/I/61tC6oUOk1L._AC_UL320_.jpg,https://m.media-amazon.com/images/I/61tC6oUOk1L._AC_SL1500_.jpg,,2026-04-16T09:42:31.932714
42,6,Organic,,174.0,B0FD9KLKLG,"Lunmon 24 Pcs Drink Containers Set Include Inflatable Swimming Pool Rings Serving Buffet Bar, Plastic Scoopers, Clear Bowls and Place Cards for Pool Party Decorations Summer Party Supplies",N/A,CNY 245.36,,,,False,https://m.media-amazon.com/images/I/71ckVdwLFlL._AC_UL320_.jpg,https://m.media-amazon.com/images/I/71ckVdwLFlL._AC_SL1500_.jpg,,2026-04-16T09:42:31.937401
43,6,Organic,,175.0,B0D1MYGN5X,"Beach Party Supplies, 142Pcs Ocean Waves Birthday Party Supplies Tableware Set Summer Pool Party Decorations Plates,Cups,Napkins,Banner,Tablecloth for Hawaiian Party Birthday Decorations",N/A,CNY 136.28,,4.6,100.0,False,https://m.media-amazon.com/images/I/81beLxrTvsL._AC_UL320_.jpg,https://m.media-amazon.com/images/I/81beLxrTvsL._AC_SL1500_.jpg,,2026-04-16T09:42:31.942646
44,6,Organic,,176.0,B0D3WKT79G,Peryiter 3 Pcs Summer Colorful Flip Flop Banner 8.2 ft Summer Garland Pom Pom Garland Tropical Flip Flop Banner Felt Slipper Garland for Hawaiian Beach Pool Party Classroom Decorations Supplies,N/A,CNY 95.38,,3.1,4.0,False,https://m.media-amazon.com/images/I/71vD7Ijf3uL._AC_UL320_.jpg,https://m.media-amazon.com/images/I/71vD7Ijf3uL._AC_SL1500_.jpg,,2026-04-16T09:42:31.951219
45,6,Organic,,177.0,B07RN8ZRSZ,"Jet Creations Cow Inflatable Animal Baby 37 inch Long Great for Pool Party Decoration, Birthday Kids and Adult an-Cow",N/A,CNY 136.01,,4.5,6965.0,False,https://m.media-amazon.com/images/I/61Wd8kV5RCL._AC_UL320_.jpg,https://m.media-amazon.com/images/I/61Wd8kV5RCL._AC_SL1500_.jpg,,2026-04-16T09:42:31.958421
46,6,Organic,,178.0,B0BZ9GDFJ6,"24 Summer Pool Drinking Straws for Kids, Pool Party Decorations Supplies, Pool Party Favors for Kids Birthday, Crazy Silly Straws for Beach Theme Party Decorations with 2 Pcs Cleaning Brushes",N/A,CNY 68.11,,4.7,141.0,False,https://m.media-amazon.com/images/I/817fKoAXU4L._AC_UL320_.jpg,https://m.media-amazon.com/images/I/817fKoAXU4L._AC_SL1500_.jpg,,2026-04-16T09:42:31.966185
47,6,Organic,,179.0,B0GP22HST1,"Pool Party Adult Party Game, Waterproof Card Game for Adults, Fun Pool Games for Adult, Best Pool Toys and Pool Accessories for Summer, 100 Cards",N/A,CNY 204.45,,4.5,20.0,False,https://m.media-amazon.com/images/I/71YffK3O7aL._AC_UL320_.jpg,https://m.media-amazon.com/images/I/71YffK3O7aL._AC_SL1500_.jpg,,2026-04-16T09:42:31.971220
48,6,Organic,,180.0,B0BZXZ4RRR,"REGUICORP 2 Pack Beach Balls, 20 Inch Beach Balls, Rainbow Color Pool Toys Pool Balls for Swimming Pool, Beach Toys Inflatable Ball for Summer Parties and Water Games",N/A,CNY 47.65,,4.5,1235.0,False,https://m.media-amazon.com/images/I/51UeWHU84ML._AC_UL320_.jpg,https://m.media-amazon.com/images/I/51UeWHU84ML._AC_SL1500_.jpg,,2026-04-16T09:42:31.977966
49,6,Organic,,181.0,B0G7X1P64Y,16Pcs Summer Party Decorations Paper Lanterns Pom Poms Hanging Swirls - Luau Beach Pool Hawaiian Tropical Hanging Decor for Home Birthday Outdoor Indoor,N/A,CNY 109.01,,4.9,16.0,False,https://m.media-amazon.com/images/I/81X2FLgG9rL._AC_UL320_.jpg,https://m.media-amazon.com/images/I/81X2FLgG9rL._AC_SL1500_.jpg,,2026-04-16T09:42:31.985614
50,6,Organic,,182.0,B0GMQ5J6W4,"Hawaiian Luau Party Decorations,144Pcs Tropical Hawaiian Tableware Set Hibiscus Floral Plates,Napkins,Cup Tropical Palm Leaf Birthday Decoration for Summer Pool Beach Party Supplies",N/A,CNY 109.01,,3.0,1.0,False,https://m.media-amazon.com/images/I/81YkiqTsZAL._AC_UL320_.jpg,https://m.media-amazon.com/images/I/81YkiqTsZAL._AC_SL1500_.jpg,,2026-04-16T09:42:31.990731
51,6,Organic,,183.0,B0G63M4BZM,"Beach Ball 12 Pack - 12'' Inflatable Beach Balls for Kids Bulk, Swimming Pool Toys Beach Toys for Summer Water Games, Hawaiian Tropical Theme Party Decorations Favors Supplies",N/A,CNY 68.11,,4.5,309.0,False,https://m.media-amazon.com/images/I/71BLmxXaPRL._AC_UL320_.jpg,https://m.media-amazon.com/images/I/71BLmxXaPRL._AC_SL1500_.jpg,,2026-04-16T09:42:31.998894
52,6,Organic,,184.0,B0F5Q38FGC,"Moon Boat 60Pcs Hawaiian Luau Paper Glasses for Adults Bulk, Summer Beach Party Photo Props Hawaii Tiki Tropical Pool Sunglasses Decorations Supplies",N/A,CNY 95.38,,4.5,8.0,False,https://m.media-amazon.com/images/I/91ULW1zAZmL._AC_UL320_.jpg,https://m.media-amazon.com/images/I/91ULW1zAZmL._AC_SL1500_.jpg,,2026-04-16T09:42:32.006070
53,6,Organic,,185.0,B0DLNL2DT4,"2 Pack Backdrop Curtains, 3.28 Feet x 7.05 Feet Sky Blue Tinsel Backdrop, Metallic Fringe Curtains Foil Tinsel Party Streamer, Winter Backdrop Happy Birthday Party Supplies",N/A,CNY 40.77,,4.5,2997.0,False,https://m.media-amazon.com/images/I/91lL8c-zHSL._AC_UL320_.jpg,https://m.media-amazon.com/images/I/91lL8c-zHSL._AC_SL1500_.jpg,,2026-04-16T09:42:32.012675
54,6,Organic,,186.0,B09NVT8F6N,"Floating Lights Solar Powered Globes for Pool, Pond, Patio & Hot Tub – Outdoor Lanterns Look Like Candles or Torches, Fun Decorations & Cool Gifts for Adults, Pool Toys & Must-Have Decor (1 pcs)",N/A,,,4.0,315.0,False,https://m.media-amazon.com/images/I/71-XxSWhveL._AC_UL320_.jpg,https://m.media-amazon.com/images/I/71-XxSWhveL._AC_SL1500_.jpg,,2026-04-16T09:42:32.016372
56,6,Title,,,,"Seen on social mediaSponsored4.5x33 Ft Ocean and Beach Wall Backdrop Decorations,Roll of Plastic Sea",,,,,,False,,,,2026-04-16T09:42:32.025437
57,6,Title,,,,Related searchespool party suppliespool party gamespool party decorations for adultspool party backd,,,,,,False,,,,2026-04-16T09:42:32.027474
58,6,Title,,,,Previous1...567Next,,,,,,False,,,,2026-04-16T09:42:32.027474
59,6,SB,8.0,,,N/A,https://aax-us-east-retail-direct.amazon.com/x/c/JKPlrvkF9CqytFXVXqvClhIAAAGdk_QhaQEAAAH2AQBvbm9fdHhuX2JpZDcgICBvbm9fdHhuX2ltcDIgICDCKsCE/clv1c_ek-wBPfXFbbSzTK3Y5t8r3dcuEaZLu8ni23CUO6iznNaVBV3lHengeGct4OH6wuqwhnBSOxIdhWdORlpZr0hh5WsYwyCUMrgqIniDy1oRcsEgyMYauu8DjPVasl0oGErow2lLRQsG4r763sgNMCBpajkpsSMVlTpiJTu7U_yjCcdUHgp9qRT6zrL9UtY5JUDfb1LxAn1JjvEJVRddi6D92w9NJQbAUrS8JzXlGir2Dqys7APH7xWwfBkMCZiCmfCuVZQ0jtVTCyZYJbG7CKq5EkBngp1cv4w9_zuBj2eCp6dkRUTZidrJcnNRmP_UioKgy3fWYOoNFMGu4P_FWIKl0QPq_91Kfg4MKtvk0GRLE69cZED5baqN6VLyz6gRnTguFttvZlKhRmlCpXPeftfa5QxpuDiDCjC755TKbOIO8fju4pVOdH_ZQ340_QArtTzBtvQO4zmvC4YgZFjo_mc-v4bXE63mefN6mtDP9Cchg9cIt4vHu4ud7UhbBuaHpg0C8r-bi3ylnC7jPmNNqpaivL0qNbpTH3FeElAkzGo-246tgIXtWzJT4LCmCxUB1MeQ-jaCc_9uQz90FR0p2QuYYaGfwpISlTeV-7fSy0oolpJ95UI-HxJgjXPB6poHef6NwOdwKtCv653-2GZKpkLQhIFj4J68PET9RsbhL8m0c3NwO8oqDKD0g6_7BXcIt5ZX3zveRkMil5y0Wg0fBCVfjUVQsb3GM_yKapZXjuj0rwW5A4SrLmeBdOoEveZCNLZNtiJnpIFmQ3ZGntFwDZ4TQIdrckrdmLVrgjEpuItiOcp1Ej_4jIkhlPPA0pUtdCzlNiaJjB06l63g3gJwbHqU8OaMxh3zXO8vDlp9jPrnMP4Qs0yLlFH11JIsoR2Ga7ywn-VfalHS2WqrNQdXqBIxIM6Kc7nISBtrG449Y_J1mDCNTzPvvYEACintUCTWEkdMfz3pX_PaajM8tkZwLZkW3uh9MW6c3SIlVUDNzIpG13MI6m2oDcVAK86BUefbnfnvL7Sxn6Bc4h9IKPmoYP6EnpD-HSeMyjlqKxtUG_1-4okGUqMeOAyWdr3Z2QjyRARRX33MZnrzRsNgkFvtiHeMldxQcLHaQOH0ePZIbsxCor9VVu857pS8Nts_nLLlvphDUOcd1dSZSPLcb2VSZHi58Tf883cv7GPt2Ag6bWZQcPqv7R9G_Qqy-q7eYQcBLwtzV5r603QGk5YRGTdqd0xJ2Ors6fC80VXFrMxlPumijvd8vsCyGovqR1vW57IQTbJTwavCYAWmslMtPxlEqQbwE-9m8PzU8gL8WnbVKbFRPcpXR5BD1orxCgo3kZj52rLLhInYzgpWBcPefzOqkxi_UCLrzL3HDv0RlOFRSYAX5khN9AaBvYq1l7mZhEkKvxHEvtnR2unl26gAR2n4CnKmCPAjkjnx1We9Yr_4kMCH18mSiEFqrRIp7cLcfSX-SQ4poWQ2SJdMO2QaqmOEVKEDiYW90qQ0KTJiu6y1RummcncyQc3aEQjepg3azQBVjU9KO0z0uqO6EZAC_9u9zfyYKpvju8br5aDgVn_tluvHt6rOh66M9eLoSeJxyFBAt25HyzqYlJnEOQ9iCIcBpsQff2ilmhmv3dRYTgqAQzeaWtH-ctmsA0ChsHAL8jb_MBL5ktNSlxvjJ4NQq4LlRTFPE-t-xVScg/https://www.amazon.com/stores/page/BD6963EF-3C57-4E0B-81BD-813B93882854/?_encoding=UTF8&store_ref=SB_A04447023HM0PJWIGJN2E-A026818221VGB7Z1PA5JF&pd_rd_plhdr=t&aaxitk=f71d4d855b1eee54c4174ef9e78ab5a0&hsa_cr_id=0&lp_asins=B0D44RFJXR%2CB0GCZXW3NL%2CB0GCZYCD47&lp_query=pool%20party%20decorations&lp_slot=desktop-hsa-3psl&ref_=sbx_be_s_3psl_mbd_mb0_bkgd&pd_rd_w=P55AK&content-id=amzn1.sym.cd7c548b-a599-426f-9ffe-daa1aa803c87%3Aamzn1.sym.cd7c548b-a599-426f-9ffe-daa1aa803c87&pf_rd_p=cd7c548b-a599-426f-9ffe-daa1aa803c87&pf_rd_r=QFD539227NASJYV7J9AJ&pd_rd_wg=CfXGh&pd_rd_r=46104480-8b9c-4d69-871b-eecd40260f3a,,,,,False,,,N/A,2026-04-16T09:42:32.039773
60,6,Title,,,,Need help?Visit the help sectionorcontact us,,,,,,False,,,,2026-04-16T09:42:32.039773
0,7,Title,,,,ResultsCheck each product page for other buying options. Price and other details may vary based on p,,,,,,False,,,,2026-04-16T09:42:46.039303
2,7,Organic,,187.0,B0D1MYGN5X,"Beach Party Supplies, 142Pcs Ocean Waves Birthday Party Supplies Tableware Set Summer Pool Party Decorations Plates,Cups,Napkins,Banner,Tablecloth for Hawaiian Party Birthday Decorations",N/A,CNY 136.28,,4.6,100.0,False,https://m.media-amazon.com/images/I/81beLxrTvsL._AC_UL320_.jpg,https://m.media-amazon.com/images/I/81beLxrTvsL._AC_SL1500_.jpg,,2026-04-16T09:42:46.044954
3,7,Organic,,188.0,B0D3WKT79G,Peryiter 3 Pcs Summer Colorful Flip Flop Banner 8.2 ft Summer Garland Pom Pom Garland Tropical Flip Flop Banner Felt Slipper Garland for Hawaiian Beach Pool Party Classroom Decorations Supplies,N/A,CNY 95.38,,3.1,4.0,False,https://m.media-amazon.com/images/I/71vD7Ijf3uL._AC_UL320_.jpg,https://m.media-amazon.com/images/I/71vD7Ijf3uL._AC_SL1500_.jpg,,2026-04-16T09:42:46.049437
4,7,Organic,,189.0,B07RN8ZRSZ,"Jet Creations Cow Inflatable Animal Baby 37 inch Long Great for Pool Party Decoration, Birthday Kids and Adult an-Cow",N/A,CNY 136.01,,4.5,6965.0,False,https://m.media-amazon.com/images/I/61Wd8kV5RCL._AC_UL320_.jpg,https://m.media-amazon.com/images/I/61Wd8kV5RCL._AC_SL1500_.jpg,,2026-04-16T09:42:46.055458
5,7,Title,,,,"Inflatable Pool Games Volleyball Net Pool Float Set with 19"" Beach Ball, Lighthouse Design – Floatin",,,,,,False,,,,2026-04-16T09:42:46.056461
6,7,Title,,,,More results,,,,,,False,,,,2026-04-16T09:42:46.056461
7,7,Organic,,190.0,B0BZ9GDFJ6,"24 Summer Pool Drinking Straws for Kids, Pool Party Decorations Supplies, Pool Party Favors for Kids Birthday, Crazy Silly Straws for Beach Theme Party Decorations with 2 Pcs Cleaning Brushes",N/A,CNY 68.11,,4.7,141.0,False,https://m.media-amazon.com/images/I/817fKoAXU4L._AC_UL320_.jpg,https://m.media-amazon.com/images/I/817fKoAXU4L._AC_SL1500_.jpg,,2026-04-16T09:42:46.061157
8,7,Organic,,191.0,B0GP22HST1,"Pool Party Adult Party Game, Waterproof Card Game for Adults, Fun Pool Games for Adult, Best Pool Toys and Pool Accessories for Summer, 100 Cards",N/A,CNY 204.45,,4.5,20.0,False,https://m.media-amazon.com/images/I/71YffK3O7aL._AC_UL320_.jpg,https://m.media-amazon.com/images/I/71YffK3O7aL._AC_SL1500_.jpg,,2026-04-16T09:42:46.066696
9,7,Organic,,192.0,B0BZXZ4RRR,"REGUICORP 2 Pack Beach Balls, 20 Inch Beach Balls, Rainbow Color Pool Toys Pool Balls for Swimming Pool, Beach Toys Inflatable Ball for Summer Parties and Water Games",N/A,CNY 47.65,,4.5,1235.0,False,https://m.media-amazon.com/images/I/51UeWHU84ML._AC_UL320_.jpg,https://m.media-amazon.com/images/I/51UeWHU84ML._AC_SL1500_.jpg,,2026-04-16T09:42:46.071355
10,7,Organic,,193.0,B0G7X1P64Y,16Pcs Summer Party Decorations Paper Lanterns Pom Poms Hanging Swirls - Luau Beach Pool Hawaiian Tropical Hanging Decor for Home Birthday Outdoor Indoor,N/A,CNY 109.01,,4.9,16.0,False,https://m.media-amazon.com/images/I/81X2FLgG9rL._AC_UL320_.jpg,https://m.media-amazon.com/images/I/81X2FLgG9rL._AC_SL1500_.jpg,,2026-04-16T09:42:46.076868
11,7,Organic,,194.0,B0GMQ5J6W4,"Hawaiian Luau Party Decorations,144Pcs Tropical Hawaiian Tableware Set Hibiscus Floral Plates,Napkins,Cup Tropical Palm Leaf Birthday Decoration for Summer Pool Beach Party Supplies",N/A,CNY 109.01,,3.0,1.0,False,https://m.media-amazon.com/images/I/81YkiqTsZAL._AC_UL320_.jpg,https://m.media-amazon.com/images/I/81YkiqTsZAL._AC_SL1500_.jpg,,2026-04-16T09:42:46.082412
12,7,Organic,,195.0,B0G63M4BZM,"Beach Ball 12 Pack - 12'' Inflatable Beach Balls for Kids Bulk, Swimming Pool Toys Beach Toys for Summer Water Games, Hawaiian Tropical Theme Party Decorations Favors Supplies",N/A,CNY 68.11,,4.5,309.0,False,https://m.media-amazon.com/images/I/71BLmxXaPRL._AC_UL320_.jpg,https://m.media-amazon.com/images/I/71BLmxXaPRL._AC_SL1500_.jpg,,2026-04-16T09:42:46.091596
13,7,Title,,,,More results,,,,,,False,,,,2026-04-16T09:42:46.092498
14,7,Organic,,196.0,B0F5Q38FGC,"Moon Boat 60Pcs Hawaiian Luau Paper Glasses for Adults Bulk, Summer Beach Party Photo Props Hawaii Tiki Tropical Pool Sunglasses Decorations Supplies",N/A,CNY 95.38,,4.5,8.0,False,https://m.media-amazon.com/images/I/91ULW1zAZmL._AC_UL320_.jpg,https://m.media-amazon.com/images/I/91ULW1zAZmL._AC_SL1500_.jpg,,2026-04-16T09:42:46.096558
15,7,Organic,,197.0,B0DLNL2DT4,"2 Pack Backdrop Curtains, 3.28 Feet x 7.05 Feet Sky Blue Tinsel Backdrop, Metallic Fringe Curtains Foil Tinsel Party Streamer, Winter Backdrop Happy Birthday Party Supplies",N/A,CNY 40.77,,4.5,2997.0,False,https://m.media-amazon.com/images/I/91lL8c-zHSL._AC_UL320_.jpg,https://m.media-amazon.com/images/I/91lL8c-zHSL._AC_SL1500_.jpg,,2026-04-16T09:42:46.101121
16,7,Organic,,198.0,B09NVT8F6N,"Floating Lights Solar Powered Globes for Pool, Pond, Patio & Hot Tub – Outdoor Lanterns Look Like Candles or Torches, Fun Decorations & Cool Gifts for Adults, Pool Toys & Must-Have Decor (1 pcs)",N/A,,,4.0,315.0,False,https://m.media-amazon.com/images/I/71-XxSWhveL._AC_UL320_.jpg,https://m.media-amazon.com/images/I/71-XxSWhveL._AC_SL1500_.jpg,,2026-04-16T09:42:46.109880
