data_index,page,ad_type,ad_rank,organic_rank,asin,title,url,price_current,price_list,rating_stars,rating_count,is_prime,image_small,image_large,brand_name,scraped_at
30,4,Organic,,102.0,B0G2MNM6K6,"xo, Fetti Pool Party Cupcake Toppers and Wrappers - 24 Pc Set | Summer Birthday Decorations, Tropical Luau, Hawaiian Theme, Kids Party, Beach Ball, Pink Hibiscus",N/A,CNY 68.11,,,,False,https://m.media-amazon.com/images/I/61pezXRjecL._AC_UL320_.jpg,https://m.media-amazon.com/images/I/61pezXRjecL._AC_SL1500_.jpg,,2026-04-16T09:41:52.803009
31,4,Organic,,103.0,B0B7WXTV8Z,"10Pack 6”Paper Floating Candle Lantern,Wooden Water Lanterns with Candles,Outdoor Patio Decor for Pool Parties,Wedding,Memorials,Garden (10Lanterns with Candles)",N/A,CNY 204.45,,4.4,49.0,False,https://m.media-amazon.com/images/I/71d6hjvgM2L._AC_UL320_.jpg,https://m.media-amazon.com/images/I/71d6hjvgM2L._AC_SL1500_.jpg,,2026-04-16T09:41:52.808603
32,4,Organic,,104.0,B0GKG7M8VG,"24PCS Hawaiian Party Decorations, Hawaiian Cardboard Glasses Bulk, Luau Party Sunglasses Frame Tropical Dress Pool Props Accessories, Hawaii Carnival Summer Pool Party Decorations for Women Men",N/A,CNY 102.19,,4.7,21.0,False,https://m.media-amazon.com/images/I/91mMAZ6XzEL._AC_UL320_.jpg,https://m.media-amazon.com/images/I/91mMAZ6XzEL._AC_SL1500_.jpg,,2026-04-16T09:41:52.816627
33,4,Organic,,105.0,B071H6KNHV,60pcs Luau Photo Booth Props - Hawaiian/Tropical/Tiki/Summer Pool Party Decorations Supplies (Assembly Needed),N/A,CNY 95.31,,4.4,1406.0,False,https://m.media-amazon.com/images/I/71jsAyjGTWL._AC_UL320_.jpg,https://m.media-amazon.com/images/I/71jsAyjGTWL._AC_SL1500_.jpg,,2026-04-16T09:41:52.822343
34,4,Organic,,106.0,B0FGWNLSSP,"Inflatable Starfish Balloons 5-Pack 24+inch Large Durable PVC - Reusable Star fish for Birthday, Baby Shower, Pool, Beach Party, Photo Props, Under the Sea Party Decorations & Ocean-Themed Gifts",N/A,CNY 136.28,,4.8,35.0,False,https://m.media-amazon.com/images/I/81dEZiTUZRL._AC_UL320_.jpg,https://m.media-amazon.com/images/I/81dEZiTUZRL._AC_SL1500_.jpg,,2026-04-16T09:41:52.828349
35,4,Organic,,107.0,B0CR6SRDHT,"200pcs Hawaiian Leis Bulk, Colorful Luau Party Decorations Silk Flower Leis Necklace, Tropical Hawaiian Bulk Hula Dance Party Decor, Hawaiian Flower Leis Summer Beach Pool Party Decorations Supplies",N/A,CNY 340.80,,4.5,2697.0,False,https://m.media-amazon.com/images/I/91r3kbTPWnL._AC_UL320_.jpg,https://m.media-amazon.com/images/I/91r3kbTPWnL._AC_SL1500_.jpg,,2026-04-16T09:41:52.833378
36,4,Organic,,108.0,B0G423SS9Z,Pink 10 Pcs 16 Inch 2026 Graduation Beach Balls Pool Floats Inflatable Grad Beach Ball Congrats Sign Bulk Prep for Grad Class of 2026 Swimming Pool Graduation Party Supplies Favors,N/A,CNY 170.37,,4.8,32.0,False,https://m.media-amazon.com/images/I/81Ri-qDol7L._AC_UL320_.jpg,https://m.media-amazon.com/images/I/81Ri-qDol7L._AC_SL1500_.jpg,,2026-04-16T09:41:52.841563
37,4,Organic,,109.0,B09N3YL8ML,"Triumpeek Inflatable Llama Pool Float, 51"" Fiesta Alpaca Pool Floaties, Novelty Fun Water Inflatable Ride-On for Summer Swimming Pool Party Decoration Toys for Adults",N/A,CNY 177.18,,4.3,322.0,False,https://m.media-amazon.com/images/I/71QgWpljWLL._AC_UL320_.jpg,https://m.media-amazon.com/images/I/71QgWpljWLL._AC_SL1500_.jpg,,2026-04-16T09:41:52.847085
38,4,Organic,,110.0,B00411TD02,Fun Express Under The Sea Party Decorations Inflatables 6 Pack - Ocean Themed Party Favors with Shark Dolphin Whale Octopus Fish Seahorse | Inflatable Animals for Birthday Decor & Classroom Display,N/A,CNY 189.12,,4.4,278.0,False,https://m.media-amazon.com/images/I/81+mrjZuZVL._AC_UL320_.jpg,https://m.media-amazon.com/images/I/81+mrjZuZVL._AC_SL1500_.jpg,,2026-04-16T09:41:52.852511
39,4,Organic,,111.0,B0DZ5QBRSS,"GiftExpress 40"" Beach Balls 2 Pack - Polka Dot & Striped Giant Transparent Inflatable Balls for Swimming Pool Party - Summer Outdoor Water Toys & Decorations",N/A,CNY 115.83,,3.8,60.0,False,https://m.media-amazon.com/images/I/71JfDJSS0pL._AC_UL320_.jpg,https://m.media-amazon.com/images/I/71JfDJSS0pL._AC_SL1500_.jpg,,2026-04-16T09:41:52.858296
40,4,Organic,,112.0,B005M4EPF0,"Fun Express Mini Beach Balls Bulk Set 50 Pack - 5 Inch Inflatable Pool Toys for Kids Ages 4-8 | Colorful Beach Games for Pool Party Decorations, Summer Birthday Favors & Outdoor Water Play Activities",N/A,CNY 190.82,,4.4,127.0,False,https://m.media-amazon.com/images/I/61azXbdEcZL._AC_UL320_.jpg,https://m.media-amazon.com/images/I/61azXbdEcZL._AC_SL1500_.jpg,,2026-04-16T09:41:52.862862
41,4,Organic,,113.0,B0GKZPLHFP,"Reallnaive Pool Party Favors Jelly Basket Beach Towel Heart Sunglasses Bachelorette Pool Party Supplies for Women(49 Pcs,Pink)",N/A,CNY 422.61,,4.2,5.0,False,https://m.media-amazon.com/images/I/81I6xyLUhCL._AC_UL320_.jpg,https://m.media-amazon.com/images/I/81I6xyLUhCL._AC_SL1500_.jpg,,2026-04-16T09:41:52.866871
42,4,Organic,,114.0,B0CR6RXWT1,"100pcs Luau Party Decorations, Silk Hawaiian Leis Tropical Flower Necklaces, Colorful Hula Dance Bulk Leis Decor, Flower Hawaiian Leis for Summer Beach Pool Theme Party Decorations Favors Supplies",N/A,CNY 245.36,,4.5,2697.0,False,https://m.media-amazon.com/images/I/91Qb2mxWFxL._AC_UL320_.jpg,https://m.media-amazon.com/images/I/91Qb2mxWFxL._AC_SL1500_.jpg,,2026-04-16T09:41:52.872940
43,4,Organic,,115.0,B08THRQ3D1,"American Flag Inflatable Cooler, Pool Party Decorations 130+ Cans Large Drink Cooler with Red White and Blue Stars for 4th of July Summer Pool Party Supplies Luau Hawaiian Beach Party Decor",N/A,CNY 104.51,,4.3,312.0,False,https://m.media-amazon.com/images/I/71OymuxtAKL._AC_UL320_.jpg,https://m.media-amazon.com/images/I/71OymuxtAKL._AC_SL1500_.jpg,,2026-04-16T09:41:52.877296
44,4,Organic,,116.0,B0F9Y9SJNZ,"50 Counts Hawaiian Leis Bulk Decorations, Leis for Luau Party Hawaiian Colorful Tropical Flower Lays for Adults Hawaii Summer Beach Luau Party Favors Birthday Party Supplies",N/A,CNY 136.28,,4.8,41.0,False,https://m.media-amazon.com/images/I/81QW9MLaIaL._AC_UL320_.jpg,https://m.media-amazon.com/images/I/81QW9MLaIaL._AC_SL1500_.jpg,,2026-04-16T09:41:52.881818
45,4,Organic,,117.0,B0GDQVDTBN,"Summer Party Decorations Set, Pre-Strung Hello Summer Banner Hanging Swirls Beach Pool Decorations for Summer Pool Holiday Birthday Party Supplies Indoor Outdoor",N/A,CNY 61.29,,5.0,1.0,False,https://m.media-amazon.com/images/I/71yJfmIZkHL._AC_UL320_.jpg,https://m.media-amazon.com/images/I/71yJfmIZkHL._AC_SL1500_.jpg,,2026-04-16T09:41:52.886335
46,4,Organic,,118.0,B0GMQ84KMG,"4 Pack Beach Plastic Tablecloth Party Decorations, Disposable Summer Pool Table Cloth, Waterproof Tropical Surfboard Table Cover for Summer Hawaiian Theme Birthday Party Supplies",N/A,CNY 68.11,,5.0,1.0,False,https://m.media-amazon.com/images/I/718ZyTON4KL._AC_UL320_.jpg,https://m.media-amazon.com/images/I/718ZyTON4KL._AC_SL1500_.jpg,,2026-04-16T09:41:52.892370
47,4,Organic,,119.0,B0DS1P27SR,Tingjoo Splish Splash Summer Birthday Decorations Pink Splish Splash Happy Birthday Pool Party Banner Extra Large Size Banner for Summer Pool Party Supplies 118 x 20 Inch(Elegant Style),N/A,CNY 61.29,,4.8,23.0,False,https://m.media-amazon.com/images/I/71Lq3fDABdL._AC_UL320_.jpg,https://m.media-amazon.com/images/I/71Lq3fDABdL._AC_SL1500_.jpg,,2026-04-16T09:41:52.897395
48,4,Organic,,120.0,B005EGUP9G,"Jet Creations DI-PTE Dinosaur Pteranodon Inflatable 57"" Wingspan- Great for Pool Party Decoration Birthday for Kids & Adults, Multicolor",N/A,CNY 132.94,,4.6,4236.0,False,https://m.media-amazon.com/images/I/61GY0Mi4VDL._AC_UL320_.jpg,https://m.media-amazon.com/images/I/61GY0Mi4VDL._AC_SL1500_.jpg,,2026-04-16T09:41:52.902762
49,4,Organic,,121.0,B0D5B1SXZ9,"3 Pack Ocean Tablecloths Iridescent Plastic Disposable Table Cloth Rectangle Water Wave Table Covers for Under Sea Ocean Pool Beach Party Decorations, 54 x 108Inch",N/A,CNY 61.29,,4.5,105.0,False,https://m.media-amazon.com/images/I/71HH3uKuaqL._AC_UL320_.jpg,https://m.media-amazon.com/images/I/71HH3uKuaqL._AC_SL1500_.jpg,,2026-04-16T09:41:52.906840
50,4,Organic,,122.0,B0DP21D9BL,"25pcs Hawaiian Leis Bulk,Colorful Lei Tropical Flower Necklace Hawaii Hula Dance Decor for Summer Beach Pool Luau Party Birthday Decoration Favors Supplies",N/A,CNY 52.09,,4.2,377.0,False,https://m.media-amazon.com/images/I/812uJFjV7FL._AC_UL320_.jpg,https://m.media-amazon.com/images/I/812uJFjV7FL._AC_SL1500_.jpg,,2026-04-16T09:41:52.911842
51,4,Organic,,123.0,B0GCGHJ4DY,Wesiti 12 Pcs Summer Table Decor Wooden Summer Beach Table Centerpieces Beach Pool Balls Palm Tree Flamingo Tabletop Topper Tropical Hawaii Tiered Tray Decor for Kitchen Holiday Pool Party Supplies,N/A,CNY 88.56,,4.4,93.0,False,https://m.media-amazon.com/images/I/81BBxRTihOL._AC_UL320_.jpg,https://m.media-amazon.com/images/I/81BBxRTihOL._AC_SL1500_.jpg,,2026-04-16T09:41:52.916871
52,4,Organic,,124.0,B01I40OAVW,"Gamie Duck Pond Matching Carnival Game for Kids, 36"" x 6"" Inflatable Pool & 20 Plastic Ducks with Numbers, Water Outdoor Game for Kids, Fun Memory Game for Backyard, Birthday Party Field Day Games",N/A,CNY 156.73,,4.4,1258.0,False,https://m.media-amazon.com/images/I/81jR8tGX1QL._AC_UL320_.jpg,https://m.media-amazon.com/images/I/81jR8tGX1QL._AC_SL1500_.jpg,,2026-04-16T09:41:52.922532
54,4,Title,,,,Debug info copied.SponsoredBalgardekor Life is Better at the Pool Garden Flag Vertical Double Sided ,,,,,,False,,,,2026-04-16T09:41:52.922532
55,4,Title,,,,Related searchespool party suppliespool party gamespool party decorations for adultspool party backd,,,,,,False,,,,2026-04-16T09:41:52.924036
56,4,Title,,,,Previous1234567Next,,,,,,False,,,,2026-04-16T09:41:52.925041
57,4,SB,6.0,,,N/A,https://aax-us-east-retail-direct.amazon.com/x/c/JGQ8gk7UHKm37fRwkoJw4NoAAAGdk_OJ_QEAAAH2AQBvbm9fdHhuX2JpZDQgICBvbm9fdHhuX2ltcDEgICDKkUxG/clv1c_ek-wBAfWFcbSDn0nIotrJ16WpAySuUbn_6iNAEHCl6-XdM7WK3nXu3ksOxTGDOiXxocZkAkWIbPoxmtskm3vTslYphZdcPQJZgqgji1uRcUED93X-vg2zTvz8PX0Z_Y3ymqXh_zPyQ3ZfpJV5ngvTv5Yqe_M1lbgtuTs5yfKzQcVYSfNvq-XkTJ6EojLbim1Nexr83G3mIDJ1PLJbwRoMqqvOdYXh8462Apl5S1mYbM-Cdmj0wXfoXsa06Ui2mByxpL_xcqx3co4BcErKDGf5EkBnApltr8oN8TgBLwact6vxamjsT2vp6agGCySZQarOiBLP7_VPUyL3csW4-Q3ZdkT9i5tuOXZvZG1-oelTZ0nPOTUhrSZ6GeM7GHHb2NcR2oPRoIoiRlmeqoKFPth51fxnoJ06NaXK7VWoRef7yORFcXi7Shl0sEeme88YOWmf1iRq-Q-X17APLN5XTCCebZm63vUNZ2-v8-Q30plEBm0AIEXCN03YqYzXcsfqQxm3JXHB-H5tmHXGcSED5Qa1W9BlxnCXrWXYKqUWoJuTN3RUOhhC7S5KXQizXLFvhmRLx9fQllvbNVQs-bWXS7OqoTr73dDFtGlpbXRrKW396reVIOcZ-Ujvi2W1auOP0hd0vlviXwnKdpWarCrV4971POWktMT0SC5v4tjG5t1Z5vOIDmZ4R46bFFgVBAq4KfUbURs8qtRs-mu8giQo1TK5CBKVr9mrABtBveic0B641gnEzPlpj0fLry-xiCG-p7pyREXsaxElQiODjOOvnoVhURN1x0MLZVtIipCcfNYGJ8peQJ7jt_Bp_KRADhrqZsv2QcERmB76bmaxu_5iNKuisjA-sT9vdFYfD693EoO8ZaqJnfCyErcM8ftY4ImgImNrNdPpERtPP_lugYQjfxz3YxONXt9gTXRFlBcrzycD1BwyuNwYmJ84EPpPE4ukqvBiyfiOCTpD1qmTCng0BcuhDGO6Zl-fVKXFG6DIOQpeqVCeZ-udtCjpLY2tDEOt3MYuXFR-jFUJ75ddJ9rsRscOF-rJaSEwDMVDuPxuz1-ZcWD86PvUIrEJNUuPNuwy91US8oRnNEV2Xv7Zuo12tVdOnRyjBeVN11RJlfyTz2yfgmFKzMacOxi-S7fTYQekZM8JEoBVTrp6BNTJQCiEpTFRNbOvoTyFsMWRCzmllU51ei4uwlL11lLfU5v0OL5CLFbfyl75VTIoyNbx9Ww1S2PmSJE16au1MxDgTG4SzynYnAFTxUuh-e-YE4SOFr7b6zuxk8-vc_V_wQYXMatmxf17cxSS9kb3kcZl2SgtWJIAoYtMuwopTZVn7v-pkhSPJDX5ZCGZzGwQtecTVEtvKUtqb8LDN7LaoofnOrLN6vunfiaV5lEpT8TJ_0MEFaS7FSVw-KJQPoLj1jbqhypWGBPNddul7SydHVcoKPPraJ4nnhltR4jOFxT6B59QEgYdowUlLkNDf1bLr0Acqh_IKT1rhSB2y6diUXKxmaHzwcnBuiZnoBHQRtKlQ9StdtbnW4AkvUmlWue4RHY063RGFgSGoTGRvYAdyBH2L4nWyf0Z1PK1F_f8vCDhElk3KC7VO4CmUv4Pq7r7KRHk79yn1zUFrFsy7vLPRXbZsI1PIdeFYLX_2Svxbx9gaKI7JowUJgg7suMigvCT4DzeoP2TzXFdmve9Oe-gGCkAw/https://www.amazon.com/stores/page/BD6963EF-3C57-4E0B-81BD-813B93882854/?_encoding=UTF8&store_ref=SB_A04447023HM0PJWIGJN2E-A026818221VGB7Z1PA5JF&pd_rd_plhdr=t&aaxitk=f71d4d855b1eee54c4174ef9e78ab5a0&hsa_cr_id=0&lp_asins=B0D44RFJXR%2CB0GCZXW3NL%2CB0GCZYCD47&lp_query=pool%20party%20decorations&lp_slot=desktop-hsa-3psl&ref_=sbx_be_s_3psl_mbd_mb0_bkgd&pd_rd_w=G3I2Y&content-id=amzn1.sym.cd7c548b-a599-426f-9ffe-daa1aa803c87%3Aamzn1.sym.cd7c548b-a599-426f-9ffe-daa1aa803c87&pf_rd_p=cd7c548b-a599-426f-9ffe-daa1aa803c87&pf_rd_r=7R4ANJZKVSHJZJV7DF68&pd_rd_wg=ZyZAA&pd_rd_r=74cc194c-27a4-4309-b8db-7d6b58933664,,,,,False,,,N/A,2026-04-16T09:41:52.930576
58,4,Title,,,,Need help?Visit the help sectionorcontact us,,,,,,False,,,,2026-04-16T09:41:52.931581
0,5,Title,,,,FiltersMost Purchased& UpAll DiscountsToday's DealsDiscoverDiscoverPool FloatString LightsBalloonsCl,,,,,,False,,,,2026-04-16T09:42:09.774097
1,5,Title,,,,ResultsCheck each product page for other buying options. Price and other details may vary based on p,,,,,,False,,,,2026-04-16T09:42:09.776095
3,5,SP,1.0,,B0GKTZ5JNK,"LED Light Up Inflatable Ice Bucket - Transparent Blue Drink Cooler with Silver Rim & Color Changing Lights - Portable Inflatable Cooler & Storage Bin for Night Pool Party, BBQ, Luau Party Decorations",N/A,CNY 122.65,,4.7,16.0,False,https://images-na.ssl-images-amazon.com/images/G/01/x-locale/common/grey-pixel.gif,https://images-na.ssl-images-amazon.com/images/G/01/x-locale/common/grey-pixel.gif,,2026-04-16T09:42:09.784656
4,5,Organic,,125.0,B0FZLZN5CP,"xo, Fetti Pool Party Birthday Banner | Kids Party Decorations, Tropical Summer, Hawaiian Luau, Flamingo, Pink Glitter, Happy Birthday Garland",N/A,CNY 74.92,,5.0,2.0,False,https://images-na.ssl-images-amazon.com/images/G/01/x-locale/common/grey-pixel.gif,https://images-na.ssl-images-amazon.com/images/G/01/x-locale/common/grey-pixel.gif,,2026-04-16T09:42:09.795895
5,5,Title,,,,More results,,,,,,False,,,,2026-04-16T09:42:09.797403
6,5,Organic,,126.0,B07WPS8C8D,HAPIKAY Solar Floating Pool Lights - Pack of 2 Solar Powered Color Changing 14-inch Balls - Float or Hang in Pool Garden Backyard Pond Party Decorations - Inflatable Wateproof,N/A,CNY 218.09,,4.5,2537.0,False,https://images-na.ssl-images-amazon.com/images/G/01/x-locale/common/grey-pixel.gif,https://images-na.ssl-images-amazon.com/images/G/01/x-locale/common/grey-pixel.gif,,2026-04-16T09:42:09.809723
7,5,Title,,,,birthday coloring tableclothsSponsored| Top 10 best-selling brand in this categoryGatherfun Giant Co,,,,,,False,,,,2026-04-16T09:42:09.812238
8,5,Title,,,,More results,,,,,,False,,,,2026-04-16T09:42:09.812238
9,5,Organic,,127.0,B0C946BBSW,"JUXIAO 5 Pack Upgrated XL Water Pool Floats, 4-in-1 (Hammock, Saddle, Lounge Chair, Drifter) Multi-Purpose Water Pool Float, Non-Stick PVC Material",N/A,CNY 134.85,,4.4,1818.0,False,https://images-na.ssl-images-amazon.com/images/G/01/x-locale/common/grey-pixel.gif,https://images-na.ssl-images-amazon.com/images/G/01/x-locale/common/grey-pixel.gif,,2026-04-16T09:42:09.819878
10,5,Organic,,128.0,B091HP49FJ,"Voiiake Pool Floats Toys Games Set, Inflatable Cross Ring Toss Game Toy with 6pcs Rings for Kids Adults Family, Swimming Pool Water Game",N/A,CNY 88.56,,4.3,711.0,False,https://images-na.ssl-images-amazon.com/images/G/01/x-locale/common/grey-pixel.gif,https://images-na.ssl-images-amazon.com/images/G/01/x-locale/common/grey-pixel.gif,,2026-04-16T09:42:09.828903
11,5,Organic,,129.0,B0GKZ857XN,"140PCS Summer Pool Party Decorations Set Swimming Beach Ball Themed Birthday, Tropical Hawaii Holiday Tableware Supplies Includes Plates, Napkin, Fork, Cup, Serves 20",N/A,CNY 122.65,,4.4,105.0,False,https://images-na.ssl-images-amazon.com/images/G/01/x-locale/common/grey-pixel.gif,https://images-na.ssl-images-amazon.com/images/G/01/x-locale/common/grey-pixel.gif,,2026-04-16T09:42:09.834930
12,5,Organic,,130.0,B09NLZ8V9L,"Pool Toys Games Set,Pool Basketball Hoop Inflatable Cross Ring Toss Game and Inflatable Cactus Kids for Teens Adults and Family (3 Set Water Toys)",N/A,CNY 149.92,,4.0,1120.0,False,https://images-na.ssl-images-amazon.com/images/G/01/x-locale/common/grey-pixel.gif,https://images-na.ssl-images-amazon.com/images/G/01/x-locale/common/grey-pixel.gif,,2026-04-16T09:42:09.840947
13,5,Organic,,131.0,B0GKNL7PMH,"Flamingo Hawaiian Party Decorations, Luau Party Decor Flamingo and Pineapple Honeycomb Ball Paper Lanterns for Birthday Pool Summer Tropical Beach Party Supplies",N/A,CNY 95.38,,4.8,21.0,False,https://images-na.ssl-images-amazon.com/images/G/01/x-locale/common/grey-pixel.gif,https://images-na.ssl-images-amazon.com/images/G/01/x-locale/common/grey-pixel.gif,,2026-04-16T09:42:09.849014
14,5,SP,2.0,,B0GR4XSB7R,"Pool Party Decorations Backdrop, Pink Happy Birthday Backdrop Summer Party Decorations Photography Background Banner for Summer Pool Birthday Party Decor",N/A,CNY 68.11,,,,False,https://m.media-amazon.com/images/I/81VXtkHIoTL._AC_SX148_SY213_QL70_.jpg,https://m.media-amazon.com/images/I/81VXtkHIoTL._AC_SX148_SY213_QL70_.jpg,,2026-04-16T09:42:09.852661
15,5,SP,3.0,,B0D8VQC5TP,"4.5x33 Ft Ocean and Beach Wall Backdrop Decorations,Roll of Plastic Seaside Photography Background,Natural Coastline Scenery Setters Wallpaper Summer Holiday Birthday Party Studio Photo Shoot Props",N/A,CNY 129.46,,4.1,74.0,False,https://images-na.ssl-images-amazon.com/images/G/01/x-locale/common/grey-pixel.gif,https://images-na.ssl-images-amazon.com/images/G/01/x-locale/common/grey-pixel.gif,,2026-04-16T09:42:09.861756
16,5,Organic,,132.0,B0D3FY757N,"Kepeel 200Pcs Summer Pool Beach Party Tableware Set, Beach Pool Ball Party Decorations Supplies for Kids Boys Girls Summer Hawaiian Party Disposable Dessert Plates Napkins Forks Favors, Serve 50",N/A,CNY 184.00,,4.7,428.0,False,https://images-na.ssl-images-amazon.com/images/G/01/x-locale/common/grey-pixel.gif,https://images-na.ssl-images-amazon.com/images/G/01/x-locale/common/grey-pixel.gif,,2026-04-16T09:42:09.872809
17,5,Organic,,133.0,B0DSHHTWDV,"156Pcs Glow In The Dark Party Supplies for Kids/Adults, 4th of July Light Up Accessories LED Bracelet Necklaces Glasses Headband Glow Sticks Bulk Party Pack Neon Disco Birthday Pool Party Decorations",N/A,CNY 177.18,,4.4,256.0,False,https://images-na.ssl-images-amazon.com/images/G/01/x-locale/common/grey-pixel.gif,https://images-na.ssl-images-amazon.com/images/G/01/x-locale/common/grey-pixel.gif,,2026-04-16T09:42:09.882086
18,5,Organic,,134.0,B09NSMZ365,"Civaner 10 Pcs Inflatable Glitter Beach Balls 16 Inch Large Sparkly Confetti Pool Balls Clear Blow up Balloon Toys for Wedding Baby Shower Birthday 2026 New Year Party Decoration(Silver,Glitter)",N/A,CNY 122.99,,4.1,566.0,False,https://images-na.ssl-images-amazon.com/images/G/01/x-locale/common/grey-pixel.gif,https://images-na.ssl-images-amazon.com/images/G/01/x-locale/common/grey-pixel.gif,,2026-04-16T09:42:09.895200
19,5,Organic,,135.0,B0F192D3WK,"Xynic 213pcs Pool Party Decorations, Paper Disposable Pool Party Birthday Decorations Include Shiny Banner Sturdy Plates and Waterproof Tablecloths for Summer Birthdays, Serves 25 People",N/A,CNY 122.65,,4.4,26.0,False,https://images-na.ssl-images-amazon.com/images/G/01/x-locale/common/grey-pixel.gif,https://images-na.ssl-images-amazon.com/images/G/01/x-locale/common/grey-pixel.gif,,2026-04-16T09:42:09.903727
20,5,Organic,,136.0,B07Q8JC9X4,"JOYIN Inflatable Pool Float Set Volleyball Net & Basketball Hoops, Floating Swimming Game Toy for Kids and Adults, Summer Floaties, Volleyball Court (105”x28”x38”)|Basketball (27.6”x23”),L-Orange",N/A,CNY 204.45,,4.2,9187.0,False,https://images-na.ssl-images-amazon.com/images/G/01/x-locale/common/grey-pixel.gif,https://images-na.ssl-images-amazon.com/images/G/01/x-locale/common/grey-pixel.gif,,2026-04-16T09:42:09.912742
21,5,Organic,,137.0,B09T2QKS13,"FLAMDYNO Pool Toys - 4/8 Pack Light Up Beach Balls for Kids w/ 8 Light Modes, Pool Beach Games Balls for Outdoor or Indoor Activities, Glow in The Dark Pool Beach Decorations for Kids and Adults",N/A,CNY 171.73,,4.2,1081.0,False,https://images-na.ssl-images-amazon.com/images/G/01/x-locale/common/grey-pixel.gif,https://images-na.ssl-images-amazon.com/images/G/01/x-locale/common/grey-pixel.gif,,2026-04-16T09:42:09.920988
22,5,Organic,,138.0,B0C4DFTKP8,"Under the Sea Party Decorations 98Pcs, Ocean Theme Birthday Party Supplies Include Backdrop Tablecloth Bubble Garlands Cake Topper Ocean Animals Balloons for Pool Beach Party Baby Shower (Ocean-01)",N/A,CNY 141.05,,4.7,538.0,False,https://images-na.ssl-images-amazon.com/images/G/01/x-locale/common/grey-pixel.gif,https://images-na.ssl-images-amazon.com/images/G/01/x-locale/common/grey-pixel.gif,,2026-04-16T09:42:09.927090
23,5,SP,4.0,,B0CR6SG9NZ,Arrowom 24pcs Hawaiian Leis Bulk Luau Party Silk Flower Necklace Colorful Tropical Hawaiian Bulk Hula Dance Party Decor Flower Leis Summer Beach Pool Party Decorations Favors Supplies,N/A,CNY 64.70,,4.5,2697.0,False,https://images-na.ssl-images-amazon.com/images/G/01/x-locale/common/grey-pixel.gif,https://images-na.ssl-images-amazon.com/images/G/01/x-locale/common/grey-pixel.gif,,2026-04-16T09:42:09.935646
24,5,SP,5.0,,B0GD6V7HKS,"Xynic pool party decorations, 207 PCS Pool Party Birthday Decorations Set with Plates, Cups, Napkins, Serves 25, 2 Tablecloths, Banner, Balloon, Summer Pool Party Birthday for Girls",N/A,CNY 129.46,,5.0,6.0,False,https://images-na.ssl-images-amazon.com/images/G/01/x-locale/common/grey-pixel.gif,https://images-na.ssl-images-amazon.com/images/G/01/x-locale/common/grey-pixel.gif,,2026-04-16T09:42:09.941366
26,5,Title,,,,Related searchespool party suppliespool party balloonspool party backdroppool party decorations for ,,,,,,False,,,,2026-04-16T09:42:09.942364
27,5,Title,,,,←PreviousNext→,,,,,,False,,,,2026-04-16T09:42:09.943369
28,5,SB,7.0,,,N/A,https://aax-us-east-retail-direct.amazon.com/x/c/JIZfwk0SOljr1voNN38-cwAAAAGdk_PMfQEAAAH2AQBvbm9fdHhuX2JpZDMgICBvbm9fdHhuX2ltcDIgICCoVC25/clv1c_ek-wBIH3FcbSDn0nEIcZs2PkEFXzGnez-daew3-ij8MJCRSEIAb_6PobSgK1e7zfTeRtfoB2eWOhTYWsd0ljRd9OtSncR5PJV2EVaE7XvwD6iBySJ8RSLa345rUcdi8ynHT6tKpFLCeszqP66jJqdd7pkJ2fkEFKvuwQrjYjwIJTictGHWmhbMbJN7jxq4rbhV0BRZgqn4DN2NLgnfjw31bFix9_QNq_XsrUtJtVyQpMtw5dQ5cpQh0J4Kgk9g55rumz1kxLDVxLRv86TsN2WqKlkflKC8HJR4J3bj9AA_s5SpnTMApGOByjYynnFjz3Nw5R91E3gV0smRUMi0L1qUDRo2B-TQzcZrz7mcKJKDG9TgwjyZKkW3HFTA5QigmrbaUCNuC9PTUkAY9trA3Ov82wfEiFj8FzCkO1nTHxCapbBehlwi5R_p1SKRQr0XYpXx1BHgYhAx5NhuFPN-qWHUAZNTlX55vDwZ3N_om0kmfIwQh2STyAehAtetDBaNo7usmAV9-3hltTXdVYK9UkATNpq1TaOcgXKQ0kOn43SlnBq66SVYU5cgrXJ-m7FYKQv49roAlR1SMgPvRgBVLUAYo7hLccwsVg1HC41xep89tSx6l6zfsqgi1zR3tkjC8ETq6N9t_mM0UjsOf1pnZJKHO3M1jzqfgbTr5JHe-E3HyPNAgzVGfDtwI_or39XusxHqthtjX8r-MkIhHMnT1FW4OF5oQeCfntNdbdx89dWvNQ1Qj553RRoGlq1K6owyHSFoOqhImSU09SploGr7xsyNCVi5UTkZdsomN2MhXJ2jmCWGkZz6kBI4c-Aa0yFe6gQI9KeXOh-MKEHgN9qLIjbYgLv-X29C_5VgI23_8ppNMcFyerv0LjoT8PQpXHi0mcjF4LfZrF5RQeu9lP3M917Eqh49a1nWV8zogw-ikwnTYd4yKpjUWjB-OnAUWB-zwncpT6nl2eC5XmaAv0_-sa_61MRsyCMhiZ89YDO8VEBhdSBgdZIBJRKPYfXGAxmdP7J1Lhn0EzOv_VlIwZRO7l-DZws94eIagNHoQQkYYD-o6A-zomJ26H-5CZg0Q3yaoQUQDlRtsniQiRMJcLMdgXfNEIAL3fCPN-1viN2wJy9bkp_66p25H37GH26-19J27yoggTzZu2uuhDKD34Y0GBcz1UBuJMou-SQvtN9mLIpidOZmQoPxwY3Dc2QXImO9jgDxbZiqPRzw-5p89ubvC99FIrRIajkwmM1lcW62su7OtfRztgdOPJCPL7bWQD946G1xK12EX7Z_Ji3MwKeNitoSR55NdbjuM6tNblPAzvSKzM0JjL7ljGlRutR-MDkCPGZm7sCNV9OfO7h9Jy55cjt9cRC8_t-iW--fXRfctbfv5hYR7_rWF6EJcrno4JiNVuN0RXrtiKCxce79NPu1JwPFrL0issVa26Zfl_jY20TRUnV7M0lEjVjHrFEtHZCkeIM6A2iueyoPDRMXc4TvTCNhkjlcnKZEVw8LAfCmt6GJWgrtDl2GgWvVQze6apCCAGTbkrSGNqCE5h_Cf7yDGP6XQ5otDmsn8tDHrxALHrNOA14_eufEjBl6HDJUFj_lpxh-t6Pjg7UJMkZ0JeoyVLrzA0_fZvpQecUuXCZpdEiFsg61R2mq4mFxGkrcTqMCFmSIP7TLL4dJ_ZIbTx7d8uhgQV/https://www.amazon.com/stores/page/BD6963EF-3C57-4E0B-81BD-813B93882854/?_encoding=UTF8&store_ref=SB_A04447023HM0PJWIGJN2E-A026818221VGB7Z1PA5JF&pd_rd_plhdr=t&aaxitk=f71d4d855b1eee54c4174ef9e78ab5a0&hsa_cr_id=0&lp_asins=B0D44RFJXR%2CB0GCZXW3NL%2CB0GCZYCD47&lp_query=pool%20party%20decorations&lp_slot=mobile-hsa-3psl&ref_=sbx_be_s_3psl_mbscm_mb0_bkgd&pd_rd_w=eVh0m&content-id=amzn1.sym.7cd916dc-8a72-417a-a810-0b4c31abacc4%3Aamzn1.sym.7cd916dc-8a72-417a-a810-0b4c31abacc4&pf_rd_p=7cd916dc-8a72-417a-a810-0b4c31abacc4&pf_rd_r=9RR5YC74A20EPXED7Q97&pd_rd_wg=hr3rd&pd_rd_r=d892cbaa-55e3-4583-a1b4-bcdb8b27cc17,,,,,False,,,N/A,2026-04-16T09:42:09.951497
0,6,Title,,,,ResultsCheck each product page for other buying options. Price and other details may vary based on p,,,,,,False,,,,2026-04-16T09:42:31.679288
2,6,Organic,,139.0,B00GISWPF6,Fun Express Inflatable Pink Flamingo Pool Float - Giant 4 Feet Tall Blow Up Flamingo Toy for Pool Party Decorations | Summer Party Decor for Tropical Luau Theme | Inflatable Toys for Kids and Adults,N/A,CNY 133.21,,3.9,214.0,False,https://m.media-amazon.com/images/I/71A1bnrPUgL._AC_UL320_.jpg,https://m.media-amazon.com/images/I/71A1bnrPUgL._AC_SL1500_.jpg,,2026-04-16T09:42:31.687800
3,6,Organic,,140.0,B0F7H4ND5Z,"3-Tier Cupcake Stand for Beach Party Decorations - Multi-Colored Tropical Luau Pool Party Supplies, Hawaiian Themed Birthday Cake Stand for Baby Shower Wedding Decorations",N/A,CNY 88.56,,4.3,59.0,False,https://m.media-amazon.com/images/I/71o2EKBm9WL._AC_UL320_.jpg,https://m.media-amazon.com/images/I/71o2EKBm9WL._AC_SL1500_.jpg,,2026-04-16T09:42:31.694365
4,6,Organic,,141.0,B0FTZJMKFX,"xo, Fetti Pink and Green Striped Cabana Plates - 24 Paper Plates, 9"" | Birthday, Retro Theme, Preppy Decor, Palm Royale, Summer",N/A,CNY 88.56,,,,False,https://m.media-amazon.com/images/I/61Gc401WEBL._AC_UL320_.jpg,https://m.media-amazon.com/images/I/61Gc401WEBL._AC_SL1500_.jpg,,2026-04-16T09:42:31.699959
6,6,Title,,,,4 stars and aboveSponsored| Based on star rating and number of customer ratingsLED Light Up Inflatab,,,,,,False,,,,2026-04-16T09:42:31.709021
7,6,Title,,,,More results,,,,,,False,,,,2026-04-16T09:42:31.709021
8,6,Organic,,142.0,B0C1GNGVZ3,Whaline 12Pcs Graduation Inflatable Beach Balls 11.8 Inch Congrats Grad Beach Ball Pool Party PVC Balls for Swimming Pool Party Summer Water Sand Game,N/A,CNY 136.28,,4.5,16.0,False,https://m.media-amazon.com/images/I/715cXBrJc9L._AC_UL320_.jpg,https://m.media-amazon.com/images/I/715cXBrJc9L._AC_SL1500_.jpg,,2026-04-16T09:42:31.714631
