data_index,page,ad_type,ad_rank,organic_rank,asin,title,url,price_current,price_list,rating_stars,rating_count,is_prime,image_small,image_large,brand_name,scraped_at
0,1,Title,,,,ResultsCheck each product page for other buying options. Price and other details may vary based on p,,,,,,False,,,,2026-04-16T09:40:47.256029
2,1,Organic,,1.0,B0GMPXPMZ5,"Pool Birthday Party Supplies,Summer Beach Party Decorations Paper Plates,Napkins,Balloon,Banner,Cupcake Topper for Summer Hawaiian Beach Pool Birthday Supplies Serves 24",N/A,$20.99,,5.0,2.0,False,https://m.media-amazon.com/images/I/91NC+3f2OpL._AC_UL320_.jpg,https://m.media-amazon.com/images/I/91NC+3f2OpL._AC_SL1500_.jpg,,2026-04-16T09:40:47.262921
3,1,Organic,,2.0,B0CR6SG9NZ,Arrowom 24pcs Hawaiian Leis Bulk Luau Party Silk Flower Necklace Colorful Tropical Hawaiian Bulk Hula Dance Party Decor Flower Leis Summer Beach Pool Party Decorations Favors Supplies,N/A,$9.49,,4.5,2697.0,False,https://m.media-amazon.com/images/I/91Dw3St+MFL._AC_UL320_.jpg,https://m.media-amazon.com/images/I/91Dw3St+MFL._AC_SL1500_.jpg,,2026-04-16T09:40:47.275227
4,1,Organic,,3.0,B0GG7FXQ7V,"Grneric 98PCS Pool Party Favors, Summer Beach Party Supplies Pool Goodie Bags with Beach Balls, Slap Bracelets, Drinking Straws & Stickers for Birthday Pool Party",N/A,$22.99,,4.5,59.0,False,https://m.media-amazon.com/images/I/81Igcfw89PL._AC_UL320_.jpg,https://m.media-amazon.com/images/I/81Igcfw89PL._AC_SL1500_.jpg,,2026-04-16T09:40:47.286192
6,1,Title,,,,Debug info copied.SponsoredSunnyray 96 Pieces Goodbye School Hello Pool Party Supplies Summer Pool P,,,,,,False,,,,2026-04-16T09:40:47.287263
7,1,Title,,,,Confetti Pool Balls for Party DecorationsSponsored|Shop CivanerShop nowPrevious pageCivaner 10 Pcs I,,,,,,False,,,,2026-04-16T09:40:47.290781
8,1,Title,,,,More results,,,,,,False,,,,2026-04-16T09:40:47.290781
9,1,Organic,,4.0,B071JR7GYP,"JOYIN 60"" Inflatable Palm Tree Cooler, Beach Theme Decor, Pool Party Decorations, Luau Hawaiian Birthday Party Supplies, Ocean Jungle Tropical Themed Summer Outdoor Drink Cooler",N/A,$19.99,,4.3,5370.0,False,https://m.media-amazon.com/images/I/815M9fW4pfL._AC_UL320_.jpg,https://m.media-amazon.com/images/I/815M9fW4pfL._AC_SL1500_.jpg,,2026-04-16T09:40:47.296802
10,1,Organic,,5.0,B0CLP5W5VQ,Ziliny 36 Pcs Summer Pool Beach Party Supplies 5 lb Beach Ball Large Paper Serving Snack Trays for Summer Hawaii Tropical Party Swimming Pool Favors,N/A,$17.99,,4.5,36.0,False,https://m.media-amazon.com/images/I/818v8g+7+0L._AC_UL320_.jpg,https://m.media-amazon.com/images/I/818v8g+7+0L._AC_SL1500_.jpg,,2026-04-16T09:40:47.304706
11,1,Organic,,6.0,B0CV33D9F1,"3 Pcs Iridescent Waves Tablecloths - Disposable Plastic Ocean Blue Table Cloth Rectangle Table Covers for Under the Sea Beach Surf Pool Party Birthday Party Decorations, 54 x 108 Inch",N/A,$8.00,,4.5,668.0,False,https://m.media-amazon.com/images/I/81jVudN5HQL._AC_UL320_.jpg,https://m.media-amazon.com/images/I/81jVudN5HQL._AC_SL1500_.jpg,,2026-04-16T09:40:47.310493
12,1,Organic,,7.0,B0GN2B8GXV,"48"" Giant Glitter Inflatable Swim Floats with Large Cup Holder Jumbo Pink Striped Pool Ring Fun Print Pool Lounger Tube for Adult Summer Swimming Beach Party Supplies",N/A,$69.99,,,,False,https://m.media-amazon.com/images/I/8155s8L6a6L._AC_UL320_.jpg,https://m.media-amazon.com/images/I/8155s8L6a6L._AC_SL1500_.jpg,,2026-04-16T09:40:47.315261
13,1,Organic,,8.0,B09Z28TMY4,Vinsot 32 Pack Beach Pool Party Eyeglasses Decor Summer Luau Paper Glasses Bulk Hawaiian Sunglasses Frame Tropical Pool Props Photo Booth Props for Summer Beach Luau Party Favor Birthday Supply Decor,N/A,$12.99,,4.1,646.0,False,https://m.media-amazon.com/images/I/81bbJ2wNgCL._AC_UL320_.jpg,https://m.media-amazon.com/images/I/81bbJ2wNgCL._AC_SL1500_.jpg,,2026-04-16T09:40:47.320941
14,1,Organic,,9.0,B07NWR7HKD,"JOYIN 12-Pack 12“ Beach Balls - Bulk Classic Beachball Inflatable Swimming Pool Toys for Games Adults Kids Birthday Party Supplies Combo Set, Rainbow Color Blow Up Luau Decorations Favors Gifts (12"")",N/A,$9.99,,4.5,3354.0,False,https://m.media-amazon.com/images/I/814LDy0nOPL._AC_UL320_.jpg,https://m.media-amazon.com/images/I/814LDy0nOPL._AC_SL1500_.jpg,,2026-04-16T09:40:47.325870
15,1,Organic,,10.0,B0721468V1,"JOYIN Inflatable Swim Tube Raft (3 pack) with Summer Fruits Painting, Pool Toys for Swimming Pool Party Decorations",N/A,$16.98,,4.6,8361.0,False,https://m.media-amazon.com/images/I/71cpqrIteIL._AC_UL320_.jpg,https://m.media-amazon.com/images/I/71cpqrIteIL._AC_SL1500_.jpg,,2026-04-16T09:40:47.333934
16,1,Organic,,11.0,B0DTJFLHHD,"Pool Party Favors and Beach Party Favors,158PCS Summer Pool Toys for Kids, Undersea theme decoration, Including Beach Balls, Sunglasses, Bubble Wands, Stamp and Crystal Shells for Kids Ages 4-8 8-12",N/A,$25.00,,4.6,198.0,False,https://m.media-amazon.com/images/I/81TrxJeWztL._AC_UL320_.jpg,https://m.media-amazon.com/images/I/81TrxJeWztL._AC_SL1500_.jpg,,2026-04-16T09:40:47.340820
17,1,Organic,,12.0,B0964DB59D,"JOYIN Set of 6 Small Pink Flamingo Yard Ornament Stakes, 17"" Plastic Flamingo Lawn Statues with Metal Legs for Sidewalks, Outdoor Garden Decor, Luau & Pool Party Decorations, 2 Styles",N/A,$13.99,,4.1,3739.0,False,https://m.media-amazon.com/images/I/713gAJWZu5L._AC_UL320_.jpg,https://m.media-amazon.com/images/I/713gAJWZu5L._AC_SL1500_.jpg,,2026-04-16T09:40:47.346695
18,1,Organic,,13.0,B07NX2V91X,"JOYIN 2-Pack Flamingo Unicorn Pool Float - Fun Floaties Inflatable Swimming Pool Tubes Toys Party Decorations, Summer Vacation Lake Beach Floaty Swim Rings Raft Lounger for Adults & Kids",N/A,$23.98,,4.4,3222.0,False,https://m.media-amazon.com/images/I/81U1c+sU5FL._AC_UL320_.jpg,https://m.media-amazon.com/images/I/81U1c+sU5FL._AC_SL1500_.jpg,,2026-04-16T09:40:47.355251
19,1,Organic,,14.0,B0BXH28VH9,"142 Pieces Pool Birthday Party Supplies - Summer Pool Tableware Set Plate,Cups,Tablecloth for Summer Pool Birthday Party, Hawaii Holiday Decorations",N/A,$19.99,,4.6,868.0,False,https://m.media-amazon.com/images/I/814MT1BHBHL._AC_UL320_.jpg,https://m.media-amazon.com/images/I/814MT1BHBHL._AC_SL1500_.jpg,,2026-04-16T09:40:47.362298
20,1,Title,,,,More results,,,,,,False,,,,2026-04-16T09:40:47.363497
21,1,Organic,,15.0,B0G2BLV35J,Inflatable Palm Tree Beach Balls Flamingo Banana Parrot Dolphin Cactus Ring Toss Sets for Tropical Hawaiian Beach Luau Summer Pool Party Decorations,N/A,$25.99,,4.3,5.0,False,https://m.media-amazon.com/images/I/71TYc-OHRGL._AC_UL320_.jpg,https://m.media-amazon.com/images/I/71TYc-OHRGL._AC_SL1500_.jpg,,2026-04-16T09:40:47.368245
22,1,Organic,,16.0,B0DXFQD2N7,"xo, Fetti Pool Party Temporary Tattoos - 68 Iridescent Foil Pcs | Summer Birthday Accessory, Kids Waterpark Party Favor, Cute Beach Activity",N/A,$7.99,,4.6,33.0,False,https://m.media-amazon.com/images/I/71mlSyRYaxL._AC_UL320_.jpg,https://m.media-amazon.com/images/I/71mlSyRYaxL._AC_SL1500_.jpg,,2026-04-16T09:40:47.375223
23,1,Organic,,17.0,B01F6LRW30,"Joyin Toy 36 Counts Hawaiian Leis Bulk, Tropical Flower Lei Hawaiian Lei Beach Hawaii Luau Party Favors Decoration Birthday Party Supplies(3 Dozen)",N/A,$9.99,,4.6,10885.0,False,https://m.media-amazon.com/images/I/911aTPl1DwL._AC_UL320_.jpg,https://m.media-amazon.com/images/I/911aTPl1DwL._AC_SL1500_.jpg,,2026-04-16T09:40:47.381994
24,1,Organic,,18.0,B0BWR9FQYX,2 Pack Blue Streamers Party Decorations Fringe Backdrop Ocean Themed Decorations Foil Curtain Backdrop Blue Birthday Ocean Party Decor Supplies,N/A,$5.97,,4.4,10539.0,False,https://m.media-amazon.com/images/I/914rDCqCJuL._AC_UL320_.jpg,https://m.media-amazon.com/images/I/914rDCqCJuL._AC_SL1500_.jpg,,2026-04-16T09:40:47.387000
25,1,Organic,,19.0,B0DYY9GJ3S,"134Pcs Tropical Summer Beach Pool Party Balloon Garland Arch Kit,with Inflatable Beach Balls,Watermelon,Sun Foil Balloons for Hawaiian Luau Birthday Graduation Party Decorations - Hot Pink Yellow Blue",N/A,$15.69,,4.4,36.0,False,https://m.media-amazon.com/images/I/81+iUruI7AL._AC_UL320_.jpg,https://m.media-amazon.com/images/I/81+iUruI7AL._AC_SL1500_.jpg,,2026-04-16T09:40:47.392546
26,1,Organic,,20.0,B0BRZXJFHM,"12Pcs Reusable Water Balloons, Pool Beach water Toys for Boys and Girls, Outdoor Summer Toys for Kids Ages 3-12",N/A,$27.99,,4.7,3037.0,False,https://m.media-amazon.com/images/I/71deILln+wL._AC_UL320_.jpg,https://m.media-amazon.com/images/I/71deILln+wL._AC_SL1500_.jpg,,2026-04-16T09:40:47.398644
27,1,Organic,,21.0,B0D89XQ37N,"Swimming Pool Party Banner for Summer Party Decorations, Summer Themed Hawaiian Outdoor Party Decorations, Baby Shower Birthday Swimming Pool Party Supplies(Pool Party Blue)",N/A,$12.99,,4.6,72.0,False,https://m.media-amazon.com/images/I/61vc5ADfwJL._AC_UL320_.jpg,https://m.media-amazon.com/images/I/61vc5ADfwJL._AC_SL1500_.jpg,,2026-04-16T09:40:47.407663
28,1,Organic,,22.0,B073RBVTXT,"ALINK 50 Umbrella Parasol Drinking Straws, Hawaiian Beach Cocktail Luau Party Decorations Supplies",N/A,$6.99,,4.6,10351.0,False,https://m.media-amazon.com/images/I/81YbWfWBaPL._AC_UL320_.jpg,https://m.media-amazon.com/images/I/81YbWfWBaPL._AC_SL1500_.jpg,,2026-04-16T09:40:47.413014
29,1,Organic,,23.0,B0F2HT5477,"117Pcs Summer Pool Themed Happy Birthday Party Decorations, Plates Napkins Cups Tableware, Swim Pool Tube Glass Backdrop Tablecloth, Happy Birthday Banner, Colorful Printed Ballons for Kids Adults",N/A,$22.99,,4.4,25.0,False,https://m.media-amazon.com/images/I/91Fbm1GlhwL._AC_UL320_.jpg,https://m.media-amazon.com/images/I/91Fbm1GlhwL._AC_SL1500_.jpg,,2026-04-16T09:40:47.418024
30,1,Title,,,,More results,,,,,,False,,,,2026-04-16T09:40:47.418541
31,1,Organic,,24.0,B07NS7BG9L,"JOYIN 28” Inflatable Palm Tree Cooler, Luau Hawaiian Tropical Beach Themed Party Decorations, Blow Up Palm Trees Cooler Outdoor Party Supplies, Kids Adults Birthday Party Décor",N/A,$18.99,,4.4,4015.0,False,https://m.media-amazon.com/images/I/91NOjIPjumL._AC_UL320_.jpg,https://m.media-amazon.com/images/I/91NOjIPjumL._AC_SL1500_.jpg,,2026-04-16T09:40:47.423577
32,1,Organic,,25.0,B0G8J1PT7S,"MEHOFOND Splish Splash Birthday Party Supplies Tableware Set 193 Pcs, Summer Pool Party Disposable Plates Cups Napkins Cutlery with Plastic Tablecloth for Girls Tropical Birthday Party",N/A,$20.99,,5.0,2.0,False,https://m.media-amazon.com/images/I/81cXU3ZUn9L._AC_UL320_.jpg,https://m.media-amazon.com/images/I/81cXU3ZUn9L._AC_SL1500_.jpg,,2026-04-16T09:40:47.430112
33,1,Organic,,26.0,B0CTQL4WBT,JellyArch 4 Pcs Inflatable Surf Board Inflatable Luau Party Decorations Blow up Surfboard,N/A,$28.99,,4.1,113.0,False,https://m.media-amazon.com/images/I/71XtcaMqViL._AC_UL320_.jpg,https://m.media-amazon.com/images/I/71XtcaMqViL._AC_SL1500_.jpg,,2026-04-16T09:40:47.436117
34,1,Organic,,27.0,B00N1QPNMA,"PartySticks Glow Sticks Party Supplies 100pk - 8 Inch Glow in the Dark Light Up Sticks Party Favors, Glow Party Decorations, Neon Party Glow Necklaces and Glow Bracelets with Connectors",N/A,$7.99,,4.6,28644.0,False,https://m.media-amazon.com/images/I/81JYNlch58L._AC_UL320_.jpg,https://m.media-amazon.com/images/I/81JYNlch58L._AC_SL1500_.jpg,,2026-04-16T09:40:47.446207
35,1,Organic,,28.0,B09TSY3Y24,Yexiya 12 Pieces Beach Honeycomb Centerpieces Pool Cake Balls Table Toppers Beach Pool Party Supplies Decorations for Birthday,N/A,$8.49,,4.3,246.0,False,https://m.media-amazon.com/images/I/81uawshAiQL._AC_UL320_.jpg,https://m.media-amazon.com/images/I/81uawshAiQL._AC_SL1500_.jpg,,2026-04-16T09:40:47.454285
36,1,Organic,,29.0,B0CYH6K5PW,"Summer Banner Pool Party Decorations, Pool Party Decorations Banner Backdrop Summer Party Decorations, Hanging Beach Themed Summer Party Decorations with Rope (72 * 44 Inches)",N/A,$8.99,,4.6,100.0,False,https://m.media-amazon.com/images/I/81d1A48zuIL._AC_UL320_.jpg,https://m.media-amazon.com/images/I/81d1A48zuIL._AC_SL1500_.jpg,,2026-04-16T09:40:47.463071
37,1,Organic,,30.0,B0DP2FLFKM,‎Renbuzhu 15PCS Pool Party Decorations Beach Ball Paper Lanterns - Summer Luau Hawaiian Themed Hanging Decor for Home Birthday Outdoor Indoor,N/A,$15.99,,4.5,126.0,False,https://m.media-amazon.com/images/I/81SAWFpzVML._AC_UL320_.jpg,https://m.media-amazon.com/images/I/81SAWFpzVML._AC_SL1500_.jpg,,2026-04-16T09:40:47.469723
38,1,Organic,,31.0,B0F6LWCHDW,"Aliceset 20 Pcs Pool Party Clear Favor Bags with Handles Swimming Themed Waterproof Goodie Bags for Pool Swimming Summer Party Birthday Baby Shower Supplies, 8 x 8 x 3. 15 Inch",N/A,$20.99,,4.7,268.0,False,https://m.media-amazon.com/images/I/81msf9UzssL._AC_UL320_.jpg,https://m.media-amazon.com/images/I/81msf9UzssL._AC_SL1500_.jpg,,2026-04-16T09:40:47.477335
39,1,Organic,,32.0,B0BKTLGZN1,"JOYIN 4-Pack 20"" Beach Balls - Large Rainbow Beach Ball Inflatable Pool Toys for Party Supplies Decorations, Adults Kids Birthday Luau Summer Beach Water Games Beachball Party Favors",N/A,$9.49,,4.5,1467.0,False,https://m.media-amazon.com/images/I/71-+c9L29ML._AC_UL320_.jpg,https://m.media-amazon.com/images/I/71-+c9L29ML._AC_SL1500_.jpg,,2026-04-16T09:40:47.484468
40,1,Organic,,33.0,B07YDK14GQ,Decor365 Under the Sea Party Decorations White Bubble Garlands Little Mermaid Birthday Decorations Bday Hanging Streamer Beach Banner Decor Underwater Backdrop Kids Ocean Party Supplies,N/A,$11.98,,4.6,6487.0,False,https://m.media-amazon.com/images/I/51Gcx9gKPQL._AC_UL320_.jpg,https://m.media-amazon.com/images/I/51Gcx9gKPQL._AC_SL1500_.jpg,,2026-04-16T09:40:47.490004
41,1,Organic,,34.0,B06XGNL1RX,"Ring Pop Lollipops - Bulk Candy Individually Wrapped Suckers Variety Party Pack- 20 Count w/Assorted Flavors - Hard Candy for Party Favors, Kids & Goodie Bags",N/A,,,4.8,87072.0,False,https://m.media-amazon.com/images/I/81caeWEBoFL._AC_UL320_.jpg,https://m.media-amazon.com/images/I/81caeWEBoFL._AC_SL1500_.jpg,,2026-04-16T09:40:47.494525
42,1,Organic,,35.0,B0GD6V7HKS,"Xynic pool party decorations, 207 PCS Pool Party Birthday Decorations Set with Plates, Cups, Napkins, Serves 25, 2 Tablecloths, Banner, Balloon, Summer Pool Party Birthday for Girls",N/A,$18.99,,5.0,6.0,False,https://m.media-amazon.com/images/I/812OfksbQtL._AC_UL320_.jpg,https://m.media-amazon.com/images/I/812OfksbQtL._AC_SL1500_.jpg,,2026-04-16T09:40:47.499581
43,1,Organic,,36.0,B0F47TPJSL,"Tingjoo 3 Pcs Pool Party Arch Backdrop Stand Cover Spandex Fitted Hawaiian Theme Arch Cover 4ft, 5ft, 6ft Pool Photo Background Props for Summer Swimming Birthday Party Decoration",N/A,$39.99,,4.5,15.0,False,https://m.media-amazon.com/images/I/81BTgH9mQyL._AC_UL320_.jpg,https://m.media-amazon.com/images/I/81BTgH9mQyL._AC_SL1500_.jpg,,2026-04-16T09:40:47.505323
44,1,Organic,,37.0,B0F1T15N7N,120PCS Summer Pool Party Supplies Swimming Beach Ball Themed Birthday Party Decorations Tropical Hawaii Holiday Tableware Set Plates Napkins Cups Set for 20 Guests,N/A,$17.99,,4.5,153.0,False,https://m.media-amazon.com/images/I/910esUO6IgL._AC_UL320_.jpg,https://m.media-amazon.com/images/I/910esUO6IgL._AC_SL1500_.jpg,,2026-04-16T09:40:47.510913
45,1,Organic,,38.0,B0DP4H4M21,"28 Pack 12 Inch Rainbow Beach Balls Bulk, Inflatable Swimming Pool Toys Beach Ball for Kids Birthday Party Favors Outdoor Summer Games Hawaiian Tropical Luau Themed Pool Party Decorations",N/A,$15.29,,4.2,34.0,False,https://m.media-amazon.com/images/I/71P91pSBUGL._AC_UL320_.jpg,https://m.media-amazon.com/images/I/71P91pSBUGL._AC_SL1500_.jpg,,2026-04-16T09:40:47.515432
46,1,Organic,,39.0,B0GHXBWRFM,"Fruitful Jewelry Beach Ball Gift Bags, 16pcs Pool Birthday Goodie Treat Summer Treat Bags for Summer Pool Party Decorations Summer Party Favors Fillers Supplies",N/A,$10.99,,,,False,https://m.media-amazon.com/images/I/91H8QhQhXTL._AC_UL320_.jpg,https://m.media-amazon.com/images/I/91H8QhQhXTL._AC_SL1500_.jpg,,2026-04-16T09:40:47.522611
47,1,Organic,,40.0,B0BLVJV2YG,"LEEZZIZZ 30Pcs Punch Balloons, Thickened Neon Punching Balloon Heavy Duty Party Favors for Kids with Rubber Band Handle, Bouncy Balls for Birthday Weddings Goodie Bag Stuffer Supply",N/A,$8.88,,4.6,3531.0,False,https://m.media-amazon.com/images/I/61o0vAZMh0L._AC_UL320_.jpg,https://m.media-amazon.com/images/I/61o0vAZMh0L._AC_SL1500_.jpg,,2026-04-16T09:40:47.527133
48,1,Organic,,41.0,B0DNS37741,"SNLN 129Pcs Pool Party Decorations Birthday Supplies, Outdoor Pool Summer Theme Balloon Garland Arch Kit Backdrop Beach Ball Tropical Luau Hawaii Holiday Swimming Outdoor Pool Decor Party Supplies",N/A,$17.99,,4.5,90.0,False,https://m.media-amazon.com/images/I/81AD-MXL1oL._AC_UL320_.jpg,https://m.media-amazon.com/images/I/81AD-MXL1oL._AC_SL1500_.jpg,,2026-04-16T09:40:47.531711
49,1,Organic,,42.0,B0D25SW86C,"Pool Party Decorations,142pcs Pool Party Supplies Tableware Flamingo Pool Party Plates and Napkins Cups Supplies for Summer Pool Party Birthday Decorations",N/A,$17.99,,4.5,28.0,False,https://m.media-amazon.com/images/I/8159cmcy4fL._AC_UL320_.jpg,https://m.media-amazon.com/images/I/8159cmcy4fL._AC_SL1500_.jpg,,2026-04-16T09:40:47.536225
50,1,Title,,,,More results,,,,,,False,,,,2026-04-16T09:40:47.537280
51,1,Organic,,43.0,B06WVB8P3B,"Luditek Sound Activated Party Lights with Remote DJ Lighting, Disco Ball Strobe Stage Light for Home Room Dance Parties Birthday Karaoke Stocking Stuffers New Years Eve Halloween Christmas Decorations",N/A,$9.99,,4.6,44885.0,False,https://m.media-amazon.com/images/I/71G4t-Vi4cL._AC_UL320_.jpg,https://m.media-amazon.com/images/I/71G4t-Vi4cL._AC_SL1500_.jpg,,2026-04-16T09:40:47.542834
52,1,Organic,,44.0,B09NM2FPKX,"Fovths Luau Grass Table Skirt Natural 9 Feet x 29.5 Inch Hawaiian Table Skirt for Tropical Hawaiian Party Decorations Luau Costume Party, Straw Yellow",N/A,$8.49,,4.5,2399.0,False,https://m.media-amazon.com/images/I/81Hsj3wr27L._AC_UL320_.jpg,https://m.media-amazon.com/images/I/81Hsj3wr27L._AC_SL1500_.jpg,,2026-04-16T09:40:47.552105
53,1,Organic,,45.0,B0C2HRKML4,"Zcaukya Inflatable Seashell Pool Float, Giant Clam Air-Filled Toys with Pearl Ball for Kids Birthday Party Swimming Pool Summer Beach Party Mermaid Ocean Theme Party Decor",N/A,$35.99,,4.6,314.0,False,https://m.media-amazon.com/images/I/71RMEUGyOSL._AC_UL320_.jpg,https://m.media-amazon.com/images/I/71RMEUGyOSL._AC_SL1500_.jpg,,2026-04-16T09:40:47.568842
54,1,Organic,,46.0,B0BTN5DNYZ,"Riakrum 3 Pcs Summer Beach Tablecloths Pool Party Table Covers Rectangle Plastic Hawaiian Tablecloth Beach Supplies Theme Party Decorations for Swimming Themed Birthday Favors, 54 x 108 Inch",N/A,$11.99,,4.7,88.0,False,https://m.media-amazon.com/images/I/91TD+XEveuL._AC_UL320_.jpg,https://m.media-amazon.com/images/I/91TD+XEveuL._AC_SL1500_.jpg,,2026-04-16T09:40:47.573864
55,1,Organic,,47.0,B0DC51MRZ4,"Freyalife Hawaiian Leis Decorations(24pcs),Leis for Luau Party Decor Flower,Tropical Hawaiian Bulk Hula Dance Party Decor",N/A,$6.99,,4.3,620.0,False,https://m.media-amazon.com/images/I/816+lI1lMEL._AC_UL320_.jpg,https://m.media-amazon.com/images/I/816+lI1lMEL._AC_SL1500_.jpg,,2026-04-16T09:40:47.577455
56,1,Organic,,48.0,B0BWHFQKC5,"Katchon, Xtralarge Wavy Blue Foil Fringe Curtain - Pack of 2 | Blue Streamers for Under The Sea Party Decorations | Foil Fringe Backdrop for Birthday, Cruise Door Decorations, Pool Party Decorations",N/A,$12.99,,4.7,796.0,False,https://m.media-amazon.com/images/I/915gfOmzz7L._AC_UL320_.jpg,https://m.media-amazon.com/images/I/915gfOmzz7L._AC_SL1500_.jpg,,2026-04-16T09:40:47.583107
58,1,Title,,,,"Debug info copied.SponsoredInflatable Pool Games Volleyball Net Pool Float Set with 19"" Beach Ball, ",,,,,,False,,,,2026-04-16T09:40:47.583610
59,1,Title,,,,Related searchespool party suppliespool party gamespool party decorations for adultspool party backd,,,,,,False,,,,2026-04-16T09:40:47.584616
60,1,Title,,,,Previous123...7Next,,,,,,False,,,,2026-04-16T09:40:47.585616
61,1,SB,1.0,,,N/A,https://aax-us-east-retail-direct.amazon.com/x/c/JPcfPf8rROwzPxYRwKy2bMUAAAGdk_KK1wEAAAH2AQBvbm9fdHhuX2JpZDYgICBvbm9fdHhuX2ltcDIgICCwayVx/clv1c_ek-wBIHXKkbXDrYT8p9Ro0SsBAQLCM4r06ZzU1rvl80qG_RBmb6J6Rg-4oEOk6B0jRMQwg_E_h09xDvhyeQprF_rF_DGvhNalZ8JJgGZQ66ym1fzS_3kEB2Mrsw0omcRl58bpbh1Uu9gGFl6NB0C3rEjgxc5hp3ql8gwzjoa3pAn0etfGuTFbkm61bhHIy62dG2CA6J7e08g_JbcH4iBdmq9BDsvRJ2z1ZzHKLmfAnrEq3q-wxEbW4lukgYPXoRQNgB4-agPMxc0akHg-oOvJWMLH4kNB01L07c67Ezw-IcCG3kzA4bK4DJJfZOgbdtLhw6c-NztIhIx1TbSrTXM3RkBUBl1eDRVMYoWhaRL8gdHWo8uR4ys_T2DQEoY3I7TEKXxiDGCC1ZdNe8sXFmO7jc8Y57laDl7jDiiDN2AAQzdiF7lOeyBlYpfhZqf9ajBFjF6uB-pl01hNqoeE2HjPC0hH3H9xJ1G3nlsY29KQeGhLtrWYr-1G6sYE92WmSTM7hLCQPZGV5UryOGEaQLgt-Drykn7Zlc47v-XrA6tJHVFK08nOV0YDDnzs7Ab7wuvHmp3-3mOeLzlBZQxdwGiB45ee3LgJtNCyudas4erAydo0zZZLZqqNyl658AzpvPr9PW1p_-zhQzLG4iVW6OAYHLZIvgWOaAZA_tdlFHMQ9RP46jSbATEexURdT0SbPVBErQ6F2x6jWEbL3THctZ0Abj9w1ay_yK1kHi2S2E0T7v0XtwIUlZ32Z8VoRgjk5PSq562_hSsTzQgarru9UakDGdvu51zMuFrDoikEYOJEXzcl03cTmRzFEgMZ_8rEmawrbWDA_-axTZ48y5wdYCDCruG-2z7g3j_9aYhrx2CPFOKYxP0TwCuOWHFfjhyYJzTIqnfDiJTOYWgNKRGv9YNyISIdwJxJaCeyfdYu5yjrFpki0F31XJW6--e0JCm8Xu2PeEyX553TtgKJNz8Q-nq65-ZNVFxnf8bRYXsBcUVuWm8XTSnAdw3NYZNfnFCrfZZc9vmS-96Z--8wXDzHagQYyJpN-CZO_RR64B619wDo1QmO72nIrW9gWwgKknQT9J_yLTS7RbdqnI9zPjCqWjUl0hXfHHo3tx4Nfw9poqlAHH-BWT7RQRFvuJzyg5N9ndqjdD44kLNWmG4Lgr6RNgWHxPUL2eBmvOg7fyF4GavPo02f2ruj1lRbBJZwsblozvJPrt-NkGM_0wWSefx8xZACsMVUwGZhkemlZRC3L_5WXWCcXmj6RsFC19pe0cd-aViWAx-BvrU-iw5VF8JQyLVZ2WQS1Pwx3TikEjXVhAfISV6SscYfnfO2xjab0z8EBokhzDs9nUgCdq6wmmGeyOME1KdJCYn2BmCFXr0LEAdhI2hoeN5c2n-JtxrkoEiZH45xieJkWvoBbC5xdPwFNR_QUALoV-wWbmz1obhhDsm6Sm90R9VredcyxHy00tUsqUf8svwgjRreeQ0K-E32wYa8QmH4xk7Ax49cpJS-sCLGxPHJPZ557fbZ8ocML0BP4KuAz3Jo17PsfT95JXjtgRWcggISfeb9OTQC5On2nNFUdcDRoHgMjAKl1Wk73AbHe4mAR_NQZ9RA6ZwbksonkQZuJ6zZY4BzN94Dnol5-haUMogIJp4k2x2D2HlXezRwNEq-652WjZapAb6a8yjsV1guSjtjuNbCQx7QvbE/https://www.amazon.com/stores/page/E97EA085-537D-4F13-8D29-E88AAAFC05F1/?_encoding=UTF8&store_ref=SB_A00093829L9TW2ZMJPDU-A0516874C7QJBI71SQJB&pd_rd_plhdr=t&aaxitk=8e25fe801ca9816be46d07ae1428cef6&hsa_cr_id=0&lp_asins=B07T1FKL23%2CB0DQPKKJXQ%2CB0BVF4V4ND&lp_query=pool%20party%20decorations&lp_slot=desktop-hsa-3psl&ref_=sbx_be_s_3psl_mbd_mb0_bkgd&pd_rd_w=3bfmx&content-id=amzn1.sym.cd7c548b-a599-426f-9ffe-daa1aa803c87%3Aamzn1.sym.cd7c548b-a599-426f-9ffe-daa1aa803c87&pf_rd_p=cd7c548b-a599-426f-9ffe-daa1aa803c87&pf_rd_r=MTKTNBNHE23CJ37WBME9&pd_rd_wg=xNjX0&pd_rd_r=213bc3c9-99f7-4cb7-b002-4e95ad22f947,,,,,False,,,N/A,2026-04-16T09:40:47.592710
62,1,Title,,,,Need help?Visit the help sectionorcontact us,,,,,,False,,,,2026-04-16T09:40:47.592710
0,2,Title,,,,FiltersMost Purchased& UpAll DiscountsToday's DealsUp to $15$15 to $20$20 to $25$25 to $35$35 & abov,,,,,,False,,,,2026-04-16T09:41:03.975986
1,2,Title,,,,ResultsCheck each product page for other buying options. Price and other details may vary based on p,,,,,,False,,,,2026-04-16T09:41:03.976986
3,2,Organic,,49.0,B0G2BLV35J,Inflatable Palm Tree Beach Balls Flamingo Banana Parrot Dolphin Cactus Ring Toss Sets for Tropical Hawaiian Beach Luau Summer Pool Party Decorations,N/A,$25.99,,4.3,5.0,False,https://images-na.ssl-images-amazon.com/images/G/01/x-locale/common/grey-pixel.gif,https://images-na.ssl-images-amazon.com/images/G/01/x-locale/common/grey-pixel.gif,,2026-04-16T09:41:03.985752
4,2,Title,,,,More results,,,,,,False,,,,2026-04-16T09:41:03.987749
5,2,Organic,,50.0,B0DXFQD2N7,"xo, Fetti Pool Party Temporary Tattoos - 68 Iridescent Foil Pcs | Summer Birthday Accessory, Kids Waterpark Party Favor, Cute Beach Activity",N/A,$7.99,,4.6,33.0,False,https://images-na.ssl-images-amazon.com/images/G/01/x-locale/common/grey-pixel.gif,https://images-na.ssl-images-amazon.com/images/G/01/x-locale/common/grey-pixel.gif,,2026-04-16T09:41:03.999750
7,2,Title,,,,"0:00Debug info copied.SponsoredInflatable Pool Games Volleyball Net Pool Float Set with 19"" Beach Ba",,,,,,False,,,,2026-04-16T09:41:04.000894
8,2,Title,,,,Enjoy Summer with Inflatable Pool Volleyball SetSponsoredInflatable Pool Games Volleyball Net Pool F,,,,,,False,,,,2026-04-16T09:41:04.002453
9,2,Title,,,,More results,,,,,,False,,,,2026-04-16T09:41:04.002453
10,2,Organic,,51.0,B01F6LRW30,"Joyin Toy 36 Counts Hawaiian Leis Bulk, Tropical Flower Lei Hawaiian Lei Beach Hawaii Luau Party Favors Decoration Birthday Party Supplies(3 Dozen)",N/A,$9.99,,4.6,10885.0,False,https://images-na.ssl-images-amazon.com/images/G/01/x-locale/common/grey-pixel.gif,https://images-na.ssl-images-amazon.com/images/G/01/x-locale/common/grey-pixel.gif,,2026-04-16T09:41:04.009380
11,2,Organic,,52.0,B0BWR9FQYX,2 Pack Blue Streamers Party Decorations Fringe Backdrop Ocean Themed Decorations Foil Curtain Backdrop Blue Birthday Ocean Party Decor Supplies,N/A,$5.97,,4.4,10539.0,False,https://images-na.ssl-images-amazon.com/images/G/01/x-locale/common/grey-pixel.gif,https://images-na.ssl-images-amazon.com/images/G/01/x-locale/common/grey-pixel.gif,,2026-04-16T09:41:04.018665
12,2,Organic,,53.0,B0DYY9GJ3S,"134Pcs Tropical Summer Beach Pool Party Balloon Garland Arch Kit,with Inflatable Beach Balls,Watermelon,Sun Foil Balloons for Hawaiian Luau Birthday Graduation Party Decorations - Hot Pink Yellow Blue",N/A,$15.69,,4.4,36.0,False,https://images-na.ssl-images-amazon.com/images/G/01/x-locale/common/grey-pixel.gif,https://images-na.ssl-images-amazon.com/images/G/01/x-locale/common/grey-pixel.gif,,2026-04-16T09:41:04.031238
13,2,Organic,,54.0,B0BRZXJFHM,"12Pcs Reusable Water Balloons, Pool Beach water Toys for Boys and Girls, Outdoor Summer Toys for Kids Ages 3-12",N/A,$27.99,,4.7,3037.0,False,https://images-na.ssl-images-amazon.com/images/G/01/x-locale/common/grey-pixel.gif,https://images-na.ssl-images-amazon.com/images/G/01/x-locale/common/grey-pixel.gif,,2026-04-16T09:41:04.038546
14,2,Organic,,55.0,B0D89XQ37N,"Swimming Pool Party Banner for Summer Party Decorations, Summer Themed Hawaiian Outdoor Party Decorations, Baby Shower Birthday Swimming Pool Party Supplies(Pool Party Blue)",N/A,$12.99,,4.6,72.0,False,https://images-na.ssl-images-amazon.com/images/G/01/x-locale/common/grey-pixel.gif,https://images-na.ssl-images-amazon.com/images/G/01/x-locale/common/grey-pixel.gif,,2026-04-16T09:41:04.045602
