data_index,page,ad_type,ad_rank,organic_rank,asin,title,url,price_current,price_list,rating_stars,rating_count,is_prime,image_small,image_large,brand_name,scraped_at,inner_products_count
26,4,Organic,,164.0,B0D859Z1M1,Sun Candy Lollipops - 30 Count Individually Wrapped Suckers Bulk - Cute Fun Summer Themed Yellow Candy Favors - Beach Theme - Pool Party Treats - Birthday Party Goodie Bags - Lemon Flavor,N/A,$14.95,,4.4,212.0,False,https://m.media-amazon.com/images/I/712tB20RN+L._AC_UL320_.jpg,https://m.media-amazon.com/images/I/712tB20RN+L._AC_SL1500_.jpg,,2026-04-21T11:31:58.840151,
27,4,Organic,,165.0,B0CXXBNKYX,Hello Summer Banner Summer Party Decorations Beach Party Decoration 3Pcs Hello Summer Pool Party Banners for Hawaiian Happy Party Supplies,N/A,$9.99,,4.3,19.0,False,https://m.media-amazon.com/images/I/81-AoSj9YiL._AC_UL320_.jpg,https://m.media-amazon.com/images/I/81-AoSj9YiL._AC_SL1500_.jpg,,2026-04-21T11:31:58.844321,
28,4,Organic,,166.0,B0C6X5186S,Libima Inflatable Hawaiian Limbo Party Game Tropical Theme Fun Game Hawaiian Party Accessories Inflatable Hawaii Limbo for Adult Kids Summer Outdoor Garden Beach Birthday Pool Game Party,N/A,$26.96,,3.6,51.0,False,https://m.media-amazon.com/images/I/718Y6eaWPzL._AC_UL320_.jpg,https://m.media-amazon.com/images/I/718Y6eaWPzL._AC_SL1500_.jpg,,2026-04-21T11:31:58.847702,
29,4,Organic,,167.0,B0D129R82J,"VILIFEVER Ice Cream Bar Banner Ice Cream Garland, Ice Cream Theme Birthday Party Baby Shower Wedding Decorations Photo Props Summer Holidays Party Favors",N/A,$9.99,,4.8,67.0,False,https://m.media-amazon.com/images/I/71-ayrrmaxL._AC_UL320_.jpg,https://m.media-amazon.com/images/I/71-ayrrmaxL._AC_SL1500_.jpg,,2026-04-21T11:31:58.852677,
30,4,Organic,,168.0,B094JQ6PHY,160 Pcs Cocktail Drink Decoration Accessories 60 Drink Cocktail Umbrellas 100 Fruit Picks Summer Coconut Palm Colorful Bamboo Toothpicks Tropical Luau Hawaiian Beach Party Decorations,N/A,$12.99,,4.7,781.0,False,https://m.media-amazon.com/images/I/81j5VTooYIS._AC_UL320_.jpg,https://m.media-amazon.com/images/I/81j5VTooYIS._AC_SL1500_.jpg,,2026-04-21T11:31:58.859103,
31,4,Organic,,169.0,B0DXDPRM7Z,11pcs Summer Pool Party Honeycomb Centerpieces Hello Summer Party Centerpieces for Table Pink Summer Theme Party Decorations for Girls Birthday Party Baby Shower Supplies,N/A,$11.99,,4.8,11.0,False,https://m.media-amazon.com/images/I/815-TmnZCgL._AC_UL320_.jpg,https://m.media-amazon.com/images/I/815-TmnZCgL._AC_SL1500_.jpg,,2026-04-21T11:31:58.863307,
32,4,Organic,,170.0,B0DP21D9BL,"25pcs Hawaiian Leis Bulk,Colorful Lei Tropical Flower Necklace Hawaii Hula Dance Decor for Summer Beach Pool Luau Party Birthday Decoration Favors Supplies",N/A,$7.64,,4.2,377.0,False,https://m.media-amazon.com/images/I/812uJFjV7FL._AC_UL320_.jpg,https://m.media-amazon.com/images/I/812uJFjV7FL._AC_SL1500_.jpg,,2026-04-21T11:31:58.866899,
33,4,Organic,,171.0,B0FZLZN5CP,"xo, Fetti Pool Party Birthday Banner | Kids Party Decorations, Tropical Summer, Hawaiian Luau, Flamingo, Pink Glitter, Happy Birthday Garland",N/A,$11.99,,5.0,2.0,False,https://m.media-amazon.com/images/I/61YeRAYAw9L._AC_UL320_.jpg,https://m.media-amazon.com/images/I/61YeRAYAw9L._AC_SL1500_.jpg,,2026-04-21T11:31:58.871255,
34,4,Organic,,172.0,B0836KTCNM,"Camlinbo 15 Pcs Inflatable Flamingo Pool Toys Ring Toss Pool Game, Flamingos Luau Party Decor Hawaiian Beach Toys Carnival Outdoor Luau Party Games Supplies for Adults Family",N/A,$12.99,,4.3,915.0,False,https://m.media-amazon.com/images/I/71GzZVqbSEL._AC_UL320_.jpg,https://m.media-amazon.com/images/I/71GzZVqbSEL._AC_SL1500_.jpg,,2026-04-21T11:31:58.875133,
35,4,Organic,,173.0,B073DWVS5T,jollylife 12PCS Luau Hawaiian Grass Skirts + 12PCS Wristbands Party Decorations Hula Hibiscus Flowers Birthday Tropical Supplies,N/A,$23.99,,4.6,1572.0,False,https://m.media-amazon.com/images/I/A1k-7qllpbL._AC_UL320_.jpg,https://m.media-amazon.com/images/I/A1k-7qllpbL._AC_SL1500_.jpg,,2026-04-21T11:31:58.881781,
36,4,Organic,,174.0,B0CYC5SH26,"Hello Summer Party Decorations Extra Large Size Beach Banner for Summer Party Decorations Supplies, 118 x 20 inch",N/A,$9.99,,4.7,26.0,False,https://m.media-amazon.com/images/I/71LkpSh-mIL._AC_UL320_.jpg,https://m.media-amazon.com/images/I/71LkpSh-mIL._AC_SL1500_.jpg,,2026-04-21T11:31:58.888647,
37,4,Organic,,175.0,B0BY4BHXVZ,"60 Pcs Hawaiian Luau Hula Skirts Decorations, Hawaiian Grass Skirts Leis Necklaces Bracelets for Tropical Beach Holiday Decorations Tropical Themed Dance",N/A,$23.86,,4.5,183.0,False,https://m.media-amazon.com/images/I/91bZUuPj29L._AC_UL320_.jpg,https://m.media-amazon.com/images/I/91bZUuPj29L._AC_SL1500_.jpg,,2026-04-21T11:31:58.895257,
38,4,Organic,,176.0,B0BTDHRYT8,"36 Count Hawaiian Lei Bulk, Tropical Luau Hawaii Theme Silk Flower Lei, Party Favors for Beach Holiday Wedding Birthday Party, Aloha Summer Party Decorations",N/A,$9.98,,4.4,1265.0,False,https://m.media-amazon.com/images/I/91dq-UYMKiL._AC_UL320_.jpg,https://m.media-amazon.com/images/I/91dq-UYMKiL._AC_SL1500_.jpg,,2026-04-21T11:31:58.899876,
39,4,Organic,,177.0,B08SJ3F3XH,"25 Count Hawaiian Leis Set Bulk for Kids & AdultsTropical Luau Flower Lei, Multicolor Party Favors for Hawaii Decor Birthday, Beach Wedding, Easter Parties & Holiday Decorations",N/A,$9.95,,4.5,2463.0,False,https://m.media-amazon.com/images/I/81Wn7vs-LGL._AC_UL320_.jpg,https://m.media-amazon.com/images/I/81Wn7vs-LGL._AC_SL1500_.jpg,,2026-04-21T11:31:58.904305,
40,4,Organic,,178.0,B0F13CVFYD,"Hallswl 3Pcs Ocean Waves Tablecloth, Ocean Water Print Tablecloths Summer Disposable Plastic Table Covers for Beach Surf Pool Sea Themed Party Birthday Decorations,54X108inch",N/A,$8.99,,4.7,67.0,False,https://m.media-amazon.com/images/I/81xmLEb5RaL._AC_UL320_.jpg,https://m.media-amazon.com/images/I/81xmLEb5RaL._AC_SL1500_.jpg,,2026-04-21T11:31:58.908289,
41,4,Organic,,179.0,B0FFMGM3D1,6pcs Vintage Surfing Surfboard Hanging Garlands Pink Surf Surfboard Theme Hanging Decorations Summer Surfing Party Room Wall Decor for Summer Beach Birthday Hawaii Surf Party Supplies,N/A,$8.99,,5.0,2.0,False,https://m.media-amazon.com/images/I/816MgUFmyeL._AC_UL320_.jpg,https://m.media-amazon.com/images/I/816MgUFmyeL._AC_SL1500_.jpg,,2026-04-21T11:31:58.912529,
42,4,Organic,,180.0,B0BVZ848QC,30 Pcs Beach Wood Hanging Tree Ornaments Beach Wooden Slices Coconut Pendant Tags Sunshine Hanging Decoration with String Tree Ornament for Luau Party Supplies Hawaiian Party Decor 15 Styles,N/A,$13.99,,4.7,541.0,False,https://m.media-amazon.com/images/I/81mE658wAgL._AC_UL320_.jpg,https://m.media-amazon.com/images/I/81mE658wAgL._AC_SL1500_.jpg,,2026-04-21T11:31:58.916242,
43,4,Organic,,181.0,B0DXF3MXS4,AIBIIN Hello Summer Porch Sign Decorations Banner Tropical Beach Hawaiian Summer Door Front Door Decorative Hanging Welcome Summer Banner Porch Decorations Indoor Outdoor 70.8x11.8 inch,N/A,$8.99,,4.4,3.0,False,https://m.media-amazon.com/images/I/61LBVXplufL._AC_UL320_.jpg,https://m.media-amazon.com/images/I/61LBVXplufL._AC_SL1500_.jpg,,2026-04-21T11:31:58.919986,
44,4,Organic,,182.0,B0DT1LH41Z,"Atonofun 60 Counts Leis for Luau Party, Hawaiian Leis Bulk Decorations Colorful Tropical Flower Necklace Hawaiian Garland for Kids Adults Hawaiian Beach Luau Party Favors Supplies",N/A,$21.99,,4.8,77.0,False,https://m.media-amazon.com/images/I/81p6bCYa3PL._AC_UL320_.jpg,https://m.media-amazon.com/images/I/81p6bCYa3PL._AC_SL1500_.jpg,,2026-04-21T11:31:58.923653,
45,4,Organic,,183.0,B0FDKCP34L,"Hawaiian Aloha Party Decorations,Luau Theme Party Supplies,Summer Beach Party,Tropical Birthday Party Decorations",N/A,$7.99,,5.0,5.0,False,https://m.media-amazon.com/images/I/61i2h9EpUgL._AC_UL320_.jpg,https://m.media-amazon.com/images/I/61i2h9EpUgL._AC_SL1500_.jpg,,2026-04-21T11:31:58.928235,
46,4,Organic,,184.0,B0F1XWXY24,"Seashell Party Supplies Ocean Beach Party Supplies Tableware with Seashell Beach Paper Plates Napkins Cups Tablecloth Banner for Summer Hawaiian Birthday Decorations, Serves 24",N/A,$19.99,,4.7,28.0,False,https://m.media-amazon.com/images/I/81X8vYoQ1yL._AC_UL320_.jpg,https://m.media-amazon.com/images/I/81X8vYoQ1yL._AC_SL1500_.jpg,,2026-04-21T11:31:58.932296,
47,4,Organic,,185.0,B0F31WZZB9,4pcs Beach Ball Banners Summer Beach Birthday Party Decorations Pool Theme Banner Decorations for Pool Party Summer Theme Baby Shower Supplies,N/A,$8.99,,5.0,3.0,False,https://m.media-amazon.com/images/I/71vcPxCB8+L._AC_UL320_.jpg,https://m.media-amazon.com/images/I/71vcPxCB8+L._AC_SL1500_.jpg,,2026-04-21T11:31:58.936689,
48,4,Organic,,186.0,B0F2HRJ53G,"Summer Pool Party Decorations, Tropical 162pcs Pastel Colorful Balloons with Beach Ball Swimming Ring Foil Balloon for Splish Splash Birthday Hawaiian Luau Baby Shower Swimming Water Party Supplies",N/A,$15.88,,4.0,21.0,False,https://m.media-amazon.com/images/I/91l3yulBLqL._AC_UL320_.jpg,https://m.media-amazon.com/images/I/91l3yulBLqL._AC_SL1500_.jpg,,2026-04-21T11:31:58.940236,
49,4,Organic,,187.0,B0G82VM9N7,"xo, Fetti Hot Dog Banner | Cookout Party, BBQ Decor, Summer Party, July 4th, Kids Party, Funny",N/A,$11.99,,5.0,1.0,False,https://m.media-amazon.com/images/I/71d6ZJ7bQNL._AC_UL320_.jpg,https://m.media-amazon.com/images/I/71d6ZJ7bQNL._AC_SL1500_.jpg,,2026-04-21T11:31:58.945139,
50,4,Organic,,188.0,B0D6BMPGS5,Hello Summer Party Centerpiece Sticks Beach Pool Centerpiece Decorations for GIrls Pink Summer Theme Table Toppers for Hawaii Beach Pool Party Baby Shower Supplies,N/A,$8.99,,4.2,4.0,False,https://m.media-amazon.com/images/I/81SCsv2iYKL._AC_UL320_.jpg,https://m.media-amazon.com/images/I/81SCsv2iYKL._AC_SL1500_.jpg,,2026-04-21T11:31:58.949036,
51,4,Organic,,189.0,B09TKHH62Z,"Umbrella Cocktail Picks for Drinks, 160 Pack Cocktail Picks for Luau Tropical Party, Pineapple Palm Leaf Fruit Sticks Summer Hawaiian Party Decorations",N/A,$14.95,,4.8,117.0,False,https://m.media-amazon.com/images/I/81o7ceEIuRL._AC_UL320_.jpg,https://m.media-amazon.com/images/I/81o7ceEIuRL._AC_SL1500_.jpg,,2026-04-21T11:31:58.953548,
52,4,Organic,,190.0,B0GC6KWF5P,Amyhill 8 Pcs Summer Ice Cream Table Decorations Wooden Ice Cream Cone Table Centerpiece Sundae Party Decorations Toppers for Summer Theme Bridal Wedding Graduation Birthday Favor Supplies,N/A,$15.99,,4.7,34.0,False,https://m.media-amazon.com/images/I/81G7hd9-UcL._AC_UL320_.jpg,https://m.media-amazon.com/images/I/81G7hd9-UcL._AC_SL1500_.jpg,,2026-04-21T11:31:58.957514,
53,4,Organic,,191.0,B0GL1GMSJV,52 Pcs Spring Hanging Swirls Set Spring Party Decorations Flowers Butterfly Ceiling Swirl Streamers Summer Birthday Party Decoration for Home Classroom School Wall Baby Shower Bulletin Board Decor,N/A,$9.99,,5.0,4.0,False,https://m.media-amazon.com/images/I/810+Oxv-hhL._AC_UL320_.jpg,https://m.media-amazon.com/images/I/810+Oxv-hhL._AC_SL1500_.jpg,,2026-04-21T11:31:58.961258,
54,4,Organic,,192.0,B0GGYZCPC9,"Summer Beach Party Paper Plates, 80 PCS (40 PCS 9 Inch & 40 PCS 7 Inch) Disposable Hawaiian Tropical Tableware for Pool, Luau, Birthday Decorations, Baby Shower Supplies Favor, Serves 40 Guests",N/A,$15.29,,5.0,1.0,False,https://m.media-amazon.com/images/I/81RzqkhKE3L._AC_UL320_.jpg,https://m.media-amazon.com/images/I/81RzqkhKE3L._AC_SL1500_.jpg,,2026-04-21T11:31:58.964421,
56,4,Title,,,,Seen on social mediaSponsoredPTFNY Glittery Goodbye School Hello Pool Banner Summer Pool Party Hangi,,,,,,False,,,,2026-04-21T11:31:58.967937,
57,4,Title,,,,Previous1234567Next,,,,,,False,,,,2026-04-21T11:31:58.968392,
58,4,SB,5.0,,,N/A,https://aax-us-east-retail-direct.amazon.com/x/c/JFw8Xy01zAlIHzoH6WbYCWYAAAGdr8-cgwEAAAH2AQBvbm9fdHhuX2JpZDQgICBvbm9fdHhuX2ltcDIgICCbDC07/clv1c_ek-wBAf2FbbWzjI3k4d3r1eKLAWZLs-we_Cksnqyiz1xen1YlNem0UdW09jeJ171RI_hQQ0uSeK_q0cZrD6xkbAlpl7k9eAt4D98BiH7msRXDwA1LLuYAABLwrtzsj6ZByCHN9V9F1yR1KMwbzgH0_wV6ZydkF0qk8VcTTu02lbXGaqdF-0Nh86snsD0rqX-FsPjvco0BBnyrbyt1ntg8mFYS0tyAV-_3Q2F57dVUezHd0dR4DUY6RoK8GyZcXlDiUZUkFLPHLdh5DbFtPz2wIj8eGavo6KY_iMqQwr-26JYIdTcECQPn2BTEACNuCsDZaDTlPuA_iu4MZrbKtxby4W8F2CybCKNY8en_O3AkyIbuV7huunCrzIBhmnbO3cdbHo3BQanpVguiHffssJ3E0-N8agqM3HIeAm2vVzRO5c8l3z-mPYGtKkJnrC3_wpIWt_v1CeHZCkHtp80cHoX_UXqYYNzRJG2iyRvcWDxlTOq8_C1Xw1QZozlH9BRBZVaNhR6JSCZWmeUgyy4OdqkEfwmqm7sd3Ybbm5ldba2zMLlUPEqHs1XOsz2wHlHPDBrYKxtNkcrnkUoWeqq4Jpeo2PE8t_pNeMmbzoVbqdYb6CvwoeLpjg6TfHIpXfNbyvkKcgpml5KKDkUjsMmpm1F6RVgUVmUoi8Ek0Y256lKPYzK0G9xqK8PsgHvHJOg4MU0J_4bYyv6FKE0BLkJIjwivn2onvF_WxF42HlJenzXcvtC3XYGt7ErSnAyeoBKdW5rwjdM36byJm7P77-P8ZiRooG5fw5OhDj5FDE4-ZvSPfYMvwUy6fU8aehrdf0XaIqMDWqbiWDKIiI8fKRpbSC71Crd4UmneQVK6Y910_6mhdMcByuvuErn5Aw6ZjfBwA5VNi9rwTJKyaCexfyba5bgy4p6KGs1L1OW-CUIcSobos9yuJcJ8eDgsi9UBroScs1fXB_LtW09EJUSSeczkGj9kS7CCeWeFMCsBddpvwIAOGmxKViWSLegggMNEiU510znw0BgnJRtV0HeHipP1dASJPsp2CvYPh2x-sux7lJFPK3c--3j_nIk9dtfA37y6VxQ3QngmiXjajkZykGJ-ssCi03Lzw8VT58EGg0B0CakoPP7ENVkdX2KAA180LRTeb_lPGXh8vXcLoDVzjRW7YSzcRz9m33KBb3SmkL43wlv_xUpXLXa7z85rvT0FuJDkgUtoPsb8qg1nNGq0jIcCuUe1bPPZTzk8ZE_eAx5vGQ1nexEadG2yfKK4dZ_bifcEjaPuGrjUU1oRICpiDjLKQfgFVWwjtRvoZyi9lIp_MZ9X43BRfV0K60jBTxOKyMjSFeyQyySefhMF1C9lI5wBmpMo5oiMnfXGCxRId4NN1QmPm9cbgxLUoJv8HEHZbuhmOs6qVGlySYflU9eZkXSeI05kGDn17-pe4eM-EH2VXPykrCMv99NnNarJ6seOuZjZkY-oPKdbHLOaVpPs9dJ5LnuNr8yJkOGGb3ofrHnbRqeQb64UYUuXymJonLMGgwTHHBZESFBuR6E_uOWGDNpdJzbCSe8dQycCqHTLSiouybr6MNXZVTttkLpzotNAnNPvak7Hwz0apBHAONciCMahda6FjOoY_TMUAcW16B4QEuyAUhj6hPugl3fIBENTIqxVhUQiT-rXwf1kPfgDdZf5gdNzIxq8Su1RGY/https://www.amazon.com/stores/page/AD723312-D35D-4CD3-B0E9-65BDEF2E3F00/?_encoding=UTF8&store_ref=SB_A04583713QCU9RACLQ6F4-A08954171UQSVU17I1HR0&pd_rd_plhdr=t&aaxitk=b3d19e8ea5339ff8af01be66ac5ac2a4&hsa_cr_id=0&lp_asins=B0DM1ZVLTX%2CB0GF1NLKLN%2CB0G3PCVXSD&lp_query=summer%20party%20decorations&lp_slot=desktop-hsa-3psl&ref_=sbx_be_s_3psl_mbd_mb0_bkgd&pd_rd_w=LODcV&content-id=amzn1.sym.cd7c548b-a599-426f-9ffe-daa1aa803c87%3Aamzn1.sym.cd7c548b-a599-426f-9ffe-daa1aa803c87&pf_rd_p=cd7c548b-a599-426f-9ffe-daa1aa803c87&pf_rd_r=WYNBFRESW29S1F83EH05&pd_rd_wg=NL525&pd_rd_r=ce992357-b0cf-4822-be1d-478aaa4fb4f6,,,,,False,,,N/A,2026-04-21T11:31:58.972929,
59,4,Title,,,,Need help?Visit the help sectionorcontact us,,,,,,False,,,,2026-04-21T11:31:58.973622,
0,5,SB,6.0,,,Luau Party Decorations,https://aax-us-east-retail-direct.amazon.com/x/c/JNwulB4gwoAZad-Dkxs_jwoAAAGdr8_QhwEAAAH2AQBvbm9fdHhuX2JpZDcgICBvbm9fdHhuX2ltcDEgICDkgJsQ/clv1c_ek-wBPHXLcTWXmxht8n262bgpECze_6OsWi0oEfGG3mtvcRoNmOavxl7F2NXMtb2yHTAbA0iAw4o-lDtd-1JD-2N4Clw7jGFSks0nEyGWNxwk3BPqyE7FsIQcjh2oi7Zt4gc62CiZLX5qmmMwm6NtlWH5Q0clUPiEsU7bjegx55LmQrdGuMK7fB8K075blN6iG1pIHfQU4DAw0RNF4umsGmRmxEfFGsmBR_PWB2sBoIYRVlrLpEA8bRP1gTPivXSyahT0lnPriygZdFrAUjicnZafaCPzISajW7h8AZeqc8lqvXinwKBCwNgjdwEcFQMuqDKQWeV_mHKvQmsNcNWsxCcLLlOE11CnuFlxNlDtNFbZDm1Xejg39cNI392ERH6UfSB_nEe6BTmwesu26Debb2g6URaUP7sm266vM92cacTe19A_rpuWbOQmASBFpBI6f_viYI_oW618NJ8z583wf8x0lG8JHZsSvrN1AyTI2ZtzcDKZci9i2ISBD2X9Rvxxb6PpVnbyYfwKF9QEEqyq_GHPa16Iaz9PTuOH4v7iI7891e4th1hjNAoGFETIAiQgPgeEUMCiix9lXRkzzwZbuj_fX0R74Es7znHVRPe3EEg1p2M81J2h7Y2H6ZjUOb1j5iny08EAzZaloL6EP7oV0wiuk-Gd8WT-CCBEu78eOrGffMIZpxH6yQ-KQ3F1RsQ9iFCNnf83uLgWLONfk8o7DDEnKhZHbVwfSSnVu0IIw40mZADfhF6sJio-OUrw7P5GAsaik6qrGXSBlgwJNI9ByleaXANIoPxy-VF3p0u6ayx3CmNsryraHfeR3tP_fwZRMiNi_y5yWizT3GxpsMiIDPtTttQzXm8VAHiDSTn05YFfy6DfTtdbfgxTPljgrf_n8yBsTl9_cXSLOLZDjjYu1tz9zF5VXo0RmtCP_GVa1EWk1CNaHqJy0nW8xuyIQRXQK2tBJZRtHlNc8B-6RqfXyAhnlbZngqJ6MbkQ6XdNM7cAHDbGH5Im9be4k0RmwgNr_3UZpXIpglcOUUO7Z_m1nkHdkRHqqJB-VvWcKJwti9PlfOvmUGjwkeFfQbOXp6V51d42g0O9fegRhDai7caO5VWSKpvluvmOJfz7zi1rv8nZ6BV4RSMcV8SLsm66p0F2_K38nOmmR22r0QEHx2QzohUMpJ2aohc6_s8Vt0dlkAyi4LQf1348zuX5TAqUhwVrlf3eTO0s8lCOSSwvP4m4dZ-vZ7nN_bd4f1rG-QubbvoVV3za_intwQciv9sE6fAaZfKFRXdV_m7IrfAPiG5vLpmNeZ3SJuzDy1Bg0H3KVF-tfM6Q-TfeEe1CDTvNCRNoyem0GS_eECVz9PAuDSXkOuCzhy6UH7ips7NSDvod4faSu6RXzlo3bNRxYQFy1zDreQrRv4WusT1C_0fRfoW6YW0AL31zlDDgv35AGjVF7pPRhYmREfxmkg7JbIR_gwwTRpiP9l1lWMXLoWnrFrNBXHXou4hVJrkbNL-GJ4R6lvWVyHMnhAYrf6n_z8HrJPj9JTUMQ1m1HVm1fILnKB_UpiDUVn1UlA65FARoGaKNCSOqnRMgLTSOiaAH9Y2P59bgmKpIHLWUx8-E3Fctsr_MAuVSPqZycB1huxYgansnH0tcQBRAh38Y6_K349PHP0L3uE-w_I6iwrZmmn3u7m7aQZQ1a9o_XrgyLzrK_pzTMQkB14NY_6qVZDETwzx9mhMgQ/https://www.amazon.com/stores/page/5293A3C0-4DB5-4472-990F-B965D60EE00A/?_encoding=UTF8&store_ref=SB_A07795963POCTO23QX4GV-A059678259FNOVC2X5G1&pd_rd_plhdr=t&aaxitk=d56eab758393d5e5d6edadc5905ab1f6&hsa_cr_id=8042606210001&lp_asins=B09NM3WQH6%2CB09Y16XSWR%2CB09NM3RNCV&lp_query=summer%20party%20decorations&lp_slot=auto-sparkle-hsa-tetris&ref_=sbx_s_sparkle_sbtcd_bkgd&pd_rd_w=Vc5oM&content-id=amzn1.sym.cc961e39-6f5f-411e-8135-81c6c1187ac0%3Aamzn1.sym.cc961e39-6f5f-411e-8135-81c6c1187ac0&pf_rd_p=cc961e39-6f5f-411e-8135-81c6c1187ac0&pf_rd_r=ZNHV3VYQYYBC4PZZCW9S&pd_rd_wg=hIGnQ&pd_rd_r=b895aeb0-1d29-42e8-9c9d-dccf444cb5b4,,,,,False,"https://m.media-amazon.com/images/S/al-na-9d5791cf-3faf/34b9de36-72e1-40c4-80b3-6b8a2d8a468c._CR0,0,400,400_AC_SX130_SY60_CB1169409_QL70_.png",,Luau Party Decorations,2026-04-21T11:32:12.332080,3.0
1,5,Title,,,,ResultsCheck each product page for other buying options. Price and other details may vary based on p,,,,,,False,,,,2026-04-21T11:32:12.333247,
3,5,Organic,,193.0,B0BVZ848QC,30 Pcs Beach Wood Hanging Tree Ornaments Beach Wooden Slices Coconut Pendant Tags Sunshine Hanging Decoration with String Tree Ornament for Luau Party Supplies Hawaiian Party Decor 15 Styles,N/A,$13.99,,4.7,541.0,False,https://m.media-amazon.com/images/I/81mE658wAgL._AC_UL320_.jpg,https://m.media-amazon.com/images/I/81mE658wAgL._AC_SL1500_.jpg,,2026-04-21T11:32:12.338065,
4,5,Organic,,194.0,B0GK575YLQ,"Chumia ""hello Summer"" ice pop Sucker Banner with Pom-pom Bunting Sucker for Party Wall Decor Hello Summer Banner for Holiday Birthday Carnival Photo Props Farmhouse Indoor Mantels Displays",N/A,$12.99,,,,False,https://m.media-amazon.com/images/I/71qieqmJGjL._AC_UL320_.jpg,https://m.media-amazon.com/images/I/71qieqmJGjL._AC_SL1500_.jpg,,2026-04-21T11:32:12.342001,
5,5,Organic,,195.0,B0B86J56ZB,"Summer Bingo Cards, Summer Party Games Bingo Cards for Birthday Party, Beach Party Favors Supplies Decorations, 24 Players Bingo Game (A01)",N/A,$6.99,,4.5,547.0,False,https://m.media-amazon.com/images/I/91h5IscRacL._AC_UL320_.jpg,https://m.media-amazon.com/images/I/91h5IscRacL._AC_SL1500_.jpg,,2026-04-21T11:32:12.345839,
6,5,Title,,,,Pool Party DecoractionSponsored|Highly bought brand in this category|Shop TURNMEONShop nowPrevious p,,,,,,False,,,,2026-04-21T11:32:12.347460,
7,5,Title,,,,More results,,,,,,False,,,,2026-04-21T11:32:12.347592,
8,5,Organic,,196.0,B0DXF3MXS4,AIBIIN Hello Summer Porch Sign Decorations Banner Tropical Beach Hawaiian Summer Door Front Door Decorative Hanging Welcome Summer Banner Porch Decorations Indoor Outdoor 70.8x11.8 inch,N/A,$8.99,,4.4,3.0,False,https://m.media-amazon.com/images/I/61LBVXplufL._AC_UL320_.jpg,https://m.media-amazon.com/images/I/61LBVXplufL._AC_SL1500_.jpg,,2026-04-21T11:32:12.353297,
9,5,Organic,,197.0,B0CSFDLBMS,"Artoid Mode Sea Shell Starfish Summer Table Runner,Spring Ocean Kitchen Dining Table Decoration for Home Party Decor 13x72 Inch",N/A,$9.99,,4.7,292.0,False,https://m.media-amazon.com/images/I/712YHZJVR1L._AC_UL320_.jpg,https://m.media-amazon.com/images/I/712YHZJVR1L._AC_SL1500_.jpg,,2026-04-21T11:32:12.361109,
10,5,Organic,,198.0,B07R3S37BY,"5 Pack Sequins Beach Balls 16 Inch 24 Inch, Inflatable Confetti Glitters Clear Beach Ball Swimming Pool Toy Birthday Party Supplies Pool Party Decorations Favors Gifts Water Balloons for Kids Adults",N/A,$11.89,,4.1,1592.0,False,https://m.media-amazon.com/images/I/81Gxdjc-DHL._AC_UL320_.jpg,https://m.media-amazon.com/images/I/81Gxdjc-DHL._AC_SL1500_.jpg,,2026-04-21T11:32:12.367270,
11,5,Organic,,199.0,B0D3WKT79G,Peryiter 3 Pcs Summer Colorful Flip Flop Banner 8.2 ft Summer Garland Pom Pom Garland Tropical Flip Flop Banner Felt Slipper Garland for Hawaiian Beach Pool Party Classroom Decorations Supplies,N/A,$13.99,,3.1,4.0,False,https://m.media-amazon.com/images/I/71vD7Ijf3uL._AC_UL320_.jpg,https://m.media-amazon.com/images/I/71vD7Ijf3uL._AC_SL1500_.jpg,,2026-04-21T11:32:12.370850,
12,5,Organic,,200.0,B0D6BMPGS5,Hello Summer Party Centerpiece Sticks Beach Pool Centerpiece Decorations for GIrls Pink Summer Theme Table Toppers for Hawaii Beach Pool Party Baby Shower Supplies,N/A,$8.99,,4.2,4.0,False,https://m.media-amazon.com/images/I/81SCsv2iYKL._AC_UL320_.jpg,https://m.media-amazon.com/images/I/81SCsv2iYKL._AC_SL1500_.jpg,,2026-04-21T11:32:12.377432,
13,5,Organic,,201.0,B0GL1GMSJV,52 Pcs Spring Hanging Swirls Set Spring Party Decorations Flowers Butterfly Ceiling Swirl Streamers Summer Birthday Party Decoration for Home Classroom School Wall Baby Shower Bulletin Board Decor,N/A,$9.99,,5.0,4.0,False,https://m.media-amazon.com/images/I/810+Oxv-hhL._AC_UL320_.jpg,https://m.media-amazon.com/images/I/810+Oxv-hhL._AC_SL1500_.jpg,,2026-04-21T11:32:12.382960,
14,5,Title,,,,Creative and unique idea to decorate homeShop ArtoidModePrevious pageArtoid Mode Sea Shell Starfish ,,,,,,False,,,,2026-04-21T11:32:12.384845,
15,5,Title,,,,More results,,,,,,False,,,,2026-04-21T11:32:12.384996,
16,5,Organic,,202.0,B0FFMK5KDY,"Beach Ball Happy Birthday Banner, 2-Piece Summer Pool Birthday Party Decoration, Beach Ball Colorful Happy Birthday Hanging Banner (Multicolor)",N/A,$9.99,,5.0,2.0,False,https://m.media-amazon.com/images/I/61Pd4AjPhbL._AC_UL320_.jpg,https://m.media-amazon.com/images/I/61Pd4AjPhbL._AC_SL1500_.jpg,,2026-04-21T11:32:12.388261,
17,5,Organic,,203.0,B0C5J75QXP,"36 Pcs Summer Wood Hanging Ornaments Summer Flip Flop Wood Chip Hanging Tree Hanging Ornament Wood Tags Colorful Ornament for Birthday Party Anniversary Home Summer Decor, 12 Styles",N/A,$12.99,,4.3,27.0,False,https://m.media-amazon.com/images/I/8103COumSiL._AC_UL320_.jpg,https://m.media-amazon.com/images/I/8103COumSiL._AC_SL1500_.jpg,,2026-04-21T11:32:12.393577,
18,5,Organic,,204.0,B0F2HRJ53G,"Summer Pool Party Decorations, Tropical 162pcs Pastel Colorful Balloons with Beach Ball Swimming Ring Foil Balloon for Splish Splash Birthday Hawaiian Luau Baby Shower Swimming Water Party Supplies",N/A,$15.88,,4.0,21.0,False,https://m.media-amazon.com/images/I/91l3yulBLqL._AC_UL320_.jpg,https://m.media-amazon.com/images/I/91l3yulBLqL._AC_SL1500_.jpg,,2026-04-21T11:32:12.397451,
19,5,Organic,,205.0,B0F5K9DPCW,"Inflatable Flamingo Party Decorations - (Pack of 3) 28"" Tall Large PVC Flamingo Animal Blow-Up Pool Toy for Kids - Summer Outdoor Backyard & Tropical Hawaiian Luau BBQ Party Decor",N/A,$7.89,,3.7,75.0,False,https://m.media-amazon.com/images/I/71tOJrZa0vL._AC_UL320_.jpg,https://m.media-amazon.com/images/I/71tOJrZa0vL._AC_SL1500_.jpg,,2026-04-21T11:32:12.402951,
20,5,Organic,,206.0,B0FMJQ7GTY,"JOYIN 12 Pcs Hawaiian Luau Party Sunglasses, Summer Pool Party Decorations, Tropical Glasses for Girls Hawaiian Outfit, Cool Party Favors & Theme Supplies",N/A,$15.99,,4.4,29.0,False,https://m.media-amazon.com/images/I/81f7fVH8MkL._AC_UL320_.jpg,https://m.media-amazon.com/images/I/81f7fVH8MkL._AC_SL1500_.jpg,,2026-04-21T11:32:12.407294,
21,5,Organic,,207.0,B0DQ4VYK9R,"REDWORD 60PCs Ice Cream Bowls, 9oz Ice Cream Containers Disposable Paper Bowls Sundae Cups Dessert Soup Containers for Ice-cream Party Decorations Summer Party Decorations",N/A,$16.99,,4.8,76.0,False,https://m.media-amazon.com/images/I/811lHRyc73L._AC_UL320_.jpg,https://m.media-amazon.com/images/I/811lHRyc73L._AC_SL1500_.jpg,,2026-04-21T11:32:12.412549,
22,5,Organic,,208.0,B0F31WZZB9,4pcs Beach Ball Banners Summer Beach Birthday Party Decorations Pool Theme Banner Decorations for Pool Party Summer Theme Baby Shower Supplies,N/A,$8.99,,5.0,3.0,False,https://m.media-amazon.com/images/I/71vcPxCB8+L._AC_UL320_.jpg,https://m.media-amazon.com/images/I/71vcPxCB8+L._AC_SL1500_.jpg,,2026-04-21T11:32:12.417026,
23,5,Organic,,209.0,B0G82VM9N7,"xo, Fetti Hot Dog Banner | Cookout Party, BBQ Decor, Summer Party, July 4th, Kids Party, Funny",N/A,$11.99,,5.0,1.0,False,https://m.media-amazon.com/images/I/71d6ZJ7bQNL._AC_UL320_.jpg,https://m.media-amazon.com/images/I/71d6ZJ7bQNL._AC_SL1500_.jpg,,2026-04-21T11:32:12.420510,
24,5,Organic,,210.0,B0D859Z1M1,Sun Candy Lollipops - 30 Count Individually Wrapped Suckers Bulk - Cute Fun Summer Themed Yellow Candy Favors - Beach Theme - Pool Party Treats - Birthday Party Goodie Bags - Lemon Flavor,N/A,$14.95,,4.4,212.0,False,https://m.media-amazon.com/images/I/712tB20RN+L._AC_UL320_.jpg,https://m.media-amazon.com/images/I/712tB20RN+L._AC_SL1500_.jpg,,2026-04-21T11:32:12.424634,
25,5,Organic,,211.0,B0F5Q9LDCJ,12pcs Beach Ball Honeycomb Centerpieces Summer Beach Theme Centerpiece Decorations for Table Beach Birthday Party Decorations for Pool Party Summer Theme Party Baby Shower Supplies,N/A,$8.99,,3.3,7.0,False,https://m.media-amazon.com/images/I/812RJ8g6svL._AC_UL320_.jpg,https://m.media-amazon.com/images/I/812RJ8g6svL._AC_SL1500_.jpg,,2026-04-21T11:32:12.428480,
26,5,Organic,,212.0,B0DX72MCCG,"12Pcs Blue Paper Lanterns Set, Blue White Mint Green Hanging Round Paper Lanterns in Assorted Sizes 6"" 8"" 10"" 12"", for Graduation, Wedding, Birthday, Baby Shower and Coastal Party Decorations",N/A,$14.88,,4.7,229.0,False,https://m.media-amazon.com/images/I/81uOrXZv8GL._AC_UL320_.jpg,https://m.media-amazon.com/images/I/81uOrXZv8GL._AC_SL1500_.jpg,,2026-04-21T11:32:12.432981,
27,5,Organic,,213.0,B0G64RZGGT,"Yousoontic Summer Beach Flip Flop Table Centerpiece Decor - 3D Wooden Slippers Sign with LED Lights, Hawaii Luau Tropical Decor for Home Mantel, Desk & Party",N/A,$16.99,,4.2,60.0,False,https://m.media-amazon.com/images/I/71xQJxcpjYL._AC_UL320_.jpg,https://m.media-amazon.com/images/I/71xQJxcpjYL._AC_SL1500_.jpg,,2026-04-21T11:32:12.436877,
28,5,Organic,,214.0,B0F1MD8QD6,48Pcs Vintage Surfing Surfboard Paper Plates 7.1inch Summer Surfing Birthday Party Tableware for Girls Pink Surfer Surf Van Surfboard Theme Dinnerware Plates for Summer Hawaii Surf party supplies,N/A,$11.69,,4.8,8.0,False,https://m.media-amazon.com/images/I/91vW2RtqKZL._AC_UL320_.jpg,https://m.media-amazon.com/images/I/91vW2RtqKZL._AC_SL1500_.jpg,,2026-04-21T11:32:12.440909,
