data_index,page,ad_type,ad_rank,organic_rank,asin,title,url,price_current,price_list,rating_stars,rating_count,is_prime,image_small,image_large,brand_name,scraped_at,inner_products_count
0,1,SB_Video,1.0,,,N/A,N/A,,,,,False,,,,2026-04-21T11:31:09.667336,1.0
1,1,Title,,,,ResultsCheck each product page for other buying options. Price and other details may vary based on p,,,,,,False,,,,2026-04-21T11:31:09.668627,
3,1,Organic,,1.0,B0CR6SG9NZ,Arrowom 24pcs Hawaiian Leis Bulk Luau Party Silk Flower Necklace Colorful Tropical Hawaiian Bulk Hula Dance Party Decor Flower Leis Summer Beach Pool Party Decorations Favors Supplies,N/A,$9.49,,4.5,2699.0,False,https://m.media-amazon.com/images/I/91Dw3St+MFL._AC_UL320_.jpg,https://m.media-amazon.com/images/I/91Dw3St+MFL._AC_SL1500_.jpg,,2026-04-21T11:31:09.676835,
4,1,Organic,,2.0,B0GMQ1CN4F,"Beach Party Supplies Serve 24, Summer Beach Party Decorations Include Hello Summer Party Plates, Napkins,Cups,Tablecloth,Banner,Balloons and Cake Toppers for Hawaiian Pool Birthday Baby Shower Decor",N/A,$20.99,,,,False,https://m.media-amazon.com/images/I/81zN2pF3aNL._AC_UL320_.jpg,https://m.media-amazon.com/images/I/81zN2pF3aNL._AC_SL1500_.jpg,,2026-04-21T11:31:09.680615,
5,1,Organic,,3.0,B0GF85NDK3,Avezano Hello Summer Banner Hawaiian Beach Door Banner Summer Door Decor Tropical Hawaiian Party Decorations Indoor Outdoor,N/A,$11.99,,,,False,https://m.media-amazon.com/images/I/811flZr9crL._AC_UL320_.jpg,https://m.media-amazon.com/images/I/811flZr9crL._AC_SL1500_.jpg,,2026-04-21T11:31:09.685994,
6,1,Title,,,,Colorful Rainbow Beach BallsSponsored|Top 10 best-selling brand in this category|Shop JOYINShop nowP,,,,,,False,,,,2026-04-21T11:31:09.687789,
8,1,Title,,,,Debug info copied.SponsoredRenbuzhu 15Pcs Summer Party Decorations Watermelon Paper Lanterns Pom Pom,,,,,,False,,,,2026-04-21T11:31:09.688325,
9,1,Title,,,,More results,,,,,,False,,,,2026-04-21T11:31:09.688467,
10,1,Organic,,4.0,B0DP2FLFKM,‎Renbuzhu 15PCS Pool Party Decorations Beach Ball Paper Lanterns - Summer Luau Hawaiian Themed Hanging Decor for Home Birthday Outdoor Indoor,N/A,$16.99,,4.5,126.0,False,https://m.media-amazon.com/images/I/81SAWFpzVML._AC_UL320_.jpg,https://m.media-amazon.com/images/I/81SAWFpzVML._AC_SL1500_.jpg,,2026-04-21T11:31:09.691529,
11,1,Organic,,5.0,B09WJB4JG1,Summer Pool Beach Hanging Swirls Banner Decor 30 Pack Foil Ceiling Hanging Swirls Streams Banner Decorations Garland for Kids Luau Hawaii Celebrating Events Birthday Party Supplies Room Wall Decor,N/A,$9.99,,4.6,287.0,False,https://m.media-amazon.com/images/I/81pvLwg9GEL._AC_UL320_.jpg,https://m.media-amazon.com/images/I/81pvLwg9GEL._AC_SL1500_.jpg,,2026-04-21T11:31:09.694968,
12,1,Organic,,6.0,B00OCGUG02,"Hefty Party On Disposable Plastic Cups, Assorted, 16 Ounce, 100 Count",N/A,$9.97,,4.8,35429.0,False,https://m.media-amazon.com/images/I/81uf-BZz2eL._AC_UL320_.jpg,https://m.media-amazon.com/images/I/81uf-BZz2eL._AC_SL1500_.jpg,,2026-04-21T11:31:09.700657,
13,1,Organic,,7.0,B0FL7DMFZK,Flutesan 16 Pcs Summer Beach Decorations Ice Cream Surfboard Pool Themed Hanging Decor Colorful Paper Lanterns Fans Poms Flowers for Home Birthday Indoor Outdoor End of Summer Party Supplies Favors,N/A,$15.99,,,,False,https://m.media-amazon.com/images/I/81Z0jyyi-tL._AC_UL320_.jpg,https://m.media-amazon.com/images/I/81Z0jyyi-tL._AC_SL1500_.jpg,,2026-04-21T11:31:09.704031,
14,1,Organic,,8.0,B071JR7GYP,"JOYIN 60"" Inflatable Palm Tree Cooler, Beach Theme Decor, Pool Party Decorations, Luau Hawaiian Birthday Party Supplies, Ocean Jungle Tropical Themed Summer Outdoor Drink Cooler",N/A,$19.99,,4.3,5368.0,False,https://m.media-amazon.com/images/I/815M9fW4pfL._AC_UL320_.jpg,https://m.media-amazon.com/images/I/815M9fW4pfL._AC_SL1500_.jpg,,2026-04-21T11:31:09.707348,
15,1,Organic,,9.0,B07NWR7HKD,"JOYIN 12-Pack 12“ Beach Balls - Bulk Classic Beachball Inflatable Swimming Pool Toys for Games Adults Kids Birthday Party Supplies Combo Set, Rainbow Color Blow Up Luau Decorations Favors Gifts (12"")",N/A,$9.99,,4.5,3356.0,False,https://m.media-amazon.com/images/I/814LDy0nOPL._AC_UL320_.jpg,https://m.media-amazon.com/images/I/814LDy0nOPL._AC_SL1500_.jpg,,2026-04-21T11:31:09.711297,
16,1,Organic,,10.0,B0DYSKPF35,Summer Party Decorations - 61 Pcs Beach Pool Party Decorations Hello Summer Banner Pool Beach Hanging Streams Decor for Home Office School Classroom,N/A,$7.99,,4.7,101.0,False,https://m.media-amazon.com/images/I/81Zdymfw6zL._AC_UL320_.jpg,https://m.media-amazon.com/images/I/81Zdymfw6zL._AC_SL1500_.jpg,,2026-04-21T11:31:09.715378,
17,1,Organic,,11.0,B0831D4S1D,R HORSE Inflatable Palm Tree Flamingo Banana Beach Ball Parrot Beach Pool Toys for Tropical Hawaiian Luau Party Summer Pool Beach Party Decorations,N/A,$22.99,,4.2,945.0,False,https://m.media-amazon.com/images/I/81UNKcb+coL._AC_UL320_.jpg,https://m.media-amazon.com/images/I/81UNKcb+coL._AC_SL1500_.jpg,,2026-04-21T11:31:09.720689,
18,1,Organic,,12.0,B07DLVSJ99,"FUTUREPLUSX 2 Pack Tropical Garland Party Decorations, 20ft Multicolored Tissue Paper Hibiscus Flower Summer Banner for Birthday Beach Theme Luau Hawaiian Party Supplies Jungle Decor",N/A,$8.99,,4.7,3375.0,False,https://m.media-amazon.com/images/I/71q9+TnamlL._AC_UL320_.jpg,https://m.media-amazon.com/images/I/71q9+TnamlL._AC_SL1500_.jpg,,2026-04-21T11:31:09.727301,
19,1,Organic,,13.0,B0F1YMPVPN,Beach Party Decorations Kit - Beach Themed Honeycomb Centerpieces and Table Decor for Summer & Pool Party Decorations,N/A,$9.98,,4.7,1132.0,False,https://m.media-amazon.com/images/I/81DHErA5m0L._AC_UL320_.jpg,https://m.media-amazon.com/images/I/81DHErA5m0L._AC_SL1500_.jpg,,2026-04-21T11:31:09.732371,
20,1,Organic,,14.0,B09Z28TMY4,Vinsot 32 Pack Beach Pool Party Eyeglasses Decor Summer Luau Paper Glasses Bulk Hawaiian Sunglasses Frame Tropical Pool Props Photo Booth Props for Summer Beach Luau Party Favor Birthday Supply Decor,N/A,$12.99,,4.1,648.0,False,https://m.media-amazon.com/images/I/81bbJ2wNgCL._AC_UL320_.jpg,https://m.media-amazon.com/images/I/81bbJ2wNgCL._AC_SL1500_.jpg,,2026-04-21T11:31:09.741729,
21,1,Title,,,,More results,,,,,,False,,,,2026-04-21T11:31:09.742434,
22,1,Organic,,15.0,B073RBVTXT,"ALINK 50 Umbrella Parasol Drinking Straws, Hawaiian Beach Cocktail Luau Party Decorations Supplies",N/A,$6.99,,4.6,10351.0,False,https://m.media-amazon.com/images/I/81YbWfWBaPL._AC_UL320_.jpg,https://m.media-amazon.com/images/I/81YbWfWBaPL._AC_SL1500_.jpg,,2026-04-21T11:31:09.748780,
23,1,Organic,,16.0,B0C3PQ9M8X,7x5ft Summer Hawaiian Beach Photography Backdrop Tropical Flower Palm Leaves Surfboard Background for Luau Aloha Party Decoration Banner Photo Booth,N/A,$13.99,,4.6,377.0,False,https://m.media-amazon.com/images/I/81BTSS8GBuL._AC_UL320_.jpg,https://m.media-amazon.com/images/I/81BTSS8GBuL._AC_SL1500_.jpg,,2026-04-21T11:31:09.754919,
24,1,Organic,,17.0,B01F6LRW30,"Joyin Toy 36 Counts Hawaiian Leis Bulk, Tropical Flower Lei Hawaiian Lei Beach Hawaii Luau Party Favors Decoration Birthday Party Supplies(3 Dozen)",N/A,$11.99,,4.6,10884.0,False,https://m.media-amazon.com/images/I/911aTPl1DwL._AC_UL320_.jpg,https://m.media-amazon.com/images/I/911aTPl1DwL._AC_SL1500_.jpg,,2026-04-21T11:31:09.759088,
25,1,Organic,,18.0,B09NM2FPKX,"Fovths Luau Grass Table Skirt Natural 9 Feet x 29.5 Inch Hawaiian Table Skirt for Tropical Hawaiian Party Decorations Luau Costume Party, Straw Yellow",N/A,$8.49,,4.5,2400.0,False,https://m.media-amazon.com/images/I/81Hsj3wr27L._AC_UL320_.jpg,https://m.media-amazon.com/images/I/81Hsj3wr27L._AC_SL1500_.jpg,,2026-04-21T11:31:09.763166,
26,1,Organic,,19.0,B0F3J74VN5,Summer Party Decoration Hello Summer Banner Colorful Beach Pool Theme Banners Pre-strung Pool Banner Hanging Swirls Honeycomb Balls Circle Dots Garland for Holiday Beach Party Decorations Supplies,N/A,$9.99,,4.8,20.0,False,https://m.media-amazon.com/images/I/81iDyh6u+ML._AC_UL320_.jpg,https://m.media-amazon.com/images/I/81iDyh6u+ML._AC_SL1500_.jpg,,2026-04-21T11:31:09.767105,
27,1,Organic,,20.0,B00N1QPNMA,"PartySticks Glow Sticks Party Supplies 100pk - 8 Inch Glow in the Dark Light Up Sticks Party Favors, Glow Party Decorations, Neon Party Glow Necklaces and Glow Bracelets with Connectors",N/A,$7.99,,4.6,28646.0,False,https://m.media-amazon.com/images/I/81JYNlch58L._AC_UL320_.jpg,https://m.media-amazon.com/images/I/81JYNlch58L._AC_SL1500_.jpg,,2026-04-21T11:31:09.773223,
28,1,Organic,,21.0,B0C6X65BLF,"MISS FANTASY Summer Party Banners, Multi Color Rectangular Paper Summer Banner Decorations for Pool, Beach, Luau, Tropical Parties",N/A,$6.99,,4.7,55.0,False,https://m.media-amazon.com/images/I/416LHGiY4NL._AC_UL320_.jpg,https://m.media-amazon.com/images/I/416LHGiY4NL._AC_SL1500_.jpg,,2026-04-21T11:31:09.777334,
29,1,Organic,,22.0,B0GC5K38TY,School's Out for Summer Decorations Include Summer Theme Banner Hanging Swirls Honeycomb Centerpieces End of School Year Party Decorations for Schools Classroom Summers Vacation Celebration Decor,N/A,$13.99,,,,False,https://m.media-amazon.com/images/I/81UBkT0V5AL._AC_UL320_.jpg,https://m.media-amazon.com/images/I/81UBkT0V5AL._AC_SL1500_.jpg,,2026-04-21T11:31:09.783356,
30,1,Organic,,23.0,B0BWR9FQYX,2 Pack Blue Streamers Party Decorations Fringe Backdrop Ocean Themed Decorations Foil Curtain Backdrop Blue Birthday Ocean Party Decor Supplies,N/A,$5.97,,4.4,10544.0,False,https://m.media-amazon.com/images/I/914rDCqCJuL._AC_UL320_.jpg,https://m.media-amazon.com/images/I/914rDCqCJuL._AC_SL1500_.jpg,,2026-04-21T11:31:09.788590,
31,1,Title,,,,More results,,,,,,False,,,,2026-04-21T11:31:09.789310,
32,1,Organic,,24.0,B0CQV2P4FX,"12Pcs Summer Party Decorations Honeycomb Centerpiece, Hello Summer Party Decorations Centerpiece,3D Beach Summer Decorations Honeycomb Centerpiece for Summer Party Beach Party Decorations",N/A,$9.99,,4.8,46.0,False,https://m.media-amazon.com/images/I/81OM2qVPj1L._AC_UL320_.jpg,https://m.media-amazon.com/images/I/81OM2qVPj1L._AC_SL1500_.jpg,,2026-04-21T11:31:09.793934,
33,1,Organic,,25.0,B07DCNJDMK,"Inflatable Palm Tree Decoration, 2 Pack Jumbo Coconut Trees Beach Backdrop Favor Tropical Blow Up Hawaiian Summer Party Decor for Hawaiian Luau Party Decoration",N/A,$13.99,,3.8,1143.0,False,https://m.media-amazon.com/images/I/61dX1IbRPCL._AC_UL320_.jpg,https://m.media-amazon.com/images/I/61dX1IbRPCL._AC_SL1500_.jpg,,2026-04-21T11:31:09.798845,
34,1,Organic,,26.0,B088FJ4L7K,"YUNXUAN Flamingo Party Supplies, Hawaiian Party Decorations Flamingo and Pineapple Honeycomb Ball Paper Lanterns Paper Fans Pom poms Flowers for Birthday Luau Tropical Bachelorette Party",N/A,$16.99,,4.7,1692.0,False,https://m.media-amazon.com/images/I/71oYj8hh1KL._AC_UL320_.jpg,https://m.media-amazon.com/images/I/71oYj8hh1KL._AC_SL1500_.jpg,,2026-04-21T11:31:09.804786,
35,1,Organic,,27.0,B0DZYT48XZ,"Hello Summer Banner,Summer Party Decorations",N/A,$6.99,,4.6,31.0,False,https://m.media-amazon.com/images/I/51lRmNCx93L._AC_UL320_.jpg,https://m.media-amazon.com/images/I/51lRmNCx93L._AC_SL1500_.jpg,,2026-04-21T11:31:09.808679,
36,1,Organic,,28.0,B075FPCFNR,60Pcs Tropical Party Decorations Supplies Tropical Palm Leaves Hibiscus Flower Simulation Artificial Leaf for Hawaiian Luau Safari Party Jungle Beach Theme BBQ Birthday Parties Decorations Table Decor,N/A,$11.99,,4.6,3137.0,False,https://m.media-amazon.com/images/I/81jZYriVXGL._AC_UL320_.jpg,https://m.media-amazon.com/images/I/81jZYriVXGL._AC_SL1500_.jpg,,2026-04-21T11:31:09.813501,
37,1,Organic,,29.0,B0B44PDCLC,"Bunch O Balloons Tropical Party (6 Pack) by ZURU, 200+ Rapid-Filling Self-Sealing Tropical Colored Water Balloons for Outdoor Family, Friends, Children Summer Fun (6 Pack)",N/A,$17.99,,4.6,2002.0,False,https://m.media-amazon.com/images/I/81qMELDxTTL._AC_UL320_.jpg,https://m.media-amazon.com/images/I/81qMELDxTTL._AC_SL1500_.jpg,,2026-04-21T11:31:09.817881,
38,1,Organic,,30.0,B0DTJ6WHHH,"Tiki Torch Bubbler - Summer Pool Party Bubble Machine with Lights and Music, Bubble Blower and Wand, Rechargeable Outdoor Toy for Kids Teens Birthday Party, 4 Feet Tall, Includes 4oz Bubble Solution",N/A,$14.99,,3.9,897.0,False,https://m.media-amazon.com/images/I/714oV45JnkL._AC_UL320_.jpg,https://m.media-amazon.com/images/I/714oV45JnkL._AC_SL1500_.jpg,,2026-04-21T11:31:09.822471,
39,1,Organic,,31.0,B0F6MZMT3Q,"Schools Out for Summer Decorations, End Of School Year Party Decorations includes Schools Out for Summer Banner and Hello Summer Hanging Swirls and Honeycomb Centerpieces",N/A,$11.99,,4.6,3.0,False,https://m.media-amazon.com/images/I/81aTvVtRLmL._AC_UL320_.jpg,https://m.media-amazon.com/images/I/81aTvVtRLmL._AC_SL1500_.jpg,,2026-04-21T11:31:09.826156,
40,1,Organic,,32.0,B09X2XY5NG,10 Pcs Beach Party Decorations Kit Summer Pool Honeycomb Table Centerpieces Decorations Beach Hawaii Theme Birthday Party Table Topper Photo Props for BBQ Summer Pool Favor Supplies,N/A,$8.99,,4.4,103.0,False,https://m.media-amazon.com/images/I/717opXWShtL._AC_UL320_.jpg,https://m.media-amazon.com/images/I/717opXWShtL._AC_SL1500_.jpg,,2026-04-21T11:31:09.829830,
41,1,Organic,,33.0,B0DC51MRZ4,"Freyalife Hawaiian Leis Decorations(24pcs),Leis for Luau Party Decor Flower,Tropical Hawaiian Bulk Hula Dance Party Decor",N/A,$6.99,,4.3,621.0,False,https://m.media-amazon.com/images/I/816+lI1lMEL._AC_UL320_.jpg,https://m.media-amazon.com/images/I/816+lI1lMEL._AC_SL1500_.jpg,,2026-04-21T11:31:09.833253,
42,1,Organic,,34.0,B0CWQZNHVK,Summer Party Decorations Hello Summer Banner Hanging Swirls and Honeycomb Centerpieces Beach Pool Decorations for Pool Holiday Birthday Party Supplies,N/A,$9.99,,4.7,19.0,False,https://m.media-amazon.com/images/I/812VyJjaHxL._AC_UL320_.jpg,https://m.media-amazon.com/images/I/812VyJjaHxL._AC_SL1500_.jpg,,2026-04-21T11:31:09.839592,
43,1,Organic,,35.0,B07M5BGJFV,"Tropical Palm Leaf Garland Party Decorations, Length 2.6M, 8.5 FT, Green",N/A,$14.99,,4.6,970.0,False,https://m.media-amazon.com/images/I/81p2nI+iEYL._AC_UL320_.jpg,https://m.media-amazon.com/images/I/81p2nI+iEYL._AC_SL1500_.jpg,,2026-04-21T11:31:09.843098,
44,1,Organic,,36.0,B07NS7BG9L,"JOYIN 28” Inflatable Palm Tree Cooler, Luau Hawaiian Tropical Beach Themed Party Decorations, Blow Up Palm Trees Cooler Outdoor Party Supplies, Kids Adults Birthday Party Décor",N/A,$17.99,,4.4,4015.0,False,https://m.media-amazon.com/images/I/91NOjIPjumL._AC_UL320_.jpg,https://m.media-amazon.com/images/I/91NOjIPjumL._AC_SL1500_.jpg,,2026-04-21T11:31:09.846831,
45,1,Organic,,37.0,B07YDK14GQ,Decor365 Under the Sea Party Decorations White Bubble Garlands Little Mermaid Birthday Decorations Bday Hanging Streamer Beach Banner Decor Underwater Backdrop Kids Ocean Party Supplies,N/A,$11.98,,4.6,6487.0,False,https://m.media-amazon.com/images/I/51Gcx9gKPQL._AC_UL320_.jpg,https://m.media-amazon.com/images/I/51Gcx9gKPQL._AC_SL1500_.jpg,,2026-04-21T11:31:09.850373,
46,1,Organic,,38.0,B0CZ637F9S,"OBXT 10"" Blue Hanging Jellyfish Paper Lanterns - Under the Sea Party & Mermaid Birthday Decorations, Baby Shower, Nautical Events, Ocean Theme Classroom & Beach Room Decor (Set of 6)",N/A,$20.99,,4.8,707.0,False,https://m.media-amazon.com/images/I/81vZ2BQo+gL._AC_UL320_.jpg,https://m.media-amazon.com/images/I/81vZ2BQo+gL._AC_SL1500_.jpg,,2026-04-21T11:31:09.854789,
47,1,Organic,,39.0,B0721468V1,"JOYIN Inflatable Swim Tube Raft (3 pack) with Summer Fruits Painting, Pool Toys for Swimming Pool Party Decorations",N/A,$16.99,,4.6,8366.0,False,https://m.media-amazon.com/images/I/71cpqrIteIL._AC_UL320_.jpg,https://m.media-amazon.com/images/I/71cpqrIteIL._AC_SL1500_.jpg,,2026-04-21T11:31:09.859624,
48,1,Organic,,40.0,B0CV33D9F1,"3 Pcs Iridescent Waves Tablecloths - Disposable Plastic Ocean Blue Table Cloth Rectangle Table Covers for Under the Sea Beach Surf Pool Party Birthday Party Decorations, 54 x 108 Inch",N/A,$8.99,,4.5,671.0,False,https://m.media-amazon.com/images/I/81jVudN5HQL._AC_UL320_.jpg,https://m.media-amazon.com/images/I/81jVudN5HQL._AC_SL1500_.jpg,,2026-04-21T11:31:09.864973,
49,1,Organic,,41.0,B0DT6X8QP2,"Summer Pool Beach Party Decorations, Splash Birthday Bash Party Supplies Tropical Summer Banner Beach Ball Lantern Fringe Curtain Foil Balloons Arch for Swimming Water Luau Hawaiian Party Decor(Blue)",N/A,$18.99,,4.4,301.0,False,https://m.media-amazon.com/images/I/81BUSERqr5L._AC_UL320_.jpg,https://m.media-amazon.com/images/I/81BUSERqr5L._AC_SL1500_.jpg,,2026-04-21T11:31:09.869670,
50,1,Organic,,42.0,B0CYBWMR83,"Summer Party Decorations, Hello Summer Banner Hanging Swirls and Honeycomb Centerpieces Beach Pool Party Decorations, Summer Pool Holiday Birthday Party Supplies",N/A,$7.99,,4.8,12.0,False,https://m.media-amazon.com/images/I/61PGCbFgpLL._AC_UL320_.jpg,https://m.media-amazon.com/images/I/61PGCbFgpLL._AC_SL1500_.jpg,,2026-04-21T11:31:09.873194,
51,1,Title,,,,More results,,,,,,False,,,,2026-04-21T11:31:09.873588,
52,1,Organic,,43.0,B0964DB59D,"JOYIN Set of 6 Small Pink Flamingo Yard Ornament Stakes, 17"" Plastic Flamingo Lawn Statues with Metal Legs for Sidewalks, Outdoor Garden Decor, Luau & Pool Party Decorations, 2 Styles",N/A,$15.99,,4.1,3739.0,False,https://m.media-amazon.com/images/I/713gAJWZu5L._AC_UL320_.jpg,https://m.media-amazon.com/images/I/713gAJWZu5L._AC_SL1500_.jpg,,2026-04-21T11:31:09.876619,
53,1,Organic,,44.0,B0F29BDCL9,Hooqict 54Pcs Summer Beach Pool Hanging Swirls Party Decorations Foil Ceiling Hanging Swirls for Summer Birthday Decorations Hawaiian Luau Tiki Beach Party Supplies,N/A,$7.97,,4.5,67.0,False,https://m.media-amazon.com/images/I/71Nu--tzh5L._AC_UL320_.jpg,https://m.media-amazon.com/images/I/71Nu--tzh5L._AC_SL1500_.jpg,,2026-04-21T11:31:09.880141,
54,1,Organic,,45.0,B09C21R58H,24 Beach Drinking Crazy Silly Straws for Kids Beach Ball Pool Summer Birthday Party Supplies Favors Decorations End of Year Student Gifts Bulk Prizes with 2 PCS Cleaning Brushes,N/A,$15.95,,4.7,564.0,False,https://m.media-amazon.com/images/I/717WhwJSsQL._AC_UL320_.jpg,https://m.media-amazon.com/images/I/717WhwJSsQL._AC_SL1500_.jpg,,2026-04-21T11:31:09.884307,
55,1,Organic,,46.0,B0GFCMWPPD,Summer Party Decorations - Pre-Strung Hello Summer Banner and Hanging Swirls Beach Party Decor for Home Office Classroom,N/A,$6.99,,5.0,13.0,False,https://m.media-amazon.com/images/I/71hDK0Jp8-L._AC_UL320_.jpg,https://m.media-amazon.com/images/I/71hDK0Jp8-L._AC_SL1500_.jpg,,2026-04-21T11:31:09.889804,
56,1,Organic,,47.0,B0BKTQ9JLP,"JOYIN 120 Counts Hawaiian Leis Bulk, Colorful Tropical Flower Leis for Kids Adults Hawaiian Beach Luau Party Favors Decorations",N/A,$32.99,,4.6,10884.0,False,https://m.media-amazon.com/images/I/911aTPl1DwL._AC_UL320_.jpg,https://m.media-amazon.com/images/I/911aTPl1DwL._AC_SL1500_.jpg,,2026-04-21T11:31:09.894444,
57,1,Organic,,48.0,B0F2RXN18F,OHOME 2 Pack Luau Party Decorations - Plastic Tablecloth for Hawaiian Theme Party Decorations | Tropical Summer Beach Pool Birthday Backdrop Favors Supplies,N/A,$6.29,,4.6,900.0,False,https://m.media-amazon.com/images/I/91VMLJwCDvL._AC_UL320_.jpg,https://m.media-amazon.com/images/I/91VMLJwCDvL._AC_SL1500_.jpg,,2026-04-21T11:31:09.900653,
59,1,Title,,,,Debug info copied.SponsoredBlueweenly 36 Pcs You are My Sunshine Squirts Bath Toys Swimming Pool Toy,,,,,,False,,,,2026-04-21T11:31:09.901811,
60,1,Title,,,,Related searchesend of summer party decorationssummer partypool party decorationssummer party decora,,,,,,False,,,,2026-04-21T11:31:09.902751,
61,1,Title,,,,Previous123...7Next,,,,,,False,,,,2026-04-21T11:31:09.903186,
62,1,SB,1.0,,,N/A,https://aax-us-east-retail-direct.amazon.com/x/c/JKG_ZYXUzNsLk0iY_0yboBkAAAGdr87a-gEAAAH2AQBvbm9fdHhuX2JpZDMgICBvbm9fdHhuX2ltcDEgICA4dpW7/clv1c_ek-wBIHXErbWDn2nI4trJ16WpAySuUZu967EKHOij0eWE71oSA52t-srdQ1GWV71xuueXA048uWv9kZtAP08ELLNINjLdpaoDSVyGTnRUEoGSRmEL6WcexDNQzl2vj4p57mCZRn0BnSaWGLhndYsXJTjMJyanGWqk8ZUSz27whb3GasbE2ZL_HEVBOQ1IrPG2bL_79uCFitApYQ90gjH6Ny21vU9BlQsniFLPtudqwYsCX46T5fUzAo9dw-dA4x-YlC6xjKHS29n9fg_FJxTXlXzYVwCP0cKu3APwFd74sutEjE-vSnyBHK7BinTQFAhCsowoaldYByg08YfKwa1N2srbhQdBTyJRy72GqxMkKW2LkJ-AkTWhy9Xo7LiwmMbEpl9rtsYaHgK9byrvhVKPwbAL09Dk9u46k-m_ePqe6jazkNWE14RdPIS63p4rhhBVgFYeNJnCxVUxoepQUrqnDjSveFLESq0COMLNszMcJESOf8jc4wxNiPpSQbLfUXUwSqZazyUPgosif3ARgZyzVuEjQYqviKF7TipgX_h9nWNc5hiOxQEHvtofUXoQeTaYNgwI6or_m_Sfqjbyo1JLjjoFLQPYS9c-EzMrYiJph7rDb8MrwNq5qmvUUaqjnMjO0P3XQFEi1CQ-YJuU36WvefmMmM1BP9Er75cr-rBRONzn0Ds6MJVrjhosWmVb70QpBdqfUw-XVdQUcszyJKS8AErFFh0D6VfX1sGuq_M2qC9D-T8MgaXmtsBk0hpKWeCpUrcoigfi0Ue1lAz3cMUC1L2gmjNEb0_n05qxMCK4CB53gXEMr6G053R6t22PhqkWDZ2nWen-zgcbIuUz4LnYYEsz0wMtOXKMdc7pGL-tSVEX8cqs44vBlFspPVkmIxhbYvkcKbLkPNldMgt3BjtK1MYqd3gdNcSrFkRK5fZ7qbUSr-x_LSDUe57WRv5ZybVRROV_p-Ov7V8pBPVU4K27FR6GAj0iAQwmVTaP_Qq3yZiD-hnKLQ1uoH75VpLMI_yDxhHEgw9XsqeX_FMat2djAMoeB_PRswKmKCgub3WndoCt1k52wtGTwL9NMJOypdV0eq3_KRy81YJfSpwxhzEHaOEoOzMlIc_ts15BAleFeWBtkaPDQg_OtVy1A2lOUHVeVXc00ZBA5E6j_Wl4tquG7cixGNNaS04om5fUCQrhuNdoLT9FfyMP1_r6K-lTPCaNNdluT09dbHJ7BB348UkyPRmscearCMM8xS90MzqOmLMNczEs3-jfokpKsUmLRKgmWtBUB6MdfEh35U-OhPhipCQKchH5RHQBQtDPLK7jpqYUN0FjfhJcEO8K2i-_N3qoGKOyFU6MFuVOMpm7aDxqXIP_ld3fkfwspCDW6eQko0aS73qAlZ-jGRxVSYoIML8RMk_L7OsexGNi8HAA0in9FdM-EhzVN4sUtnlQn_sRVqBJDIiQUf7MGZ4AZmsSYV3XlxLBDV87ZjOzr5x3srTvPI66EDjMWOCgYpKEst7j-1Y6uIq5fYyst778SeyJNLft4ORVni48rgAns3SfCxCIKLef0dX80sxhvUpZLLoTOrF_BTpg1RrNG_A3yOuuUBLwbhIkv16RPUvk3rjPcKK2Sb-2bbKqE-iAxaJtEXVj03hEKA_4Bs9Pd3F0w74eurY_Qs3gMtZ0FbQE43QfAdm/https://www.amazon.com/stores/page/6956570F-DAF5-4795-AC42-1726A926FA0D/?_encoding=UTF8&store_ref=SB_A017845915CPB7KG2KJUE-A06766673SV040RNQ87P0&pd_rd_plhdr=t&aaxitk=593ed25cdae78151079140b4dafc652e&hsa_cr_id=0&lp_asins=B0DDH82BQW%2CB0CZ3LWF46%2CB0CKHGHL7Y&lp_query=summer%20party%20decorations&lp_slot=desktop-hsa-3psl&ref_=sbx_be_s_3psl_mbd_mb0_bkgd&pd_rd_w=K4WjC&content-id=amzn1.sym.cd7c548b-a599-426f-9ffe-daa1aa803c87%3Aamzn1.sym.cd7c548b-a599-426f-9ffe-daa1aa803c87&pf_rd_p=cd7c548b-a599-426f-9ffe-daa1aa803c87&pf_rd_r=2C3YSEHZT56NNT20WPNQ&pd_rd_wg=KkSrc&pd_rd_r=cc746e14-8788-4ff3-b254-b9a2b0a18e60,,,,,False,,,N/A,2026-04-21T11:31:09.907447,
63,1,Title,,,,Need help?Visit the help sectionorcontact us,,,,,,False,,,,2026-04-21T11:31:09.908149,
0,2,SB_Video,2.0,,,N/A,N/A,,,,,False,,,,2026-04-21T11:31:22.999130,1.0
1,2,Title,,,,ResultsCheck each product page for other buying options. Price and other details may vary based on p,,,,,,False,,,,2026-04-21T11:31:23.000201,
3,2,Organic,,49.0,B0GKNL7PMH,"Flamingo Hawaiian Party Decorations, Luau Party Decor Flamingo and Pineapple Honeycomb Ball Paper Lanterns for Birthday Pool Summer Tropical Beach Party Supplies",N/A,$13.99,,4.8,22.0,False,https://m.media-amazon.com/images/I/81qvfkmXqHL._AC_UL320_.jpg,https://m.media-amazon.com/images/I/81qvfkmXqHL._AC_SL1500_.jpg,,2026-04-21T11:31:23.004526,
4,2,Organic,,50.0,B0BKTLGZN1,"JOYIN 4-Pack 20"" Beach Balls - Large Rainbow Beach Ball Inflatable Pool Toys for Party Supplies Decorations, Adults Kids Birthday Luau Summer Beach Water Games Beachball Party Favors",N/A,$9.99,,4.5,1468.0,False,https://m.media-amazon.com/images/I/71-+c9L29ML._AC_UL320_.jpg,https://m.media-amazon.com/images/I/71-+c9L29ML._AC_SL1500_.jpg,,2026-04-21T11:31:23.010004,
5,2,Organic,,51.0,B0BTN5DNYZ,"Riakrum 3 Pcs Summer Beach Tablecloths Pool Party Table Covers Rectangle Plastic Hawaiian Tablecloth Beach Supplies Theme Party Decorations for Swimming Themed Birthday Favors, 54 x 108 Inch",N/A,$8.99,,4.7,88.0,False,https://m.media-amazon.com/images/I/91TD+XEveuL._AC_UL320_.jpg,https://m.media-amazon.com/images/I/91TD+XEveuL._AC_SL1500_.jpg,,2026-04-21T11:31:23.014541,
6,2,Title,,,,Under The Sea Party DecorationsSponsored|Shop yorrShop nowPrevious pageUnder The Sea Party Decoratio,,,,,,False,,,,2026-04-21T11:31:23.016577,
7,2,Title,,,,More results,,,,,,False,,,,2026-04-21T11:31:23.016842,
8,2,Organic,,52.0,B0CYX62N3G,"YQUQWN, Hello Summer Banner - No DIY, Summer Banner for Summer Party Decorations, Hello Summer Sun Signs for Birthday Beach Pool Decorations, Tropical Party Decorations, Summer Party Supplies",N/A,$5.99,,4.7,42.0,False,https://m.media-amazon.com/images/I/61Hj6HHce+L._AC_UL320_.jpg,https://m.media-amazon.com/images/I/61Hj6HHce+L._AC_SL1500_.jpg,,2026-04-21T11:31:23.021895,
9,2,Organic,,53.0,B0F29LHPXS,"96 PCS Hello Summer Beach Pool Hawaiian Pre-Cut Temporary Tattoos for Kids | Super Cute Themed Birthday Party Favors, Supplies, Decorations, Fake Tattoo Stickers (Multiple)",N/A,$7.99,,4.6,50.0,False,https://m.media-amazon.com/images/I/81zvrwTnkHL._AC_UL320_.jpg,https://m.media-amazon.com/images/I/81zvrwTnkHL._AC_SL1500_.jpg,,2026-04-21T11:31:23.026263,
10,2,Organic,,54.0,B0F7XT2HJ3,"Summer Party Decorations, Beach Party Supplies include Summer Plates and Napkins, Cups and Forks for Beach Birthday Decorations Serves 24",N/A,$17.99,,4.6,118.0,False,https://m.media-amazon.com/images/I/81GqC4mvazL._AC_UL320_.jpg,https://m.media-amazon.com/images/I/81GqC4mvazL._AC_SL1500_.jpg,,2026-04-21T11:31:23.031931,
11,2,Organic,,55.0,B0BPS34MRJ,33pcs Spring Hanging Decorations for Home - Flower Butterfly Hanging Swirls with Led Lights for Spring Summer Easter Flower Butterfly Themed Birthday Party Decorations,N/A,$8.99,,4.6,539.0,False,https://m.media-amazon.com/images/I/815GV8ode1L._AC_UL320_.jpg,https://m.media-amazon.com/images/I/815GV8ode1L._AC_SL1500_.jpg,,2026-04-21T11:31:23.037247,
12,2,Organic,,56.0,B0GMFQSBW2,"Summer Party Decorations, NO-DIY Beach Party Decorations Include 1 Pc Hello Summer Banner, 1Pc Blue Foil Fringe Curtain and 22 Pcs Hanging Decorations for Holiday Home Office Classroom",N/A,$9.99,,,,False,https://m.media-amazon.com/images/I/81RErBpZRPL._AC_UL320_.jpg,https://m.media-amazon.com/images/I/81RErBpZRPL._AC_SL1500_.jpg,,2026-04-21T11:31:23.041643,
13,2,Organic,,57.0,B0DS1SYB42,"Luau Party Decorations, 36PCS Hawaiian Themed Leis Necklace Costume Accessories, Colorful Hawaiian Leis Tropical Flower Clothing Bulk",N/A,$9.98,,4.5,242.0,False,https://m.media-amazon.com/images/I/8196+Nb-nrL._AC_UL320_.jpg,https://m.media-amazon.com/images/I/8196+Nb-nrL._AC_SL1500_.jpg,,2026-04-21T11:31:23.046664,
