data_index,page,ad_type,ad_rank,organic_rank,asin,title,url,price_current,price_list,rating_stars,rating_count,is_prime,image_small,image_large,brand_name,scraped_at,inner_products_count
20,5,Organic,,206.0,B0F38FYCC6,Yousoontic 3 Pcs Summer Table Block Signs Tropical Watermelon Flamingo Centerpiece Hello Summer Hawaiian Decorations for Tiered Tray Decor Home Office Kitchen Mantel Shelf Indoor (Tropical),N/A,$12.99,,3.9,17.0,False,https://m.media-amazon.com/images/I/81M90aTIftL._AC_UL320_.jpg,https://m.media-amazon.com/images/I/81M90aTIftL._AC_SL1500_.jpg,,2026-04-18T10:03:30.420925,
21,5,Organic,,207.0,B0DSLDL8NW,"nuvagiki 3 Pack Bee Hive Decor, Farmhouse Bumble Bee Decorations with Sunflower, Rustic Tiered Tray Tabletop Decor for Home Kitchen, Spring Summer Bee Theme",N/A,$25.99,,4.7,32.0,False,https://m.media-amazon.com/images/I/81rLEM1BSSL._AC_UL320_.jpg,https://m.media-amazon.com/images/I/81rLEM1BSSL._AC_SL1500_.jpg,,2026-04-18T10:03:30.424167,
22,5,Organic,,208.0,B0G82VM9N7,"xo, Fetti Hot Dog Banner | Cookout Party, BBQ Decor, Summer Party, July 4th, Kids Party, Funny",N/A,$11.99,,,,False,https://m.media-amazon.com/images/I/71d6ZJ7bQNL._AC_UL320_.jpg,https://m.media-amazon.com/images/I/71d6ZJ7bQNL._AC_SL1500_.jpg,,2026-04-18T10:03:30.427439,
23,5,Organic,,209.0,B0FBW381SQ,8pcs Beach Ball Theme Garlands Summer Beach Birthday Party Decorations Pool Beach Ball Cutout Hanging Garland Room Wall Decor for Pool Party Summer Theme Baby Shower Supplies,N/A,$11.99,,5.0,2.0,False,https://m.media-amazon.com/images/I/81MRIRnlO+L._AC_UL320_.jpg,https://m.media-amazon.com/images/I/81MRIRnlO+L._AC_SL1500_.jpg,,2026-04-18T10:03:30.430715,
24,5,Organic,,210.0,B0GCM3FPNM,"50 LED 25ft Summer Hawaiian Beach String Lights Outdoor with Remote, Flamingo Pineapple Palm Tree Fairy Twinkle Lights Battery Operated with 8 Modes & Timer for Tropical Party Beach Pool Decorations",N/A,$16.19,,4.4,334.0,False,https://m.media-amazon.com/images/I/71IaC6j30YL._AC_UL320_.jpg,https://m.media-amazon.com/images/I/71IaC6j30YL._AC_SL1500_.jpg,,2026-04-18T10:03:30.436040,
25,5,Organic,,211.0,B0CWRPX4RD,"AVOIN colorlife Summer Beach Flip-flop Garden Flag 12x18 Inch Double Sided, Welcome Seasonal Holiday Burlap Yard Outdoor Decoration",N/A,$8.99,,4.8,115.0,False,https://m.media-amazon.com/images/I/71bTwbLlICL._AC_UL320_.jpg,https://m.media-amazon.com/images/I/71bTwbLlICL._AC_SL1500_.jpg,,2026-04-18T10:03:30.447606,
26,5,Organic,,212.0,B0G64RZGGT,"Yousoontic Summer Beach Flip Flop Table Centerpiece Decor - 3D Wooden Slippers Sign with LED Lights, Hawaii Luau Tropical Decor for Home Mantel, Desk & Party",N/A,$16.99,,4.2,60.0,False,https://m.media-amazon.com/images/I/71xQJxcpjYL._AC_UL320_.jpg,https://m.media-amazon.com/images/I/71xQJxcpjYL._AC_SL1500_.jpg,,2026-04-18T10:03:30.452094,
27,5,Organic,,213.0,B0BYDMHXHG,"AVOIN colorlife Hello Sunshine Classic Garden Flag 12x18 Inch Double Sided Outside, Summer Party Holiday Burlap Yard Outdoor Decoration",N/A,$6.99,,4.8,285.0,False,https://m.media-amazon.com/images/I/71Lr5yGIRfL._AC_UL320_.jpg,https://m.media-amazon.com/images/I/71Lr5yGIRfL._AC_SL1500_.jpg,,2026-04-18T10:03:30.461985,
28,5,Organic,,214.0,B0DP21D9BL,"25pcs Hawaiian Leis Bulk,Colorful Lei Tropical Flower Necklace Hawaii Hula Dance Decor for Summer Beach Pool Luau Party Birthday Decoration Favors Supplies",N/A,$7.64,,4.2,377.0,False,https://m.media-amazon.com/images/I/812uJFjV7FL._AC_UL320_.jpg,https://m.media-amazon.com/images/I/812uJFjV7FL._AC_SL1500_.jpg,,2026-04-18T10:03:30.467160,
29,5,Organic,,215.0,B0DRBWLBJV,3 Pcs Spring Table Decorations Tulip Wooden Set Tabletop Farmhouse Spring Tiered Tray Decor Hello Spring Decorations for Home (Tulip),N/A,$15.99,,4.5,31.0,False,https://m.media-amazon.com/images/I/71-2XpsIZWL._AC_UL320_.jpg,https://m.media-amazon.com/images/I/71-2XpsIZWL._AC_SL1500_.jpg,,2026-04-18T10:03:30.473801,
30,5,Organic,,216.0,B07F3Y5BZG,60 Flags Imitated Burlap Pennant Banner - Multicolor Fabric Triangle Rainbow Flag Bunting for Party and Festival Classroom Hanging Decoration,N/A,$12.99,,4.8,1267.0,False,https://m.media-amazon.com/images/I/71l-GG3JsQL._AC_UL320_.jpg,https://m.media-amazon.com/images/I/71l-GG3JsQL._AC_SL1500_.jpg,,2026-04-18T10:03:30.478848,
31,5,Organic,,217.0,B0CWQLW4M3,Barydat 6 Pcs Sunflower Table Sign Summer Sunflower Wooden Table Centerpiece Gnome Wooden Welcome Sunshine Decor Summer Sign Party Ornament Farmhouse Rustic for Home Kitchen,N/A,$13.99,,4.5,21.0,False,https://m.media-amazon.com/images/I/81Mn7ZxyLBL._AC_UL320_.jpg,https://m.media-amazon.com/images/I/81Mn7ZxyLBL._AC_SL1500_.jpg,,2026-04-18T10:03:30.483109,
32,5,Organic,,218.0,B0CXCJGGRQ,3 Pcs Summer Tiered Tray Decorations Set Watermelon Wood Table Signs Tabletop Farmhouse Summer Table Decor Hello Summer Decorations for Party Office Home Bedroom Kitchen(Watermelon),N/A,$9.99,,4.4,52.0,False,https://m.media-amazon.com/images/I/71dtWTh8YsL._AC_UL320_.jpg,https://m.media-amazon.com/images/I/71dtWTh8YsL._AC_SL1500_.jpg,,2026-04-18T10:03:30.488179,
33,5,Organic,,219.0,B0CWNDG2J2,"ARKENY Yellow Lemon Eucalyptus Summer Kitchen Towels Dish Towels Set of 2,Black Bike Hello Summer Hand Towels 18x26 Inch Drying Dishcloth,Farmhouse Home Seasonal Holiday Summer Decorations AD333",N/A,$13.99,,4.6,36.0,False,https://m.media-amazon.com/images/I/611sadxcqgL._AC_UL320_.jpg,https://m.media-amazon.com/images/I/611sadxcqgL._AC_SL1500_.jpg,,2026-04-18T10:03:30.497319,
34,5,Organic,,220.0,B0CP7VDZKQ,Kigley 6 Pcs Retro Spring Tulips Wood Signs Rustic Farmhouse Tulip Table Centerpiece Multicolor Floral Block Tabletop Signs Spring Decoration for Home Mantel Table Tiered Tray Decor,N/A,$15.99,,4.1,25.0,False,https://m.media-amazon.com/images/I/71fsWujb7AL._AC_UL320_.jpg,https://m.media-amazon.com/images/I/71fsWujb7AL._AC_SL1500_.jpg,,2026-04-18T10:03:30.500535,
35,5,Organic,,221.0,B0F4X181BH,Renbuzhu 14Pcs Beach Party Decorations Paper Lanterns Fans Pom Poms Hanging Swirls - Luau Pool Summer Hawaiian Tropical Themed Decor for Home Birthday Outdoor Indoor,N/A,$15.99,,4.5,14.0,False,https://m.media-amazon.com/images/I/81ZOGm2OLrL._AC_UL320_.jpg,https://m.media-amazon.com/images/I/81ZOGm2OLrL._AC_SL1500_.jpg,,2026-04-18T10:03:30.503817,
36,5,Organic,,222.0,B0BTST4FFG,"Bee Tiered Tray Decor, Spring Summer Farmhouse Tiered Tray Decorations, Decorative Bumble Bee Gnome Hive Honey Truck Wooden Signs, Rustic Home Decor for Table Shelf Mantel Office Holiday Party",N/A,$16.99,,4.3,174.0,False,https://m.media-amazon.com/images/I/71kI6GHxL3L._AC_UL320_.jpg,https://m.media-amazon.com/images/I/71kI6GHxL3L._AC_SL1500_.jpg,,2026-04-18T10:03:30.506954,
37,5,Organic,,223.0,B0BZ4LPRFH,"AVOIN colorlife Sunflower Spring Summer Garden Flag 12x18 Inch Double Sided Outside, With God All Things Are Possible Floral Yard Outdoor Decoration",N/A,$6.99,,4.8,463.0,False,https://m.media-amazon.com/images/I/810ZIyCgwmL._AC_UL320_.jpg,https://m.media-amazon.com/images/I/810ZIyCgwmL._AC_SL1500_.jpg,,2026-04-18T10:03:30.512497,
38,5,Organic,,224.0,B0BVF49ZGB,GEEORY Kitchen Towels for Spring Summer Decor Yellow Daisy Dish Towels 18 x 26 Inch Ultra Absorbent Bar Drying Cloth Hello Sunshine Hand Towel for Kitchen Bathroom Party Home Decorations Set of 2,N/A,$13.99,,4.4,98.0,False,https://m.media-amazon.com/images/I/71cMo0-axhL._AC_UL320_.jpg,https://m.media-amazon.com/images/I/71cMo0-axhL._AC_SL1500_.jpg,,2026-04-18T10:03:30.521836,
39,5,Organic,,225.0,B0DVTBP3ZH,"xo, Fetti Pool Party Paper Plates, 3 Designs | 24 pcs 9"" | Kids Decorations, Summer Birthday Decor, Stripe Tablescape, Colorful Table Setting",N/A,$13.99,,4.6,8.0,False,https://m.media-amazon.com/images/I/61ZUcHaHT8L._AC_UL320_.jpg,https://m.media-amazon.com/images/I/61ZUcHaHT8L._AC_SL1500_.jpg,,2026-04-18T10:03:30.526432,
40,5,Organic,,226.0,B087LYK31B,"14 Pcs Tropical Party Decorations Set - Pre-Strung Flamingo Banner, Paper Fans, Lanterns & Palm Leaves - Hawaiian Themed Luau Party Decorations for Summer Beach, Pool & Birthday",N/A,$16.99,,4.6,595.0,False,https://m.media-amazon.com/images/I/81NHRmonFgL._AC_UL320_.jpg,https://m.media-amazon.com/images/I/81NHRmonFgL._AC_SL1500_.jpg,,2026-04-18T10:03:30.530873,
41,5,Organic,,227.0,B0C39SQD1L,Karenhi Sunflower Hello Summer Sign Welcome Summer Decorations Wood Flower Sign Sunflower Inspirational Door Hanger Outdoor Wooden Front Door Decor for Home Farmhouse Porch Kitchen,N/A,$9.99,,4.7,32.0,False,https://m.media-amazon.com/images/I/81G9hDzi2eL._AC_UL320_.jpg,https://m.media-amazon.com/images/I/81G9hDzi2eL._AC_SL1500_.jpg,,2026-04-18T10:03:30.536469,
42,5,Organic,,228.0,B0FGNQL3KS,Lemon Truck Decor Vintage Metal Truck Tiered Tray Decor Lemon Party Decorations Summer Farmhouse Yellow Car with Mini Fake Lemons for Home Kitchen Tabletop Centerpiece Supplies,N/A,$11.99,,4.6,194.0,False,https://m.media-amazon.com/images/I/61oPDvUMFoL._AC_UL320_.jpg,https://m.media-amazon.com/images/I/61oPDvUMFoL._AC_SL1500_.jpg,,2026-04-18T10:03:30.542765,
43,5,Organic,,229.0,B0DK6Z1HH1,"3 Pcs Sunflower Decor For Tables, Farmhouse Sunflower Standing Wooden Table Sign, Spring Summer Decor For Home Office Tables Kitchen Farmhouse, Ideal Gift For Friend Family Teacher",N/A,$9.99,,4.5,30.0,False,https://m.media-amazon.com/images/I/71zKr7vImYL._AC_UL320_.jpg,https://m.media-amazon.com/images/I/71zKr7vImYL._AC_SL1500_.jpg,,2026-04-18T10:03:30.547947,
44,5,Organic,,230.0,B0BTDHRYT8,"36 Count Hawaiian Lei Bulk, Tropical Luau Hawaii Theme Silk Flower Lei, Party Favors for Beach Holiday Wedding Birthday Party, Aloha Summer Party Decorations",N/A,$9.98,,4.4,1265.0,False,https://m.media-amazon.com/images/I/91dq-UYMKiL._AC_UL320_.jpg,https://m.media-amazon.com/images/I/91dq-UYMKiL._AC_SL1500_.jpg,,2026-04-18T10:03:30.552174,
45,5,Organic,,231.0,B0DWWXXB2F,3 Pcs Hello Summer Door Sign 12 Inch Summer Wooden Welcome Sign Front Door Decoration Flamingo Swimming Pool Ice Cream Hanging Hanger for Home Porch Holiday Decor,N/A,$15.99,,4.7,141.0,False,https://m.media-amazon.com/images/I/81-7Bp5yrJL._AC_UL320_.jpg,https://m.media-amazon.com/images/I/81-7Bp5yrJL._AC_SL1500_.jpg,,2026-04-18T10:03:30.556266,
46,5,Organic,,232.0,B09V2723WS,Sunflower Door Sign Summer Welcome Wreaths For Front Door Decoration 12 Inch Wood Hanging Farmhouse Porch Wall Decor Indoor Outdoor,N/A,$11.99,,4.6,315.0,False,https://m.media-amazon.com/images/I/81joL50cNML._AC_UL320_.jpg,https://m.media-amazon.com/images/I/81joL50cNML._AC_SL1500_.jpg,,2026-04-18T10:03:30.560704,
47,5,Organic,,233.0,B0BYDNVSK1,"AVOIN colorlife Summer Polka Dot Bee Welcome Garden Flag 12x18 Inch Double Sided Outside, Seasonal Holiday Burlap Yard Outdoor Decoration",N/A,$6.99,,4.8,384.0,False,https://m.media-amazon.com/images/I/71UheEzIY7L._AC_UL320_.jpg,https://m.media-amazon.com/images/I/71UheEzIY7L._AC_SL1500_.jpg,,2026-04-18T10:03:30.566319,
48,5,Organic,,234.0,B0DXFNDN63,"xo, Fetti Pool Party Napkins - 3-ply, 24 pcs | Summer Cocktail Napkins, Colorful Party Setting, Kids Birthday Decoration, Fun Tablescape",N/A,$12.99,,5.0,6.0,False,https://m.media-amazon.com/images/I/61UHEDYOG8L._AC_UL320_.jpg,https://m.media-amazon.com/images/I/61UHEDYOG8L._AC_SL1500_.jpg,,2026-04-18T10:03:30.569774,
49,5,Organic,,235.0,B0BVTJSLP6,GEEORY Summer Pillow Covers 18x18 Inch Set of 4 Popsicle Ice Cream Pillows Decorative Throw Pillows with Says Fun in The Sun Summer Decorations Farmhouse Decor Cushion Case for Sofa Couch G283-18,N/A,$13.99,,4.9,108.0,False,https://m.media-amazon.com/images/I/71DlrGkdLQL._AC_UL320_.jpg,https://m.media-amazon.com/images/I/71DlrGkdLQL._AC_SL1500_.jpg,,2026-04-18T10:03:30.578148,
50,5,Organic,,236.0,B09P59BSK5,Eersida 42 Pieces Spring Sun Flowers Hanging Swirl Decorations Spring Summer Sunflower Baby Shower Decor Ceiling Hanging Decor for Birthday Party Baby Shower Wedding Supplies,N/A,$11.69,,4.5,66.0,False,https://m.media-amazon.com/images/I/716geAI4stL._AC_UL320_.jpg,https://m.media-amazon.com/images/I/716geAI4stL._AC_SL1500_.jpg,,2026-04-18T10:03:30.581058,
51,5,Organic,,237.0,B0FMWD7QSL,"Inflatable Pink Flamingo Party Decorations - (3 Pack) 28"" Large Blow-Up Flamingos, Realistic Animal Design, Summer Hawaiian Luau, BBQ, Birthday Party Decor, Pool Float Toys Indoor & Outdoor",N/A,$9.99,,4.4,24.0,False,https://m.media-amazon.com/images/I/71nQEPbwQ2L._AC_UL320_.jpg,https://m.media-amazon.com/images/I/71nQEPbwQ2L._AC_SL1500_.jpg,,2026-04-18T10:03:30.585158,
52,5,Organic,,238.0,B0B81CCC34,Karenhi Lemon Welcome Wooden Sign for Front Door Lemon Wooden Hanger Summer Door Sign Wood Spring Hanging Decorations Farmhouse Porch Decor for Outdoor Housewarming Gift,N/A,$11.99,,4.2,262.0,False,https://m.media-amazon.com/images/I/71YGk9XpA2L._AC_UL320_.jpg,https://m.media-amazon.com/images/I/71YGk9XpA2L._AC_SL1500_.jpg,,2026-04-18T10:03:30.588472,
53,5,Organic,,239.0,B0BYDQFRGM,"AVOIN colorlife Summer Bee Happy Garden Flag 12x18 Inch Double Sided Outside, Sunflower Party Holiday Burlap Yard Outdoor Decoration",N/A,$6.99,,4.8,329.0,False,https://m.media-amazon.com/images/I/71S2yVm-kNL._AC_UL320_.jpg,https://m.media-amazon.com/images/I/71S2yVm-kNL._AC_SL1500_.jpg,,2026-04-18T10:03:30.593845,
54,5,Organic,,240.0,B0GKFK9F5M,"Putuo Decor Summer Slippers Hanging Sign, Summer Door Sign, Hello Summer Wooden Sign Hanging Plaque Rustic Wall Sign Yard Indoor Outdoor Garden Decoration with Rope",N/A,$9.99,,,,False,https://m.media-amazon.com/images/I/71tsgqkKK3L._AC_UL320_.jpg,https://m.media-amazon.com/images/I/71tsgqkKK3L._AC_SL1500_.jpg,,2026-04-18T10:03:30.596859,
56,5,Title,,,,"Debug info copied.Sponsored12 Pcs Tulip Honeycomb Decorations, Spring Decorations for Office, Table ",,,,,,False,,,,2026-04-18T10:03:30.597632,
57,5,Title,,,,Related searchessummer party decorationssummer decorations for officesummer decorations for homesumm,,,,,,False,,,,2026-04-18T10:03:30.598458,
58,5,Title,,,,Previous1...4567Next,,,,,,False,,,,2026-04-18T10:03:30.598826,
59,5,SB,8.0,,,N/A,https://aax-us-east-retail-direct.amazon.com/x/c/JJpg_vOqpTXG0z0IqaS6nLgAAAGdoAuV9QEAAAH2AQBvbm9fdHhuX2JpZDUgICBvbm9fdHhuX2ltcDIgICCPqG0E/clv1c_ek-wxPHXFbbWDfHXL5sAvQuvcRxOLvvnKHNBfp1a39rlgiXiJGvYXwU7YwHhHBsWJQjlkFPP92oo8fihiFNYWFmAccJ7yCGdJjl1ymrzGMy2uj_Dwhvyh2Xp-NnU5fPLihZeiK9uc6qQZlV9EhAh7ZPLoduTkoVq9IwQrzcjwr5rCcurWCeP74nAyVJg5JN1pvFJwvnrnoTJ0ML2hRgQ_3jSi998QdvXXY0LGtmqGAysj3Y-4ZeSdB7NHcZwcdrXF43ZS50Z6Pfj5VvrTytUse2L1ycDnUfPi2DHUJhyVnJNNbs8PXktSE74KskNC1mncUFFRIDqPpM1n3bMhRcQ5cjLfBtqhrlQRQCKBqrafMW22qWirWxdpLGCEHRqVtROPzsQ5f5bTpGv3IkhoLWPO6UzSzsqioY5uDGFs_6ANocyddnfwjCjVDkmzVOkcaNSbaYV1QH4Ui-1bviZ7WC0olCxhlXs8pJX3EXo18kgFt4u4xTFzHES1rlk1_44v3_kbdPSMdUDpV6U4Lt3ZtVOxPN40_69HsxqWa8jnjCoYBjmBzwKCTMSJakXZGoSY0awH7Q-arzC6VNCLrbS7gfxQSVNzsrJagGRMN_x_jwc9hqC1i49fX9cCQkERcwCGZ6V7bD1amEiRABW0Nj82WjH03fIImJBMVG-GMUZMYgpDapCOSijdujOlVsgVHD4UhoA33nCbyEOaCptsQzXrDzP0z6jz9seyJkZbb1v5sD3orQYDlZu3IegT4kF67xE4_5jsjqKaznnCN6phhrHU_eoII4Cl_xeU1r6ksnOcf0uDkYGoGuH9ulOl0JjBscbsw4cAc5xYU6GALi3ejtZDhBKDy9DzOZOzVUW6K8-UpR8ej5NMPmfx3o1ad1jkDgf7gNnIfZwDxN2raWQYtyNoHk4Jcg7hDyk-LIMCad4AvFCmd2Umq95Vr3GYiTDdW2Q7R9LYVnZimEexXbgjV7OxTc27Up_yNh4rJ1zya0g5lbD3bmdVlRqrWlg8lqwoSTnKGoQcD1mgKX6NARRAWmhLA4e18yExHhT9lCMicvDG9tCGJ9CfZr1F3B1WR4do5DR5jRusins-83hXTP2b_wW-gAz3Ou9DxgC3Vdh23efp6YEYUlZvgsgFUVuFt6ibxaKK9O0qi4TW0ZT5af3sKd2vhphSthNezhw64f9hgmLnph8RGSVISbFMSDiQgpdm0inEb3LiJ52zTesFkw1UXy8Rp8uoqrJu1idi-5MEtOGB9E8XPzo_ZXQJY9e2deBXEmRUlvGxMxuh_iNKGaeeqtMJpDNlFuQkcr9WCiACfj3OqtqnQ_pP2llpLU_Ju03YNbnomq0jv0c2t4TrlXXMHaXkKuhi6NGBy5sorgL0dqDyoDjd3ApSAg-H5O5Q9mvWJ269poZf_wkR4z1q3JYnoru8Q5JapuPYteo0V5DqNesDVqNLr2tzo4InAM1SrW0QjS1v0JEWYqRquxx7-QpBlcjmZ5hvTnOs9Kzod_XhlPlXdUnt8nB6y8O00L9j_xqlGKfP_yWeQjqT5bb_2r7LqjK79uF4Srjnxmz3bl4LWe0IwDI9EWRa_HeazkQQji-uG5Uo4dq_2IfOljsbLVoMdo8PL9C4jGHOnXagSyBhx2t1GvfsrGo1VEvoQ9a7JynzPugwXDj5o8gWjb9lyqU5qpL8RyO_uK-xZuEKvpHqW-PWy3m3g/https://www.amazon.com/stores/page/A77B4514-D850-44CD-8791-8BC9DB196E34/?_encoding=UTF8&store_ref=SB_A04069161GHA6AWPS10EB-A04224281RWNFCXSIWN0&pd_rd_plhdr=t&aaxitk=959480831cac39e8a775cbb632a0d632&hsa_cr_id=0&lp_asins=B0G1B93MR4%2CB0D6FYS4SC%2CB0G1B7BB5P&lp_query=summer%20decorations&lp_slot=desktop-hsa-3psl&ref_=sbx_be_s_3psl_mbd_mb0_bkgd&pd_rd_w=zR3eR&content-id=amzn1.sym.cd7c548b-a599-426f-9ffe-daa1aa803c87%3Aamzn1.sym.cd7c548b-a599-426f-9ffe-daa1aa803c87&pf_rd_p=cd7c548b-a599-426f-9ffe-daa1aa803c87&pf_rd_r=DQMA8ER3AR8NJB9VV9X4&pd_rd_wg=xCAxg&pd_rd_r=03f744ca-2adc-465b-827a-db4e45796573,,,,,False,,,N/A,2026-04-18T10:03:30.602961,
60,5,Title,,,,Need help?Visit the help sectionorcontact us,,,,,,False,,,,2026-04-18T10:03:30.603448,
0,6,SB_Video,3.0,,,N/A,N/A,,,,,False,,,,2026-04-18T10:03:44.357784,1.0
1,6,Title,,,,ResultsCheck each product page for other buying options. Price and other details may vary based on p,,,,,,False,,,,2026-04-18T10:03:44.359604,
3,6,Organic,,241.0,B0GKFK9F5M,"Putuo Decor Summer Slippers Hanging Sign, Summer Door Sign, Hello Summer Wooden Sign Hanging Plaque Rustic Wall Sign Yard Indoor Outdoor Garden Decoration with Rope",N/A,$9.99,,,,False,https://m.media-amazon.com/images/I/71tsgqkKK3L._AC_UL320_.jpg,https://m.media-amazon.com/images/I/71tsgqkKK3L._AC_SL1500_.jpg,,2026-04-18T10:03:44.365797,
4,6,Organic,,242.0,B0DPMTTWL9,Hushee 20 Pcs Spring Flower Tiered Tray Decor Set Rustic Farmhouse Daisy Floral Wooden Sign Table Decorations for Spring Home Kitchen Shelf Tabletop Centerpiece,N/A,$14.99,,4.3,35.0,False,https://m.media-amazon.com/images/I/81ywU3cjfaL._AC_UL320_.jpg,https://m.media-amazon.com/images/I/81ywU3cjfaL._AC_SL1500_.jpg,,2026-04-18T10:03:44.369347,
5,6,Organic,,243.0,B0BYDQFRGM,"AVOIN colorlife Summer Bee Happy Garden Flag 12x18 Inch Double Sided Outside, Sunflower Party Holiday Burlap Yard Outdoor Decoration",N/A,$6.99,,4.8,329.0,False,https://m.media-amazon.com/images/I/71S2yVm-kNL._AC_UL320_.jpg,https://m.media-amazon.com/images/I/71S2yVm-kNL._AC_SL1500_.jpg,,2026-04-18T10:03:44.375580,
6,6,Title,,,,Sunflower Spring Theme Party Home Decor SaleSponsored|Highly bought brand in decorative folding fans,,,,,,False,,,,2026-04-18T10:03:44.377709,
7,6,Title,,,,More results,,,,,,False,,,,2026-04-18T10:03:44.377999,
8,6,Organic,,244.0,B0D3LFT9Y4,"Bee Wooden Wreaths Front Door Welcome Signs with Bow Ribbon, Bee Decoration Wood Door Wall Signs Door Hanger Crafts for Spring Home Farmhouse Party Porch Wall Decor",N/A,$9.99,,4.2,101.0,False,https://m.media-amazon.com/images/I/71cz0rsUZWL._AC_UL320_.jpg,https://m.media-amazon.com/images/I/71cz0rsUZWL._AC_SL1500_.jpg,,2026-04-18T10:03:44.381855,
9,6,Organic,,245.0,B0CSF8B2BC,"Artoid Mode Blue Lemon Iris Summer Table Runner, Seasonal Spring Kitchen Dining Table Decor for Home Party Decor 13x72 Inch",N/A,$9.99,,4.5,174.0,False,https://m.media-amazon.com/images/I/81ToNZYNyoL._AC_UL320_.jpg,https://m.media-amazon.com/images/I/81ToNZYNyoL._AC_SL1500_.jpg,,2026-04-18T10:03:44.389028,
10,6,Organic,,246.0,B0GC34JZD5,"Artoid Mode Holiday Pool Swim Ring Waterproof 210 GSM Summer Table Runner, Seasonal Kitchen Dining Table Decoration for Home Party Decor 13x72 Inch",N/A,$8.99,,,,False,https://m.media-amazon.com/images/I/819J3Y6pdQL._AC_UL320_.jpg,https://m.media-amazon.com/images/I/819J3Y6pdQL._AC_SL1500_.jpg,,2026-04-18T10:03:44.391918,
11,6,Organic,,247.0,B0CQPY8LR8,"AVOIN colorlife Hello Summer Floral Cat Garden Flag 12x18 Inch Double Sided Outside, Party Holiday Burlap Yard Outdoor Decoration",N/A,$8.99,,4.7,218.0,False,https://m.media-amazon.com/images/I/71kLazk75mL._AC_UL320_.jpg,https://m.media-amazon.com/images/I/71kLazk75mL._AC_SL1500_.jpg,,2026-04-18T10:03:44.397868,
12,6,Organic,,248.0,B0CWGFFZ5W,"Artoid Mode America Stars Tree Patriotic 4th of July Kitchen Towels Dish Towels, 18x26 Inch Farmhouse Memorial Day Decoration Hand Towels Set of 4",N/A,$17.99,,4.5,77.0,False,https://m.media-amazon.com/images/I/71SRK4USkyL._AC_UL320_.jpg,https://m.media-amazon.com/images/I/71SRK4USkyL._AC_SL1500_.jpg,,2026-04-18T10:03:44.404244,
13,6,Organic,,249.0,B0DSW2D9W2,"Artoid Mode Popsicles Summer Placemats Set of 4, 12x18 Inch Seasonal Spring Holiday Table Mats for Party Kitchen Dining Decoration",N/A,$9.99,,3.9,10.0,False,https://m.media-amazon.com/images/I/71oxyNd9a1L._AC_UL320_.jpg,https://m.media-amazon.com/images/I/71oxyNd9a1L._AC_SL1500_.jpg,,2026-04-18T10:03:44.411246,
14,6,Title,,,,BonBloom's Artificial Sunflower Garland DecorShopBonBloom'sPrevious pageBonBloom's 4 Pack Artificial,,,,,,False,,,,2026-04-18T10:03:44.412836,
15,6,Title,,,,More results,,,,,,False,,,,2026-04-18T10:03:44.412979,
16,6,Organic,,250.0,B0CYGPYQ3V,Yousoontic 5 Pcs Summer Wooden Tabletop Decor Freestanding Wood Table Sign Summer Decorations for Home Rustic Tabletop Centerpiece Standing Block Decorations for Farmhouse Office (Beach),N/A,$14.99,,4.1,120.0,False,https://m.media-amazon.com/images/I/71j7tGSGANL._AC_UL320_.jpg,https://m.media-amazon.com/images/I/71j7tGSGANL._AC_SL1500_.jpg,,2026-04-18T10:03:44.416203,
17,6,Organic,,251.0,B0DSDWVPHN,"Artoid Mode Ice Cream Watermelon Happy Summer Table Runner, Seasonal Holiday Kitchen Dining Table Decoration for Home Party Indoor 13x72 Inch",N/A,$9.99,,4.2,17.0,False,https://m.media-amazon.com/images/I/81CYS6i1o4L._AC_UL320_.jpg,https://m.media-amazon.com/images/I/81CYS6i1o4L._AC_SL1500_.jpg,,2026-04-18T10:03:44.422106,
18,6,Organic,,252.0,B0CP64YWPL,"Hananona 12 Pcs Artificial Flowers Outdoor, Faux Artificial Plants UV Resistant Plastic Flower Bulk for Hanging Planter Porch Window Home Wedding Fall Summer Decor (12, Fuchsia, Purple, Yellow, Green)",N/A,$16.99,,4.3,2457.0,False,https://m.media-amazon.com/images/I/91DchnpL2dL._AC_UL320_.jpg,https://m.media-amazon.com/images/I/91DchnpL2dL._AC_SL1500_.jpg,,2026-04-18T10:03:44.426155,
19,6,Organic,,253.0,B0C294C85N,"Rustic Be the Sunshine Wood Hanging Sign, Farmhouse Summer Sunshine Artwork Decor, Sunflowers Wooden Plaque Sign Wall Art Decor Signs Summer Home Office Decoration 8x10 Inches",N/A,$9.98,,4.5,239.0,False,https://m.media-amazon.com/images/I/61GRi1LFEML._AC_UL320_.jpg,https://m.media-amazon.com/images/I/61GRi1LFEML._AC_SL1500_.jpg,,2026-04-18T10:03:44.430474,
20,6,Organic,,254.0,B0CXDWKLR7,Yousoontic 3 Pcs Summer Beach Ball Table Decor Wooden Beachy Coastal Standing Tabletop Decor Rustic Coastal Table Sign Beach Centerpiece for Home Farmhouse Office Decorations,N/A,$9.99,,3.7,12.0,False,https://m.media-amazon.com/images/I/61rIwj6pi1L._AC_UL320_.jpg,https://m.media-amazon.com/images/I/61rIwj6pi1L._AC_SL1500_.jpg,,2026-04-18T10:03:44.434076,
21,6,Organic,,255.0,B09WMJVL1Q,"PETCEE Hello Summer Door Sign - 11.5""Farmhouse Sunflower Front Door Decor Welcome Hanger Wreaths for Home Office Summer Hanging Sign Wall Decorations Reusable Seasonal Sign for Kitchen Classroom Porch",N/A,$9.99,,4.4,354.0,False,https://m.media-amazon.com/images/I/81SPIq51Q4L._AC_UL320_.jpg,https://m.media-amazon.com/images/I/81SPIq51Q4L._AC_SL1500_.jpg,,2026-04-18T10:03:44.438233,
22,6,Organic,,256.0,B0DSZNSVZK,"2Pcs Summer Beach Home Gnome Room Decorations, Women's Gifts Handmade Blue Ocean Kitchen Summer Layered Tray Decorations Beach Gnomes Plush,Birthday Gnome Gift",N/A,$15.99,,4.6,25.0,False,https://m.media-amazon.com/images/I/81ZdxU-j7SL._AC_UL320_.jpg,https://m.media-amazon.com/images/I/81ZdxU-j7SL._AC_SL1500_.jpg,,2026-04-18T10:03:44.441704,
23,6,Organic,,257.0,B09Z6LFF2B,Amyhill 27 Pcs Spring Sunflower Wooden Tree Ornament Set Hanging Butterfly Tree Decoration with Rope Pendant Hanging Tag Wood Cutout Decoration for Home Birthday Party Supplies,N/A,$13.99,,4.6,215.0,False,https://m.media-amazon.com/images/I/81xbBLiygBL._AC_UL320_.jpg,https://m.media-amazon.com/images/I/81xbBLiygBL._AC_SL1500_.jpg,,2026-04-18T10:03:44.444966,
24,6,Organic,,258.0,B0DYPD944D,Goodbye School Hello Summer Backdrop 72 x 44 Inch Large End of School Year Background Banner for Hawaiian Pool Beach Party Decorations,N/A,$7.99,,4.6,27.0,False,https://m.media-amazon.com/images/I/81Q26SiAHfL._AC_UL320_.jpg,https://m.media-amazon.com/images/I/81Q26SiAHfL._AC_SL1500_.jpg,,2026-04-18T10:03:44.448655,
25,6,Organic,,259.0,B0GK86ZB36,Amyhill Spring Summer Table Decor You Are My Sunshine Wooden Block Sign Summer Tabletop Decorations Farmhouse Tiered Tray Decor Rustic Table Centerpieces for Home Desk Shelf Mantle Office Decorations,N/A,$14.97,,4.9,13.0,False,https://m.media-amazon.com/images/I/71Lh7IUkBcL._AC_UL320_.jpg,https://m.media-amazon.com/images/I/71Lh7IUkBcL._AC_SL1500_.jpg,,2026-04-18T10:03:44.452170,
26,6,Organic,,260.0,B0DMFC4RVY,"LUEUR Artificial Silk Sunflower with Vase Fake Flowers in Vase Centerpiece Coffee Table Decor, Fake Plant Blue Daisy Flower Arrangement for Spring & Summer Decorations Indoor Home Office Living Room",N/A,$22.99,,4.3,115.0,False,https://m.media-amazon.com/images/I/81+KxYjGRPL._AC_UL320_.jpg,https://m.media-amazon.com/images/I/81+KxYjGRPL._AC_SL1500_.jpg,,2026-04-18T10:03:44.455587,
27,6,Organic,,261.0,B0DXDPRM7Z,11pcs Summer Pool Party Honeycomb Centerpieces Hello Summer Party Centerpieces for Table Pink Summer Theme Party Decorations for Girls Birthday Party Baby Shower Supplies,N/A,$11.99,,4.8,11.0,False,https://m.media-amazon.com/images/I/815-TmnZCgL._AC_UL320_.jpg,https://m.media-amazon.com/images/I/815-TmnZCgL._AC_SL1500_.jpg,,2026-04-18T10:03:44.460722,
28,6,Organic,,262.0,B0D3WKT79G,Peryiter 3 Pcs Summer Colorful Flip Flop Banner 8.2 ft Summer Garland Pom Pom Garland Tropical Flip Flop Banner Felt Slipper Garland for Hawaiian Beach Pool Party Classroom Decorations Supplies,N/A,$13.99,,3.1,4.0,False,https://m.media-amazon.com/images/I/71vD7Ijf3uL._AC_UL320_.jpg,https://m.media-amazon.com/images/I/71vD7Ijf3uL._AC_SL1500_.jpg,,2026-04-18T10:03:44.464183,
29,6,Organic,,263.0,B0GCHP67Z2,"Smile Summer Welcome Wooden Decorations, Hello Summer Sunshine, Farmhouse Hanging Door Decor for Holiday Home Accent",N/A,$8.99,,4.7,28.0,False,https://m.media-amazon.com/images/I/61BeUx0+5EL._AC_UL320_.jpg,https://m.media-amazon.com/images/I/61BeUx0+5EL._AC_SL1500_.jpg,,2026-04-18T10:03:44.467742,
