data_index,page,ad_type,ad_rank,organic_rank,asin,title,url,price_current,price_list,rating_stars,rating_count,is_prime,image_small,image_large,brand_name,scraped_at,inner_products_count
0,1,SB_Video,1.0,,,N/A,N/A,,,,,False,,,,2026-04-18T10:02:16.583985,1.0
1,1,Title,,,,ResultsCheck each product page for other buying options. Price and other details may vary based on p,,,,,,False,,,,2026-04-18T10:02:16.584913,
3,1,Organic,,1.0,B0CQV2P4FX,"12Pcs Summer Party Decorations Honeycomb Centerpiece, Hello Summer Party Decorations Centerpiece,3D Beach Summer Decorations Honeycomb Centerpiece for Summer Party Beach Party Decorations",N/A,$9.99,,4.8,46.0,False,https://m.media-amazon.com/images/I/81OM2qVPj1L._AC_UL320_.jpg,https://m.media-amazon.com/images/I/81OM2qVPj1L._AC_SL1500_.jpg,,2026-04-18T10:02:16.589997,
4,1,Organic,,2.0,B0DYSKPF35,Summer Party Decorations - 61 Pcs Beach Pool Party Decorations Hello Summer Banner Pool Beach Hanging Streams Decor for Home Office School Classroom,N/A,$7.99,,4.7,101.0,False,https://m.media-amazon.com/images/I/81Zdymfw6zL._AC_UL320_.jpg,https://m.media-amazon.com/images/I/81Zdymfw6zL._AC_SL1500_.jpg,,2026-04-18T10:02:16.594256,
5,1,Organic,,3.0,B0G8GLCCXD,AIBIIN Last Day of School Decorations Hello Summer Backdrop Schools Out for Summer End of School Year Decorations Last Day of School Banner Hawaiian Beach Photo Studio Props Backdrop 70.8 x 43.3 inch,N/A,$7.99,,,,False,https://m.media-amazon.com/images/I/71O+1M3-CUL._AC_UL320_.jpg,https://m.media-amazon.com/images/I/71O+1M3-CUL._AC_SL1500_.jpg,,2026-04-18T10:02:16.597682,
7,1,Title,,,,Recently bought and ratedSponsored| 4+ stars and rising in past 90 days‎Renbuzhu 15PCS Pool Party De,,,,,,False,,,,2026-04-18T10:02:16.601099,
9,1,Title,,,,Debug info copied.SponsoredINQCMY Artificial Fake Hanging Plants Flowers Basket for Spring Summer Ou,,,,,,False,,,,2026-04-18T10:02:16.601575,
10,1,Title,,,,Sunflower Hanging Paper FanSponsored|Highly bought brand in decorative folding fans|Shop Paper JazzS,,,,,,False,,,,2026-04-18T10:02:16.602836,
11,1,Title,,,,More results,,,,,,False,,,,2026-04-18T10:02:16.603034,
12,1,Organic,,4.0,B0CR6SG9NZ,Arrowom 24pcs Hawaiian Leis Bulk Luau Party Silk Flower Necklace Colorful Tropical Hawaiian Bulk Hula Dance Party Decor Flower Leis Summer Beach Pool Party Decorations Favors Supplies,N/A,$9.49,,4.5,2698.0,False,https://m.media-amazon.com/images/I/91Dw3St+MFL._AC_UL320_.jpg,https://m.media-amazon.com/images/I/91Dw3St+MFL._AC_SL1500_.jpg,,2026-04-18T10:02:16.607413,
13,1,Organic,,5.0,B0DP2FLFKM,‎Renbuzhu 15PCS Pool Party Decorations Beach Ball Paper Lanterns - Summer Luau Hawaiian Themed Hanging Decor for Home Birthday Outdoor Indoor,N/A,$16.99,,4.5,126.0,False,https://m.media-amazon.com/images/I/81SAWFpzVML._AC_UL320_.jpg,https://m.media-amazon.com/images/I/81SAWFpzVML._AC_SL1500_.jpg,,2026-04-18T10:02:16.611770,
14,1,Organic,,6.0,B01F6LRW30,"Joyin Toy 36 Counts Hawaiian Leis Bulk, Tropical Flower Lei Hawaiian Lei Beach Hawaii Luau Party Favors Decoration Birthday Party Supplies(3 Dozen)",N/A,$9.99,,4.6,10885.0,False,https://m.media-amazon.com/images/I/911aTPl1DwL._AC_UL320_.jpg,https://m.media-amazon.com/images/I/911aTPl1DwL._AC_SL1500_.jpg,,2026-04-18T10:02:16.615769,
15,1,Organic,,7.0,B0GF85NDK3,Avezano Hello Summer Banner Hawaiian Beach Door Banner Summer Door Decor Tropical Hawaiian Party Decorations Indoor Outdoor,N/A,$11.99,,,,False,https://m.media-amazon.com/images/I/811flZr9crL._AC_UL320_.jpg,https://m.media-amazon.com/images/I/811flZr9crL._AC_SL1500_.jpg,,2026-04-18T10:02:16.618941,
16,1,Organic,,8.0,B0C6X65BLF,"MISS FANTASY Summer Party Banners, Multi Color Rectangular Paper Summer Banner Decorations for Pool, Beach, Luau, Tropical Parties",N/A,$6.99,,4.7,55.0,False,https://m.media-amazon.com/images/I/416LHGiY4NL._AC_UL320_.jpg,https://m.media-amazon.com/images/I/416LHGiY4NL._AC_SL1500_.jpg,,2026-04-18T10:02:16.623010,
17,1,Organic,,9.0,B09QM5XX82,"Uieke 3 Pack Artificial Sunflower Garland, 7.5ft/Strand Silk Sunflowers Hanging Vines Flowers with Green Leaves for Room Kitchen Garden Birthday Wedding Baby Shower Party Table Decor Large",N/A,$14.99,,4.4,1390.0,False,https://m.media-amazon.com/images/I/81qgOQNv7KL._AC_UL320_.jpg,https://m.media-amazon.com/images/I/81qgOQNv7KL._AC_SL1500_.jpg,,2026-04-18T10:02:16.630980,
18,1,Organic,,10.0,B09WJB4JG1,Summer Pool Beach Hanging Swirls Banner Decor 30 Pack Foil Ceiling Hanging Swirls Streams Banner Decorations Garland for Kids Luau Hawaii Celebrating Events Birthday Party Supplies Room Wall Decor,N/A,$9.99,,4.6,287.0,False,https://m.media-amazon.com/images/I/81pvLwg9GEL._AC_UL320_.jpg,https://m.media-amazon.com/images/I/81pvLwg9GEL._AC_SL1500_.jpg,,2026-04-18T10:02:16.635280,
19,1,Organic,,11.0,B0B4VLGT76,Jetec Summer Slippers Hanging Sign Shape Welcome Hello Flip Flop Wooden Door Sign Hanging Plaque Rustic Wall Sign Yard Indoor Outdoor Garden Decoration with Rope (Hello Summer),N/A,$8.99,,4.4,1165.0,False,https://m.media-amazon.com/images/I/71O52MbRKJL._AC_UL320_.jpg,https://m.media-amazon.com/images/I/71O52MbRKJL._AC_SL1500_.jpg,,2026-04-18T10:02:16.638665,
20,1,Organic,,12.0,B0CTLVD83Z,Barydat 6 Pcs Summer Wooden Table Decor Hello Summer Wood Signs Sunshine Table Centerpieces Beach Table Decor Farmhouse Tiered Tray for Home Kitchen,N/A,$14.99,,4.4,33.0,False,https://m.media-amazon.com/images/I/81WXwapPt5L._AC_UL320_.jpg,https://m.media-amazon.com/images/I/81WXwapPt5L._AC_SL1500_.jpg,,2026-04-18T10:02:16.642184,
21,1,Organic,,13.0,B09XL2QSQ9,48Pcs Hello Summer Cut-Outs Summer Flower Cut Outs with 90Pcs Glue Points Colorful Paper Patterned Cut-Outs Bulletin Board Decoration for School Classroom Game Party Supplies,N/A,$7.99,,4.6,140.0,False,https://m.media-amazon.com/images/I/817ZbamDpRL._AC_UL320_.jpg,https://m.media-amazon.com/images/I/817ZbamDpRL._AC_SL1500_.jpg,,2026-04-18T10:02:16.646046,
22,1,Organic,,14.0,B0831D4S1D,R HORSE Inflatable Palm Tree Flamingo Banana Beach Ball Parrot Beach Pool Toys for Tropical Hawaiian Luau Party Summer Pool Beach Party Decorations,N/A,$22.99,,4.2,945.0,False,https://m.media-amazon.com/images/I/81UNKcb+coL._AC_UL320_.jpg,https://m.media-amazon.com/images/I/81UNKcb+coL._AC_SL1500_.jpg,,2026-04-18T10:02:16.650222,
23,1,Title,,,,More results,,,,,,False,,,,2026-04-18T10:02:16.650910,
24,1,Organic,,15.0,B0D2H5QKGS,"4th of July Decorations Wooden Table Sign Summer Decorations, Patriotic Independence Day Memorial Day Decorations Reversible Double-sided Different Theme Farmhouse Tabletop Centerpiece Decor",N/A,$11.99,,4.7,288.0,False,https://m.media-amazon.com/images/I/71YsUJ+z1lL._AC_UL320_.jpg,https://m.media-amazon.com/images/I/71YsUJ+z1lL._AC_SL1500_.jpg,,2026-04-18T10:02:16.654306,
25,1,Organic,,16.0,B09X1FZHC9,Chunful 30 Pieces Summer Tree Ornaments Christmas in July Wood Hanging Decoration Beach Wooden Slices Winter Tree Ornaments with String for Luau Hawaiian Party Supplies (Cute Style),N/A,$9.99,,4.5,658.0,False,https://m.media-amazon.com/images/I/81nuDXIZ7HL._AC_UL320_.jpg,https://m.media-amazon.com/images/I/81nuDXIZ7HL._AC_SL1500_.jpg,,2026-04-18T10:02:16.657937,
26,1,Organic,,17.0,B0BYCMNS61,Geelin 5 Pcs Sunflower Wooden Table Signs Sunflower Gnomes Decoration Summer Gnome Table Centerpieces Hello Sunshine Welcome Decoration for Summer Party Home Kitchen Decor(Colorful),N/A,$11.99,,4.3,230.0,False,https://m.media-amazon.com/images/I/81GZ+n7eLHL._AC_UL320_.jpg,https://m.media-amazon.com/images/I/81GZ+n7eLHL._AC_SL1500_.jpg,,2026-04-18T10:02:16.661538,
27,1,Organic,,18.0,B0BVW71PM3,Maitys 3 Pcs Spring Table Decor Summer Sunflower Wood Table Sign Spring Freestanding Butterfly Tabletop for Home Kitchen Rustic Centerpiece Standing Tiered Tray Shelf Decorations(Classic Sunflower),N/A,$9.99,,4.5,195.0,False,https://m.media-amazon.com/images/I/61aXZ5oTJcL._AC_UL320_.jpg,https://m.media-amazon.com/images/I/61aXZ5oTJcL._AC_SL1500_.jpg,,2026-04-18T10:02:16.665530,
28,1,Organic,,19.0,B0CYGY1S86,4 Pcs Sunflower Table Decorations Sunflower Tiered Tray Decor Farmhouse Rustic Table Decor Books Stack Signs Block for Home Office Decorations,N/A,$11.99,,4.5,347.0,False,https://m.media-amazon.com/images/I/81abAhWF8gL._AC_UL320_.jpg,https://m.media-amazon.com/images/I/81abAhWF8gL._AC_SL1500_.jpg,,2026-04-18T10:02:16.669165,
29,1,Organic,,20.0,B07DLVSJ99,"FUTUREPLUSX 2 Pack Tropical Garland Party Decorations, 20ft Multicolored Tissue Paper Hibiscus Flower Summer Banner for Birthday Beach Theme Luau Hawaiian Party Supplies Jungle Decor",N/A,$8.99,,4.7,3375.0,False,https://m.media-amazon.com/images/I/71q9+TnamlL._AC_UL320_.jpg,https://m.media-amazon.com/images/I/71q9+TnamlL._AC_SL1500_.jpg,,2026-04-18T10:02:16.674040,
30,1,Organic,,21.0,B08QFBHYZC,"Pinkpum 20'' Eucalyptus Wreath for Front Door, Porch, Window - Green Decor for Home, Farmhouse - Spring, Summer, Fall, All Seasons",N/A,$21.99,,4.4,5715.0,False,https://m.media-amazon.com/images/I/81P9Jpi54zL._AC_UL320_.jpg,https://m.media-amazon.com/images/I/81P9Jpi54zL._AC_SL1500_.jpg,,2026-04-18T10:02:16.677942,
31,1,Organic,,22.0,B07NWR7HKD,"JOYIN 12-Pack 12“ Beach Balls - Bulk Classic Beachball Inflatable Swimming Pool Toys for Games Adults Kids Birthday Party Supplies Combo Set, Rainbow Color Blow Up Luau Decorations Favors Gifts (12"")",N/A,$9.99,,4.5,3354.0,False,https://m.media-amazon.com/images/I/814LDy0nOPL._AC_UL320_.jpg,https://m.media-amazon.com/images/I/814LDy0nOPL._AC_SL1500_.jpg,,2026-04-18T10:02:16.681980,
32,1,Organic,,23.0,B071JR7GYP,"JOYIN 60"" Inflatable Palm Tree Cooler, Beach Theme Decor, Pool Party Decorations, Luau Hawaiian Birthday Party Supplies, Ocean Jungle Tropical Themed Summer Outdoor Drink Cooler",N/A,$19.99,,4.3,5368.0,False,https://m.media-amazon.com/images/I/815M9fW4pfL._AC_UL320_.jpg,https://m.media-amazon.com/images/I/815M9fW4pfL._AC_SL1500_.jpg,,2026-04-18T10:02:16.685370,
33,1,Title,,,,More results,,,,,,False,,,,2026-04-18T10:02:16.685904,
34,1,Organic,,24.0,B09YY1D5T7,"OPSEAM Butterfly Wall Decor 24/48 PCS, 3D Butterflies Stickers for Party Decorations with Magnets(Colorful, 24)",N/A,$6.99,,4.7,4351.0,False,https://m.media-amazon.com/images/I/81FEiIm-bCL._AC_UL320_.jpg,https://m.media-amazon.com/images/I/81FEiIm-bCL._AC_SL1500_.jpg,,2026-04-18T10:02:16.689318,
35,1,Organic,,25.0,B0C2VGNTW1,"ASMAD Solar Lights Outdoor(4 Pack,32 LEDs), Solar Garden Lights, Outdoor Decorations, Firefly Light for Patio Decor, Big Bulb, Unique Gifts for Women, Gifts for Grandma",N/A,$23.73,,4.5,8104.0,False,https://m.media-amazon.com/images/I/815Gp83CG4L._AC_UL320_.jpg,https://m.media-amazon.com/images/I/815Gp83CG4L._AC_SL1500_.jpg,,2026-04-18T10:02:16.694807,
36,1,Organic,,26.0,B00N1QPNMA,"PartySticks Glow Sticks Party Supplies 100pk - 8 Inch Glow in the Dark Light Up Sticks Party Favors, Glow Party Decorations, Neon Party Glow Necklaces and Glow Bracelets with Connectors",N/A,$7.99,,4.6,28646.0,False,https://m.media-amazon.com/images/I/81JYNlch58L._AC_UL320_.jpg,https://m.media-amazon.com/images/I/81JYNlch58L._AC_SL1500_.jpg,,2026-04-18T10:02:16.699522,
37,1,Organic,,27.0,B0DS6FWLYC,"AVOIN colorlife Hello Sunshine Floral Sweet Summer Time Throw Pillow Covers, 18 x 18 Inch Popsicle Ice Cream Polka Dots Stripes Best Summer Ever Holiday Seasonal Cushion Case Decorations Set of 4",N/A,$12.99,,4.6,42.0,False,https://m.media-amazon.com/images/I/81b6UF50-xL._AC_UL320_.jpg,https://m.media-amazon.com/images/I/81b6UF50-xL._AC_SL1500_.jpg,,2026-04-18T10:02:16.708725,
38,1,Organic,,28.0,B0CZ637F9S,"OBXT 10"" Blue Hanging Jellyfish Paper Lanterns - Under the Sea Party & Mermaid Birthday Decorations, Baby Shower, Nautical Events, Ocean Theme Classroom & Beach Room Decor (Set of 6)",N/A,$20.99,,4.8,707.0,False,https://m.media-amazon.com/images/I/81vZ2BQo+gL._AC_UL320_.jpg,https://m.media-amazon.com/images/I/81vZ2BQo+gL._AC_SL1500_.jpg,,2026-04-18T10:02:16.713266,
39,1,Organic,,29.0,B07M5BGJFV,"Tropical Palm Leaf Garland Party Decorations, Length 2.6M, 8.5 FT, Green",N/A,$14.99,,4.6,968.0,False,https://m.media-amazon.com/images/I/81p2nI+iEYL._AC_UL320_.jpg,https://m.media-amazon.com/images/I/81p2nI+iEYL._AC_SL1500_.jpg,,2026-04-18T10:02:16.716907,
40,1,Organic,,30.0,B0721468V1,"JOYIN Inflatable Swim Tube Raft (3 pack) with Summer Fruits Painting, Pool Toys for Swimming Pool Party Decorations",N/A,$16.98,,4.6,8362.0,False,https://m.media-amazon.com/images/I/71cpqrIteIL._AC_UL320_.jpg,https://m.media-amazon.com/images/I/71cpqrIteIL._AC_SL1500_.jpg,,2026-04-18T10:02:16.721523,
41,1,Organic,,31.0,B0F1YMPVPN,Beach Party Decorations Kit - Beach Themed Honeycomb Centerpieces and Table Decor for Summer & Pool Party Decorations,N/A,$9.98,,4.7,1133.0,False,https://m.media-amazon.com/images/I/81DHErA5m0L._AC_UL320_.jpg,https://m.media-amazon.com/images/I/81DHErA5m0L._AC_SL1500_.jpg,,2026-04-18T10:02:16.726265,
42,1,Organic,,32.0,B09TW1CPJ8,"Spring Decorations for Home, Office, Indoor - Yellow Honey Bumble Bee Sunflower Plush Gnomes Doll - Summer Gnome Gifts Ideas for Women - Bee Stuffed Sitters - Unique Housewarming Gifts for New Home",N/A,$25.99,,4.6,486.0,False,https://m.media-amazon.com/images/I/712VWAB5FGL._AC_UL320_.jpg,https://m.media-amazon.com/images/I/712VWAB5FGL._AC_SL1500_.jpg,,2026-04-18T10:02:16.729990,
43,1,Organic,,33.0,B0BLVJV2YG,"LEEZZIZZ 30Pcs Punch Balloons, Thickened Neon Punching Balloon Heavy Duty Party Favors for Kids with Rubber Band Handle, Bouncy Balls for Birthday Weddings Goodie Bag Stuffer Supply",N/A,$8.88,,4.6,3540.0,False,https://m.media-amazon.com/images/I/61o0vAZMh0L._AC_UL320_.jpg,https://m.media-amazon.com/images/I/61o0vAZMh0L._AC_SL1500_.jpg,,2026-04-18T10:02:16.734371,
44,1,Organic,,34.0,B07VDQWXK8,"XONOR Artificial Flower Plants - Mixed Color Daisies in Picket Fence Pot for Indoor Office Wedding Home Decor, 2 Sets",N/A,$22.99,,4.5,2192.0,False,https://m.media-amazon.com/images/I/712KTr+ctvL._AC_UL320_.jpg,https://m.media-amazon.com/images/I/712KTr+ctvL._AC_SL1500_.jpg,,2026-04-18T10:02:16.739318,
45,1,Organic,,35.0,B0F3J74VN5,Summer Party Decoration Hello Summer Banner Colorful Beach Pool Theme Banners Pre-strung Pool Banner Hanging Swirls Honeycomb Balls Circle Dots Garland for Holiday Beach Party Decorations Supplies,N/A,$9.99,,4.8,20.0,False,https://m.media-amazon.com/images/I/81iDyh6u+ML._AC_UL320_.jpg,https://m.media-amazon.com/images/I/81iDyh6u+ML._AC_SL1500_.jpg,,2026-04-18T10:02:16.743553,
46,1,Organic,,36.0,B0BPS34MRJ,33pcs Spring Hanging Decorations for Home - Flower Butterfly Hanging Swirls with Led Lights for Spring Summer Easter Flower Butterfly Themed Birthday Party Decorations,N/A,$8.99,,4.6,539.0,False,https://m.media-amazon.com/images/I/815GV8ode1L._AC_UL320_.jpg,https://m.media-amazon.com/images/I/815GV8ode1L._AC_SL1500_.jpg,,2026-04-18T10:02:16.747758,
47,1,Organic,,37.0,B0DZYT48XZ,"Hello Summer Banner,Summer Party Decorations",N/A,$6.99,,4.6,31.0,False,https://m.media-amazon.com/images/I/51lRmNCx93L._AC_UL320_.jpg,https://m.media-amazon.com/images/I/51lRmNCx93L._AC_SL1500_.jpg,,2026-04-18T10:02:16.752117,
48,1,Organic,,38.0,B0DBV9YQN4,Cheerland Flower Banner Wildflower Garland Floral for Enchanted Garden Theme Wedding Wild Birthday Baby Bloom Fairy Tale Tea Market Spring Mothers Day Supplies Woodland Cottagecore Party Decorations,N/A,$13.99,,4.7,288.0,False,https://m.media-amazon.com/images/I/81UlRkfD0EL._AC_UL320_.jpg,https://m.media-amazon.com/images/I/81UlRkfD0EL._AC_SL1500_.jpg,,2026-04-18T10:02:16.756277,
49,1,Organic,,39.0,B0GC25DZ11,"Smile 4 Pcs Summer Indoor Wooden Decor, Sunflowers Colorful Hello Sunshine Summer Tiered Tray Farmhouse Table Decoration for Home and Office",N/A,$9.99,,4.5,106.0,False,https://m.media-amazon.com/images/I/71W6fV0JQGL._AC_UL320_.jpg,https://m.media-amazon.com/images/I/71W6fV0JQGL._AC_SL1500_.jpg,,2026-04-18T10:02:16.760916,
50,1,Organic,,40.0,B0BKTQ9JLP,"JOYIN 120 Counts Hawaiian Leis Bulk, Colorful Tropical Flower Leis for Kids Adults Hawaiian Beach Luau Party Favors Decorations",N/A,$25.99,,4.6,10885.0,False,https://m.media-amazon.com/images/I/911aTPl1DwL._AC_UL320_.jpg,https://m.media-amazon.com/images/I/911aTPl1DwL._AC_SL1500_.jpg,,2026-04-18T10:02:16.765098,
51,1,Organic,,41.0,B0F3GL7QCG,"COCHIE Metal Hello Summer Sign, Summer Decorations for Home, Office, Shelf, Mantel, Indoor, Beach Slippers Tabletop Centerpiece Decoration, Watermelon Red Decor (Beach)",N/A,$15.99,,4.6,257.0,False,https://m.media-amazon.com/images/I/71RVEYvQsYL._AC_UL320_.jpg,https://m.media-amazon.com/images/I/71RVEYvQsYL._AC_SL1500_.jpg,,2026-04-18T10:02:16.768870,
52,1,Organic,,42.0,B075FPCFNR,60Pcs Tropical Party Decorations Supplies Tropical Palm Leaves Hibiscus Flower Simulation Artificial Leaf for Hawaiian Luau Safari Party Jungle Beach Theme BBQ Birthday Parties Decorations Table Decor,N/A,$11.99,,4.6,3137.0,False,https://m.media-amazon.com/images/I/81jZYriVXGL._AC_UL320_.jpg,https://m.media-amazon.com/images/I/81jZYriVXGL._AC_SL1500_.jpg,,2026-04-18T10:02:16.773050,
53,1,Title,,,,More results,,,,,,False,,,,2026-04-18T10:02:16.773680,
54,1,Organic,,43.0,B0C5RLKCTC,Kigley 7 Pieces Hello Summer Table Decoration Sign Wooden Centerpieces Beach Gnome Wooden Decor for Farmhouse Summer Beach Home Table Tiered Tray Decor,N/A,$9.99,,4.5,73.0,False,https://m.media-amazon.com/images/I/81CVba4XuXL._AC_UL320_.jpg,https://m.media-amazon.com/images/I/81CVba4XuXL._AC_SL1500_.jpg,,2026-04-18T10:02:16.777682,
55,1,Organic,,44.0,B073RBVTXT,"ALINK 50 Umbrella Parasol Drinking Straws, Hawaiian Beach Cocktail Luau Party Decorations Supplies",N/A,$6.99,,4.6,10351.0,False,https://m.media-amazon.com/images/I/81YbWfWBaPL._AC_UL320_.jpg,https://m.media-amazon.com/images/I/81YbWfWBaPL._AC_SL1500_.jpg,,2026-04-18T10:02:16.783124,
56,1,Organic,,45.0,B0DTHKJN3V,Yuntau 4 Pcs Sunflower Decorations Sunflower Wooden Sign Sunshine Table Centerpiece Summer Tiered Tray Decor Decorative Faux Book Stack Block for Coffee Table Fireplace Mantel Floating Shelf,N/A,$16.99,,4.5,411.0,False,https://m.media-amazon.com/images/I/71E03+qbDqL._AC_UL320_.jpg,https://m.media-amazon.com/images/I/71E03+qbDqL._AC_SL1500_.jpg,,2026-04-18T10:02:16.788020,
57,1,Organic,,46.0,B0BV21BSRG,"Summer Party Decorations Porch Sign, 71"" X 12"" Hello Summer Banne for Office Indoor Door",N/A,$9.99,,4.6,94.0,False,https://m.media-amazon.com/images/I/71WsYe4+xCL._AC_UL320_.jpg,https://m.media-amazon.com/images/I/71WsYe4+xCL._AC_SL1500_.jpg,,2026-04-18T10:02:16.792744,
58,1,Organic,,47.0,B0DC51MRZ4,"Freyalife Hawaiian Leis Decorations(24pcs),Leis for Luau Party Decor Flower,Tropical Hawaiian Bulk Hula Dance Party Decor",N/A,$6.99,,4.3,621.0,False,https://m.media-amazon.com/images/I/816+lI1lMEL._AC_UL320_.jpg,https://m.media-amazon.com/images/I/816+lI1lMEL._AC_SL1500_.jpg,,2026-04-18T10:02:16.797585,
59,1,Organic,,48.0,B095P71JSG,Summer Slippers Hanging Sign Shape Welcome Hello Flip Flop Wooden Door Plaque Rustic Wall Sign Yard Indoor Outdoor Garden Decoration with Rope (Welcome),N/A,$8.99,,4.4,1165.0,False,https://m.media-amazon.com/images/I/71Jt6EhZpFL._AC_UL320_.jpg,https://m.media-amazon.com/images/I/71Jt6EhZpFL._AC_SL1500_.jpg,,2026-04-18T10:02:16.803194,
61,1,Title,,,,"Debug info copied.Sponsored12 Pcs Tulip Honeycomb Decorations, Spring Decorations for Office, Table ",,,,,,False,,,,2026-04-18T10:02:16.804896,
62,1,Title,,,,Related searchessummer party decorationssummer decorations for officesummer decorations for homesumm,,,,,,False,,,,2026-04-18T10:02:16.806778,
63,1,Title,,,,Previous123...7Next,,,,,,False,,,,2026-04-18T10:02:16.807515,
64,1,SB,1.0,,,N/A,https://aax-us-east-retail-direct.amazon.com/x/c/JKCWeJeuTGFf6C1AklBWt0EAAAGdoAp1wwEAAAH2AQBvbm9fdHhuX2JpZDIgICBvbm9fdHhuX2ltcDIgICBzX2f3/clv1c_ek-wBPHXFbbWzjK3YoscrxfcOWxCnjqPwnbd-7bg2urWBhkqNDFuMQpQ0xi2JdpI6ovlmFHP8uoqMVFpkhNY1Oi1QJmMX3nS8AVtBsug1K2yms_tOd3vcV_Zo_5s6trhH5LZPdvsmETnUGD4_KJCRJqbocmMttTrPkL8ziH6ZMbf2WKQatfe7p2x0VBaIpsyFgNdr0lWHStgZQ2tN86huPi5nte9pl7_osUwSGzo1_0-zdLkTuwFWbHsAo7nXpHGisa5FzKBjOcYGzVq8cA0qaHqfEJEzajGQeFvY3wJX1_MxccfvKb1EVbt5gC9hU-a7qJUUxMK6-DeI2uvNT0ejgHdokWg_RL42ST7Be1RC0jSJVZ8lXlmpSc3FR6nAc4-5vZ8AeWz-jWvPQA_Ud_Ob23UqTx8snLmwFDTNSHyG5berEOD6EuC-QmUE4HZVrxQm1zm2lL71w9STOoYCqk8KzLXnBkwGAr_OXaLeJC46pHiNVg0QDhQeusYeljOkkMUCs-CUF4XydZTokczAXCBPARjHWjrm4MqJQ8kGlc3Sj2ywrvhZDaAdtHEJvk_nDvFRy4hEZ6UAZoTjXHr4IdxCIdIPG87mg-mGy1fQFUfpub2_BevG5r5ngcWjDdxLG3iapzM_8DmwXtktGwBM9lwvGAcYt3EEUST-ahi5CAcjsW6tHo4jRAZ3RwI-vjuBq4swEyGvgzwWOPAD3NMv6k6yWrSqfcpQsPVK-hSs0NzF1JdlfAoIfeYotsBnLbpqmaCpcrbohAfi0cSlr-YWK2Gz3cCUFxxEOo-a49qzMCKoAA9dqpkI7sRd33R5NmuMhir2Sr2nG_f6zrMc6YNsyGV0MqtAUmvu7l2G477rXYawtj5lqeWYlUVij3BmjVuWpDvQmDN-b4fJawztP4EdXnpayqYv1nmgXtt-I3CYZoi2f4A5M_rHTEazUN5lxwA8hllVjQO2rlyqkGDTTKzttLJ5Z3BLasDPFa1ns-EcKal1SWZtnRyg8LlEYJnbD4amjfWAXuvZmogGlaWMMqglEDh1RIqKbsoLMgopYCDu8NMG0wcw5lZZKKUlAykZv28ouTs_Kbvv_Wo7gIr7Gjd07YapmP9HVHTv_7NbpkJ_KVaSzQDQjqMEV-aCE2lEzUpjCjj5FCR6kbzpEcAi5GN9Ru3sIHLOp9PfA-6cx2PfvRr-KqLcZoZPzQWtxvH9f--R-PCJS61cUsmA2SYrKq5FyTW1zvjhyLtN10T9_67VtpEAwHsYvIncA6JtXfyS9CWqioV707IjXbeInOOqpCeV8OV_mpYdI81n6uNwMLFCAKkPURQCJ_cPOvzybjkl6sWYBi_Rw4sLDi_ddf-obdmtiyk2kKWIA4JhWdd5w0AnJ5YXp66dcfvtyLyubfEfN3PzUzvPaldnudn6R3Wqxuys7LonAamcSNU8iPcJJyhjJ_pYbwpUZRYs6XZQV14GiIvQSCcpNKiLAZDJCOzeGqOXPfRxFMFpSohJWnTJrGq9z6-JO3Vv9-Ak7HqGXrXSGG2DkfLdvF3gMsOpGHr19X53FsQ-HjO-nY6xUO35u1EzzTbtw0URQFCynZ8Z0Hk5Rj2k_01K6UEIinNCVsI7zM4Fwdl-EOZM5p_Bh-dwyETTXR14Y2B7EdLtvy3I5q1ePrRctIo-IkUukPyTMe8klQP7ov_vDN2RjPafj4/https://www.amazon.com/stores/page/E08B70A4-705C-43BD-8E6C-DF7897D7FBF3/?_encoding=UTF8&store_ref=SB_A0984150WSDLNQGSK6ZZ-A0402304BG7J43KVHDXH&pd_rd_plhdr=t&aaxitk=f955d63435b4076e6c1067379c9af78b&hsa_cr_id=0&lp_asins=B0FZKB4ZWK%2CB0CSSMVZVX%2CB0CRB4JCT6&lp_query=summer%20decorations&lp_slot=desktop-hsa-3psl&ref_=sbx_be_s_3psl_mbd_mb0_bkgd&pd_rd_w=DVaqS&content-id=amzn1.sym.cd7c548b-a599-426f-9ffe-daa1aa803c87%3Aamzn1.sym.cd7c548b-a599-426f-9ffe-daa1aa803c87&pf_rd_p=cd7c548b-a599-426f-9ffe-daa1aa803c87&pf_rd_r=8CSN79K4P001TTNYYG0G&pd_rd_wg=d34FM&pd_rd_r=6bed63cf-433b-430a-abea-5936bfd9155a,,,,,False,,,N/A,2026-04-18T10:02:16.812104,
65,1,Title,,,,Need help?Visit the help sectionorcontact us,,,,,,False,,,,2026-04-18T10:02:16.813196,
0,2,SB,2.0,,,Under The Sea Party Decorations,https://aax-us-east-retail-direct.amazon.com/x/c/JLPzlltG6fm1Lw_vY3btyRcAAAGdoArO-gEAAAH2AQBvbm9fdHhuX2JpZDcgICBvbm9fdHhuX2ltcDEgICDtHda1/clv1c_ek-wxPf3VcbWTPWXjyXvh-iWmpCpkoAotaCvaxm-NiHhpUiyZcDwpdGG-y9clcEdJ6BQ6hlwKVI3NuXm2Zr-SU_aKnxP0bjuSjsH8OXl7MpUBxbuU929vEy44eEAjiLI8_Y79JxJszyjbmxOx9f83_ZTQFyeimnKzkyQrjcrwK5rCcs3IgrWa2faywc5RYh4UJdoqslNCQHcTag19wr3lzPOnRx9VkdyXd0qOt_3yVrfTYC-uku3EerasVB3s_tSV9nma6htZsUdeuIbH9vtMRQ-MASzpqrCOKhZAHY_MlrZqrw6bEX2N-2zYNTQhTTl4oazOqtSLSNriB036JHTOm1coG1zuLC-X1LTO-0ksLggttj10r7wwFa15MIHpaHYWNRJhscAW149YOr3O0GnMrJP_yNGo8ctzDh-IZQHCw_v3kIrvJuDZ2DWYc15UDIYlqeT2VldOQ-5HY5sI76QzV-SInctY_rD4YPnrhF2Kjiik4ozXmRQir8j3cF5emqnajRNfkR0S86yizWt3omJgWRbcWjEsmSjCD-jxHP3pWv0bhx7qsS-y-ZCZb_PEakGIw7peYGNbbGDME6Y6PdRoDwhLckHioW_XQne2nlmqXKMzHmgII3FguOH69764gJgJqbUbpRRTCssEs9LXdRYPwfhst8Tla8AVHO-uGKJqJrUS1YYFN7iYtOXuzFR_ioQkeTcQyBB2XnB16Aa1knlp48GbZT2LZwBk-9gk-LQyBe8ZnSis_pYyLXc-qVcqpH0DtEr5MrmYjfXBYReGrUchyIl5nyA-zNfHbrZjcNJspDT7etOJHWyPErj63t-aQBVz13CpmE9B9JJA32zcGqah2MZ0a3dtjmGA9306FJH6GTsEn614wRQoraOfbuCtdmBoR0PM4ARjiWoGCcVBOef3zPdEaOLFJ1vUpfNqIFE7iQZLzAb87ZTJ57ObxwbSjBLDmNXT46FmFmCPU_J1-1e06gHlbS3yL2rlcm8xVmC2D7M32YVbxGOWIFJLGYZ80oNlA-ccdmJGAGSmttIjEVd2vLZdrid3NZuCTUx49Bmgys6eih1PLONUN0QP24BVixJTpeYaiWaBxyqSJCjYP5_ROC6Vbz5uy2jUVRVNvgK4LqHpJiSUH8hv4OmTLwIZq1Y7SiZZQ0r6jfrFPn4PUw9gOFCm59mHQ2xfnhdmAVcJte4lKAuw3wueoKSbvbTF98nCaT4ZjY_CCMXtY_ZsSDeublCpoue5seFbe7TYjM-F7wOsFzkcX9AYFHpTuYZ0A-zr5LFif525AUh2elW3q_ihvoy-W_kmTxGB6gyrR63BR2AmORxyGLvCyZuQHPdmbDgX-hqtvXeSNViAiAoiHiEPaIlTBwpIN2qDkTu8ZVrBtA_7lpMoglHyzq5h5A6GkkQiv1tySiQIWGMgfcJqRWcwDuxIeVXCJ5WF-OubBJqfYv5VQOPjRW8_qKKTMT54rsEIFGUOo9bVF3APiTWQI_R9ROMT2iqQa6XXezRoDartTUcD199p7dQ9urKMz3_b4mLcezsxTyd-nR8xa63Qa1MAlkdEuV5q6zAZoKTnGiL6rlTIioaJ4IQzJ42uSjR2dCCxSMWpVeIpAi1qnfh6pSebnFgRNXPsI9wDvgkz2aYEMokw4b4sgwnT_HBzs79ySRaLY8UD_-OrcAjA01q__zHYAZee8ucD57QLUs/https://www.amazon.com/stores/page/6956570F-DAF5-4795-AC42-1726A926FA0D/?_encoding=UTF8&store_ref=SB_A017845915CPB7KG2KJUE-A06766673SV040RNQ87P0&pd_rd_plhdr=t&aaxitk=593ed25cdae78151079140b4dafc652e&hsa_cr_id=0&lp_asins=B0DDH82BQW%2CB0CZ3LWF46%2CB0CKHGHL7Y&lp_query=summer%20decorations&lp_slot=auto-sparkle-hsa-tetris&ref_=sbx_s_sparkle_sbtcd_bkgd&pd_rd_w=DhcLY&content-id=amzn1.sym.cc961e39-6f5f-411e-8135-81c6c1187ac0%3Aamzn1.sym.cc961e39-6f5f-411e-8135-81c6c1187ac0&pf_rd_p=cc961e39-6f5f-411e-8135-81c6c1187ac0&pf_rd_r=FS68CS3QEPM9XRMXH4ZF&pd_rd_wg=TxDZh&pd_rd_r=a8789b52-bbf2-4003-ba55-d2c786758025,,,,,False,"https://m.media-amazon.com/images/S/al-na-9d5791cf-3faf/6652b2e9-23b6-4b18-809a-f61057132782._CR0,0,600,600_AC_SX130_SY60_CB1169409_QL70_.jpg",,Under The Sea Party Decorations,2026-04-18T10:02:39.672690,3.0
1,2,Title,,,,ResultsCheck each product page for other buying options. Price and other details may vary based on p,,,,,,False,,,,2026-04-18T10:02:39.673636,
3,2,Organic,,49.0,B0BVQ41GL9,FairySandy 2 Pieces Summer Gnomes Beach Decorations Mini Gnomes Resin Figurines Set Decor Collectible Tabletop Kitchen Decorations for Home Kitchen Farmhouse Office,N/A,$19.49,,4.5,73.0,False,https://m.media-amazon.com/images/I/71F21whIDRL._AC_UL320_.jpg,https://m.media-amazon.com/images/I/71F21whIDRL._AC_SL1500_.jpg,,2026-04-18T10:02:39.677633,
4,2,Organic,,50.0,B0BY8N3353,Farmhouse Sunshine Sunflower Wooden Box Sign Rustic Country Sunflower Box Sign Wood Sign Decor Summer Square Wood Sign Home Desk Tabletop Shelf Decor 5 x 5,N/A,$6.99,,4.7,412.0,False,https://m.media-amazon.com/images/I/61ijXQfneVL._AC_UL320_.jpg,https://m.media-amazon.com/images/I/61ijXQfneVL._AC_SL1500_.jpg,,2026-04-18T10:02:39.681097,
