data_index,page,ad_type,ad_rank,organic_rank,asin,title,url,price_current,price_list,rating_stars,rating_count,is_prime,image_small,image_large,brand_name,scraped_at,inner_products_count
8,3,Organic,,100.0,B0F6MWZQ37,Simplepolymer Hello Sweet Summer Metal Sign Rustic Home Office Decoration with Wooden Base for Table Shelf Tiered Tray Fireplace Mantel Decor,N/A,$9.99,,3.9,10.0,False,https://m.media-amazon.com/images/I/71-Z-i1QSEL._AC_UL320_.jpg,https://m.media-amazon.com/images/I/71-Z-i1QSEL._AC_SL1500_.jpg,,2026-04-18T10:02:55.673496,
9,3,Organic,,101.0,B0F9YNB2BR,Inspirational Sun Summer Desk Decoration for Home Sunshine Decor Inspirational Desk Decor for Women Men Summer Decorations for Home Table Office Classroom Dorm Nursery Playroom Shelf Decors,N/A,$7.99,,5.0,8.0,False,https://m.media-amazon.com/images/I/61AmXn3JasL._AC_UL320_.jpg,https://m.media-amazon.com/images/I/61AmXn3JasL._AC_SL1500_.jpg,,2026-04-18T10:02:55.676860,
10,3,Organic,,102.0,B09QGQ9BZ7,Huray Rayho Sunflower Metal Truck with Artificial Plastic Flower Yellow Vintage Farm Pickup Farmhouse Tabletop Tiered Tray Decor Home Kitchen Mantel Shelf Spring Mini Diecast Truck Decorations,N/A,$13.99,,4.3,689.0,False,https://m.media-amazon.com/images/I/61fbmMg4XAL._AC_UL320_.jpg,https://m.media-amazon.com/images/I/61fbmMg4XAL._AC_SL1500_.jpg,,2026-04-18T10:02:55.679729,
11,3,Organic,,103.0,B0F2FBQ4H1,Watermelon Summer Tiered Tray Decor Vintage Truck with Mini Watermelons Wooden Crate Farmhouse Kitchen Centerpieces for Tables Sweet Time Hello Summer Signs for Home Watermelon Party Decorations,N/A,$12.99,,4.3,674.0,False,https://m.media-amazon.com/images/I/613WItNaKiL._AC_UL320_.jpg,https://m.media-amazon.com/images/I/613WItNaKiL._AC_SL1500_.jpg,,2026-04-18T10:02:55.683874,
12,3,Organic,,104.0,B0CN6M45DZ,"4"" Bird Decor - Every Little Thing Is Gonna Be Alright - Spring Decor Watercolor Adorable Birds, Positive Quotes Wooden Plaque Desk Decor, Uplifting Gifts, Spring Decor for Home Decorations - A20",N/A,$11.99,,4.6,242.0,False,https://m.media-amazon.com/images/I/71oVo6uiKpL._AC_UL320_.jpg,https://m.media-amazon.com/images/I/71oVo6uiKpL._AC_SL1500_.jpg,,2026-04-18T10:02:55.687202,
13,3,Organic,,105.0,B09VKG94RZ,"Artoid Mode Yellow Hello Sunshine Summer Decorative Doormat, Seasonal Spring Holiday Low-Profile Floor Mat Switch Mat for Indoor Outdoor 17 x 29 Inch",N/A,$15.99,,4.4,310.0,False,https://m.media-amazon.com/images/I/710TungCE7L._AC_UL320_.jpg,https://m.media-amazon.com/images/I/710TungCE7L._AC_SL1500_.jpg,,2026-04-18T10:02:55.694857,
14,3,Title,,,,"American Patriotic Pleated Fan FlagShopCouahPrevious page4 Pack USA Pleated Bunting Fan Flags, 1.5x3",,,,,,False,,,,2026-04-18T10:02:55.696376,
15,3,Title,,,,More results,,,,,,False,,,,2026-04-18T10:02:55.696569,
16,3,Organic,,106.0,B0CWQZNHVK,Summer Party Decorations Hello Summer Banner Hanging Swirls and Honeycomb Centerpieces Beach Pool Decorations for Pool Holiday Birthday Party Supplies,N/A,$9.99,,4.7,19.0,False,https://m.media-amazon.com/images/I/812VyJjaHxL._AC_UL320_.jpg,https://m.media-amazon.com/images/I/812VyJjaHxL._AC_SL1500_.jpg,,2026-04-18T10:02:55.699836,
17,3,Organic,,107.0,B0B8G6PQ63,"200 Count Hawaiian Lei Bulk, Tropical Luau Hawaii Theme Silk Flower Necklace, Party Favors for Beach Holiday Wedding Birthday Party, Aloha Summer Party Decorations",N/A,$39.99,,4.4,337.0,False,https://m.media-amazon.com/images/I/A1JXqd95lrL._AC_UL320_.jpg,https://m.media-amazon.com/images/I/A1JXqd95lrL._AC_SL1500_.jpg,,2026-04-18T10:02:55.703284,
18,3,Organic,,108.0,B0CX1L81FV,26 Pcs Summer Swimming Pool Tiered Tray Decoration Summer Wood Signs Kitchen Decoration Rustic Farmhouse Tiered Tray Table Decorations for Home Party,N/A,$10.99,,4.3,79.0,False,https://m.media-amazon.com/images/I/81yQtV-0t3L._AC_UL320_.jpg,https://m.media-amazon.com/images/I/81yQtV-0t3L._AC_SL1500_.jpg,,2026-04-18T10:02:55.707992,
19,3,Organic,,109.0,B0BZ48MZ2T,Chunful Reversible Hello Summer 4th of July Decorations for Home Wooden Memorial Day Patriotic Table Decoration Summer Table Centerpieces Red White Blue Flamingo Watermelon Independence Day Sign,N/A,$9.99,,4.4,67.0,False,https://m.media-amazon.com/images/I/81ytCYHCNSL._AC_UL320_.jpg,https://m.media-amazon.com/images/I/81ytCYHCNSL._AC_SL1500_.jpg,,2026-04-18T10:02:55.711524,
20,3,Organic,,110.0,B0BN833PVB,Jutom 3 Pcs Bee Hive Decor Honey Bee Tiered Tray Decor Summer Spring Honeybee Decorations Mini Jute Farmhouse Beehive for Kitchen Table Shelf Home Coffee Bar Themed Party(Vintage Color),N/A,$25.99,,4.7,137.0,False,https://m.media-amazon.com/images/I/81nt3P25NaL._AC_UL320_.jpg,https://m.media-amazon.com/images/I/81nt3P25NaL._AC_SL1500_.jpg,,2026-04-18T10:02:55.715403,
21,3,Organic,,111.0,B0F5Q829G5,"Wooden Summer Ornaments for Tree 27 PCS,9 Styles DIY Unfinished Wood Beach Cutouts Ornament for Crafts Hanging Hawaiian Decorations, Watermelon Surfboard Slippers Coconut Tree Home Gifts",N/A,$9.99,,4.5,84.0,False,https://m.media-amazon.com/images/I/71hvVbB+6uL._AC_UL320_.jpg,https://m.media-amazon.com/images/I/71hvVbB+6uL._AC_SL1500_.jpg,,2026-04-18T10:02:55.718767,
22,3,Organic,,112.0,B0B3NDG7H2,Jetec 12 Pcs Sunflower Tiered Tray Decor Spring Wooden Farmhouse Summer Tiered Tray Signs Truck Gnomes Tabletop for Home Rustic Kitchen Decorations,N/A,$9.19,,4.2,420.0,False,https://m.media-amazon.com/images/I/81EJ4G-FFdL._AC_UL320_.jpg,https://m.media-amazon.com/images/I/81EJ4G-FFdL._AC_SL1500_.jpg,,2026-04-18T10:02:55.721713,
23,3,Organic,,113.0,B0BY7MQCL3,24 Pcs Summer Tree Ornaments Beach Wood Hanging Decoration Hawaiian Wooden Slices Pendant Summer Tree Hanging Ornaments Gift Tags Tropical Party Decor for Luau Party Supplies,N/A,$11.99,,4.4,72.0,False,https://m.media-amazon.com/images/I/81ugdeiHn4L._AC_UL320_.jpg,https://m.media-amazon.com/images/I/81ugdeiHn4L._AC_SL1500_.jpg,,2026-04-18T10:02:55.724884,
24,3,Organic,,114.0,B0BYS89VRF,Geelin 36 Pcs Summer Wood Hanging Ornaments for Tree Mini Tree Decorations Hawaiian Beach Wooden Pendant Decorations with String for Luau Party Supplies(Cute Style),N/A,$11.99,,4.5,304.0,False,https://m.media-amazon.com/images/I/81swIFYCsRL._AC_UL320_.jpg,https://m.media-amazon.com/images/I/81swIFYCsRL._AC_SL1500_.jpg,,2026-04-18T10:02:55.729595,
25,3,Organic,,115.0,B0CYBPD52V,Summer Decorations for Home Daisy Summer Door Decor Hello Sunshine Door Sign Daisy Wreaths for Front Door Wooden Front Door Hanger Hanging Sign for Office Porch Wall Indoor Home Decor,N/A,$7.99,,4.5,122.0,False,https://m.media-amazon.com/images/I/71Z1PVfDntL._AC_UL320_.jpg,https://m.media-amazon.com/images/I/71Z1PVfDntL._AC_SL1500_.jpg,,2026-04-18T10:02:55.735796,
26,3,Organic,,116.0,B0946ZZ9BD,"Outus 30 Pieces Hawaiian Luau Birthday Party Hanging Swirl Decorations, Flower Tropical Palm Flamingo Sign Foil Ceiling Decor for Floral Tropical Party Summer Beach Pool Tiki Supplies(Summer)",N/A,$8.79,,4.6,1154.0,False,https://m.media-amazon.com/images/I/81cwoPntlvL._AC_UL320_.jpg,https://m.media-amazon.com/images/I/81cwoPntlvL._AC_SL1500_.jpg,,2026-04-18T10:02:55.739312,
27,3,Organic,,117.0,B0BZHDLX2V,Glenmal 2 Pcs Hello Summer Slippers Hanging Sign Flip Flop Welcome Door Decor Rustic Summer Wall Decor for Door Indoor Yard Outdoor Garden Decoration with Rope,N/A,$9.99,,4.3,95.0,False,https://m.media-amazon.com/images/I/81BFmg8juQL._AC_UL320_.jpg,https://m.media-amazon.com/images/I/81BFmg8juQL._AC_SL1500_.jpg,,2026-04-18T10:02:55.743538,
28,3,Organic,,118.0,B0DWX2WR49,Hello Summer Table Runner Popsicles Green Leaves Burlap Table Decoration for Home Seasonal Holiday Indoor Kitchen Dining Decor 13x72 Inch,N/A,$9.99,,5.0,2.0,False,https://m.media-amazon.com/images/I/81B1jVAmgKL._AC_UL320_.jpg,https://m.media-amazon.com/images/I/81B1jVAmgKL._AC_SL1500_.jpg,,2026-04-18T10:02:55.748210,
29,3,Organic,,119.0,B0F4WL7RV7,Summer Bulletin Board Classroom Decorations Floating into Summer Paper Cutouts Swim Ring DIY Photo Craft Set Hawaiian Theme Tropical Bulletin Board Borders for Back to School Office Teacher Supplies,N/A,$13.99,,4.3,15.0,False,https://m.media-amazon.com/images/I/81hAOPY2gBL._AC_UL320_.jpg,https://m.media-amazon.com/images/I/81hAOPY2gBL._AC_SL1500_.jpg,,2026-04-18T10:02:55.752297,
30,3,Organic,,120.0,B0BYDMHXHG,"AVOIN colorlife Hello Sunshine Classic Garden Flag 12x18 Inch Double Sided Outside, Summer Party Holiday Burlap Yard Outdoor Decoration",N/A,$6.99,,4.8,285.0,False,https://m.media-amazon.com/images/I/71Lr5yGIRfL._AC_UL320_.jpg,https://m.media-amazon.com/images/I/71Lr5yGIRfL._AC_SL1500_.jpg,,2026-04-18T10:02:55.757719,
31,3,Organic,,121.0,B0GJSG3ZW4,"Summer Bulletin Board Decorations Set, Summer Ice Pop Classroom Decorations, Colorful Popsicle Paper Cutouts, for School Classroom Home Party Supplies",N/A,$8.99,,5.0,2.0,False,https://m.media-amazon.com/images/I/81bfd0+RamL._AC_UL320_.jpg,https://m.media-amazon.com/images/I/81bfd0+RamL._AC_SL1500_.jpg,,2026-04-18T10:02:55.761065,
32,3,Organic,,122.0,B0CYBWMR83,"Summer Party Decorations, Hello Summer Banner Hanging Swirls and Honeycomb Centerpieces Beach Pool Party Decorations, Summer Pool Holiday Birthday Party Supplies",N/A,$7.99,,4.8,12.0,False,https://m.media-amazon.com/images/I/61PGCbFgpLL._AC_UL320_.jpg,https://m.media-amazon.com/images/I/61PGCbFgpLL._AC_SL1500_.jpg,,2026-04-18T10:02:55.764442,
33,3,Organic,,123.0,B0F66M5QT2,"Summer Decorations Watermelon Gnomes, One in a Melon Summer Fruit Party Farmhouse Tiered Tray Decor for Home Office, Watermelon Birthday Decorations Gifts",N/A,$18.99,,,,False,https://m.media-amazon.com/images/I/416u30CXJhL._AC_UL320_.jpg,https://m.media-amazon.com/images/I/416u30CXJhL._AC_SL1500_.jpg,,2026-04-18T10:02:55.767683,
34,3,Organic,,124.0,B0GC5NBZ1Q,"Smile 4 Pcs Summer Indoor Wooden Decor, Sunshine Sunflower Summertime Tiered Tray Farmhouse Table Decoration for Home and Office",N/A,$15.99,,4.5,106.0,False,https://m.media-amazon.com/images/I/71KOgo9daJL._AC_UL320_.jpg,https://m.media-amazon.com/images/I/71KOgo9daJL._AC_SL1500_.jpg,,2026-04-18T10:02:55.771216,
35,3,Organic,,125.0,B07CRL2KC9,"Hajoyful Grass Skirt Hawaiian Luau Hula Skirts Party Decorations Favors Supplies Grass Skirts for Adult Elastic Hibiscus Flowers Tropical Skirt, Party, Birthday, Celebration 60CM 12Pack Multicolored",N/A,$22.98,,4.6,1316.0,False,https://m.media-amazon.com/images/I/91bZU2w7XPL._AC_UL320_.jpg,https://m.media-amazon.com/images/I/91bZU2w7XPL._AC_SL1500_.jpg,,2026-04-18T10:02:55.774986,
36,3,Organic,,126.0,B0D1K7VDML,Hello Summer Bulletin Board Decoration Set Summer Theme Bulletin Board Borders Beach Paper Cutouts Summertime Bulletin Boarder for Hello Summer Tropical Theme School Classroom Decor,N/A,$11.99,,5.0,17.0,False,https://m.media-amazon.com/images/I/81rbxBXwxwL._AC_UL320_.jpg,https://m.media-amazon.com/images/I/81rbxBXwxwL._AC_SL1500_.jpg,,2026-04-18T10:02:55.778216,
37,3,Organic,,127.0,B0CRL4LZ3P,16 Pcs Summer Hanging Tree Ornaments Hawaiian Style Ball Decoration Ice Cream Orange Juice Flamingo Sea Seahorse Style Ball for Summer Spring Holiday Party Tree July Decor(Beach),N/A,$15.99,,4.1,73.0,False,https://m.media-amazon.com/images/I/81yEb-rqXvL._AC_UL320_.jpg,https://m.media-amazon.com/images/I/81yEb-rqXvL._AC_SL1500_.jpg,,2026-04-18T10:02:55.781590,
38,3,Organic,,128.0,B09WQN12D9,Whaline 9 Sheets Hello Summer Window Clings Sun Pool Beach Window Decals Drinks Ice Cream Flip Flops Double-Sided Stickers for Summer Pool Party Supplies School Home Office Decorations,N/A,$7.99,,4.6,127.0,False,https://m.media-amazon.com/images/I/81nMEmpp+2L._AC_UL320_.jpg,https://m.media-amazon.com/images/I/81nMEmpp+2L._AC_SL1500_.jpg,,2026-04-18T10:02:55.784928,
39,3,Organic,,129.0,B0D2TQF1SQ,"JCFIRE Summer Pool Beach Party Favors Kids Tattoos, 102 Styles Larger Tropical Hawaiian Luau Themed Temporary Tattoos for Kids Teens Adult, Waterproof Summer Stickers Party Decorations Supplies",N/A,$5.99,,4.7,923.0,False,https://m.media-amazon.com/images/I/71KUi4pTJkL._AC_UL320_.jpg,https://m.media-amazon.com/images/I/71KUi4pTJkL._AC_SL1500_.jpg,,2026-04-18T10:02:55.788605,
40,3,Organic,,130.0,B083B5YW71,"JOYIN 43"" Inflatable Cactus Cooler with Sombrero Hat for Fiesta, Cinco de Mayo Party Supplies, Inflatable Party Cooler, Pool Party Decoration",N/A,$19.99,,4.6,986.0,False,https://m.media-amazon.com/images/I/71FlDC+by3L._AC_UL320_.jpg,https://m.media-amazon.com/images/I/71FlDC+by3L._AC_SL1500_.jpg,,2026-04-18T10:02:55.791688,
41,3,Organic,,131.0,B0F29LHPXS,"96 PCS Hello Summer Beach Pool Hawaiian Pre-Cut Temporary Tattoos for Kids | Super Cute Themed Birthday Party Favors, Supplies, Decorations, Fake Tattoo Stickers (Multiple)",N/A,$7.19,,4.6,50.0,False,https://m.media-amazon.com/images/I/81zvrwTnkHL._AC_UL320_.jpg,https://m.media-amazon.com/images/I/81zvrwTnkHL._AC_SL1500_.jpg,,2026-04-18T10:02:55.795824,
42,3,Organic,,132.0,B0CT7FZZNX,"GEEORY Hello Summer Pillow Covers 18x18 Inch Set of 4, Popsicles Flamingo Swim Ring Pool Party Sweet Summer Time Farmhouse Decorative Throw Pillowcases for Home Sofa Couch Decoration G525-18",N/A,$12.99,,4.7,105.0,False,https://m.media-amazon.com/images/I/61rkaFECkTL._AC_UL320_.jpg,https://m.media-amazon.com/images/I/61rkaFECkTL._AC_SL1500_.jpg,,2026-04-18T10:02:55.803268,
43,3,Organic,,133.0,B0C3W1XF57,Maitys 36 Pcs Spring Flower Ornaments for Tree Hawaiian Wooden Flower Decorate Wooden Hibiscus Daisy Hanging Decor for Birthday Wedding Baby Shower Themed Summer Holiday Party Decoration (Daisy),N/A,$16.59,,4.2,331.0,False,https://m.media-amazon.com/images/I/81Zm9u0UfrL._AC_UL320_.jpg,https://m.media-amazon.com/images/I/81Zm9u0UfrL._AC_SL1500_.jpg,,2026-04-18T10:02:55.808376,
44,3,Organic,,134.0,B0C6JNRGK1,Sintuff 6 Pcs Lemon Decorations Lemon Gnome Wooden Table Centerpiece Hello Summer Lemonade Wood Sign for Table Farmhouse Kitchen Summer Lemon Theme Party Table Tiered Tray Decor,N/A,$13.99,,4.7,36.0,False,https://m.media-amazon.com/images/I/816vdlMq9AL._AC_UL320_.jpg,https://m.media-amazon.com/images/I/816vdlMq9AL._AC_SL1500_.jpg,,2026-04-18T10:02:55.811695,
45,3,Organic,,135.0,B0BZ4LPRFH,"AVOIN colorlife Sunflower Spring Summer Garden Flag 12x18 Inch Double Sided Outside, With God All Things Are Possible Floral Yard Outdoor Decoration",N/A,$6.99,,4.8,463.0,False,https://m.media-amazon.com/images/I/810ZIyCgwmL._AC_UL320_.jpg,https://m.media-amazon.com/images/I/810ZIyCgwmL._AC_SL1500_.jpg,,2026-04-18T10:02:55.816992,
46,3,Organic,,136.0,B0B2JZMQBR,"30 Pcs Flowers Butterfly Hanging Swirl Decorations, Spring Summer Mother's Day Sunflower Baby Shower Decor for Women Home Birthday Party Baby Shower Wedding Supplies(Flower and Butterfly)",N/A,$9.99,,4.6,507.0,False,https://m.media-amazon.com/images/I/81FfY1fFBHL._AC_UL320_.jpg,https://m.media-amazon.com/images/I/81FfY1fFBHL._AC_SL1500_.jpg,,2026-04-18T10:02:55.820862,
47,3,Organic,,137.0,B0BPLB7GVR,"Artoid Mode Yellow Flowers Bee Hello Sunshine Spring Kitchen Towels Dish Towels, 18x26 Inch Summer Holiday Decoration Hand Towels Set of 2",N/A,$13.99,,4.1,363.0,False,https://m.media-amazon.com/images/I/61mnCkVZfsL._AC_UL320_.jpg,https://m.media-amazon.com/images/I/61mnCkVZfsL._AC_SL1500_.jpg,,2026-04-18T10:02:55.825027,
48,3,Organic,,138.0,B0BTDHRYT8,"36 Count Hawaiian Lei Bulk, Tropical Luau Hawaii Theme Silk Flower Lei, Party Favors for Beach Holiday Wedding Birthday Party, Aloha Summer Party Decorations",N/A,$9.98,,4.4,1265.0,False,https://m.media-amazon.com/images/I/91dq-UYMKiL._AC_UL320_.jpg,https://m.media-amazon.com/images/I/91dq-UYMKiL._AC_SL1500_.jpg,,2026-04-18T10:02:55.828396,
49,3,Organic,,139.0,B09P5XRB53,Joanlody Blue Cheesecloth Table Runner Spring Summer 10Ft Rustic Gauze Boho Cheese Cloth Table Runner for Wedding Bridal Baby Shower Decoration,N/A,$7.99,,4.7,1260.0,False,https://m.media-amazon.com/images/I/81snfxGPkWL._AC_UL320_.jpg,https://m.media-amazon.com/images/I/81snfxGPkWL._AC_SL1500_.jpg,,2026-04-18T10:02:55.833580,
50,3,Organic,,140.0,B0DX787DSG,Outus 16 Pcs Summer Tree Ornaments Ball Hawaiian Style Ball Decoration for Tree for Summer Watermelon Tropical Leaf Coconut Palm Farmhouse Home Fireplace Holiday Party Favors Decor,N/A,$18.99,,3.9,386.0,False,https://m.media-amazon.com/images/I/81ElWbsjHoL._AC_UL320_.jpg,https://m.media-amazon.com/images/I/81ElWbsjHoL._AC_SL1500_.jpg,,2026-04-18T10:02:55.837218,
51,3,Organic,,141.0,B0GBWZPW9K,"FUTBU Summer Throw Pillow Covers 18x18 Inch Set of 4, Popsicles Flamingo Sweet Summer Time Farmhouse Cushion Case, Swim Ring Pool Party Holiday Decoration for Sofa Couch",N/A,$12.39,,4.8,282.0,False,https://m.media-amazon.com/images/I/71sephuCFqL._AC_UL320_.jpg,https://m.media-amazon.com/images/I/71sephuCFqL._AC_SL1500_.jpg,,2026-04-18T10:02:55.841656,
52,3,Organic,,142.0,B0GCM3FPNM,"50 LED 25ft Summer Hawaiian Beach String Lights Outdoor with Remote, Flamingo Pineapple Palm Tree Fairy Twinkle Lights Battery Operated with 8 Modes & Timer for Tropical Party Beach Pool Decorations",N/A,$16.19,,4.4,334.0,False,https://m.media-amazon.com/images/I/71IaC6j30YL._AC_UL320_.jpg,https://m.media-amazon.com/images/I/71IaC6j30YL._AC_SL1500_.jpg,,2026-04-18T10:02:55.845898,
53,3,Organic,,143.0,B0CXCJGGRQ,3 Pcs Summer Tiered Tray Decorations Set Watermelon Wood Table Signs Tabletop Farmhouse Summer Table Decor Hello Summer Decorations for Party Office Home Bedroom Kitchen(Watermelon),N/A,$9.99,,4.4,52.0,False,https://m.media-amazon.com/images/I/71dtWTh8YsL._AC_UL320_.jpg,https://m.media-amazon.com/images/I/71dtWTh8YsL._AC_SL1500_.jpg,,2026-04-18T10:02:55.850459,
54,3,Organic,,144.0,B0DTPZ743W,Summer Party Decorations Hello Summer Banner Beach Hanging Swirls Streamers Beach Pool Theme Decorations for Home School Classroom Office Pool Holiday Party Supplies,N/A,$11.99,,4.4,18.0,False,https://m.media-amazon.com/images/I/81PV7tdUOUL._AC_UL320_.jpg,https://m.media-amazon.com/images/I/81PV7tdUOUL._AC_SL1500_.jpg,,2026-04-18T10:02:55.854239,
56,3,Title,,,,"Debug info copied.Sponsored12 Pcs Tulip Honeycomb Decorations, Spring Decorations for Office, Table ",,,,,,False,,,,2026-04-18T10:02:55.855186,
57,3,Title,,,,Related searchessummer party decorationssummer decorations for officesummer decorations for homesumm,,,,,,False,,,,2026-04-18T10:02:55.855986,
58,3,Title,,,,Previous1234...7Next,,,,,,False,,,,2026-04-18T10:02:55.856325,
59,3,SB,5.0,,,N/A,https://aax-us-east-retail-direct.amazon.com/x/c/JNaHPs1KdJpSeje37fuj8GQAAAGdoAsOlwEAAAH2AQBvbm9fdHhuX2JpZDEgICBvbm9fdHhuX2ltcDEgICBOZWaY/clv1c_ek-wxPHXFbbWDfHXL5sAvQuvcRxOLvvnKHNBSzC-P6NhMWPUUOVEsAtQ09jeHBsWBYjlmlcLsogAdGVzAWcCh8N_zP4RxAJ222hyCi3os8kHi3FnIbILk9SeoX1yluphd4Ja_fEKKnNjacOSrgMIG7OBad2FnvXqlcJgxSaWwKZOWOgTBBQrfhO0CbwdAHOhhrXpxYrAmAbF6ejVh1FQc-z1V80dh846OE5UvrPTUM3PtXdJZjQ5iRaJcA2Jl3hbn6SfO0PfmN5J3X2oCGvVfzEq6texGFPBOVofeLVO7_6qL0g3OjV8n6hlOuY8AJ7_JGHdzZByIUKqjDX5CE8GX_xerP2-PgVhKDR52HulGp-46oFlMLsJuNs5OSPMLw1_Yu7sn-vE3a8vhVRyCTeaVGxBkQowbdIFtzYNDPWqyTHSXYFYcRrQuA0YyFORBmW2F3R5H-ETZjcCzQOXtAwsQfB50k-Cv4x94DEaVH6ODgobVzACIZVqCK1vX51wPM5mihwW-W7inCkKmMmvq5fWFp4_1V6fskBpuEqUDWY2E1uIUAUNfZilh6WQT-GEP0lW5Jja6SsPJCfLphNfHnBE0qaDDqPO3fJvnxQj-2xCvd8qwFb6V7QXQZwFir4TrxzxiCpw7UuMHR8DgW0vyIDmq2lqs5UHBwYKTt7K-dusttyzSAvnNRME2Qgb7R0v1KlVCE4ukggv6fB6awdAiOvEvQaV-1ah61HvkwrDmNCESWmF1vzHkSIb79uAgDfBZ3jQiPY4Ed69NwLEXTICKfClf9sFj2WC1ovrpkAjs9X30cz3xhOqoXrVC6B1Dy3zlE_x-aFRgy9kk_FssbY9KP2_SJujaqqVYoQnFAfBW5Wm0CS_Eg5Ho5ziiIbOiu17th_WncNS8cKDu8WEfbMVpKBoh8dbiVA1CyamkFhiE_-FqNJxdAdgvAq7Yf0BzS-LIqXPz88WtLiBfv5lTYtEbvjBzAGfEHx_Gb_AOUfgZsAfrJPay-Zn9QGtNep-5mErdShL-tJXRXuSdCfu6wHPJ5wlb2tVaMKLV83YHrDCbX9OhoxlXjX3tImjjBucseyQTBfgF5ZkMl9BQJfi-P1RVQm8SCd-BQ68_ObNpthbzJhRs559R2xcACWUV40UKEYUqXaPl8tnpXAoQZCHXgy75tx-FsGBBr_FGP0iVpfkUvpFbuvLDXnQnW5sZc3LfLaINvOtDbugwWI0Miu70YiLbyE8whwtAGglaA2XNtjxV_QQUwBoJdMH5Jiilne0TTg173UTwNLiFFH15-NWO64QUkI3WLQDn04hqRC_qQJlPFZ4VarL2wRzkXby53ykGs9N-Z3bP7LtWtD8ZnDmDUXZoMs6VSUTEFuJnPdTfsiih3lWmNa3e6c2TS7JtsjmbWBH1i-Ve29mF9qOu4KIfEFfojF3f3DzujYTA8oMcOjtukUWf__DZjBLp4W2FuSP3mRZ9-uJhFxyXslt3bilWTVnfinTw8UommnJcif69n7geVkftsBApahtJKHrMgaFmq0hWWhv7f-pN3JHTVlsuUULNgiuV_GpSZH_mmQH943YkGIjevMbyD7H3P2c9ocVlvCQrNGYM1T9YDutyW-nNiMCg4r-qzbwy2iMZCSnfs6iR7qWU9r8SLAbq6WMI0ZdPGlxXhwlrufUKHRfVT-HKNoa-pf88R0-2bc_L5-BNPxPVIsXY3g0/https://www.amazon.com/stores/page/A77B4514-D850-44CD-8791-8BC9DB196E34/?_encoding=UTF8&store_ref=SB_A04069161GHA6AWPS10EB-A04224281RWNFCXSIWN0&pd_rd_plhdr=t&aaxitk=959480831cac39e8a775cbb632a0d632&hsa_cr_id=0&lp_asins=B0G1B93MR4%2CB0D6FYS4SC%2CB0G1B7BB5P&lp_query=summer%20decorations&lp_slot=desktop-hsa-3psl&ref_=sbx_be_s_3psl_mbd_mb0_bkgd&pd_rd_w=HbG8J&content-id=amzn1.sym.cd7c548b-a599-426f-9ffe-daa1aa803c87%3Aamzn1.sym.cd7c548b-a599-426f-9ffe-daa1aa803c87&pf_rd_p=cd7c548b-a599-426f-9ffe-daa1aa803c87&pf_rd_r=VTJC4YG94VSN9E422JZG&pd_rd_wg=XWUtm&pd_rd_r=f18aee58-33c5-470d-a8b8-1c9695637f78,,,,,False,,,N/A,2026-04-18T10:02:55.860176,
60,3,Title,,,,Need help?Visit the help sectionorcontact us,,,,,,False,,,,2026-04-18T10:02:55.860764,
0,4,SB_Video,2.0,,,N/A,N/A,,,,,False,,,,2026-04-18T10:03:13.419074,1.0
1,4,Title,,,,ResultsCheck each product page for other buying options. Price and other details may vary based on p,,,,,,False,,,,2026-04-18T10:03:13.420462,
3,4,Organic,,145.0,B087794HBV,Boao 8 Pieces Flip Flop Decorations 52 Feet Summer Hanging Banner Beach Slipper Garland for Hawaiian Party Birthday Baby Shower Supplies,N/A,$9.99,,4.6,186.0,False,https://m.media-amazon.com/images/I/71E-4U-F1iL._AC_UL320_.jpg,https://m.media-amazon.com/images/I/71E-4U-F1iL._AC_SL1500_.jpg,,2026-04-18T10:03:13.426319,
4,4,Organic,,146.0,B083B5YW71,"JOYIN 43"" Inflatable Cactus Cooler with Sombrero Hat for Fiesta, Cinco de Mayo Party Supplies, Inflatable Party Cooler, Pool Party Decoration",N/A,$19.99,,4.6,986.0,False,https://m.media-amazon.com/images/I/71FlDC+by3L._AC_UL320_.jpg,https://m.media-amazon.com/images/I/71FlDC+by3L._AC_SL1500_.jpg,,2026-04-18T10:03:13.430761,
5,4,Organic,,147.0,B0C6JNRGK1,Sintuff 6 Pcs Lemon Decorations Lemon Gnome Wooden Table Centerpiece Hello Summer Lemonade Wood Sign for Table Farmhouse Kitchen Summer Lemon Theme Party Table Tiered Tray Decor,N/A,$13.99,,4.7,36.0,False,https://m.media-amazon.com/images/I/816vdlMq9AL._AC_UL320_.jpg,https://m.media-amazon.com/images/I/816vdlMq9AL._AC_SL1500_.jpg,,2026-04-18T10:03:13.434989,
6,4,Title,,,,Colorful Rainbow Beach BallsSponsored|Top 10 best-selling brand in this category|Shop JOYINShop nowP,,,,,,False,,,,2026-04-18T10:03:13.437097,
7,4,Title,,,,More results,,,,,,False,,,,2026-04-18T10:03:13.437339,
8,4,Organic,,148.0,B0BYS89VRF,Geelin 36 Pcs Summer Wood Hanging Ornaments for Tree Mini Tree Decorations Hawaiian Beach Wooden Pendant Decorations with String for Luau Party Supplies(Cute Style),N/A,$11.99,,4.5,304.0,False,https://m.media-amazon.com/images/I/81swIFYCsRL._AC_UL320_.jpg,https://m.media-amazon.com/images/I/81swIFYCsRL._AC_SL1500_.jpg,,2026-04-18T10:03:13.441353,
9,4,Organic,,149.0,B0DWF6PPN3,12Pcs School's out for Summer Party Honeycomb Centerpieces End of School Year Table Decorations Tropical Tables Honeycombs Ball for Schools Classroom Summers Vacation Celebration Decor,N/A,$11.99,,5.0,4.0,False,https://m.media-amazon.com/images/I/81b0GEXE5xL._AC_UL320_.jpg,https://m.media-amazon.com/images/I/81b0GEXE5xL._AC_SL1500_.jpg,,2026-04-18T10:03:13.445942,
10,4,Organic,,150.0,B0FJLRC7VD,Roowest Hello Summer Metal Sign Rustic Summer Table Top Decor Centerpiece Holiday Tiered Tray Decoration Word Sign with Wood Base for Home Office Desk Shelf Mantel Fireplace Indoor Beach Party Gift,N/A,$11.99,,4.8,47.0,False,https://m.media-amazon.com/images/I/71EoyrJQb6L._AC_UL320_.jpg,https://m.media-amazon.com/images/I/71EoyrJQb6L._AC_SL1500_.jpg,,2026-04-18T10:03:13.449448,
11,4,Organic,,151.0,B0CRL4LZ3P,16 Pcs Summer Hanging Tree Ornaments Hawaiian Style Ball Decoration Ice Cream Orange Juice Flamingo Sea Seahorse Style Ball for Summer Spring Holiday Party Tree July Decor(Beach),N/A,$15.99,,4.1,73.0,False,https://m.media-amazon.com/images/I/81yEb-rqXvL._AC_UL320_.jpg,https://m.media-amazon.com/images/I/81yEb-rqXvL._AC_SL1500_.jpg,,2026-04-18T10:03:13.454248,
12,4,Organic,,152.0,B0F1FBD2S1,Summer Tree Decorations Hello Summer Wooden Hanging Tree Ornaments 24Pcs Hawaiian Beach Coconut Flamingo Wooden Hanging Ornaments for Indoor Home Mantle Fireplace Party Supplies,N/A,$9.99,,4.3,65.0,False,https://m.media-amazon.com/images/I/71NJ0i9LTiL._AC_UL320_.jpg,https://m.media-amazon.com/images/I/71NJ0i9LTiL._AC_SL1500_.jpg,,2026-04-18T10:03:13.460032,
13,4,Organic,,153.0,B0DX787DSG,Outus 16 Pcs Summer Tree Ornaments Ball Hawaiian Style Ball Decoration for Tree for Summer Watermelon Tropical Leaf Coconut Palm Farmhouse Home Fireplace Holiday Party Favors Decor,N/A,$18.99,,3.9,386.0,False,https://m.media-amazon.com/images/I/81ElWbsjHoL._AC_UL320_.jpg,https://m.media-amazon.com/images/I/81ElWbsjHoL._AC_SL1500_.jpg,,2026-04-18T10:03:13.465712,
14,4,Title,,,,BonBloom's Artificial Sunflower Garland DecorShopBonBloom'sPrevious pageBonBloom's 4 Pack Artificial,,,,,,False,,,,2026-04-18T10:03:13.467922,
15,4,Title,,,,More results,,,,,,False,,,,2026-04-18T10:03:13.468140,
16,4,Organic,,154.0,B0946ZZ9BD,"Outus 30 Pieces Hawaiian Luau Birthday Party Hanging Swirl Decorations, Flower Tropical Palm Flamingo Sign Foil Ceiling Decor for Floral Tropical Party Summer Beach Pool Tiki Supplies(Summer)",N/A,$8.79,,4.6,1154.0,False,https://m.media-amazon.com/images/I/81cwoPntlvL._AC_UL320_.jpg,https://m.media-amazon.com/images/I/81cwoPntlvL._AC_SL1500_.jpg,,2026-04-18T10:03:13.471020,
17,4,Organic,,155.0,B0BZ4LPRFH,"AVOIN colorlife Sunflower Spring Summer Garden Flag 12x18 Inch Double Sided Outside, With God All Things Are Possible Floral Yard Outdoor Decoration",N/A,$6.99,,4.8,463.0,False,https://m.media-amazon.com/images/I/810ZIyCgwmL._AC_UL320_.jpg,https://m.media-amazon.com/images/I/810ZIyCgwmL._AC_SL1500_.jpg,,2026-04-18T10:03:13.476430,
