data_index,page,ad_type,ad_rank,organic_rank,asin,title,url,price_current,price_list,rating_stars,rating_count,is_prime,image_small,image_large,brand_name,scraped_at,inner_products_count
18,4,Organic,,156.0,B0CT7FZZNX,"GEEORY Hello Summer Pillow Covers 18x18 Inch Set of 4, Popsicles Flamingo Swim Ring Pool Party Sweet Summer Time Farmhouse Decorative Throw Pillowcases for Home Sofa Couch Decoration G525-18",N/A,$12.99,,4.7,105.0,False,https://m.media-amazon.com/images/I/61rkaFECkTL._AC_UL320_.jpg,https://m.media-amazon.com/images/I/61rkaFECkTL._AC_SL1500_.jpg,,2026-04-18T10:03:13.483965,
19,4,Organic,,157.0,B0GJSG3ZW4,"Summer Bulletin Board Decorations Set, Summer Ice Pop Classroom Decorations, Colorful Popsicle Paper Cutouts, for School Classroom Home Party Supplies",N/A,$8.99,,5.0,2.0,False,https://m.media-amazon.com/images/I/81bfd0+RamL._AC_UL320_.jpg,https://m.media-amazon.com/images/I/81bfd0+RamL._AC_SL1500_.jpg,,2026-04-18T10:03:13.487177,
20,4,Organic,,158.0,B0DT6X8QP2,"Summer Pool Beach Party Decorations, Splash Birthday Bash Party Supplies Tropical Summer Banner Beach Ball Lantern Fringe Curtain Foil Balloons Arch for Swimming Water Luau Hawaiian Party Decor(Blue)",N/A,$18.99,,4.4,301.0,False,https://m.media-amazon.com/images/I/81BUSERqr5L._AC_UL320_.jpg,https://m.media-amazon.com/images/I/81BUSERqr5L._AC_SL1500_.jpg,,2026-04-18T10:03:13.490451,
21,4,Organic,,159.0,B0GBWZPW9K,"FUTBU Summer Throw Pillow Covers 18x18 Inch Set of 4, Popsicles Flamingo Sweet Summer Time Farmhouse Cushion Case, Swim Ring Pool Party Holiday Decoration for Sofa Couch",N/A,$12.39,,4.8,282.0,False,https://m.media-amazon.com/images/I/71sephuCFqL._AC_UL320_.jpg,https://m.media-amazon.com/images/I/71sephuCFqL._AC_SL1500_.jpg,,2026-04-18T10:03:13.495087,
22,4,Organic,,160.0,B0GCFP61SJ,"Smile Summer Indoor Decorations Wooden Decor, Sunflower Gnome, Sign for Home Tabletop Centerpiece Mantel Shelf Fireplace",N/A,$8.99,,4.5,78.0,False,https://m.media-amazon.com/images/I/71xGsvIkWxL._AC_UL320_.jpg,https://m.media-amazon.com/images/I/71xGsvIkWxL._AC_SL1500_.jpg,,2026-04-18T10:03:13.498456,
23,4,Organic,,161.0,B0DRBWLBJV,3 Pcs Spring Table Decorations Tulip Wooden Set Tabletop Farmhouse Spring Tiered Tray Decor Hello Spring Decorations for Home (Tulip),N/A,$15.99,,4.5,31.0,False,https://m.media-amazon.com/images/I/71-2XpsIZWL._AC_UL320_.jpg,https://m.media-amazon.com/images/I/71-2XpsIZWL._AC_SL1500_.jpg,,2026-04-18T10:03:13.501640,
24,4,Organic,,162.0,B0C3W1XF57,Maitys 36 Pcs Spring Flower Ornaments for Tree Hawaiian Wooden Flower Decorate Wooden Hibiscus Daisy Hanging Decor for Birthday Wedding Baby Shower Themed Summer Holiday Party Decoration (Daisy),N/A,$16.59,,4.2,331.0,False,https://m.media-amazon.com/images/I/81Zm9u0UfrL._AC_UL320_.jpg,https://m.media-amazon.com/images/I/81Zm9u0UfrL._AC_SL1500_.jpg,,2026-04-18T10:03:13.505028,
25,4,Organic,,163.0,B0BTSX97F4,"Summer Tiered Tray Decor, Farmhouse Watermelon Tray Decorations, Hello Summer Sweet Watermelon Gnome Wooden Signs, Rustic Summer Home Decor for Table Mantel Office Holiday Party",N/A,$13.99,,4.4,92.0,False,https://m.media-amazon.com/images/I/71-LZZI7EkL._AC_UL320_.jpg,https://m.media-amazon.com/images/I/71-LZZI7EkL._AC_SL1500_.jpg,,2026-04-18T10:03:13.509101,
26,4,Organic,,164.0,B0CRR4VVD9,"Artoid Mode Ice Cream Watermelon Happy Summer Kitchen Towels Dish Towels, 18x26 Inch Seasonal Summer Decoration Hand Towels Set of 2",N/A,$11.99,,4.3,16.0,False,https://m.media-amazon.com/images/I/617Jz333FfL._AC_UL320_.jpg,https://m.media-amazon.com/images/I/617Jz333FfL._AC_SL1500_.jpg,,2026-04-18T10:03:13.511961,
27,4,Organic,,165.0,B09WQN12D9,Whaline 9 Sheets Hello Summer Window Clings Sun Pool Beach Window Decals Drinks Ice Cream Flip Flops Double-Sided Stickers for Summer Pool Party Supplies School Home Office Decorations,N/A,$7.99,,4.6,127.0,False,https://m.media-amazon.com/images/I/81nMEmpp+2L._AC_UL320_.jpg,https://m.media-amazon.com/images/I/81nMEmpp+2L._AC_SL1500_.jpg,,2026-04-18T10:03:13.515401,
28,4,Organic,,166.0,B0G7X1P64Y,16Pcs Summer Party Decorations Paper Lanterns Pom Poms Hanging Swirls - Luau Beach Pool Hawaiian Tropical Hanging Decor for Home Birthday Outdoor Indoor,N/A,$15.99,,4.9,16.0,False,https://m.media-amazon.com/images/I/81X2FLgG9rL._AC_UL320_.jpg,https://m.media-amazon.com/images/I/81X2FLgG9rL._AC_SL1500_.jpg,,2026-04-18T10:03:13.518785,
29,4,Organic,,167.0,B0FVWW9M8Y,"Valery Madelyn 30ct Summer Tree Ornaments Christmas in July Decorations, Coastal Beach Ocean Theme Set with Flamingo, Gnome, Avocado, Lemon & Palm Tree. Shatterproof Balls for Hawaiian Tropical Party",N/A,$15.99,,4.7,10.0,False,https://m.media-amazon.com/images/I/91W+NgKlzEL._AC_UL320_.jpg,https://m.media-amazon.com/images/I/91W+NgKlzEL._AC_SL1500_.jpg,,2026-04-18T10:03:13.521827,
30,4,Organic,,168.0,B09VZCC81P,Summer Door Wreath Flip Flop Hanging Sign Ice Lolly Welcome Sign Rustic Wood Wreath for Front Door Outside Summer Home Decorations 25 x 15 Inch,N/A,$15.99,,4.5,187.0,False,https://m.media-amazon.com/images/I/8112LidcNQL._AC_UL320_.jpg,https://m.media-amazon.com/images/I/8112LidcNQL._AC_SL1500_.jpg,,2026-04-18T10:03:13.526452,
31,4,Organic,,169.0,B0F29LHPXS,"96 PCS Hello Summer Beach Pool Hawaiian Pre-Cut Temporary Tattoos for Kids | Super Cute Themed Birthday Party Favors, Supplies, Decorations, Fake Tattoo Stickers (Multiple)",N/A,$7.19,,4.6,50.0,False,https://m.media-amazon.com/images/I/81zvrwTnkHL._AC_UL320_.jpg,https://m.media-amazon.com/images/I/81zvrwTnkHL._AC_SL1500_.jpg,,2026-04-18T10:03:13.530511,
32,4,Organic,,170.0,B0BYDNVSK1,"AVOIN colorlife Summer Polka Dot Bee Welcome Garden Flag 12x18 Inch Double Sided Outside, Seasonal Holiday Burlap Yard Outdoor Decoration",N/A,$6.99,,4.8,384.0,False,https://m.media-amazon.com/images/I/71UheEzIY7L._AC_UL320_.jpg,https://m.media-amazon.com/images/I/71UheEzIY7L._AC_SL1500_.jpg,,2026-04-18T10:03:13.536044,
33,4,Organic,,171.0,B07CRL2KC9,"Hajoyful Grass Skirt Hawaiian Luau Hula Skirts Party Decorations Favors Supplies Grass Skirts for Adult Elastic Hibiscus Flowers Tropical Skirt, Party, Birthday, Celebration 60CM 12Pack Multicolored",N/A,$22.98,,4.6,1316.0,False,https://m.media-amazon.com/images/I/91bZU2w7XPL._AC_UL320_.jpg,https://m.media-amazon.com/images/I/91bZU2w7XPL._AC_SL1500_.jpg,,2026-04-18T10:03:13.540631,
34,4,Organic,,172.0,B0F4WL7RV7,Summer Bulletin Board Classroom Decorations Floating into Summer Paper Cutouts Swim Ring DIY Photo Craft Set Hawaiian Theme Tropical Bulletin Board Borders for Back to School Office Teacher Supplies,N/A,$13.99,,4.3,15.0,False,https://m.media-amazon.com/images/I/81hAOPY2gBL._AC_UL320_.jpg,https://m.media-amazon.com/images/I/81hAOPY2gBL._AC_SL1500_.jpg,,2026-04-18T10:03:13.544072,
35,4,Organic,,173.0,B0DTPZ743W,Summer Party Decorations Hello Summer Banner Beach Hanging Swirls Streamers Beach Pool Theme Decorations for Home School Classroom Office Pool Holiday Party Supplies,N/A,$11.99,,4.4,18.0,False,https://m.media-amazon.com/images/I/81PV7tdUOUL._AC_UL320_.jpg,https://m.media-amazon.com/images/I/81PV7tdUOUL._AC_SL1500_.jpg,,2026-04-18T10:03:13.547673,
36,4,Organic,,174.0,B09P5XRB53,Joanlody Blue Cheesecloth Table Runner Spring Summer 10Ft Rustic Gauze Boho Cheese Cloth Table Runner for Wedding Bridal Baby Shower Decoration,N/A,$7.99,,4.7,1260.0,False,https://m.media-amazon.com/images/I/81snfxGPkWL._AC_UL320_.jpg,https://m.media-amazon.com/images/I/81snfxGPkWL._AC_SL1500_.jpg,,2026-04-18T10:03:13.553122,
37,4,Organic,,175.0,B0D1K7VDML,Hello Summer Bulletin Board Decoration Set Summer Theme Bulletin Board Borders Beach Paper Cutouts Summertime Bulletin Boarder for Hello Summer Tropical Theme School Classroom Decor,N/A,$11.99,,5.0,17.0,False,https://m.media-amazon.com/images/I/81rbxBXwxwL._AC_UL320_.jpg,https://m.media-amazon.com/images/I/81rbxBXwxwL._AC_SL1500_.jpg,,2026-04-18T10:03:13.556885,
38,4,Organic,,176.0,B0CWQKCTTN,Glittery Peace Out School Hello Summer Banner with Sun Palm Tree Colorful End of School Year Fireplace Wall Garland Last Day of School Summer Vacation Beach Pool Party Decorations,N/A,$9.99,,4.6,9.0,False,https://m.media-amazon.com/images/I/61hTGeJ6aZL._AC_UL320_.jpg,https://m.media-amazon.com/images/I/61hTGeJ6aZL._AC_SL1500_.jpg,,2026-04-18T10:03:13.560378,
39,4,Organic,,177.0,B0GFVBV9W7,"WDS WONDROUS Ice Cream Cone 2Pcs, Summer Gnomes Figurines Decor, Brown Resin Dessert Statues, Fake Ice Cream Cone Small Gnomes for Home, Sweet Treat Tabletop Decorations Gifts for Women",N/A,$18.99,,4.8,5.0,False,https://m.media-amazon.com/images/I/71A5OTlLFkL._AC_UL320_.jpg,https://m.media-amazon.com/images/I/71A5OTlLFkL._AC_SL1500_.jpg,,2026-04-18T10:03:13.563866,
40,4,Organic,,178.0,B0CXCJGGRQ,3 Pcs Summer Tiered Tray Decorations Set Watermelon Wood Table Signs Tabletop Farmhouse Summer Table Decor Hello Summer Decorations for Party Office Home Bedroom Kitchen(Watermelon),N/A,$9.99,,4.4,52.0,False,https://m.media-amazon.com/images/I/71dtWTh8YsL._AC_UL320_.jpg,https://m.media-amazon.com/images/I/71dtWTh8YsL._AC_SL1500_.jpg,,2026-04-18T10:03:13.567573,
41,4,Organic,,179.0,B0CYP8FF1J,10 x 8 Inch Wood Summer Tree Topper with LED Light Summer Tree top Ornaments for Luau Party Hawaiian Decorations Tabletop Display Supplies,N/A,$20.99,,4.6,39.0,False,https://m.media-amazon.com/images/I/71N6ek00EcL._AC_UL320_.jpg,https://m.media-amazon.com/images/I/71N6ek00EcL._AC_SL1500_.jpg,,2026-04-18T10:03:13.572915,
42,4,Organic,,180.0,B0FS366JXW,"xo, Fetti Summer Party Streamers - 5 Crepe Paper Rolls | Pink, Blue, Green, Orange, Pool Birthday Decorations, Island Bachelorette Decor, Tropical Luau, Beach Hawaiian Theme",N/A,$10.99,,5.0,1.0,False,https://m.media-amazon.com/images/I/51oJ9eT6B2L._AC_UL320_.jpg,https://m.media-amazon.com/images/I/51oJ9eT6B2L._AC_SL1500_.jpg,,2026-04-18T10:03:13.579787,
43,4,Organic,,181.0,B0B2JZMQBR,"30 Pcs Flowers Butterfly Hanging Swirl Decorations, Spring Summer Mother's Day Sunflower Baby Shower Decor for Women Home Birthday Party Baby Shower Wedding Supplies(Flower and Butterfly)",N/A,$9.99,,4.6,507.0,False,https://m.media-amazon.com/images/I/81FfY1fFBHL._AC_UL320_.jpg,https://m.media-amazon.com/images/I/81FfY1fFBHL._AC_SL1500_.jpg,,2026-04-18T10:03:13.584917,
44,4,Organic,,182.0,B0F5NTPJYC,"Summer Party Decorations, Beach Party Decor Includes Hello Summer Banner Beach Hanging Swirls and Garland, Summer Decorations for Office Classroom, Pool Decorations",N/A,$11.99,,4.7,12.0,False,https://m.media-amazon.com/images/I/81U1mq6OQ+L._AC_UL320_.jpg,https://m.media-amazon.com/images/I/81U1mq6OQ+L._AC_SL1500_.jpg,,2026-04-18T10:03:13.591558,
45,4,Organic,,183.0,B0CWRPX4RD,"AVOIN colorlife Summer Beach Flip-flop Garden Flag 12x18 Inch Double Sided, Welcome Seasonal Holiday Burlap Yard Outdoor Decoration",N/A,$8.99,,4.8,115.0,False,https://m.media-amazon.com/images/I/71bTwbLlICL._AC_UL320_.jpg,https://m.media-amazon.com/images/I/71bTwbLlICL._AC_SL1500_.jpg,,2026-04-18T10:03:13.598595,
46,4,Organic,,184.0,B0D2TQF1SQ,"JCFIRE Summer Pool Beach Party Favors Kids Tattoos, 102 Styles Larger Tropical Hawaiian Luau Themed Temporary Tattoos for Kids Teens Adult, Waterproof Summer Stickers Party Decorations Supplies",N/A,$5.99,,4.7,923.0,False,https://m.media-amazon.com/images/I/71KUi4pTJkL._AC_UL320_.jpg,https://m.media-amazon.com/images/I/71KUi4pTJkL._AC_SL1500_.jpg,,2026-04-18T10:03:13.602708,
47,4,Organic,,185.0,B0C1ND9MDN,Whaline 48Pcs Ice Pops Cutouts Colorful Summer Ice Lolly Party Decor Back to School Classroom Bulletin Board Cut-Outs with Glue Points for School Office DIY Projects,N/A,$9.69,,4.7,59.0,False,https://m.media-amazon.com/images/I/61HZ6Yjx2UL._AC_UL320_.jpg,https://m.media-amazon.com/images/I/61HZ6Yjx2UL._AC_SL1500_.jpg,,2026-04-18T10:03:13.606321,
48,4,Organic,,186.0,B0F38FYCC6,Yousoontic 3 Pcs Summer Table Block Signs Tropical Watermelon Flamingo Centerpiece Hello Summer Hawaiian Decorations for Tiered Tray Decor Home Office Kitchen Mantel Shelf Indoor (Tropical),N/A,$12.99,,3.9,17.0,False,https://m.media-amazon.com/images/I/81M90aTIftL._AC_UL320_.jpg,https://m.media-amazon.com/images/I/81M90aTIftL._AC_SL1500_.jpg,,2026-04-18T10:03:13.609680,
49,4,Organic,,187.0,B0D298R6F3,Summer Birthday Party Decorations - Beach Party Pool Decor 10PCS Hanging Swirl Banner Flip Flop Slippers Swirls Summer Birthday Hawaiian Supplies for Holiday Celebration Outdoor,N/A,$9.99,,4.5,46.0,False,https://m.media-amazon.com/images/I/81S+FcCVIcL._AC_UL320_.jpg,https://m.media-amazon.com/images/I/81S+FcCVIcL._AC_SL1500_.jpg,,2026-04-18T10:03:13.613022,
50,4,Organic,,188.0,B0G82VM9N7,"xo, Fetti Hot Dog Banner | Cookout Party, BBQ Decor, Summer Party, July 4th, Kids Party, Funny",N/A,$11.99,,,,False,https://m.media-amazon.com/images/I/71d6ZJ7bQNL._AC_UL320_.jpg,https://m.media-amazon.com/images/I/71d6ZJ7bQNL._AC_SL1500_.jpg,,2026-04-18T10:03:13.616452,
51,4,Organic,,189.0,B0F1Z58MLQ,Summer Bulletin Board Decoration Set Tropical Palm May Bulletin Board Border Aloha Summer Cutouts Hawaiian Luau Holiday Party Decoration for Classroom Window Door Wall Home Office School 80Pcs,N/A,$8.99,,4.6,62.0,False,https://m.media-amazon.com/images/I/81V8pjQU3SL._AC_UL320_.jpg,https://m.media-amazon.com/images/I/81V8pjQU3SL._AC_SL1500_.jpg,,2026-04-18T10:03:13.619714,
52,4,Organic,,190.0,B0BTDHRYT8,"36 Count Hawaiian Lei Bulk, Tropical Luau Hawaii Theme Silk Flower Lei, Party Favors for Beach Holiday Wedding Birthday Party, Aloha Summer Party Decorations",N/A,$9.98,,4.4,1265.0,False,https://m.media-amazon.com/images/I/91dq-UYMKiL._AC_UL320_.jpg,https://m.media-amazon.com/images/I/91dq-UYMKiL._AC_SL1500_.jpg,,2026-04-18T10:03:13.622984,
53,4,Organic,,191.0,B0GCM3FPNM,"50 LED 25ft Summer Hawaiian Beach String Lights Outdoor with Remote, Flamingo Pineapple Palm Tree Fairy Twinkle Lights Battery Operated with 8 Modes & Timer for Tropical Party Beach Pool Decorations",N/A,$16.19,,4.4,334.0,False,https://m.media-amazon.com/images/I/71IaC6j30YL._AC_UL320_.jpg,https://m.media-amazon.com/images/I/71IaC6j30YL._AC_SL1500_.jpg,,2026-04-18T10:03:13.626709,
54,4,Organic,,192.0,B0G64RZGGT,"Yousoontic Summer Beach Flip Flop Table Centerpiece Decor - 3D Wooden Slippers Sign with LED Lights, Hawaii Luau Tropical Decor for Home Mantel, Desk & Party",N/A,$16.99,,4.2,60.0,False,https://m.media-amazon.com/images/I/71xQJxcpjYL._AC_UL320_.jpg,https://m.media-amazon.com/images/I/71xQJxcpjYL._AC_SL1500_.jpg,,2026-04-18T10:03:13.630012,
56,4,Title,,,,"Debug info copied.SponsoredOBBOLO 12 Pcs Tulip Honeycomb Decorations, Spring Decorations for Office,",,,,,,False,,,,2026-04-18T10:03:13.630865,
57,4,Title,,,,Related searchessummer party decorationssummer decorations for officesummer decorations for homesumm,,,,,,False,,,,2026-04-18T10:03:13.632013,
58,4,Title,,,,Previous1234567Next,,,,,,False,,,,2026-04-18T10:03:13.632396,
59,4,SB,6.0,,,N/A,https://aax-us-east-retail-direct.amazon.com/x/c/JMmwRR1J5VdbYX4mds1R_CUAAAGdoAtTjAEAAAH2AQBvbm9fdHhuX2JpZDIgICBvbm9fdHhuX2ltcDIgICDw7Vqc/clv1c_ek-wBAf2FbbWzjI3k6d3r1eKjFOCmHGg-DUVFF_2GqaGEofhxQ0cxywPu93QABgWLVM_ybDI8uqrgnG9Af2zUIdAoQwePBQAbTBtBsug1K2yms_tMFr91Qq6YPh8PqKRnBOM_h62wFozHo22MyTkLwCaps_snhXpyIf2wDyiqI4vGOgzpnTqwH9ZvNFcPtBNE-hywHuL3IXOTuron9BW3sGRFRd3LlJo9ado6cqbBvmjD9N7uXonX7B2Ut-WkqXREY8ArGCqn-JopqYTnaL90REeMPCTpkqy7k9YgHY3wmZxqQklc0rtGVy6XSb3zdSBh5zUPyHgudx2YkrS7ASnzDhkDiTFUFALiJe4KWyuQK_HQs8fP2NcYHjxG78rWfbtd7RHV4JjTkIbPgE_Vt_Obm1U6SL8MyDfli53mDPoTtGBObxTZ-XySA1a6YWCEjxi5MmKr2Tv3fVyUOrYKqk9Ky5XnQk3GBr7OXbzVpy46pHkNVRKQCSQROsYepBYnCI4urHg_bIizi1SokUzAXCBPMTgHWzxWuTjWr5dxNa3EWZRq_cCf59xXmKZsOfNwhTDEa_sPKvRlCMgfHRIh_zTX5LNPvNLSROI13I66ejGWTx2jztUqsGRjd7Vt2g9Aca1NT9BMr7V0CkjxvE8UEiTpz4WfJXMRbG7qdEUHStot_zvcLEWplwfskDvBJMh-EV1J-Z7o7_-EiCWBLkJIzwitn3MdRXg13Xv3bZbXeZFrOQjm-TupcOM-z3dQvc4mna94DOVL6DFxWzX72-AAWm0fMDhKN8tahRc8q_5jNElbXZERRzR6hX4I9jExd9rJOuQSNfhBHShN8dcSc7dWa9ebYArz80MtH_1aj9W86mkxrW6FUeBTs0ePlFQ8Ydw1r7xfZyYuD6My5JOwMqmXFLtYfJ7JG-hl8tXZOJwM8A4EQi_hLQCX3YoB_WuYrL_Lw6YhFJNVHJrdXq0t7sNDQ0wGMY5kwlNVgBBkJbnFhvhexzkeNwjcrwbIviF3m4cCFwgwrUHhWryvZpKoqDI3V3bo7RqI-rSnyo_aCbrlVCzkajwhdJunqxVK1VprawD9tXXnO1Mhp9YSlYmAmERSX3XHfhHdrbjzw9YM-fOe9bKd6JuZ7rQkrxoAxIVqVK5JK5V5b6L-1lclw1zGD4gZkQ8tEw8MT4H2XGoddCbMUKBPNu5_YX_VlqLQEcPs8_DrOIE2lkwcdGvW1Ld9W6TskNxoB5ShZTU4S1wNN61GCghjqtkVthGH8UKf3imMNAOcZHM6cdRoIqW7C2s12JeJwvcP7LHtS7QZQ0ELGWLnjxc1qGyBPn2_ICi-NiI3OXr7XOPYiQuOqC0s-ZP114QLfvehG3LxR4GxAfH_fTv9bgcNpFOU6Xz_7cOBihv1pCmpajbp79iUc0_blKcGkG5htDYQVjARwVI_bc5lXArd6VYdkTxU1Kejtbm0k-wpq5G6kWYIGn65gFCJCuze2ruXHcpy5MldeBpaul2xmo4etCb77b57cWDTlvtUBuOK2fdZFaXn-h2CLrL8AealiuwoCjU1lceXaytl4aFwcPYoePP1WxS07u2QC8DW_QvTVw22g72WDeLtFOWfDDRWWlaKMrcaJeOMKxVFg7udU8e76iJa0ylYIg8oJow6IFDIMy1tEiKJrmsyez0LWXHz-KoozfGJeWmIGcWtI0/https://www.amazon.com/stores/page/E08B70A4-705C-43BD-8E6C-DF7897D7FBF3/?_encoding=UTF8&store_ref=SB_A0984150WSDLNQGSK6ZZ-A0402304BG7J43KVHDXH&pd_rd_plhdr=t&aaxitk=f955d63435b4076e6c1067379c9af78b&hsa_cr_id=0&lp_asins=B0FZKB4ZWK%2CB0CSSMVZVX%2CB0CRB4JCT6&lp_query=summer%20decorations&lp_slot=desktop-hsa-3psl&ref_=sbx_be_s_3psl_mbd_mb0_bkgd&pd_rd_w=mVwLV&content-id=amzn1.sym.cd7c548b-a599-426f-9ffe-daa1aa803c87%3Aamzn1.sym.cd7c548b-a599-426f-9ffe-daa1aa803c87&pf_rd_p=cd7c548b-a599-426f-9ffe-daa1aa803c87&pf_rd_r=C58XAY5DY3DJD0NCJZEH&pd_rd_wg=Gw7gf&pd_rd_r=6db4e44d-f6ea-4113-bc1e-478af439ef3e,,,,,False,,,N/A,2026-04-18T10:03:13.636511,
60,4,Title,,,,Need help?Visit the help sectionorcontact us,,,,,,False,,,,2026-04-18T10:03:13.637221,
0,5,SB,7.0,,,Artificial Hanging Flowers for Outdoors Decoration,https://aax-us-east-retail-direct.amazon.com/x/c/JNoJyB9Rxl7XsgC1VT3h5HAAAAGdoAuVGwEAAAH2AQBvbm9fdHhuX2JpZDUgICBvbm9fdHhuX2ltcDIgICDOo1nk/clv1c_ek-wBIHXKsTWnuvbk1pDgEg6DVmYMqmbqoig83fDS4TGw2xoIiDaAO6mOXpSoOCHgreopQ0Q91Pgn4vG-XIykyU69denz4Czslv4JLZi7Yoeu0GM7b7ydQT4YfphqmAzc8Ssy1bOw3L8ChgoG81krdTWyH0cllu6hOCwrzUpxp5rQQv5boohluoO4ToHvPnFhKnPk5nrHgXb_1zJn4iCxU4SPdyziAJ2h4nMxPiU9bBDTct93daSdD5mlhC4w8V_UDkr1hD5SxB_antVkdTScY76eoLs6Dx3fB6rsndo0yhhISEzlNAwjE3XJfVdlHYwmNUdfY31XpM1n3bCjdSwa2envqz3doBPwws-25HbfB0xtUL18poOFZDAU3QRfVsWSk3zBzCqRBrFEcviiO9shqUjyzsmCochPjCdt14OdaMzDkP2_9cQM9-Sk692YqNSTWqJ5GPzsNbli3gPSMZc29rJ1ZGQg5w8PZ0TseywF8E3EGqtB1tJoa5un-rH5GMfH9PbQgt1y7SXLKnZ3SycvmUQ4weu4KjrfigFZdoQ70Bes5NF_UengvxYNF2MTAJHJ73Y-Y2NeRFICWKwGXjix93aDQGZFyUFUDcSQdjy9kVObVN1ttujTvlTL1hZid5iwb5m1LZkM1eOc8ZlbqI2Y8Dp8Y7VceSWcTKZCurlYOwtNYfPbBSaYSzvBHLh-KQn9jl4sCX9N4CsJ6PhEr1Cm7sA08-B7-MT-6S_JMiXP20sm5hfnuVKoFXt7CnZ0vj3m2-TC8Ik3bTZ7xi-TjigiQCXFM6pbDvbAcuqRKMFPjAA99XHwOCBzj5AViPNAeBBHrV4cvRkg6XNNKmVb79O6P243g_5E862TTH0Ywk8922r-uwe8M_72av224980OdXqCKnrR1lS-yXg54dFS8RtQxiRzTchJ8fAKtRgXj_tsADvS88H5nP2rqCGqhO6Sbge1vTt6eBeVKJOGJwcY4Hplstx-bDq5cha4baTw1yup51YWTEowCRCR1xeasWlYWvOx8zvp7xtcqo5U2MLd75sRsVa2Ofmj0H3YUUn0JInOVnfTrGFmqHM3GAizU3CvIXKbdOCmhEgPoRWTC9s6LC_Mv5enNU2oM0vxkvnMHfg_KDBGHp6Vu-OL6Jl89BNUvrza4OjfObW2D7cBJS5G011HzYfCFUEzR7B_E1tQyERFf4ngUTjWOrINhyKIfEQ2ZDZUN8Kkedh6iYeElpiVJL0mN7mnx2tBUynpQ_D6fxhRjY5rq1c44D5K4hTpTXq7m_2OyRX3t2qSeytqN7VJjClfbwVW6-VAS31X_pY_w7CORIy6Dh0g4McEuCFYS0vivxK50HRohWyC4fmXijvdtROp6_LC1v8dtjpNpGZ-jVt62k6wk8PPftC16ef05bCdwip5NsktUFqb6asUHKSI1hxybEstp7PfyIGKBG2nuEdHSC2PlwcXjYGcg6J7EUmjvcwm2VqiVdAaXUqpjUwLa360P07gpqAjpA55oDTdMnt8mBllX1MU3_jxzqGB2DWLsbtSx-7OjU3ij_haxFxaGRE_zl6EZjIBtyj8pEdqosz9pngE-9NTbNQhAvWiHYG_lQ-om7TFi3jBe6FqWx2QcO1c7df2deqW4nZvj_OMqJqXlablAC8S7LCT0qflvQMpkplevkC7LbXTw5wBco-BSM7toWaANVFuJyK_HBz5NheQ/https://www.amazon.com/stores/page/A77B4514-D850-44CD-8791-8BC9DB196E34/?_encoding=UTF8&store_ref=SB_A04069161GHA6AWPS10EB-A04224281RWNFCXSIWN0&pd_rd_plhdr=t&aaxitk=959480831cac39e8a775cbb632a0d632&hsa_cr_id=0&lp_asins=B0G1B93MR4%2CB0D6FYS4SC%2CB0G1B7BB5P&lp_query=summer%20decorations&lp_slot=auto-sparkle-hsa-tetris&ref_=sbx_s_sparkle_sbtcd_bkgd&pd_rd_w=EOcZf&content-id=amzn1.sym.cc961e39-6f5f-411e-8135-81c6c1187ac0%3Aamzn1.sym.cc961e39-6f5f-411e-8135-81c6c1187ac0&pf_rd_p=cc961e39-6f5f-411e-8135-81c6c1187ac0&pf_rd_r=DQMA8ER3AR8NJB9VV9X4&pd_rd_wg=o6YoY&pd_rd_r=4ada5985-71c0-4951-9ddd-62b37b039035,,,,,False,"https://m.media-amazon.com/images/S/al-na-9d5791cf-3faf/a7d88eba-7c5f-43b5-bc3f-5a42cb395131._CR0,0,640,500_AC_SX130_SY60_CB1169409_QL70_.png",,Artificial Hanging Flowers for Outdoors Decoration,2026-04-18T10:03:30.368103,3.0
1,5,Title,,,,ResultsCheck each product page for other buying options. Price and other details may vary based on p,,,,,,False,,,,2026-04-18T10:03:30.369197,
3,5,Organic,,193.0,B0FS366JXW,"xo, Fetti Summer Party Streamers - 5 Crepe Paper Rolls | Pink, Blue, Green, Orange, Pool Birthday Decorations, Island Bachelorette Decor, Tropical Luau, Beach Hawaiian Theme",N/A,$10.99,,5.0,1.0,False,https://m.media-amazon.com/images/I/51oJ9eT6B2L._AC_UL320_.jpg,https://m.media-amazon.com/images/I/51oJ9eT6B2L._AC_SL1500_.jpg,,2026-04-18T10:03:30.373386,
4,5,Organic,,194.0,B0C37DC8TH,Hello Summer Burlap Banner with Sunshine Signs and Bows Rustic Bunting Garland for Camp Pool Beach Barbecue Hawaiian Summer Party Decorations,N/A,$9.99,,4.5,16.0,False,https://m.media-amazon.com/images/I/61yAm08lyhL._AC_UL320_.jpg,https://m.media-amazon.com/images/I/61yAm08lyhL._AC_SL1500_.jpg,,2026-04-18T10:03:30.376763,
5,5,Organic,,195.0,B09QPTQRJB,Yalikop 11 Pieces Summer Tiered Tray Decor Sets Hawaii Wooden Decor Sign Palm Trees Rustic Farmhouse Beach Sunshine Decorative Trays for Table Home Holiday Shelf Kitchen Office,N/A,$12.99,,4.4,463.0,False,https://m.media-amazon.com/images/I/71HkZ4A5KnL._AC_UL320_.jpg,https://m.media-amazon.com/images/I/71HkZ4A5KnL._AC_SL1500_.jpg,,2026-04-18T10:03:30.380059,
6,5,Title,,,,Artificial Cemetery Flowers For Grave Summer DecorSponsored|30K+ bought from this brand in past mont,,,,,,False,,,,2026-04-18T10:03:30.381480,
7,5,Title,,,,More results,,,,,,False,,,,2026-04-18T10:03:30.381610,
8,5,Organic,,196.0,B0CYP8FF1J,10 x 8 Inch Wood Summer Tree Topper with LED Light Summer Tree top Ornaments for Luau Party Hawaiian Decorations Tabletop Display Supplies,N/A,$20.99,,4.6,39.0,False,https://m.media-amazon.com/images/I/71N6ek00EcL._AC_UL320_.jpg,https://m.media-amazon.com/images/I/71N6ek00EcL._AC_SL1500_.jpg,,2026-04-18T10:03:30.384509,
9,5,Organic,,197.0,B0BW3KHBVT,"4 Pack Patriotic Artificial Berry Stem Picks White Blue Red Stars for 4th of July Independence Day, Pentagram Faux Berry Branches Decoration for Home Office Restaurant Vase Décor",N/A,$16.99,,4.5,367.0,False,https://m.media-amazon.com/images/I/81JizKTi40L._AC_UL320_.jpg,https://m.media-amazon.com/images/I/81JizKTi40L._AC_SL1500_.jpg,,2026-04-18T10:03:30.388197,
10,5,Organic,,198.0,B0C1ND9MDN,Whaline 48Pcs Ice Pops Cutouts Colorful Summer Ice Lolly Party Decor Back to School Classroom Bulletin Board Cut-Outs with Glue Points for School Office DIY Projects,N/A,$9.69,,4.7,59.0,False,https://m.media-amazon.com/images/I/61HZ6Yjx2UL._AC_UL320_.jpg,https://m.media-amazon.com/images/I/61HZ6Yjx2UL._AC_SL1500_.jpg,,2026-04-18T10:03:30.391505,
11,5,Organic,,199.0,B0C6JNRGK1,Sintuff 6 Pcs Lemon Decorations Lemon Gnome Wooden Table Centerpiece Hello Summer Lemonade Wood Sign for Table Farmhouse Kitchen Summer Lemon Theme Party Table Tiered Tray Decor,N/A,$13.99,,4.7,36.0,False,https://m.media-amazon.com/images/I/816vdlMq9AL._AC_UL320_.jpg,https://m.media-amazon.com/images/I/816vdlMq9AL._AC_SL1500_.jpg,,2026-04-18T10:03:30.394668,
12,5,Organic,,200.0,B0D5ZNJWVR,4E's Novelty Summer Inflatable Limbo Game Party Game for Kids Boys Girls Adults Tropical Inflatable Decoration for Indoor Outdoor Bithday Beach Pool Tropical Luau Backyard Game,N/A,$29.99,,3.7,126.0,False,https://m.media-amazon.com/images/I/71lPT-wabXL._AC_UL320_.jpg,https://m.media-amazon.com/images/I/71lPT-wabXL._AC_SL1500_.jpg,,2026-04-18T10:03:30.399286,
13,5,Organic,,201.0,B0B2JZMQBR,"30 Pcs Flowers Butterfly Hanging Swirl Decorations, Spring Summer Mother's Day Sunflower Baby Shower Decor for Women Home Birthday Party Baby Shower Wedding Supplies(Flower and Butterfly)",N/A,$9.99,,4.6,507.0,False,https://m.media-amazon.com/images/I/81FfY1fFBHL._AC_UL320_.jpg,https://m.media-amazon.com/images/I/81FfY1fFBHL._AC_SL1500_.jpg,,2026-04-18T10:03:30.402824,
14,5,Title,,,,Creative and unique idea to decorate homeShop ArtoidModePrevious pageArtoid Mode Sea Shell Starfish ,,,,,,False,,,,2026-04-18T10:03:30.404228,
15,5,Title,,,,More results,,,,,,False,,,,2026-04-18T10:03:30.404355,
16,5,Organic,,202.0,B0GFVBV9W7,"WDS WONDROUS Ice Cream Cone 2Pcs, Summer Gnomes Figurines Decor, Brown Resin Dessert Statues, Fake Ice Cream Cone Small Gnomes for Home, Sweet Treat Tabletop Decorations Gifts for Women",N/A,$18.99,,4.8,5.0,False,https://m.media-amazon.com/images/I/71A5OTlLFkL._AC_UL320_.jpg,https://m.media-amazon.com/images/I/71A5OTlLFkL._AC_SL1500_.jpg,,2026-04-18T10:03:30.407379,
17,5,Organic,,203.0,B0GCFP61SJ,"Smile Summer Indoor Decorations Wooden Decor, Sunflower Gnome, Sign for Home Tabletop Centerpiece Mantel Shelf Fireplace",N/A,$8.99,,4.5,78.0,False,https://m.media-amazon.com/images/I/71xGsvIkWxL._AC_UL320_.jpg,https://m.media-amazon.com/images/I/71xGsvIkWxL._AC_SL1500_.jpg,,2026-04-18T10:03:30.410728,
18,5,Organic,,204.0,B09WCSKWZB,Teling 74 Pcs Flip Flop Summer Bulletin Board Decorations Flip Flop Beach Cutouts May Tropical Hawaiian Theme Decor Pool Party Cutouts with Glue Point Dots for Classroom School Office Wall(Simple),N/A,$8.99,,4.7,250.0,False,https://m.media-amazon.com/images/I/81pw3JUCi9L._AC_UL320_.jpg,https://m.media-amazon.com/images/I/81pw3JUCi9L._AC_SL1500_.jpg,,2026-04-18T10:03:30.414020,
19,5,Organic,,205.0,B0BTSX97F4,"Summer Tiered Tray Decor, Farmhouse Watermelon Tray Decorations, Hello Summer Sweet Watermelon Gnome Wooden Signs, Rustic Summer Home Decor for Table Mantel Office Holiday Party",N/A,$13.99,,4.4,92.0,False,https://m.media-amazon.com/images/I/71-LZZI7EkL._AC_UL320_.jpg,https://m.media-amazon.com/images/I/71-LZZI7EkL._AC_SL1500_.jpg,,2026-04-18T10:03:30.417634,
