data_index,page,ad_type,ad_rank,organic_rank,asin,title,url,price_current,price_list,rating_stars,rating_count,is_prime,image_small,image_large,brand_name,scraped_at,inner_products_count
14,2,Title,,,,Patriotic American Pleated Fan FlagShopCouahPrevious page3x6 Ft 4 Pack American Pleated Bunting Fan ,,,,,,False,,,,2026-04-21T11:31:23.048203,
15,2,Title,,,,More results,,,,,,False,,,,2026-04-21T11:31:23.048457,
16,2,Organic,,58.0,B07JGSW88G,"Lvydec Wisteria Artificial Flowers Garland, 4 Pcs Total 28.8ft Artificial Wisteria Vine Silk Hanging Flower for Home Garden Outdoor Ceremony Wedding Arch Floral Decor (Pink)",N/A,$24.99,,4.4,8656.0,False,https://m.media-amazon.com/images/I/8141uB-gTSL._AC_UL320_.jpg,https://m.media-amazon.com/images/I/8141uB-gTSL._AC_SL1500_.jpg,,2026-04-21T11:31:23.052594,
17,2,Organic,,59.0,B07HQ4GCCV,"Ocean Line Luau Party Sunglasses - 9 Pairs Funny Hawaiian Glasses, Tropical Fancy Dress Props, Fun Summer Kids Party Favors, Beach Themed Party Supplies Decoration",N/A,$17.98,,4.7,2161.0,False,https://m.media-amazon.com/images/I/71ugXRbXMFL._AC_UL320_.jpg,https://m.media-amazon.com/images/I/71ugXRbXMFL._AC_SL1500_.jpg,,2026-04-21T11:31:23.057771,
18,2,Organic,,60.0,B0BWHFQKC5,"Katchon, Xtralarge Wavy Blue Foil Fringe Curtain - Pack of 2 | Blue Streamers for Under The Sea Party Decorations | Foil Fringe Backdrop for Birthday, Cruise Door Decorations, Pool Party Decorations",N/A,$12.99,,4.7,796.0,False,https://m.media-amazon.com/images/I/915gfOmzz7L._AC_UL320_.jpg,https://m.media-amazon.com/images/I/915gfOmzz7L._AC_SL1500_.jpg,,2026-04-21T11:31:23.062154,
19,2,Organic,,61.0,B0GM781VGY,Renbuzhu 15Pcs Beach Party Decorations Paper Lanterns Fans Pom Poms Hanging Swirls Summer Pool Luau Hawaiian Tropical Decor Indoor Outdoor,N/A,$15.99,,,,False,https://m.media-amazon.com/images/I/81s97jmKk9L._AC_UL320_.jpg,https://m.media-amazon.com/images/I/81s97jmKk9L._AC_SL1500_.jpg,,2026-04-21T11:31:23.065941,
20,2,Organic,,62.0,B0F5NTPJYC,"Summer Party Decorations, Beach Party Decor Includes Hello Summer Banner Beach Hanging Swirls and Garland, Summer Decorations for Office Classroom, Pool Decorations",N/A,$11.99,,4.7,12.0,False,https://m.media-amazon.com/images/I/81U1mq6OQ+L._AC_UL320_.jpg,https://m.media-amazon.com/images/I/81U1mq6OQ+L._AC_SL1500_.jpg,,2026-04-21T11:31:23.069409,
21,2,Organic,,63.0,B0D4DQQ8SW,"Luau Party Decorations, Natural Hawaiian Grass Table Skirt, Flower 108 X 29.5"" Grass Skirts Tropical Luau Party Favors, Table Skirt for Luau Summer Tropical Indoor Outdoor Parties Decor Accessories",N/A,$8.98,,4.5,710.0,False,https://m.media-amazon.com/images/I/81-9j7gt+mL._AC_UL320_.jpg,https://m.media-amazon.com/images/I/81-9j7gt+mL._AC_SL1500_.jpg,,2026-04-21T11:31:23.073090,
22,2,Organic,,64.0,B0CQKP1Y1R,"Playbees Giant Inflatable Palm Tree 6 Foot - 4PK - Beach Party Decorations for Summer Luau Themed Pool Party, Tropical Hawaiian Blow Up Palm Tree Favors - Poolside Ambiance, Easy Inflation",N/A,$41.99,,4.2,478.0,False,https://m.media-amazon.com/images/I/81wL7vpgZhL._AC_UL320_.jpg,https://m.media-amazon.com/images/I/81wL7vpgZhL._AC_SL1500_.jpg,,2026-04-21T11:31:23.078526,
23,2,Organic,,65.0,B0CRGQMFYB,"AILEHO Kids Sunglasses Bulk Party Favors - 24 Packs Boys Girls Sunglasses for Kids Age 3-8 with UV 400 Protection, Neon Sunglasses for Kids Party",N/A,$22.49,,4.8,1114.0,False,https://m.media-amazon.com/images/I/812gCrg-OsL._AC_UL320_.jpg,https://m.media-amazon.com/images/I/812gCrg-OsL._AC_SL1500_.jpg,,2026-04-21T11:31:23.082764,
24,2,Organic,,66.0,B0GDQVDTBN,"Summer Party Decorations Set, Pre-Strung Hello Summer Banner Hanging Swirls Beach Pool Decorations for Summer Pool Holiday Birthday Party Supplies Indoor Outdoor",N/A,$8.99,,5.0,1.0,False,https://m.media-amazon.com/images/I/71yJfmIZkHL._AC_UL320_.jpg,https://m.media-amazon.com/images/I/71yJfmIZkHL._AC_SL1500_.jpg,,2026-04-21T11:31:23.087268,
25,2,Organic,,67.0,B0GCK6Z8GQ,"Summer Tropical Party Decorations, Beach Birthday Bash Party Supplies Hawaiian Summer Banner Artificial Palm Leaves Hibiscus Flowers Fringe Curtain Foil Balloons for Aloha Luau Decor(Orange Blue)",N/A,$18.99,,4.4,301.0,False,https://m.media-amazon.com/images/I/81bQ1aGGihL._AC_UL320_.jpg,https://m.media-amazon.com/images/I/81bQ1aGGihL._AC_SL1500_.jpg,,2026-04-21T11:31:23.091570,
26,2,Organic,,68.0,B0BV21BSRG,"Summer Party Decorations Porch Sign, 71"" X 12"" Hello Summer Banne for Office Indoor Door",N/A,$9.99,,4.6,94.0,False,https://m.media-amazon.com/images/I/71WsYe4+xCL._AC_UL320_.jpg,https://m.media-amazon.com/images/I/71WsYe4+xCL._AC_SL1500_.jpg,,2026-04-21T11:31:23.095994,
27,2,Organic,,69.0,B0F26B3QGB,"Beach Ball Paper Lanterns 10 Pcs - 8"" Colorful Summer Hanging Decorations for Pool Party, Beach Birthday Party, Classroom & Office Decor",N/A,$13.99,,4.8,61.0,False,https://m.media-amazon.com/images/I/715dxKDKyTL._AC_UL320_.jpg,https://m.media-amazon.com/images/I/715dxKDKyTL._AC_SL1500_.jpg,,2026-04-21T11:31:23.099971,
28,2,Organic,,70.0,B0FZGTSPZM,Renbuzhu 15Pcs Summer Party Decorations Watermelon Paper Lanterns Pom Poms Hanging Swirls Pool Beach Luau Tropical Birthday Hanging Decor Indoor Outdoor,N/A,$16.99,,5.0,1.0,False,https://m.media-amazon.com/images/I/81IcRicZ62L._AC_UL320_.jpg,https://m.media-amazon.com/images/I/81IcRicZ62L._AC_SL1500_.jpg,,2026-04-21T11:31:23.103715,
29,2,Organic,,71.0,B0CS32HN3K,"Gatherfun Ice Cream Party Supplies: 2-Pack Ice Cream Birthday Party Decorations,Disposable Plastic Tablecloth, Ideal Table Cover for Kids & Girls Birthday, Baby Shower & Themed Parties, 54 x 108 Inch",N/A,$8.98,,4.7,837.0,False,https://m.media-amazon.com/images/I/710w1gI2qxL._AC_UL320_.jpg,https://m.media-amazon.com/images/I/710w1gI2qxL._AC_SL1500_.jpg,,2026-04-21T11:31:23.107893,
30,2,Organic,,72.0,B0B8BZQY15,"AOBKIAT Wedding Party Decorations, 5 Rolls Olive Green Khaki Crepe Paper Streamers for Green Boho Wedding, Birthday, Bridal/Baby Shower",N/A,$9.99,,4.7,1167.0,False,https://m.media-amazon.com/images/I/61Z1Pbs7-iL._AC_UL320_.jpg,https://m.media-amazon.com/images/I/61Z1Pbs7-iL._AC_SL1500_.jpg,,2026-04-21T11:31:23.113268,
31,2,Organic,,73.0,B0D2TQF1SQ,"JCFIRE Summer Pool Beach Party Favors Kids Tattoos, 102 Styles Larger Tropical Hawaiian Luau Themed Temporary Tattoos for Kids Teens Adult, Waterproof Summer Stickers Party Decorations Supplies",N/A,$5.99,,4.7,925.0,False,https://m.media-amazon.com/images/I/71KUi4pTJkL._AC_UL320_.jpg,https://m.media-amazon.com/images/I/71KUi4pTJkL._AC_SL1500_.jpg,,2026-04-21T11:31:23.117693,
32,2,Organic,,74.0,B09NV8M82B,"Tropical Luau Party Decorations Set Hawaiian Beach Theme Party Favors Luau Party Supplies with 9ft Luau Grass Table Skirt, Palm Leaves, Hibiscus Flowers, 3D Fruit Straws, Flamingo and Pineapple Décors",N/A,$19.98,,4.6,517.0,False,https://m.media-amazon.com/images/I/81RxmR6D5gL._AC_UL320_.jpg,https://m.media-amazon.com/images/I/81RxmR6D5gL._AC_SL1500_.jpg,,2026-04-21T11:31:23.121609,
33,2,Organic,,75.0,B0CFSLVSCF,"Giant Inflatable Palm Trees - 2 Pack - 6 Foot Super Sturdy Trees for Luau Parties, Beach Decor, Poolside Ambiance, Tropical Theme Decor & Outdoor Fun, Easy Inflation",N/A,$27.99,,4.2,478.0,False,https://m.media-amazon.com/images/I/71FudYlYhIL._AC_UL320_.jpg,https://m.media-amazon.com/images/I/71FudYlYhIL._AC_SL1500_.jpg,,2026-04-21T11:31:23.126436,
34,2,Organic,,76.0,B0B2P18C1J,"Paxcoo 50pc Umbrella Straws for Cocktails, Tropical Hawaiian Luau Party Decorations (Assorted Colors)",N/A,$7.99,,4.6,1088.0,False,https://m.media-amazon.com/images/I/71PMm6c2CXL._AC_UL320_.jpg,https://m.media-amazon.com/images/I/71PMm6c2CXL._AC_SL1500_.jpg,,2026-04-21T11:31:23.130098,
35,2,Organic,,77.0,B0CR6SVS6X,"50pcs Hawaiian Leis Decorations, Hawaiian Leis Bulk Flower Necklaces Luau Party Decor, Colorful Hula Dance Celebration Tropical Summer Beach Pool Parties, Hawaiian Flower Leis for Party Favors Decor",N/A,$19.99,,4.5,2699.0,False,https://m.media-amazon.com/images/I/9146S2M6KEL._AC_UL320_.jpg,https://m.media-amazon.com/images/I/9146S2M6KEL._AC_SL1500_.jpg,,2026-04-21T11:31:23.134092,
36,2,Organic,,78.0,B08CS889K5,"KESOTE 6 Pieces Hawaiian Tropical Parrot Bird Honeycomb Hanging Party Decorations, Summer Tiki Bar Party Decor, Rainforest Decorations Garden Yard Room Decor",N/A,$9.99,,4.6,513.0,False,https://m.media-amazon.com/images/I/71uWFh7r34L._AC_UL320_.jpg,https://m.media-amazon.com/images/I/71uWFh7r34L._AC_SL1500_.jpg,,2026-04-21T11:31:23.138378,
37,2,Organic,,79.0,B0CB3Y6PPW,"Party Goodie Bag Stuffer Fillers for Kids, 32 Pack Mini Bubble Wand Toys Gifts for Toddler, Small Birthday Summer Beach Pool Camping Party Favor Supplies,4th of July Classroom School Stuff Treat Prize",N/A,$8.88,,4.6,2733.0,False,https://m.media-amazon.com/images/I/71P27BMtwSL._AC_UL320_.jpg,https://m.media-amazon.com/images/I/71P27BMtwSL._AC_SL1500_.jpg,,2026-04-21T11:31:23.142375,
38,2,Organic,,80.0,B0B8G6PQ63,"200 Count Hawaiian Lei Bulk, Tropical Luau Hawaii Theme Silk Flower Necklace, Party Favors for Beach Holiday Wedding Birthday Party, Aloha Summer Party Decorations",N/A,$39.99,,4.4,338.0,False,https://m.media-amazon.com/images/I/A1JXqd95lrL._AC_UL320_.jpg,https://m.media-amazon.com/images/I/A1JXqd95lrL._AC_SL1500_.jpg,,2026-04-21T11:31:23.145865,
39,2,Organic,,81.0,B09NN5WTZ5,Spakon 9 Pieces Tropical Birds Honeycomb Paper Cutouts Rio Luau Party Hanging Decorations Rainforest Hanging Paper Birds Hawaiian Parrot Honeycomb Cutouts for Luau Party Decor,N/A,$11.99,,4.6,408.0,False,https://m.media-amazon.com/images/I/81DGOJ7+vDL._AC_UL320_.jpg,https://m.media-amazon.com/images/I/81DGOJ7+vDL._AC_SL1500_.jpg,,2026-04-21T11:31:23.149599,
40,2,Organic,,82.0,B0D2ZSC14M,"Vellibring 12"" Summer Inflatable Beach Balls Bulk Rainbow Color Swimming Pool Water Games Toys for Kids Summer Beach Party Favor",N/A,$14.39,,4.5,202.0,False,https://m.media-amazon.com/images/I/71ogg3oFFZL._AC_UL320_.jpg,https://m.media-amazon.com/images/I/71ogg3oFFZL._AC_SL1500_.jpg,,2026-04-21T11:31:23.154019,
41,2,Organic,,83.0,B07CRL2KC9,"Hajoyful Grass Skirt Hawaiian Luau Hula Skirts Party Decorations Favors Supplies Grass Skirts for Adult Elastic Hibiscus Flowers Tropical Skirt, Party, Birthday, Celebration 60CM 12Pack Multicolored",N/A,$22.98,,4.6,1316.0,False,https://m.media-amazon.com/images/I/91bZU2w7XPL._AC_UL320_.jpg,https://m.media-amazon.com/images/I/91bZU2w7XPL._AC_SL1500_.jpg,,2026-04-21T11:31:23.158610,
42,2,Organic,,84.0,B0D298R6F3,Summer Birthday Party Decorations - Beach Party Pool Decor 10PCS Hanging Swirl Banner Flip Flop Slippers Swirls Summer Birthday Hawaiian Supplies for Holiday Celebration Outdoor,N/A,$9.99,,4.5,46.0,False,https://m.media-amazon.com/images/I/81S+FcCVIcL._AC_UL320_.jpg,https://m.media-amazon.com/images/I/81S+FcCVIcL._AC_SL1500_.jpg,,2026-04-21T11:31:23.162368,
43,2,Organic,,85.0,B0G7X1P64Y,16Pcs Summer Party Decorations Paper Lanterns Pom Poms Hanging Swirls - Luau Beach Pool Hawaiian Tropical Hanging Decor for Home Birthday Outdoor Indoor,N/A,$15.99,,4.9,16.0,False,https://m.media-amazon.com/images/I/81X2FLgG9rL._AC_UL320_.jpg,https://m.media-amazon.com/images/I/81X2FLgG9rL._AC_SL1500_.jpg,,2026-04-21T11:31:23.167444,
44,2,Organic,,86.0,B0DVTBP3ZH,"xo, Fetti Pool Party Paper Plates, 3 Designs | 24 pcs 9"" | Kids Decorations, Summer Birthday Decor, Stripe Tablescape, Colorful Table Setting",N/A,$13.99,,4.6,8.0,False,https://m.media-amazon.com/images/I/61ZUcHaHT8L._AC_UL320_.jpg,https://m.media-amazon.com/images/I/61ZUcHaHT8L._AC_SL1500_.jpg,,2026-04-21T11:31:23.171537,
45,2,Organic,,87.0,B0CLP5W5VQ,Ziliny 36 Pcs Summer Pool Beach Party Supplies 5 lb Beach Ball Large Paper Serving Snack Trays for Summer Hawaii Tropical Party Swimming Pool Favors,N/A,$17.99,,4.5,36.0,False,https://m.media-amazon.com/images/I/818v8g+7+0L._AC_UL320_.jpg,https://m.media-amazon.com/images/I/818v8g+7+0L._AC_SL1500_.jpg,,2026-04-21T11:31:23.175235,
46,2,Organic,,88.0,B0946ZZ9BD,"Outus 30 Pieces Hawaiian Luau Birthday Party Hanging Swirl Decorations, Flower Tropical Palm Flamingo Sign Foil Ceiling Decor for Floral Tropical Party Summer Beach Pool Tiki Supplies(Summer)",N/A,$8.79,,4.6,1154.0,False,https://m.media-amazon.com/images/I/81cwoPntlvL._AC_UL320_.jpg,https://m.media-amazon.com/images/I/81cwoPntlvL._AC_SL1500_.jpg,,2026-04-21T11:31:23.178975,
47,2,Organic,,89.0,B0D1GB693Z,"ASTARON Black Sunglasses Bulk, 6/12/24/48 Pack Sunglasses Party Favors for Summer Beach Pool Birthday Wedding Party Supplies",N/A,$13.99,,4.7,1343.0,False,https://m.media-amazon.com/images/I/71BsdLm4EFL._AC_UL320_.jpg,https://m.media-amazon.com/images/I/71BsdLm4EFL._AC_SL1500_.jpg,,2026-04-21T11:31:23.187091,
48,2,Organic,,90.0,B07CNC6RP7,HESTYA 42 Pieces Colorful Pennant Banner Flag Multicolor Bunting String Triangle Banner Pennants for Birthdays Classroom School Carnival Garland Outdoor Events Party Hanging Decorations(Pastel),N/A,$10.99,,4.7,577.0,False,https://m.media-amazon.com/images/I/71TelkiFeJL._AC_UL320_.jpg,https://m.media-amazon.com/images/I/71TelkiFeJL._AC_SL1500_.jpg,,2026-04-21T11:31:23.193587,
49,2,Organic,,91.0,B0CW98ZCKZ,Ozepao 58 Pcs Summer Cutouts Beach Hawaiian Theme Bulletin Board Decoration Tropical Fruits Paper Cut Outs for School Supplies Classroom Home Party Decor,N/A,$9.99,,4.9,56.0,False,https://m.media-amazon.com/images/I/812-qu1OwsL._AC_UL320_.jpg,https://m.media-amazon.com/images/I/812-qu1OwsL._AC_SL1500_.jpg,,2026-04-21T11:31:23.200834,
50,2,Organic,,92.0,B09P5XRB53,Joanlody Blue Cheesecloth Table Runner Spring Summer 10Ft Rustic Gauze Boho Cheese Cloth Table Runner for Wedding Bridal Baby Shower Decoration,N/A,$7.99,,4.7,1260.0,False,https://m.media-amazon.com/images/I/81snfxGPkWL._AC_UL320_.jpg,https://m.media-amazon.com/images/I/81snfxGPkWL._AC_SL1500_.jpg,,2026-04-21T11:31:23.207943,
51,2,Organic,,93.0,B0DY7Q87NC,Summer Beach Party Decorations - Pre-Strung Hello Summer Banner and 16 Hanging Swirls Pool Party Decorations for Home Office Classroom,N/A,$7.95,,4.6,20.0,False,https://m.media-amazon.com/images/I/81WnSn6kppL._AC_UL320_.jpg,https://m.media-amazon.com/images/I/81WnSn6kppL._AC_SL1500_.jpg,,2026-04-21T11:31:23.213326,
52,2,Organic,,94.0,B01JGQF40Y,"250pcs Multicolor Pennant Flags,LOOBJOYGAME 263Ft Nylon Fabric Decorations Grand Opening Banner Rope",N/A,$12.99,,4.6,2041.0,False,https://m.media-amazon.com/images/I/61drJej456L._AC_UL320_.jpg,https://m.media-amazon.com/images/I/61drJej456L._AC_SL1500_.jpg,,2026-04-21T11:31:23.218530,
53,2,Organic,,95.0,B0DJVMRP8H,"Brightown 60 LED Flower Solar String Lights Outdoor Waterproof Fairy Lights for Garden Yard Fence Patio Christmas Tree Wedding Party Decor, Multicolor",N/A,$9.99,,4.5,2158.0,False,https://m.media-amazon.com/images/I/810L1A99NBL._AC_UL320_.jpg,https://m.media-amazon.com/images/I/810L1A99NBL._AC_SL1500_.jpg,,2026-04-21T11:31:23.223734,
54,2,Organic,,96.0,B0BYHQC4XZ,Jerify 24 Pcs Mini Beach Stress Balls 2.5 Inch Foam PU Relief Stress Ball Mini Rainbow Blow Up Beach Balls Toys for Girls Boys Birthday Beach Hawaiian Party Favors Summer Water Games (Bright Color),N/A,$19.99,,4.6,163.0,False,https://m.media-amazon.com/images/I/71wn91QlcCL._AC_UL320_.jpg,https://m.media-amazon.com/images/I/71wn91QlcCL._AC_SL1500_.jpg,,2026-04-21T11:31:23.227398,
56,2,Title,,,,"Debug info copied.SponsoredMega-L Cinco de Mayo Decorations, 2 Pack Fiesta Party Decorations Taco Pa",,,,,,False,,,,2026-04-21T11:31:23.228306,
57,2,Title,,,,Related searchesend of summer party decorationssummer partypool party decorationssummer party decora,,,,,,False,,,,2026-04-21T11:31:23.229501,
58,2,Title,,,,Previous123...7Next,,,,,,False,,,,2026-04-21T11:31:23.229838,
59,2,SB,2.0,,,N/A,https://aax-us-east-retail-direct.amazon.com/x/c/JBDPmCC3-6nx3BomvO3TJOAAAAGdr88QkwEAAAH2AQBvbm9fdHhuX2JpZDQgICBvbm9fdHhuX2ltcDIgICAu0jY2/clv1c_ek-wBPHXFbbWzjK3YoscrxfcOWxCnjqP74Xj-5LnFUmL7dJObYINvL8Ou-1wyRGF9gmFV-fP4lI23vEgszLEIt6plOtpkwTebS1h__Vi7A4-5JJilK5fVPxY4fNO8hq9-k3_gwezjbDBvB8RtRquEvCaoNfs1lVBggUxTbek6IqHiUM0zQ1Nh4I47wBVkSf6MH3hzj-j_2eJUKl6tXzMofiPBCdrUEs4rF8iM52F4bS7RImbyn6C0BqLNWpqPz_5XapJPuLfUBRvwz1ZtInCjldrm8pOXCgXCA3psKItxmCuNd6vmAvxxH63FlkxNZ-g-dv-5NYT5IB9Muh6xbv2ycdmtpz7a087KlYlDjHC4mEBr8py8RpyUg5Hzl8MKABn5SR8UndaJ8vpqOb6A9GyiNf9BXtFpyPXVebZC0w9dxXjO_av83U-xxtKXxemXDVhnx3mwlL7e3XSnpHMP6Oon5cpmEWnWaVrx4xjwtr_mzlxKIznXgywZvbdnPwSJQYowIpJYE-pxHppnV7RfJb-kd7te_Qzk-I-8AG5kfVUHw55BpUqRajlriKAiUa4WW0NxOtBx9S6QXOLjtoPy2hNrffCccdn9hbLw-H5X0qZLcNz4nOgI_aeIwsW5-nnuIXQ95NAxrKN29e-wbSDaTNgUSXm0r0MDwW6uqiwVLkJqZJQ935hTdKGwa4o5PIve7ESHg94TcchY-4pEXQMqvOqDljD5cB-VhrquNI6_aDucqbKALjZdy4YWXmoxwxP1PQbkbnq5tHgZaXouTH4v-bL6RLKii4ZK6MNopca8vu2AALP2tg7Q96HaBeNI9MemUC_OFzZ3SEOnrZrSO-9s4gc2P2o0e_pKRTf9aKYn-UxJJr--jXpP4-omGOjrxF6UknuxLLI-8K3W_n9vVtzTtWjOixeO9OD1jA7Dl0dWAxsDhmZ8A2I2LDHXxfFLo1PG6CMa_cXgq7foBC3s1syxHZUYU1BVM3rQjbYk5i7s1ZgcDUZgS0wqGa-_tDjuwbnczWoDPeozGI9jYs9MMC7nfJveEJrqAp2ukJ942JU4ZDv-leFOkFEmPqOdgcfkm7pMvKPLxNfSlV_pg2JXS50xtz__rcHuZgOMVlg-I4s5RYWtEFvVfjC8Im8s8MHX86gP0ETBc8mH0hyl-udUzVTSihW6L0ucpOentv6aRcYRR14GCf00FRulLQHjGIlY_nH_9dXR8iL0ubXS3Kc75rBbXOUnAMj5v6rPVubmQJQZ-2rcRxii-Sz7oGzB_pp2omdHKpNQsldcZ-VVoT_HSN066Fa2ZmhsYPydorg_agOk3fls2shWqyLbbyGxeEyWY_ZXJV-mJhA21i7nDtsBk5DbZINRw0ZzLK-tgtS_RkIi4ER8uoR-H2WJbtm1eJoWnyU8II3kggEMhxQuyNIqtfX5d04mlmRfXSkKQNnt983yhM9JO1QES6RQfooATvwY_Ajeh5-vBr06oU7kF0LY9riaMkG38AU-1rKgjNUNbOT10KryA7m3zCnQG4bnsLl2fmozOf-uWkL-XJ4gYK37aLNOmmKMPjaQmkFcldFMfoA_vSeQ1sNDZs3_xmJTbnHRNhc5Ze0aJzcvLwZY1IqeLDFvSPdTUzP23VVgYeandLKeaYQ0ggb0qRHQJg8GrU1xHqxVR3aROr_9Rl0ub-YTsMFD1Pi_ftUydc/https://www.amazon.com/stores/page/AD723312-D35D-4CD3-B0E9-65BDEF2E3F00/?_encoding=UTF8&store_ref=SB_A04583713QCU9RACLQ6F4-A08954171UQSVU17I1HR0&pd_rd_plhdr=t&aaxitk=b3d19e8ea5339ff8af01be66ac5ac2a4&hsa_cr_id=0&lp_asins=B0DM1ZVLTX%2CB0GF1NLKLN%2CB0G3PCVXSD&lp_query=summer%20party%20decorations&lp_slot=desktop-hsa-3psl&ref_=sbx_be_s_3psl_mbd_mb0_bkgd&pd_rd_w=w6Yvr&content-id=amzn1.sym.cd7c548b-a599-426f-9ffe-daa1aa803c87%3Aamzn1.sym.cd7c548b-a599-426f-9ffe-daa1aa803c87&pf_rd_p=cd7c548b-a599-426f-9ffe-daa1aa803c87&pf_rd_r=9BMGH7SEWAZ2CP506MQP&pd_rd_wg=Km9SZ&pd_rd_r=215c7de7-7a11-411c-8ab8-844fb3e41486,,,,,False,,,N/A,2026-04-21T11:31:23.234767,
60,2,Title,,,,Need help?Visit the help sectionorcontact us,,,,,,False,,,,2026-04-21T11:31:23.235494,
0,3,SB,3.0,,,Luau Party Decorations,https://aax-us-east-retail-direct.amazon.com/x/c/JJ6D-u7lRAf-Pb5Q-nPW6tQAAAGdr89VHQEAAAH2AQBvbm9fdHhuX2JpZDQgICBvbm9fdHhuX2ltcDIgICBJRuZy/clv1c_ek-wBHf2LbTWnuO7cAeAI08zORMXWAvjGIYWrhWgN9RTs2J9U8BGecOXbofINxeXPPY6y_KZaxqypLXKYlvqZLYD-jTaOI63PuDc-bdizYoHU9lGyBrnMWC4Inp64EoI-3rzaLSjuy8xToYzz8Mo_93DAFycjuX-uGTATnKs0KqvmPvUbsh9PlHmRCi4HvH-_JWMyCiIHxPuoRQkF0rFZCS7jXuvlN7-0DyHOQOrmoytqDmKIj2lA-idR_NPIGfK3Cy8vqZtE2ZeDcq1TpSQ4joDUOq2RDNP5hSfTUQtmj4ncJ0FUCQ6tgHYE5QslqVkdSWEjuEy_9YJqbknuKxWxCg01ChmVPIJkPQbrfmijquO1XuxDI4WEi7jlFUehv2w0SUBkoAQ8N6sqpA-b_lNxzufEeQEVXfl3PkS8xw_NIVm_DKiociShp0D6beiOyRhcE-E_pdjm4gvS_nOMBlogaEyaowgMvD-IAdM8LKMJdUmIAQ6vGVpdunN6UdRBGvhjWaUxfzQuK-BmdHzylV1dv4BpZ3S1pozOZZbedbwXAwJNp5am6vdriqBefig2OkNGRfehtW2TxKL0Vg4YtWqR9O4EDWvwi4DvGqm8E1oMv1hOCqks40WQMKWPSZsspl9h0I0O6JeMUQdtOw5PzVAty063ImLAkfk5maPTwb-ouDLJbhcBwUiqFSYXVj5a0SntZJb-sPpmG3HQ25m73hemNbqhRL3tQvTuOY-8a6jtFVOwzYrTRdHzVpeYvBc2uNFuNhHG_7Syvy8kQod32Nr2nsMCLAiEuEMcwxBvKY3MAEQjaLECwMeuFv9p5--GjwZN8BeJPRgOO5AVH8YFQ7sfqogxr213SE1U6OfzXaoULW9g5GoaoHatRB8ETgtN6Sm41MfIH4cUS0FnNyux26sYUjXtbThlbYZxBvU-XIDalL7_A1RXzECxRtGBNQMn8lhT7sFtr0E9Cp2q4Mz2igEk61_8INuW57hUjj5m1XX9D75lBuXmnLyCqVr9M1Es6u1DO3mCC5KlnA4oY_H7jpj5UHN-GNwDZ17T_1Xe6pnRCHU_DlxXsicBS7mKzmSxAQxt0s9Fn7fWc03I-3SjWLGK_bu_M4yoF9-wNvat5yyZrfKmKTeb5ngEk0fV2jjXB3mjVXkLO221L26qKeTagKvh5gszxeK5TUpu7IL_X9k_sEQnQMsVCPQ3VRuT-NFfdDTPRCRNR4hYYBvhDx9wAm5oSX6fuGZHHmyCJ5FvDtW6nleGwzVRZcixS_hXgYKjgIwF0fQbb2nxziYo7dwllLtoW5J30Bw53Qoqz_1R8uCX99BAfx9lppLfpE6UWQvfwZASy_iYw0RNBijMmp3-xy6_fSOP39BTveknUoIELfWxl4xNN8PRiEqC4N3xty0yGJemFHx6S1p83Ha7K6l-nzswK0E3IMXJR-JBmdN9t4dKxAmE5klKmIea5wQ1oamxqg26y5UKHNpt4cN39vUZGRo21CwdSTKA4RQzIw9esvHNhGc9kqw5Ors2eYchFuK84Npgflq99R-g73Lfti5sjRvc6dAEHHWP3mUpUFTWFW20BPgxGvxVZUEvu7q02TFr9ChS9MKOmc_dOBCnE0hk6eDVW4gCQpEfQGQOCP-ISU2-MnNnptRWBdK30qAnpdL-QG62bWVXtyuyunDQsmJDZVOmr8d3a5hEdtLiRJE3ZJ3819_amt_e9Y2Qu1tamE/https://www.amazon.com/stores/page/5293A3C0-4DB5-4472-990F-B965D60EE00A/?_encoding=UTF8&store_ref=SB_A07795963POCTO23QX4GV-A059678259FNOVC2X5G1&pd_rd_plhdr=t&aaxitk=d56eab758393d5e5d6edadc5905ab1f6&hsa_cr_id=8042606210001&lp_asins=B09NM3WQH6%2CB09Y16XSWR%2CB09NM3RNCV&lp_query=summer%20party%20decorations&lp_slot=auto-sparkle-hsa-tetris&ref_=sbx_s_sparkle_sbtcd_bkgd&pd_rd_w=qQXpA&content-id=amzn1.sym.cc961e39-6f5f-411e-8135-81c6c1187ac0%3Aamzn1.sym.cc961e39-6f5f-411e-8135-81c6c1187ac0&pf_rd_p=cc961e39-6f5f-411e-8135-81c6c1187ac0&pf_rd_r=5A96RNFFRSEH8Z3W4HGG&pd_rd_wg=kwvZp&pd_rd_r=26e609b6-1fc8-431b-b7b1-0443ec13d15b,,,,,False,"https://m.media-amazon.com/images/S/al-na-9d5791cf-3faf/34b9de36-72e1-40c4-80b3-6b8a2d8a468c._CR0,0,400,400_AC_SX130_SY60_CB1169409_QL70_.png",,Luau Party Decorations,2026-04-21T11:31:40.768883,3.0
1,3,Title,,,,ResultsCheck each product page for other buying options. Price and other details may vary based on p,,,,,,False,,,,2026-04-21T11:31:40.770237,
3,3,Organic,,97.0,B0C2HRKML4,"Zcaukya Inflatable Seashell Pool Float, Giant Clam Air-Filled Toys with Pearl Ball for Kids Birthday Party Swimming Pool Summer Beach Party Mermaid Ocean Theme Party Decor",N/A,$35.99,,4.6,315.0,False,https://m.media-amazon.com/images/I/71RMEUGyOSL._AC_UL320_.jpg,https://m.media-amazon.com/images/I/71RMEUGyOSL._AC_SL1500_.jpg,,2026-04-21T11:31:40.778645,
4,3,Organic,,98.0,B0F7QXP2WY,"Cute Hawaiian Party Decoration Lights - Mini LED Flamingo Pineapple Palm Tree Cacti Signs, Summer Tropical-themed Birthday Party Table Centerpieces Lamps Decor",N/A,$15.99,,4.7,10.0,False,https://m.media-amazon.com/images/I/715-yAuwcfL._AC_UL320_.jpg,https://m.media-amazon.com/images/I/715-yAuwcfL._AC_SL1500_.jpg,,2026-04-21T11:31:40.782785,
5,3,Organic,,99.0,B07CJ2SJ6Q,"4E's Novelty 2 Pack Giant Inflatable Palm Trees 6 Ft Tall - Palm Tree Blow Up for Tropical Seaside Inflate Trees Party Decorations, Summer Beach Tree Party, Beach Decoration Plant Birthday Supplies",N/A,$25.99,,4.0,1036.0,False,https://m.media-amazon.com/images/I/81hX7ak5V2L._AC_UL320_.jpg,https://m.media-amazon.com/images/I/81hX7ak5V2L._AC_SL1500_.jpg,,2026-04-21T11:31:40.787282,
6,3,Title,,,,Pool Party DecoractionSponsored|Highly bought brand in this category|Shop TURNMEONShop nowPrevious p,,,,,,False,,,,2026-04-21T11:31:40.789286,
7,3,Title,,,,More results,,,,,,False,,,,2026-04-21T11:31:40.789432,
8,3,Organic,,100.0,B0CZQP2PSJ,"12 Pack Summer Can Cooler Sleeve Insulated Neoprene Can Coolers in Bulk, Beach Pool Bottle Can Drink Holder Party Decorations, Men Women Birthday Bachelorette Party Favor Gifts",N/A,$11.69,,4.4,171.0,False,https://m.media-amazon.com/images/I/81Y2vnYdXIL._AC_UL320_.jpg,https://m.media-amazon.com/images/I/81Y2vnYdXIL._AC_SL1500_.jpg,,2026-04-21T11:31:40.793880,
9,3,Organic,,101.0,B0BYHQC4XZ,Jerify 24 Pcs Mini Beach Stress Balls 2.5 Inch Foam PU Relief Stress Ball Mini Rainbow Blow Up Beach Balls Toys for Girls Boys Birthday Beach Hawaiian Party Favors Summer Water Games (Bright Color),N/A,$19.99,,4.6,163.0,False,https://m.media-amazon.com/images/I/71wn91QlcCL._AC_UL320_.jpg,https://m.media-amazon.com/images/I/71wn91QlcCL._AC_SL1500_.jpg,,2026-04-21T11:31:40.797801,
10,3,Organic,,102.0,B07RV85678,Decor365 White Finger Starfish Sea Shell Garland Ocean Coastal Nautical Party Decoration Starfish Cutouts Hanging Bunting Banner Under the Sea Mermaid Wish Birthday Beach Wedding Decor,N/A,$12.99,,4.0,904.0,False,https://m.media-amazon.com/images/I/41NXMamleBL._AC_UL320_.jpg,https://m.media-amazon.com/images/I/41NXMamleBL._AC_SL1500_.jpg,,2026-04-21T11:31:40.802296,
11,3,Organic,,103.0,B0FS366JXW,"xo, Fetti Summer Party Streamers - 5 Crepe Paper Rolls | Pink, Blue, Green, Orange, Pool Birthday Decorations, Island Bachelorette Decor, Tropical Luau, Beach Hawaiian Theme",N/A,$10.99,,5.0,1.0,False,https://m.media-amazon.com/images/I/51oJ9eT6B2L._AC_UL320_.jpg,https://m.media-amazon.com/images/I/51oJ9eT6B2L._AC_SL1500_.jpg,,2026-04-21T11:31:40.808268,
12,3,Organic,,104.0,B07S21149G,"JOYIN Toy 60 Counts Hawaiian Leis Bulk, Tropical Flower Lei Hawaiian Lei Beach Hawaii Luau Party Favors Decoration Birthday Party Supplies",N/A,$17.99,,4.6,10884.0,False,https://m.media-amazon.com/images/I/911aTPl1DwL._AC_UL320_.jpg,https://m.media-amazon.com/images/I/911aTPl1DwL._AC_SL1500_.jpg,,2026-04-21T11:31:40.812286,
13,3,Organic,,105.0,B0CP8PLRGS,"[ 10''+8'' ] 12 Pack Watermelon Beach Balls Bulk, Inflatable Mini Beach Ball for Kids Swimming Pool Toys Birthday Party Favors Outdoor Summer Essentials Water Toys,Fruits Theme Pool Party Decorations",N/A,$12.82,,4.4,124.0,False,https://m.media-amazon.com/images/I/81wK2nJFavL._AC_UL320_.jpg,https://m.media-amazon.com/images/I/81wK2nJFavL._AC_SL1500_.jpg,,2026-04-21T11:31:40.817990,
14,3,Title,,,,Patriotic American Pleated Fan FlagShopCouahPrevious page3x6 Ft 4 Pack American Pleated Bunting Fan ,,,,,,False,,,,2026-04-21T11:31:40.820708,
15,3,Title,,,,More results,,,,,,False,,,,2026-04-21T11:31:40.820887,
16,3,Organic,,106.0,B0F2HZHWT5,HOMETITUTE Aloha Banner Luau Decorations 118 x 20 Inch Hawaiian Banner Tropical Hello Summer Backdrop Aloha Sign for Pool Party Backyard Summer Beach Tiki Bar Outdoor Photo Booth,N/A,$10.99,,4.8,72.0,False,https://m.media-amazon.com/images/I/81676Y3mYBL._AC_UL320_.jpg,https://m.media-amazon.com/images/I/81676Y3mYBL._AC_SL1500_.jpg,,2026-04-21T11:31:40.824289,
17,3,Organic,,107.0,B087LYK31B,"14 Pcs Tropical Party Decorations Set - Pre-Strung Flamingo Banner, Paper Fans, Lanterns & Palm Leaves - Hawaiian Themed Luau Party Decorations for Summer Beach, Pool & Birthday",N/A,$16.99,,4.6,595.0,False,https://m.media-amazon.com/images/I/81NHRmonFgL._AC_UL320_.jpg,https://m.media-amazon.com/images/I/81NHRmonFgL._AC_SL1500_.jpg,,2026-04-21T11:31:40.829043,
