data_index,page,ad_type,ad_rank,organic_rank,asin,title,url,price_current,price_list,rating_stars,rating_count,is_prime,image_small,image_large,brand_name,scraped_at,inner_products_count
18,3,Organic,,108.0,B0DP6NRZGV,"72"" Inflatable Palm Tree Cooler, 200+ Drinks Super Large Capacity, Pool Party Decoration, Luau Party Decor, Beach Hawaiian Birthday Party Supplies Tropical Themed Summer Outdoor Drink Cooler",N/A,$22.49,,4.3,449.0,False,https://m.media-amazon.com/images/I/71NsI-mdCGL._AC_UL320_.jpg,https://m.media-amazon.com/images/I/71NsI-mdCGL._AC_SL1500_.jpg,,2026-04-21T11:31:40.833778,
19,3,Organic,,109.0,B0FLXP8HLL,Flip Flop Candy Lollipops - 24 Individually Wrapped Summer Themed Suckers - Beach Candy - Summer Party Favors - Pool Party Treats - Goodie Bags for Kids Birthday Party,N/A,$13.95,,4.9,15.0,False,https://m.media-amazon.com/images/I/818UkPj-a9L._AC_UL320_.jpg,https://m.media-amazon.com/images/I/818UkPj-a9L._AC_SL1500_.jpg,,2026-04-21T11:31:40.838045,
20,3,Organic,,110.0,B0F2M4HC7X,"Summer Party Honeycomb Centerpieces, 9pcs Summer Party Decorations 3D Honeycomb, Hawaii Beach Summer Honeycomb Centerpiece Beach Party Centerpiece Decorations for Summer Beach Hawaii Party Decorations",N/A,$7.99,,4.0,1.0,False,https://m.media-amazon.com/images/I/81SU5Jmt+aL._AC_UL320_.jpg,https://m.media-amazon.com/images/I/81SU5Jmt+aL._AC_SL1500_.jpg,,2026-04-21T11:31:40.842263,
21,3,Organic,,111.0,B094LZ2VGR,"4E's Novelty 48 Packs Tropical Party Cups with Parasol Straws - Disposable Plastic Cups 16oz BPA free, for Hawaiian Luau Party and Pool Parties, Beach Theme Birthday Decorations for Kids & Adults",N/A,$13.49,,4.7,443.0,False,https://m.media-amazon.com/images/I/61HGwRd92VL._AC_UL320_.jpg,https://m.media-amazon.com/images/I/61HGwRd92VL._AC_SL1500_.jpg,,2026-04-21T11:31:40.847775,
22,3,Organic,,112.0,B083B5YW71,"JOYIN 43"" Inflatable Cactus Cooler with Sombrero Hat for Fiesta, Cinco de Mayo Party Supplies, Inflatable Party Cooler, Pool Party Decoration",N/A,$18.99,,4.6,987.0,False,https://m.media-amazon.com/images/I/71FlDC+by3L._AC_UL320_.jpg,https://m.media-amazon.com/images/I/71FlDC+by3L._AC_SL1500_.jpg,,2026-04-21T11:31:40.851257,
23,3,Organic,,113.0,B097DQV2ST,"Inflatable Flamingo Cooler 130+ Cans Large Capacity, Bottom Quick-Drain, Luau Party Decor, Flamingo Pool Party Decorations, Beach Hawaiian Birthday Party Supplies Tropical Themed Summer Drink Cooler",N/A,$15.99,,4.3,449.0,False,https://m.media-amazon.com/images/I/71yt6voYyEL._AC_UL320_.jpg,https://m.media-amazon.com/images/I/71yt6voYyEL._AC_SL1500_.jpg,,2026-04-21T11:31:40.855232,
24,3,Organic,,114.0,B0C936QPTS,"FreshDear 6 Counts Hawaiian Leis Bulk,leis for luau party,hawaiian leis for adults,beach party favors for adults,Summer Beach Vacation,Theme Party Decorations",N/A,$7.99,,4.5,473.0,False,https://m.media-amazon.com/images/I/71+MQO2IASL._AC_UL320_.jpg,https://m.media-amazon.com/images/I/71+MQO2IASL._AC_SL1500_.jpg,,2026-04-21T11:31:40.859380,
25,3,Organic,,115.0,B0B1HJRTNP,JOZON Colorful Glittery School's Out for Summer Banner with Sunglasses Sun Popsicle Slippers Signs End of School Year Summer Vacation Banner Garland Beach Pool Splash Bash Summer Vacation Decorations,N/A,$8.99,,4.8,27.0,False,https://m.media-amazon.com/images/I/61+se7fYjgL._AC_UL320_.jpg,https://m.media-amazon.com/images/I/61+se7fYjgL._AC_SL1500_.jpg,,2026-04-21T11:31:40.863151,
26,3,Organic,,116.0,B0CR6RXWT1,"100pcs Luau Party Decorations, Silk Hawaiian Leis Tropical Flower Necklaces, Colorful Hula Dance Bulk Leis Decor, Flower Hawaiian Leis for Summer Beach Pool Theme Party Decorations Favors Supplies",N/A,$35.99,,4.5,2699.0,False,https://m.media-amazon.com/images/I/91Qb2mxWFxL._AC_UL320_.jpg,https://m.media-amazon.com/images/I/91Qb2mxWFxL._AC_SL1500_.jpg,,2026-04-21T11:31:40.867285,
27,3,Organic,,117.0,B0DYJM264C,"OHOME Ice Cream Party Decorations - Disposable Tablecloth for Ice Cream Birthday Party Decorations - Plastic Table Cover for Summer Bar Party Banner,2 Pack",N/A,$5.37,,4.6,2355.0,False,https://m.media-amazon.com/images/I/71acrhC5TzL._AC_UL320_.jpg,https://m.media-amazon.com/images/I/71acrhC5TzL._AC_SL1500_.jpg,,2026-04-21T11:31:40.872286,
28,3,Organic,,118.0,B0DLGSDK64,"JOYIN 2-Pack 20"" Beach Balls - Pool Toys Large Inflatable Beach Ball Swimming Pool Water Games, Classic Rainbow Color Beachball Luau Birthday Decorations Party Supplies Party Favors Gifts",N/A,$7.99,,4.4,667.0,False,https://m.media-amazon.com/images/I/61qNOIW4oEL._AC_UL320_.jpg,https://m.media-amazon.com/images/I/61qNOIW4oEL._AC_SL1500_.jpg,,2026-04-21T11:31:40.876903,
29,3,Organic,,119.0,B0CYT7NTXZ,Bememo 6 Pcs Hello Summer Table Decorations Sign Summer Gnome Wooden Table Centerpieces Beach Hawaii Table Decor Ice Cream Colorful Table Topper Sign for Summer Pool Tropical Party Supplies,N/A,$11.99,,4.3,22.0,False,https://m.media-amazon.com/images/I/71ML03K825L._AC_UL320_.jpg,https://m.media-amazon.com/images/I/71ML03K825L._AC_SL1500_.jpg,,2026-04-21T11:31:40.880540,
30,3,Organic,,120.0,B0F3CRG7L5,"3 Pack Summer Flamingo Tablecloth Party Decorations, Hawaiian Tropical Plastic Table Cloth, Disposable Luau Table Cover for Summer Flamingo Picnic Birthday Party Supplies Decorations, 54” x 108”",N/A,$8.99,,4.4,46.0,False,https://m.media-amazon.com/images/I/816T9zMlEeL._AC_UL320_.jpg,https://m.media-amazon.com/images/I/816T9zMlEeL._AC_SL1500_.jpg,,2026-04-21T11:31:40.884199,
31,3,Organic,,121.0,B095S5DPN5,"FUTUREPLUSX 48 PCS Leis for Luau Party decorations, Hawaiian Leis Tropical Hawaiian Bulk Including Colorful Flower Necklace Headbands and Wristbands for Hula Dance Party Tropical Summer Beach Theme",N/A,$11.99,,4.5,690.0,False,https://m.media-amazon.com/images/I/91F4LP+2-TL._AC_UL320_.jpg,https://m.media-amazon.com/images/I/91F4LP+2-TL._AC_SL1500_.jpg,,2026-04-21T11:31:40.888554,
32,3,Organic,,122.0,B0DGCKDBPB,"SCIONE 28 Pack Mini Beach Balls Bulk, 5-Inch Inflatable Rainbow Beach Balls for Kids, Ideal for Pool Toys, Beach Theme Party Decorations and Outdoor Games, Hawaiian Tropical Theme Decorations Supplies",N/A,$19.98,,4.5,53.0,False,https://m.media-amazon.com/images/I/71qTXD5xFVL._AC_UL320_.jpg,https://m.media-amazon.com/images/I/71qTXD5xFVL._AC_SL1500_.jpg,,2026-04-21T11:31:40.893588,
33,3,Organic,,123.0,B0D8VVKG4J,"ASTARON Black Sunglasses Bulk, 6/12/24/48 Pack Sunglasses Party Favors for Summer Beach Pool Birthday Wedding Party Supplies",N/A,$13.99,,4.7,1343.0,False,https://m.media-amazon.com/images/I/71VD0MYkNDL._AC_UL320_.jpg,https://m.media-amazon.com/images/I/71VD0MYkNDL._AC_SL1500_.jpg,,2026-04-21T11:31:40.899026,
34,3,Organic,,124.0,B0CYH6K5PW,"Summer Banner Pool Party Decorations, Pool Party Decorations Banner Backdrop Summer Party Decorations, Hanging Beach Themed Summer Party Decorations with Rope (72 * 44 Inches)",N/A,$9.99,,4.6,100.0,False,https://m.media-amazon.com/images/I/81d1A48zuIL._AC_UL320_.jpg,https://m.media-amazon.com/images/I/81d1A48zuIL._AC_SL1500_.jpg,,2026-04-21T11:31:40.902584,
35,3,Organic,,125.0,B083W99RQ8,"Zcaukya Inflatable Palm Tree Cooler, 60"" Blow Up Palm Tree Cooler for Tropical Party Decorations, Hawaiian Party Supplies Pool Decorations",N/A,$19.49,,4.2,1456.0,False,https://m.media-amazon.com/images/I/71YUjeio9AL._AC_UL320_.jpg,https://m.media-amazon.com/images/I/71YUjeio9AL._AC_SL1500_.jpg,,2026-04-21T11:31:40.911399,
36,3,Organic,,126.0,B0DS1P3HH2,"Luau Party Decorations, 12PCS Leis for Luau Party Necklace Women Clothing Accessories, Hawaiian Colorful Tropical Theme Costume Accessories, Hawaii Flower Lays Garland Summer Pool Birthday Supplies",N/A,$6.99,,4.3,345.0,False,https://m.media-amazon.com/images/I/81nhCQVD9jL._AC_UL320_.jpg,https://m.media-amazon.com/images/I/81nhCQVD9jL._AC_SL1500_.jpg,,2026-04-21T11:31:40.915223,
37,3,Organic,,127.0,B0F9Y9SJNZ,"50 Counts Hawaiian Leis Bulk Decorations, Leis for Luau Party Hawaiian Colorful Tropical Flower Lays for Adults Hawaii Summer Beach Luau Party Favors Birthday Party Supplies",N/A,$19.99,,4.8,41.0,False,https://m.media-amazon.com/images/I/81QW9MLaIaL._AC_UL320_.jpg,https://m.media-amazon.com/images/I/81QW9MLaIaL._AC_SL1500_.jpg,,2026-04-21T11:31:40.919068,
38,3,Organic,,128.0,B0C5J75QXP,"36 Pcs Summer Wood Hanging Ornaments Summer Flip Flop Wood Chip Hanging Tree Hanging Ornament Wood Tags Colorful Ornament for Birthday Party Anniversary Home Summer Decor, 12 Styles",N/A,$12.99,,4.3,27.0,False,https://m.media-amazon.com/images/I/8103COumSiL._AC_UL320_.jpg,https://m.media-amazon.com/images/I/8103COumSiL._AC_SL1500_.jpg,,2026-04-21T11:31:40.922943,
39,3,Organic,,129.0,B0B4VLGT76,Jetec Summer Slippers Hanging Sign Shape Welcome Hello Flip Flop Wooden Door Sign Hanging Plaque Rustic Wall Sign Yard Indoor Outdoor Garden Decoration with Rope (Hello Summer),N/A,$8.99,,4.4,1167.0,False,https://m.media-amazon.com/images/I/71O52MbRKJL._AC_UL320_.jpg,https://m.media-amazon.com/images/I/71O52MbRKJL._AC_SL1500_.jpg,,2026-04-21T11:31:40.926472,
40,3,Organic,,130.0,B0CTNT4ZL9,"xo, Fetti Italian Summer Paper Plates - 32 pk, 16 9"" plates + 16 7"" plates | Bachelorette Party Decorations, Last Toast Coast, Birthday Party Supplies, Flower Baby Shower, Stripe Cake Plates",N/A,$17.99,,3.7,30.0,False,https://m.media-amazon.com/images/I/610uCWtQTkL._AC_UL320_.jpg,https://m.media-amazon.com/images/I/610uCWtQTkL._AC_SL1500_.jpg,,2026-04-21T11:31:40.930217,
41,3,Organic,,131.0,B0C3GWLW1W,"GIFTINBOX Pool Party Favors Beach Party Favors - Pool Toys For Kids Ages 3 4 5 6 7 8 Beach Balls Bulk, Kids Sunglasses, Bubble Wands, Summer Toys for Party Supplies Birthday",N/A,$32.39,,4.6,466.0,False,https://m.media-amazon.com/images/I/81xEmSpvDUL._AC_UL320_.jpg,https://m.media-amazon.com/images/I/81xEmSpvDUL._AC_SL1500_.jpg,,2026-04-21T11:31:40.934260,
42,3,Organic,,132.0,B07N7RMR1Q,"Fun Express Bulk Fedora Hats 12 Pack - Colorful Straw Party Hats for Adults & Kids | Fiesta Party Decorations for Cinco De Mayo, Birthday Celebrations & Mexican Theme Events | Assorted Rainbow Colors",N/A,$33.17,,4.1,173.0,False,https://m.media-amazon.com/images/I/81QgIcKto2L._AC_UL320_.jpg,https://m.media-amazon.com/images/I/81QgIcKto2L._AC_SL1500_.jpg,,2026-04-21T11:31:40.937808,
43,3,Organic,,133.0,B0GK575YLQ,"Chumia ""hello Summer"" ice pop Sucker Banner with Pom-pom Bunting Sucker for Party Wall Decor Hello Summer Banner for Holiday Birthday Carnival Photo Props Farmhouse Indoor Mantels Displays",N/A,$12.99,,,,False,https://m.media-amazon.com/images/I/71qieqmJGjL._AC_UL320_.jpg,https://m.media-amazon.com/images/I/71qieqmJGjL._AC_SL1500_.jpg,,2026-04-21T11:31:40.941468,
44,3,Organic,,134.0,B0CZ969M49,Glitter School’s out for Summer Banner and Colorful Glittery Summer Patterns Banner End of School Year Garland Banner Summer Vacation Beach Pool Party Fireplace Mantle Decorations,N/A,$9.99,,4.8,8.0,False,https://m.media-amazon.com/images/I/619I0Sn77zL._AC_UL320_.jpg,https://m.media-amazon.com/images/I/619I0Sn77zL._AC_SL1500_.jpg,,2026-04-21T11:31:40.944979,
45,3,Organic,,135.0,B0GL1BF729,52 Pcs Spring Summer Insects Hanging Swirls Kit Bug Party Decorations Butterfly Sunflower Ceiling Decor Insect Paper Swirl Streamers for Birthday Home Classroom Baby Shower School Bugs Wall Decoration,N/A,$8.99,,5.0,2.0,False,https://m.media-amazon.com/images/I/71891EBkUzL._AC_UL320_.jpg,https://m.media-amazon.com/images/I/71891EBkUzL._AC_SL1500_.jpg,,2026-04-21T11:31:40.951390,
46,3,Organic,,136.0,B09XR3F2GW,"GINMIC Kids Sunglasses Bulk Party Favors, 24Pack Valentines Day Gifts UV 400 Protection Neon Sunglasses for Boys and Girls, Party Favor, Birthday Classroom Goodie Bags Party Supplies.",N/A,$20.89,,4.6,1360.0,False,https://m.media-amazon.com/images/I/81JzFGTP95L._AC_UL320_.jpg,https://m.media-amazon.com/images/I/81JzFGTP95L._AC_SL1500_.jpg,,2026-04-21T11:31:40.955582,
47,3,Organic,,137.0,B09JWZ2819,"Triumpeek Inflatable Cactus Cooler, 55"" Fiesta Cactus Ice Bucket Wearing Sombreros for Summer Swimming Pool Hawaiian Themed Party Supplies",N/A,$19.99,,4.6,826.0,False,https://m.media-amazon.com/images/I/71dXIIKJn5L._AC_UL320_.jpg,https://m.media-amazon.com/images/I/71dXIIKJn5L._AC_SL1500_.jpg,,2026-04-21T11:31:40.959634,
48,3,Organic,,138.0,B0C7ZNLZHJ,Pool Party Hanging Swirls 20Pcs Summer Beach Pool Birthday Party Decorations Summer Ceiling Hanging Decorations for Hello Summer Party Beach Party Luau Hawaii Party Summer Party Supplies,N/A,$8.99,,4.7,19.0,False,https://m.media-amazon.com/images/I/81aQt8S7roL._AC_UL320_.jpg,https://m.media-amazon.com/images/I/81aQt8S7roL._AC_SL1500_.jpg,,2026-04-21T11:31:40.963700,
49,3,Organic,,139.0,B0DVTD2YPF,"xo, Fetti Pink + Green Pool Party Plastic Cups | 16 pcs 12 oz | Summer Drinkware, Colorful Decorations, Bachelorette Party Drinks, Birthday Supplies",N/A,$15.99,,4.9,14.0,False,https://m.media-amazon.com/images/I/51uCjCVkXwL._AC_UL320_.jpg,https://m.media-amazon.com/images/I/51uCjCVkXwL._AC_SL1500_.jpg,,2026-04-21T11:31:40.967786,
50,3,Organic,,140.0,B0CXXBNKYX,Hello Summer Banner Summer Party Decorations Beach Party Decoration 3Pcs Hello Summer Pool Party Banners for Hawaiian Happy Party Supplies,N/A,$9.99,,4.3,19.0,False,https://m.media-amazon.com/images/I/81-AoSj9YiL._AC_UL320_.jpg,https://m.media-amazon.com/images/I/81-AoSj9YiL._AC_SL1500_.jpg,,2026-04-21T11:31:40.973205,
51,3,Organic,,141.0,B0GKLS7CW2,"9 Sheets Summer Window Clings for Glass Windows, Beach Tropical Window Decals for Kids, Hello Summer Window Stickers for Home, Office, Classroom Spring Decor, Glass Door Decorations",N/A,$8.99,,,,False,https://m.media-amazon.com/images/I/81hFkwRtTuL._AC_UL320_.jpg,https://m.media-amazon.com/images/I/81hFkwRtTuL._AC_SL1500_.jpg,,2026-04-21T11:31:40.977407,
52,3,Organic,,142.0,B0D6BM24KK,18pcs Summer Beach Pool Centerpiece Sticks for Hello Summer Party Decorations Beach Pool Party Centerpiece for Table Summer Theme Birthday Party Hawaii Beach Party Baby Shower Supplies,N/A,$8.99,,4.0,7.0,False,https://m.media-amazon.com/images/I/8197lmVn+9L._AC_UL320_.jpg,https://m.media-amazon.com/images/I/8197lmVn+9L._AC_SL1500_.jpg,,2026-04-21T11:31:40.981679,
53,3,Organic,,143.0,B0D859Z1M1,Sun Candy Lollipops - 30 Count Individually Wrapped Suckers Bulk - Cute Fun Summer Themed Yellow Candy Favors - Beach Theme - Pool Party Treats - Birthday Party Goodie Bags - Lemon Flavor,N/A,$14.95,,4.4,212.0,False,https://m.media-amazon.com/images/I/712tB20RN+L._AC_UL320_.jpg,https://m.media-amazon.com/images/I/712tB20RN+L._AC_SL1500_.jpg,,2026-04-21T11:31:40.986438,
54,3,Organic,,144.0,B0836KTCNM,"Camlinbo 15 Pcs Inflatable Flamingo Pool Toys Ring Toss Pool Game, Flamingos Luau Party Decor Hawaiian Beach Toys Carnival Outdoor Luau Party Games Supplies for Adults Family",N/A,$12.99,,4.3,915.0,False,https://m.media-amazon.com/images/I/71GzZVqbSEL._AC_UL320_.jpg,https://m.media-amazon.com/images/I/71GzZVqbSEL._AC_SL1500_.jpg,,2026-04-21T11:31:40.991243,
56,3,Title,,,,Debug info copied.SponsoredBlueweenly 36 Pcs You are My Sunshine Squirts Bath Toys Swimming Pool Toy,,,,,,False,,,,2026-04-21T11:31:40.992328,
57,3,Title,,,,Related searchesend of summer party decorationssummer partypool party decorationssummer party decora,,,,,,False,,,,2026-04-21T11:31:40.993305,
58,3,Title,,,,Previous1234...7Next,,,,,,False,,,,2026-04-21T11:31:40.993814,
59,3,SB,4.0,,,N/A,https://aax-us-east-retail-direct.amazon.com/x/c/JB84iv_HHbQqFEmds_HYQ_AAAAGdr89V0gEAAAH2AQBvbm9fdHhuX2JpZDEgICBvbm9fdHhuX2ltcDEgICB-ETrD/clv1c_ek-wBHfWbcbSXg5XY5uoyt97Ni6EUnFBLb8M-7iqzg-sYc9nQR_ZE3CxU5KfiC2_jawwTPfM5C4OrYH0dkmBUscEu1G8ppFSESZIL1FM1tkcnwzf_p2R-O787-lEBzJcV4mDiruEDzLCTuegPsAUHZH34NuIlLXqkZJBDvSqxpNXsctcu8mrfpbePIziQsJFnwji1JNOK_f4dSTRl0vNL06LCUY7EFoz3BQacbvoLtEeest9Pa9QGv0JNpVDi_qdh7MmYfUF513dIGJ7v-trLNJfa6MFCyh3uPO3by9AHwi5YUnzzvGL2v8StuK1nUB1GrAjHXipAzvDZSiGiAt20Q21Bl8rgTqp3622Bl76XFgN2ffCSJe1NsAzNeDjdskfOe2mtPedbipPX9irltlZg4pqNCZbqTjVtu7LJNRWop-A4TLmbhSp0dHumX9xfqHzVvB6EUkEyjXsLeBdYDCieTdehpLKsR_QpiOtZVzPfcNG2DvvCLMLpuul3zsnuc4m05XHGOFnzRH6LbyaipYIOP-Jisd23sG50Lur3T3LE57PT58peJnxB8CTFthMvrGnMnxF5IoW4EOyCJ0CedhcHND7nKFeolU8FSejDjX7tMgI-pCHvxla4FyZKBpmZ-FRN9AXwC79cJU24DImMNXNxMfLEE8wCeR3qKkRccWTZ7X4nYGcUER7q5VZ0yPkjxVignEwhqxEx0BNVRwV5BEYKeuzBkAYTDf3bX69iWsRdAmwy5-qIaBBTEUow64GbCHWOkoED3svOnUa-1uzPvThVnjiL7aMcwipxukQEUDskPK8vEToCLzZg2QeSSX-40Duf9F2CjFGVpLyk5II3jztj6PiFDx_nkf64FpJxp2HFPgbfZzDzQcIAlU0BAf_ssbeQB0VQ5HfHlkbu__NvTef4hxLjyahy0L5W9YjCfaVwZmXIjfB3AstWr3cS9JMoOpRP_Yf3m8Lp9xvtaF3itFyPNMUVvjUh8ADswuiJmmKYKuUibw7uuW-Cc3UTqaWu6CGclq1C9So29UeLWKvPdvur3YAOYNQ_3SrAjCs6-ym_pDFbOH6N764B6Z7QrdCu0-jED6DhEnZqpBTK3Rco0kV31PJLdW5d-I0c_Jj2ptuQ93tQhtmcOlTXbknExBCH0dL_HJyHBR9TPdWz8dt-qEnDNwdlLBvxi3eifDA_WeO0jd9i6Gafh_fNH4PPNoIkJGOYWkX8XnzTO20vGLJzPjms1kY0V2UVE0Tdj7JHqlIOdqGpLptDZ0k3vs62PPuwsw1M8BXK_zx7XbJ2LluxvM38eU2ZVF46s-3rxszrW32hUD60W_AGdvEiEyTdbbltCPvJekErtVURfWw978y2y8mTzdc9XYZctiMiuJl062lVUxACM6IDSblZ0Vq-0qMnkim0VE3Hs3OKYPJCkE7o7qTJkCjSGn2bUn6LhiMDuBbboqva6WIjV7vYUxVCq4tdhNt4D98IYbDcYm_bTpK18WkDg8srIziG6FmnJKGKSZw4k9nhiyLzhnAxNtVkG7YOQQQ3Lm9a9fhtp8BjFSIxuZkp_VznfKLuN9eGnaAc3eTvoiRNgi9vlAsS_B3aG_LSatOpjgDaMVt0OkJZkvXjeoSF2ux4_NW1B8JeCpdceNaWto1eYB6oZ4UC1GkLj7UIb1YIUP5QEN4MOjQB-3AIqyS5g/https://www.amazon.com/stores/page/AD723312-D35D-4CD3-B0E9-65BDEF2E3F00/?_encoding=UTF8&store_ref=SB_A04583713QCU9RACLQ6F4-A08954171UQSVU17I1HR0&pd_rd_plhdr=t&aaxitk=b3d19e8ea5339ff8af01be66ac5ac2a4&hsa_cr_id=0&lp_asins=B0DM1ZVLTX%2CB0GF1NLKLN%2CB0G3PCVXSD&lp_query=summer%20party%20decorations&lp_slot=desktop-hsa-3psl&ref_=sbx_be_s_3psl_mbd_mb0_bkgd&pd_rd_w=zSoAM&content-id=amzn1.sym.cd7c548b-a599-426f-9ffe-daa1aa803c87%3Aamzn1.sym.cd7c548b-a599-426f-9ffe-daa1aa803c87&pf_rd_p=cd7c548b-a599-426f-9ffe-daa1aa803c87&pf_rd_r=5A96RNFFRSEH8Z3W4HGG&pd_rd_wg=AqqDH&pd_rd_r=90f9f389-1d13-4898-ad0a-786467951bfb,,,,,False,,,N/A,2026-04-21T11:31:40.999295,
60,3,Title,,,,Need help?Visit the help sectionorcontact us,,,,,,False,,,,2026-04-21T11:31:41.000029,
0,4,SB_Video,3.0,,,N/A,N/A,,,,,False,,,,2026-04-21T11:31:58.740159,1.0
1,4,Title,,,,ResultsCheck each product page for other buying options. Price and other details may vary based on p,,,,,,False,,,,2026-04-21T11:31:58.741488,
3,4,Organic,,145.0,B0CR6RXWT1,"100pcs Luau Party Decorations, Silk Hawaiian Leis Tropical Flower Necklaces, Colorful Hula Dance Bulk Leis Decor, Flower Hawaiian Leis for Summer Beach Pool Theme Party Decorations Favors Supplies",N/A,$35.99,,4.5,2699.0,False,https://m.media-amazon.com/images/I/91Qb2mxWFxL._AC_UL320_.jpg,https://m.media-amazon.com/images/I/91Qb2mxWFxL._AC_SL1500_.jpg,,2026-04-21T11:31:58.745957,
4,4,Organic,,146.0,B0B4VLGT76,Jetec Summer Slippers Hanging Sign Shape Welcome Hello Flip Flop Wooden Door Sign Hanging Plaque Rustic Wall Sign Yard Indoor Outdoor Garden Decoration with Rope (Hello Summer),N/A,$8.99,,4.4,1167.0,False,https://m.media-amazon.com/images/I/71O52MbRKJL._AC_UL320_.jpg,https://m.media-amazon.com/images/I/71O52MbRKJL._AC_SL1500_.jpg,,2026-04-21T11:31:58.749282,
5,4,Organic,,147.0,B0C3GWLW1W,"GIFTINBOX Pool Party Favors Beach Party Favors - Pool Toys For Kids Ages 3 4 5 6 7 8 Beach Balls Bulk, Kids Sunglasses, Bubble Wands, Summer Toys for Party Supplies Birthday",N/A,$32.39,,4.6,466.0,False,https://m.media-amazon.com/images/I/81xEmSpvDUL._AC_UL320_.jpg,https://m.media-amazon.com/images/I/81xEmSpvDUL._AC_SL1500_.jpg,,2026-04-21T11:31:58.753506,
6,4,Title,,,,Under The Sea Party DecorationsSponsored|Shop yorrShop nowPrevious pageUnder The Sea Party Decoratio,,,,,,False,,,,2026-04-21T11:31:58.755020,
7,4,Title,,,,More results,,,,,,False,,,,2026-04-21T11:31:58.755207,
8,4,Organic,,148.0,B0GK575YLQ,"Chumia ""hello Summer"" ice pop Sucker Banner with Pom-pom Bunting Sucker for Party Wall Decor Hello Summer Banner for Holiday Birthday Carnival Photo Props Farmhouse Indoor Mantels Displays",N/A,$12.99,,,,False,https://m.media-amazon.com/images/I/71qieqmJGjL._AC_UL320_.jpg,https://m.media-amazon.com/images/I/71qieqmJGjL._AC_SL1500_.jpg,,2026-04-21T11:31:58.760199,
9,4,Organic,,149.0,B0CWH5MH8S,"24 Summer Crazy Straws for Kids Bulk, Pool Party Favors for Kids Birthday, Beach Party Decorations Supplies, Back to School and End of Year Student Gifts with 2 Cleaning Brushes",N/A,$9.99,,4.6,80.0,False,https://m.media-amazon.com/images/I/81NvzZiADsL._AC_UL320_.jpg,https://m.media-amazon.com/images/I/81NvzZiADsL._AC_SL1500_.jpg,,2026-04-21T11:31:58.764810,
10,4,Organic,,150.0,B095S5DPN5,"FUTUREPLUSX 48 PCS Leis for Luau Party decorations, Hawaiian Leis Tropical Hawaiian Bulk Including Colorful Flower Necklace Headbands and Wristbands for Hula Dance Party Tropical Summer Beach Theme",N/A,$11.99,,4.5,690.0,False,https://m.media-amazon.com/images/I/91F4LP+2-TL._AC_UL320_.jpg,https://m.media-amazon.com/images/I/91F4LP+2-TL._AC_SL1500_.jpg,,2026-04-21T11:31:58.769954,
11,4,Organic,,151.0,B0D8VVKG4J,"ASTARON Black Sunglasses Bulk, 6/12/24/48 Pack Sunglasses Party Favors for Summer Beach Pool Birthday Wedding Party Supplies",N/A,$13.99,,4.7,1343.0,False,https://m.media-amazon.com/images/I/71VD0MYkNDL._AC_UL320_.jpg,https://m.media-amazon.com/images/I/71VD0MYkNDL._AC_SL1500_.jpg,,2026-04-21T11:31:58.776932,
12,4,Organic,,152.0,B0GKLS7CW2,"9 Sheets Summer Window Clings for Glass Windows, Beach Tropical Window Decals for Kids, Hello Summer Window Stickers for Home, Office, Classroom Spring Decor, Glass Door Decorations",N/A,$8.99,,,,False,https://m.media-amazon.com/images/I/81hFkwRtTuL._AC_UL320_.jpg,https://m.media-amazon.com/images/I/81hFkwRtTuL._AC_SL1500_.jpg,,2026-04-21T11:31:58.781077,
13,4,Organic,,153.0,B0DVTD2YPF,"xo, Fetti Pink + Green Pool Party Plastic Cups | 16 pcs 12 oz | Summer Drinkware, Colorful Decorations, Bachelorette Party Drinks, Birthday Supplies",N/A,$15.99,,4.9,14.0,False,https://m.media-amazon.com/images/I/51uCjCVkXwL._AC_UL320_.jpg,https://m.media-amazon.com/images/I/51uCjCVkXwL._AC_SL1500_.jpg,,2026-04-21T11:31:58.784863,
14,4,Title,,,,3x6 Ft American Patriotic Pleated Fan FlagShopCouahPrevious page3x6 Ft 4 Pack American Pleated Bunti,,,,,,False,,,,2026-04-21T11:31:58.786529,
15,4,Title,,,,More results,,,,,,False,,,,2026-04-21T11:31:58.786670,
16,4,Organic,,154.0,B0GMQ63YV1,"Seashell Beach Party Decorations, Ocean Seashell Birthday Party Supplies with Starfish Plates,Napkins,Banner,Balloons,Tablecloth,Cups,Cake Topper,Honeycomb for Summer Birthday Party Decorations",N/A,$21.99,,,,False,https://m.media-amazon.com/images/I/81NNOMn4eNL._AC_UL320_.jpg,https://m.media-amazon.com/images/I/81NNOMn4eNL._AC_SL1500_.jpg,,2026-04-21T11:31:58.790585,
17,4,Organic,,155.0,B0C7ZNLZHJ,Pool Party Hanging Swirls 20Pcs Summer Beach Pool Birthday Party Decorations Summer Ceiling Hanging Decorations for Hello Summer Party Beach Party Luau Hawaii Party Summer Party Supplies,N/A,$8.99,,4.7,19.0,False,https://m.media-amazon.com/images/I/81aQt8S7roL._AC_UL320_.jpg,https://m.media-amazon.com/images/I/81aQt8S7roL._AC_SL1500_.jpg,,2026-04-21T11:31:58.796864,
18,4,Organic,,156.0,B0C5J75QXP,"36 Pcs Summer Wood Hanging Ornaments Summer Flip Flop Wood Chip Hanging Tree Hanging Ornament Wood Tags Colorful Ornament for Birthday Party Anniversary Home Summer Decor, 12 Styles",N/A,$12.99,,4.3,27.0,False,https://m.media-amazon.com/images/I/8103COumSiL._AC_UL320_.jpg,https://m.media-amazon.com/images/I/8103COumSiL._AC_SL1500_.jpg,,2026-04-21T11:31:58.800612,
19,4,Organic,,157.0,B0GL1BF729,52 Pcs Spring Summer Insects Hanging Swirls Kit Bug Party Decorations Butterfly Sunflower Ceiling Decor Insect Paper Swirl Streamers for Birthday Home Classroom Baby Shower School Bugs Wall Decoration,N/A,$8.99,,5.0,2.0,False,https://m.media-amazon.com/images/I/71891EBkUzL._AC_UL320_.jpg,https://m.media-amazon.com/images/I/71891EBkUzL._AC_SL1500_.jpg,,2026-04-21T11:31:58.805223,
20,4,Organic,,158.0,B09XR3F2GW,"GINMIC Kids Sunglasses Bulk Party Favors, 24Pack Valentines Day Gifts UV 400 Protection Neon Sunglasses for Boys and Girls, Party Favor, Birthday Classroom Goodie Bags Party Supplies.",N/A,$20.89,,4.6,1360.0,False,https://m.media-amazon.com/images/I/81JzFGTP95L._AC_UL320_.jpg,https://m.media-amazon.com/images/I/81JzFGTP95L._AC_SL1500_.jpg,,2026-04-21T11:31:58.810143,
21,4,Organic,,159.0,B0F1SXK93S,CHARLENT Glitter Temporary Tattoos for Aloha Party Decoration - 74 Individually Sheets Glitter Summer Tattoos for Kids Women Hawaiian Party Favors,N/A,$6.99,,4.7,143.0,False,https://m.media-amazon.com/images/I/81vtkHW4-xL._AC_UL320_.jpg,https://m.media-amazon.com/images/I/81vtkHW4-xL._AC_SL1500_.jpg,,2026-04-21T11:31:58.816009,
22,4,Organic,,160.0,B0F9Y9SJNZ,"50 Counts Hawaiian Leis Bulk Decorations, Leis for Luau Party Hawaiian Colorful Tropical Flower Lays for Adults Hawaii Summer Beach Luau Party Favors Birthday Party Supplies",N/A,$19.99,,4.8,41.0,False,https://m.media-amazon.com/images/I/81QW9MLaIaL._AC_UL320_.jpg,https://m.media-amazon.com/images/I/81QW9MLaIaL._AC_SL1500_.jpg,,2026-04-21T11:31:58.821136,
23,4,Organic,,161.0,B09JWZ2819,"Triumpeek Inflatable Cactus Cooler, 55"" Fiesta Cactus Ice Bucket Wearing Sombreros for Summer Swimming Pool Hawaiian Themed Party Supplies",N/A,$19.99,,4.6,826.0,False,https://m.media-amazon.com/images/I/71dXIIKJn5L._AC_UL320_.jpg,https://m.media-amazon.com/images/I/71dXIIKJn5L._AC_SL1500_.jpg,,2026-04-21T11:31:58.825884,
24,4,Organic,,162.0,B0CZ969M49,Glitter School’s out for Summer Banner and Colorful Glittery Summer Patterns Banner End of School Year Garland Banner Summer Vacation Beach Pool Party Fireplace Mantle Decorations,N/A,$9.99,,4.8,8.0,False,https://m.media-amazon.com/images/I/619I0Sn77zL._AC_UL320_.jpg,https://m.media-amazon.com/images/I/619I0Sn77zL._AC_SL1500_.jpg,,2026-04-21T11:31:58.829783,
25,4,Organic,,163.0,B0D6BM24KK,18pcs Summer Beach Pool Centerpiece Sticks for Hello Summer Party Decorations Beach Pool Party Centerpiece for Table Summer Theme Birthday Party Hawaii Beach Party Baby Shower Supplies,N/A,$8.99,,4.0,7.0,False,https://m.media-amazon.com/images/I/8197lmVn+9L._AC_UL320_.jpg,https://m.media-amazon.com/images/I/8197lmVn+9L._AC_SL1500_.jpg,,2026-04-21T11:31:58.834715,
