data_index,page,ad_type,ad_rank,organic_rank,asin,title,url,price_current,price_list,rating_stars,rating_count,is_prime,image_small,image_large,brand_name,scraped_at,inner_products_count
0,1,SB,1.0,,,Travel Activities for Kids,https://aax-events-cell01-cf.us-east.ono.axp.amazon-adsystem.com/x/c/JEiywqX_lSnPyi2GsoDeV3wAAAGdr9B7kQEAAAH2AQBvbm9fdHhuX2JpZDEgICBvbm9fdHhuX2ltcDIgICCAd4hG/clv1c_ek-IBXfWYkbXHj8nY-s8yi9Z7dM1iEYApnnt_IoJ193J_5qW07Y8odpIaG6Elt9TxVpnwL_GqDvlLZmC5t7esNDNoIuyVQAgmHGs7GORGUYmzQnIjsjDg-oF4eWcZnIgxXBrjiVrpp2nu0EfigTj8GP_uqlclEnyEsb9kzmrlE4_e2kREvDsPYMMDASz0vqxkBQvgyjrUeGIBqX6oXrkQoM7n1u5JcQEkKY-0CDwq5AaJL8niAMF9Nbl10-53ajJsEz-UtpTrQ9ZmMaMVWes5kIN0WpkrGrlx_1KUwfxlGkW5dKXMVcJr2-kdQcdl9iPBvlXL-Xe_Iy0a_-8NcMuo9Nty1XeE2bGGoAGMQKhvM6RNeuC3rCgpUdjSezNIxFKliHfbEMCLNSKbJGvQof-18U43ijGTreGWz3VghS_UoKcC2CWixhVkrRRf7pf9AWQbV2mSvF82TBA1aN6RpkOEtBJVr1zWVwQTirWrfZBL-bC30DZXBblgF9vaTTS2R_8TvzB1SpXFzEaF2ICvYCyqVIJ28rj94s811fMO1HzgRWmywZfFTr2Y6wFw4BE36fGXFc05JF2ZlM5ANGKC26Pw1ZohSwoqQmvLTQnPsT8Lwo5a2i8uCgOuiD9z27NGbYUPbK-MdqLp8OosLxDGl9_hSUMo1GVE9-LsoenBnUs5CgT8mQpbod-fZ9kQ6g_Ezr4nNnDNReQky50baVtuGJ84mbh61C0gZhXYd6Ne0Ljl247oikR9INkumAG2zRkr-Fjhmknor4xGt1-taMzy2SlkJ82uEpVqse2bemFXjKtx0AAt4fjOsvxAiwBJvCHdwiPVutOeX3eqavysoxk6-jU9bZrCXRIVGTmWS2p4-r1wQFXN56CJi-ZMISzBZ7H1nszQiD8G34seVFEfR-U8vUpO3d0rtBrl2xpKpYpaFns9yysQy7K7kLxdT7wSB1ucLlyFhzbx3OCuER8fmmwaEFOBoL2hxqLiampIKoCw4_3qDFMB4MNx_TBu4aJXAAcMUtQj5u3EXSou_6YKTWEpFXTh0wcha2NFfcjr-RdWHiLOhR3a1JL3GbRDoSVTRoMflGF4mWvXDia9cwWPBEB5hJLD9FpWGWhSvd9yh3_3aVHCnsm3Lqv_7mPqhvMP8Rr5kksnDmK-5H2AXEdtKl4JgaPDmhOSdtpZzmvfx0SR8N8qNw-sAmPmXi-TdOx7mvuvyML1CRzHddz4Vcbp44PueFh09ohmeN5yLdM3ieva-EIG-4EbaF8PalwylESbq0TMBE2RoxDsyMIDkWC481q-whSAFL_xYnGgzgNJ9KGn37h7W_x4e8Z2jurXli3oz-Kz92RCv8uRKoxUwYZGjXfgDQnNJUit5dPNADmaaqkV71vql_mTT41a0t5Y9wSZ1GkkkmXba6WqTKvtYB7kF1SAc09pWl9Q5zl5PRK80kbED6dZs-zU6SQXVPYwl0aw_jMDNqU42eW6lY7hqxlECAS2VqRJaosYMR0ajqVDuVKOuDnyNeEpPZ557ffZcgMML3DadBvI12UyJ7-BlXwmVstHdvy0sVntJZNtRQKqXm7MhXRlksnooIwWapgWJyRjFaXVPpVf88h8KnihZtSUQqiJxxkULpGNAQ4sAVBmb1Xijw0A1ng-5PLV5oQJ1MFaUD44rHpZjNz_hZPlSiA0dgLwLMXJVU7nR0aGM-Heel3CkYOVV7GS6I/https://www.amazon.com/stores/page/DBC38549-974F-48C0-AB3D-93F4CBDDC59B/?_encoding=UTF8&store_ref=SB_A0149544926FCABD643D-A0962715395MYGX979JJD&pd_rd_plhdr=t&aaxitk=20ef2c70a5611a1beb6fdd0949a54013&hsa_cr_id=0&lp_asins=B01KYLLOFE%2CB00TF7ZZM2%2CB07QL3D9VP&lp_query=summer%20crafts%20for%20kids&lp_slot=auto-sparkle-hsa-tetris&ref_=sbx_s_sparkle_sbtcd_bkgd&pd_rd_w=9PeXZ&content-id=amzn1.sym.2fb72bc8-96ef-420d-b08f-c04b69f36507%3Aamzn1.sym.2fb72bc8-96ef-420d-b08f-c04b69f36507&pf_rd_p=2fb72bc8-96ef-420d-b08f-c04b69f36507&pf_rd_r=W5WKWCAJG8XQDVEHETDV&pd_rd_wg=FVJnl&pd_rd_r=f5c80886-4dde-449c-9ddc-54508ef5123c,,,,,False,"https://m.media-amazon.com/images/S/al-na-9d5791cf-3faf/634935eb-5018-4f4e-942f-2c510dac3d60._CR0,0,1800,1500_AC_SX130_SY60_CB1169409_QL70_.jpg",,Travel Activities for Kids,2026-04-21T11:32:56.160147,3.0
1,1,Title,,,,ResultsCheck each product page for other buying options. Price and other details may vary based on p,,,,,,False,,,,2026-04-21T11:32:56.161158,
3,1,Organic,,1.0,B0DXVHSV9X,Trnayi 36 Pcs Summer Unfinished Wooden Keychains Color Your Own Beach Fruit Keychains Tropical Hawaiian Luau Blank Wood Painting DIY Crafts for Summer Party Activities Arts Project Decor,N/A,$16.99,,4.7,88.0,False,https://m.media-amazon.com/images/I/81hLs3bt+xL._AC_UL320_.jpg,https://m.media-amazon.com/images/I/81hLs3bt+xL._AC_SL1500_.jpg,,2026-04-21T11:32:56.166084,
4,1,Organic,,2.0,B0DJ8TQT79,"JOYIN 36 Pcs 9""x6"" Summer Make a face Stickers for Kids, Make Your Own Hawaii Pool Beach Sticker Sheets, Luau Craft Party Decor, Summer Holiday Party Favors Kids Crafts, Goodie Bags Stuffers",N/A,$5.39,,4.8,7634.0,False,https://m.media-amazon.com/images/I/91d4reOTOrL._AC_UL320_.jpg,https://m.media-amazon.com/images/I/91d4reOTOrL._AC_SL1500_.jpg,,2026-04-21T11:32:56.172006,
5,1,Organic,,3.0,B0GN1NVBK1,"JOPHMO 24 Pack DIY Wood Picture Frames - 4 x 6 Unfinished Wooden Photo Frame with Beach Stickers Rhinestone Stickers Painting Tools, Summer Beach Theme Arts and Crafts Kit Birthday Party Favors",N/A,$29.99,,5.0,5.0,False,https://m.media-amazon.com/images/I/91Ojv3Lg90L._AC_UL320_.jpg,https://m.media-amazon.com/images/I/91Ojv3Lg90L._AC_SL1500_.jpg,,2026-04-21T11:32:56.176320,
7,1,Title,,,,"Debug info copied.SponsoredKiditos Magic Water Elf Toy Kit – Squishies for Kids, 20 Gels & 10 Molds,",,,,,,False,,,,2026-04-21T11:32:56.177908,
8,1,Title,,,,Fuzzy Velvet Color Make Your Own Jigsaw PuzzlesSponsored|Shop RealspringShop nowPrevious pageRealspr,,,,,,False,,,,2026-04-21T11:32:56.179921,
9,1,Title,,,,More results,,,,,,False,,,,2026-04-21T11:32:56.180121,
10,1,Organic,,4.0,B0C7S26G2L,"Dan&Darci Kids Sea Shell Painting Kit - Arts & Crafts for Kids - Gifts for Boys and Girls Ages 6-8, 8-12 - Craft Activities Kits - Creative Art Activity Gift Toys for Age 6 7 8 9 10 11 12 Year Old",N/A,$9.98,,4.6,1666.0,False,https://m.media-amazon.com/images/I/81UQKatVU8L._AC_UL320_.jpg,https://m.media-amazon.com/images/I/81UQKatVU8L._AC_SL1500_.jpg,,2026-04-21T11:32:56.185244,
11,1,Organic,,5.0,B094P1WXYF,"4E's Novelty 24 Pack DIY Pinwheels Craft for Kids, Bulk Summer Pinwheel Craft Kit, Color Your Own Paper Windmill for Pinwheels for Kids Bulk Spring Craft for Kids Easter Art Games",N/A,$18.99,,4.4,226.0,False,https://m.media-amazon.com/images/I/81qP1zjZ-ML._AC_UL320_.jpg,https://m.media-amazon.com/images/I/81qP1zjZ-ML._AC_SL1500_.jpg,,2026-04-21T11:32:56.195053,
12,1,Organic,,6.0,B0DY4R1CMC,"30Sets Summer Felt Visor Hats Crafts Kits for Kids Bulk, DIY Beach Sun Visor Hat Activities with Stickers for Hawaiian/Luau/Under-The-Sea Party Supplies",N/A,$20.99,,4.7,17.0,False,https://m.media-amazon.com/images/I/9153AfDU3vL._AC_UL320_.jpg,https://m.media-amazon.com/images/I/9153AfDU3vL._AC_SL1500_.jpg,,2026-04-21T11:32:56.200047,
13,1,Organic,,7.0,B0CPP6M7RW,Durable Resin Garden Pot Craft Kit for Kids- 24 Pack Colorful Flower Plant Spring Crafts with Super-adhesive Stickers & Blank Labels School Activities Growing Kit for Classroom Home DIY Gift 4+ years,N/A,$25.99,,4.7,56.0,False,https://m.media-amazon.com/images/I/81N-2tO-mGL._AC_UL320_.jpg,https://m.media-amazon.com/images/I/81N-2tO-mGL._AC_SL1500_.jpg,,2026-04-21T11:32:56.205220,
14,1,Organic,,8.0,B0CVWZCWGW,OHOME Summer Giant Coloring Poster/Tablecloth - Summer Decorations - 30 x 72 Inches Jumbo Paper Coloring Banner - Kids Crafts Gifts Toys Games Ice Cream Party Decorations - Arts Crafts Supplies,N/A,$7.16,,4.8,1550.0,False,https://m.media-amazon.com/images/I/91DIFfRUjlL._AC_UL320_.jpg,https://m.media-amazon.com/images/I/91DIFfRUjlL._AC_SL1500_.jpg,,2026-04-21T11:32:56.210146,
15,1,Organic,,9.0,B08HD89CX6,"Rock Painting Kit- Glow in The Dark Rock Kit, Arts and Crafts for Kids Ages 6-12, Art Supplies Toy , Kids Craft Paint Kits, Arts & Crafts for Boys Girls Birthday Party Gift Toy",N/A,$13.98,,4.7,10933.0,False,https://m.media-amazon.com/images/I/811-oY6xryL._AC_UL320_.jpg,https://m.media-amazon.com/images/I/811-oY6xryL._AC_SL1500_.jpg,,2026-04-21T11:32:56.215846,
16,1,Organic,,10.0,B0D1VHPV4M,"Summer Craft Kits for Kids Make A Ocean Animals Worlds Stickers Scene, Summer Craft Under The Sea Scene Sticker Shark Tropical Fish Sea Animal Bulk Set for Home Classroom Game Activities (24Set)",N/A,$9.99,,4.6,100.0,False,https://m.media-amazon.com/images/I/81ANssB4OsL._AC_UL320_.jpg,https://m.media-amazon.com/images/I/81ANssB4OsL._AC_SL1500_.jpg,,2026-04-21T11:32:56.220409,
17,1,Organic,,11.0,B09TZW9643,chiazllta 30 Pack Summer Crafts Kit for Kids End of School Year Picture Frames Beach DIY Art Crafts Classroom Summer Activities Game Party Favor,N/A,$9.99,,4.4,505.0,False,https://m.media-amazon.com/images/I/812knrxRe2L._AC_UL320_.jpg,https://m.media-amazon.com/images/I/812knrxRe2L._AC_SL1500_.jpg,,2026-04-21T11:32:56.226483,
18,1,Organic,,12.0,B0DZBPJKMD,"RattanView 24 Pcs Summer Party Craft Color Your Own Keychains Diy Craft Wooden Blank Keychains for Sunday School Classroom Home Active Party Favors Gifts, 12 Styles",N/A,$14.99,,4.6,110.0,False,https://m.media-amazon.com/images/I/719MCU2i+LL._AC_UL320_.jpg,https://m.media-amazon.com/images/I/719MCU2i+LL._AC_SL1500_.jpg,,2026-04-21T11:32:56.232013,
19,1,Organic,,13.0,B089WKB15C,"JOYEZA Rock Painting Kit Deluxe, Arts and Crafts for Girls Boys Age 6+, 12 Rocks Tween Gift Art Set, Waterproof Paints, Craft Kits Art Supplies, Kids Crafts Ages 6-8, Kids Activities 6 7 8 9 10",N/A,$7.99,,4.6,4027.0,False,https://m.media-amazon.com/images/I/81RDcxjWdDL._AC_UL320_.jpg,https://m.media-amazon.com/images/I/81RDcxjWdDL._AC_SL1500_.jpg,,2026-04-21T11:32:56.235970,
20,1,Organic,,14.0,B0CSDRX3Z7,"24Set Spring Craft Kits for Kids Make A Summer Bugs Stickers Scene, DIY Summer Craft Jar Sticker Butterfly Flower Bee Mushroom Insect Bulk Set Make Your Own Scene for Home Classroom Game Activities",N/A,$9.99,,4.9,22.0,False,https://m.media-amazon.com/images/I/81EeR8o+k6L._AC_UL320_.jpg,https://m.media-amazon.com/images/I/81EeR8o+k6L._AC_SL1500_.jpg,,2026-04-21T11:32:56.239696,
21,1,Title,,,,More results,,,,,,False,,,,2026-04-21T11:32:56.240446,
22,1,Organic,,15.0,B0DTHLDPKP,"Feifeiya 24 Sets Foam Visors for Kids, Color Your Own Foam Sun Visors with Pens DIY Coil Visor Summer DIY Class Crafts(Beach)",N/A,$23.99,,4.5,15.0,False,https://m.media-amazon.com/images/I/81sGNe0o2GL._AC_UL320_.jpg,https://m.media-amazon.com/images/I/81sGNe0o2GL._AC_SL1500_.jpg,,2026-04-21T11:32:56.245540,
23,1,Organic,,16.0,B07HSJNSJR,"Creative Roots Mosaic Turtle DIY Stepping Stone Kit, Includes Ceramic Stone & 6 Vibrant Paints for Kids Ages 8+",N/A,$8.99,,4.6,23343.0,False,https://m.media-amazon.com/images/I/811sbLqC7uL._AC_UL320_.jpg,https://m.media-amazon.com/images/I/811sbLqC7uL._AC_SL1500_.jpg,,2026-04-21T11:32:56.250629,
24,1,Organic,,17.0,B0DDLZV8YM,Dan&Darci Aqua Fairy Water Gel Kit for Kids - Gifts for Girls - Magic Elf Toy Kits - Waters Pets - DIY Squishy Maker Set - Craft for Kids - Make Your Own Squishies Toys Crafts - Gifts for Boys & Girls,N/A,$26.99,,4.7,2610.0,False,https://m.media-amazon.com/images/I/81zOXYyoExL._AC_UL320_.jpg,https://m.media-amazon.com/images/I/81zOXYyoExL._AC_SL1500_.jpg,,2026-04-21T11:32:56.254287,
25,1,Organic,,18.0,B00HUBBDIK,"Made By Me Create Your Own Window Art, Paint Your Own Suncatchers, DIY Arts & Crafts Idea, Craft Kits for Kids, Crafts for Kids & Toddlers, Toddler Arts and Crafts",N/A,$10.97,,4.7,30776.0,False,https://m.media-amazon.com/images/I/91MeCsPGRGL._AC_UL320_.jpg,https://m.media-amazon.com/images/I/91MeCsPGRGL._AC_SL1500_.jpg,,2026-04-21T11:32:56.262204,
26,1,Organic,,19.0,B0DXF11NX4,Lonfliness 30 Sets Dessert Arts Crafts Coloring Magnets Kits for Fridge Color Your Own Ice Cream Donut Cupcake DIY Magnetic Sweet Treat Crafts for Party Decorations Classroom Home Activities Games,N/A,$9.99,,4.3,50.0,False,https://m.media-amazon.com/images/I/81No9BgHxSL._AC_UL320_.jpg,https://m.media-amazon.com/images/I/81No9BgHxSL._AC_SL1500_.jpg,,2026-04-21T11:32:56.265819,
27,1,Organic,,20.0,B0C6M4QR7S,Winlyn 36 Sets Summer Crafts Kits DIY Whimsical Bookmarks Decorations Art Sets Fruits Treats Animals Sun Rainbow Foam Stickers for Kids Classroom Activities Reading Rewards Birthday Camp Party Favors,N/A,$19.99,,4.7,101.0,False,https://m.media-amazon.com/images/I/81+C+duAtxL._AC_UL320_.jpg,https://m.media-amazon.com/images/I/81+C+duAtxL._AC_SL1500_.jpg,,2026-04-21T11:32:56.269466,
28,1,Organic,,21.0,B0DRDXP6X1,"Toysmith Outdoor Discovery Solar Print Paper Kit Bundle – Sun Printing Set for Kids – Includes 36 Sheets Sun Print Paper, Stencils, & Frames – Creative Arts & Crafts Gift for Boys & Girls Ages 5+",N/A,$24.99,,4.4,372.0,False,https://m.media-amazon.com/images/I/71yY7-BDmpL._AC_UL320_.jpg,https://m.media-amazon.com/images/I/71yY7-BDmpL._AC_SL1500_.jpg,,2026-04-21T11:32:56.273309,
29,1,Organic,,22.0,B0GR9VTJ7F,"24 Set Summer Arts and Crafts for Kids Adults Bulk, Hawaiian Summer Activities DIY Puzzle Kit with Beach Tropical Palm Tree, Ocean Theme Painting for Classroom Party Favors Gift Coloring Game Supplies",N/A,$15.98,,4.4,45.0,False,https://m.media-amazon.com/images/I/91qUgBztU3L._AC_UL320_.jpg,https://m.media-amazon.com/images/I/91qUgBztU3L._AC_SL1500_.jpg,,2026-04-21T11:32:56.277241,
30,1,Organic,,23.0,B0D9M3TWZJ,"EPUMP Sea Shell Painting Kit for Kids - Glow in the Dark Beach Toys and Summer Crafts, Arts and Crafts Kit Creative DIY Indoor Outdoor Activity Toy Birthday Gift for Boys Girls Age 6 7 8 9 10 11 12+",N/A,$7.99,,4.6,711.0,False,https://m.media-amazon.com/images/I/81UDAPHzMnL._AC_UL320_.jpg,https://m.media-amazon.com/images/I/81UDAPHzMnL._AC_SL1500_.jpg,,2026-04-21T11:32:56.280246,
31,1,Title,,,,More results,,,,,,False,,,,2026-04-21T11:32:56.280635,
32,1,Organic,,24.0,B0F32NWX24,"Klever Kits JOVA Stepping Stones Painting Kit for Kids - Paint 5 Garden Stones, Ceramic Garden Decor, Unicorn Craft Kits for Boys, Easter Crafts Gifts for Boy, Girl Age 8+ Year Old - Summer Gift",N/A,$21.99,,4.8,149.0,False,https://m.media-amazon.com/images/I/914Z8GvppJL._AC_UL320_.jpg,https://m.media-amazon.com/images/I/914Z8GvppJL._AC_SL1500_.jpg,,2026-04-21T11:32:56.283329,
33,1,Organic,,25.0,B000J3ZVMK,"4M Make A Wind Chime Kit - Arts & Crafts Construct & Paint A Wind Powered Musical Chime DIY Gift for Kids, Boys & Girls",N/A,$10.99,,4.5,9438.0,False,https://m.media-amazon.com/images/I/61-FGO3h6VL._AC_UL320_.jpg,https://m.media-amazon.com/images/I/61-FGO3h6VL._AC_SL1500_.jpg,,2026-04-21T11:32:56.287726,
34,1,Organic,,26.0,B01M5F2YPO,"Crayola Ultimate Washable Chalk Collection (64ct), Essential Easter Basket Stuffers, Bulk Outdoor Sidewalk Chalk for Kids, Outdoor Activities & Spring Crafts, Gifts for Kids",N/A,$20.02,,4.7,9806.0,False,https://m.media-amazon.com/images/I/81yD8+ZY+IL._AC_UL320_.jpg,https://m.media-amazon.com/images/I/81yD8+ZY+IL._AC_SL1500_.jpg,,2026-04-21T11:32:56.291706,
35,1,Organic,,27.0,B08F998VHB,"hapray 4 Pack Bird House Crafts for Kids Ages 5-8 8-12, Buildable DIY Birdhouse Kit for Children to Build, Summer Arts and Craft Projects with Paint, 3+ Boy Girl Gift for Halloween Christmas",N/A,$23.99,,4.5,2489.0,False,https://m.media-amazon.com/images/I/71WooHz+mKL._AC_UL320_.jpg,https://m.media-amazon.com/images/I/71WooHz+mKL._AC_SL1500_.jpg,,2026-04-21T11:32:56.295307,
36,1,Organic,,28.0,B09MF1CZ4Y,"SunGemmers Window Gem Art Suncatcher Kits - Summer Crafts for Kids, Fun 5 Year Old Girl Birthday Gift, Fun Gifts for 8 Year Old Girls, Crafts for Kids Ages 4-10, Diamond Art Kit for Boys & Girls 6-12",N/A,$5.99,,4.6,7275.0,False,https://m.media-amazon.com/images/I/91W4OW8CkOL._AC_UL320_.jpg,https://m.media-amazon.com/images/I/91W4OW8CkOL._AC_SL1500_.jpg,,2026-04-21T11:32:56.299123,
37,1,Organic,,29.0,B0D297W4D4,"Worgree 48 Pcs DIY Wooden Magnets, Wooden Art Craft Supplies Painting Kit for Kids Ages 4-8 8-12 Glow in The Dark Party Favors Goodie Bag Stuffers Birthday Gifts Toys for Boys Girls",N/A,$12.59,,4.4,293.0,False,https://m.media-amazon.com/images/I/81ESOZ0DT9L._AC_UL320_.jpg,https://m.media-amazon.com/images/I/81ESOZ0DT9L._AC_SL1500_.jpg,,2026-04-21T11:32:56.303345,
38,1,Organic,,30.0,B0BRNY9HZB,"Dan&Darci Kids Rock Painting Kit - Glow in The Dark - Gifts Arts & Crafts for Boys and Girls Ages 6-12 - Craft Activities Kits - Creative Art Toys for 6, 7, 8, 9, 10, 11 & 12 Year Old Kid",N/A,$11.98,,4.7,31037.0,False,https://m.media-amazon.com/images/I/812+xR9XGoL._AC_UL320_.jpg,https://m.media-amazon.com/images/I/812+xR9XGoL._AC_SL1500_.jpg,,2026-04-21T11:32:56.307960,
39,1,Organic,,31.0,B0CNTRYHKK,"Air Dry Clay 66 Colors, Modeling Clay for Kids, DIY Model Magic Clay, Molding Clay Kit with Sculpting Tools, Non-Sticky Soft and Super Light, Arts and Crafts Gift for Boys Girls Kids",N/A,$19.99,,4.6,2044.0,False,https://m.media-amazon.com/images/I/81v5p4XiazL._AC_UL320_.jpg,https://m.media-amazon.com/images/I/81v5p4XiazL._AC_SL1500_.jpg,,2026-04-21T11:32:56.313027,
40,1,Organic,,32.0,B08PZ63BP2,"4 Pack DIY Bird House Wind Chime Kits for Children to Build and Paint, Wooden Arts and Crafts for Kids Girls Boys Toddlers Ages 8-12 4-6 6-8",N/A,$11.99,,4.3,1095.0,False,https://m.media-amazon.com/images/I/71rcdXv71lL._AC_UL320_.jpg,https://m.media-amazon.com/images/I/71rcdXv71lL._AC_SL1500_.jpg,,2026-04-21T11:32:56.316754,
41,1,Organic,,33.0,B07KQLCGSR,"Dan&Darci Paint & Plant Flower Growing Kit for Kids - Gift Ideas Age 5 6 7 8-12 Year Old Girl - Birthday Crafts Gifts for Girls & Boys, Fun Gardening Kits, Art Projects for Ages 5-12 Years",N/A,$17.99,,4.6,12139.0,False,https://m.media-amazon.com/images/I/91j3V70TAvL._AC_UL320_.jpg,https://m.media-amazon.com/images/I/91j3V70TAvL._AC_SL1500_.jpg,,2026-04-21T11:32:56.321873,
42,1,Organic,,34.0,B07SJQ6LQY,"PURPLE LADYBUG 300 PCS Bendable Wax Craft Sticks, Imagination Sticks for Kids, Road Trip Essentials, Travel Toys for Toddlers in Car, Airplane Activities for Kids Ages 4-8, Camping & Summer Essentials",N/A,$14.99,,4.7,1942.0,False,https://m.media-amazon.com/images/I/9130weOxdBL._AC_UL320_.jpg,https://m.media-amazon.com/images/I/9130weOxdBL._AC_SL1500_.jpg,,2026-04-21T11:32:56.326286,
43,1,Organic,,35.0,B0F9WHCL19,"Skillmatics Aqua Puffs - 3D Art Kit, Animals, Mess-Free Paint by Number Craft for Kids, DIY Color & Inflate Activity, Travel & Creative Gift for Girls & Boys Ages 4, 5, 6, 7, 8, 9, 10",N/A,$18.97,,4.6,1190.0,False,https://m.media-amazon.com/images/I/81NYm5B533L._AC_UL320_.jpg,https://m.media-amazon.com/images/I/81NYm5B533L._AC_SL1500_.jpg,,2026-04-21T11:32:56.331132,
44,1,Organic,,36.0,B0DQTWD595,32 Sets Summer Hawaii Crafts Kits DIY Felt Wreath Making Kits Tropical Beach Crafts with Flamingo Palm Pineapple Watermelon Surfboard Stickers for Party Decorations Home,N/A,$15.99,,4.8,25.0,False,https://m.media-amazon.com/images/I/81PG7a00OoL._AC_UL320_.jpg,https://m.media-amazon.com/images/I/81PG7a00OoL._AC_SL1500_.jpg,,2026-04-21T11:32:56.336047,
45,1,Organic,,37.0,B0CQYTVX68,"Poen 48 Pcs DIY Pinwheels Paper Craft Bulk Color Your Own White Pinwheels Summer Activity Arts July 4 Patriotic Memorial Day Craft Blank Windmills Party Favor Supplies, 5 Inches",N/A,$19.99,,4.4,110.0,False,https://m.media-amazon.com/images/I/71c+l4kzaIL._AC_UL320_.jpg,https://m.media-amazon.com/images/I/71c+l4kzaIL._AC_SL1500_.jpg,,2026-04-21T11:32:56.341073,
46,1,Organic,,38.0,B0GSD21JXT,32Pcs Summer Craft Coloring Glasses Bulk - Hawaiian Luau Art Craft Kit- Beach Pool Theme DIY Paper Party Glasses Decor for Teacher Students Classroom Activities Camp Project Party Favors - 8 Designs,N/A,$9.99,,5.0,14.0,False,https://m.media-amazon.com/images/I/818TXFVnqeL._AC_UL320_.jpg,https://m.media-amazon.com/images/I/818TXFVnqeL._AC_SL1500_.jpg,,2026-04-21T11:32:56.344748,
47,1,Organic,,39.0,B0D3WWHSDZ,Kajaia 24pc Summer Pool DIY Bags Bulk Color Your Own Tote Bag Reusable Non Woven Goodie Bag with Handle for Summer Pool Beach Crafts Painting Party Favor Supplies,N/A,$22.99,,4.6,7.0,False,https://m.media-amazon.com/images/I/81Q-Z0OR6vL._AC_UL320_.jpg,https://m.media-amazon.com/images/I/81Q-Z0OR6vL._AC_SL1500_.jpg,,2026-04-21T11:32:56.349824,
48,1,Organic,,40.0,B0F24F9HPQ,"LINAYE 24 Sheets Ocean Stickers with Under The Sea Scenes, Make Your Own Sea Life Animal Fish Stickers, Ocean Summer Crafts Activities for Kids",N/A,$7.99,,4.7,185.0,False,https://m.media-amazon.com/images/I/91YH-9ql6PL._AC_UL320_.jpg,https://m.media-amazon.com/images/I/91YH-9ql6PL._AC_SL1500_.jpg,,2026-04-21T11:32:56.362980,
49,1,Organic,,41.0,B0CRHCJDPH,"Kiditos Magic Water Elf Toy Kit – Squishies for Kids, 20 Gels & 10 Molds, Magic Gel Water Pets Sensory DIY Craft Kit, Party Favors & Gifts for Kids Ages 3+",N/A,$26.99,,4.6,2077.0,False,https://m.media-amazon.com/images/I/81jFjCT45dL._AC_UL320_.jpg,https://m.media-amazon.com/images/I/81jFjCT45dL._AC_SL1500_.jpg,,2026-04-21T11:32:56.368676,
50,1,Organic,,42.0,B0DQ158VV3,Winlyn 24 Sets Potted Flower Craft Kits DIY Potted Flower Ornaments Decorations Tulip Sunflower Foam Stickers Arts and Crafts for Kids Classroom Activities Birthday Spring Summer Camping Party Favors,N/A,$23.99,,4.7,39.0,False,https://m.media-amazon.com/images/I/81hRwGbvb-L._AC_UL320_.jpg,https://m.media-amazon.com/images/I/81hRwGbvb-L._AC_SL1500_.jpg,,2026-04-21T11:32:56.374258,
51,1,Title,,,,More results,,,,,,False,,,,2026-04-21T11:32:56.375075,
52,1,Organic,,43.0,B0GR9VFT1F,"24 Set Summer Crafts for Kids Bulk, Summer Ocean Activities Puzzle with Mermaid Fish Starfish Animal, Camp Beach Arts and Crafts Classroom Gifts, Under the Sea Theme Party Favors, June Coloring Games",N/A,$13.98,,4.0,40.0,False,https://m.media-amazon.com/images/I/91KZmkqYdXL._AC_UL320_.jpg,https://m.media-amazon.com/images/I/91KZmkqYdXL._AC_SL1500_.jpg,,2026-04-21T11:32:56.381117,
53,1,Organic,,44.0,B0CC797P1S,"Klever Kits 4 DIY Wooden Race Cars-Build & Paint Your Own Wood Craft Kit, 4 Race Cars Toy, Easy to Assemble Arts Crafts Kit, Birthday Party Presents for Kids Boys and Girls",N/A,$15.99,,4.6,1690.0,False,https://m.media-amazon.com/images/I/81gY5yhcPAL._AC_UL320_.jpg,https://m.media-amazon.com/images/I/81gY5yhcPAL._AC_SL1500_.jpg,,2026-04-21T11:32:56.388386,
54,1,Organic,,45.0,B09KLWR9WB,Haooryx Color Your Own Summer Bookmarks - 72Pcs Bulk Kids DIY Coloring Blank Bookmarks Summer Theme Book Marks for Teacher Student Classroom Rewards Supplies Paper Art Craft Kit Party Gift Bag Fillers,N/A,$9.99,,4.4,131.0,False,https://m.media-amazon.com/images/I/81HGeOMVdsL._AC_UL320_.jpg,https://m.media-amazon.com/images/I/81HGeOMVdsL._AC_SL1500_.jpg,,2026-04-21T11:32:56.393533,
55,1,Organic,,46.0,B09NSSYTN6,Imagimake Window Art Princess | Suncatcher Kit | Arts and Crafts for Kids Ages 8-12 | Girls Toys Age 6-8 | Unicorn Gifts for Girls Age 6-8 | 5 Year Old Girl Gift | 8 Year Old Girl Birthday Gift,N/A,$19.99,,4.7,5515.0,False,https://m.media-amazon.com/images/I/71Jj8XWaVSL._AC_UL320_.jpg,https://m.media-amazon.com/images/I/71Jj8XWaVSL._AC_SL1500_.jpg,,2026-04-21T11:32:56.399493,
56,1,Organic,,47.0,B0D2NZMBG4,JellyArch 30 Pack Summer Wind Chime Making Kit for Adults Make Your Own Summer Wind Chime Beach Wooden Ornaments for DIY Crafts Activity Birthday Decoration,N/A,$18.99,,4.2,102.0,False,https://m.media-amazon.com/images/I/81RoBmfAqzL._AC_UL320_.jpg,https://m.media-amazon.com/images/I/81RoBmfAqzL._AC_SL1500_.jpg,,2026-04-21T11:32:56.404423,
57,1,Organic,,48.0,B00TF7ZZM2,Wikki Stix for Doodlers - Kid's Travel Essential: Portable Creativity On-The-Go! Pack of 24 Wikki Stix in Neon and Primary Colors. Made in USA ! 3 & Up.,N/A,$5.50,,4.3,13268.0,False,https://m.media-amazon.com/images/I/61dfmiFMD2L._AC_UL320_.jpg,https://m.media-amazon.com/images/I/61dfmiFMD2L._AC_SL1500_.jpg,,2026-04-21T11:32:56.409347,
59,1,Title,,,,Debug info copied.SponsoredTeexpert Magic Water Elf Toy Kit – Art and Crafts for Kids Girls Boys Age,,,,,,False,,,,2026-04-21T11:32:56.410301,
60,1,Title,,,,Related searchessummer craftsfall crafts for kidssummer crafts for kids ages 4-8crafts for kidssumme,,,,,,False,,,,2026-04-21T11:32:56.411223,
61,1,Title,,,,Previous123...7Next,,,,,,False,,,,2026-04-21T11:32:56.411643,
62,1,SB,2.0,,,N/A,https://aax-us-east-retail-direct.amazon.com/x/c/JFRnblgv3pZsTumBiiVTm8AAAAGdr9B8OwEAAAH2AQBvbm9fdHhuX2JpZDcgICBvbm9fdHhuX2ltcDIgICDfNUYZ/clv1c_ek-IBPfXPTbXzt5jsa-NiaKao7eIGpfKQi6gVYva39rFEjZNZc6B8V8_xMhonh_jS2zd0BfS6u20hk0hrwLGSMi1xPW8xYmRomd_qiIboUsnyQmKrh9giFTiROFUJHNhpzibEcPtIkeCG0Tk0OCMUMlBzhi-_lXtmuTww4em2r6XeUsfFIwdjvWMKNV3JO4UhNad7688XVxsVOXh80AgICqeKceZIGeEvH62oh0RYFC-lfh3uOugvLW8wmYiG2n6Y88WIzogEQwYN995e-fk_KTE-eiLxmHJjC_h8kdiF1Mkro_2vC_dhwG3FRhNdmJCzfzXPLY4MGmZFpgXwnVlUtoQYc0bAYyZATbznBvFQtWh7OS48E3vzcvgc0N4sOm22tl0d2oyQkCukf1JhLuiQRALv13Q5y1z4pAetjGSTdOU_zhG4bGjAWfcbvYUV1Ahw78GhaWR41pMkwbpSPvEeHnqFQd9izd8SfTZd2gFlo4FymaBBuL8JjQP_fGWmDtdz0bHmmTL-nLAKr8LZ_R2kYLK9gGzIXzAa7KoJqNB_4jJeRO10fzLOk-bgxDjG10O3RETsDvb-kthrtNKSs6AwVYSL1FMW93kDTkwTkAQHaUOKdwa7Kqq30Ywg7r63i08-UE6PFCeOUhCO5KgxykOhXhqyYDrlmyL7aNdCFkMmCoXbD3EzTxq-MNbkc_7CDRgFdbb8wyjS7HMawPc0vNEGBglZe2vFh2UgyorjoV47Z3cxeuT1Akg3Ec9rqgHsPZKYvz8tVfZpZDlJrORDmSHTdsVS-jlHxJTtrASyoGkaiw6JshXDu1SBqNK2yFsIC-PWwZ_vXfHD-CUgnewXsA7JuNNNabyppHuafpCtjWfVvbLSiEqJVRAmxx2NONn0fXCmIMXxgRGv08SqoN-HNfjyC7gz_S-YrBqUp6qTsc5oZ6Eir6y8ool9vmjx7jKYme6PVi9qrLB7wRMfmmwM__oW7ADyKJuomKnsUd1-s6Wj71PD4MdRPTFyxYOXaDx8d8XKSbDH912zSL9HCE-AtREtW0A2oKG_j6autc02hzd7-ZCJ3Sr49qiNFgfSLbX0eAa_4U_BxM0EM6qOkkm85f8yG_y_o4V4Q7AZ45ExD26nkwdwr5v-LmPqhM8VhhqS-fbuOoNP-T-aU6ZtZGNxqieCmVOK__dDJnye5-RCmFtwsPOB06x2DgKWJrYtoZDWtoLy6wSZwQPWID3_2ENiXgIgpN8IXYtqgPvO7xNDPYhyf56aNzOT5XL5Bd4TE7WqEJvgcPSbpaGKJeQTJ_ZXiGAcORHqnaF4uEkKHPxrsBp9BI1dzY4cmzGwh4BPaI0cFeyTSyC92JPL0y77AZLAulNp_kikaQGtZUBdK6lX250pyrjFg0RX2Yy4VKnJ88BlWl5iVknyaYclUd-7gSScAoJ_fuIkil0FwWu0MQascnxf4EGP0PkAC7bqrtCuevLFTIVT6zNuofUmiW4sSHqK29bOZshnx3EiU--d4D3E0u8d6fnw_nh2FESaE2fQBRohEKFmYFPHRy6ArRmiCpY30pqiJjzpRBHHz8ipLtlpnI5B2EVRkmhlKvbnrg6B27x6KYyppv5hYN6f-ID7LQ_yjW3nUMs5DwyIB-B-S6fDeVWIGE9sFDHrNR6J4JKJNudoBHecgH9qvYak1FIr1qV1cxqbxW3hAc/https://www.amazon.com/stores/page/DBC38549-974F-48C0-AB3D-93F4CBDDC59B/?_encoding=UTF8&store_ref=SB_A0149544926FCABD643D-A0962715395MYGX979JJD&pd_rd_plhdr=t&aaxitk=20ef2c70a5611a1beb6fdd0949a54013&hsa_cr_id=0&lp_asins=B01KYLLOFE%2CB00TF7ZZM2%2CB07QL3D9VP&lp_query=summer%20crafts%20for%20kids&lp_slot=desktop-hsa-3psl&ref_=sbx_be_s_3psl_mbd_mb0_bkgd&pd_rd_w=rSE4k&content-id=amzn1.sym.cd7c548b-a599-426f-9ffe-daa1aa803c87%3Aamzn1.sym.cd7c548b-a599-426f-9ffe-daa1aa803c87&pf_rd_p=cd7c548b-a599-426f-9ffe-daa1aa803c87&pf_rd_r=W5WKWCAJG8XQDVEHETDV&pd_rd_wg=lErMD&pd_rd_r=b7678ecb-a247-41e3-9c89-05eb1a30b26d,,,,,False,,,N/A,2026-04-21T11:32:56.416780,
63,1,Title,,,,Need help?Visit the help sectionorcontact us,,,,,,False,,,,2026-04-21T11:32:56.417430,
0,2,SB_Video,1.0,,,N/A,N/A,,,,,False,,,,2026-04-21T11:33:13.214441,1.0
1,2,Title,,,,ResultsCheck each product page for other buying options. Price and other details may vary based on p,,,,,,False,,,,2026-04-21T11:33:13.215532,
