data_index,page,ad_type,ad_rank,organic_rank,asin,title,url,price_current,price_list,rating_stars,rating_count,is_prime,image_small,image_large,brand_name,scraped_at,inner_products_count
0,1,SB,1.0,,,Vlipoeasn Thank You for All You Do Decor,https://aax-us-east-retail-direct.amazon.com/x/c/JEcIu3VGbS29MwYW5F8xDioAAAGdsBIlVgEAAAH2AQBvbm9fdHhuX2JpZDEgICBvbm9fdHhuX2ltcDEgICD5z8Lm/clv1c_ek-wBIHXLbbWTg5Tc58pGgIJ7b4aDJq0xcKprv_i3msKlT3qRj0VBKyuY2HhfGv55FY_iVZJtf00hO0CFknJ_0KKIw0TPhT8SPHnjgkH_UgnTRmGiglui8P-ppF0J3s0_RJeRizvco7MzwMD4zP2g_nqaN2fnE06EtBgD_Sq3ptvsctcI7LqvAiBdtQkxmKQ7e3_zPu7z8cLVeZuulHoGvw5dXU3rOasBWrmARc9rVEi60eijmmADJNbSl53EGUjKHLZ16QY6LPUGJl-4lKNaI93YwwMcikOOrtyrGR-lO167iUvvVni_8f9cvQa83deGM1xQAm0AHIVGzEL18xywiH0dfxqbWV45yUy5nQ73FdQi76h1Iw8DNScjw0llMT0vKs8nQSpwLWlUuz4_Y67C9efu93GZ2DW_wJu6FmDLS1R2TMhtis2AqjkoCN5x3yyb0ukPkkzwN2-J7Ycpx4_4F8TYnrkw08IVERFgLGhpiLz05ozsHcNPqn6cKWSpnGgayQrsmhBmtfxqrF4C6Sr_cywm6H1oNw7cnZHBgG-6c-3xEMUPIMFpScX9m9ImspZjFmn1ACgUTQ-8rLdIrei9iGxlJTVqdx9jjzPfOl9WIW-7O364KMJSXx6JDImVqxpP2Oy12JgpGS_1eNKdEsQrZB43M5RAiUBSGYPhfcTQTlK2hNTa1KG-pmtAv1qJo58kVe9u85c70KBzUosztOx0MqqYcNv-PqhbdETpHtmu_1cm5CLfCYpt5isQJwd2stcI_Y_ppCVZMVpywLP2STl4SWFlliXX_MgvKCXWKnRZqT2q1tB9hj6RrDv7nA0EQe8oPinkIaXDG3Sql0fT7CmjL_XeWjPfCls6G-Jsor9zizlAMCQc83Len4BtT7RQSyx19ByxM0erb8I1FELkXc9JV2nFEb0vuIA2EJshDE6qItRSbRSEX7zY_OgZ3DFNwy4VKQt5Ds3YXc0y3Uc2932_StNWR3bJLNsUbrzNtWv2sT8yEzF5AdfgMOfvE4mk5VPQSflZUpzN6RWFqBpWVKgyIgXHjtLNBgJ0tTGZ_U2vo3np87TEzHRqvtjnwKxUsAj84L3mhzO0quTSkZTK3wyf0y6gcsDIpPiVbrdzvFzM3lfbWtzRfT2r9RGknVuESk1iyQ3HPJZHTifxhQkJc3dmPKTjyCryFF8D7WhYAqW_diz506qqrmdCyZjTLm63iUfzA-PbSY5_7PUz5NcTXqZf6xSOZXBmtoqx1uNCJLg6wFG8h2M30u1jCJ0iGIH9hekiv0IuwGkdf0HZL1g9h0cMuWgpGX8X-H4Ly5WmdxTYvSSay5xLKTswGIHKcFnZL-yAc7a8Eu5KO_Khohm7dE3xw76UO162RHho3H-a71d-mn38KpxjGH09NlRzA1sfhvpvIbW8ZgKdZsbh7NH-aDf2IeXSPBTDIaLfiJKs645s6q2Q_MEFMPW4Cu9S3BbNJAwpKJi3HRVwnavKxVDcNbpKoVg3t9_TC9hQTAPXRbehQSjoYGVT1mGDdHrMSmNmOpksnM8888tfg8qyfBjMvMFSuWsbwoRSelfGXJtIfuqznTt0gGtPR0XNWb_tJVjc-ejq1b5bbtviRWfalR9gHBIze2dR8WmsRBODSYMBU10X0N1yODfYZwjIQHaHmkXB69Ikmtj2FdtCZUXLVLQyA/https://www.amazon.com/stores/page/75D90EC5-9E34-44D9-9EFF-0E0223FDA374/?_encoding=UTF8&store_ref=SB_A07549943WXYYHOK4YW7-A04043162JJ2LX6HH8QD6&pd_rd_plhdr=t&aaxitk=2756ad469767743787eebdb5a9d6d2bc&hsa_cr_id=0&lp_asins=B0F8BHC9CD%2CB0DZN3F168%2CB0DL649CQX&lp_query=teacher%20appreciation%20week%20decorations&lp_slot=auto-sparkle-hsa-tetris&ref_=sbx_s_sparkle_sbtcd_bkgd&pd_rd_w=nmnfE&content-id=amzn1.sym.2fb72bc8-96ef-420d-b08f-c04b69f36507%3Aamzn1.sym.2fb72bc8-96ef-420d-b08f-c04b69f36507&pf_rd_p=2fb72bc8-96ef-420d-b08f-c04b69f36507&pf_rd_r=A14855DARV2EJT6V03K2&pd_rd_wg=cFffk&pd_rd_r=8918af1a-abf4-4f11-8e23-b8ec3864aee9,,,,,False,"https://m.media-amazon.com/images/S/al-na-9d5791cf-3faf/201f0b19-7de0-45b6-99ab-b94011f09b26._CR0,0,400,400_AC_SX130_SY60_CB1169409_QL70_.jpeg",,Vlipoeasn Thank You for All You Do Decor,2026-04-21T12:44:40.057830,3.0
1,1,Title,,,,ResultsCheck each product page for other buying options. Price and other details may vary based on p,,,,,,False,,,,2026-04-21T12:44:40.058619,
3,1,Organic,,1.0,B0GMHRZSJV,"Teacher Appreciation Decorations, Staff Appreciation Decorations includes Thank You Teacher & Staff Backdrop, Honeycomb Centerpieces and Hanging Swirls, Teacher Appreciation Week Decoration",N/A,$21.99,,5.0,1.0,False,https://m.media-amazon.com/images/I/811ral5EqUL._AC_UL320_.jpg,https://m.media-amazon.com/images/I/811ral5EqUL._AC_SL1500_.jpg,,2026-04-21T12:44:40.062907,
4,1,Organic,,2.0,B0DLWDFXJQ,Affrolling 35 Pcs Teacher Appreciation Week Decorations Teacher Appreciation Banner Hanging Swirls Wall End of Year Decor Holiday Celebrating Events for School Classroom End of Year Party Supplies,N/A,$16.99,,4.7,59.0,False,https://m.media-amazon.com/images/I/81fnIFLUucL._AC_UL320_.jpg,https://m.media-amazon.com/images/I/81fnIFLUucL._AC_SL1500_.jpg,,2026-04-21T12:44:40.066463,
5,1,Organic,,3.0,B0DRP7QZY4,"Teacher Appreciation Week Banner Yard Sign Decorations, Thank You Teacher Staffs Banner Yard Sign Decorations",N/A,$9.89,,3.7,9.0,False,https://m.media-amazon.com/images/I/61xCxtgDxfL._AC_UL320_.jpg,https://m.media-amazon.com/images/I/61xCxtgDxfL._AC_SL1500_.jpg,,2026-04-21T12:44:40.069994,
7,1,Title,,,,New arrivalsSponsoredBased on items added in the past 60 daysGerrii 60 Pcs Thank You Themed Party Pl,,,,,,False,,,,2026-04-21T12:44:40.073305,
9,1,Title,,,,"Debug info copied.SponsoredVlipoeasn We Appreciate You Banner Decorations, Colorful Thank You for Al",,,,,,False,,,,2026-04-21T12:44:40.073798,
10,1,Title,,,,Thank You Teachers BannerSponsored|Shop AvezanoShop nowPrevious pageAvezano Thank You Teachers Backd,,,,,,False,,,,2026-04-21T12:44:40.074850,
11,1,Title,,,,More results,,,,,,False,,,,2026-04-21T12:44:40.074980,
12,1,Organic,,4.0,B0G2579Q3R,SmoothNovelty 3 Pcs Teacher Appreciation Week Banner Thank You Teachers Banner Porch Sign Happy Teacher Appreciation Week Decoration for Classroom School Office Decor Photo Props Background,N/A,$14.99,,4.8,96.0,False,https://m.media-amazon.com/images/I/71y4j-MS5qL._AC_UL320_.jpg,https://m.media-amazon.com/images/I/71y4j-MS5qL._AC_SL1500_.jpg,,2026-04-21T12:44:40.080161,
13,1,Organic,,5.0,B0DTYKBSG4,"Teacher Appreciation Party Supplies,125Pcs Thank You Party Plates and Napkin We Appreciate All That You Do Tableware Decorations for Teacher Appreciation Week,Teacher Staff Party Decor",N/A,$16.99,,4.5,2.0,False,https://m.media-amazon.com/images/I/812dWTbwhlL._AC_UL320_.jpg,https://m.media-amazon.com/images/I/812dWTbwhlL._AC_SL1500_.jpg,,2026-04-21T12:44:40.083736,
14,1,Organic,,6.0,B0DZCWJ3GR,"Thank You Teachers Teacher Appreciation Week Backdrop Banner Decorations, Teacher and Staff Appreciation Banners Decoration for Classroom, School Office Decor, Photo Booth Props Background",N/A,$5.95,,4.9,20.0,False,https://m.media-amazon.com/images/I/81UBQwV36ZL._AC_UL320_.jpg,https://m.media-amazon.com/images/I/81UBQwV36ZL._AC_SL1500_.jpg,,2026-04-21T12:44:40.087103,
15,1,Organic,,7.0,B0GLQC7B65,"Teacher Appreciation Decorations Door Cover - Black Happy Teacher and Staff Appreciation Week Decoration Porch Sign, Teach Love Inspire Party Decor for School Office Classroom Celebration",N/A,$8.99,,,,False,https://m.media-amazon.com/images/I/816yxwYKnCL._AC_UL320_.jpg,https://m.media-amazon.com/images/I/816yxwYKnCL._AC_SL1500_.jpg,,2026-04-21T12:44:40.090707,
16,1,Organic,,8.0,B0F23CP9RL,"Happy Teacher Day Banner Teacher Appreciation Week Decorations Flag Outdoor 71x44 Inch School Classroom Backdrop,Thank You Teacher Gifts for Indoor Home Party Supplies,Yard Sign Photography Background",N/A,$7.99,,4.7,802.0,False,https://m.media-amazon.com/images/I/811cnNBEsBL._AC_UL320_.jpg,https://m.media-amazon.com/images/I/811cnNBEsBL._AC_SL1500_.jpg,,2026-04-21T12:44:40.095820,
17,1,Organic,,9.0,B0GH6TXPK5,"Teacher Appreciation Decorations - Thank You Teachers Teacher Appreciation Week Photo Booth Backdrop Decorations | Teacher Appreciation Banner for Classroom, School Office Decor, Photo Booth Props Background",N/A,$5.99,,4.6,267.0,False,https://m.media-amazon.com/images/I/91AIt1T0fIL._AC_UL320_.jpg,https://m.media-amazon.com/images/I/91AIt1T0fIL._AC_SL1500_.jpg,,2026-04-21T12:44:40.099568,
18,1,Organic,,10.0,B0BVY6T9JK,56 Pcs Teacher Appreciation Hanging Swirls Decorations Thank You Teachers Foil Ceiling Hanging Decor Teacher Appreciation Gifts for Teacher Appreciation Week Teacher's Day,N/A,$8.99,,4.4,18.0,False,https://m.media-amazon.com/images/I/81-u2amN85L._AC_UL320_.jpg,https://m.media-amazon.com/images/I/81-u2amN85L._AC_SL1500_.jpg,,2026-04-21T12:44:40.102701,
19,1,Organic,,11.0,B0F8BHC9CD,"Vlipoeasn We Appreciate You Banner Decorations, Colorful Thank You for All You Do Backdrop Banner Honeycomb Centerpieces, Retirement Office Decor Staff Teachers Professors Doctor Nurses Appreciation",N/A,$22.99,,4.8,139.0,False,https://m.media-amazon.com/images/I/81TG2NMch-L._AC_UL320_.jpg,https://m.media-amazon.com/images/I/81TG2NMch-L._AC_SL1500_.jpg,,2026-04-21T12:44:40.106340,
20,1,Organic,,12.0,B0GL1SZG79,"Teacher Appreciation Decorations, Staff Appreciation Decorations includes Thank You Teachers & Staff Banner and Colorful Teacher Hanging Swirls, Teacher Appreciation Week Decorations for Home Office",N/A,$12.99,,,,False,https://m.media-amazon.com/images/I/81iLMMagVLL._AC_UL320_.jpg,https://m.media-amazon.com/images/I/81iLMMagVLL._AC_SL1500_.jpg,,2026-04-21T12:44:40.110948,
21,1,Organic,,13.0,B0GMTX27YQ,"Teacher Appreciation Week Decorations - Teacher Appreciation Party Backdrop Decor, Large Thank You Teachers Party Banner Supplies for Home Classroom Indoor Outdoor, 71"" X 43""",N/A,$7.99,,4.8,25.0,False,https://m.media-amazon.com/images/I/8128hRCUZYL._AC_UL320_.jpg,https://m.media-amazon.com/images/I/8128hRCUZYL._AC_SL1500_.jpg,,2026-04-21T12:44:40.114511,
22,1,Organic,,14.0,B0FZL3JC28,Thank You Teachers Notebook Banner Teacher Appreciation Week Backdrop Banner Large Hanging 9.8 x 1.6 ft Graduation Party Supplies for School Classroom Office Indoor Outdoor Party Decoration,N/A,$11.99,,,,False,https://m.media-amazon.com/images/I/81idC69FFTL._AC_UL320_.jpg,https://m.media-amazon.com/images/I/81idC69FFTL._AC_SL1500_.jpg,,2026-04-21T12:44:40.117767,
23,1,Title,,,,More results,,,,,,False,,,,2026-04-21T12:44:40.118174,
24,1,Organic,,15.0,B0DRNSQ9R6,"10 Pcs Teacher Appreciation Week Table Honeycomb Centerpieces Decorations, Thank You Teacher Table Centerpieces Table Topper for Teacher Day Graduation Home School Classroom Party Desk Decor",N/A,$9.99,,4.7,362.0,False,https://m.media-amazon.com/images/I/81odEG9tJWL._AC_UL320_.jpg,https://m.media-amazon.com/images/I/81odEG9tJWL._AC_SL1500_.jpg,,2026-04-21T12:44:40.121429,
25,1,Organic,,16.0,B0DYD44NHZ,"Qttier Teacher Appreciation Week Banner, Thank you Teacher Decorations, Teacher Appreciation Week Party Decorations, Teacher Appreciation Party Supplies, Pre-strung",N/A,$11.99,,5.0,1.0,False,https://m.media-amazon.com/images/I/71+26Rwu0aL._AC_UL320_.jpg,https://m.media-amazon.com/images/I/71+26Rwu0aL._AC_SL1500_.jpg,,2026-04-21T12:44:40.126050,
26,1,Organic,,17.0,B0F21R19SC,"Thank You Teachers Staff Decorations for Teacher Appreciation Week, School Classroom Decorations Background Banner, Apple Garland, Paper Eyeglasses, Best Teacher Ever Latex Balloons",N/A,$8.99,,4.6,12.0,False,https://m.media-amazon.com/images/I/81aq3jElAaL._AC_UL320_.jpg,https://m.media-amazon.com/images/I/81aq3jElAaL._AC_SL1500_.jpg,,2026-04-21T12:44:40.129691,
27,1,Organic,,18.0,B0FWKKDPGN,Moukeren Teacher Appreciation Week Backdrop Banner Teacher's Day Supply Thank You Teachers Staff We Appreciate Banner for All You Do Hanging Sign for School Classroom Decoration (Composition Book),N/A,$9.99,,,,False,https://m.media-amazon.com/images/I/81Osq6eBqTL._AC_UL320_.jpg,https://m.media-amazon.com/images/I/81Osq6eBqTL._AC_SL1500_.jpg,,2026-04-21T12:44:40.133374,
28,1,Organic,,19.0,B0BVFGMJPV,"Nepnuser Thank You Teachers Table Runner Teacher Appreciation Week Party Decoration Home Kitchen Dining Room Decor (13"" x 72"")",N/A,$9.99,,4.8,18.0,False,https://m.media-amazon.com/images/I/71GBvYyB5RL._AC_UL320_.jpg,https://m.media-amazon.com/images/I/71GBvYyB5RL._AC_SL1500_.jpg,,2026-04-21T12:44:40.137970,
29,1,Organic,,20.0,B0DXQQR5XP,"Teacher Appreciation Decorations, 157PCS Teacher Appreciation Week Balloon Garland Arch kit with Large Thank You Teachers Backdrop Banner for Teachers Staffs Appreciation Week",N/A,$14.99,,3.4,12.0,False,https://m.media-amazon.com/images/I/81DHtYquo+L._AC_UL320_.jpg,https://m.media-amazon.com/images/I/81DHtYquo+L._AC_SL1500_.jpg,,2026-04-21T12:44:40.142202,
30,1,Organic,,21.0,B0DSJSRKDY,Anwyll Teacher Week Gift Tags - 50Pcs Happy Teacher Appreciation Week Tags with String Teachers Thank You Tag Personalized Thanks for All You Do Hang Paper Tag for Gift Present Treat Bag Party Favors,N/A,$8.99,,4.8,276.0,False,https://m.media-amazon.com/images/I/71XJ+aZQ9HL._AC_UL320_.jpg,https://m.media-amazon.com/images/I/71XJ+aZQ9HL._AC_SL1500_.jpg,,2026-04-21T12:44:40.145998,
31,1,Organic,,22.0,B0DYJKD9HG,"Teacher Appreciation Week Banner, IF Teachers Were Flowers We'd Pick You Banner, Teacher Appreciations Classroom Decor, Teacher Appreciations Week Party Decor, Thank You Teachers Decor, Pre-strung",N/A,$14.99,,5.0,4.0,False,https://m.media-amazon.com/images/I/71xWQ26QugL._AC_UL320_.jpg,https://m.media-amazon.com/images/I/71xWQ26QugL._AC_SL1500_.jpg,,2026-04-21T12:44:40.149539,
32,1,Organic,,23.0,B0CT88HSYF,"HOWAF Teacher Appreciation Week Decoration Yard Sign Banner, Thank You Teachers and Staff We Appreciate You Fence Banner for School Decoration, Long Fabric Teacher's Day Yard Sign",N/A,$9.99,,4.2,17.0,False,https://m.media-amazon.com/images/I/81DpzCXSC-L._AC_UL320_.jpg,https://m.media-amazon.com/images/I/81DpzCXSC-L._AC_SL1500_.jpg,,2026-04-21T12:44:40.153859,
33,1,Title,,,,More results,,,,,,False,,,,2026-04-21T12:44:40.154424,
34,1,Organic,,24.0,B0DTHB7KD3,Teacher Appreciation Yard Signs 18 Pcs Teacher Appreciation Outdoor Decorations with Stakes Teacher Appreciation Lawn Signs Party Supplies for Indoor Outdoor School Lawn Garden Home Decor,N/A,$29.99,,3.9,6.0,False,https://m.media-amazon.com/images/I/91K4SdCvGEL._AC_UL320_.jpg,https://m.media-amazon.com/images/I/91K4SdCvGEL._AC_SL1500_.jpg,,2026-04-21T12:44:40.159230,
35,1,Organic,,25.0,B0DZN3F168,"Vlipoeasn We Appreciate You Banner Decorations, Blue Gold Thank You for All You Do Backdrop Banner Honeycomb Centerpieces, Retirement Office Decor Staff Teachers Professors Doctor Nurses Appreciation",N/A,$21.99,,4.8,139.0,False,https://m.media-amazon.com/images/I/91rqQZrSWaL._AC_UL320_.jpg,https://m.media-amazon.com/images/I/91rqQZrSWaL._AC_SL1500_.jpg,,2026-04-21T12:44:40.163411,
36,1,Organic,,26.0,B0GFTVRG8S,"48Pcs Teacher Appreciation Decorations Napkins, Disposable Thank You Teachers and Staff Paper Napkins, We appreciate You Napkins for Teacher Appreciation Week School Office Classroom",N/A,$9.99,,,,False,https://m.media-amazon.com/images/I/81RlcTKBGoL._AC_UL320_.jpg,https://m.media-amazon.com/images/I/81RlcTKBGoL._AC_SL1500_.jpg,,2026-04-21T12:44:40.167273,
37,1,Organic,,27.0,B0CY85BP6M,Thank You Teachers and Staff Banner National Teacher Appreciation Week Decoration We Love Our Teachers Decor Thanks for All You Do Backdrop Gold Glitter Supplies,N/A,$11.99,,4.9,10.0,False,https://m.media-amazon.com/images/I/71SCrXywCxL._AC_UL320_.jpg,https://m.media-amazon.com/images/I/71SCrXywCxL._AC_SL1500_.jpg,,2026-04-21T12:44:40.172888,
38,1,Organic,,28.0,B0DWHL8QX2,"3Pcs Teacher Appreciation Tablecloth,Teacher Appreciation Party Supplies Thank You Teachers Table Cover We Appreciate All That You Do Table Decorations for Best Teacher Ever,Teacher Appreciation Week",N/A,$9.49,,4.8,8.0,False,https://m.media-amazon.com/images/I/81ka1tgspWL._AC_UL320_.jpg,https://m.media-amazon.com/images/I/81ka1tgspWL._AC_SL1500_.jpg,,2026-04-21T12:44:40.176988,
39,1,Organic,,29.0,B0FWKNRVJM,Moukeren Teacher Appreciation Week Backdrop Banner Teacher's Day Supply Thank You Teachers Staff We Appreciate Banner for All You Do Hanging Sign for School Classroom Decoration(Colorful),N/A,$8.99,,,,False,https://m.media-amazon.com/images/I/71sn+Soe5UL._AC_UL320_.jpg,https://m.media-amazon.com/images/I/71sn+Soe5UL._AC_SL1500_.jpg,,2026-04-21T12:44:40.183060,
40,1,Organic,,30.0,B0BWCPXJJV,"71"" X 12"" Thank You Teachers Banner, Teacher Appreciation Decorations Porch Banner, Teacher Appreciation Week Banner, Teacher Appreciation Banner Classroom Door Decorations tineit",N/A,$8.99,,4.2,10.0,False,https://m.media-amazon.com/images/I/714SRTT2+JL._AC_UL320_.jpg,https://m.media-amazon.com/images/I/714SRTT2+JL._AC_SL1500_.jpg,,2026-04-21T12:44:40.187323,
41,1,Organic,,31.0,B0F21KBBKV,"Teacher Appreciation Week Decorations Set, Thank You Teachers Staff Background, Thank You for All You Do Banner, School Classroom Decorations Hanging Swirl, Honeycomb Centerpieces, Paper Eyeglasses",N/A,$16.99,,4.4,10.0,False,https://m.media-amazon.com/images/I/81cX0MMwfcL._AC_UL320_.jpg,https://m.media-amazon.com/images/I/81cX0MMwfcL._AC_SL1500_.jpg,,2026-04-21T12:44:40.191205,
42,1,Organic,,32.0,B0GDRD6C3B,"Teacher Appreciation Decorations Tableware, Teacher Appreciation Plates and Napkins Thank You Teachers and Staff Plates and We Appreciate You Napkins, for Teachers Staffs Appreciation Week",N/A,$16.99,,,,False,https://m.media-amazon.com/images/I/81-WN1mQkaL._AC_UL320_.jpg,https://m.media-amazon.com/images/I/81-WN1mQkaL._AC_SL1500_.jpg,,2026-04-21T12:44:40.194960,
43,1,Organic,,33.0,B0CTSSCMZN,"Teacher Appreciation Decorations, NO-DIY Teacher Appreciation Banner Include 1 Pc Teacher Appreciation Week Banner, 1Pc Garland and 16 Pcs Hanging Decorations, Thank You Teachers Banner",N/A,$9.99,,5.0,5.0,False,https://m.media-amazon.com/images/I/81576Ea40LL._AC_UL320_.jpg,https://m.media-amazon.com/images/I/81576Ea40LL._AC_SL1500_.jpg,,2026-04-21T12:44:40.198710,
44,1,Organic,,34.0,B0GQGNHHB3,Teacher Appreciation Banner Decorations - 15 Pcs Thank You Teachers Week Party Garland Hanging Swirls Honeycomb Centerpieces Backdrop Photo Booth Props Decor Supplies for Classroom School,N/A,$15.99,,,,False,https://m.media-amazon.com/images/I/81oj-uZ7g4L._AC_UL320_.jpg,https://m.media-amazon.com/images/I/81oj-uZ7g4L._AC_SL1500_.jpg,,2026-04-21T12:44:40.202675,
45,1,Organic,,35.0,B0CWTYJLCS,"Teacher Appreciation Week Table Decorations Honeycomb Centerpieces, 9PCS Teacher Appreciation Decorations 3D Double Side Table Topper Sign Thank You Teacher Table Centerpieces",N/A,$9.99,,4.9,11.0,False,https://m.media-amazon.com/images/I/71bUFq89DLL._AC_UL320_.jpg,https://m.media-amazon.com/images/I/71bUFq89DLL._AC_SL1500_.jpg,,2026-04-21T12:44:40.206290,
46,1,Organic,,36.0,B0CX1L4Y6J,"Teacher Appreciation Week Decorations Supplies,Include Thank You Teachers Banner,Hanging Swirls and Apple Garland Strings for Teacher's Day Office Classroom Party Decorations.",N/A,$9.99,,,,False,https://m.media-amazon.com/images/I/81lWDDFao-L._AC_UL320_.jpg,https://m.media-amazon.com/images/I/81lWDDFao-L._AC_SL1500_.jpg,,2026-04-21T12:44:40.210026,
47,1,Organic,,37.0,B0CY4LXBL2,Happy Teacher Appreciation Week Banner Thank You Teacher We Love Our Teacher Party Decorations for Teacher Celebrate Teacher Appreciation Week Party Supplies(Black),N/A,$9.99,,4.3,5.0,False,https://m.media-amazon.com/images/I/71rs9Cw5h6L._AC_UL320_.jpg,https://m.media-amazon.com/images/I/71rs9Cw5h6L._AC_SL1500_.jpg,,2026-04-21T12:44:40.213588,
48,1,Organic,,38.0,B0CRL5L2PV,"Qttier Nacho Average Teacher Banner, Pre-strung Fiesta Teacher Banner, Cinco de Mayo Decor for Teachers, National Teachers’ Day, Teacher Appreciation Week Decorations(Black & Gold Glitter)",N/A,$11.99,,5.0,3.0,False,https://m.media-amazon.com/images/I/71Qrm46gWgL._AC_UL320_.jpg,https://m.media-amazon.com/images/I/71Qrm46gWgL._AC_SL1500_.jpg,,2026-04-21T12:44:40.217837,
49,1,Organic,,39.0,B0CYLTC3MV,How Sweet It is to be Taught by You Banner Thank You Teachers We Appreciate You Garland Teacher Appreciation Week Theme Decoration We Love Our Teachers Classroom Party Supplies,N/A,$9.99,,5.0,3.0,False,https://m.media-amazon.com/images/I/71uoXhI0XKL._AC_UL320_.jpg,https://m.media-amazon.com/images/I/71uoXhI0XKL._AC_SL1500_.jpg,,2026-04-21T12:44:40.221778,
50,1,Organic,,40.0,B0CY7XN5TL,We Love Our Teachers Banner National Teacher Appreciation Week Decoration Thank You Teachers Day Party Celebration Decor Supplies,N/A,$9.99,,5.0,1.0,False,https://m.media-amazon.com/images/I/71JqcS1lEML._AC_UL320_.jpg,https://m.media-amazon.com/images/I/71JqcS1lEML._AC_SL1500_.jpg,,2026-04-21T12:44:40.225420,
51,1,Organic,,41.0,B0DWMT5HSN,"Thank You Teacher Appreciation Week Backdrop Banner Decorations, Thank You Teachers and Staff Banner Photo Booth Background Staff Appreciation Decorations for School Classroom Office",N/A,$8.89,,4.8,21.0,False,https://m.media-amazon.com/images/I/81mWBmVXgeL._AC_UL320_.jpg,https://m.media-amazon.com/images/I/81mWBmVXgeL._AC_SL1500_.jpg,,2026-04-21T12:44:40.228947,
52,1,Organic,,42.0,B0CXHVNKG6,"XIFAN Thank You Teachers Banner 98x19.2 Inches, Large Teachers Appreciation Week Decorations Yard Sign, Teacher's Appreciation Day Decor Classroom Supplies Durable Backdrop Poster for Indoor Outdoor",N/A,$7.99,,4.5,16.0,False,https://m.media-amazon.com/images/I/81i7ggpJ+cL._AC_UL320_.jpg,https://m.media-amazon.com/images/I/81i7ggpJ+cL._AC_SL1500_.jpg,,2026-04-21T12:44:40.232922,
53,1,Title,,,,More results,,,,,,False,,,,2026-04-21T12:44:40.233701,
54,1,Organic,,43.0,B0GF1L2NDS,Thank You Teachers Backdrop Large Size Teacher Appreciation Week Classroom Banner Decorations Colorful Thank You Gift for Back to School Office Photo Booth Props Background Decor(Retro Groovy),N/A,$10.99,,,,False,https://m.media-amazon.com/images/I/81K8QI904CL._AC_UL320_.jpg,https://m.media-amazon.com/images/I/81K8QI904CL._AC_SL1500_.jpg,,2026-04-21T12:44:40.236966,
55,1,Organic,,44.0,B0G2C7YH3H,Flutesan 21 Pcs Teacher Appreciation Week Decoration Happy Teachers Appreciation Week Banner Colorful Best Teacher Ever Backdrop Decoration with 20 Pcs We Appreciate You Balloons for School Supply,N/A,$11.99,,5.0,10.0,False,https://m.media-amazon.com/images/I/81gIIJMX6gL._AC_UL320_.jpg,https://m.media-amazon.com/images/I/81gIIJMX6gL._AC_SL1500_.jpg,,2026-04-21T12:44:40.240681,
56,1,Organic,,45.0,B0GJPZFLWF,Thank You Teachers & Staff Banner Happy Teacher Appreciation Week Decoration Banner We Love Our Teachers Thank You for Helping Us Grow Teachers Day Party Favors Supplies,N/A,$7.28,,,,False,https://m.media-amazon.com/images/I/61KsgwSiMyL._AC_UL320_.jpg,https://m.media-amazon.com/images/I/61KsgwSiMyL._AC_SL1500_.jpg,,2026-04-21T12:44:40.244535,
57,1,Organic,,46.0,B0F1F45W24,"Thank You Teacher Staffs Banner Yard Sign, Happy Teacher Appreciation Week Banner Decorations, Thank You Teacher Decorations",N/A,$11.99,,5.0,3.0,False,https://m.media-amazon.com/images/I/81FrEGTH8ZL._AC_UL320_.jpg,https://m.media-amazon.com/images/I/81FrEGTH8ZL._AC_SL1500_.jpg,,2026-04-21T12:44:40.248335,
58,1,Organic,,47.0,B0DF7HNHWL,"Mini Funny Turtle Gifts Mothers Day Teacher Appreciation Graduation Nurses Week 2026 Fathers Day, Birthday Gifts for Women Men Her Him, Small Cute Stuff Things, Emotional Positive Crochet Turtle Decor",N/A,$7.98,,4.8,1785.0,False,https://m.media-amazon.com/images/I/71FGjn9y9BL._AC_UL320_.jpg,https://m.media-amazon.com/images/I/71FGjn9y9BL._AC_SL1500_.jpg,,2026-04-21T12:44:40.252535,
59,1,Organic,,48.0,B0GRVRPX8N,"Happy Teacher Appreciation Week Decorations - Thank You Teachers Banner Ceiling Hanging Swirls for Teacher's Day Decor, Table Honeycomb Teacher's Gift Office Classroom Supplies",N/A,$9.99,,,,False,https://m.media-amazon.com/images/I/810HU4RspGL._AC_UL320_.jpg,https://m.media-amazon.com/images/I/810HU4RspGL._AC_SL1500_.jpg,,2026-04-21T12:44:40.256029,
61,1,Title,,,,Debug info copied.SponsoredSkylety 24 Pcs Teacher Appreciation Gifts Teacher Gifts Bulk Teachers Dea,,,,,,False,,,,2026-04-21T12:44:40.256966,
62,1,Title,,,,Previous123...7Next,,,,,,False,,,,2026-04-21T12:44:40.257289,
63,1,SB,2.0,,,N/A,https://aax-us-east-retail-direct.amazon.com/x/c/JGK_VvENMwt9OzYRw9S7Q0UAAAGdsBIlZwEAAAH2AQBvbm9fdHhuX2JpZDYgICBvbm9fdHhuX2ltcDIgICCsQHDb/clv1c_ek-wxPHXFbbWDfHXL5sAvQuvcRxOLvvnaLj92sezHint5e1jJOtEsAtQ09g2HBsWReUII6mqUxhxun3M83n7XFSaSKFDlSBtNzMRT2kJLJomiBEtkghA4-WV1L1spvE42iKKXhSUBpemA3lpbg-k2dbB5dmFhpXqlcKg6RXSlMa-W2IOKiiDcLag18OvPhYq-3Yi6wLpWTbEJVRddi6A93A9NBa1CEy8HgxhhK_TYDAGCdmT02EEIUvS8A2Jl3hbn7yf6f24B5g_kG-JPgCTVM47wU_BTEzvy-_t2JbR27mGVPMLVkyYIYi_I8wtk3GSezS9Xhkj_W4ozLXDlUcqqKEL2Y9iUTe9mtgwRyhV1H9lTbfeLJIUYXxB_8MKu5R9cIM8e9fXxtXxrQ5BldktXkNdpuDkDOBvezMf31k1aGVRtlS9DeQJZWEOOu1fcOEm38KncdZXC99CO-JBagU24ez3g664aLZ1yBwFcIEBMNp7z3sG09BjRZHp_1RA15Y488r-F_HxlmC7jPl8tnGUM8QudICO_CiBBLca9PuLQ4zIJEJ0L4CtdRzOHVUUAVOeAKCQiIxo6CN3fRqBd_wVcJiGX1KXfIf0Tf-9A9h7KAPydzde2fxXrB0EdqW6h2kl2h2dTYW-JByNbVrDnSLKP19k4IzyZHlOmMp7_iEUlzx4Y4t7XSFZ-tJjaxfGJj5rqV1fICYhh7Su0oChP5e57FoCFLrUofbuy2Wzn8adEt5vZsbFECIbj9uAgDfBZ3jQiPY4E969NmQlG_aZuLrcJnUBwBMnvSFiQAytlrk3vE3hP3qXsGODfLfwVFzj4RzkiDTbnU8HMi6MWJomms9MIVFv-i3jh_w_op-jrKEUjDYW_QpopxMt5aB7Lqz5322DFdI1x2Z75ngaWsQ84yP8BuJ6j_GdIGRC6J7Z4EPhS28yEJiLmGXi7T4Yx6B4nGkqy2LOaRLJk6WoV8_HxHYy7VL_S-v4rF0Cu2-cImTPobXeeLxKpVBnwNKxtGE4oei2bfEoE44hueSDlxfaFhB3OKN9t90I1CKAdDOrSKNp2L4jjDLgKaXEXBTseUys7d1LDit017jITB9mejZ3z2hsQK3UzzygooLC22pfwZ1Duy2ttQxYmClK_qtskfyROkGQ6E6cEepEsahq-HPirqSPQOOLG_pAaB3LLgZZKdWio2g3WPKGJnS8q1gpR7266bMj_BNZAdKPNY24D6TMvDK_t0nTVjgcEUUhQhbIO-tRolp_63tbZ0gpFu6xAHQAZvPzB6cQb3rBnHw_4OhOXXYpuWzdQS01J6JVUirIpIFYSGb6pg2VpXAXk62NJERFeZDOUaTTosuhirH_GP-c4hNmNd-wADNYFWt07HOtaEK-eiBa6xudGAPVoQMfl4n6DgEjuDkRVnYPIWYqkzmHCP5-iklEdFN4DBw2D6ILREdit2ffAH72H-ETnbWlYRsESkbRkmGSimx4xB7APibQYITEQFom33FcfT-ZY-RjMPxcMU5ck5o-huiu_AhLDEGrz4SJgDPz2Y_asEmr8QrOPv1HiKtqtTuG7hCk2jYn7vpNjJ6HZMjlfoGdM0-OqAOwl9XNjQvbm3Xl2JGzTkAzWdKyeLQad0L6bIlOCx5nSdkJGsItMfFZZrSepMEHP9zheHBqpTpRsJreqg_TaXztA_vOfCeGs1_nNrI35wnT/https://www.amazon.com/stores/page/70729CCC-0772-404C-AC29-CB7CFD040E40/?_encoding=UTF8&store_ref=SB_A079778622TUAF7204R7G-A00622454O3FNPSFFHHD&pd_rd_plhdr=t&aaxitk=771bc11d86a1c5e0d62a1f9ea7b2085c&hsa_cr_id=0&lp_asins=B0CT3D5P4H%2CB0DT36PXST%2CB0GMQ7DCKB&lp_query=teacher%20appreciation%20week%20decorations&lp_slot=desktop-hsa-3psl&ref_=sbx_be_s_3psl_mbd_mb0_bkgd&pd_rd_w=69ruS&content-id=amzn1.sym.cd7c548b-a599-426f-9ffe-daa1aa803c87%3Aamzn1.sym.cd7c548b-a599-426f-9ffe-daa1aa803c87&pf_rd_p=cd7c548b-a599-426f-9ffe-daa1aa803c87&pf_rd_r=A14855DARV2EJT6V03K2&pd_rd_wg=LyfXF&pd_rd_r=b2ef1f74-af8b-4666-82e6-e59533e7b2e3,,,,,False,,,N/A,2026-04-21T12:44:40.261454,
64,1,Title,,,,Need help?Visit the help sectionorcontact us,,,,,,False,,,,2026-04-21T12:44:40.262013,
