data_index,page,ad_type,ad_rank,organic_rank,asin,title,url,price_current,price_list,rating_stars,rating_count,is_prime,image_small,image_large,brand_name,scraped_at,inner_products_count
0,4,SB,7.0,,,First Responders Appreciation Sign Decor,https://aax-us-east-retail-direct.amazon.com/x/c/JC42408Dy8FJKiMHLTe10mkAAAGdsBLt5AEAAAH2AQBvbm9fdHhuX2JpZDMgICBvbm9fdHhuX2ltcDEgICDlyFJ8/clv1c_ek-wBIHXErbWDn2nI4trJ16WpAySuUbu95Yp9htivxOalHSjuS6YktGQ0tj2IdoIY5eJZV__ZLPoNnn2mWLecASOpDW5lCIoGO4tT2kJLJq6u1fjPZwt1J09ZvV_xkJQF5SaSuhEYU1wUNnvRiVRaCGAoO-8FlTknmTcZydKzAMWXQfNfmLFWCyh9lg68b6qH7dxNsUkGLfoFWX8IEbdmrIdOU5bFJ5nnQaCKRjkixKl6yCkvLdBlQ5tAQ2pl1iDmVa4kVstUO4Z3V2kyIvZf7Kq5DOyaFO3CVr_iaWij_62ngi6qzTNiqLmIQye5RYrO2Dn2uTrIUzL1XbR4-I15MEV978bV2UihJFh1qLTIkY9Xgx67-vl8SlgTOzllfoczdI1jtXrBpo_f3QuIcXnfOx7ifQAodFFo3am_Sxv5Qrl_I76fJ642EGTtttTuI0M0cPef1ZDaHVXhic4RLhtalNXGpUES12xu6aabayH5SiyrECYe5Jt-Ruv_ta0rkw7vblP1oyFEYDf2YUgPQ_trmMy82XbiJkT5xogrC3ENR1IzvPk5eU8Kc9gtog2DIiVoKEXK0wSBZDBQoPJHnGFJmmNAKoJa-vi_djRejytIrgskqkTKX5ea5tFMwBr1yxlCpguQG4tm0GbFleu0Sda9nXNBAC0VkQmAJ__tEM-HTBVOWp9d2eLm0IAZiOEk9EBHj504fFyA1gVl3XPZ1GfUO94_MDxjD2L2P_am8vIRm7PAuZVrr3fxhhPorg36XRwBWIln7IJmQH4Ejiq4YIWW8aYrCaF-rs2S3Hu1O_CPngjt0659wYWVSbyQtDV9zF3WBKFbwKbmDCvnwNIHFbvctDH0VvhD7yeBBCqTXdtTFZ8qDWQtZyL-le_Tc1cjiGL7-9vuTwTapP1x4Unb6L4NLmaiePoefM1J8TPGu1YCdRpDPQLeF2Shf3a3cK-m7H4oQXAFTFnmSsqctl0Z-Y4AN6w6oTlJVp-6owCr2VnEoiosmoyr8hxMAIqQmp2RTsFhHgePUK7f_gfvCeiAbsrrhAiPX0GY8UD2GSRuQG7fb6AHyJeKy03gcWXFVNVyaNfV8DFIPtjiQiScB8LOdoXTM9IADVSS-wYeAoUrNlpzPwLYy8niQ1926gcH8CL78FBW9O8YFXNi0tloHWXMGc2gT0LE5xGjQ6xbjpdHAV4BMNrdzmWsLdfA72ShVQhFK7srCZhyQ42SKxsKAktMJ9j8q4HwYnmx8nkHWiIHRJ8IYg8CkyzpFV1uT1_jd-769j0Gi_gydYzKg89DPa7o63VOtkxWFu0Ca28tPcP4dmFMlVMMWrl4vVc1lshrOhW-Lx7UGvy8gt5JnSdmvqBSgcXoabXInz1dr79ws8DMpMIcodzfe6tC6OwpKabEfW91tHfQoKTVuc6iixnvt3o9Y-idWXqxifu4LTKYWOO2lww_ZvxNwsOjRGc9qqq8eI00l56DriVQhjFortA1zMCgpOrOWPqF24bmvrKfSQ4lZ33YWBiFJAGCB4eFs76eDMse2Pe7mV5-rvd3dR3CIdBaQfLhYRKg5w3CQ0TDzsl3b0uDMKKyoIbcHuu2d3QvJzRQ3HtyCvyHXJC7gCzAWtKbmD9eeWcfeIKeyhRwvSxsoInpZ-X3TQY6CrgJr5KqsT0QSiqIbtXqNBChMuDNMfmoVHS2AGSzU6TVWRYTR3p5ohh/https://www.amazon.com/stores/page/D14321ED-3713-4C28-9B7D-7C41A0D7C184/?_encoding=UTF8&store_ref=SB_A033761733JRCGTYM9J5F-A06180973MNP7K4XYB1YC&pd_rd_plhdr=t&aaxitk=5d4d123e1e6496874aad4d871d641769&hsa_cr_id=0&lp_asins=B0DJSBB7TT%2CB0DJSCBLN3%2CB0DJSFPVVJ&lp_query=teacher%20appreciation%20week%20decorations&lp_slot=auto-sparkle-hsa-tetris&ref_=sbx_s_sparkle_sbtcd_bkgd&pd_rd_w=CzAvJ&content-id=amzn1.sym.cc961e39-6f5f-411e-8135-81c6c1187ac0%3Aamzn1.sym.cc961e39-6f5f-411e-8135-81c6c1187ac0&pf_rd_p=cc961e39-6f5f-411e-8135-81c6c1187ac0&pf_rd_r=WP9CXFM2WXF7VY6C9EJP&pd_rd_wg=XAuUv&pd_rd_r=e5de8a12-9415-47da-bf6e-7eea9643f9ca,,,,,False,"https://m.media-amazon.com/images/S/al-na-9d5791cf-3faf/73059b3c-e513-4629-a0f0-6dbccc2ede4b._CR0,0,512,512_AC_SX130_SY60_CB1169409_QL70_.png",,First Responders Appreciation Sign Decor,2026-04-21T12:45:31.194812,3.0
1,4,Title,,,,ResultsCheck each product page for other buying options. Price and other details may vary based on p,,,,,,False,,,,2026-04-21T12:45:31.195763,
3,4,SP,1.0,,B0G3NSP7Z5,"210pcs Teacher Appreciation Decorations for 25 Guests, All-in-one Set with No-diy Banner, Balloons, Plates, Cups, Napkins, Tablecloths – Easy Assembly Employee Appreciation Decorations",N/A,$22.99,,4.2,12.0,False,https://m.media-amazon.com/images/I/81znZluNTkL._AC_UL320_.jpg,https://m.media-amazon.com/images/I/81znZluNTkL._AC_SL1500_.jpg,,2026-04-21T12:45:31.198939,
4,4,SP,2.0,,B0GL1SZG79,"Teacher Appreciation Decorations, Staff Appreciation Decorations includes Thank You Teachers & Staff Banner and Colorful Teacher Hanging Swirls, Teacher Appreciation Week Decorations for Home Office",N/A,$12.99,,,,False,https://m.media-amazon.com/images/I/81iLMMagVLL._AC_UL320_.jpg,https://m.media-amazon.com/images/I/81iLMMagVLL._AC_SL1500_.jpg,,2026-04-21T12:45:31.202098,
5,4,SP,3.0,,B0CXHVNKG6,"XIFAN Thank You Teachers Banner 98x19.2 Inches, Large Teachers Appreciation Week Decorations Yard Sign, Teacher's Appreciation Day Decor Classroom Supplies Durable Backdrop Poster for Indoor Outdoor",N/A,$7.99,,4.5,16.0,False,https://m.media-amazon.com/images/I/81i7ggpJ+cL._AC_UL320_.jpg,https://m.media-amazon.com/images/I/81i7ggpJ+cL._AC_SL1500_.jpg,,2026-04-21T12:45:31.206380,
6,4,SP,4.0,,B0GMHRZSJV,"Teacher Appreciation Decorations, Staff Appreciation Decorations includes Thank You Teacher & Staff Backdrop, Honeycomb Centerpieces and Hanging Swirls, Teacher Appreciation Week Decoration",N/A,$21.99,,5.0,1.0,False,https://m.media-amazon.com/images/I/811ral5EqUL._AC_UL320_.jpg,https://m.media-amazon.com/images/I/811ral5EqUL._AC_SL1500_.jpg,,2026-04-21T12:45:31.210520,
7,4,Organic,,145.0,B0DS67GZGN,12 Pcs Teacher Appreciation Table Decorations Honeycomb Centerpieces Thank You Table Decoration 3D Teacher Appreciation Week Honeycomb Centerpiece Tables Sign for Classrooms Desks Decor,N/A,$8.99,,3.0,3.0,False,https://m.media-amazon.com/images/I/81zuw4aW8qL._AC_UL320_.jpg,https://m.media-amazon.com/images/I/81zuw4aW8qL._AC_SL1500_.jpg,,2026-04-21T12:45:31.215406,
8,4,Organic,,146.0,B0FX9XNMJ2,Fulmoon Pre Strung We Appreciate You Glitter Banner Appreciation Week Party Decoration for Employee Doctor Nurse Parents Teacher Coworker Staff Thank You Sign Party Decorations(Champagne Gold),N/A,$11.99,,,,False,https://m.media-amazon.com/images/I/51IQ1+j-brL._AC_UL320_.jpg,https://m.media-amazon.com/images/I/51IQ1+j-brL._AC_SL1500_.jpg,,2026-04-21T12:45:31.220464,
9,4,Organic,,147.0,B0CYLQHQDQ,Thank You Teachers We Appreciate You Banner Teacher Appreciation Week Decoration Glitter Black Happy Teacher’s Day Garland Thank You Teacher Classroom Party Supplies,N/A,$9.99,,5.0,4.0,False,https://m.media-amazon.com/images/I/71l3jdluUjL._AC_UL320_.jpg,https://m.media-amazon.com/images/I/71l3jdluUjL._AC_SL1500_.jpg,,2026-04-21T12:45:31.224466,
10,4,Title,,,,"Henoyso 12 Pack Teacher Appreciation Gift Bags with Ribbon, Clear PVC Teachers Thank You Treat Bags ",,,,,,False,,,,2026-04-21T12:45:31.225603,
11,4,Title,,,,More results,,,,,,False,,,,2026-04-21T12:45:31.225741,
12,4,Organic,,148.0,B0GLYYPJV5,Teachers Appreciation Week Decorations Thank You Teachers and Staff Door Cover School Classroom Home Door Banner,N/A,$12.99,,,,False,https://m.media-amazon.com/images/I/81LOeTZjN0L._AC_UL320_.jpg,https://m.media-amazon.com/images/I/81LOeTZjN0L._AC_SL1500_.jpg,,2026-04-21T12:45:31.229373,
13,4,Organic,,149.0,B0DS2BGCNR,"Teacher Appreciation Week Tablecloths Table Decorations, Thank You Teacher Table Cover Teachers Appreciation Party Decorations",N/A,$7.99,,4.8,5.0,False,https://m.media-amazon.com/images/I/717LeitR+PL._AC_UL320_.jpg,https://m.media-amazon.com/images/I/717LeitR+PL._AC_SL1500_.jpg,,2026-04-21T12:45:31.232980,
14,4,Organic,,150.0,B0DRCMNR2P,Avezano 3pcs Teacher Appreciation Tablecloth 108 x 54 inch Teacher Appreciation Decorations Thank You Teachers Plastic Table Covers Disposable,N/A,$9.99,,3.9,8.0,False,https://m.media-amazon.com/images/I/71-12827-gL._AC_UL320_.jpg,https://m.media-amazon.com/images/I/71-12827-gL._AC_SL1500_.jpg,,2026-04-21T12:45:31.238040,
15,4,SP,5.0,,B0GSVCZP7Z,"Teacher Appreciation Door Banner,Large Fabric Thank You Teacher Door Cover for Classroom Decorations, Teacher Appreciation Week Decorations Party Supplies (Blackboard)",N/A,$11.99,,5.0,16.0,False,https://m.media-amazon.com/images/I/81dhNG0R5GL._AC_UL320_.jpg,https://m.media-amazon.com/images/I/81dhNG0R5GL._AC_SL1500_.jpg,,2026-04-21T12:45:31.241329,
16,4,SP,6.0,,B0G76GBD7J,"Teacher Appreciation Backdrop, Large 71"" x 43"" Thank You Teachers Banner with Hemmed Edges for Classroom School Office, Teacher Appreciation Week Party Supplies Background, Chalkboard Style",N/A,$8.99,,5.0,1.0,False,https://m.media-amazon.com/images/I/71gZxLNC6OL._AC_UL320_.jpg,https://m.media-amazon.com/images/I/71gZxLNC6OL._AC_SL1500_.jpg,,2026-04-21T12:45:31.244373,
17,4,SP,7.0,,B0F8BHC9CD,"Vlipoeasn We Appreciate You Banner Decorations, Colorful Thank You for All You Do Backdrop Banner Honeycomb Centerpieces, Retirement Office Decor Staff Teachers Professors Doctor Nurses Appreciation",N/A,$22.99,,4.8,139.0,False,https://m.media-amazon.com/images/I/81TG2NMch-L._AC_UL320_.jpg,https://m.media-amazon.com/images/I/81TG2NMch-L._AC_SL1500_.jpg,,2026-04-21T12:45:31.248396,
18,4,SP,8.0,,B0DYV257XL,Nacho Average Teacher Backdrop Banner Teacher Appreciation Week Banner Decorations Thank You Teachers Staffs Decorations Mexican Colored Photo Booth Props Background,N/A,$9.99,,4.7,4.0,False,https://m.media-amazon.com/images/I/813fptP7+1L._AC_UL320_.jpg,https://m.media-amazon.com/images/I/813fptP7+1L._AC_SL1500_.jpg,,2026-04-21T12:45:31.252986,
19,4,Organic,,151.0,B0GLZKQNPZ,Thank You Teachers Backdrop Happy Teacher Appreciation Week Banner Decorations Thank You Teacher Staff Photography Background School Classroom Office Party Decor Supplies (7x5FT),N/A,$7.66,,5.0,1.0,False,https://m.media-amazon.com/images/I/61uZsj4ODrL._AC_UL320_.jpg,https://m.media-amazon.com/images/I/61uZsj4ODrL._AC_SL1500_.jpg,,2026-04-21T12:45:31.257200,
20,4,Organic,,152.0,B0F8HZZWHB,"30-Piece Teacher Appreciation Photo Booth Props Set | Glitter Selfie Props with Apple, Pencil & Chalkboard Designs – Perfect for Teachers Day, Appreciation Week & Thank You Parties",N/A,$5.99,,4.5,2.0,False,https://m.media-amazon.com/images/I/91keV5kD+zL._AC_UL320_.jpg,https://m.media-amazon.com/images/I/91keV5kD+zL._AC_SL1500_.jpg,,2026-04-21T12:45:31.263552,
21,4,Title,,,,Teachers appreciation bagSponsored|Shop DECEEDShop nowPrevious pageDECEED 12 PCS Teachers Appreciati,,,,,,False,,,,2026-04-21T12:45:31.265416,
22,4,Title,,,,More results,,,,,,False,,,,2026-04-21T12:45:31.265660,
23,4,Organic,,153.0,B0GJ99PHC7,"Thank You Decorations Tablecloth, 3 Pack Disposable Thank You for All You Do Theme We Appreciate You Table Cover Party Supplies for Employee Staff Teacher Nurse Appreciation, 55in x 86in",N/A,$9.99,,5.0,1.0,False,https://m.media-amazon.com/images/I/81xE08+j-oL._AC_UL320_.jpg,https://m.media-amazon.com/images/I/81xE08+j-oL._AC_SL1500_.jpg,,2026-04-21T12:45:31.270811,
24,4,Organic,,154.0,B0B5RFG984,"Homsolver Teacher Appreciation Gifts for Women, Christmas Birthday Valentines Retirement Thanksgiving Teachers' Day Graduation Season, Teacher’s Last Nerve Scented Candles",N/A,$7.98,,4.8,4336.0,False,https://m.media-amazon.com/images/I/51ajm09-CTL._AC_UL320_.jpg,https://m.media-amazon.com/images/I/51ajm09-CTL._AC_SL1500_.jpg,,2026-04-21T12:45:31.275376,
25,4,SP,9.0,,B0F1F45W24,"Thank You Teacher Staffs Banner Yard Sign, Happy Teacher Appreciation Week Banner Decorations, Thank You Teacher Decorations",N/A,$11.99,,5.0,3.0,False,https://m.media-amazon.com/images/I/81FrEGTH8ZL._AC_UL320_.jpg,https://m.media-amazon.com/images/I/81FrEGTH8ZL._AC_SL1500_.jpg,,2026-04-21T12:45:31.278779,
26,4,SP,10.0,,B0GT3S4YTQ,"Teacher Appreciation Week Decoration Door Cover, Thank You Teacher and Staff Banner Classroom Decorations for School Door Decor, Large Backdrop for Appreciation Week Party Supplies 71 x 35.4 Inches",N/A,$7.99,,4.3,11.0,False,https://m.media-amazon.com/images/I/817GNutHdRL._AC_UL320_.jpg,https://m.media-amazon.com/images/I/817GNutHdRL._AC_SL1500_.jpg,,2026-04-21T12:45:31.283296,
27,4,SP,11.0,,B0CYLQHQDQ,Thank You Teachers We Appreciate You Banner Teacher Appreciation Week Decoration Glitter Black Happy Teacher’s Day Garland Thank You Teacher Classroom Party Supplies,N/A,$9.99,,5.0,4.0,False,https://m.media-amazon.com/images/I/71l3jdluUjL._AC_UL320_.jpg,https://m.media-amazon.com/images/I/71l3jdluUjL._AC_SL1500_.jpg,,2026-04-21T12:45:31.286716,
28,4,SP,12.0,,B0GKH7BMCV,35 Pieces Teacher Appreciation Week Photo Booth Props Kit Funny Thank You Teachers and Staff Props Sticks Teachers Day Party Decorations Supplies,N/A,$8.99,,4.9,25.0,False,https://m.media-amazon.com/images/I/81pcxdVgYXL._AC_UL320_.jpg,https://m.media-amazon.com/images/I/81pcxdVgYXL._AC_SL1500_.jpg,,2026-04-21T12:45:31.291180,
29,4,Organic,,155.0,B0CY81PZZL,National Teacher Appreciation Week Decoration We Love Our Teachers Banner Thank You for Helping Us Grow Teachers Day Party Celebration Decor Supplies - Black,N/A,$8.99,,5.0,1.0,False,https://m.media-amazon.com/images/I/71B2rPAiDpL._AC_UL320_.jpg,https://m.media-amazon.com/images/I/71B2rPAiDpL._AC_SL1500_.jpg,,2026-04-21T12:45:31.297367,
30,4,Organic,,156.0,B0BZ3FW1SR,"HOWAF Teachers Appreciation Week Best Teacher Ever Party Props Table Centerpieces Sticks for Teacher Day Party Supplies,27pcs",N/A,$9.99,,4.5,8.0,False,https://m.media-amazon.com/images/I/81sKtm9wACL._AC_UL320_.jpg,https://m.media-amazon.com/images/I/81sKtm9wACL._AC_SL1500_.jpg,,2026-04-21T12:45:31.303864,
31,4,Organic,,157.0,B0CWKF5B8L,Teacher Appreciation Week Door Cover Thank You Teachers Party School Classroom Front Door Banner Photography Decoration,N/A,$9.99,,4.9,14.0,False,https://m.media-amazon.com/images/I/81O2BDVkA9L._AC_UL320_.jpg,https://m.media-amazon.com/images/I/81O2BDVkA9L._AC_SL1500_.jpg,,2026-04-21T12:45:31.308853,
32,4,Organic,,158.0,B0DWFHKJ7G,XtraLarge Thank You Teachers & Staff Backdrop Banner - Teachers Appreciation Week Background Bulletin Board Appreciation Week Party Hanging Photo Booth Decoration for School Classroom Office Wall,N/A,$13.99,,4.8,36.0,False,https://m.media-amazon.com/images/I/91hrNnq3tjL._AC_UL320_.jpg,https://m.media-amazon.com/images/I/91hrNnq3tjL._AC_SL1500_.jpg,,2026-04-21T12:45:31.313237,
33,4,Organic,,159.0,B0GHY8V5MS,Nacho Average Teacher Backdrop 6x4FT Teacher Appreciation Week Photography Background Thank You Teachers Staff Banner Decorations Supplies Photo Props,N/A,$5.99,,5.0,1.0,False,https://m.media-amazon.com/images/I/71keLk8egUL._AC_UL320_.jpg,https://m.media-amazon.com/images/I/71keLk8egUL._AC_SL1500_.jpg,,2026-04-21T12:45:31.319853,
34,4,Organic,,160.0,B0DPQJ82DR,"Mocsicka Thank You Teahcher Banner 2025 Teacher Appreciation Week Party Decorations Banner Thank You Teacher We Apprecitae All You Do Backdrop Supplies for School (White, 70.8x43.3 inch)",N/A,$6.99,,4.0,6.0,False,https://m.media-amazon.com/images/I/81T17hEB1aL._AC_UL320_.jpg,https://m.media-amazon.com/images/I/81T17hEB1aL._AC_SL1500_.jpg,,2026-04-21T12:45:31.326151,
35,4,Organic,,161.0,B0BZRFFG8T,5x3ft Thank You for All You Do Backdrop Congratulations Graduates Background Be Thankful to The Teacher Doctor Staff We Appreciate You CNA Week Decoration Banner Prom Photography Party Supplies,N/A,$10.99,,4.8,328.0,False,https://m.media-amazon.com/images/I/71lfxIEi9bL._AC_UL320_.jpg,https://m.media-amazon.com/images/I/71lfxIEi9bL._AC_SL1500_.jpg,,2026-04-21T12:45:31.332356,
36,4,Organic,,162.0,B0F18NT9XD,"Thank You We Appreciate You Banner - Teacher Appreciation Week Decoration, Thank You Teachers & Staff Theme School Classroom Bulletin Board Decor Teacher Appreciation Party Supplies",N/A,$9.99,,4.7,4.0,False,https://m.media-amazon.com/images/I/61ZmQit32hL._AC_UL320_.jpg,https://m.media-amazon.com/images/I/61ZmQit32hL._AC_SL1500_.jpg,,2026-04-21T12:45:31.338760,
37,4,Organic,,163.0,B0DX4T3Z9B,Thank You for All You Do Decorations 1pcs Thank You Banner and 60pcs Balloons We Appreciate You Backdrop Employee Staff Appreciation Gifts Teacher Doctor Graduation Volunteer Lab Week Decor,N/A,$12.98,,4.3,8.0,False,https://m.media-amazon.com/images/I/71hCdBZuyEL._AC_UL320_.jpg,https://m.media-amazon.com/images/I/71hCdBZuyEL._AC_SL1500_.jpg,,2026-04-21T12:45:31.345436,
38,4,Organic,,164.0,B0DS2CNX74,"Teacher Appreciation Week Paper Plates Set for 24 Guests Thank You Teachers Tableware Plates Napkins Set, We Appreciate You Teacher Dinnerware Table Decorations",N/A,$8.99,,5.0,2.0,False,https://m.media-amazon.com/images/I/71BBTTmZmPL._AC_UL320_.jpg,https://m.media-amazon.com/images/I/71BBTTmZmPL._AC_SL1500_.jpg,,2026-04-21T12:45:31.351753,
39,4,Organic,,165.0,B0DXPQS3D4,"Teacher Staff Thank You Treat Sign, Teacher Appreciation Table Sign, Teacher Appreciation Week Treat Sign, Employee Appreciation Sign, Dessert Table Sign, Christmas Treats Sign-JSGXLP02",N/A,$9.98,,3.9,2.0,False,https://m.media-amazon.com/images/I/618aXBKwx-L._AC_UL320_.jpg,https://m.media-amazon.com/images/I/618aXBKwx-L._AC_SL1500_.jpg,,2026-04-21T12:45:31.356205,
40,4,Organic,,166.0,B09Y5GYLKP,Thank You Teachers Large Indoor Outdoor Banner Decoration Teachers Appreciation Week Porch Fence Bulletin Board Wall Hanging Decor (1.6 x 8.2ft),N/A,$9.99,,4.6,77.0,False,https://m.media-amazon.com/images/I/81noJOH9OyL._AC_UL320_.jpg,https://m.media-amazon.com/images/I/81noJOH9OyL._AC_SL1500_.jpg,,2026-04-21T12:45:31.362638,
41,4,Organic,,167.0,B0DW7W4RJM,Teachers Appreciation Week Decorations Teacher Gifts Thank You Teachers Banner Teachers Appreciation Decoration and Supplies for Home School Office Party,N/A,$5.99,,5.0,2.0,False,https://m.media-amazon.com/images/I/71Wu4xCnnqL._AC_UL320_.jpg,https://m.media-amazon.com/images/I/71Wu4xCnnqL._AC_SL1500_.jpg,,2026-04-21T12:45:31.368288,
42,4,Organic,,168.0,B0GH18WPM6,"Teacher Appreciation Week Banner Hanging Swirls Decorations, Thank You Teachers Staff Banner Teacher's Day Hanging Swirls Streamers for Ceiling Teacher Appreciation Day Decorations",N/A,$11.99,,,,False,https://m.media-amazon.com/images/I/81I5eTnEwUL._AC_UL320_.jpg,https://m.media-amazon.com/images/I/81I5eTnEwUL._AC_SL1500_.jpg,,2026-04-21T12:45:31.372246,
43,4,Organic,,169.0,B0CRDD9ZX7,"Mocsicka Thank You Teachers Backdrop Staff Teacher Appreciation Party Decorations Thanks for All You Do Graduation Photography Background Banner (Colorful, 7x5ft(82''x60''))",N/A,$6.99,,4.4,8.0,False,https://m.media-amazon.com/images/I/81I1c1MjmEL._AC_UL320_.jpg,https://m.media-amazon.com/images/I/81I1c1MjmEL._AC_SL1500_.jpg,,2026-04-21T12:45:31.378066,
44,4,Organic,,170.0,B0BS3PVQG6,PTFNY Thank You Teachers Backdrop Banner Teachers Appreciation Week Decoration Classroom Bulletion Board Party Background for School Classroom Office,N/A,$9.99,,4.6,13.0,False,https://m.media-amazon.com/images/I/81VLYgHQfzL._AC_UL320_.jpg,https://m.media-amazon.com/images/I/81VLYgHQfzL._AC_SL1500_.jpg,,2026-04-21T12:45:31.384073,
45,4,Organic,,171.0,B0DTYFBP1Q,"Appreciation Decorations,50Pcs Teacher Appreciation Party Napkins Thank You Paper Napkins We Appreciate All That You Do Table Decorations for Teacher Staff Graduation,Teacher Appreciation Week Party",N/A,$8.99,,2.7,4.0,False,https://m.media-amazon.com/images/I/81U9YhuP4lL._AC_UL320_.jpg,https://m.media-amazon.com/images/I/81U9YhuP4lL._AC_SL1500_.jpg,,2026-04-21T12:45:31.388328,
46,4,Organic,,172.0,B0DSKH92MR,"Teacher Appreciation Banner Thank You Teachers Banner Appreciation Decorations Happy Teacher Appreciation Week Backdrop School Classroom Office Background Decorations (63"" x 40"")",N/A,$6.99,,4.8,9.0,False,https://m.media-amazon.com/images/I/81cSWregdCL._AC_UL320_.jpg,https://m.media-amazon.com/images/I/81cSWregdCL._AC_SL1500_.jpg,,2026-04-21T12:45:31.392104,
47,4,Organic,,173.0,B0GMTRR33P,"Teacher Appreciation Week Decorations - 3PCS Teacher Appreciation Backdrop Banners Decor Set, Love Our Teachers Large Sign Supplies for Party Office School Classroom",N/A,$9.99,,,,False,https://m.media-amazon.com/images/I/81ogG8yJXPL._AC_UL320_.jpg,https://m.media-amazon.com/images/I/81ogG8yJXPL._AC_SL1500_.jpg,,2026-04-21T12:45:31.395922,
48,4,Organic,,174.0,B0GFSJKF6P,WorldBazaar Teacher Appreciation Cupcake Toppers 24 PCS End of Year Teacher Thank You Cake Topper Decoration Graduation Nurse Week Birthday Party Decorations,N/A,$6.99,,,,False,https://m.media-amazon.com/images/I/81MXoyG7JgL._AC_UL320_.jpg,https://m.media-amazon.com/images/I/81MXoyG7JgL._AC_SL1500_.jpg,,2026-04-21T12:45:31.400879,
49,4,Organic,,175.0,B0CY4VGX25,Best Teacher Ever Banner Thank You Teacher We Love Our Teacher Party Decorations for School Classroom Celebrate Teacher Appreciation Week Party Supplies (Gold),N/A,$9.99,,5.0,4.0,False,https://m.media-amazon.com/images/I/71LUN5yfu0L._AC_UL320_.jpg,https://m.media-amazon.com/images/I/71LUN5yfu0L._AC_SL1500_.jpg,,2026-04-21T12:45:31.404590,
50,4,Organic,,176.0,B0C37QFM2D,"Pirese We Appreciate You Banner Decorations, Employee Appreciation Decorations, Thank You Sign, Staff Appreciation Banner, Thank You Banner, Team Appreciation Week for Teacher Nurse Doctor Pastor",N/A,$9.99,,4.6,284.0,False,https://m.media-amazon.com/images/I/81Fhdwab3WL._AC_UL320_.jpg,https://m.media-amazon.com/images/I/81Fhdwab3WL._AC_SL1500_.jpg,,2026-04-21T12:45:31.409228,
51,4,Organic,,177.0,B0F18L6WJ3,Glittery Thank You For Your Dedication and Hard Work Banner Thank You Teachers Banner Hanging Swirls Teachers Staffs Appreciation Week Decorations Teachers Employee Doctor Retirement Appreciation Party Decor,N/A,$9.99,,4.8,11.0,False,https://m.media-amazon.com/images/I/71B-8eGWIoL._AC_UL320_.jpg,https://m.media-amazon.com/images/I/71B-8eGWIoL._AC_SL1500_.jpg,,2026-04-21T12:45:31.412984,
52,4,Organic,,178.0,B0D1QG9HPJ,Vohado Thank You for All You Do Door Cover Thank You Banners for Employee Teacher Doctor Nurse Staff Appreciation Decorations 2025 Prom Congratulations Graduates Party Decor,N/A,$12.99,,4.5,9.0,False,https://m.media-amazon.com/images/I/71U73hb9Q3L._AC_UL320_.jpg,https://m.media-amazon.com/images/I/71U73hb9Q3L._AC_SL1500_.jpg,,2026-04-21T12:45:31.416791,
53,4,Organic,,179.0,B0CX92K89D,Teachers Appreciation Week Decorations Teacher Gifts Thank You Teachers Banner Teachers Appreciation Decoration and Supplies for Home School Office Party,N/A,$11.99,,4.6,18.0,False,https://m.media-amazon.com/images/I/71--RFKj9IL._AC_UL320_.jpg,https://m.media-amazon.com/images/I/71--RFKj9IL._AC_SL1500_.jpg,,2026-04-21T12:45:31.420561,
54,4,Organic,,180.0,B0CNXN8VVQ,"JOYMEMO Teacher of the Year Sash - Thank You Teachers and Teacher Appreciation Week Decorations, Teacher Appreciate Party Decor, Happy Teachers’ Day Supplies",N/A,$7.99,,4.4,9.0,False,https://m.media-amazon.com/images/I/61GMRN4HdzL._AC_UL320_.jpg,https://m.media-amazon.com/images/I/61GMRN4HdzL._AC_SL1500_.jpg,,2026-04-21T12:45:31.425328,
55,4,Organic,,181.0,B0D5VS2T16,"Thank You Decorations Tableware, We Appreciate You Decorations, Paper Plate, Cup, Napkin, Cutlery, Thank You For All You Do Employee Staff Teacher Nurse Appreciation Party Supplies | 24 Guest",N/A,$17.99,,4.7,25.0,False,https://m.media-amazon.com/images/I/81pREA+ANGL._AC_UL320_.jpg,https://m.media-amazon.com/images/I/81pREA+ANGL._AC_SL1500_.jpg,,2026-04-21T12:45:31.429194,
56,4,Organic,,182.0,B0FQN8PMB1,3PCS Colorful We Appreciate You Decoration Banner Thank You for All You Do Banner You Are Amazing Backdrop for Teacher Employee Staff Nurse Poaster Volunteer Appreciation Retirement Party Decorations,N/A,$14.99,,4.7,30.0,False,https://m.media-amazon.com/images/I/81mmP6RV72L._AC_UL320_.jpg,https://m.media-amazon.com/images/I/81mmP6RV72L._AC_SL1500_.jpg,,2026-04-21T12:45:31.432900,
57,4,Organic,,183.0,B0D2WWZWDM,3pcs We Appreciate You Table Cloths Thank You Decorations for Work Anniversary Party Disposable Plastic Blue Gold Table Cover for Coworker Employee Volunteer Teacher Appreciation Office Supplies Favor,N/A,$12.99,,4.7,41.0,False,https://m.media-amazon.com/images/I/81ZX4XDGx6L._AC_UL320_.jpg,https://m.media-amazon.com/images/I/81ZX4XDGx6L._AC_SL1500_.jpg,,2026-04-21T12:45:31.437596,
58,4,Organic,,184.0,B0GK976J2J,"71x42inch Thank You Teachers Backdrop, Doughnut You Donut Know How Much We Appreciate Polyester Photography Background for Parties, Appreciation Week Photo Booth Prop Decorations",N/A,$9.99,,,,False,https://m.media-amazon.com/images/I/81nslNvN-qL._AC_UL320_.jpg,https://m.media-amazon.com/images/I/81nslNvN-qL._AC_SL1500_.jpg,,2026-04-21T12:45:31.442109,
59,4,Organic,,185.0,B0DS1W3YHV,Gejoy 2 Sets Teacher Appreciation Balloons Stand Kit Pencil Shape 6.5 ft Adjustable Metal Tube with 185 Pcs Balloons 2 Set Welcome Letters for Back to School Teacher Appreciation Week Decorations,N/A,$29.99,,5.0,7.0,False,https://m.media-amazon.com/images/I/71CQXHuMH5L._AC_UL320_.jpg,https://m.media-amazon.com/images/I/71CQXHuMH5L._AC_SL1500_.jpg,,2026-04-21T12:45:31.446019,
60,4,Organic,,186.0,B0FGHQ125B,"Composition Notebook Table Runner for Back to School Party Decoration Teacher Appreciation Week Classroom Dining Room Home Kitchen Table Decor (13"" x 72"")",N/A,$8.99,,4.8,7.0,False,https://m.media-amazon.com/images/I/81uX3SjQ45L._AC_UL320_.jpg,https://m.media-amazon.com/images/I/81uX3SjQ45L._AC_SL1500_.jpg,,2026-04-21T12:45:31.449743,
61,4,Organic,,187.0,B0CY515SZB,Thank You for Helping Us Grow Banner Teacher Appreciation Week Party Decorations Thank You Teachers Banner for Teacher’s Day Celebration School Classroom Office Party Supplies (Gold),N/A,$9.99,,5.0,1.0,False,https://m.media-amazon.com/images/I/71U0AhvzGcL._AC_UL320_.jpg,https://m.media-amazon.com/images/I/71U0AhvzGcL._AC_SL1500_.jpg,,2026-04-21T12:45:31.453781,
62,4,Organic,,188.0,B0GD6NWWXQ,"50Pcs Teacher Appreciation Party Oval Paper Plates 10"" x 12"" Large Heavy Duty Thank You Teachers Decorations Appreciation Week Dessert Plates for 2026 School Graduation Party Supplies",N/A,$17.99,,4.7,21.0,False,https://m.media-amazon.com/images/I/71+PWY6g-OL._AC_UL320_.jpg,https://m.media-amazon.com/images/I/71+PWY6g-OL._AC_SL1500_.jpg,,2026-04-21T12:45:31.457898,
63,4,Organic,,189.0,B0DY7DJ699,"We Appreciate You Thank You for All You Do Banner, Thank You for You Dedication Hard Work Appreciation Party Decorations for Teacher Employee Staff Doctors Nurse Volunteer Soldier, Appreciation Week Office Party Decorations",N/A,$11.99,,4.7,28.0,False,https://m.media-amazon.com/images/I/71n+rnbda9L._AC_UL320_.jpg,https://m.media-amazon.com/images/I/71n+rnbda9L._AC_SL1500_.jpg,,2026-04-21T12:45:31.462611,
64,4,Organic,,190.0,B0DXPP7P7Y,"Teacher Staff Thank You Treat Sign, Teacher Appreciation Table Sign, Teacher Appreciation Week Treat Sign, Employee Appreciation Sign, Dessert Table Sign, Christmas Treats Sign-JSGXLP04",N/A,$9.98,,5.0,6.0,False,https://m.media-amazon.com/images/I/61YBZsmU48L._AC_UL320_.jpg,https://m.media-amazon.com/images/I/61YBZsmU48L._AC_SL1500_.jpg,,2026-04-21T12:45:31.466501,
