data_index,page,ad_type,ad_rank,organic_rank,asin,title,url,price_current,price_list,rating_stars,rating_count,is_prime,image_small,image_large,brand_name,scraped_at,inner_products_count
3,3,Organic,,97.0,B0F21KPWD5,Summer Birthday Party Decorations - 13 Pcs Beach Pool Hanging Swirls Decors Set for Kids Hello Summer Slip Flop Banner Supplies Happy Hawaii Holiday Celebration Table Honeycomb Centerpieces,N/A,$12.49,,4.9,12.0,False,https://m.media-amazon.com/images/I/81OgQ8q0dNL._AC_UL320_.jpg,https://m.media-amazon.com/images/I/81OgQ8q0dNL._AC_SL1500_.jpg,,2026-04-14T17:29:56.409069,
4,3,Organic,,98.0,B0C7ZNLZHJ,Pool Party Hanging Swirls 20Pcs Summer Beach Pool Birthday Party Decorations Summer Ceiling Hanging Decorations for Hello Summer Party Beach Party Luau Hawaii Party Summer Party Supplies,N/A,$8.99,,4.7,19.0,False,https://m.media-amazon.com/images/I/81aQt8S7roL._AC_UL320_.jpg,https://m.media-amazon.com/images/I/81aQt8S7roL._AC_SL1500_.jpg,,2026-04-14T17:29:56.413909,
5,3,Organic,,99.0,B0F58591L1,Oudain 2 Pack Blue Bow Starfish and Seashell Garland 6.56 ft Ocean Coastal Nautical Beach Party Paper Bow Hanging Banner for Under the Sea Summer Birthday Wedding Bachelorette Mermaid Baby Shower,N/A,$7.49,,4.7,116.0,False,https://m.media-amazon.com/images/I/611IoA1u3FL._AC_UL320_.jpg,https://m.media-amazon.com/images/I/611IoA1u3FL._AC_SL1500_.jpg,,2026-04-14T17:29:56.419490,
6,3,Title,,,,Kids Sunglasses Bulk Party FavorsSponsored|5K+ bought from this brand in past month|Shop RugortShop ,,,,,,False,,,,2026-04-14T17:29:56.422007,
7,3,Title,,,,More results,,,,,,False,,,,2026-04-14T17:29:56.422007,
8,3,Organic,,100.0,B0B4VLGT76,Jetec Summer Slippers Hanging Sign Shape Welcome Hello Flip Flop Wooden Door Sign Hanging Plaque Rustic Wall Sign Yard Indoor Outdoor Garden Decoration with Rope (Hello Summer),N/A,$7.99,,4.4,1166.0,False,https://m.media-amazon.com/images/I/71O52MbRKJL._AC_UL320_.jpg,https://m.media-amazon.com/images/I/71O52MbRKJL._AC_SL1500_.jpg,,2026-04-14T17:29:56.425632,
9,3,Organic,,101.0,B0FBW381SQ,8pcs Beach Ball Theme Garlands Summer Beach Birthday Party Decorations Pool Beach Ball Cutout Hanging Garland Room Wall Decor for Pool Party Summer Theme Baby Shower Supplies,N/A,$8.99,,5.0,2.0,False,https://m.media-amazon.com/images/I/81MRIRnlO+L._AC_UL320_.jpg,https://m.media-amazon.com/images/I/81MRIRnlO+L._AC_SL1500_.jpg,,2026-04-14T17:29:56.431608,
10,3,Organic,,102.0,B0CW98ZCKZ,Ozepao 58 Pcs Summer Cutouts Beach Hawaiian Theme Bulletin Board Decoration Tropical Fruits Paper Cut Outs for School Supplies Classroom Home Party Decor,N/A,$9.99,,4.9,56.0,False,https://m.media-amazon.com/images/I/812-qu1OwsL._AC_UL320_.jpg,https://m.media-amazon.com/images/I/812-qu1OwsL._AC_SL1500_.jpg,,2026-04-14T17:29:56.439433,
11,3,Organic,,103.0,B0D6BKYCW6,Summer Beach Pool Honeycomb Centerpieces Hello Summer Party Decorations Summer Pool Party Centerpiece Decoration for Summer Birthday Hawaii Beach Theme Party Supplies,N/A,$8.09,,4.6,3.0,False,https://m.media-amazon.com/images/I/81hexSW+OcL._AC_UL320_.jpg,https://m.media-amazon.com/images/I/81hexSW+OcL._AC_SL1500_.jpg,,2026-04-14T17:29:56.446491,
12,3,Organic,,104.0,B0DTHLYD5F,BlissYard Hello Summer Banner 71x43 Inches Beach Party Decorations Hawaiian Tropical Backdrop with Surfboard Ice Cream Design Summer Party Banner for Indoor Outdoor Pool Luau Decor,N/A,$12.99,,4.7,13.0,False,https://m.media-amazon.com/images/I/81aESmY+81L._AC_UL320_.jpg,https://m.media-amazon.com/images/I/81aESmY+81L._AC_SL1500_.jpg,,2026-04-14T17:29:56.452276,
13,3,Organic,,105.0,B0DLB3QP6M,"12 Pack 8 Inch Beach Ball Paper Lanterns - Summer Classroom Decorations & Pool Party Hanging Decor, Reusable Hawaiian Luau, Ocean Theme Birthday & Beach Party Supplies for Indoor Outdoor",N/A,$14.99,,4.9,27.0,False,https://m.media-amazon.com/images/I/81U-nIczqYL._AC_UL320_.jpg,https://m.media-amazon.com/images/I/81U-nIczqYL._AC_SL1500_.jpg,,2026-04-14T17:29:56.456839,
14,3,Title,,,,Creative and unique idea to decorate homeShop ArtoidModePrevious pageArtoid Mode Sea Shell Starfish ,,,,,,False,,,,2026-04-14T17:29:56.458845,
15,3,Title,,,,More results,,,,,,False,,,,2026-04-14T17:29:56.458845,
16,3,Organic,,106.0,B083W99RQ8,"Zcaukya Inflatable Palm Tree Cooler, 60"" Blow Up Palm Tree Cooler for Tropical Party Decorations, Hawaiian Party Supplies Pool Decorations",N/A,$19.49,,4.2,1456.0,False,https://m.media-amazon.com/images/I/71YUjeio9AL._AC_UL320_.jpg,https://m.media-amazon.com/images/I/71YUjeio9AL._AC_SL1500_.jpg,,2026-04-14T17:29:56.470413,
17,3,Organic,,107.0,B0CSYYW1ZJ,"PAPER JAZZ Sunflower Party Decorations Sunflower Bithday Paper Fans Bulletin Board Decor, Yellow Tissue Flowers Wall Decorations Hanging Sun Flower Theme Party Supplies Baby Shower.",N/A,$15.19,,4.6,300.0,False,https://m.media-amazon.com/images/I/715XtqOW8xL._AC_UL320_.jpg,https://m.media-amazon.com/images/I/715XtqOW8xL._AC_SL1500_.jpg,,2026-04-14T17:29:56.474435,
18,3,Organic,,108.0,B09WZW2VL6,CAVLA Glitter Hello Summer Banner with Sunflower Signs and Colorful Glittery Popsicle Banner Hello Summer Ice Cream Garland Banner Summer Birthday Party Fireplace Mantle Decorations Supplies,N/A,$9.99,,4.7,83.0,False,https://m.media-amazon.com/images/I/61jTv+wHcML._AC_UL320_.jpg,https://m.media-amazon.com/images/I/61jTv+wHcML._AC_SL1500_.jpg,,2026-04-14T17:29:56.479090,
19,3,Organic,,109.0,B0DP21D9BL,"25pcs Hawaiian Leis Bulk,Colorful Lei Tropical Flower Necklace Hawaii Hula Dance Decor for Summer Beach Pool Luau Party Birthday Decoration Favors Supplies",N/A,$8.99,,4.2,377.0,False,https://m.media-amazon.com/images/I/812uJFjV7FL._AC_UL320_.jpg,https://m.media-amazon.com/images/I/812uJFjV7FL._AC_SL1500_.jpg,,2026-04-14T17:29:56.483148,
20,3,Organic,,110.0,B0946ZZ9BD,"Outus 30 Pieces Hawaiian Luau Birthday Party Hanging Swirl Decorations, Flower Tropical Palm Flamingo Sign Foil Ceiling Decor for Floral Tropical Party Summer Beach Pool Tiki Supplies(Summer)",N/A,$8.79,,4.6,1154.0,False,https://m.media-amazon.com/images/I/81cwoPntlvL._AC_UL320_.jpg,https://m.media-amazon.com/images/I/81cwoPntlvL._AC_SL1500_.jpg,,2026-04-14T17:29:56.487176,
21,3,Organic,,111.0,B095S5DPN5,"FUTUREPLUSX 48 PCS Leis for Luau Party decorations, Hawaiian Leis Tropical Hawaiian Bulk Including Colorful Flower Necklace Headbands and Wristbands for Hula Dance Party Tropical Summer Beach Theme",N/A,$11.99,,4.5,690.0,False,https://m.media-amazon.com/images/I/91F4LP+2-TL._AC_UL320_.jpg,https://m.media-amazon.com/images/I/91F4LP+2-TL._AC_SL1500_.jpg,,2026-04-14T17:29:56.492195,
22,3,Organic,,112.0,B0DS5YKKV7,Fullhawl 11 Pcs Summer Beach Party Hanging Decorations School's Out for Summer Ceiling Hanging Decor with 3D Honeycomb Ball End of School Year Pool Party Ornaments for Luau Hawaii Grad Beach Vacation,N/A,$14.99,,4.5,5.0,False,https://m.media-amazon.com/images/I/81ryMSZkVCL._AC_UL320_.jpg,https://m.media-amazon.com/images/I/81ryMSZkVCL._AC_SL1500_.jpg,,2026-04-14T17:29:56.496319,
23,3,Organic,,113.0,B0D1GB693Z,"ASTARON Black Sunglasses Bulk, 6/12/24/48 Pack Sunglasses Party Favors for Summer Beach Pool Birthday Wedding Party Supplies",N/A,$13.99,,4.7,1341.0,False,https://m.media-amazon.com/images/I/71BsdLm4EFL._AC_UL320_.jpg,https://m.media-amazon.com/images/I/71BsdLm4EFL._AC_SL1500_.jpg,,2026-04-14T17:29:56.504346,
24,3,Organic,,114.0,B0CZFT9G1C,Summer Garland Hello Summer Banner with Colorful Glittery Popsicle Banner Hello Summer Ice Cream Garland Banner Party Decorations for The Home Indoor Outdoor Mantel Fireplace Hanging Déco,N/A,$7.86,,4.9,5.0,False,https://m.media-amazon.com/images/I/61xs5mlYj0L._AC_UL320_.jpg,https://m.media-amazon.com/images/I/61xs5mlYj0L._AC_SL1500_.jpg,,2026-04-14T17:29:56.507129,
25,3,Organic,,115.0,B0B1HJRTNP,JOZON Colorful Glittery School's Out for Summer Banner with Sunglasses Sun Popsicle Slippers Signs End of School Year Summer Vacation Banner Garland Beach Pool Splash Bash Summer Vacation Decorations,N/A,$8.99,,4.8,27.0,False,https://m.media-amazon.com/images/I/61+se7fYjgL._AC_UL320_.jpg,https://m.media-amazon.com/images/I/61+se7fYjgL._AC_SL1500_.jpg,,2026-04-14T17:29:56.512230,
26,3,Organic,,116.0,B0CQMYQHSM,Amandir 159PCS Summer Pool Beach Party Decorations Splash Tropical Balloon Garland Arch Kit Sun Watermelon Foil Balloons for Birthday Swimming Water Luau Hawaiian Baby Shower Party Decorations,N/A,$9.99,,4.3,64.0,False,https://m.media-amazon.com/images/I/81bDoUgoI7L._AC_UL320_.jpg,https://m.media-amazon.com/images/I/81bDoUgoI7L._AC_SL1500_.jpg,,2026-04-14T17:29:56.518030,
27,3,Organic,,117.0,B0CLP5W5VQ,Ziliny 36 Pcs Summer Pool Beach Party Supplies 5 lb Beach Ball Large Paper Serving Snack Trays for Summer Hawaii Tropical Party Swimming Pool Favors,N/A,$17.99,,4.5,36.0,False,https://m.media-amazon.com/images/I/818v8g+7+0L._AC_UL320_.jpg,https://m.media-amazon.com/images/I/818v8g+7+0L._AC_SL1500_.jpg,,2026-04-14T17:29:56.524626,
28,3,Organic,,118.0,B0CYC1LCJ1,"Hello Summer Party Decorations, Hello Summer Backdrop Banner for Hello Summer Party Decorations Supplies, 71 x 43 inch",N/A,$9.99,,4.9,43.0,False,https://m.media-amazon.com/images/I/81E5TxjcAVL._AC_UL320_.jpg,https://m.media-amazon.com/images/I/81E5TxjcAVL._AC_SL1500_.jpg,,2026-04-14T17:29:56.530461,
29,3,Organic,,119.0,B0BTDHRYT8,"36 Count Hawaiian Lei Bulk, Tropical Luau Hawaii Theme Silk Flower Lei, Party Favors for Beach Holiday Wedding Birthday Party, Aloha Summer Party Decorations",N/A,$9.98,,4.4,1265.0,False,https://m.media-amazon.com/images/I/91dq-UYMKiL._AC_UL320_.jpg,https://m.media-amazon.com/images/I/91dq-UYMKiL._AC_SL1500_.jpg,,2026-04-14T17:29:56.535190,
30,3,Organic,,120.0,B01JGQF40Y,"250pcs Multicolor Pennant Flags,LOOBJOYGAME 263Ft Nylon Fabric Decorations Grand Opening Banner Rope",N/A,$12.99,,4.6,2041.0,False,https://m.media-amazon.com/images/I/61drJej456L._AC_UL320_.jpg,https://m.media-amazon.com/images/I/61drJej456L._AC_SL1500_.jpg,,2026-04-14T17:29:56.541067,
31,3,Organic,,121.0,B0CT7J5ZNT,FRIDAY NIGHT 30 Pcs Hawaiian Luau Hanging Swirls Tropical Party Decorations Foil Ceiling Hangers with Flowers and Green Leaves for Summer Beach Pool Birthday Supplies,N/A,$8.99,,4.7,32.0,False,https://m.media-amazon.com/images/I/81TTz7F43mL._AC_UL320_.jpg,https://m.media-amazon.com/images/I/81TTz7F43mL._AC_SL1500_.jpg,,2026-04-14T17:29:56.544099,
32,3,Organic,,122.0,B0BPL5PYV8,"Zcaukya Inflatable Palm Tree Cooler, 60"" Blow Up Palm Tree Cooler for Tropical Party Decorations, Hawaiian Party Supplies Pool Decorations",N/A,$32.29,,4.2,1456.0,False,https://m.media-amazon.com/images/I/81adb71iO8L._AC_UL320_.jpg,https://m.media-amazon.com/images/I/81adb71iO8L._AC_SL1500_.jpg,,2026-04-14T17:29:56.554661,
33,3,Organic,,123.0,B0BYDMHXHG,"AVOIN colorlife Hello Sunshine Classic Garden Flag 12x18 Inch Double Sided Outside, Summer Party Holiday Burlap Yard Outdoor Decoration",N/A,$6.99,,4.8,285.0,False,https://m.media-amazon.com/images/I/71Lr5yGIRfL._AC_UL320_.jpg,https://m.media-amazon.com/images/I/71Lr5yGIRfL._AC_SL1500_.jpg,,2026-04-14T17:29:56.560690,
34,3,Organic,,124.0,B0CZ969M49,Glitter School’s out for Summer Banner and Colorful Glittery Summer Patterns Banner End of School Year Garland Banner Summer Vacation Beach Pool Party Fireplace Mantle Decorations,N/A,$9.99,,4.8,8.0,False,https://m.media-amazon.com/images/I/619I0Sn77zL._AC_UL320_.jpg,https://m.media-amazon.com/images/I/619I0Sn77zL._AC_SL1500_.jpg,,2026-04-14T17:29:56.564701,
35,3,Organic,,125.0,B0DXFNDN63,"xo, Fetti Pool Party Napkins - 3-ply, 24 pcs | Summer Cocktail Napkins, Colorful Party Setting, Kids Birthday Decoration, Fun Tablescape",N/A,$12.99,,5.0,6.0,False,https://m.media-amazon.com/images/I/61UHEDYOG8L._AC_UL320_.jpg,https://m.media-amazon.com/images/I/61UHEDYOG8L._AC_SL1500_.jpg,,2026-04-14T17:29:56.568724,
36,3,Organic,,126.0,B0F3CRG7L5,"3 Pack Summer Flamingo Tablecloth Party Decorations, Hawaiian Tropical Plastic Table Cloth, Disposable Luau Table Cover for Summer Flamingo Picnic Birthday Party Supplies Decorations, 54” x 108”",N/A,$8.99,,4.4,46.0,False,https://m.media-amazon.com/images/I/816T9zMlEeL._AC_UL320_.jpg,https://m.media-amazon.com/images/I/816T9zMlEeL._AC_SL1500_.jpg,,2026-04-14T17:29:56.573309,
37,3,Organic,,127.0,B09JWZ2819,"Triumpeek Inflatable Cactus Cooler, 55"" Fiesta Cactus Ice Bucket Wearing Sombreros for Summer Swimming Pool Hawaiian Themed Party Supplies",N/A,$19.99,,4.6,825.0,False,https://m.media-amazon.com/images/I/71dXIIKJn5L._AC_UL320_.jpg,https://m.media-amazon.com/images/I/71dXIIKJn5L._AC_SL1500_.jpg,,2026-04-14T17:29:56.578191,
38,3,Organic,,128.0,B0CXXBNKYX,Hello Summer Banner Summer Party Decorations Beach Party Decoration 3Pcs Hello Summer Pool Party Banners for Hawaiian Happy Party Supplies,N/A,$9.99,,4.3,19.0,False,https://m.media-amazon.com/images/I/81-AoSj9YiL._AC_UL320_.jpg,https://m.media-amazon.com/images/I/81-AoSj9YiL._AC_SL1500_.jpg,,2026-04-14T17:29:56.582699,
39,3,Organic,,129.0,B0F13CVFYD,"Hallswl 3Pcs Ocean Waves Tablecloth, Ocean Water Print Tablecloths Summer Disposable Plastic Table Covers for Beach Surf Pool Sea Themed Party Birthday Decorations,54X108inch",N/A,$8.99,,4.7,67.0,False,https://m.media-amazon.com/images/I/81xmLEb5RaL._AC_UL320_.jpg,https://m.media-amazon.com/images/I/81xmLEb5RaL._AC_SL1500_.jpg,,2026-04-14T17:29:56.587385,
40,3,Organic,,130.0,B0G82VM9N7,"xo, Fetti Hot Dog Banner | Cookout Party, BBQ Decor, Summer Party, July 4th, Kids Party, Funny",N/A,$10.99,,,,False,https://m.media-amazon.com/images/I/71d6ZJ7bQNL._AC_UL320_.jpg,https://m.media-amazon.com/images/I/71d6ZJ7bQNL._AC_SL1500_.jpg,,2026-04-14T17:29:56.593042,
41,3,Organic,,131.0,B0GCM3FPNM,"50 LED 25ft Summer Hawaiian Beach String Lights Outdoor with Remote, Flamingo Pineapple Palm Tree Fairy Twinkle Lights Battery Operated with 8 Modes & Timer for Tropical Party Beach Pool Decorations",N/A,$16.19,,4.4,334.0,False,https://m.media-amazon.com/images/I/71IaC6j30YL._AC_UL320_.jpg,https://m.media-amazon.com/images/I/71IaC6j30YL._AC_SL1500_.jpg,,2026-04-14T17:29:56.598674,
42,3,Organic,,132.0,B0BYP3H6FF,Hello Summer Banner and Colorful Flip Flop Banner Summer Hawaiian Tropical Beach Pool Slippers Garland Banner Summer Holiday Birthday Party Classroom Bulletin Board Fireplace Mantle Decorations,N/A,$9.99,,4.8,39.0,False,https://m.media-amazon.com/images/I/61e-wv+U+GL._AC_UL320_.jpg,https://m.media-amazon.com/images/I/61e-wv+U+GL._AC_SL1500_.jpg,,2026-04-14T17:29:56.603407,
43,3,Organic,,133.0,B09WYB7F1H,"100PCS Flamingo Fruit Paper Straws,Disposable Plastic Drinking Straws,Tropical Hawaiian Beach Summer Pool Party Cocktail Decorations - Assorted Colors",N/A,$11.99,,4.6,526.0,False,https://m.media-amazon.com/images/I/712Vps8x8oL._AC_UL320_.jpg,https://m.media-amazon.com/images/I/712Vps8x8oL._AC_SL1500_.jpg,,2026-04-14T17:29:56.609254,
44,3,Organic,,134.0,B0D9JF7Y4H,PIGETALE 2 Pack 3.2x6.5 Feet Wavy Blue Backdrop Curtain Tinsel Streamers Foil Fringe Backdrop Ocean Themed Decor Baby Shower Bachelorette Disco Winter Under The Sea Summer Pool Beach Party Decorations,N/A,$5.40,,4.3,214.0,False,https://m.media-amazon.com/images/I/9177pfW8Z6L._AC_UL320_.jpg,https://m.media-amazon.com/images/I/9177pfW8Z6L._AC_SL1500_.jpg,,2026-04-14T17:29:56.613938,
45,3,Organic,,135.0,B0D129R82J,"VILIFEVER Ice Cream Bar Banner Ice Cream Garland, Ice Cream Theme Birthday Party Baby Shower Wedding Decorations Photo Props Summer Holidays Party Favors",N/A,$9.99,,4.8,67.0,False,https://m.media-amazon.com/images/I/71-ayrrmaxL._AC_UL320_.jpg,https://m.media-amazon.com/images/I/71-ayrrmaxL._AC_SL1500_.jpg,,2026-04-14T17:29:56.618698,
46,3,Organic,,136.0,B0B8G6PQ63,"200 Count Hawaiian Lei Bulk, Tropical Luau Hawaii Theme Silk Flower Necklace, Party Favors for Beach Holiday Wedding Birthday Party, Aloha Summer Party Decorations",N/A,$39.99,,4.4,337.0,False,https://m.media-amazon.com/images/I/A1JXqd95lrL._AC_UL320_.jpg,https://m.media-amazon.com/images/I/A1JXqd95lrL._AC_SL1500_.jpg,,2026-04-14T17:29:56.622876,
47,3,Organic,,137.0,B073DWVS5T,jollylife 12PCS Luau Hawaiian Grass Skirts + 12PCS Wristbands Party Decorations Hula Hibiscus Flowers Birthday Tropical Supplies,N/A,$23.99,,4.6,1572.0,False,https://m.media-amazon.com/images/I/A1k-7qllpbL._AC_UL320_.jpg,https://m.media-amazon.com/images/I/A1k-7qllpbL._AC_SL1500_.jpg,,2026-04-14T17:29:56.627567,
48,3,Organic,,138.0,B0F9Y9SJNZ,"50 Counts Hawaiian Leis Bulk Decorations, Leis for Luau Party Hawaiian Colorful Tropical Flower Lays for Adults Hawaii Summer Beach Luau Party Favors Birthday Party Supplies",N/A,$19.99,,4.8,41.0,False,https://m.media-amazon.com/images/I/81QW9MLaIaL._AC_UL320_.jpg,https://m.media-amazon.com/images/I/81QW9MLaIaL._AC_SL1500_.jpg,,2026-04-14T17:29:56.632873,
49,3,Organic,,139.0,B09XQV8C9P,48 Pieces Spring Sun Flowers Butterfly Hanging Swirl Decorations Spirals Sunflower Party Streamers Wall Ceiling Hanging Supplies Favors Spring Summer Birthday Party Decorations,N/A,$11.99,,4.3,137.0,False,https://m.media-amazon.com/images/I/71L6G1vaVFL._AC_UL320_.jpg,https://m.media-amazon.com/images/I/71L6G1vaVFL._AC_SL1500_.jpg,,2026-04-14T17:29:56.637086,
50,3,Organic,,140.0,B0F31WZZB9,4pcs Beach Ball Banners Summer Beach Birthday Party Decorations Pool Theme Banner Decorations for Pool Party Summer Theme Baby Shower Supplies,N/A,$8.99,,5.0,3.0,False,https://m.media-amazon.com/images/I/71vcPxCB8+L._AC_UL320_.jpg,https://m.media-amazon.com/images/I/71vcPxCB8+L._AC_SL1500_.jpg,,2026-04-14T17:29:56.641506,
51,3,Organic,,141.0,B0DQ4VYK9R,"REDWORD 60PCs Ice Cream Bowls, 9oz Ice Cream Containers Disposable Paper Bowls Sundae Cups Dessert Soup Containers for Ice-cream Party Decorations Summer Party Decorations",N/A,$15.99,,4.8,76.0,False,https://m.media-amazon.com/images/I/811lHRyc73L._AC_UL320_.jpg,https://m.media-amazon.com/images/I/811lHRyc73L._AC_SL1500_.jpg,,2026-04-14T17:29:56.646707,
52,3,Organic,,142.0,B0C85LSKPV,"Summer Pool Birthday Party Decorations, Summer Themed Birthday Plates, Napkin, Cups Banner, Balloons and Cake Topper for Swimming Pool Party Decorations Supplies Set Serves 20",N/A,$17.99,,4.2,53.0,False,https://m.media-amazon.com/images/I/8169SKkQ7IL._AC_UL320_.jpg,https://m.media-amazon.com/images/I/8169SKkQ7IL._AC_SL1500_.jpg,,2026-04-14T17:29:56.653643,
53,3,Organic,,143.0,B0CT7FZZNX,"GEEORY Hello Summer Pillow Covers 18x18 Inch Set of 4, Popsicles Flamingo Swim Ring Pool Party Sweet Summer Time Farmhouse Decorative Throw Pillowcases for Home Sofa Couch Decoration G525-18",N/A,$12.99,,4.7,105.0,False,https://m.media-amazon.com/images/I/61rkaFECkTL._AC_UL320_.jpg,https://m.media-amazon.com/images/I/61rkaFECkTL._AC_SL1500_.jpg,,2026-04-14T17:29:56.663045,
54,3,Organic,,144.0,B0FCS5JGC1,"Hello Summer Banner - Popsicle Garland & Ice Cream Party Decor, Colorful Beach Pool Party Decorations, Tropical Summer Backdrop, Holiday Luau Supplies",N/A,$8.99,,3.8,3.0,False,https://m.media-amazon.com/images/I/61hJAo0gwYL._AC_UL320_.jpg,https://m.media-amazon.com/images/I/61hJAo0gwYL._AC_SL1500_.jpg,,2026-04-14T17:29:56.666071,
56,3,Title,,,,"Debug info copied.SponsoredLarge Paper Flowers, 20 Inch Tissue Paper Flowers Decorations for Wall, Y",,,,,,False,,,,2026-04-14T17:29:56.667191,
57,3,Title,,,,Related searchesend of summer party decorationssummer partypool party decorationssummer party decora,,,,,,False,,,,2026-04-14T17:29:56.668199,
58,3,Title,,,,Previous1234...7Next,,,,,,False,,,,2026-04-14T17:29:56.669198,
59,3,SB,4.0,,,N/A,https://aax-events-cell01-cf.us-east.ono.axp.amazon-adsystem.com/x/c/JKxXUzVXqgSSApZx3ORLOKQAAAGdi1Ns5gEAAAH2AQBvbm9fdHhuX2JpZDUgICBvbm9fdHhuX2ltcDIgICDGOYTB/clv1c_ek-wxfHXFbbWDfHXL5sAvQuvcbyIGJIqKXNLxmeTHimtxY7lHdu_O2ql-m1-end4S5rlwYW9zVM3Bl8hchkJG7O8N_58EoWWwQlFhq79VM026B3hwLJZay1-4_GcdtJaE3lQRLQPKE3V6x8BAGP1z5j7otGdphXLImRwSDKO5pYvGOpT4vPRcMcci8O1BxoSPnQS7FZNZ18YtTdctU0T0HqPBGdbYMse2pqfiVARZ1Pk-DNmTvwFWLE0MGB_SVP1oro21ck5FqOiB6rmtjZJ5boBUepe3CgXCOleiOJQdC7q39VYVq2phB49kHwkzFz45bv3PCKJxSXWOV5Ut7gQFNSsl921WeJKbgHJVkcJr27cPDfiTILJr26F0P9v2AQsDSuvohbvdQYqp-baA9Oyisf9BEdFpGOsuTnAjIOOzqjHtEXi-CuS-Z1CKRQ7GamBakqMYgbklxQ74DNLtsnEbZnzIvWN9ECZLzIiuj0QBiiGszQ-0cURckiqkQXeKP0hAdv6cgW96qw_xR_A26C-uT9TikR9LSna4B1WHOY_nK9Me1ARNdHLzx0Vre9tFYjCp3ZRzyrcSHyukQl3L4eqi_cYIrI4WSR4twEGiYQg6Sec4BLkKm46b5Lp_9xJVK3X0njVSFLrHF-p_lBeVpM2-RmovNzcFLKHkZOfiLAPFmg98rgBKhjAf9TgW0FPppfqcQc6NrOTcK9DqGtBmHsbHVIE4S0IZBO4yoEofkZZxwB1x597vt8rj1DIo4ayar_0rioDA5I3TWc5HQKtGUXskMbWBd3WMbt2Z5tvzICCoDjnDe9tHVGLWSyAC774kisXedOTtvMIPGfyYtnmUGopgzrz3KMI47yJv43UQGZNac779KeWRkCiAL8u2z-o40FmjF5LffvdfX9zki7y62Htx2L86Fl_o5EWPlS7BnWBtrIR_vXJx4COU2jGUtP6SFZIU8mPmC_JAQCtmgF037GQnMeH6pyFNVJu0obCsGdv1ig_eL9kwLMPZIKkmFoZ3PuFSBToYDLSllYt4Gl4OrjUsHwu00kdUEL8Ni9NZurR-29S567ezfDFWvlDFGrbdf_IOziIUMzZHKczwTY4WHd_CFmrsVIMmr49tIL1sgNUu3bR2n1j72ihsDWCtexFwh-dGugJ7y0bla-vlKWSbMvTX8mFxYzS-rWLCuhh6yRgIyeQzUBcKWMyNCA5GeZzSCM40WVSaDm9ruFMXzTsgMnW1rCiweVKD0E6nM20p5DIIYsFhoZqDVxBwafKU1gRMzkHp4E9927dYOP-vCVMmztlXfU-dGLEdT5xW41o7IeIkW2bgJrixlc-ue14yqMX5lbNLXKw-bljXZL_SfzImlx0RNiSELg4uU39wE3eGqSh_C04wcPRNVtRP70IkTSKQfa4cApGRYOZ08H_9B-mpcoRjZpzBAbDCVI6S0KnOU9lJiYsoyI1qnVJ1-wHfH4U-oc39ic_dn3HJWBELMjDrM_rtdjHgRD_GadIig9IP43zdVHkTgw9OD_3yNp6XfFRtiUpa0QGQaxWTBBv4DRelZoZ-eVHrzhyiYX6-ViNoPKpTb6DZNjt_IFVMMyyKOg8ywd3O2YE9VZuILCb6rgO0NYjcbLg5w1m6DFN6tVQXE1aD20hP_a-l5vaPyWECqHHTCq7BDe-jupLYKIpcKqeDWVCWJ-NNakS7alMb2702yN0f8IffA/https://www.amazon.com/stores/page/535A1B34-AFEE-4A8C-8050-2B62EB5D8DAF/?_encoding=UTF8&store_ref=SB_A06356331R1HTCT15VW4M-A0154144LNICXJM1LZVK&pd_rd_plhdr=t&aaxitk=e041cfdf374a0326eefbe8d64f03d260&hsa_cr_id=0&lp_asins=B0F842CMDP%2CB0CB8FJS4D%2CB0FGHFM2CM&lp_query=summer%20party%20decorations&lp_slot=desktop-hsa-3psl&ref_=sbx_be_s_3psl_mbd_mb0_bkgd&pd_rd_w=hL7e9&content-id=amzn1.sym.cd7c548b-a599-426f-9ffe-daa1aa803c87%3Aamzn1.sym.cd7c548b-a599-426f-9ffe-daa1aa803c87&pf_rd_p=cd7c548b-a599-426f-9ffe-daa1aa803c87&pf_rd_r=Z2W3JK1N9J0ZW2KJ4BC5&pd_rd_wg=ILgFQ&pd_rd_r=ec66cf87-4a9d-42f5-a796-f6405ab698fb,,,,,False,,,N/A,2026-04-14T17:29:56.673972,
60,3,Title,,,,Need help?Visit the help sectionorcontact us,,,,,,False,,,,2026-04-14T17:29:56.673972,
0,4,SB_Video,3.0,,,N/A,N/A,,,,,False,,,,2026-04-14T17:30:10.772089,1.0
1,4,Title,,,,ResultsCheck each product page for other buying options. Price and other details may vary based on p,,,,,,False,,,,2026-04-14T17:30:10.772864,
3,4,Organic,,145.0,B0CT7FZZNX,"GEEORY Hello Summer Pillow Covers 18x18 Inch Set of 4, Popsicles Flamingo Swim Ring Pool Party Sweet Summer Time Farmhouse Decorative Throw Pillowcases for Home Sofa Couch Decoration G525-18",N/A,$12.99,,4.7,105.0,False,https://m.media-amazon.com/images/I/61rkaFECkTL._AC_UL320_.jpg,https://m.media-amazon.com/images/I/61rkaFECkTL._AC_SL1500_.jpg,,2026-04-14T17:30:10.783020,
4,4,Organic,,146.0,B0G9LTXLML,"MEHOFOND 3 Pack Splish Splash Birthday Tablecloth, Disposable Plastic Tropical Table Cloth 54x108 inch, Summer Pool Birthday Table Cover for Girl Splash Water Paddling Pool Party Supplies",N/A,$9.49,,5.0,1.0,False,https://m.media-amazon.com/images/I/71rXl4frX1L._AC_UL320_.jpg,https://m.media-amazon.com/images/I/71rXl4frX1L._AC_SL1500_.jpg,,2026-04-14T17:30:10.793011,
5,4,Organic,,147.0,B0GCM3FPNM,"50 LED 25ft Summer Hawaiian Beach String Lights Outdoor with Remote, Flamingo Pineapple Palm Tree Fairy Twinkle Lights Battery Operated with 8 Modes & Timer for Tropical Party Beach Pool Decorations",N/A,$16.19,,4.4,334.0,False,https://m.media-amazon.com/images/I/71IaC6j30YL._AC_UL320_.jpg,https://m.media-amazon.com/images/I/71IaC6j30YL._AC_SL1500_.jpg,,2026-04-14T17:30:10.800145,
6,4,Title,,,,Bulk sunglasses for kidsSponsored|5K+ bought from this brand in past month|Shop RugortShop nowPrevio,,,,,,False,,,,2026-04-14T17:30:10.803939,
7,4,Title,,,,More results,,,,,,False,,,,2026-04-14T17:30:10.803939,
8,4,Organic,,148.0,B0CZ969M49,Glitter School’s out for Summer Banner and Colorful Glittery Summer Patterns Banner End of School Year Garland Banner Summer Vacation Beach Pool Party Fireplace Mantle Decorations,N/A,$9.99,,4.8,8.0,False,https://m.media-amazon.com/images/I/619I0Sn77zL._AC_UL320_.jpg,https://m.media-amazon.com/images/I/619I0Sn77zL._AC_SL1500_.jpg,,2026-04-14T17:30:10.807448,
9,4,Organic,,149.0,B09WYB7F1H,"100PCS Flamingo Fruit Paper Straws,Disposable Plastic Drinking Straws,Tropical Hawaiian Beach Summer Pool Party Cocktail Decorations - Assorted Colors",N/A,$11.99,,4.6,526.0,False,https://m.media-amazon.com/images/I/712Vps8x8oL._AC_UL320_.jpg,https://m.media-amazon.com/images/I/712Vps8x8oL._AC_SL1500_.jpg,,2026-04-14T17:30:10.812999,
10,4,Organic,,150.0,B0BYP3H6FF,Hello Summer Banner and Colorful Flip Flop Banner Summer Hawaiian Tropical Beach Pool Slippers Garland Banner Summer Holiday Birthday Party Classroom Bulletin Board Fireplace Mantle Decorations,N/A,$9.99,,4.8,39.0,False,https://m.media-amazon.com/images/I/61e-wv+U+GL._AC_UL320_.jpg,https://m.media-amazon.com/images/I/61e-wv+U+GL._AC_SL1500_.jpg,,2026-04-14T17:30:10.816000,
11,4,Organic,,151.0,B0G82VM9N7,"xo, Fetti Hot Dog Banner | Cookout Party, BBQ Decor, Summer Party, July 4th, Kids Party, Funny",N/A,$10.99,,,,False,https://m.media-amazon.com/images/I/71d6ZJ7bQNL._AC_UL320_.jpg,https://m.media-amazon.com/images/I/71d6ZJ7bQNL._AC_SL1500_.jpg,,2026-04-14T17:30:10.823326,
12,4,Organic,,152.0,B0DQ4VYK9R,"REDWORD 60PCs Ice Cream Bowls, 9oz Ice Cream Containers Disposable Paper Bowls Sundae Cups Dessert Soup Containers for Ice-cream Party Decorations Summer Party Decorations",N/A,$15.99,,4.8,76.0,False,https://m.media-amazon.com/images/I/811lHRyc73L._AC_UL320_.jpg,https://m.media-amazon.com/images/I/811lHRyc73L._AC_SL1500_.jpg,,2026-04-14T17:30:10.828327,
13,4,Organic,,153.0,B01JGQF40Y,"250pcs Multicolor Pennant Flags,LOOBJOYGAME 263Ft Nylon Fabric Decorations Grand Opening Banner Rope",N/A,$12.99,,4.6,2041.0,False,https://m.media-amazon.com/images/I/61drJej456L._AC_UL320_.jpg,https://m.media-amazon.com/images/I/61drJej456L._AC_SL1500_.jpg,,2026-04-14T17:30:10.832884,
14,4,Title,,,,Blow Up Your Business. Literally.ShopLookOurWayPrevious pageLookOurWay Air Dancers Wacky Waving Infl,,,,,,False,,,,2026-04-14T17:30:10.834450,
