data_index,page,ad_type,ad_rank,organic_rank,asin,title,url,price_current,price_list,rating_stars,rating_count,is_prime,image_small,image_large,brand_name,scraped_at,inner_products_count
15,4,Title,,,,More results,,,,,,False,,,,2026-04-14T17:30:10.834450,
16,4,Organic,,154.0,B0F13CVFYD,"Hallswl 3Pcs Ocean Waves Tablecloth, Ocean Water Print Tablecloths Summer Disposable Plastic Table Covers for Beach Surf Pool Sea Themed Party Birthday Decorations,54X108inch",N/A,$8.99,,4.7,67.0,False,https://m.media-amazon.com/images/I/81xmLEb5RaL._AC_UL320_.jpg,https://m.media-amazon.com/images/I/81xmLEb5RaL._AC_SL1500_.jpg,,2026-04-14T17:30:10.838454,
17,4,Organic,,155.0,B0BPL5PYV8,"Zcaukya Inflatable Palm Tree Cooler, 60"" Blow Up Palm Tree Cooler for Tropical Party Decorations, Hawaiian Party Supplies Pool Decorations",N/A,$32.29,,4.2,1456.0,False,https://m.media-amazon.com/images/I/81adb71iO8L._AC_UL320_.jpg,https://m.media-amazon.com/images/I/81adb71iO8L._AC_SL1500_.jpg,,2026-04-14T17:30:10.848537,
18,4,Organic,,156.0,B0GKZZXKS4,"Hawaiian Luau Party Decorations, 3Pcs Hawaiian Backdrop Foil Fringe Curtain Aloha Photo Booth Prop Balloon, 3.3x6.6ft Green Brown Yellow Tinsel Streamer for Pineapple Tropical Summer Beach Party Decor",N/A,$8.99,,4.5,8.0,False,https://m.media-amazon.com/images/I/91K16nfvfTL._AC_UL320_.jpg,https://m.media-amazon.com/images/I/91K16nfvfTL._AC_SL1500_.jpg,,2026-04-14T17:30:10.853235,
19,4,Organic,,157.0,B0D6KL854J,Gyufise 6Pcs Fruit Honeycomb Centerpieces Hawaiian Summer Fruit Table Toppers Tropical Fruit Party Decorations Pineapple Strawberry Grape for Hawaiian Luau Fruit Themed Party,N/A,$8.99,,4.7,44.0,False,https://m.media-amazon.com/images/I/81aZE7W-ZyL._AC_UL320_.jpg,https://m.media-amazon.com/images/I/81aZE7W-ZyL._AC_SL1500_.jpg,,2026-04-14T17:30:10.856235,
20,4,Organic,,158.0,B0D9JF7Y4H,PIGETALE 2 Pack 3.2x6.5 Feet Wavy Blue Backdrop Curtain Tinsel Streamers Foil Fringe Backdrop Ocean Themed Decor Baby Shower Bachelorette Disco Winter Under The Sea Summer Pool Beach Party Decorations,N/A,$5.40,,4.3,214.0,False,https://m.media-amazon.com/images/I/9177pfW8Z6L._AC_UL320_.jpg,https://m.media-amazon.com/images/I/9177pfW8Z6L._AC_SL1500_.jpg,,2026-04-14T17:30:10.860238,
21,4,Organic,,159.0,B0C85LSKPV,"Summer Pool Birthday Party Decorations, Summer Themed Birthday Plates, Napkin, Cups Banner, Balloons and Cake Topper for Swimming Pool Party Decorations Supplies Set Serves 20",N/A,$17.99,,4.2,53.0,False,https://m.media-amazon.com/images/I/8169SKkQ7IL._AC_UL320_.jpg,https://m.media-amazon.com/images/I/8169SKkQ7IL._AC_SL1500_.jpg,,2026-04-14T17:30:10.865979,
22,4,Organic,,160.0,B0D129R82J,"VILIFEVER Ice Cream Bar Banner Ice Cream Garland, Ice Cream Theme Birthday Party Baby Shower Wedding Decorations Photo Props Summer Holidays Party Favors",N/A,$9.99,,4.8,67.0,False,https://m.media-amazon.com/images/I/71-ayrrmaxL._AC_UL320_.jpg,https://m.media-amazon.com/images/I/71-ayrrmaxL._AC_SL1500_.jpg,,2026-04-14T17:30:10.869984,
23,4,Organic,,161.0,B0F3CRG7L5,"3 Pack Summer Flamingo Tablecloth Party Decorations, Hawaiian Tropical Plastic Table Cloth, Disposable Luau Table Cover for Summer Flamingo Picnic Birthday Party Supplies Decorations, 54” x 108”",N/A,$8.99,,4.4,46.0,False,https://m.media-amazon.com/images/I/816T9zMlEeL._AC_UL320_.jpg,https://m.media-amazon.com/images/I/816T9zMlEeL._AC_SL1500_.jpg,,2026-04-14T17:30:10.874024,
24,4,Organic,,162.0,B0DXFNDN63,"xo, Fetti Pool Party Napkins - 3-ply, 24 pcs | Summer Cocktail Napkins, Colorful Party Setting, Kids Birthday Decoration, Fun Tablescape",N/A,$12.99,,5.0,6.0,False,https://m.media-amazon.com/images/I/61UHEDYOG8L._AC_UL320_.jpg,https://m.media-amazon.com/images/I/61UHEDYOG8L._AC_SL1500_.jpg,,2026-04-14T17:30:10.878021,
25,4,Organic,,163.0,B09JWZ2819,"Triumpeek Inflatable Cactus Cooler, 55"" Fiesta Cactus Ice Bucket Wearing Sombreros for Summer Swimming Pool Hawaiian Themed Party Supplies",N/A,$19.99,,4.6,825.0,False,https://m.media-amazon.com/images/I/71dXIIKJn5L._AC_UL320_.jpg,https://m.media-amazon.com/images/I/71dXIIKJn5L._AC_SL1500_.jpg,,2026-04-14T17:30:10.882654,
26,4,Organic,,164.0,B0BTDHRYT8,"36 Count Hawaiian Lei Bulk, Tropical Luau Hawaii Theme Silk Flower Lei, Party Favors for Beach Holiday Wedding Birthday Party, Aloha Summer Party Decorations",N/A,$9.98,,4.4,1265.0,False,https://m.media-amazon.com/images/I/91dq-UYMKiL._AC_UL320_.jpg,https://m.media-amazon.com/images/I/91dq-UYMKiL._AC_SL1500_.jpg,,2026-04-14T17:30:10.886657,
27,4,Organic,,165.0,B0FCS5JGC1,"Hello Summer Banner - Popsicle Garland & Ice Cream Party Decor, Colorful Beach Pool Party Decorations, Tropical Summer Backdrop, Holiday Luau Supplies",N/A,$8.99,,3.8,3.0,False,https://m.media-amazon.com/images/I/61hJAo0gwYL._AC_UL320_.jpg,https://m.media-amazon.com/images/I/61hJAo0gwYL._AC_SL1500_.jpg,,2026-04-14T17:30:10.890658,
28,4,Organic,,166.0,B0GK9BPL4J,"2Pack Summer Garland for Hawaiian Tropical Luau Party Decorations, Flamingo & Palm Leaves Garland Flamingo Party Decorations for Summer Birthday Baby Shower Wedding Decor, No DIY.",N/A,$7.99,,4.0,2.0,False,https://m.media-amazon.com/images/I/71QBjLjREEL._AC_UL320_.jpg,https://m.media-amazon.com/images/I/71QBjLjREEL._AC_SL1500_.jpg,,2026-04-14T17:30:10.895168,
29,4,Organic,,167.0,B09XQV8C9P,48 Pieces Spring Sun Flowers Butterfly Hanging Swirl Decorations Spirals Sunflower Party Streamers Wall Ceiling Hanging Supplies Favors Spring Summer Birthday Party Decorations,N/A,$11.99,,4.3,137.0,False,https://m.media-amazon.com/images/I/71L6G1vaVFL._AC_UL320_.jpg,https://m.media-amazon.com/images/I/71L6G1vaVFL._AC_SL1500_.jpg,,2026-04-14T17:30:10.900338,
30,4,Organic,,168.0,B0FZLZN5CP,"xo, Fetti Pool Party Birthday Banner | Kids Party Decorations, Tropical Summer, Hawaiian Luau, Flamingo, Pink Glitter, Happy Birthday Garland",N/A,$10.99,,5.0,2.0,False,https://m.media-amazon.com/images/I/61YeRAYAw9L._AC_UL320_.jpg,https://m.media-amazon.com/images/I/61YeRAYAw9L._AC_SL1500_.jpg,,2026-04-14T17:30:10.904372,
31,4,Organic,,169.0,B0DZVJQC2Z,"Summer Vibes Neon Sign for wall decor, Summer Party LED Sign, USB Powered Beach Bar Neon Light with Dimmable Switch for Beach Bar Bedroom Party Decoration",N/A,$18.89,,4.6,6.0,False,https://m.media-amazon.com/images/I/81rNOtQBzsL._AC_UL320_.jpg,https://m.media-amazon.com/images/I/81rNOtQBzsL._AC_SL1500_.jpg,,2026-04-14T17:30:10.907872,
32,4,Organic,,170.0,B0CMQK4RMF,Sun Party Decorations Boho Sun Polka Dot Garland Streamer Ombre Orange White Retro Muted Sun Banner for First Trip Around the Sun Hippie Boho Summer Birthday Baby Shower Wedding Bridal Shower Supplies,N/A,$12.99,,4.8,576.0,False,https://m.media-amazon.com/images/I/71+4LDjX+5L._AC_UL320_.jpg,https://m.media-amazon.com/images/I/71+4LDjX+5L._AC_SL1500_.jpg,,2026-04-14T17:30:10.915062,
33,4,Organic,,171.0,B0CX1N2821,"Vellibring 16 Pack 12"" Summer Inflatable Beach Balls Bulk Rainbow Swimming Pool Water Games Toys for Kids Summer Party Supplies Decorations",N/A,$9.99,,4.4,501.0,False,https://m.media-amazon.com/images/I/71mzmT+5bTL._AC_UL320_.jpg,https://m.media-amazon.com/images/I/71mzmT+5bTL._AC_SL1500_.jpg,,2026-04-14T17:30:10.920063,
34,4,Organic,,172.0,B0G7TF8YKY,18 Pcs Summer Party Decorations Set Coastal Beach Seashell Paper Lanterns Blue Bow Starfish Hanging Swirls Ocean Nautical Pool Party Hanging Decor for Birthday Wedding Baby Shower Decor,N/A,$16.99,,5.0,1.0,False,https://m.media-amazon.com/images/I/81pgeUTRWvL._AC_UL320_.jpg,https://m.media-amazon.com/images/I/81pgeUTRWvL._AC_SL1500_.jpg,,2026-04-14T17:30:10.928243,
35,4,Organic,,173.0,B0FMWD7QSL,"Inflatable Pink Flamingo Party Decorations - (3 Pack) 28"" Large Blow-Up Flamingos, Realistic Animal Design, Summer Hawaiian Luau, BBQ, Birthday Party Decor, Pool Float Toys Indoor & Outdoor",N/A,$9.99,,4.4,24.0,False,https://m.media-amazon.com/images/I/71nQEPbwQ2L._AC_UL320_.jpg,https://m.media-amazon.com/images/I/71nQEPbwQ2L._AC_SL1500_.jpg,,2026-04-14T17:30:10.936829,
36,4,Organic,,174.0,B0F1TZZJ49,HOMETITUTE Hello Summer Banner 71 x 43 inch Summer Hawaiian Party Decorations Flower Butterfly Summer Outdoor Decorations Supplies Backdrop Tropical Beach Hawaiian Party Themed Photo Booth Props,N/A,$12.99,,5.0,15.0,False,https://m.media-amazon.com/images/I/81r46yF5hUL._AC_UL320_.jpg,https://m.media-amazon.com/images/I/81r46yF5hUL._AC_SL1500_.jpg,,2026-04-14T17:30:10.940831,
37,4,Organic,,175.0,B0CT8NCXR6,GPGHE Hello Summer Table Runner Popsicle Fruits Leaves Love Heart Table Runners Seasonal Kitchen Dining Table Decoration for Home Party Banquet Decor 13x72 Inch,N/A,$7.99,,4.7,51.0,False,https://m.media-amazon.com/images/I/81aoxUi+nwL._AC_UL320_.jpg,https://m.media-amazon.com/images/I/81aoxUi+nwL._AC_SL1500_.jpg,,2026-04-14T17:30:10.945485,
38,4,Organic,,176.0,B0D12MLZ6X,"Summer Beach Tablecloths, Beach Themed Party Decorations 3pcs Hawaiian Tablecloth Waterproof Table Cover for Pool Beach Party Supplies",N/A,$8.17,,4.6,43.0,False,https://m.media-amazon.com/images/I/81kGQbQ98-L._AC_UL320_.jpg,https://m.media-amazon.com/images/I/81kGQbQ98-L._AC_SL1500_.jpg,,2026-04-14T17:30:10.952060,
39,4,Organic,,177.0,B0CTNT4ZL9,"xo, Fetti Italian Summer Paper Plates - 32 pk, 16 9"" plates + 16 7"" plates | Bachelorette Party Decorations, Last Toast Coast, Birthday Party Supplies, Flower Baby Shower, Stripe Cake Plates",N/A,$17.99,,3.7,30.0,False,https://m.media-amazon.com/images/I/610uCWtQTkL._AC_UL320_.jpg,https://m.media-amazon.com/images/I/610uCWtQTkL._AC_SL1500_.jpg,,2026-04-14T17:30:10.956118,
40,4,Organic,,178.0,B0CYNP5QZF,Goodbye School Hello Pool Banner Bye Bye School Hello Pool Party Decorations End of School Year Party Decorations Last Day of School Decorations Pool Party Decorations,N/A,$8.99,,4.7,14.0,False,https://m.media-amazon.com/images/I/81eO5+C0hpL._AC_UL320_.jpg,https://m.media-amazon.com/images/I/81eO5+C0hpL._AC_SL1500_.jpg,,2026-04-14T17:30:10.960709,
41,4,Organic,,179.0,B0F31WZZB9,4pcs Beach Ball Banners Summer Beach Birthday Party Decorations Pool Theme Banner Decorations for Pool Party Summer Theme Baby Shower Supplies,N/A,$8.99,,5.0,3.0,False,https://m.media-amazon.com/images/I/71vcPxCB8+L._AC_UL320_.jpg,https://m.media-amazon.com/images/I/71vcPxCB8+L._AC_SL1500_.jpg,,2026-04-14T17:30:10.965734,
42,4,Organic,,180.0,B0C6X5186S,Libima Inflatable Hawaiian Limbo Party Game Tropical Theme Fun Game Hawaiian Party Accessories Inflatable Hawaii Limbo for Adult Kids Summer Outdoor Garden Beach Birthday Pool Game Party,N/A,$30.99,,3.6,51.0,False,https://m.media-amazon.com/images/I/718Y6eaWPzL._AC_UL320_.jpg,https://m.media-amazon.com/images/I/718Y6eaWPzL._AC_SL1500_.jpg,,2026-04-14T17:30:10.969733,
43,4,Organic,,181.0,B0GC6KWF5P,Amyhill 8 Pcs Summer Ice Cream Table Decorations Wooden Ice Cream Cone Table Centerpiece Sundae Party Decorations Toppers for Summer Theme Bridal Wedding Graduation Birthday Favor Supplies,N/A,$15.99,,4.7,34.0,False,https://m.media-amazon.com/images/I/81G7hd9-UcL._AC_UL320_.jpg,https://m.media-amazon.com/images/I/81G7hd9-UcL._AC_SL1500_.jpg,,2026-04-14T17:30:10.973835,
44,4,Organic,,182.0,B09TKHH62Z,"Umbrella Cocktail Picks for Drinks, 160 Pack Cocktail Picks for Luau Tropical Party, Pineapple Palm Leaf Fruit Sticks Summer Hawaiian Party Decorations",N/A,$14.95,,4.8,117.0,False,https://m.media-amazon.com/images/I/81o7ceEIuRL._AC_UL320_.jpg,https://m.media-amazon.com/images/I/81o7ceEIuRL._AC_SL1500_.jpg,,2026-04-14T17:30:10.977842,
45,4,Organic,,183.0,B0GMQ84KMG,"4 Pack Beach Plastic Tablecloth Party Decorations, Disposable Summer Pool Table Cloth, Waterproof Tropical Surfboard Table Cover for Summer Hawaiian Theme Birthday Party Supplies",N/A,$9.99,,5.0,1.0,False,https://m.media-amazon.com/images/I/718ZyTON4KL._AC_UL320_.jpg,https://m.media-amazon.com/images/I/718ZyTON4KL._AC_SL1500_.jpg,,2026-04-14T17:30:10.981858,
46,4,Organic,,184.0,B094JQ6PHY,160 Pcs Cocktail Drink Decoration Accessories 60 Drink Cocktail Umbrellas 100 Fruit Picks Summer Coconut Palm Colorful Bamboo Toothpicks Tropical Luau Hawaiian Beach Party Decorations,N/A,$12.82,,4.7,781.0,False,https://m.media-amazon.com/images/I/81j5VTooYIS._AC_UL320_.jpg,https://m.media-amazon.com/images/I/81j5VTooYIS._AC_SL1500_.jpg,,2026-04-14T17:30:10.985407,
47,4,Organic,,185.0,B0GBVNMHXF,"Seashell Birthday Party Decorations, Coastal Birthday Decorations Includes Banners, Backdrop, Balloons, Honeycomb, Tablecloth, Cale Topper for The Summer I Turned Pretty Party Decor",N/A,$13.98,,5.0,2.0,False,https://m.media-amazon.com/images/I/71yxXKekI4L._AC_UL320_.jpg,https://m.media-amazon.com/images/I/71yxXKekI4L._AC_SL1500_.jpg,,2026-04-14T17:30:10.989916,
48,4,Organic,,186.0,B0DXFQD2N7,"xo, Fetti Pool Party Temporary Tattoos - 68 Iridescent Foil Pcs | Summer Birthday Accessory, Kids Waterpark Party Favor, Cute Beach Activity",N/A,$7.99,,4.6,33.0,False,https://m.media-amazon.com/images/I/71mlSyRYaxL._AC_UL320_.jpg,https://m.media-amazon.com/images/I/71mlSyRYaxL._AC_SL1500_.jpg,,2026-04-14T17:30:10.994463,
49,4,Organic,,187.0,B0D1GB693Z,"ASTARON Black Sunglasses Bulk, 6/12/24/48 Pack Sunglasses Party Favors for Summer Beach Pool Birthday Wedding Party Supplies",N/A,$13.99,,4.7,1341.0,False,https://m.media-amazon.com/images/I/71BsdLm4EFL._AC_UL320_.jpg,https://m.media-amazon.com/images/I/71BsdLm4EFL._AC_SL1500_.jpg,,2026-04-14T17:30:11.001791,
50,4,Organic,,188.0,B0FV8WS7H5,"xo, Fetti Camp Bunting Banner - 32 Flags | Bachelorette Decorations, Birthday Party, Bridal Shower, Pink Green Gingham, Summer Camp, Bandana",N/A,$13.99,,,,False,https://m.media-amazon.com/images/I/71Hobo4NN6L._AC_UL320_.jpg,https://m.media-amazon.com/images/I/71Hobo4NN6L._AC_SL1500_.jpg,,2026-04-14T17:30:11.005305,
51,4,Organic,,189.0,B09P5XRB53,Joanlody Blue Cheesecloth Table Runner Spring Easter 10Ft Rustic Gauze Boho Cheese Cloth Table Runner for Wedding Bridal Baby Shower Decoration,N/A,$7.99,,4.7,1260.0,False,https://m.media-amazon.com/images/I/81snfxGPkWL._AC_UL320_.jpg,https://m.media-amazon.com/images/I/81snfxGPkWL._AC_SL1500_.jpg,,2026-04-14T17:30:11.014094,
52,4,Organic,,190.0,B0DY73NR36,"24 Sheets Summer Stickers, Make a Face Sticker for Kids, Hawaii Tropical Pool Beach Stickers, Make Your Own Sticker with Pineapple Flamingo Beverage, Summer Holiday Party Favors",N/A,$5.99,,4.8,278.0,False,https://m.media-amazon.com/images/I/813oMQgoJvL._AC_UL320_.jpg,https://m.media-amazon.com/images/I/813oMQgoJvL._AC_SL1500_.jpg,,2026-04-14T17:30:11.020289,
53,4,Organic,,191.0,B09SF8HM5S,"FreshDear 12 Counts Hawaiian Leis Bulk,leis for luau party,hawaiian leis for adults,beach party favors for adults,Summer Beach Vacation,Theme Party Decorations",N/A,$8.49,,4.5,254.0,False,https://m.media-amazon.com/images/I/81QXHQaBHHL._AC_UL320_.jpg,https://m.media-amazon.com/images/I/81QXHQaBHHL._AC_SL1500_.jpg,,2026-04-14T17:30:11.026321,
54,4,Organic,,192.0,B0FHGRDQ99,12pcs Pink Beach Ball Party Honeycomb Centerpieces for Girls Summer Beach Birthday Party Decorations for Table Beach Ball Theme Centerpiece for Summer Pool Theme Party Baby Shower Supplies,N/A,$9.47,,4.5,2.0,False,https://m.media-amazon.com/images/I/71DhxbU-J2L._AC_UL320_.jpg,https://m.media-amazon.com/images/I/71DhxbU-J2L._AC_SL1500_.jpg,,2026-04-14T17:30:11.030324,
56,4,Title,,,,Debug info copied.SponsoredOzepao 58 Pcs Summer Cutouts Beach Hawaiian Theme Bulletin Board Decorati,,,,,,False,,,,2026-04-14T17:30:11.031830,
57,4,Title,,,,Related searchesend of summer party decorationssummer partypool party decorationssummer party decora,,,,,,False,,,,2026-04-14T17:30:11.031830,
58,4,Title,,,,Previous1234567Next,,,,,,False,,,,2026-04-14T17:30:11.032835,
59,4,SB,5.0,,,N/A,https://aax-events-cell01-cf.us-east.ono.axp.amazon-adsystem.com/x/c/JHXjgZz6IFrk6MRVMmvwY-0AAAGdi1OilQEAAAH2AQBvbm9fdHhuX2JpZDcgICBvbm9fdHhuX2ltcDEgICDc_OFC/clv1c_ek-wBfHXFbbWzjK3YpscrxfcOWxCPjrzKreb9TK-P6PhAhhEORCuMXYU1xsfjslO1VJ-fePkfN-SREk0j8OtQZrCAD2kttRJ2yJnjFFRvUgHyQn_3nHo2Oj875mkBzL05BFd5TD6sr9KBEFwnZMCUVTXp__YVlTplpTG3U-y3Fee3WUXyiE91vCqoH_2Nx0AxBSz6lhymgHW0_Bl-4CAs93-RAq_Rw3l9TuH-WXHngucpLlH-jGYMocPTI85OWtZMuFWLI5UJWCQePlKUysuLJl5xZWX14cezkQb3Tm4coBunbgztjyqWH7PMCleCrQWR54kl1VVcbNxrQ5rEkjYBIZqVkdE4uYzR3MM5jQnXGeUq5b7P7geMxO33DbmFQ4IkIL1btTaq-VIlROgJ3SXO3w0aRemzeZ9ZcggN1osBF-mOyKhYgS2FxYA1J7-OjXBIQB4d9KzvEuVn6BVFtFLxGjSxSG0lcG0CO0LKMzMBnZY_8UZj0rQZ72oCWHtEZTEhfl5fASUPlZ8RETARuZy6TkRWNkgak7NDZwbUgmN9ncNwu2UguEfH_tzbwtGMytpM3K_FnbVKxM-g0KEnN5JX-WBlad_CgyGUpAlAWa55St_aK8oNUJUb1E6uxpQY9Wh6Nq1oSiWNKZqDCfl6YtQyl1au0DWfOy8l_ToJee0bZUfUoS_UDt7a1TjxGcvqkCqJ2B0sfGKkFClkUgHIYpQMqBfleg6VpRWkDdthJ4GmFRVcSIG4B8ljxdq_5RDQNQbIBRVUS1UmwgIIbMvSWpPso2vxfY-5GgDsCmlY6OPIfjPJ8YOPoxDbm8cWEyFpd_D3C1bXcGccXI3l6Vj2nBBngtUjbRJNPTAGtGl5FBe8JNdYjBlGiuYYKE3bzHn95wrFOjy6bEE8cpqQHUuG83tLPyoKhKnEUUvLmbRq1Op8XxPtkfQgKl4OPWh19LJyqf-Z552eanO9vg-b5WfCSO2iSWIlG26mOUmg23v34myQkB_QiVbqKxLlN2O92NlHsjyvIthMgdCV4g8aLTE_IuEXKjHgiVFM168iVfjrZ-172i0nlqIOPBJVaS3v3IUATERxz3UhmnAuEBXAHsPSwXe0Xdx3dlJuFIZD6cIWz3cIYTELIkWUY6yMdk0qxZGOiEzGhCQ5KosHJsIh0M3z4b64aTWv3NaoGyhvdgX8WS64gwfQhJVlLhQf9adGKb8k6hK3S_dGFbd7QNslWeGUNaWhxQnHanuhMr3kxNH-M5seM46mDmBiVAyD005mKrIAwtZTwnvGaCQOtW-JFI9taULzI672_oFS0qFud5H_xy9QxKBdaBXvU-BrjiswjUDYLo7vad07ZqGV_gcdGdAbuLIq4sn28SRtWoP1kqyz9zuuamFk8XRZUoEJR68Hh3A3VtTgh3CQtXs7ce5xpnMCfGcYKhzQNzecd-Xt9r3YIvVaW0uGnBEegxiz-d_e2yQkUcn5s0CXhRDwM8_44lV5bbbCr2Cv-bMSx_8WEhPpfTtDlwOotF2NhE628Oce7yr1GNfY0gw_UbK5u79k07dKeTBfOaXUhKNMSAvYgcJ8aSSf43oMhr2SmJplBz4shVGEoyMkP9DDkNA_zTSnOaTzV5UXZjftReqXOH78sZLxkBhjRhlTATunzd9TaPDCFgf8Hgp6L4Ckbb-1yyA3eyzMLQlaaU9vtHXVXS-OfgHPmr-rJHmXoU/https://www.amazon.com/stores/page/6956570F-DAF5-4795-AC42-1726A926FA0D/?_encoding=UTF8&store_ref=SB_A017845915CPB7KG2KJUE-A06766673SV040RNQ87P0&pd_rd_plhdr=t&aaxitk=593ed25cdae78151079140b4dafc652e&hsa_cr_id=0&lp_asins=B0DDH82BQW%2CB0CZ3LWF46%2CB0CKHGHL7Y&lp_query=summer%20party%20decorations&lp_slot=desktop-hsa-3psl&ref_=sbx_be_s_3psl_mbd_mb0_bkgd&pd_rd_w=SUXUD&content-id=amzn1.sym.cd7c548b-a599-426f-9ffe-daa1aa803c87%3Aamzn1.sym.cd7c548b-a599-426f-9ffe-daa1aa803c87&pf_rd_p=cd7c548b-a599-426f-9ffe-daa1aa803c87&pf_rd_r=G3DJYCXAAWV3KFZTQDK2&pd_rd_wg=FDWgo&pd_rd_r=fa13c803-67db-49cd-8b3e-3fea41907b29,,,,,False,,,N/A,2026-04-14T17:30:11.037959,
60,4,Title,,,,Need help?Visit the help sectionorcontact us,,,,,,False,,,,2026-04-14T17:30:11.038483,
0,5,SB,6.0,,,Luau Party Decorations,https://aax-us-east-retail-direct.amazon.com/x/c/JBRbHS7rRtv1rev_5zv9QYMAAAGdi1PqdAEAAAH2AQBvbm9fdHhuX2JpZDUgICBvbm9fdHhuX2ltcDEgICBoaPrB/clv1c_ek-YBIHXFcbWDn2nI4trJ16WpAySuUaPTmvXw1HqnQLPaHtQX2wJGgg9lPHKl9_OeVSrTGih2koGEgxtQX6ynj-vE1Rp7L-4O6NkBvcqENRXBwGJ-viGyjrr0NU0ZvYwBIs6RhBDCxpCO_yavbgs9fW5cp2agl3Kk8dsRjOrwra3GaobEyZSJIrsj6zs0y7agq-oVGFhOx7e0dzNV5pg8WFAT0uDDky8npDYmGEVwDgxk7hNXyD1VWqiA0pCeq1exotPM6Vr9k8b3U2gGY-ymM5hqucwUyvgAtwYuuvD1AJgvezyQPTIDMucCNDLOa2t0eMZAskljYTg1vd6qooHBp6H0l2Dib36EKJ1Wxu5bIewj4V-IkAqfaD1_bRbuOPji84XuK8yCRBzexqn0JE8q5oacx-x2WbraubfxoXZRHrIxj7vWtMB7CVEK3ShRF2aePWnYe5KbTBoDiQkQLrgznkuoM4TjElN-4G29Gk3niw5xaQEC6JrRcT89fFWRJs-i78u3kNBwIYBS7BslVxaj417WipSij3Yfq61VsE2RLUmB8yC5VRar9FT2j3fk6DOEnx1bI9ocIMyKaPkGkAiBAo-6NzWJvsvmC6vAD2NGHdqDOH7TRlgU7xWWGkBaQu0lxIzhT1_uK3MLU8etEOmbntqA0PSce3HC0fSt54jdvtlGDklE8BMCYWTvLt_-PH2dQKo1TmEbCEt05R3nTzPyz4Hq98fzsOIBjeGRghwZUQ1kpMpICAgHiM2wPHxt_dhGoMxAP83u76XilcOuSTZX087DRC9DMD-FOuXeRjsChudSsA9NudhZ1A_0ZGStdDlOEVrr08FnnPte9z5jmaj6vVAlM1R68BbgK52VvRszDZ8KTVwFRgftxdfR4C-YvXW-Jkad9TGYPwZQ3NvkDBqp2AqCpMUWOy740Aii7RTHaM5q4Pt2fr0LGG6cM_7paQ42d1xRAmiHsR4x2KCCJYzxXVzlsH-nqy45w2XIMau0SrksYx6epipqmrKmOf3oAUriXIuC1pc4ndaVV2VvgvlIs6y5_pxMwR4oPryUeesHZvSVaiBwHblnmbzZE0ImdiDNcNmv0CPo0i-PiARDn8cDLQKJMbqbCoWC16jDr_YQsmA9Nvg0J6T1G2XRgvbJaqG_mMA13CZvFzJ2Tl6Ku8286HHdCDxwqcgWaLi1dDDffmwooroaZz1JH1sSnaF6uVYWQylHVqX3TsemxeZow9dKWn8G8VtlqPMs4QmgimiPzb4FfMP48jaRI0g0pB8L4TnwCEK1ZaWDpSMi1VwRMwF3GrXUOrxZP2kGsSNKKFja_zq2L30eWBcK8dqBcJnrQmKOlQrjUiqMTq8BElfTASh8MlzGLRP_4tgnHERCPf5LOOeIz2Q_PSV7eDRVHAZAr_ETaMCzuAqrP3MtLPMluH0iOv6uiBPWmb4UbYBcjSUFwaaal-G9f6-N9SBfgid7UDSN_xihrpeEus4c8Xh60untFtcVx2ircANPlH6FM6x2uEXv6S6VIL7iWxY2jd0pgJ3wFoDSCS8Jz-RJgfZCAMBny7E5YNVNhWI2hRgc9XuUGZNB4Go3IMzHDUk9mVxmUp3nBN8n8HA_4B4AekTwxzJsP1deDxcBLU9SBtNay0gWbUbzGYVx7U9J8utXMi9DnLsX7ywPg/https://www.amazon.com/stores/page/03B2A611-0CC7-4F02-B07C-B3C3201FCDF4/?_encoding=UTF8&store_ref=SB_A08572753TPV7BIJKHJXD-A06583893JYOSEDL6ZR11&pd_rd_plhdr=t&aaxitk=5521e88bb42d979098c80feb81005f73&hsa_cr_id=5752477420401&lp_asins=B09NM3H6Q8%2CB09Y1FJ967%2CB09TVFMBFB&lp_query=summer%20party%20decorations&lp_slot=auto-sparkle-hsa-tetris&ref_=sbx_s_sparkle_sbtcd_bkgd&pd_rd_w=dYhAe&content-id=amzn1.sym.cc961e39-6f5f-411e-8135-81c6c1187ac0%3Aamzn1.sym.cc961e39-6f5f-411e-8135-81c6c1187ac0&pf_rd_p=cc961e39-6f5f-411e-8135-81c6c1187ac0&pf_rd_r=PTD36QCQX87F46MWD0XR&pd_rd_wg=0IPwr&pd_rd_r=4a1f087a-3756-4c44-857e-83d11ce49742,,,,,False,"https://m.media-amazon.com/images/S/al-na-9d5791cf-3faf/34b9de36-72e1-40c4-80b3-6b8a2d8a468c._CR0,0,400,400_AC_SX130_SY60_CB1169409_QL70_.png",,Luau Party Decorations,2026-04-14T17:30:29.006163,3.0
1,5,Title,,,,ResultsCheck each product page for other buying options. Price and other details may vary based on p,,,,,,False,,,,2026-04-14T17:30:29.007161,
3,5,Organic,,193.0,B0CTNT4ZL9,"xo, Fetti Italian Summer Paper Plates - 32 pk, 16 9"" plates + 16 7"" plates | Bachelorette Party Decorations, Last Toast Coast, Birthday Party Supplies, Flower Baby Shower, Stripe Cake Plates",N/A,$17.99,,3.7,30.0,False,https://m.media-amazon.com/images/I/610uCWtQTkL._AC_UL320_.jpg,https://m.media-amazon.com/images/I/610uCWtQTkL._AC_SL1500_.jpg,,2026-04-14T17:30:29.012722,
4,5,Organic,,194.0,B0FMWD7QSL,"Inflatable Pink Flamingo Party Decorations - (3 Pack) 28"" Large Blow-Up Flamingos, Realistic Animal Design, Summer Hawaiian Luau, BBQ, Birthday Party Decor, Pool Float Toys Indoor & Outdoor",N/A,$9.99,,4.4,24.0,False,https://m.media-amazon.com/images/I/71nQEPbwQ2L._AC_UL320_.jpg,https://m.media-amazon.com/images/I/71nQEPbwQ2L._AC_SL1500_.jpg,,2026-04-14T17:30:29.018486,
5,5,Organic,,195.0,B0GMQ84KMG,"4 Pack Beach Plastic Tablecloth Party Decorations, Disposable Summer Pool Table Cloth, Waterproof Tropical Surfboard Table Cover for Summer Hawaiian Theme Birthday Party Supplies",N/A,$9.99,,5.0,1.0,False,https://m.media-amazon.com/images/I/718ZyTON4KL._AC_UL320_.jpg,https://m.media-amazon.com/images/I/718ZyTON4KL._AC_SL1500_.jpg,,2026-04-14T17:30:29.023520,
6,5,Title,,,,Kids Sunglasses Bulk Party FavorsSponsored|5K+ bought from this brand in past month|Shop RugortShop ,,,,,,False,,,,2026-04-14T17:30:29.025525,
7,5,Title,,,,More results,,,,,,False,,,,2026-04-14T17:30:29.025525,
8,5,Organic,,196.0,B0G7TF8YKY,18 Pcs Summer Party Decorations Set Coastal Beach Seashell Paper Lanterns Blue Bow Starfish Hanging Swirls Ocean Nautical Pool Party Hanging Decor for Birthday Wedding Baby Shower Decor,N/A,$16.99,,5.0,1.0,False,https://m.media-amazon.com/images/I/81pgeUTRWvL._AC_UL320_.jpg,https://m.media-amazon.com/images/I/81pgeUTRWvL._AC_SL1500_.jpg,,2026-04-14T17:30:29.029644,
9,5,Organic,,197.0,B0DYJM264C,"OHOME Ice Cream Party Decorations - Disposable Tablecloth for Ice Cream Birthday Party Decorations - Plastic Table Cover for Summer Bar Party Banner,2 Pack",N/A,$5.37,,4.6,2355.0,False,https://m.media-amazon.com/images/I/71acrhC5TzL._AC_UL320_.jpg,https://m.media-amazon.com/images/I/71acrhC5TzL._AC_SL1500_.jpg,,2026-04-14T17:30:29.035671,
10,5,Organic,,198.0,B0DXN3ZHZN,"Traplace 9 Sheets Summer Window Clings, Double Sided Summer Window Clings for Glass Windows, Hello Beach Decals, Sun Watermelon Pattern Stickers for Home Office Accessories Decorations",N/A,$8.99,,4.5,1667.0,False,https://m.media-amazon.com/images/I/81hmu3ipNBL._AC_UL320_.jpg,https://m.media-amazon.com/images/I/81hmu3ipNBL._AC_SL1500_.jpg,,2026-04-14T17:30:29.039685,
11,5,Organic,,199.0,B0CT8NCXR6,GPGHE Hello Summer Table Runner Popsicle Fruits Leaves Love Heart Table Runners Seasonal Kitchen Dining Table Decoration for Home Party Banquet Decor 13x72 Inch,N/A,$7.99,,4.7,51.0,False,https://m.media-amazon.com/images/I/81aoxUi+nwL._AC_UL320_.jpg,https://m.media-amazon.com/images/I/81aoxUi+nwL._AC_SL1500_.jpg,,2026-04-14T17:30:29.044741,
12,5,Organic,,200.0,B0CMQK4RMF,Sun Party Decorations Boho Sun Polka Dot Garland Streamer Ombre Orange White Retro Muted Sun Banner for First Trip Around the Sun Hippie Boho Summer Birthday Baby Shower Wedding Bridal Shower Supplies,N/A,$12.99,,4.8,576.0,False,https://m.media-amazon.com/images/I/71+4LDjX+5L._AC_UL320_.jpg,https://m.media-amazon.com/images/I/71+4LDjX+5L._AC_SL1500_.jpg,,2026-04-14T17:30:29.048320,
13,5,Organic,,201.0,B0D12MLZ6X,"Summer Beach Tablecloths, Beach Themed Party Decorations 3pcs Hawaiian Tablecloth Waterproof Table Cover for Pool Beach Party Supplies",N/A,$8.17,,4.6,43.0,False,https://m.media-amazon.com/images/I/81kGQbQ98-L._AC_UL320_.jpg,https://m.media-amazon.com/images/I/81kGQbQ98-L._AC_SL1500_.jpg,,2026-04-14T17:30:29.052800,
14,5,Title,,,,Creative and unique idea to decorate homeShop ArtoidModePrevious pageArtoid Mode Sea Shell Starfish ,,,,,,False,,,,2026-04-14T17:30:29.054140,
15,5,Title,,,,More results,,,,,,False,,,,2026-04-14T17:30:29.054140,
16,5,Organic,,202.0,B0F31WZZB9,4pcs Beach Ball Banners Summer Beach Birthday Party Decorations Pool Theme Banner Decorations for Pool Party Summer Theme Baby Shower Supplies,N/A,$8.99,,5.0,3.0,False,https://m.media-amazon.com/images/I/71vcPxCB8+L._AC_UL320_.jpg,https://m.media-amazon.com/images/I/71vcPxCB8+L._AC_SL1500_.jpg,,2026-04-14T17:30:29.059444,
17,5,Organic,,203.0,B094JQ6PHY,160 Pcs Cocktail Drink Decoration Accessories 60 Drink Cocktail Umbrellas 100 Fruit Picks Summer Coconut Palm Colorful Bamboo Toothpicks Tropical Luau Hawaiian Beach Party Decorations,N/A,$12.82,,4.7,781.0,False,https://m.media-amazon.com/images/I/81j5VTooYIS._AC_UL320_.jpg,https://m.media-amazon.com/images/I/81j5VTooYIS._AC_SL1500_.jpg,,2026-04-14T17:30:29.063091,
